[I 2025-08-20 00:09:26,317] Trial 15 finished with value: 0.5013666144082076 and parameters: {'model_type': 'bayesian_ridge', 'alpha_1': 8.07789870709091e-05, 'alpha_2': 0.00011339279660961435, 'lambda_1': 4.59832462282724e-05, 'lambda_2': 0.0009798256373508474}. Best is trial 11 with value: 0.8111826087189743.
[I 2025-08-20 00:09:26,627] Trial 16 finished with value: 0.8061067112782881 and parameters: {'model_type': 'rf', 'n_estimators': 199, 'max_depth': 13, 'min_samples_split': 9}. Best is trial 11 with value: 0.8111826087189743.
[I 2025-08-20 00:09:26,838] Trial 17 finished with value: 0.8103284371151861 and parameters: {'model_type': 'rf', 'n_estimators': 121, 'max_depth': 13, 'min_samples_split': 4}. Best is trial 11 with value: 0.8111826087189743.
[I 2025-08-20 00:09:27,092] Trial 18 finished with value: 0.80741139518945 and parameters: {'model_type': 'rf', 'n_estimators': 162, 'max_depth': 14, 'min_samples_split': 8}. Best is trial 11 with value: 0.8111826087189743.
[I 2025-08-20 00:09:27,101] Trial 19 finished with value: 0.5013680158681472 and parameters: {'model_type': 'bayesian_ridge', 'alpha_1': 0.0009812356429277664, 'alpha_2': 0.0009399689785005302, 'lambda_1': 0.0009867352949787362, 'lambda_2': 0.0007257526722344912}. Best is trial 11 with value: 0.8111826087189743.
[I 2025-08-20 00:09:27,613] Trial 20 finished with value: 0.7641501534540086 and parameters: {'model_type': 'xgb', 'n_estimators': 121, 'max_depth': 8, 'learning_rate': 0.023723293051653965}. Best is trial 11 with value: 0.8111826087189743.
[I 2025-08-20 00:09:27,833] Trial 21 finished with value: 0.8106768886799242 and parameters: {'model_type': 'rf', 'n_estimators': 122, 'max_depth': 13, 'min_samples_split': 4}. Best is trial 11 with value: 0.8111826087189743.
[I 2025-08-20 00:09:28,057] Trial 22 finished with value: 0.8099289130185677 and parameters: {'model_type': 'rf', 'n_estimators': 127, 'max_depth': 15, 'min_samples_split': 4}. Best is trial 11 with value: 0.8111826087189743.
[I 2025-08-20 00:09:28,313] Trial 23 finished with value: 0.8084045604654 and parameters: {'model_type': 'rf', 'n_estimators': 160, 'max_depth': 13, 'min_samples_split': 7}. Best is trial 11 with value: 0.8111826087189743.
[I 2025-08-20 00:09:28,570] Trial 24 finished with value: 0.8119858206413456 and parameters: {'model_type': 'rf', 'n_estimators': 141, 'max_depth': 14, 'min_samples_split': 3}. Best is trial 24 with value: 0.8119858206413456.
[I 2025-08-20 00:09:28,912] Trial 25 finished with value: 0.8083840921696785 and parameters: {'model_type': 'rf', 'n_estimators': 177, 'max_depth': 14, 'min_samples_split': 2}. Best is trial 24 with value: 0.8119858206413456.
[I 2025-08-20 00:09:29,144] Trial 26 finished with value: 0.8094430620028474 and parameters: {'model_type': 'rf', 'n_estimators': 147, 'max_depth': 11, 'min_samples_split': 7}. Best is trial 24 with value: 0.8119858206413456.
[I 2025-08-20 00:09:29,393] Trial 27 finished with value: 0.8118497221199233 and parameters: {'model_type': 'rf', 'n_estimators': 136, 'max_depth': 14, 'min_samples_split': 3}. Best is trial 24 with value: 0.8119858206413456.
[I 2025-08-20 00:09:29,564] Trial 28 finished with value: 0.783479647448996 and parameters: {'model_type': 'xgb', 'n_estimators': 134, 'max_depth': 3, 'learning_rate': 0.21617702325576332}. Best is trial 24 with value: 0.8119858206413456.
[I 2025-08-20 00:09:29,575] Trial 29 finished with value: 0.5013708980017038 and parameters: {'model_type': 'bayesian_ridge', 'alpha_1': 1.4172739169373237e-05, 'alpha_2': 2.316305129685997e-05, 'lambda_1': 0.0001428491041143653, 'lambda_2': 3.797432470120882e-05}. Best is trial 24 with value: 0.8119858206413456.
[I 2025-08-20 00:09:29,782] Trial 30 finished with value: 0.8080712513570817 and parameters: {'model_type': 'rf', 'n_estimators': 113, 'max_depth': 12, 'min_samples_split': 3}. Best is trial 24 with value: 0.8119858206413456.
[I 2025-08-20 00:09:30,020] Trial 31 finished with value: 0.8107990012738953 and parameters: {'model_type': 'rf', 'n_estimators': 140, 'max_depth': 14, 'min_samples_split': 5}. Best is trial 24 with value: 0.8119858206413456.
[I 2025-08-20 00:09:30,297] Trial 32 finished with value: 0.8116953729873939 and parameters: {'model_type': 'rf', 'n_estimators': 152, 'max_depth': 15, 'min_samples_split': 3}. Best is trial 24 with value: 0.8119858206413456.
[I 2025-08-20 00:09:30,579] Trial 33 finished with value: 0.8117267270133145 and parameters: {'model_type': 'rf', 'n_estimators': 156, 'max_depth': 14, 'min_samples_split': 3}. Best is trial 24 with value: 0.8119858206413456.
[I 2025-08-20 00:09:30,879] Trial 34 finished with value: 0.8087942436439726 and parameters: {'model_type': 'rf', 'n_estimators': 169, 'max_depth': 12, 'min_samples_split': 3}. Best is trial 24 with value: 0.8119858206413456.
[I 2025-08-20 00:09:31,169] Trial 35 finished with value: 0.8117079459277918 and parameters: {'model_type': 'rf', 'n_estimators': 158, 'max_depth': 14, 'min_samples_split': 3}. Best is trial 24 with value: 0.8119858206413456.
[I 2025-08-20 00:09:31,503] Trial 36 finished with value: 0.8082552768468507 and parameters: {'model_type': 'rf', 'n_estimators': 175, 'max_depth': 14, 'min_samples_split': 2}. Best is trial 24 with value: 0.8119858206413456.
[I 2025-08-20 00:09:31,728] Trial 37 finished with value: 0.7914114658835961 and parameters: {'model_type': 'lgbm', 'n_estimators': 189, 'max_depth': 6, 'learning_rate': 0.07761527047100175}. Best is trial 24 with value: 0.8119858206413456.
[I 2025-08-20 00:09:31,739] Trial 38 finished with value: 0.5013688303125711 and parameters: {'model_type': 'bayesian_ridge', 'alpha_1': 0.0004620202983056229, 'alpha_2': 0.0004662894067832679, 'lambda_1': 0.00044251633636101614, 'lambda_2': 0.0005126237204672272}. Best is trial 24 with value: 0.8119858206413456.
[I 2025-08-20 00:09:31,974] Trial 39 finished with value: 0.8065830067630188 and parameters: {'model_type': 'rf', 'n_estimators': 132, 'max_depth': 11, 'min_samples_split': 3}. Best is trial 24 with value: 0.8119858206413456.
[I 2025-08-20 00:09:32,715] Trial 40 finished with value: 0.7698112862217537 and parameters: {'model_type': 'xgb', 'n_estimators': 158, 'max_depth': 9, 'learning_rate': 0.23450284219783016}. Best is trial 24 with value: 0.8119858206413456.
[I 2025-08-20 00:09:33,002] Trial 41 finished with value: 0.8118148392852825 and parameters: {'model_type': 'rf', 'n_estimators': 153, 'max_depth': 14, 'min_samples_split': 3}. Best is trial 24 with value: 0.8119858206413456.
[I 2025-08-20 00:09:33,281] Trial 42 finished with value: 0.8117009301802491 and parameters: {'model_type': 'rf', 'n_estimators': 155, 'max_depth': 14, 'min_samples_split': 3}. Best is trial 24 with value: 0.8119858206413456.
[I 2025-08-20 00:09:33,574] Trial 43 finished with value: 0.8093901747852688 and parameters: {'model_type': 'rf', 'n_estimators': 170, 'max_depth': 13, 'min_samples_split': 4}. Best is trial 24 with value: 0.8119858206413456.
[I 2025-08-20 00:09:33,790] Trial 44 finished with value: 0.7646909242279141 and parameters: {'model_type': 'lgbm', 'n_estimators': 165, 'max_depth': 7, 'learning_rate': 0.18679266664416402}. Best is trial 24 with value: 0.8119858206413456.
[I 2025-08-20 00:09:34,129] Trial 45 finished with value: 0.810656808514113 and parameters: {'model_type': 'rf', 'n_estimators': 181, 'max_depth': 12, 'min_samples_split': 2}. Best is trial 24 with value: 0.8119858206413456.
[I 2025-08-20 00:09:34,337] Trial 46 finished with value: 0.8108108211863595 and parameters: {'model_type': 'rf', 'n_estimators': 113, 'max_depth': 14, 'min_samples_split': 3}. Best is trial 24 with value: 0.8119858206413456.
[I 2025-08-20 00:09:34,601] Trial 47 finished with value: 0.810336366025509 and parameters: {'model_type': 'rf', 'n_estimators': 153, 'max_depth': 13, 'min_samples_split': 4}. Best is trial 24 with value: 0.8119858206413456.
[I 2025-08-20 00:09:34,790] Trial 48 finished with value: 0.709682635957836 and parameters: {'model_type': 'lgbm', 'n_estimators': 130, 'max_depth': 5, 'learning_rate': 0.011813996884812494}. Best is trial 24 with value: 0.8119858206413456.
[I 2025-08-20 00:09:35,032] Trial 49 finished with value: 0.8101416597006433 and parameters: {'model_type': 'rf', 'n_estimators': 141, 'max_depth': 15, 'min_samples_split': 5}. Best is trial 24 with value: 0.8119858206413456.
Regression Results:
  Train R²: 0.952
  Test R²: 0.812
  CV R²: 0.411 ± 0.256
Saved comparison to results/rxn_feature_comparison_hte_each_8_optuna.json

==================================================
ANALYSIS COMPLETE
==================================================
Check the following directories for outputs:
  - plots/: Visualization files
  - results/: Data files and reports
  - models/: Trained model files
