=== ML Measurable HTE Rate Bias Analysis ===

==================================================
Running HTE Prediction Analysis: each with 8 features
==================================================

=== Loading Data ===
Number of HTE rates: 1031
Found 5 hydrogen-dependent features: ['num_Hs', 'BV_Hs_avg', 'Charges_Hs_avg', 'fukui_E_Hs_avg', 'fukui_N_Hs_avg']
Found 2 pKa-dependent features: ['pka_aHs', 'pka_lowest']
Found 26 heteroatom-dependent features: ['BV_main_1', 'Charges_main_atom', 'fukui_E_main_atom', 'fukui_N_main_atom', 'L_main_atom_1', 'L_main_atom_2', 'B1_main_atom_1', 'B1_main_atom_2', 'B5_main_atom_1', 'B5_main_atom_2', 'Charges_secondary_1', 'Charges_secondary_2', 'fukui_N_secondary_1', 'fukui_N_secondary_2', 'Charges_secondary_avg', 'fukui_N_secondary_avg', 'FCS_1', 'FREQS_1', 'FCS_2', 'FREQS_2', 'FCS_avg', 'FREQS_avg', 'BV_Hs_avg', 'Charges_Hs_avg', 'fukui_E_Hs_avg', 'fukui_N_Hs_avg']

Processing num_Hs conditional features...
  18/46 molecules meet condition num_Hs
    num_Hs: 0 -> 0 NA values
    BV_Hs_avg: 28 -> 0 NA values
    Charges_Hs_avg: 28 -> 0 NA values
    fukui_E_Hs_avg: 28 -> 0 NA values
    fukui_N_Hs_avg: 28 -> 0 NA values

Processing pKa_features conditional features...
  18/46 molecules meet condition pKa_features
    Processing pKa feature pka_aHs with special handling...
      Created indicator: has_acidic_H_for_pka_aHs
      Created interaction: pka_aHs_x_has_acidic_H
      Used 50.0 for molecules without acidic H
    pka_aHs: 28 -> 0 NA values
    Processing pKa feature pka_lowest with special handling...
      Created indicator: has_acidic_H_for_pka_lowest
      Created interaction: pka_lowest_x_has_acidic_H
      Used 50.0 for molecules without acidic H
    pka_lowest: 38 -> 0 NA values

Handling remaining NA values...

Encoding categorical features...
  Removed identifier feature: name
  Found categorical feature class with 4 unique values: ['aromatic' 'hetero' 'aliphatic' 'mixture']
    One-hot encoded class -> 4 features: ['class_aliphatic', 'class_aromatic', 'class_hetero', 'class_mixture']
  Removed identifier feature: smiles
  Processed 1 categorical features
  Removed 2 identifier features: ['name', 'smiles']

Creating feature quality indicators...
  Added indicator: has_num_Hs
  Added indicator: has_pKa_features
Preprocessing complete. Shape: (46, 65)
Remaining NA values: 0
Found 1 pKa-dependent features: ['pka_basic']
Warning: num_Hs column not found, cannot properly handle pKa features
Found 15 heteroatom-dependent features: ['BV_main_1', 'Charges_main_atom', 'fukui_E_main_atom', 'fukui_N_main_atom', 'L_main_atom_1', 'B1_main_atom_1', 'B5_main_atom_1', 'Charges_secondary_1', 'fukui_N_secondary_1', 'Charges_secondary_avg', 'fukui_N_secondary_avg', 'FCS_1', 'FREQS_1', 'FCS_avg', 'FREQS_avg']

Handling remaining NA values...
  pka_basic: Filled 1 NA values with median/zero
  smiles: Filled 1 NA values with mode/unknown
  class: Filled 1 NA values with mode/unknown

Encoding categorical features...
  Removed identifier feature: name
  Removed identifier feature: smiles
  Found categorical feature class with 5 unique values: ['1_aliphatic' '1_aromatic' '2_aliphatic' '1_mixture' '2_mixture']
    One-hot encoded class -> 5 features: ['class_1_aliphatic', 'class_1_aromatic', 'class_1_mixture', 'class_2_aliphatic', 'class_2_mixture']
  Processed 1 categorical features
  Removed 2 identifier features: ['name', 'smiles']

Creating feature quality indicators...
Preprocessing complete. Shape: (55, 40)
Remaining NA values: 0
Loaded reaction energy features: 1488 rows, 8 features

=== Selecting Features (selected) ===
Final selected features (8): ['acyl_class_aromatic', 'acyl_Charges_secondary_1', 'acyl_pka_aHs_x_has_acidic_H', 'amine_BV_secondary_avg', 'acyl_BV_secondary_2', 'amine_Charges_secondary_1', 'amine_class_1_mixture', 'amine_pka_basic']
=== Building HTE Prediction Models with 8 features ===
Selected features: ['acyl_class_aromatic', 'acyl_Charges_secondary_1', 'acyl_pka_aHs_x_has_acidic_H', 'amine_BV_secondary_avg', 'acyl_BV_secondary_2', 'amine_Charges_secondary_1', 'amine_class_1_mixture', 'amine_pka_basic']
Valid features: 17
=== Building Regression Model ===
Regression dataset: (1031, 17)
Target range: -1.418 to 4.010


Training data: 619 samples
Test data: 206 samples


Train-only SFS selected 16 features for regression
Running hyperparameter optimization for regression...
[I 2025-08-20 19:16:37,449] A new study created in memory with name: no-name-952782e5-a83f-4c47-9bc7-b5206dedee73
[I 2025-08-20 19:16:37,515] Trial 0 finished with value: 0.5866920890493916 and parameters: {'model_type': 'bayesian_ridge', 'alpha_1': 0.00021389973941345625, 'alpha_2': 0.00011807223831655878, 'lambda_1': 0.0003625276478871407, 'lambda_2': 0.0005443296559683627}. Best is trial 0 with value: 0.5866920890493916.
[I 2025-08-20 19:16:40,858] Trial 1 finished with value: 0.7804424656416976 and parameters: {'model_type': 'xgb', 'n_estimators': 180, 'max_depth': 5, 'learning_rate': 0.09979014405284974}. Best is trial 1 with value: 0.7804424656416976.
[I 2025-08-20 19:16:42,000] Trial 2 finished with value: 0.775803656903992 and parameters: {'model_type': 'xgb', 'n_estimators': 71, 'max_depth': 4, 'learning_rate': 0.12678878677210853}. Best is trial 1 with value: 0.7804424656416976.
Warning: less than 75% GPU memory available for training. Free: 3571.375 Total: 81155.75
[I 2025-08-20 19:17:27,014] Trial 3 finished with value: 0.7680710515201573 and parameters: {'model_type': 'cat', 'iterations': 545, 'depth': 6, 'learning_rate': 0.17597986560750808}. Best is trial 1 with value: 0.7804424656416976.
[I 2025-08-20 19:17:29,600] Trial 4 finished with value: 0.7326229181485318 and parameters: {'model_type': 'xgb', 'n_estimators': 100, 'max_depth': 6, 'learning_rate': 0.19621758695676345}. Best is trial 1 with value: 0.7804424656416976.
[I 2025-08-20 19:17:29,605] Trial 5 finished with value: 0.58669129145198 and parameters: {'model_type': 'bayesian_ridge', 'alpha_1': 0.0009602270206281893, 'alpha_2': 0.0009888955118524557, 'lambda_1': 0.0007006931380497126, 'lambda_2': 0.0004027898962403013}. Best is trial 1 with value: 0.7804424656416976.
Warning: less than 75% GPU memory available for training. Free: 3691.375 Total: 81155.75
[I 2025-08-20 19:17:58,249] Trial 6 finished with value: 0.7763948746047198 and parameters: {'model_type': 'cat', 'iterations': 513, 'depth': 5, 'learning_rate': 0.17973549439856554}. Best is trial 1 with value: 0.7804424656416976.
[I 2025-08-20 19:17:58,254] Trial 7 finished with value: 0.5866914412142885 and parameters: {'model_type': 'bayesian_ridge', 'alpha_1': 0.0003964407415618968, 'alpha_2': 0.0007615343130173517, 'lambda_1': 0.0004206396171332451, 'lambda_2': 0.00042338788364911824}. Best is trial 1 with value: 0.7804424656416976.
Warning: less than 75% GPU memory available for training. Free: 7339.4375 Total: 81155.75
[I 2025-08-20 19:18:15,523] Trial 8 finished with value: 0.7113035202213009 and parameters: {'model_type': 'cat', 'iterations': 458, 'depth': 10, 'learning_rate': 0.16247962465047852}. Best is trial 1 with value: 0.7804424656416976.
[I 2025-08-20 19:18:16,034] Trial 9 finished with value: 0.7532981744374388 and parameters: {'model_type': 'lgbm', 'n_estimators': 100, 'max_depth': 7, 'learning_rate': 0.24764622440520867}. Best is trial 1 with value: 0.7804424656416976.
[I 2025-08-20 19:18:16,591] Trial 10 finished with value: 0.7484325182562956 and parameters: {'model_type': 'rf', 'n_estimators': 188, 'max_depth': 14, 'min_samples_split': 10}. Best is trial 1 with value: 0.7804424656416976.
[I 2025-08-20 19:18:20,353] Trial 11 finished with value: 0.6290044010158629 and parameters: {'model_type': 'xgb', 'n_estimators': 183, 'max_depth': 3, 'learning_rate': 0.011526945180134501}. Best is trial 1 with value: 0.7804424656416976.
Warning: less than 75% GPU memory available for training. Free: 7339.4375 Total: 81155.75
[I 2025-08-20 19:18:58,911] Trial 12 finished with value: 0.7716218887408264 and parameters: {'model_type': 'cat', 'iterations': 775, 'depth': 4, 'learning_rate': 0.077955188799856}. Best is trial 1 with value: 0.7804424656416976.
[I 2025-08-20 19:18:59,430] Trial 13 finished with value: 0.7567452109987525 and parameters: {'model_type': 'rf', 'n_estimators': 156, 'max_depth': 11, 'min_samples_split': 2}. Best is trial 1 with value: 0.7804424656416976.
[I 2025-08-20 19:18:59,596] Trial 14 finished with value: 0.7700520660846247 and parameters: {'model_type': 'lgbm', 'n_estimators': 146, 'max_depth': 6, 'learning_rate': 0.09415466769582809}. Best is trial 1 with value: 0.7804424656416976.
[I 2025-08-20 19:19:02,316] Trial 15 finished with value: 0.7571264240042359 and parameters: {'model_type': 'xgb', 'n_estimators': 199, 'max_depth': 5, 'learning_rate': 0.27385409339288835}. Best is trial 1 with value: 0.7804424656416976.
Warning: less than 75% GPU memory available for training. Free: 4007.4375 Total: 81155.75
[I 2025-08-20 19:19:07,894] Trial 16 finished with value: 0.7711189318650263 and parameters: {'model_type': 'cat', 'iterations': 298, 'depth': 4, 'learning_rate': 0.22710979496943384}. Best is trial 1 with value: 0.7804424656416976.
[I 2025-08-20 19:19:11,183] Trial 17 finished with value: 0.7259625512292127 and parameters: {'model_type': 'xgb', 'n_estimators': 151, 'max_depth': 8, 'learning_rate': 0.058280115977885585}. Best is trial 1 with value: 0.7804424656416976.
Warning: less than 75% GPU memory available for training. Free: 4007.4375 Total: 81155.75
[I 2025-08-20 19:19:50,646] Trial 18 finished with value: 0.7996778383564428 and parameters: {'model_type': 'cat', 'iterations': 579, 'depth': 7, 'learning_rate': 0.13065899258188501}. Best is trial 18 with value: 0.7996778383564428.
[I 2025-08-20 19:19:51,017] Trial 19 finished with value: 0.7529405661634628 and parameters: {'model_type': 'rf', 'n_estimators': 127, 'max_depth': 10, 'min_samples_split': 6}. Best is trial 18 with value: 0.7996778383564428.
[I 2025-08-20 19:19:51,055] Trial 20 finished with value: 0.7472648749691047 and parameters: {'model_type': 'lgbm', 'n_estimators': 52, 'max_depth': 3, 'learning_rate': 0.11349636694464832}. Best is trial 18 with value: 0.7996778383564428.
Warning: less than 75% GPU memory available for training. Free: 4007.4375 Total: 81155.75
[I 2025-08-20 19:20:15,641] Trial 21 finished with value: 0.785378063263909 and parameters: {'model_type': 'cat', 'iterations': 594, 'depth': 7, 'learning_rate': 0.13942898845840881}. Best is trial 18 with value: 0.7996778383564428.
Warning: less than 75% GPU memory available for training. Free: 7623.4375 Total: 81155.75
[I 2025-08-20 19:20:56,873] Trial 22 finished with value: 0.7777300978796987 and parameters: {'model_type': 'cat', 'iterations': 705, 'depth': 8, 'learning_rate': 0.12372431765043775}. Best is trial 18 with value: 0.7996778383564428.
Warning: less than 75% GPU memory available for training. Free: 10887.4375 Total: 81155.75
[I 2025-08-20 19:21:30,240] Trial 23 finished with value: 0.7709755226188288 and parameters: {'model_type': 'cat', 'iterations': 604, 'depth': 8, 'learning_rate': 0.14122936041390663}. Best is trial 18 with value: 0.7996778383564428.
[I 2025-08-20 19:21:41,276] Trial 24 finished with value: 0.7668518052887324 and parameters: {'model_type': 'cat', 'iterations': 392, 'depth': 7, 'learning_rate': 0.05400300931161903}. Best is trial 18 with value: 0.7996778383564428.
[I 2025-08-20 19:21:44,846] Trial 25 finished with value: 0.7809988237424805 and parameters: {'model_type': 'xgb', 'n_estimators': 170, 'max_depth': 5, 'learning_rate': 0.0983588726907243}. Best is trial 18 with value: 0.7996778383564428.
[I 2025-08-20 19:22:12,088] Trial 26 finished with value: 0.8052332234290546 and parameters: {'model_type': 'cat', 'iterations': 625, 'depth': 7, 'learning_rate': 0.15093202468256062}. Best is trial 26 with value: 0.8052332234290546.
[I 2025-08-20 19:22:56,894] Trial 27 finished with value: 0.7788885799421291 and parameters: {'model_type': 'cat', 'iterations': 639, 'depth': 7, 'learning_rate': 0.2074530838345912}. Best is trial 26 with value: 0.8052332234290546.
[I 2025-08-20 19:23:40,768] Trial 28 finished with value: 0.7813610732676765 and parameters: {'model_type': 'cat', 'iterations': 679, 'depth': 8, 'learning_rate': 0.14868996139192828}. Best is trial 26 with value: 0.8052332234290546.
[I 2025-08-20 19:24:12,190] Trial 29 finished with value: 0.7892287297082352 and parameters: {'model_type': 'cat', 'iterations': 576, 'depth': 6, 'learning_rate': 0.1522428772259139}. Best is trial 26 with value: 0.8052332234290546.
[I 2025-08-20 19:24:12,204] Trial 30 finished with value: 0.5866945086671743 and parameters: {'model_type': 'bayesian_ridge', 'alpha_1': 0.000896107493922842, 'alpha_2': 2.162888041077086e-06, 'lambda_1': 5.2075240017081465e-06, 'lambda_2': 0.0009971623377927116}. Best is trial 26 with value: 0.8052332234290546.
[I 2025-08-20 19:24:43,423] Trial 31 finished with value: 0.7927516356663149 and parameters: {'model_type': 'cat', 'iterations': 586, 'depth': 6, 'learning_rate': 0.14856692993519965}. Best is trial 26 with value: 0.8052332234290546.
[I 2025-08-20 19:25:04,826] Trial 32 finished with value: 0.7783868673257393 and parameters: {'model_type': 'cat', 'iterations': 549, 'depth': 6, 'learning_rate': 0.1637139348280492}. Best is trial 26 with value: 0.8052332234290546.
Warning: less than 75% GPU memory available for training. Free: 60145.4375 Total: 81155.75
[I 2025-08-20 19:25:12,410] Trial 33 finished with value: 0.7826448297234454 and parameters: {'model_type': 'cat', 'iterations': 473, 'depth': 6, 'learning_rate': 0.1833577929978843}. Best is trial 26 with value: 0.8052332234290546.
Warning: less than 75% GPU memory available for training. Free: 58289.4375 Total: 81155.75
[I 2025-08-20 19:25:34,793] Trial 34 finished with value: 0.7861266994700754 and parameters: {'model_type': 'cat', 'iterations': 616, 'depth': 6, 'learning_rate': 0.1455669743352188}. Best is trial 26 with value: 0.8052332234290546.
Warning: less than 75% GPU memory available for training. Free: 56613.4375 Total: 81155.75
[I 2025-08-20 19:26:25,015] Trial 35 finished with value: 0.7812386047468005 and parameters: {'model_type': 'cat', 'iterations': 703, 'depth': 7, 'learning_rate': 0.20623158137033}. Best is trial 26 with value: 0.8052332234290546.
[I 2025-08-20 19:26:30,316] Trial 36 finished with value: 0.7811629931122762 and parameters: {'model_type': 'cat', 'iterations': 564, 'depth': 5, 'learning_rate': 0.11985366470536599}. Best is trial 26 with value: 0.8052332234290546.
[I 2025-08-20 19:26:36,209] Trial 37 finished with value: 0.7691543479779344 and parameters: {'model_type': 'cat', 'iterations': 658, 'depth': 5, 'learning_rate': 0.08341090768767692}. Best is trial 26 with value: 0.8052332234290546.
[I 2025-08-20 19:26:36,226] Trial 38 finished with value: 0.5866894418039639 and parameters: {'model_type': 'bayesian_ridge', 'alpha_1': 2.6095132458096534e-05, 'alpha_2': 0.00041977116959988897, 'lambda_1': 0.0009890398609542687, 'lambda_2': 6.0233112554077526e-05}. Best is trial 26 with value: 0.8052332234290546.
[I 2025-08-20 19:26:41,613] Trial 39 finished with value: 0.7635209094229959 and parameters: {'model_type': 'cat', 'iterations': 423, 'depth': 7, 'learning_rate': 0.15810935531546325}. Best is trial 26 with value: 0.8052332234290546.
[I 2025-08-20 19:26:41,795] Trial 40 finished with value: 0.773561661974229 and parameters: {'model_type': 'lgbm', 'n_estimators': 95, 'max_depth': 8, 'learning_rate': 0.1290996668266414}. Best is trial 26 with value: 0.8052332234290546.
[I 2025-08-20 19:26:47,831] Trial 41 finished with value: 0.7785735474407927 and parameters: {'model_type': 'cat', 'iterations': 614, 'depth': 6, 'learning_rate': 0.14549894606924915}. Best is trial 26 with value: 0.8052332234290546.
[I 2025-08-20 19:26:56,326] Trial 42 finished with value: 0.7856329920739831 and parameters: {'model_type': 'cat', 'iterations': 575, 'depth': 6, 'learning_rate': 0.11370230119993216}. Best is trial 26 with value: 0.8052332234290546.
[I 2025-08-20 19:27:04,170] Trial 43 finished with value: 0.7862016345875378 and parameters: {'model_type': 'cat', 'iterations': 519, 'depth': 6, 'learning_rate': 0.16581614719995424}. Best is trial 26 with value: 0.8052332234290546.
[I 2025-08-20 19:27:09,376] Trial 44 finished with value: 0.7497359958622247 and parameters: {'model_type': 'cat', 'iterations': 497, 'depth': 8, 'learning_rate': 0.1750444377616893}. Best is trial 26 with value: 0.8052332234290546.
[I 2025-08-20 19:27:09,733] Trial 45 finished with value: 0.7509376169942149 and parameters: {'model_type': 'rf', 'n_estimators': 126, 'max_depth': 15, 'min_samples_split': 10}. Best is trial 26 with value: 0.8052332234290546.
[I 2025-08-20 19:27:16,488] Trial 46 finished with value: 0.7865874489793229 and parameters: {'model_type': 'cat', 'iterations': 517, 'depth': 5, 'learning_rate': 0.19296550787477615}. Best is trial 26 with value: 0.8052332234290546.
[I 2025-08-20 19:27:16,503] Trial 47 finished with value: 0.5866944402764733 and parameters: {'model_type': 'bayesian_ridge', 'alpha_1': 0.0006024800848500902, 'alpha_2': 0.0004916846136428011, 'lambda_1': 4.796927872104291e-06, 'lambda_2': 0.0009848682226661655}. Best is trial 26 with value: 0.8052332234290546.
[I 2025-08-20 19:27:23,740] Trial 48 finished with value: 0.7845670492644136 and parameters: {'model_type': 'cat', 'iterations': 558, 'depth': 5, 'learning_rate': 0.19036503808184546}. Best is trial 26 with value: 0.8052332234290546.
[I 2025-08-20 19:27:31,509] Trial 49 finished with value: 0.7917259171077875 and parameters: {'model_type': 'cat', 'iterations': 749, 'depth': 5, 'learning_rate': 0.20650068488940293}. Best is trial 26 with value: 0.8052332234290546.
Regression Results:
  Train R²: 0.951
  Test R²: 0.805
  CV R²: 0.414 ± 0.178

=== Generating Visualizations ===
=== Evaluating CatBoost with Parity Plots ===
Model Performance:
  Train R²: 0.951, MAE: 0.134, RMSE: 0.200
  Test R²: 0.805, MAE: 0.329, RMSE: 0.424
Generating parity plots...
Parity plot saved as: plots/parity_plot_catboost_train_each_8_optuna_cpv2_gpu0_train.png
Parity plot saved as: plots/parity_plot_catboost_test_each_8_optuna_cpv2_gpu0_test.png
Parity analysis plot saved as: plots/parity_analysis_catboost_test_each_8_optuna_cpv2_gpu0_analysis.png
Saved predictions to results/predictions_each_8_optuna_cpv2_gpu0.csv
Saved combined dataset to results/combined_df_each_8_optuna_cpv2_gpu0.csv
Models saved with suffix: _each_8_optuna_cpv2_gpu0
HTE prediction evaluation report saved to results/reports/hte_prediction_report_manual_8_each_8_optuna_cpv2_gpu0.txt

=== Comparing without reaction-energy features (HTE prediction) ===
=== Building HTE Prediction Models with 8 features ===
Selected features: ['acyl_class_aromatic', 'acyl_Charges_secondary_1', 'acyl_pka_aHs_x_has_acidic_H', 'amine_BV_secondary_avg', 'acyl_BV_secondary_2', 'amine_Charges_secondary_1', 'amine_class_1_mixture', 'amine_pka_basic']
Valid features: 9
=== Building Regression Model ===
Regression dataset: (1031, 9)
Target range: -1.418 to 4.010


Training data: 619 samples
Test data: 206 samples


Train-only SFS selected 8 features for regression
Running hyperparameter optimization for regression...
[I 2025-08-20 19:29:04,836] A new study created in memory with name: no-name-f9958424-f732-45a3-8475-7ccd90f418b6
[I 2025-08-20 19:29:05,187] Trial 0 finished with value: 0.7585428290617711 and parameters: {'model_type': 'xgb', 'n_estimators': 191, 'max_depth': 7, 'learning_rate': 0.04814837994657722}. Best is trial 0 with value: 0.7585428290617711.
[I 2025-08-20 19:29:05,428] Trial 1 finished with value: 0.755079565673364 and parameters: {'model_type': 'xgb', 'n_estimators': 145, 'max_depth': 9, 'learning_rate': 0.2503274989939473}. Best is trial 0 with value: 0.7585428290617711.
[I 2025-08-20 19:29:05,502] Trial 2 finished with value: 0.806399607199858 and parameters: {'model_type': 'lgbm', 'n_estimators': 63, 'max_depth': 7, 'learning_rate': 0.10393432106466773}. Best is trial 2 with value: 0.806399607199858.
[I 2025-08-20 19:29:05,787] Trial 3 finished with value: 0.7429849408702819 and parameters: {'model_type': 'xgb', 'n_estimators': 111, 'max_depth': 10, 'learning_rate': 0.24098105115078097}. Best is trial 2 with value: 0.806399607199858.
[I 2025-08-20 19:29:05,790] Trial 4 finished with value: 0.45778789716277446 and parameters: {'model_type': 'bayesian_ridge', 'alpha_1': 4.0319748017097086e-05, 'alpha_2': 0.0005930727110475246, 'lambda_1': 2.3333795634561634e-05, 'lambda_2': 0.0007138959145540728}. Best is trial 2 with value: 0.806399607199858.
[I 2025-08-20 19:29:05,951] Trial 5 finished with value: 0.7967750930489397 and parameters: {'model_type': 'xgb', 'n_estimators': 186, 'max_depth': 4, 'learning_rate': 0.0821921528876243}. Best is trial 2 with value: 0.806399607199858.
[I 2025-08-20 19:29:06,039] Trial 6 finished with value: 0.7703367384327612 and parameters: {'model_type': 'xgb', 'n_estimators': 119, 'max_depth': 3, 'learning_rate': 0.18613264794813378}. Best is trial 2 with value: 0.806399607199858.
[I 2025-08-20 19:29:06,245] Trial 7 finished with value: 0.7332413769535548 and parameters: {'model_type': 'rf', 'n_estimators': 171, 'max_depth': 6, 'min_samples_split': 8}. Best is trial 2 with value: 0.806399607199858.
[I 2025-08-20 19:29:06,247] Trial 8 finished with value: 0.45779025302746545 and parameters: {'model_type': 'bayesian_ridge', 'alpha_1': 0.00020055385393528285, 'alpha_2': 0.0003001895370695528, 'lambda_1': 0.00041725490582111455, 'lambda_2': 0.0009113967878616412}. Best is trial 2 with value: 0.806399607199858.
[I 2025-08-20 19:29:06,248] Trial 9 finished with value: 0.4577895200355466 and parameters: {'model_type': 'bayesian_ridge', 'alpha_1': 0.0007315253797112204, 'alpha_2': 8.229451303143329e-05, 'lambda_1': 0.0008389757920194324, 'lambda_2': 0.000874641618592242}. Best is trial 2 with value: 0.806399607199858.
