[I 2025-08-20 19:29:57,667] Trial 3 finished with value: 0.4577815280115419 and parameters: {'model_type': 'bayesian_ridge', 'alpha_1': 0.0005103458920784427, 'alpha_2': 0.0006348207214742162, 'lambda_1': 0.00046760995023471217, 'lambda_2': 0.0002515142757961127}. Best is trial 0 with value: 0.8002420042215845.
[I 2025-08-20 19:29:57,668] Trial 4 finished with value: 0.45778725342300897 and parameters: {'model_type': 'bayesian_ridge', 'alpha_1': 9.32158049811204e-05, 'alpha_2': 0.0006313329552668912, 'lambda_1': 4.67654187658641e-05, 'lambda_2': 0.000666032581795349}. Best is trial 0 with value: 0.8002420042215845.
[I 2025-08-20 19:30:27,296] Trial 5 finished with value: 0.7930658296001891 and parameters: {'model_type': 'cat', 'iterations': 693, 'depth': 7, 'learning_rate': 0.09352706738992568}. Best is trial 0 with value: 0.8002420042215845.
[I 2025-08-20 19:30:27,368] Trial 6 finished with value: 0.8048817408751604 and parameters: {'model_type': 'lgbm', 'n_estimators': 137, 'max_depth': 6, 'learning_rate': 0.0952756202649673}. Best is trial 6 with value: 0.8048817408751604.
[I 2025-08-20 19:30:34,848] Trial 7 finished with value: 0.7854102367979509 and parameters: {'model_type': 'cat', 'iterations': 268, 'depth': 9, 'learning_rate': 0.24749875119224488}. Best is trial 6 with value: 0.8048817408751604.
[I 2025-08-20 19:30:42,218] Trial 8 finished with value: 0.7800423647225594 and parameters: {'model_type': 'cat', 'iterations': 450, 'depth': 6, 'learning_rate': 0.2631909082625628}. Best is trial 6 with value: 0.8048817408751604.
[I 2025-08-20 19:30:42,223] Trial 9 finished with value: 0.457791268239642 and parameters: {'model_type': 'bayesian_ridge', 'alpha_1': 0.000652260205608701, 'alpha_2': 0.0004436593699432927, 'lambda_1': 0.0005608036752640633, 'lambda_2': 0.000995513187607235}. Best is trial 6 with value: 0.8048817408751604.
[I 2025-08-20 19:30:42,322] Trial 10 finished with value: 0.741493880396342 and parameters: {'model_type': 'lgbm', 'n_estimators': 198, 'max_depth': 4, 'learning_rate': 0.01545888845976734}. Best is trial 6 with value: 0.8048817408751604.
[I 2025-08-20 19:30:42,419] Trial 11 finished with value: 0.7937667798124036 and parameters: {'model_type': 'lgbm', 'n_estimators': 106, 'max_depth': 10, 'learning_rate': 0.14208325619146053}. Best is trial 6 with value: 0.8048817408751604.
[I 2025-08-20 19:30:42,680] Trial 12 finished with value: 0.7949225497371873 and parameters: {'model_type': 'lgbm', 'n_estimators': 131, 'max_depth': 7, 'learning_rate': 0.1683289643827652}. Best is trial 6 with value: 0.8048817408751604.
[I 2025-08-20 19:30:42,934] Trial 13 finished with value: 0.7923764505840724 and parameters: {'model_type': 'rf', 'n_estimators': 135, 'max_depth': 14, 'min_samples_split': 10}. Best is trial 6 with value: 0.8048817408751604.
[I 2025-08-20 19:30:44,333] Trial 14 finished with value: 0.7651215355614944 and parameters: {'model_type': 'xgb', 'n_estimators': 53, 'max_depth': 6, 'learning_rate': 0.10462108438621041}. Best is trial 6 with value: 0.8048817408751604.
[I 2025-08-20 19:30:44,404] Trial 15 finished with value: 0.7871908830499479 and parameters: {'model_type': 'lgbm', 'n_estimators': 102, 'max_depth': 7, 'learning_rate': 0.1928256654951621}. Best is trial 6 with value: 0.8048817408751604.
[I 2025-08-20 19:30:44,538] Trial 16 finished with value: 0.8046610731657122 and parameters: {'model_type': 'lgbm', 'n_estimators': 166, 'max_depth': 9, 'learning_rate': 0.0445256517077918}. Best is trial 6 with value: 0.8048817408751604.
[I 2025-08-20 19:30:44,752] Trial 17 finished with value: 0.5155396052669755 and parameters: {'model_type': 'rf', 'n_estimators': 176, 'max_depth': 3, 'min_samples_split': 2}. Best is trial 6 with value: 0.8048817408751604.
[I 2025-08-20 19:30:47,397] Trial 18 finished with value: 0.7655468769808448 and parameters: {'model_type': 'xgb', 'n_estimators': 160, 'max_depth': 9, 'learning_rate': 0.025516210572237113}. Best is trial 6 with value: 0.8048817408751604.
[I 2025-08-20 19:30:47,488] Trial 19 finished with value: 0.8086122619203409 and parameters: {'model_type': 'lgbm', 'n_estimators': 163, 'max_depth': 5, 'learning_rate': 0.07226682646552268}. Best is trial 19 with value: 0.8086122619203409.
[I 2025-08-20 19:30:47,561] Trial 20 finished with value: 0.8086604534485984 and parameters: {'model_type': 'lgbm', 'n_estimators': 147, 'max_depth': 5, 'learning_rate': 0.08868127151554021}. Best is trial 20 with value: 0.8086604534485984.
[I 2025-08-20 19:30:47,640] Trial 21 finished with value: 0.8129120460139831 and parameters: {'model_type': 'lgbm', 'n_estimators': 148, 'max_depth': 5, 'learning_rate': 0.09725793906631557}. Best is trial 21 with value: 0.8129120460139831.
[I 2025-08-20 19:30:47,718] Trial 22 finished with value: 0.8076324246336456 and parameters: {'model_type': 'lgbm', 'n_estimators': 153, 'max_depth': 5, 'learning_rate': 0.06615894046582327}. Best is trial 21 with value: 0.8129120460139831.
[I 2025-08-20 19:30:47,808] Trial 23 finished with value: 0.809258276061985 and parameters: {'model_type': 'lgbm', 'n_estimators': 185, 'max_depth': 5, 'learning_rate': 0.12044550056743494}. Best is trial 21 with value: 0.8129120460139831.
[I 2025-08-20 19:30:47,881] Trial 24 finished with value: 0.8063816934855728 and parameters: {'model_type': 'lgbm', 'n_estimators': 184, 'max_depth': 4, 'learning_rate': 0.12870245236137748}. Best is trial 21 with value: 0.8129120460139831.
[I 2025-08-20 19:30:49,932] Trial 25 finished with value: 0.7786229289516501 and parameters: {'model_type': 'xgb', 'n_estimators': 200, 'max_depth': 5, 'learning_rate': 0.1204785655392424}. Best is trial 21 with value: 0.8129120460139831.
[I 2025-08-20 19:30:50,070] Trial 26 finished with value: 0.5124377140889007 and parameters: {'model_type': 'rf', 'n_estimators': 147, 'max_depth': 3, 'min_samples_split': 6}. Best is trial 21 with value: 0.8129120460139831.
[I 2025-08-20 19:30:50,111] Trial 27 finished with value: 0.8025505910093003 and parameters: {'model_type': 'lgbm', 'n_estimators': 92, 'max_depth': 4, 'learning_rate': 0.2082763141113299}. Best is trial 21 with value: 0.8129120460139831.
[I 2025-08-20 19:30:50,214] Trial 28 finished with value: 0.8084427640018224 and parameters: {'model_type': 'lgbm', 'n_estimators': 179, 'max_depth': 6, 'learning_rate': 0.06313256847702059}. Best is trial 21 with value: 0.8129120460139831.
[I 2025-08-20 19:30:50,258] Trial 29 finished with value: 0.8110015036230176 and parameters: {'model_type': 'lgbm', 'n_estimators': 73, 'max_depth': 5, 'learning_rate': 0.14847711373660744}. Best is trial 21 with value: 0.8129120460139831.
[I 2025-08-20 19:30:50,295] Trial 30 finished with value: 0.8027068480910373 and parameters: {'model_type': 'lgbm', 'n_estimators': 73, 'max_depth': 4, 'learning_rate': 0.14719484497681046}. Best is trial 21 with value: 0.8129120460139831.
[I 2025-08-20 19:30:50,370] Trial 31 finished with value: 0.8129374489972544 and parameters: {'model_type': 'lgbm', 'n_estimators': 143, 'max_depth': 5, 'learning_rate': 0.10930943309781373}. Best is trial 31 with value: 0.8129374489972544.
[I 2025-08-20 19:30:50,432] Trial 32 finished with value: 0.8078027182385965 and parameters: {'model_type': 'lgbm', 'n_estimators': 121, 'max_depth': 5, 'learning_rate': 0.1245086160651659}. Best is trial 31 with value: 0.8129374489972544.
[I 2025-08-20 19:30:50,485] Trial 33 finished with value: 0.8015550442690756 and parameters: {'model_type': 'lgbm', 'n_estimators': 76, 'max_depth': 6, 'learning_rate': 0.1569285878000261}. Best is trial 31 with value: 0.8129374489972544.
[I 2025-08-20 19:30:50,517] Trial 34 finished with value: 0.7930518141460593 and parameters: {'model_type': 'lgbm', 'n_estimators': 52, 'max_depth': 4, 'learning_rate': 0.11199996678820352}. Best is trial 31 with value: 0.8129374489972544.
[I 2025-08-20 19:30:50,596] Trial 35 finished with value: 0.7961969383848505 and parameters: {'model_type': 'lgbm', 'n_estimators': 114, 'max_depth': 7, 'learning_rate': 0.19223542270259758}. Best is trial 31 with value: 0.8129374489972544.
Warning: less than 75% GPU memory available for training. Free: 4037.4375 Total: 81155.75
[I 2025-08-20 19:31:01,811] Trial 36 finished with value: 0.7688844386205966 and parameters: {'model_type': 'cat', 'iterations': 750, 'depth': 4, 'learning_rate': 0.29917219813238916}. Best is trial 31 with value: 0.8129374489972544.
[I 2025-08-20 19:31:01,829] Trial 37 finished with value: 0.4577876104287515 and parameters: {'model_type': 'bayesian_ridge', 'alpha_1': 0.0009707456289672273, 'alpha_2': 6.89213718426971e-05, 'lambda_1': 0.0009002682629620662, 'lambda_2': 0.0007319030925879835}. Best is trial 31 with value: 0.8129374489972544.
[I 2025-08-20 19:31:03,304] Trial 38 finished with value: 0.7819992214665659 and parameters: {'model_type': 'xgb', 'n_estimators': 142, 'max_depth': 5, 'learning_rate': 0.14480048867039}. Best is trial 31 with value: 0.8129374489972544.
[I 2025-08-20 19:31:03,427] Trial 39 finished with value: 0.7751438606564226 and parameters: {'model_type': 'rf', 'n_estimators': 86, 'max_depth': 8, 'min_samples_split': 10}. Best is trial 31 with value: 0.8129374489972544.
[I 2025-08-20 19:31:03,436] Trial 40 finished with value: 0.4577790107840506 and parameters: {'model_type': 'bayesian_ridge', 'alpha_1': 0.0009923748874985764, 'alpha_2': 1.5000096532857539e-05, 'lambda_1': 0.00041865560102338436, 'lambda_2': 5.855694090840368e-05}. Best is trial 31 with value: 0.8129374489972544.
[I 2025-08-20 19:31:03,515] Trial 41 finished with value: 0.8133337084627354 and parameters: {'model_type': 'lgbm', 'n_estimators': 153, 'max_depth': 5, 'learning_rate': 0.08368844045839591}. Best is trial 41 with value: 0.8133337084627354.
[I 2025-08-20 19:31:03,587] Trial 42 finished with value: 0.8137613544012431 and parameters: {'model_type': 'lgbm', 'n_estimators': 126, 'max_depth': 5, 'learning_rate': 0.08248541114217664}. Best is trial 42 with value: 0.8137613544012431.
[I 2025-08-20 19:31:03,665] Trial 43 finished with value: 0.810229693182034 and parameters: {'model_type': 'lgbm', 'n_estimators': 120, 'max_depth': 6, 'learning_rate': 0.08444159976396513}. Best is trial 42 with value: 0.8137613544012431.
Warning: less than 75% GPU memory available for training. Free: 7651.4375 Total: 81155.75
[I 2025-08-20 19:31:05,705] Trial 44 finished with value: 0.7842253686849223 and parameters: {'model_type': 'cat', 'iterations': 230, 'depth': 10, 'learning_rate': 0.05692827782084594}. Best is trial 42 with value: 0.8137613544012431.
[I 2025-08-20 19:31:06,032] Trial 45 finished with value: 0.7865873489804789 and parameters: {'model_type': 'lgbm', 'n_estimators': 128, 'max_depth': 4, 'learning_rate': 0.04197095054264352}. Best is trial 42 with value: 0.8137613544012431.
[I 2025-08-20 19:31:06,126] Trial 46 finished with value: 0.8124753061516761 and parameters: {'model_type': 'lgbm', 'n_estimators': 155, 'max_depth': 5, 'learning_rate': 0.09870417849635982}. Best is trial 42 with value: 0.8137613544012431.
[I 2025-08-20 19:31:06,210] Trial 47 finished with value: 0.808109691981496 and parameters: {'model_type': 'lgbm', 'n_estimators': 152, 'max_depth': 6, 'learning_rate': 0.08314958334949486}. Best is trial 42 with value: 0.8137613544012431.
[I 2025-08-20 19:31:06,263] Trial 48 finished with value: 0.8031997417685286 and parameters: {'model_type': 'lgbm', 'n_estimators': 139, 'max_depth': 4, 'learning_rate': 0.10100511267736512}. Best is trial 42 with value: 0.8137613544012431.
[I 2025-08-20 19:31:06,273] Trial 49 finished with value: 0.45779088242630406 and parameters: {'model_type': 'bayesian_ridge', 'alpha_1': 4.350191301496923e-05, 'alpha_2': 0.0009969188435909886, 'lambda_1': 0.0002461613853740333, 'lambda_2': 0.0009522328053337172}. Best is trial 42 with value: 0.8137613544012431.
Regression Results:
  Train R²: 0.876
  Test R²: 0.814
  CV R²: 0.490 ± 0.222
Failed to save comparison file: Object of type ndarray is not JSON serializable

==================================================
ANALYSIS COMPLETE
==================================================
Check the following directories for outputs:
  - plots/: Visualization files
  - results/: Data files and reports
  - models/: Trained model files
