[I 2025-08-20 19:29:06,293] Trial 10 finished with value: 0.8014910442579879 and parameters: {'model_type': 'lgbm', 'n_estimators': 57, 'max_depth': 7, 'learning_rate': 0.12173005756519409}. Best is trial 2 with value: 0.806399607199858.
[I 2025-08-20 19:29:06,331] Trial 11 finished with value: 0.8027428150046866 and parameters: {'model_type': 'lgbm', 'n_estimators': 50, 'max_depth': 7, 'learning_rate': 0.12251938615165947}. Best is trial 2 with value: 0.806399607199858.
[I 2025-08-20 19:29:06,368] Trial 12 finished with value: 0.7991265300302025 and parameters: {'model_type': 'lgbm', 'n_estimators': 52, 'max_depth': 6, 'learning_rate': 0.15012911525565936}. Best is trial 2 with value: 0.806399607199858.
[I 2025-08-20 19:29:06,432] Trial 13 finished with value: 0.6109443258575833 and parameters: {'model_type': 'lgbm', 'n_estimators': 75, 'max_depth': 8, 'learning_rate': 0.015527212211979932}. Best is trial 2 with value: 0.806399607199858.
[I 2025-08-20 19:29:10,539] Trial 14 finished with value: 0.7959150924505995 and parameters: {'model_type': 'cat', 'iterations': 566, 'depth': 6, 'learning_rate': 0.10414525969008279}. Best is trial 2 with value: 0.806399607199858.
[I 2025-08-20 19:29:10,588] Trial 15 finished with value: 0.8097699557182364 and parameters: {'model_type': 'lgbm', 'n_estimators': 83, 'max_depth': 5, 'learning_rate': 0.17100307709607482}. Best is trial 15 with value: 0.8097699557182364.
[I 2025-08-20 19:29:10,631] Trial 16 finished with value: 0.8091533449090748 and parameters: {'model_type': 'lgbm', 'n_estimators': 91, 'max_depth': 5, 'learning_rate': 0.19560230448318697}. Best is trial 15 with value: 0.8097699557182364.
[I 2025-08-20 19:29:10,807] Trial 17 finished with value: 0.7910013175038222 and parameters: {'model_type': 'rf', 'n_estimators': 90, 'max_depth': 13, 'min_samples_split': 2}. Best is trial 15 with value: 0.8097699557182364.
[I 2025-08-20 19:29:13,892] Trial 18 finished with value: 0.7610245853471407 and parameters: {'model_type': 'cat', 'iterations': 255, 'depth': 10, 'learning_rate': 0.19984056573247927}. Best is trial 15 with value: 0.8097699557182364.
[I 2025-08-20 19:29:13,945] Trial 19 finished with value: 0.8012617603951581 and parameters: {'model_type': 'lgbm', 'n_estimators': 93, 'max_depth': 5, 'learning_rate': 0.2913027673627771}. Best is trial 15 with value: 0.8097699557182364.
[I 2025-08-20 19:29:13,996] Trial 20 finished with value: 0.8018381592341087 and parameters: {'model_type': 'lgbm', 'n_estimators': 138, 'max_depth': 4, 'learning_rate': 0.18782169886818056}. Best is trial 15 with value: 0.8097699557182364.
[I 2025-08-20 19:29:14,039] Trial 21 finished with value: 0.8140269920372587 and parameters: {'model_type': 'lgbm', 'n_estimators': 79, 'max_depth': 5, 'learning_rate': 0.15046781036321996}. Best is trial 21 with value: 0.8140269920372587.
[I 2025-08-20 19:29:14,086] Trial 22 finished with value: 0.8148148158981605 and parameters: {'model_type': 'lgbm', 'n_estimators': 91, 'max_depth': 5, 'learning_rate': 0.1527515268520213}. Best is trial 22 with value: 0.8148148158981605.
[I 2025-08-20 19:29:14,127] Trial 23 finished with value: 0.8062607415288725 and parameters: {'model_type': 'lgbm', 'n_estimators': 76, 'max_depth': 5, 'learning_rate': 0.16606332229135565}. Best is trial 22 with value: 0.8148148158981605.
[I 2025-08-20 19:29:14,169] Trial 24 finished with value: 0.811553171177668 and parameters: {'model_type': 'lgbm', 'n_estimators': 105, 'max_depth': 4, 'learning_rate': 0.15078863957107674}. Best is trial 22 with value: 0.8148148158981605.
[I 2025-08-20 19:29:14,277] Trial 25 finished with value: 0.5048229551701211 and parameters: {'model_type': 'rf', 'n_estimators': 106, 'max_depth': 3, 'min_samples_split': 3}. Best is trial 22 with value: 0.8148148158981605.
[I 2025-08-20 19:29:14,321] Trial 26 finished with value: 0.80194269315691 and parameters: {'model_type': 'lgbm', 'n_estimators': 103, 'max_depth': 4, 'learning_rate': 0.14343352069624135}. Best is trial 22 with value: 0.8148148158981605.
[I 2025-08-20 19:29:20,031] Trial 27 finished with value: 0.7821284600622351 and parameters: {'model_type': 'cat', 'iterations': 777, 'depth': 4, 'learning_rate': 0.213950429191205}. Best is trial 22 with value: 0.8148148158981605.
[I 2025-08-20 19:29:20,085] Trial 28 finished with value: 0.7985930424535128 and parameters: {'model_type': 'lgbm', 'n_estimators': 132, 'max_depth': 4, 'learning_rate': 0.06767450146425204}. Best is trial 22 with value: 0.8148148158981605.
[I 2025-08-20 19:29:20,127] Trial 29 finished with value: 0.8020466645742184 and parameters: {'model_type': 'lgbm', 'n_estimators': 69, 'max_depth': 6, 'learning_rate': 0.13744348695697328}. Best is trial 22 with value: 0.8148148158981605.
[I 2025-08-20 19:29:20,170] Trial 30 finished with value: 0.7900263595900583 and parameters: {'model_type': 'lgbm', 'n_estimators': 156, 'max_depth': 3, 'learning_rate': 0.22306335781385045}. Best is trial 22 with value: 0.8148148158981605.
[I 2025-08-20 19:29:20,211] Trial 31 finished with value: 0.8080080191343869 and parameters: {'model_type': 'lgbm', 'n_estimators': 82, 'max_depth': 5, 'learning_rate': 0.16902718977010522}. Best is trial 22 with value: 0.8148148158981605.
[I 2025-08-20 19:29:20,257] Trial 32 finished with value: 0.8018500342373431 and parameters: {'model_type': 'lgbm', 'n_estimators': 98, 'max_depth': 5, 'learning_rate': 0.16552954172831597}. Best is trial 22 with value: 0.8148148158981605.
[I 2025-08-20 19:29:20,302] Trial 33 finished with value: 0.8031874710900246 and parameters: {'model_type': 'lgbm', 'n_estimators': 120, 'max_depth': 4, 'learning_rate': 0.1245206629377365}. Best is trial 22 with value: 0.8148148158981605.
[I 2025-08-20 19:29:20,351] Trial 34 finished with value: 0.8011690513131862 and parameters: {'model_type': 'lgbm', 'n_estimators': 83, 'max_depth': 6, 'learning_rate': 0.17021775723221821}. Best is trial 22 with value: 0.8148148158981605.
[I 2025-08-20 19:29:20,361] Trial 35 finished with value: 0.45777844465097517 and parameters: {'model_type': 'bayesian_ridge', 'alpha_1': 0.0009885340527966266, 'alpha_2': 0.0009870848992533767, 'lambda_1': 0.0008259888974009926, 'lambda_2': 3.57676985742119e-05}. Best is trial 22 with value: 0.8148148158981605.
[I 2025-08-20 19:29:20,870] Trial 36 finished with value: 0.7746095224147791 and parameters: {'model_type': 'xgb', 'n_estimators': 113, 'max_depth': 5, 'learning_rate': 0.14564926032324257}. Best is trial 22 with value: 0.8148148158981605.
[I 2025-08-20 19:29:20,904] Trial 37 finished with value: 0.790293903373436 and parameters: {'model_type': 'lgbm', 'n_estimators': 69, 'max_depth': 4, 'learning_rate': 0.09539299775217346}. Best is trial 22 with value: 0.8148148158981605.
[I 2025-08-20 19:29:21,038] Trial 38 finished with value: 0.7888721261605414 and parameters: {'model_type': 'rf', 'n_estimators': 84, 'max_depth': 11, 'min_samples_split': 10}. Best is trial 22 with value: 0.8148148158981605.
[I 2025-08-20 19:29:21,492] Trial 39 finished with value: 0.7828791396974428 and parameters: {'model_type': 'xgb', 'n_estimators': 101, 'max_depth': 5, 'learning_rate': 0.12917747764822618}. Best is trial 22 with value: 0.8148148158981605.
[I 2025-08-20 19:29:23,250] Trial 40 finished with value: 0.7723419133205136 and parameters: {'model_type': 'cat', 'iterations': 210, 'depth': 10, 'learning_rate': 0.15610918668312465}. Best is trial 22 with value: 0.8148148158981605.
[I 2025-08-20 19:29:23,312] Trial 41 finished with value: 0.8027666890321675 and parameters: {'model_type': 'lgbm', 'n_estimators': 91, 'max_depth': 5, 'learning_rate': 0.18273747625078388}. Best is trial 22 with value: 0.8148148158981605.
[I 2025-08-20 19:29:23,377] Trial 42 finished with value: 0.7952190299699303 and parameters: {'model_type': 'lgbm', 'n_estimators': 94, 'max_depth': 6, 'learning_rate': 0.20365702908947353}. Best is trial 22 with value: 0.8148148158981605.
[I 2025-08-20 19:29:23,413] Trial 43 finished with value: 0.7841913599591033 and parameters: {'model_type': 'lgbm', 'n_estimators': 64, 'max_depth': 4, 'learning_rate': 0.24672372306094942}. Best is trial 22 with value: 0.8148148158981605.
[I 2025-08-20 19:29:23,425] Trial 44 finished with value: 0.4577819145164842 and parameters: {'model_type': 'bayesian_ridge', 'alpha_1': 0.00044586431714876176, 'alpha_2': 0.0008786195110173133, 'lambda_1': 0.00015981139216239006, 'lambda_2': 0.0002666937054858564}. Best is trial 22 with value: 0.8148148158981605.
[I 2025-08-20 19:29:23,469] Trial 45 finished with value: 0.8019653323756737 and parameters: {'model_type': 'lgbm', 'n_estimators': 77, 'max_depth': 5, 'learning_rate': 0.22073959396705986}. Best is trial 22 with value: 0.8148148158981605.
[I 2025-08-20 19:29:23,536] Trial 46 finished with value: 0.7910074625324787 and parameters: {'model_type': 'lgbm', 'n_estimators': 112, 'max_depth': 6, 'learning_rate': 0.18193660245373347}. Best is trial 22 with value: 0.8148148158981605.
[I 2025-08-20 19:29:23,748] Trial 47 finished with value: 0.7917383967624152 and parameters: {'model_type': 'xgb', 'n_estimators': 84, 'max_depth': 3, 'learning_rate': 0.1988735536357282}. Best is trial 22 with value: 0.8148148158981605.
[I 2025-08-20 19:29:23,815] Trial 48 finished with value: 0.8151506736389902 and parameters: {'model_type': 'lgbm', 'n_estimators': 106, 'max_depth': 5, 'learning_rate': 0.10445086053172467}. Best is trial 48 with value: 0.8151506736389902.
[I 2025-08-20 19:29:23,870] Trial 49 finished with value: 0.8120246497831759 and parameters: {'model_type': 'lgbm', 'n_estimators': 127, 'max_depth': 4, 'learning_rate': 0.10571631032545083}. Best is trial 48 with value: 0.8151506736389902.
Regression Results:
  Train R²: 0.876
  Test R²: 0.815
  CV R²: 0.493 ± 0.232
Failed to save comparison file: Object of type ndarray is not JSON serializable

==================================================
ANALYSIS COMPLETE
==================================================
Check the following directories for outputs:
  - plots/: Visualization files
  - results/: Data files and reports
  - models/: Trained model files
