[I 2025-08-20 01:51:38,362] Trial 0 finished with value: 0.6354033744481795 and parameters: {'model_type': 'rf', 'n_estimators': 164, 'max_depth': 8, 'min_samples_split': 2}. Best is trial 0 with value: 0.6354033744481795.
[I 2025-08-20 01:51:38,798] Trial 1 finished with value: 0.630734298337533 and parameters: {'model_type': 'rf', 'n_estimators': 166, 'max_depth': 8, 'min_samples_split': 10}. Best is trial 0 with value: 0.6354033744481795.
[I 2025-08-20 01:51:39,056] Trial 2 finished with value: 0.49729745192398467 and parameters: {'model_type': 'rf', 'n_estimators': 145, 'max_depth': 4, 'min_samples_split': 6}. Best is trial 0 with value: 0.6354033744481795.
[I 2025-08-20 01:51:39,063] Trial 3 finished with value: 0.4180480124987277 and parameters: {'model_type': 'bayesian_ridge', 'alpha_1': 0.0008780679974983428, 'alpha_2': 0.0004943757858930911, 'lambda_1': 0.0008233556092339311, 'lambda_2': 0.0009929071712068225}. Best is trial 0 with value: 0.6354033744481795.
[I 2025-08-20 01:51:39,398] Trial 4 finished with value: 0.6467197310296797 and parameters: {'model_type': 'lgbm', 'n_estimators': 172, 'max_depth': 10, 'learning_rate': 0.05860697948653316}. Best is trial 4 with value: 0.6467197310296797.
[I 2025-08-20 01:51:40,725] Trial 5 finished with value: 0.6737990656733595 and parameters: {'model_type': 'cat', 'iterations': 369, 'depth': 6, 'learning_rate': 0.23280584426819975}. Best is trial 5 with value: 0.6737990656733595.
[I 2025-08-20 01:51:40,729] Trial 6 finished with value: 0.4180502325126193 and parameters: {'model_type': 'bayesian_ridge', 'alpha_1': 0.00028427291188072476, 'alpha_2': 0.00032291814431873925, 'lambda_1': 0.000615295640642265, 'lambda_2': 0.0007394599474025288}. Best is trial 5 with value: 0.6737990656733595.
[I 2025-08-20 01:51:40,897] Trial 7 finished with value: 0.4942122244950642 and parameters: {'model_type': 'rf', 'n_estimators': 78, 'max_depth': 4, 'min_samples_split': 7}. Best is trial 5 with value: 0.6737990656733595.
[I 2025-08-20 01:51:41,067] Trial 8 finished with value: 0.43964985900452735 and parameters: {'model_type': 'rf', 'n_estimators': 106, 'max_depth': 3, 'min_samples_split': 10}. Best is trial 5 with value: 0.6737990656733595.
[I 2025-08-20 01:51:41,069] Trial 9 finished with value: 0.4180496476957474 and parameters: {'model_type': 'bayesian_ridge', 'alpha_1': 0.0008564823639009485, 'alpha_2': 0.0003757189298109409, 'lambda_1': 0.0007857272594550803, 'lambda_2': 0.0008093015318125835}. Best is trial 5 with value: 0.6737990656733595.
[I 2025-08-20 01:51:43,584] Trial 10 finished with value: 0.6567846063698368 and parameters: {'model_type': 'cat', 'iterations': 365, 'depth': 6, 'learning_rate': 0.2849953292490648}. Best is trial 5 with value: 0.6737990656733595.
[I 2025-08-20 01:51:46,597] Trial 11 finished with value: 0.6575053424681557 and parameters: {'model_type': 'cat', 'iterations': 362, 'depth': 6, 'learning_rate': 0.2909718032285413}. Best is trial 5 with value: 0.6737990656733595.
[I 2025-08-20 01:51:49,557] Trial 12 finished with value: 0.6518116708833503 and parameters: {'model_type': 'cat', 'iterations': 361, 'depth': 6, 'learning_rate': 0.27872098470472834}. Best is trial 5 with value: 0.6737990656733595.
[I 2025-08-20 01:51:49,951] Trial 13 finished with value: 0.6620379617642727 and parameters: {'model_type': 'xgb', 'n_estimators': 51, 'max_depth': 6, 'learning_rate': 0.21651180126499306}. Best is trial 5 with value: 0.6737990656733595.
[I 2025-08-20 01:51:50,232] Trial 14 finished with value: 0.6618616428158407 and parameters: {'model_type': 'xgb', 'n_estimators': 50, 'max_depth': 6, 'learning_rate': 0.1838101474771352}. Best is trial 5 with value: 0.6737990656733595.
[I 2025-08-20 01:51:50,814] Trial 15 finished with value: 0.6483890281442628 and parameters: {'model_type': 'xgb', 'n_estimators': 107, 'max_depth': 6, 'learning_rate': 0.19617919124510932}. Best is trial 5 with value: 0.6737990656733595.
[I 2025-08-20 01:51:51,606] Trial 16 finished with value: 0.6485026374899132 and parameters: {'model_type': 'xgb', 'n_estimators': 197, 'max_depth': 8, 'learning_rate': 0.20975031813610445}. Best is trial 5 with value: 0.6737990656733595.
[I 2025-08-20 01:51:51,637] Trial 17 finished with value: 0.6509655980058108 and parameters: {'model_type': 'lgbm', 'n_estimators': 51, 'max_depth': 5, 'learning_rate': 0.10810774281185848}. Best is trial 5 with value: 0.6737990656733595.
[I 2025-08-20 01:52:13,558] Trial 18 finished with value: 0.6883335201566319 and parameters: {'model_type': 'cat', 'iterations': 699, 'depth': 10, 'learning_rate': 0.23549303661734017}. Best is trial 18 with value: 0.6883335201566319.
[I 2025-08-20 01:52:41,018] Trial 19 finished with value: 0.6976772726975371 and parameters: {'model_type': 'cat', 'iterations': 754, 'depth': 10, 'learning_rate': 0.2405387965677654}. Best is trial 19 with value: 0.6976772726975371.
[I 2025-08-20 01:53:03,593] Trial 20 finished with value: 0.7041039270021423 and parameters: {'model_type': 'cat', 'iterations': 745, 'depth': 10, 'learning_rate': 0.15183253775294542}. Best is trial 20 with value: 0.7041039270021423.
[I 2025-08-20 01:53:27,766] Trial 21 finished with value: 0.7020869027778449 and parameters: {'model_type': 'cat', 'iterations': 760, 'depth': 10, 'learning_rate': 0.13031541878536923}. Best is trial 20 with value: 0.7041039270021423.
[I 2025-08-20 01:53:52,741] Trial 22 finished with value: 0.7107688890336319 and parameters: {'model_type': 'cat', 'iterations': 791, 'depth': 10, 'learning_rate': 0.14077940219742124}. Best is trial 22 with value: 0.7107688890336319.
[I 2025-08-20 01:54:08,346] Trial 23 finished with value: 0.7178930108333688 and parameters: {'model_type': 'cat', 'iterations': 794, 'depth': 9, 'learning_rate': 0.1305228266801921}. Best is trial 23 with value: 0.7178930108333688.
[I 2025-08-20 01:54:17,501] Trial 24 finished with value: 0.6987499816212785 and parameters: {'model_type': 'cat', 'iterations': 623, 'depth': 8, 'learning_rate': 0.14286709194829356}. Best is trial 23 with value: 0.7178930108333688.
[I 2025-08-20 01:54:26,704] Trial 25 finished with value: 0.6966414203785878 and parameters: {'model_type': 'cat', 'iterations': 613, 'depth': 8, 'learning_rate': 0.10258822087238931}. Best is trial 23 with value: 0.7178930108333688.
[I 2025-08-20 01:54:42,382] Trial 26 finished with value: 0.6924290739755834 and parameters: {'model_type': 'cat', 'iterations': 799, 'depth': 9, 'learning_rate': 0.06958010197293886}. Best is trial 23 with value: 0.7178930108333688.
[I 2025-08-20 01:54:47,385] Trial 27 finished with value: 0.6810203620059332 and parameters: {'model_type': 'cat', 'iterations': 662, 'depth': 4, 'learning_rate': 0.1671783270550958}. Best is trial 23 with value: 0.7178930108333688.
[I 2025-08-20 01:54:47,627] Trial 28 finished with value: 0.6411379525909945 and parameters: {'model_type': 'lgbm', 'n_estimators': 131, 'max_depth': 10, 'learning_rate': 0.10450723802847899}. Best is trial 23 with value: 0.7178930108333688.
[I 2025-08-20 01:54:59,220] Trial 29 finished with value: 0.6769319056412498 and parameters: {'model_type': 'cat', 'iterations': 562, 'depth': 9, 'learning_rate': 0.028631192199311484}. Best is trial 23 with value: 0.7178930108333688.
[I 2025-08-20 01:55:14,102] Trial 30 finished with value: 0.7256561298327076 and parameters: {'model_type': 'cat', 'iterations': 724, 'depth': 9, 'learning_rate': 0.15492706772434486}. Best is trial 30 with value: 0.7256561298327076.
[I 2025-08-20 01:55:30,379] Trial 31 finished with value: 0.7152600848594927 and parameters: {'model_type': 'cat', 'iterations': 795, 'depth': 9, 'learning_rate': 0.15573179699202117}. Best is trial 30 with value: 0.7256561298327076.
[I 2025-08-20 01:55:49,838] Trial 32 finished with value: 0.7052789637551587 and parameters: {'model_type': 'cat', 'iterations': 792, 'depth': 9, 'learning_rate': 0.12323321992184745}. Best is trial 30 with value: 0.7256561298327076.
[I 2025-08-20 01:55:57,964] Trial 33 finished with value: 0.6382723199859222 and parameters: {'model_type': 'cat', 'iterations': 211, 'depth': 8, 'learning_rate': 0.16845832977752248}. Best is trial 30 with value: 0.7256561298327076.
[I 2025-08-20 01:56:46,509] Trial 34 finished with value: 0.7033428635003929 and parameters: {'model_type': 'cat', 'iterations': 694, 'depth': 9, 'learning_rate': 0.14732924899290836}. Best is trial 30 with value: 0.7256561298327076.
[I 2025-08-20 01:56:46,530] Trial 35 finished with value: 0.41805660980764314 and parameters: {'model_type': 'bayesian_ridge', 'alpha_1': 5.5601351382634644e-05, 'alpha_2': 0.0009743007788147338, 'lambda_1': 8.024128558602162e-06, 'lambda_2': 1.4714276507052533e-05}. Best is trial 30 with value: 0.7256561298327076.
[I 2025-08-20 01:56:47,430] Trial 36 finished with value: 0.6468033620365182 and parameters: {'model_type': 'rf', 'n_estimators': 197, 'max_depth': 15, 'min_samples_split': 2}. Best is trial 30 with value: 0.7256561298327076.
[I 2025-08-20 01:56:47,636] Trial 37 finished with value: 0.638493415792463 and parameters: {'model_type': 'lgbm', 'n_estimators': 82, 'max_depth': 10, 'learning_rate': 0.07983662111784587}. Best is trial 30 with value: 0.7256561298327076.
[I 2025-08-20 01:57:36,963] Trial 38 finished with value: 0.6869877900895784 and parameters: {'model_type': 'cat', 'iterations': 799, 'depth': 9, 'learning_rate': 0.180414535979141}. Best is trial 30 with value: 0.7256561298327076.
[I 2025-08-20 01:58:05,238] Trial 39 finished with value: 0.6991091402643187 and parameters: {'model_type': 'cat', 'iterations': 714, 'depth': 8, 'learning_rate': 0.12420245002480491}. Best is trial 30 with value: 0.7256561298327076.
[I 2025-08-20 01:58:05,261] Trial 40 finished with value: 0.4180549492308675 and parameters: {'model_type': 'bayesian_ridge', 'alpha_1': 0.0005501606432027413, 'alpha_2': 6.051033667817807e-05, 'lambda_1': 0.00018328902349840195, 'lambda_2': 0.00020210402800396123}. Best is trial 30 with value: 0.7256561298327076.
