[I 2025-08-20 02:46:48,087] Trial 15 finished with value: 0.7272971640353192 and parameters: {'model_type': 'cat', 'iterations': 797, 'depth': 10, 'learning_rate': 0.09205699626243641}. Best is trial 5 with value: 0.7385050852572441.
[I 2025-08-20 02:46:56,701] Trial 16 finished with value: 0.7250077509471236 and parameters: {'model_type': 'cat', 'iterations': 797, 'depth': 4, 'learning_rate': 0.08294040133165832}. Best is trial 5 with value: 0.7385050852572441.
[I 2025-08-20 02:47:11,805] Trial 17 finished with value: 0.7285746054902165 and parameters: {'model_type': 'cat', 'iterations': 733, 'depth': 10, 'learning_rate': 0.08932696963566382}. Best is trial 5 with value: 0.7385050852572441.
[I 2025-08-20 02:47:11,907] Trial 18 finished with value: 0.566281925114993 and parameters: {'model_type': 'lgbm', 'n_estimators': 107, 'max_depth': 10, 'learning_rate': 0.011220932767743191}. Best is trial 5 with value: 0.7385050852572441.
[I 2025-08-20 02:47:12,083] Trial 19 finished with value: 0.6781184280762601 and parameters: {'model_type': 'rf', 'n_estimators': 110, 'max_depth': 15, 'min_samples_split': 8}. Best is trial 5 with value: 0.7385050852572441.
[I 2025-08-20 02:47:16,023] Trial 20 finished with value: 0.6899063149356428 and parameters: {'model_type': 'xgb', 'n_estimators': 190, 'max_depth': 5, 'learning_rate': 0.19621734056735723}. Best is trial 5 with value: 0.7385050852572441.
[I 2025-08-20 02:47:27,013] Trial 21 finished with value: 0.7158645904102585 and parameters: {'model_type': 'cat', 'iterations': 789, 'depth': 10, 'learning_rate': 0.09172188084847585}. Best is trial 5 with value: 0.7385050852572441.
[I 2025-08-20 02:47:42,248] Trial 22 finished with value: 0.7316210205358674 and parameters: {'model_type': 'cat', 'iterations': 677, 'depth': 10, 'learning_rate': 0.08295311335841618}. Best is trial 5 with value: 0.7385050852572441.
[I 2025-08-20 02:47:53,896] Trial 23 finished with value: 0.7178893249890269 and parameters: {'model_type': 'cat', 'iterations': 658, 'depth': 9, 'learning_rate': 0.06726035438913668}. Best is trial 5 with value: 0.7385050852572441.
[I 2025-08-20 02:48:05,932] Trial 24 finished with value: 0.7247446422802268 and parameters: {'model_type': 'cat', 'iterations': 610, 'depth': 9, 'learning_rate': 0.11536510552613344}. Best is trial 5 with value: 0.7385050852572441.
[I 2025-08-20 02:48:05,950] Trial 25 finished with value: 0.2785285222953985 and parameters: {'model_type': 'bayesian_ridge', 'alpha_1': 0.0009315082581738392, 'alpha_2': 7.410619781859852e-05, 'lambda_1': 0.0009813895011063865, 'lambda_2': 1.5303900065628026e-05}. Best is trial 5 with value: 0.7385050852572441.
[I 2025-08-20 02:48:18,161] Trial 26 finished with value: 0.7324907279411521 and parameters: {'model_type': 'cat', 'iterations': 705, 'depth': 9, 'learning_rate': 0.1686192314585076}. Best is trial 5 with value: 0.7385050852572441.
[I 2025-08-20 02:48:26,667] Trial 27 finished with value: 0.7236960497427348 and parameters: {'model_type': 'cat', 'iterations': 603, 'depth': 9, 'learning_rate': 0.170979735226301}. Best is trial 5 with value: 0.7385050852572441.
[I 2025-08-20 02:48:33,250] Trial 28 finished with value: 0.726932029641566 and parameters: {'model_type': 'cat', 'iterations': 694, 'depth': 7, 'learning_rate': 0.20839411127121588}. Best is trial 5 with value: 0.7385050852572441.
[I 2025-08-20 02:48:33,367] Trial 29 finished with value: 0.6647166192312254 and parameters: {'model_type': 'rf', 'n_estimators': 58, 'max_depth': 12, 'min_samples_split': 2}. Best is trial 5 with value: 0.7385050852572441.
[I 2025-08-20 02:48:33,747] Trial 30 finished with value: 0.6933063995216238 and parameters: {'model_type': 'xgb', 'n_estimators': 86, 'max_depth': 5, 'learning_rate': 0.15254878803423155}. Best is trial 5 with value: 0.7385050852572441.
[I 2025-08-20 02:48:49,821] Trial 31 finished with value: 0.7254962744002338 and parameters: {'model_type': 'cat', 'iterations': 725, 'depth': 10, 'learning_rate': 0.10045013762796966}. Best is trial 5 with value: 0.7385050852572441.
[I 2025-08-20 02:49:00,428] Trial 32 finished with value: 0.7253526917594699 and parameters: {'model_type': 'cat', 'iterations': 725, 'depth': 9, 'learning_rate': 0.15977661262486562}. Best is trial 5 with value: 0.7385050852572441.
[I 2025-08-20 02:49:14,838] Trial 33 finished with value: 0.7256992749228559 and parameters: {'model_type': 'cat', 'iterations': 563, 'depth': 10, 'learning_rate': 0.06382970585432}. Best is trial 5 with value: 0.7385050852572441.
[I 2025-08-20 02:49:18,404] Trial 34 finished with value: 0.6744221464579537 and parameters: {'model_type': 'cat', 'iterations': 439, 'depth': 9, 'learning_rate': 0.1880130328406126}. Best is trial 5 with value: 0.7385050852572441.
[I 2025-08-20 02:49:33,333] Trial 35 finished with value: 0.7139078491866163 and parameters: {'model_type': 'cat', 'iterations': 737, 'depth': 10, 'learning_rate': 0.14427429362986918}. Best is trial 5 with value: 0.7385050852572441.
[I 2025-08-20 02:49:33,351] Trial 36 finished with value: 0.27852594176266765 and parameters: {'model_type': 'bayesian_ridge', 'alpha_1': 6.9524918830487885e-06, 'alpha_2': 0.0009802349892936162, 'lambda_1': 4.9113768483031214e-05, 'lambda_2': 0.00021389109824515806}. Best is trial 5 with value: 0.7385050852572441.
[I 2025-08-20 02:49:44,691] Trial 37 finished with value: 0.718811756589197 and parameters: {'model_type': 'cat', 'iterations': 659, 'depth': 9, 'learning_rate': 0.10951569208552729}. Best is trial 5 with value: 0.7385050852572441.
[I 2025-08-20 02:49:44,848] Trial 38 finished with value: 0.6818150502728705 and parameters: {'model_type': 'lgbm', 'n_estimators': 130, 'max_depth': 8, 'learning_rate': 0.03397846460555942}. Best is trial 5 with value: 0.7385050852572441.
[I 2025-08-20 02:49:57,744] Trial 39 finished with value: 0.7176995665848173 and parameters: {'model_type': 'cat', 'iterations': 580, 'depth': 10, 'learning_rate': 0.22181334036099218}. Best is trial 5 with value: 0.7385050852572441.
[I 2025-08-20 02:49:58,047] Trial 40 finished with value: 0.6770895878718415 and parameters: {'model_type': 'rf', 'n_estimators': 172, 'max_depth': 12, 'min_samples_split': 5}. Best is trial 5 with value: 0.7385050852572441.
[I 2025-08-20 02:50:11,298] Trial 41 finished with value: 0.722759671733393 and parameters: {'model_type': 'cat', 'iterations': 754, 'depth': 10, 'learning_rate': 0.07092517733683701}. Best is trial 5 with value: 0.7385050852572441.
[I 2025-08-20 02:50:27,738] Trial 42 finished with value: 0.7204542803166882 and parameters: {'model_type': 'cat', 'iterations': 769, 'depth': 10, 'learning_rate': 0.08484906688163499}. Best is trial 5 with value: 0.7385050852572441.
[I 2025-08-20 02:50:38,744] Trial 43 finished with value: 0.7136511552040613 and parameters: {'model_type': 'cat', 'iterations': 708, 'depth': 9, 'learning_rate': 0.11258445475151926}. Best is trial 5 with value: 0.7385050852572441.
[I 2025-08-20 02:50:52,301] Trial 44 finished with value: 0.723481948969915 and parameters: {'model_type': 'cat', 'iterations': 669, 'depth': 10, 'learning_rate': 0.046066534536387684}. Best is trial 5 with value: 0.7385050852572441.
[I 2025-08-20 02:50:52,320] Trial 45 finished with value: 0.27852315064308186 and parameters: {'model_type': 'bayesian_ridge', 'alpha_1': 0.0009359438663730036, 'alpha_2': 5.7191907463908056e-05, 'lambda_1': 0.0009542999345861304, 'lambda_2': 0.0005386754827459292}. Best is trial 5 with value: 0.7385050852572441.
[I 2025-08-20 02:51:03,370] Trial 46 finished with value: 0.7191862423711712 and parameters: {'model_type': 'cat', 'iterations': 754, 'depth': 9, 'learning_rate': 0.18137568504010984}. Best is trial 5 with value: 0.7385050852572441.
[I 2025-08-20 02:51:17,500] Trial 47 finished with value: 0.7328654393617123 and parameters: {'model_type': 'cat', 'iterations': 793, 'depth': 10, 'learning_rate': 0.0935755181691808}. Best is trial 5 with value: 0.7385050852572441.
[I 2025-08-20 02:51:17,546] Trial 48 finished with value: 0.7050793519756384 and parameters: {'model_type': 'lgbm', 'n_estimators': 80, 'max_depth': 4, 'learning_rate': 0.1303390078635402}. Best is trial 5 with value: 0.7385050852572441.
[I 2025-08-20 02:51:18,440] Trial 49 finished with value: 0.6993824409588945 and parameters: {'model_type': 'xgb', 'n_estimators': 136, 'max_depth': 7, 'learning_rate': 0.05795608039397779}. Best is trial 5 with value: 0.7385050852572441.
Regression Results:
  Train R²: 0.949
  Test R²: 0.739
  CV R²: 0.546 ± 0.158
Saved comparison to results/rxn_feature_comparison_hte_each_8_optuna.json

==================================================
ANALYSIS COMPLETE
==================================================
Check the following directories for outputs:
  - plots/: Visualization files
  - results/: Data files and reports
  - models/: Trained model files
