[I 2025-08-20 03:21:03,004] Trial 16 finished with value: 0.3802777952512705 and parameters: {'model_type': 'bayesian_ridge', 'alpha_1': 0.0009760821111187706, 'alpha_2': 0.0009684531639341459, 'lambda_1': 3.4095807643442838e-06, 'lambda_2': 0.0009664267743524676}. Best is trial 12 with value: 0.7413469997462603.
[I 2025-08-20 03:21:12,579] Trial 17 finished with value: 0.7357902074334645 and parameters: {'model_type': 'cat', 'iterations': 778, 'depth': 4, 'learning_rate': 0.15243497739348172}. Best is trial 12 with value: 0.7413469997462603.
[I 2025-08-20 03:21:15,213] Trial 18 finished with value: 0.694939565134077 and parameters: {'model_type': 'cat', 'iterations': 227, 'depth': 4, 'learning_rate': 0.16887073118016224}. Best is trial 12 with value: 0.7413469997462603.
[I 2025-08-20 03:21:21,687] Trial 19 finished with value: 0.6993151011369048 and parameters: {'model_type': 'cat', 'iterations': 458, 'depth': 4, 'learning_rate': 0.020291734753150437}. Best is trial 12 with value: 0.7413469997462603.
[I 2025-08-20 03:21:21,698] Trial 20 finished with value: 0.38028352860134107 and parameters: {'model_type': 'bayesian_ridge', 'alpha_1': 0.0006896873630695831, 'alpha_2': 0.0006514567567697017, 'lambda_1': 0.0009062815205144099, 'lambda_2': 9.42642171392451e-06}. Best is trial 12 with value: 0.7413469997462603.
[I 2025-08-20 03:21:36,125] Trial 21 finished with value: 0.7218645269097402 and parameters: {'model_type': 'cat', 'iterations': 787, 'depth': 10, 'learning_rate': 0.1381207312012215}. Best is trial 12 with value: 0.7413469997462603.
[I 2025-08-20 03:21:47,656] Trial 22 finished with value: 0.7275545243346635 and parameters: {'model_type': 'cat', 'iterations': 791, 'depth': 9, 'learning_rate': 0.07977763946788474}. Best is trial 12 with value: 0.7413469997462603.
[I 2025-08-20 03:21:55,038] Trial 23 finished with value: 0.7076983521009264 and parameters: {'model_type': 'cat', 'iterations': 682, 'depth': 5, 'learning_rate': 0.1488233990002148}. Best is trial 12 with value: 0.7413469997462603.
[I 2025-08-20 03:22:02,876] Trial 24 finished with value: 0.7251246263255025 and parameters: {'model_type': 'cat', 'iterations': 697, 'depth': 8, 'learning_rate': 0.0869270274194627}. Best is trial 12 with value: 0.7413469997462603.
[I 2025-08-20 03:22:03,012] Trial 25 finished with value: 0.690844143944397 and parameters: {'model_type': 'lgbm', 'n_estimators': 155, 'max_depth': 9, 'learning_rate': 0.19914901244339475}. Best is trial 12 with value: 0.7413469997462603.
[I 2025-08-20 03:22:10,704] Trial 26 finished with value: 0.7089094911758649 and parameters: {'model_type': 'cat', 'iterations': 791, 'depth': 5, 'learning_rate': 0.1077263904385825}. Best is trial 12 with value: 0.7413469997462603.
[I 2025-08-20 03:22:17,581] Trial 27 finished with value: 0.72956771940928 and parameters: {'model_type': 'cat', 'iterations': 514, 'depth': 6, 'learning_rate': 0.06017175064824894}. Best is trial 12 with value: 0.7413469997462603.
[I 2025-08-20 03:22:30,279] Trial 28 finished with value: 0.7172931623044241 and parameters: {'model_type': 'cat', 'iterations': 687, 'depth': 9, 'learning_rate': 0.16671669508374476}. Best is trial 12 with value: 0.7413469997462603.
[I 2025-08-20 03:22:31,715] Trial 29 finished with value: 0.5674125655781691 and parameters: {'model_type': 'xgb', 'n_estimators': 145, 'max_depth': 10, 'learning_rate': 0.14584432808612607}. Best is trial 12 with value: 0.7413469997462603.
[I 2025-08-20 03:22:32,014] Trial 30 finished with value: 0.7295545443410992 and parameters: {'model_type': 'lgbm', 'n_estimators': 196, 'max_depth': 4, 'learning_rate': 0.0345813629315264}. Best is trial 12 with value: 0.7413469997462603.
[I 2025-08-20 03:22:37,938] Trial 31 finished with value: 0.7186629046340687 and parameters: {'model_type': 'cat', 'iterations': 549, 'depth': 6, 'learning_rate': 0.12488774309854764}. Best is trial 12 with value: 0.7413469997462603.
[I 2025-08-20 03:22:48,421] Trial 32 finished with value: 0.7189420014303525 and parameters: {'model_type': 'cat', 'iterations': 624, 'depth': 8, 'learning_rate': 0.1075432746414911}. Best is trial 12 with value: 0.7413469997462603.
[I 2025-08-20 03:22:51,365] Trial 33 finished with value: 0.6763469198573306 and parameters: {'model_type': 'cat', 'iterations': 444, 'depth': 6, 'learning_rate': 0.1288910714926106}. Best is trial 12 with value: 0.7413469997462603.
[I 2025-08-20 03:22:59,637] Trial 34 finished with value: 0.7244480325605451 and parameters: {'model_type': 'cat', 'iterations': 738, 'depth': 8, 'learning_rate': 0.0943688672913469}. Best is trial 12 with value: 0.7413469997462603.
[I 2025-08-20 03:23:00,696] Trial 35 finished with value: 0.6066571289184457 and parameters: {'model_type': 'xgb', 'n_estimators': 140, 'max_depth': 8, 'learning_rate': 0.05400094519949}. Best is trial 12 with value: 0.7413469997462603.
[I 2025-08-20 03:23:00,750] Trial 36 finished with value: 0.7422008103121915 and parameters: {'model_type': 'lgbm', 'n_estimators': 86, 'max_depth': 3, 'learning_rate': 0.1715296806988952}. Best is trial 36 with value: 0.7422008103121915.
[I 2025-08-20 03:23:00,792] Trial 37 finished with value: 0.7525663917476926 and parameters: {'model_type': 'lgbm', 'n_estimators': 90, 'max_depth': 3, 'learning_rate': 0.2064516772725002}. Best is trial 37 with value: 0.7525663917476926.
[I 2025-08-20 03:23:00,824] Trial 38 finished with value: 0.7478794900460388 and parameters: {'model_type': 'lgbm', 'n_estimators': 90, 'max_depth': 3, 'learning_rate': 0.232498503245977}. Best is trial 37 with value: 0.7525663917476926.
[I 2025-08-20 03:23:00,856] Trial 39 finished with value: 0.7359712131911371 and parameters: {'model_type': 'lgbm', 'n_estimators': 82, 'max_depth': 3, 'learning_rate': 0.23367855923570546}. Best is trial 37 with value: 0.7525663917476926.
[I 2025-08-20 03:23:00,896] Trial 40 finished with value: 0.7234483346363095 and parameters: {'model_type': 'lgbm', 'n_estimators': 92, 'max_depth': 4, 'learning_rate': 0.2211910822085487}. Best is trial 37 with value: 0.7525663917476926.
[I 2025-08-20 03:23:00,928] Trial 41 finished with value: 0.7479833413837162 and parameters: {'model_type': 'lgbm', 'n_estimators': 87, 'max_depth': 3, 'learning_rate': 0.2273889275192006}. Best is trial 37 with value: 0.7525663917476926.
[I 2025-08-20 03:23:00,954] Trial 42 finished with value: 0.7450676125977258 and parameters: {'model_type': 'lgbm', 'n_estimators': 53, 'max_depth': 3, 'learning_rate': 0.2395423782908585}. Best is trial 37 with value: 0.7525663917476926.
[I 2025-08-20 03:23:00,980] Trial 43 finished with value: 0.7369083332844093 and parameters: {'model_type': 'lgbm', 'n_estimators': 56, 'max_depth': 3, 'learning_rate': 0.2546100223056719}. Best is trial 37 with value: 0.7525663917476926.
[I 2025-08-20 03:23:01,013] Trial 44 finished with value: 0.7393775946333326 and parameters: {'model_type': 'lgbm', 'n_estimators': 94, 'max_depth': 3, 'learning_rate': 0.22854516488263368}. Best is trial 37 with value: 0.7525663917476926.
[I 2025-08-20 03:23:01,049] Trial 45 finished with value: 0.7303201331047477 and parameters: {'model_type': 'lgbm', 'n_estimators': 71, 'max_depth': 4, 'learning_rate': 0.27944160429822007}. Best is trial 37 with value: 0.7525663917476926.
[I 2025-08-20 03:23:01,078] Trial 46 finished with value: 0.7539455774289641 and parameters: {'model_type': 'lgbm', 'n_estimators': 73, 'max_depth': 3, 'learning_rate': 0.19291917191052815}. Best is trial 46 with value: 0.7539455774289641.
[I 2025-08-20 03:23:01,119] Trial 47 finished with value: 0.7213358011009843 and parameters: {'model_type': 'lgbm', 'n_estimators': 68, 'max_depth': 5, 'learning_rate': 0.20418143710160058}. Best is trial 46 with value: 0.7539455774289641.
[I 2025-08-20 03:23:01,149] Trial 48 finished with value: 0.7313219971406153 and parameters: {'model_type': 'lgbm', 'n_estimators': 52, 'max_depth': 4, 'learning_rate': 0.2445011979860034}. Best is trial 46 with value: 0.7539455774289641.
[I 2025-08-20 03:23:01,180] Trial 49 finished with value: 0.7472603221553364 and parameters: {'model_type': 'lgbm', 'n_estimators': 69, 'max_depth': 3, 'learning_rate': 0.18818964071370786}. Best is trial 46 with value: 0.7539455774289641.
Regression Results:
  Train R²: 0.847
  Test R²: 0.754
  CV R²: 0.508 ± 0.231
Failed to save comparison file: Object of type ndarray is not JSON serializable

==================================================
ANALYSIS COMPLETE
==================================================
Check the following directories for outputs:
  - plots/: Visualization files
  - results/: Data files and reports
  - models/: Trained model files
