=== ML Measurable HTE Rate Bias Analysis ===

==================================================
Running HTE Prediction Analysis: each with 8 features
==================================================

=== Loading Data ===
Number of HTE rates: 1031
Found 5 hydrogen-dependent features: ['num_Hs', 'BV_Hs_avg', 'Charges_Hs_avg', 'fukui_E_Hs_avg', 'fukui_N_Hs_avg']
Found 2 pKa-dependent features: ['pka_aHs', 'pka_lowest']
Found 26 heteroatom-dependent features: ['BV_main_1', 'Charges_main_atom', 'fukui_E_main_atom', 'fukui_N_main_atom', 'L_main_atom_1', 'L_main_atom_2', 'B1_main_atom_1', 'B1_main_atom_2', 'B5_main_atom_1', 'B5_main_atom_2', 'Charges_secondary_1', 'Charges_secondary_2', 'fukui_N_secondary_1', 'fukui_N_secondary_2', 'Charges_secondary_avg', 'fukui_N_secondary_avg', 'FCS_1', 'FREQS_1', 'FCS_2', 'FREQS_2', 'FCS_avg', 'FREQS_avg', 'BV_Hs_avg', 'Charges_Hs_avg', 'fukui_E_Hs_avg', 'fukui_N_Hs_avg']

Processing num_Hs conditional features...
  18/46 molecules meet condition num_Hs
    num_Hs: 0 -> 0 NA values
    BV_Hs_avg: 28 -> 0 NA values
    Charges_Hs_avg: 28 -> 0 NA values
    fukui_E_Hs_avg: 28 -> 0 NA values
    fukui_N_Hs_avg: 28 -> 0 NA values

Processing pKa_features conditional features...
  18/46 molecules meet condition pKa_features
    Processing pKa feature pka_aHs with special handling...
      Created indicator: has_acidic_H_for_pka_aHs
      Created interaction: pka_aHs_x_has_acidic_H
      Used 50.0 for molecules without acidic H
    pka_aHs: 28 -> 0 NA values
    Processing pKa feature pka_lowest with special handling...
      Created indicator: has_acidic_H_for_pka_lowest
      Created interaction: pka_lowest_x_has_acidic_H
      Used 50.0 for molecules without acidic H
    pka_lowest: 38 -> 0 NA values

Handling remaining NA values...

Encoding categorical features...
  Removed identifier feature: name
  Found categorical feature class with 4 unique values: ['aromatic' 'hetero' 'aliphatic' 'mixture']
    One-hot encoded class -> 4 features: ['class_aliphatic', 'class_aromatic', 'class_hetero', 'class_mixture']
  Removed identifier feature: smiles
  Processed 1 categorical features
  Removed 2 identifier features: ['name', 'smiles']

Creating feature quality indicators...
  Added indicator: has_num_Hs
  Added indicator: has_pKa_features
Preprocessing complete. Shape: (46, 65)
Remaining NA values: 0
Found 1 pKa-dependent features: ['pka_basic']
Warning: num_Hs column not found, cannot properly handle pKa features
Found 15 heteroatom-dependent features: ['BV_main_1', 'Charges_main_atom', 'fukui_E_main_atom', 'fukui_N_main_atom', 'L_main_atom_1', 'B1_main_atom_1', 'B5_main_atom_1', 'Charges_secondary_1', 'fukui_N_secondary_1', 'Charges_secondary_avg', 'fukui_N_secondary_avg', 'FCS_1', 'FREQS_1', 'FCS_avg', 'FREQS_avg']

Handling remaining NA values...
  pka_basic: Filled 1 NA values with median/zero
  smiles: Filled 1 NA values with mode/unknown
  class: Filled 1 NA values with mode/unknown

Encoding categorical features...
  Removed identifier feature: name
  Removed identifier feature: smiles
  Found categorical feature class with 5 unique values: ['1_aliphatic' '1_aromatic' '2_aliphatic' '1_mixture' '2_mixture']
    One-hot encoded class -> 5 features: ['class_1_aliphatic', 'class_1_aromatic', 'class_1_mixture', 'class_2_aliphatic', 'class_2_mixture']
  Processed 1 categorical features
  Removed 2 identifier features: ['name', 'smiles']

Creating feature quality indicators...
Preprocessing complete. Shape: (55, 40)
Remaining NA values: 0
Loaded reaction energy features: 1488 rows, 8 features

=== Selecting Features (selected) ===
Final selected features (8): ['acyl_BV_secondary_2', 'amine_pka_basic', 'acyl_class_aromatic', 'acyl_Charges_secondary_1', 'acyl_pka_aHs_x_has_acidic_H', 'amine_BV_secondary_avg', 'amine_Charges_secondary_1', 'amine_class_1_mixture']
=== Building HTE Prediction Models with 8 features ===
Selected features: ['acyl_BV_secondary_2', 'amine_pka_basic', 'acyl_class_aromatic', 'acyl_Charges_secondary_1', 'acyl_pka_aHs_x_has_acidic_H', 'amine_BV_secondary_avg', 'amine_Charges_secondary_1', 'amine_class_1_mixture']
Valid features: 17
=== Building Regression Model ===
Regression dataset: (1031, 17)
Target range: -1.418 to 4.010


Training data: 619 samples
Test data: 206 samples


Train-only SFS selected 16 features for regression
Running hyperparameter optimization for regression...
[I 2025-08-20 03:33:27,244] A new study created in memory with name: no-name-1676146c-ef88-434b-b6f8-c74db3d1c34b
[I 2025-08-20 03:33:31,379] Trial 0 finished with value: 0.7459598334378164 and parameters: {'model_type': 'cat', 'iterations': 762, 'depth': 4, 'learning_rate': 0.24427030373262043}. Best is trial 0 with value: 0.7459598334378164.
[I 2025-08-20 03:33:36,027] Trial 1 finished with value: 0.7566175211202801 and parameters: {'model_type': 'cat', 'iterations': 407, 'depth': 9, 'learning_rate': 0.07018045131462732}. Best is trial 1 with value: 0.7566175211202801.
[I 2025-08-20 03:33:42,421] Trial 2 finished with value: 0.7306222902772207 and parameters: {'model_type': 'cat', 'iterations': 411, 'depth': 10, 'learning_rate': 0.11270399258101492}. Best is trial 1 with value: 0.7566175211202801.
[I 2025-08-20 03:33:42,938] Trial 3 finished with value: 0.7865669098237511 and parameters: {'model_type': 'rf', 'n_estimators': 178, 'max_depth': 12, 'min_samples_split': 8}. Best is trial 3 with value: 0.7865669098237511.
[I 2025-08-20 03:33:43,087] Trial 4 finished with value: 0.7690995827576311 and parameters: {'model_type': 'rf', 'n_estimators': 59, 'max_depth': 7, 'min_samples_split': 3}. Best is trial 3 with value: 0.7865669098237511.
[I 2025-08-20 03:33:43,244] Trial 5 finished with value: 0.7790685438972007 and parameters: {'model_type': 'rf', 'n_estimators': 55, 'max_depth': 11, 'min_samples_split': 8}. Best is trial 3 with value: 0.7865669098237511.
[I 2025-08-20 03:33:43,347] Trial 6 finished with value: -650.3465123075091 and parameters: {'model_type': 'bayesian_ridge', 'alpha_1': 8.344583858356903e-06, 'alpha_2': 8.871695967767593e-05, 'lambda_1': 0.0006935215264842525, 'lambda_2': 0.0005092048035095118}. Best is trial 3 with value: 0.7865669098237511.
[I 2025-08-20 03:33:47,183] Trial 7 finished with value: 0.767984686236138 and parameters: {'model_type': 'xgb', 'n_estimators': 172, 'max_depth': 8, 'learning_rate': 0.03469141785312251}. Best is trial 3 with value: 0.7865669098237511.
[I 2025-08-20 03:33:47,327] Trial 8 finished with value: 0.7450931179984424 and parameters: {'model_type': 'rf', 'n_estimators': 64, 'max_depth': 6, 'min_samples_split': 9}. Best is trial 3 with value: 0.7865669098237511.
[I 2025-08-20 03:33:50,167] Trial 9 finished with value: 0.7528441225968646 and parameters: {'model_type': 'xgb', 'n_estimators': 53, 'max_depth': 10, 'learning_rate': 0.1809870111412092}. Best is trial 3 with value: 0.7865669098237511.
[I 2025-08-20 03:33:50,657] Trial 10 finished with value: 0.742079282662191 and parameters: {'model_type': 'lgbm', 'n_estimators': 195, 'max_depth': 3, 'learning_rate': 0.2978551817826174}. Best is trial 3 with value: 0.7865669098237511.
[I 2025-08-20 03:33:51,093] Trial 11 finished with value: 0.7871296991584595 and parameters: {'model_type': 'rf', 'n_estimators': 126, 'max_depth': 15, 'min_samples_split': 8}. Best is trial 11 with value: 0.7871296991584595.
[I 2025-08-20 03:33:51,490] Trial 12 finished with value: 0.7887754025437064 and parameters: {'model_type': 'rf', 'n_estimators': 129, 'max_depth': 15, 'min_samples_split': 7}. Best is trial 12 with value: 0.7887754025437064.
[I 2025-08-20 03:33:51,884] Trial 13 finished with value: 0.7896523190702012 and parameters: {'model_type': 'rf', 'n_estimators': 121, 'max_depth': 15, 'min_samples_split': 5}. Best is trial 13 with value: 0.7896523190702012.
[I 2025-08-20 03:33:52,048] Trial 14 finished with value: 0.767780098738563 and parameters: {'model_type': 'lgbm', 'n_estimators': 118, 'max_depth': 10, 'learning_rate': 0.15347737209966528}. Best is trial 13 with value: 0.7896523190702012.
[I 2025-08-20 03:33:52,061] Trial 15 finished with value: -652.7957594988677 and parameters: {'model_type': 'bayesian_ridge', 'alpha_1': 0.0009685582933698656, 'alpha_2': 0.0009977930978517077, 'lambda_1': 7.018348349174065e-05, 'lambda_2': 9.53786353012571e-05}. Best is trial 13 with value: 0.7896523190702012.
[I 2025-08-20 03:33:52,480] Trial 16 finished with value: 0.7895819939420636 and parameters: {'model_type': 'rf', 'n_estimators': 120, 'max_depth': 15, 'min_samples_split': 5}. Best is trial 13 with value: 0.7896523190702012.
[I 2025-08-20 03:33:52,808] Trial 17 finished with value: 0.789508686185924 and parameters: {'model_type': 'rf', 'n_estimators': 100, 'max_depth': 13, 'min_samples_split': 4}. Best is trial 13 with value: 0.7896523190702012.
[I 2025-08-20 03:33:53,285] Trial 18 finished with value: 0.7896825717282359 and parameters: {'model_type': 'rf', 'n_estimators': 149, 'max_depth': 14, 'min_samples_split': 5}. Best is trial 18 with value: 0.7896825717282359.
[I 2025-08-20 03:33:56,701] Trial 19 finished with value: 0.7562200808539405 and parameters: {'model_type': 'xgb', 'n_estimators': 155, 'max_depth': 3, 'learning_rate': 0.21892832719385164}. Best is trial 18 with value: 0.7896825717282359.
[I 2025-08-20 03:33:56,712] Trial 20 finished with value: -647.4037358650705 and parameters: {'model_type': 'bayesian_ridge', 'alpha_1': 0.0004155161157232431, 'alpha_2': 0.0007033631052169051, 'lambda_1': 0.0009605263316506548, 'lambda_2': 0.0009940572907740958}. Best is trial 18 with value: 0.7896825717282359.
[I 2025-08-20 03:33:57,020] Trial 21 finished with value: 0.7870877644194274 and parameters: {'model_type': 'rf', 'n_estimators': 98, 'max_depth': 14, 'min_samples_split': 5}. Best is trial 18 with value: 0.7896825717282359.
[I 2025-08-20 03:33:57,465] Trial 22 finished with value: 0.7883943449046575 and parameters: {'model_type': 'rf', 'n_estimators': 144, 'max_depth': 13, 'min_samples_split': 5}. Best is trial 18 with value: 0.7896825717282359.
[I 2025-08-20 03:33:57,746] Trial 23 finished with value: 0.7902366164237216 and parameters: {'model_type': 'rf', 'n_estimators': 91, 'max_depth': 15, 'min_samples_split': 6}. Best is trial 23 with value: 0.7902366164237216.
[I 2025-08-20 03:33:58,016] Trial 24 finished with value: 0.7862028059870088 and parameters: {'model_type': 'rf', 'n_estimators': 87, 'max_depth': 13, 'min_samples_split': 6}. Best is trial 23 with value: 0.7902366164237216.
[I 2025-08-20 03:33:58,107] Trial 25 finished with value: 0.6876571186919631 and parameters: {'model_type': 'lgbm', 'n_estimators': 84, 'max_depth': 5, 'learning_rate': 0.01950851269361356}. Best is trial 23 with value: 0.7902366164237216.
[I 2025-08-20 03:33:58,643] Trial 26 finished with value: 0.7919789534836778 and parameters: {'model_type': 'rf', 'n_estimators': 147, 'max_depth': 14, 'min_samples_split': 3}. Best is trial 26 with value: 0.7919789534836778.
[I 2025-08-20 03:33:59,171] Trial 27 finished with value: 0.7894087477169839 and parameters: {'model_type': 'rf', 'n_estimators': 148, 'max_depth': 12, 'min_samples_split': 2}. Best is trial 26 with value: 0.7919789534836778.
[I 2025-08-20 03:33:59,776] Trial 28 finished with value: 0.7908031395094047 and parameters: {'model_type': 'rf', 'n_estimators': 163, 'max_depth': 14, 'min_samples_split': 3}. Best is trial 26 with value: 0.7919789534836778.
Warning: less than 75% GPU memory available for training. Free: 3879.125 Total: 81155.75
[I 2025-08-20 03:34:14,041] Trial 29 finished with value: 0.7460390105942243 and parameters: {'model_type': 'cat', 'iterations': 794, 'depth': 5, 'learning_rate': 0.295229720135067}. Best is trial 26 with value: 0.7919789534836778.
[I 2025-08-20 03:34:18,187] Trial 30 finished with value: 0.7638020052079575 and parameters: {'model_type': 'xgb', 'n_estimators': 162, 'max_depth': 9, 'learning_rate': 0.10717008276770387}. Best is trial 26 with value: 0.7919789534836778.
[I 2025-08-20 03:34:18,656] Trial 31 finished with value: 0.7925306129740697 and parameters: {'model_type': 'rf', 'n_estimators': 138, 'max_depth': 14, 'min_samples_split': 3}. Best is trial 31 with value: 0.7925306129740697.
[I 2025-08-20 03:34:19,169] Trial 32 finished with value: 0.7905908051848782 and parameters: {'model_type': 'rf', 'n_estimators': 142, 'max_depth': 14, 'min_samples_split': 2}. Best is trial 31 with value: 0.7925306129740697.
Warning: less than 75% GPU memory available for training. Free: 8921.25 Total: 81155.75
[I 2025-08-20 03:34:20,602] Trial 33 finished with value: 0.7684835477017357 and parameters: {'model_type': 'cat', 'iterations': 265, 'depth': 7, 'learning_rate': 0.22051317454185632}. Best is trial 31 with value: 0.7925306129740697.
[I 2025-08-20 03:34:21,114] Trial 34 finished with value: 0.7884996703362055 and parameters: {'model_type': 'rf', 'n_estimators': 136, 'max_depth': 12, 'min_samples_split': 2}. Best is trial 31 with value: 0.7925306129740697.
[I 2025-08-20 03:34:28,111] Trial 35 finished with value: 0.7616292531176833 and parameters: {'model_type': 'cat', 'iterations': 577, 'depth': 7, 'learning_rate': 0.15250870928351368}. Best is trial 31 with value: 0.7925306129740697.
[I 2025-08-20 03:34:28,802] Trial 36 finished with value: 0.7924005897170717 and parameters: {'model_type': 'rf', 'n_estimators': 166, 'max_depth': 14, 'min_samples_split': 3}. Best is trial 31 with value: 0.7925306129740697.
[I 2025-08-20 03:34:29,588] Trial 37 finished with value: 0.7917333112228679 and parameters: {'model_type': 'rf', 'n_estimators': 167, 'max_depth': 13, 'min_samples_split': 3}. Best is trial 31 with value: 0.7925306129740697.
[I 2025-08-20 03:34:29,616] Trial 38 finished with value: -653.202869513062 and parameters: {'model_type': 'bayesian_ridge', 'alpha_1': 0.0009954792087596685, 'alpha_2': 2.4566688993373268e-05, 'lambda_1': 2.954223827201602e-05, 'lambda_2': 2.7081574694362283e-05}. Best is trial 31 with value: 0.7925306129740697.
[I 2025-08-20 03:34:30,983] Trial 39 finished with value: 0.7915322435147331 and parameters: {'model_type': 'rf', 'n_estimators': 186, 'max_depth': 13, 'min_samples_split': 3}. Best is trial 31 with value: 0.7925306129740697.
[I 2025-08-20 03:34:34,338] Trial 40 finished with value: 0.7637162979283189 and parameters: {'model_type': 'lgbm', 'n_estimators': 176, 'max_depth': 9, 'learning_rate': 0.07447121160286738}. Best is trial 31 with value: 0.7925306129740697.
[I 2025-08-20 03:34:35,699] Trial 41 finished with value: 0.7919910475948103 and parameters: {'model_type': 'rf', 'n_estimators': 191, 'max_depth': 13, 'min_samples_split': 3}. Best is trial 31 with value: 0.7925306129740697.
[I 2025-08-20 03:34:37,051] Trial 42 finished with value: 0.7924042236137838 and parameters: {'model_type': 'rf', 'n_estimators': 167, 'max_depth': 12, 'min_samples_split': 3}. Best is trial 31 with value: 0.7925306129740697.
[I 2025-08-20 03:34:38,288] Trial 43 finished with value: 0.7881893977558485 and parameters: {'model_type': 'rf', 'n_estimators': 184, 'max_depth': 11, 'min_samples_split': 4}. Best is trial 31 with value: 0.7925306129740697.
[I 2025-08-20 03:34:39,507] Trial 44 finished with value: 0.7910284983150215 and parameters: {'model_type': 'rf', 'n_estimators': 200, 'max_depth': 12, 'min_samples_split': 4}. Best is trial 31 with value: 0.7925306129740697.
[I 2025-08-20 03:34:41,175] Trial 45 finished with value: 0.7888485716522531 and parameters: {'model_type': 'rf', 'n_estimators': 157, 'max_depth': 11, 'min_samples_split': 3}. Best is trial 31 with value: 0.7925306129740697.
[I 2025-08-20 03:34:43,884] Trial 46 finished with value: 0.7909567145061133 and parameters: {'model_type': 'rf', 'n_estimators': 184, 'max_depth': 14, 'min_samples_split': 4}. Best is trial 31 with value: 0.7925306129740697.
[I 2025-08-20 03:34:46,507] Trial 47 finished with value: 0.7548851391519651 and parameters: {'model_type': 'xgb', 'n_estimators': 174, 'max_depth': 6, 'learning_rate': 0.26031571038762785}. Best is trial 31 with value: 0.7925306129740697.
[I 2025-08-20 03:34:49,470] Trial 48 finished with value: 0.7912936004118278 and parameters: {'model_type': 'rf', 'n_estimators': 192, 'max_depth': 12, 'min_samples_split': 2}. Best is trial 31 with value: 0.7925306129740697.
[I 2025-08-20 03:34:49,533] Trial 49 finished with value: -647.4455908459103 and parameters: {'model_type': 'bayesian_ridge', 'alpha_1': 0.0005298920091759295, 'alpha_2': 0.0004056372522097262, 'lambda_1': 0.00039903774293997113, 'lambda_2': 0.0009676591885023606}. Best is trial 31 with value: 0.7925306129740697.
Regression Results:
  Train R²: 0.954
  Test R²: 0.793
  CV R²: 0.485 ± 0.153

=== Generating Visualizations ===
=== Evaluating Random Forest with Parity Plots ===
Model Performance:
  Train R²: 0.954, MAE: 0.143, RMSE: 0.206
  Test R²: 0.793, MAE: 0.313, RMSE: 0.405
Generating parity plots...
Parity plot saved as: plots/parity_plot_random_forest_train_each_8_optuna_train.png
Parity plot saved as: plots/parity_plot_random_forest_test_each_8_optuna_test.png
Parity analysis plot saved as: plots/parity_analysis_random_forest_test_each_8_optuna_analysis.png
Saved predictions to results/predictions_each_8_optuna.csv
Saved combined dataset to results/combined_df_each_8_optuna.csv
Models saved with suffix: _each_8_optuna
HTE prediction evaluation report saved to results/reports/hte_prediction_report_manual_8_each_8_optuna.txt

=== Comparing without reaction-energy features (HTE prediction) ===
=== Building HTE Prediction Models with 8 features ===
Selected features: ['acyl_BV_secondary_2', 'amine_pka_basic', 'acyl_class_aromatic', 'acyl_Charges_secondary_1', 'acyl_pka_aHs_x_has_acidic_H', 'amine_BV_secondary_avg', 'amine_Charges_secondary_1', 'amine_class_1_mixture']
Valid features: 9
=== Building Regression Model ===
Regression dataset: (1031, 9)
Target range: -1.418 to 4.010


Training data: 619 samples
Test data: 206 samples


Train-only SFS selected 8 features for regression
Running hyperparameter optimization for regression...
[I 2025-08-20 03:39:18,077] A new study created in memory with name: no-name-7ab7df2c-3b0c-4ea5-ba9b-cbd215589b90
[I 2025-08-20 03:40:27,164] Trial 0 finished with value: 0.8058410729521328 and parameters: {'model_type': 'cat', 'iterations': 229, 'depth': 9, 'learning_rate': 0.14411502739444546}. Best is trial 0 with value: 0.8058410729521328.
[I 2025-08-20 03:40:32,328] Trial 1 finished with value: 0.7958770147353051 and parameters: {'model_type': 'rf', 'n_estimators': 134, 'max_depth': 11, 'min_samples_split': 9}. Best is trial 0 with value: 0.8058410729521328.
[I 2025-08-20 03:40:40,525] Trial 2 finished with value: 0.6974713822165852 and parameters: {'model_type': 'lgbm', 'n_estimators': 58, 'max_depth': 8, 'learning_rate': 0.026384664351362025}. Best is trial 0 with value: 0.8058410729521328.
[I 2025-08-20 03:40:40,608] Trial 3 finished with value: 0.502863863322679 and parameters: {'model_type': 'bayesian_ridge', 'alpha_1': 0.0005184729451779764, 'alpha_2': 0.0006940844480153573, 'lambda_1': 0.0009120736859743003, 'lambda_2': 6.504537571580288e-06}. Best is trial 0 with value: 0.8058410729521328.
[I 2025-08-20 03:45:18,142] Trial 4 finished with value: 0.8000775406630696 and parameters: {'model_type': 'cat', 'iterations': 738, 'depth': 10, 'learning_rate': 0.2596789832296801}. Best is trial 0 with value: 0.8058410729521328.
[I 2025-08-20 03:45:35,096] Trial 5 finished with value: 0.7814592813711659 and parameters: {'model_type': 'lgbm', 'n_estimators': 150, 'max_depth': 6, 'learning_rate': 0.05348872118431589}. Best is trial 0 with value: 0.8058410729521328.
[I 2025-08-20 03:45:45,426] Trial 6 finished with value: 0.7803642003292711 and parameters: {'model_type': 'lgbm', 'n_estimators': 108, 'max_depth': 7, 'learning_rate': 0.039592937158985}. Best is trial 0 with value: 0.8058410729521328.
[I 2025-08-20 03:45:47,090] Trial 7 finished with value: 0.7619339666114364 and parameters: {'model_type': 'xgb', 'n_estimators': 137, 'max_depth': 9, 'learning_rate': 0.22314973548771835}. Best is trial 0 with value: 0.8058410729521328.
[I 2025-08-20 03:45:47,681] Trial 8 finished with value: 0.7912630055967734 and parameters: {'model_type': 'xgb', 'n_estimators': 104, 'max_depth': 4, 'learning_rate': 0.22063083240069575}. Best is trial 0 with value: 0.8058410729521328.
[I 2025-08-20 03:46:12,314] Trial 9 finished with value: 0.7936336832185484 and parameters: {'model_type': 'cat', 'iterations': 448, 'depth': 7, 'learning_rate': 0.06904784931322401}. Best is trial 0 with value: 0.8058410729521328.
[I 2025-08-20 03:46:37,878] Trial 10 finished with value: 0.7916381743581709 and parameters: {'model_type': 'cat', 'iterations': 206, 'depth': 10, 'learning_rate': 0.13563029864595316}. Best is trial 0 with value: 0.8058410729521328.
[I 2025-08-20 03:48:28,861] Trial 11 finished with value: 0.7993530123389393 and parameters: {'model_type': 'cat', 'iterations': 692, 'depth': 10, 'learning_rate': 0.29825552642345854}. Best is trial 0 with value: 0.8058410729521328.
[I 2025-08-20 03:54:43,879] Trial 12 finished with value: 0.8081763015339553 and parameters: {'model_type': 'cat', 'iterations': 786, 'depth': 9, 'learning_rate': 0.13989070725373798}. Best is trial 12 with value: 0.8081763015339553.
[I 2025-08-20 03:54:53,753] Trial 13 finished with value: 0.8058138751053116 and parameters: {'model_type': 'cat', 'iterations': 215, 'depth': 4, 'learning_rate': 0.14529791244442716}. Best is trial 12 with value: 0.8081763015339553.
[I 2025-08-20 03:54:53,881] Trial 14 finished with value: 0.5028581998827917 and parameters: {'model_type': 'bayesian_ridge', 'alpha_1': 0.0009969168846771894, 'alpha_2': 1.0137183408759115e-05, 'lambda_1': 2.618361396912938e-05, 'lambda_2': 0.0009366153656335048}. Best is trial 12 with value: 0.8081763015339553.
