[I 2025-08-20 02:49:39,429] Trial 15 finished with value: 0.697963378258883 and parameters: {'model_type': 'lgbm', 'n_estimators': 50, 'max_depth': 5, 'learning_rate': 0.10589688452252406}. Best is trial 3 with value: 0.717761701566976.
[I 2025-08-20 02:49:42,559] Trial 16 finished with value: 0.6843283964856993 and parameters: {'model_type': 'cat', 'iterations': 202, 'depth': 10, 'learning_rate': 0.2325639565518386}. Best is trial 3 with value: 0.717761701566976.
[I 2025-08-20 02:49:42,646] Trial 17 finished with value: 0.696079490865825 and parameters: {'model_type': 'lgbm', 'n_estimators': 96, 'max_depth': 8, 'learning_rate': 0.19499607057982554}. Best is trial 3 with value: 0.717761701566976.
[I 2025-08-20 02:49:46,911] Trial 18 finished with value: 0.6926199954120829 and parameters: {'model_type': 'cat', 'iterations': 467, 'depth': 6, 'learning_rate': 0.13419080935226127}. Best is trial 3 with value: 0.717761701566976.
[I 2025-08-20 02:49:47,172] Trial 19 finished with value: 0.6753213191700349 and parameters: {'model_type': 'rf', 'n_estimators': 131, 'max_depth': 14, 'min_samples_split': 2}. Best is trial 3 with value: 0.717761701566976.
[I 2025-08-20 02:49:47,183] Trial 20 finished with value: 0.2785185979204944 and parameters: {'model_type': 'bayesian_ridge', 'alpha_1': 0.0009716608686137849, 'alpha_2': 0.00038553402398408933, 'lambda_1': 0.0004765994980778153, 'lambda_2': 0.0009577604068099189}. Best is trial 3 with value: 0.717761701566976.
[I 2025-08-20 02:49:47,258] Trial 21 finished with value: 0.7184066922538924 and parameters: {'model_type': 'lgbm', 'n_estimators': 116, 'max_depth': 5, 'learning_rate': 0.2501783834899364}. Best is trial 21 with value: 0.7184066922538924.
[I 2025-08-20 02:49:47,297] Trial 22 finished with value: 0.725329616195008 and parameters: {'model_type': 'lgbm', 'n_estimators': 87, 'max_depth': 5, 'learning_rate': 0.25636891977039206}. Best is trial 22 with value: 0.725329616195008.
[I 2025-08-20 02:49:47,344] Trial 23 finished with value: 0.7257510871996565 and parameters: {'model_type': 'lgbm', 'n_estimators': 85, 'max_depth': 5, 'learning_rate': 0.25601861457741837}. Best is trial 23 with value: 0.7257510871996565.
[I 2025-08-20 02:49:47,380] Trial 24 finished with value: 0.701326336628151 and parameters: {'model_type': 'lgbm', 'n_estimators': 80, 'max_depth': 5, 'learning_rate': 0.2626420581775612}. Best is trial 23 with value: 0.7257510871996565.
[I 2025-08-20 02:49:47,425] Trial 25 finished with value: 0.7185743533313904 and parameters: {'model_type': 'lgbm', 'n_estimators': 120, 'max_depth': 5, 'learning_rate': 0.2502013591188805}. Best is trial 23 with value: 0.7257510871996565.
[I 2025-08-20 02:49:47,502] Trial 26 finished with value: 0.7027167117182347 and parameters: {'model_type': 'lgbm', 'n_estimators': 132, 'max_depth': 7, 'learning_rate': 0.17156917045023812}. Best is trial 23 with value: 0.7257510871996565.
[I 2025-08-20 02:49:47,533] Trial 27 finished with value: 0.7061575413940477 and parameters: {'model_type': 'lgbm', 'n_estimators': 84, 'max_depth': 4, 'learning_rate': 0.22077459664757837}. Best is trial 23 with value: 0.7257510871996565.
[I 2025-08-20 02:49:47,571] Trial 28 finished with value: 0.7103220120755203 and parameters: {'model_type': 'lgbm', 'n_estimators': 120, 'max_depth': 4, 'learning_rate': 0.2822916772063723}. Best is trial 23 with value: 0.7257510871996565.
[I 2025-08-20 02:49:47,667] Trial 29 finished with value: 0.6873772895206299 and parameters: {'model_type': 'lgbm', 'n_estimators': 200, 'max_depth': 6, 'learning_rate': 0.2545422603982552}. Best is trial 23 with value: 0.7257510871996565.
[I 2025-08-20 02:49:47,702] Trial 30 finished with value: 0.7044236949644698 and parameters: {'model_type': 'lgbm', 'n_estimators': 78, 'max_depth': 5, 'learning_rate': 0.13215916156219565}. Best is trial 23 with value: 0.7257510871996565.
[I 2025-08-20 02:49:47,747] Trial 31 finished with value: 0.6997182646710319 and parameters: {'model_type': 'lgbm', 'n_estimators': 118, 'max_depth': 5, 'learning_rate': 0.2454580303540208}. Best is trial 23 with value: 0.7257510871996565.
[I 2025-08-20 02:49:47,807] Trial 32 finished with value: 0.7041832968663131 and parameters: {'model_type': 'lgbm', 'n_estimators': 109, 'max_depth': 5, 'learning_rate': 0.2767530127292683}. Best is trial 23 with value: 0.7257510871996565.
[I 2025-08-20 02:49:47,875] Trial 33 finished with value: 0.6830724530386573 and parameters: {'model_type': 'lgbm', 'n_estimators': 139, 'max_depth': 7, 'learning_rate': 0.23925202733871542}. Best is trial 23 with value: 0.7257510871996565.
[I 2025-08-20 02:49:48,029] Trial 34 finished with value: 0.6760085734835279 and parameters: {'model_type': 'rf', 'n_estimators': 92, 'max_depth': 13, 'min_samples_split': 10}. Best is trial 23 with value: 0.7257510871996565.
[I 2025-08-20 02:49:48,077] Trial 35 finished with value: 0.7262113341789649 and parameters: {'model_type': 'lgbm', 'n_estimators': 116, 'max_depth': 4, 'learning_rate': 0.19706412322446115}. Best is trial 35 with value: 0.7262113341789649.
[I 2025-08-20 02:49:48,105] Trial 36 finished with value: 0.7097521444796938 and parameters: {'model_type': 'lgbm', 'n_estimators': 65, 'max_depth': 4, 'learning_rate': 0.19579051034339492}. Best is trial 35 with value: 0.7262113341789649.
[I 2025-08-20 02:49:49,131] Trial 37 finished with value: 0.6811959376411403 and parameters: {'model_type': 'xgb', 'n_estimators': 101, 'max_depth': 4, 'learning_rate': 0.2211435148937896}. Best is trial 35 with value: 0.7262113341789649.
[I 2025-08-20 02:49:49,209] Trial 38 finished with value: 0.6902391846178288 and parameters: {'model_type': 'lgbm', 'n_estimators': 149, 'max_depth': 6, 'learning_rate': 0.04279313491451539}. Best is trial 35 with value: 0.7262113341789649.
[I 2025-08-20 02:49:49,351] Trial 39 finished with value: 0.41972836370151123 and parameters: {'model_type': 'rf', 'n_estimators': 126, 'max_depth': 3, 'min_samples_split': 2}. Best is trial 35 with value: 0.7262113341789649.
[I 2025-08-20 02:49:49,363] Trial 40 finished with value: 0.27852738529729437 and parameters: {'model_type': 'bayesian_ridge', 'alpha_1': 2.37987303329308e-05, 'alpha_2': 0.0009737924068815597, 'lambda_1': 0.000985120699636754, 'lambda_2': 0.00012829768507987297}. Best is trial 35 with value: 0.7262113341789649.
[I 2025-08-20 02:49:49,427] Trial 41 finished with value: 0.7105342592821204 and parameters: {'model_type': 'lgbm', 'n_estimators': 115, 'max_depth': 5, 'learning_rate': 0.2544386567187627}. Best is trial 35 with value: 0.7262113341789649.
[I 2025-08-20 02:49:49,465] Trial 42 finished with value: 0.7263206195403682 and parameters: {'model_type': 'lgbm', 'n_estimators': 90, 'max_depth': 4, 'learning_rate': 0.2838725496938924}. Best is trial 42 with value: 0.7263206195403682.
[I 2025-08-20 02:49:49,511] Trial 43 finished with value: 0.7164019062846193 and parameters: {'model_type': 'lgbm', 'n_estimators': 88, 'max_depth': 4, 'learning_rate': 0.2818153841076259}. Best is trial 42 with value: 0.7263206195403682.
[I 2025-08-20 02:49:49,603] Trial 44 finished with value: 0.7097009659325151 and parameters: {'model_type': 'xgb', 'n_estimators': 74, 'max_depth': 3, 'learning_rate': 0.2759497954277173}. Best is trial 42 with value: 0.7263206195403682.
[I 2025-08-20 02:49:49,637] Trial 45 finished with value: 0.6987703583904128 and parameters: {'model_type': 'lgbm', 'n_estimators': 58, 'max_depth': 4, 'learning_rate': 0.201580121603064}. Best is trial 42 with value: 0.7263206195403682.
[I 2025-08-20 02:49:49,674] Trial 46 finished with value: 0.7039055893023702 and parameters: {'model_type': 'lgbm', 'n_estimators': 98, 'max_depth': 3, 'learning_rate': 0.17798544322957363}. Best is trial 42 with value: 0.7263206195403682.
[I 2025-08-20 02:49:49,718] Trial 47 finished with value: 0.7175138113925719 and parameters: {'model_type': 'lgbm', 'n_estimators': 90, 'max_depth': 4, 'learning_rate': 0.23056835234022371}. Best is trial 42 with value: 0.7263206195403682.
[I 2025-08-20 02:49:49,780] Trial 48 finished with value: 0.711204800976758 and parameters: {'model_type': 'lgbm', 'n_estimators': 160, 'max_depth': 5, 'learning_rate': 0.26722343821193917}. Best is trial 42 with value: 0.7263206195403682.
[I 2025-08-20 02:49:49,892] Trial 49 finished with value: 0.6617923898804501 and parameters: {'model_type': 'xgb', 'n_estimators': 71, 'max_depth': 6, 'learning_rate': 0.2998280607869863}. Best is trial 42 with value: 0.7263206195403682.
Regression Results:
  Train R²: 0.929
  Test R²: 0.726
  CV R²: 0.522 ± 0.223
Saved comparison to results/rxn_feature_comparison_hte_each_8_optuna.json

==================================================
ANALYSIS COMPLETE
==================================================
Check the following directories for outputs:
  - plots/: Visualization files
  - results/: Data files and reports
  - models/: Trained model files
