=== ML Measurable HTE Rate Bias Analysis ===

==================================================
Running HTE Prediction Analysis: each with 8 features
==================================================

=== Loading Data ===
Number of HTE rates: 1031
Found 5 hydrogen-dependent features: ['num_Hs', 'BV_Hs_avg', 'Charges_Hs_avg', 'fukui_E_Hs_avg', 'fukui_N_Hs_avg']
Found 2 pKa-dependent features: ['pka_aHs', 'pka_lowest']
Found 26 heteroatom-dependent features: ['BV_main_1', 'Charges_main_atom', 'fukui_E_main_atom', 'fukui_N_main_atom', 'L_main_atom_1', 'L_main_atom_2', 'B1_main_atom_1', 'B1_main_atom_2', 'B5_main_atom_1', 'B5_main_atom_2', 'Charges_secondary_1', 'Charges_secondary_2', 'fukui_N_secondary_1', 'fukui_N_secondary_2', 'Charges_secondary_avg', 'fukui_N_secondary_avg', 'FCS_1', 'FREQS_1', 'FCS_2', 'FREQS_2', 'FCS_avg', 'FREQS_avg', 'BV_Hs_avg', 'Charges_Hs_avg', 'fukui_E_Hs_avg', 'fukui_N_Hs_avg']

Processing num_Hs conditional features...
  18/46 molecules meet condition num_Hs
    num_Hs: 0 -> 0 NA values
    BV_Hs_avg: 28 -> 0 NA values
    Charges_Hs_avg: 28 -> 0 NA values
    fukui_E_Hs_avg: 28 -> 0 NA values
    fukui_N_Hs_avg: 28 -> 0 NA values

Processing pKa_features conditional features...
  18/46 molecules meet condition pKa_features
    Processing pKa feature pka_aHs with special handling...
      Created indicator: has_acidic_H_for_pka_aHs
      Created interaction: pka_aHs_x_has_acidic_H
      Used 50.0 for molecules without acidic H
    pka_aHs: 28 -> 0 NA values
    Processing pKa feature pka_lowest with special handling...
      Created indicator: has_acidic_H_for_pka_lowest
      Created interaction: pka_lowest_x_has_acidic_H
      Used 50.0 for molecules without acidic H
    pka_lowest: 38 -> 0 NA values

Handling remaining NA values...

Encoding categorical features...
  Removed identifier feature: name
  Found categorical feature class with 4 unique values: ['aromatic' 'hetero' 'aliphatic' 'mixture']
    One-hot encoded class -> 4 features: ['class_aliphatic', 'class_aromatic', 'class_hetero', 'class_mixture']
  Removed identifier feature: smiles
  Processed 1 categorical features
  Removed 2 identifier features: ['name', 'smiles']

Creating feature quality indicators...
  Added indicator: has_num_Hs
  Added indicator: has_pKa_features
Preprocessing complete. Shape: (46, 65)
Remaining NA values: 0
Found 1 pKa-dependent features: ['pka_basic']
Warning: num_Hs column not found, cannot properly handle pKa features
Found 15 heteroatom-dependent features: ['BV_main_1', 'Charges_main_atom', 'fukui_E_main_atom', 'fukui_N_main_atom', 'L_main_atom_1', 'B1_main_atom_1', 'B5_main_atom_1', 'Charges_secondary_1', 'fukui_N_secondary_1', 'Charges_secondary_avg', 'fukui_N_secondary_avg', 'FCS_1', 'FREQS_1', 'FCS_avg', 'FREQS_avg']

Handling remaining NA values...
  pka_basic: Filled 1 NA values with median/zero
  smiles: Filled 1 NA values with mode/unknown
  class: Filled 1 NA values with mode/unknown

Encoding categorical features...
  Removed identifier feature: name
  Removed identifier feature: smiles
  Found categorical feature class with 5 unique values: ['1_aliphatic' '1_aromatic' '2_aliphatic' '1_mixture' '2_mixture']
    One-hot encoded class -> 5 features: ['class_1_aliphatic', 'class_1_aromatic', 'class_1_mixture', 'class_2_aliphatic', 'class_2_mixture']
  Processed 1 categorical features
  Removed 2 identifier features: ['name', 'smiles']

Creating feature quality indicators...
Preprocessing complete. Shape: (55, 40)
Remaining NA values: 0
Loaded reaction energy features: 1488 rows, 8 features

=== Selecting Features (selected) ===
Final selected features (8): ['acyl_Charges_secondary_1', 'amine_Charges_secondary_1', 'amine_BV_secondary_avg', 'amine_pka_basic', 'amine_class_1_mixture', 'acyl_pka_aHs_x_has_acidic_H', 'acyl_class_aromatic', 'acyl_BV_secondary_2']
=== Building HTE Prediction Models with 8 features ===
Selected features: ['acyl_Charges_secondary_1', 'amine_Charges_secondary_1', 'amine_BV_secondary_avg', 'amine_pka_basic', 'amine_class_1_mixture', 'acyl_pka_aHs_x_has_acidic_H', 'acyl_class_aromatic', 'acyl_BV_secondary_2']
Valid features: 17
=== Building Regression Model ===
Regression dataset: (1031, 17)
Target range: -1.418 to 4.010


Training data: 619 samples
Test data: 206 samples


Train-only SFS selected 16 features for regression
Running hyperparameter optimization for regression...
[I 2025-08-20 05:07:48,093] A new study created in memory with name: no-name-0e027fd0-c5db-4f17-8039-4299e9f97705
[I 2025-08-20 05:07:48,657] Trial 0 finished with value: 0.7588332318763803 and parameters: {'model_type': 'lgbm', 'n_estimators': 90, 'max_depth': 10, 'learning_rate': 0.16318647716148846}. Best is trial 0 with value: 0.7588332318763803.
[I 2025-08-20 05:07:50,020] Trial 1 finished with value: 0.7691606007569844 and parameters: {'model_type': 'xgb', 'n_estimators': 86, 'max_depth': 5, 'learning_rate': 0.06332939728429049}. Best is trial 1 with value: 0.7691606007569844.
[I 2025-08-20 05:07:50,295] Trial 2 finished with value: 0.7701196054634125 and parameters: {'model_type': 'xgb', 'n_estimators': 193, 'max_depth': 6, 'learning_rate': 0.10007845989166748}. Best is trial 2 with value: 0.7701196054634125.
[I 2025-08-20 05:08:07,498] Trial 3 finished with value: 0.7658894435596442 and parameters: {'model_type': 'cat', 'iterations': 599, 'depth': 10, 'learning_rate': 0.06975130255119007}. Best is trial 2 with value: 0.7701196054634125.
[I 2025-08-20 05:08:07,819] Trial 4 finished with value: 0.7516792062202804 and parameters: {'model_type': 'rf', 'n_estimators': 117, 'max_depth': 13, 'min_samples_split': 10}. Best is trial 2 with value: 0.7701196054634125.
[I 2025-08-20 05:08:08,445] Trial 5 finished with value: 0.7582875465983125 and parameters: {'model_type': 'xgb', 'n_estimators': 116, 'max_depth': 6, 'learning_rate': 0.15190778606702815}. Best is trial 2 with value: 0.7701196054634125.
[I 2025-08-20 05:08:12,720] Trial 6 finished with value: 0.7733219383346532 and parameters: {'model_type': 'xgb', 'n_estimators': 153, 'max_depth': 6, 'learning_rate': 0.06741207608275034}. Best is trial 6 with value: 0.7733219383346532.
[I 2025-08-20 05:08:13,073] Trial 7 finished with value: 0.7579371076185257 and parameters: {'model_type': 'lgbm', 'n_estimators': 118, 'max_depth': 9, 'learning_rate': 0.036583455023512436}. Best is trial 6 with value: 0.7733219383346532.
[I 2025-08-20 05:08:13,149] Trial 8 finished with value: 0.7410797340142317 and parameters: {'model_type': 'lgbm', 'n_estimators': 119, 'max_depth': 7, 'learning_rate': 0.2593634665205136}. Best is trial 6 with value: 0.7733219383346532.
[I 2025-08-20 05:08:13,239] Trial 9 finished with value: 0.7879768369916742 and parameters: {'model_type': 'xgb', 'n_estimators': 80, 'max_depth': 4, 'learning_rate': 0.1492432404750945}. Best is trial 9 with value: 0.7879768369916742.
[I 2025-08-20 05:08:13,288] Trial 10 finished with value: 0.5866905158745532 and parameters: {'model_type': 'bayesian_ridge', 'alpha_1': 0.0009189439728939032, 'alpha_2': 0.0007257010408463341, 'lambda_1': 0.00010268865352102487, 'lambda_2': 0.00023833854956296425}. Best is trial 9 with value: 0.7879768369916742.
[I 2025-08-20 05:08:13,439] Trial 11 finished with value: 0.7816829740467851 and parameters: {'model_type': 'xgb', 'n_estimators': 175, 'max_depth': 3, 'learning_rate': 0.16215083158881577}. Best is trial 9 with value: 0.7879768369916742.
[I 2025-08-20 05:08:13,494] Trial 12 finished with value: 0.7595206599634325 and parameters: {'model_type': 'xgb', 'n_estimators': 50, 'max_depth': 3, 'learning_rate': 0.19869865555855964}. Best is trial 9 with value: 0.7879768369916742.
[I 2025-08-20 05:08:14,008] Trial 13 finished with value: 0.7732455023570889 and parameters: {'model_type': 'cat', 'iterations': 200, 'depth': 4, 'learning_rate': 0.21938502670563}. Best is trial 9 with value: 0.7879768369916742.
[I 2025-08-20 05:08:14,021] Trial 14 finished with value: 0.5866939340445962 and parameters: {'model_type': 'bayesian_ridge', 'alpha_1': 8.29782070589332e-06, 'alpha_2': 4.292447425353874e-05, 'lambda_1': 0.0009713838479011691, 'lambda_2': 0.0009146424765157357}. Best is trial 9 with value: 0.7879768369916742.
[I 2025-08-20 05:08:14,409] Trial 15 finished with value: 0.7858305618294991 and parameters: {'model_type': 'xgb', 'n_estimators': 173, 'max_depth': 3, 'learning_rate': 0.12596747407622594}. Best is trial 9 with value: 0.7879768369916742.
[I 2025-08-20 05:08:14,632] Trial 16 finished with value: 0.5346397767114256 and parameters: {'model_type': 'rf', 'n_estimators': 152, 'max_depth': 3, 'min_samples_split': 2}. Best is trial 9 with value: 0.7879768369916742.
[I 2025-08-20 05:08:14,841] Trial 17 finished with value: 0.7704163396465565 and parameters: {'model_type': 'xgb', 'n_estimators': 60, 'max_depth': 4, 'learning_rate': 0.11686000843038327}. Best is trial 9 with value: 0.7879768369916742.
[I 2025-08-20 05:08:15,329] Trial 18 finished with value: 0.7854748787604647 and parameters: {'model_type': 'xgb', 'n_estimators': 148, 'max_depth': 4, 'learning_rate': 0.1195592957285714}. Best is trial 9 with value: 0.7879768369916742.
[I 2025-08-20 05:08:15,560] Trial 19 finished with value: 0.7499989224387924 and parameters: {'model_type': 'rf', 'n_estimators': 83, 'max_depth': 9, 'min_samples_split': 6}. Best is trial 9 with value: 0.7879768369916742.
[I 2025-08-20 05:08:15,569] Trial 20 finished with value: 0.5866892848800314 and parameters: {'model_type': 'bayesian_ridge', 'alpha_1': 0.00041650594213076355, 'alpha_2': 0.000967810272641713, 'lambda_1': 0.0006593424316313752, 'lambda_2': 2.1868621473189183e-05}. Best is trial 9 with value: 0.7879768369916742.
[I 2025-08-20 05:08:16,059] Trial 21 finished with value: 0.7826392331451493 and parameters: {'model_type': 'xgb', 'n_estimators': 148, 'max_depth': 4, 'learning_rate': 0.11834486130729684}. Best is trial 9 with value: 0.7879768369916742.
[I 2025-08-20 05:08:16,241] Trial 22 finished with value: 0.7830063163991522 and parameters: {'model_type': 'xgb', 'n_estimators': 172, 'max_depth': 4, 'learning_rate': 0.1361959631101991}. Best is trial 9 with value: 0.7879768369916742.
[I 2025-08-20 05:08:16,405] Trial 23 finished with value: 0.7649827881052125 and parameters: {'model_type': 'xgb', 'n_estimators': 140, 'max_depth': 5, 'learning_rate': 0.19365882740608736}. Best is trial 9 with value: 0.7879768369916742.
[I 2025-08-20 05:08:18,659] Trial 24 finished with value: 0.7828697449725897 and parameters: {'model_type': 'xgb', 'n_estimators': 172, 'max_depth': 4, 'learning_rate': 0.09169771062503478}. Best is trial 9 with value: 0.7879768369916742.
[I 2025-08-20 05:08:28,515] Trial 25 finished with value: 0.7805968089259953 and parameters: {'model_type': 'cat', 'iterations': 777, 'depth': 7, 'learning_rate': 0.29685243947815493}. Best is trial 9 with value: 0.7879768369916742.
[I 2025-08-20 05:08:29,393] Trial 26 finished with value: 0.7591845640092107 and parameters: {'model_type': 'xgb', 'n_estimators': 199, 'max_depth': 5, 'learning_rate': 0.1867819001212042}. Best is trial 9 with value: 0.7879768369916742.
[I 2025-08-20 05:08:29,706] Trial 27 finished with value: 0.5959977320302436 and parameters: {'model_type': 'xgb', 'n_estimators': 137, 'max_depth': 3, 'learning_rate': 0.012961761293816279}. Best is trial 9 with value: 0.7879768369916742.
[I 2025-08-20 05:08:30,247] Trial 28 finished with value: 0.7776125684942709 and parameters: {'model_type': 'xgb', 'n_estimators': 163, 'max_depth': 4, 'learning_rate': 0.12831699627057047}. Best is trial 9 with value: 0.7879768369916742.
[I 2025-08-20 05:08:30,398] Trial 29 finished with value: 0.7543389806202577 and parameters: {'model_type': 'lgbm', 'n_estimators': 183, 'max_depth': 5, 'learning_rate': 0.08863215343780403}. Best is trial 9 with value: 0.7879768369916742.
[I 2025-08-20 05:08:30,726] Trial 30 finished with value: 0.7516627111462885 and parameters: {'model_type': 'rf', 'n_estimators': 103, 'max_depth': 15, 'min_samples_split': 10}. Best is trial 9 with value: 0.7879768369916742.
[I 2025-08-20 05:08:30,904] Trial 31 finished with value: 0.7867078864189986 and parameters: {'model_type': 'xgb', 'n_estimators': 165, 'max_depth': 4, 'learning_rate': 0.14098376329260479}. Best is trial 9 with value: 0.7879768369916742.
[I 2025-08-20 05:08:31,028] Trial 32 finished with value: 0.7824463925978704 and parameters: {'model_type': 'xgb', 'n_estimators': 163, 'max_depth': 3, 'learning_rate': 0.1512061520744259}. Best is trial 9 with value: 0.7879768369916742.
[I 2025-08-20 05:08:31,158] Trial 33 finished with value: 0.7776169516902102 and parameters: {'model_type': 'xgb', 'n_estimators': 137, 'max_depth': 4, 'learning_rate': 0.1789494222601289}. Best is trial 9 with value: 0.7879768369916742.
[I 2025-08-20 05:08:31,286] Trial 34 finished with value: 0.7752133865640121 and parameters: {'model_type': 'xgb', 'n_estimators': 163, 'max_depth': 3, 'learning_rate': 0.13583038975598133}. Best is trial 9 with value: 0.7879768369916742.
[I 2025-08-20 05:08:34,001] Trial 35 finished with value: 0.7743273481078952 and parameters: {'model_type': 'cat', 'iterations': 262, 'depth': 4, 'learning_rate': 0.1080482502161107}. Best is trial 9 with value: 0.7879768369916742.
[I 2025-08-20 05:08:34,813] Trial 36 finished with value: 0.7743869395712675 and parameters: {'model_type': 'xgb', 'n_estimators': 186, 'max_depth': 5, 'learning_rate': 0.14334680163340144}. Best is trial 9 with value: 0.7879768369916742.
[I 2025-08-20 05:08:35,252] Trial 37 finished with value: 0.7330968629805905 and parameters: {'model_type': 'xgb', 'n_estimators': 67, 'max_depth': 7, 'learning_rate': 0.16452919604037294}. Best is trial 9 with value: 0.7879768369916742.
[I 2025-08-20 05:08:35,375] Trial 38 finished with value: 0.7532045407880824 and parameters: {'model_type': 'lgbm', 'n_estimators': 100, 'max_depth': 4, 'learning_rate': 0.2361020661138665}. Best is trial 9 with value: 0.7879768369916742.
[I 2025-08-20 05:08:35,387] Trial 39 finished with value: 0.5866934222924287 and parameters: {'model_type': 'bayesian_ridge', 'alpha_1': 0.0009704745841210335, 'alpha_2': 0.00017789454776782378, 'lambda_1': 1.2402141801331969e-05, 'lambda_2': 0.0007889341146578297}. Best is trial 9 with value: 0.7879768369916742.
[I 2025-08-20 05:08:36,020] Trial 40 finished with value: 0.7535019471146245 and parameters: {'model_type': 'xgb', 'n_estimators': 144, 'max_depth': 5, 'learning_rate': 0.17449436998446138}. Best is trial 9 with value: 0.7879768369916742.
[I 2025-08-20 05:08:36,235] Trial 41 finished with value: 0.7859640384089699 and parameters: {'model_type': 'xgb', 'n_estimators': 174, 'max_depth': 4, 'learning_rate': 0.13169968510498725}. Best is trial 9 with value: 0.7879768369916742.
[I 2025-08-20 05:08:36,410] Trial 42 finished with value: 0.7833192192257554 and parameters: {'model_type': 'xgb', 'n_estimators': 186, 'max_depth': 4, 'learning_rate': 0.12333670479537485}. Best is trial 9 with value: 0.7879768369916742.
[I 2025-08-20 05:08:36,513] Trial 43 finished with value: 0.7661768026903748 and parameters: {'model_type': 'xgb', 'n_estimators': 129, 'max_depth': 3, 'learning_rate': 0.08272244556513662}. Best is trial 9 with value: 0.7879768369916742.
[I 2025-08-20 05:08:36,661] Trial 44 finished with value: 0.7830765487875776 and parameters: {'model_type': 'xgb', 'n_estimators': 157, 'max_depth': 4, 'learning_rate': 0.10545977061559399}. Best is trial 9 with value: 0.7879768369916742.
[I 2025-08-20 05:08:36,861] Trial 45 finished with value: 0.7828184824169522 and parameters: {'model_type': 'xgb', 'n_estimators': 173, 'max_depth': 5, 'learning_rate': 0.15137270561119556}. Best is trial 9 with value: 0.7879768369916742.
[I 2025-08-20 05:08:39,161] Trial 46 finished with value: 0.7323463981695137 and parameters: {'model_type': 'cat', 'iterations': 424, 'depth': 10, 'learning_rate': 0.134780821198175}. Best is trial 9 with value: 0.7879768369916742.
[I 2025-08-20 05:08:39,364] Trial 47 finished with value: 0.7642892545369511 and parameters: {'model_type': 'lgbm', 'n_estimators': 180, 'max_depth': 6, 'learning_rate': 0.07939841573988278}. Best is trial 9 with value: 0.7879768369916742.
[I 2025-08-20 05:08:39,960] Trial 48 finished with value: 0.755415212910872 and parameters: {'model_type': 'rf', 'n_estimators': 165, 'max_depth': 12, 'min_samples_split': 2}. Best is trial 9 with value: 0.7879768369916742.
[I 2025-08-20 05:08:42,020] Trial 49 finished with value: 0.7614216912727452 and parameters: {'model_type': 'xgb', 'n_estimators': 129, 'max_depth': 3, 'learning_rate': 0.05597005387623254}. Best is trial 9 with value: 0.7879768369916742.
Regression Results:
  Train R²: 0.946
  Test R²: 0.788
  CV R²: 0.423 ± 0.222

=== Generating Visualizations ===
=== Evaluating XGBoost with Parity Plots ===
Model Performance:
  Train R²: 0.946, MAE: 0.153, RMSE: 0.210
  Test R²: 0.788, MAE: 0.329, RMSE: 0.442
Generating parity plots...
Parity plot saved as: plots/parity_plot_xgboost_train_each_8_optuna_ens7_gpu1_train.png
Parity plot saved as: plots/parity_plot_xgboost_test_each_8_optuna_ens7_gpu1_test.png
Parity analysis plot saved as: plots/parity_analysis_xgboost_test_each_8_optuna_ens7_gpu1_analysis.png
Saved predictions to results/predictions_each_8_optuna_ens7_gpu1.csv
Saved combined dataset to results/combined_df_each_8_optuna_ens7_gpu1.csv
Models saved with suffix: _each_8_optuna_ens7_gpu1
HTE prediction evaluation report saved to results/reports/hte_prediction_report_manual_8_each_8_optuna_ens7_gpu1.txt

=== Comparing without reaction-energy features (HTE prediction) ===
=== Building HTE Prediction Models with 8 features ===
Selected features: ['acyl_Charges_secondary_1', 'amine_Charges_secondary_1', 'amine_BV_secondary_avg', 'amine_pka_basic', 'amine_class_1_mixture', 'acyl_pka_aHs_x_has_acidic_H', 'acyl_class_aromatic', 'acyl_BV_secondary_2']
Valid features: 9
=== Building Regression Model ===
Regression dataset: (1031, 9)
Target range: -1.418 to 4.010


Training data: 619 samples
Test data: 206 samples


Train-only SFS selected 8 features for regression
Running hyperparameter optimization for regression...
[I 2025-08-20 05:08:58,488] A new study created in memory with name: no-name-587c64c6-4956-421b-95f6-215e6b1cd0cb
[I 2025-08-20 05:08:58,556] Trial 0 finished with value: 0.6687206901521308 and parameters: {'model_type': 'rf', 'n_estimators': 60, 'max_depth': 5, 'min_samples_split': 10}. Best is trial 0 with value: 0.6687206901521308.
[I 2025-08-20 05:08:58,688] Trial 1 finished with value: 0.7738700585246235 and parameters: {'model_type': 'lgbm', 'n_estimators': 119, 'max_depth': 6, 'learning_rate': 0.02627987486895412}. Best is trial 1 with value: 0.7738700585246235.
[I 2025-08-20 05:08:58,728] Trial 2 finished with value: 0.7888963964201561 and parameters: {'model_type': 'lgbm', 'n_estimators': 200, 'max_depth': 3, 'learning_rate': 0.2757748841528248}. Best is trial 2 with value: 0.7888963964201561.
[I 2025-08-20 05:09:00,997] Trial 3 finished with value: 0.7710564741948733 and parameters: {'model_type': 'cat', 'iterations': 496, 'depth': 8, 'learning_rate': 0.2934151419674225}. Best is trial 2 with value: 0.7888963964201561.
[I 2025-08-20 05:09:01,046] Trial 4 finished with value: 0.7791629452691076 and parameters: {'model_type': 'lgbm', 'n_estimators': 74, 'max_depth': 7, 'learning_rate': 0.041623044358455805}. Best is trial 2 with value: 0.7888963964201561.
[I 2025-08-20 05:09:01,071] Trial 5 finished with value: 0.8108547252261825 and parameters: {'model_type': 'lgbm', 'n_estimators': 66, 'max_depth': 5, 'learning_rate': 0.21431197694241125}. Best is trial 5 with value: 0.8108547252261825.
[I 2025-08-20 05:09:01,074] Trial 6 finished with value: 0.4577862274279334 and parameters: {'model_type': 'bayesian_ridge', 'alpha_1': 0.0009168168574563908, 'alpha_2': 0.0007966887802702349, 'lambda_1': 0.0008339922585510796, 'lambda_2': 0.0006244217124487636}. Best is trial 5 with value: 0.8108547252261825.
[I 2025-08-20 05:09:01,076] Trial 7 finished with value: 0.4577815122672513 and parameters: {'model_type': 'bayesian_ridge', 'alpha_1': 0.0009502259411685779, 'alpha_2': 0.0008877391144116934, 'lambda_1': 0.00012398729828314194, 'lambda_2': 0.00023438975563268405}. Best is trial 5 with value: 0.8108547252261825.
[I 2025-08-20 05:09:03,254] Trial 8 finished with value: 0.7374873936857191 and parameters: {'model_type': 'xgb', 'n_estimators': 67, 'max_depth': 9, 'learning_rate': 0.02927098114004125}. Best is trial 5 with value: 0.8108547252261825.
[I 2025-08-20 05:09:03,412] Trial 9 finished with value: 0.5155895725363162 and parameters: {'model_type': 'rf', 'n_estimators': 173, 'max_depth': 3, 'min_samples_split': 10}. Best is trial 5 with value: 0.8108547252261825.
[I 2025-08-20 05:09:03,712] Trial 10 finished with value: 0.7604994832670291 and parameters: {'model_type': 'xgb', 'n_estimators': 114, 'max_depth': 10, 'learning_rate': 0.1819303767310588}. Best is trial 5 with value: 0.8108547252261825.
[I 2025-08-20 05:09:03,759] Trial 11 finished with value: 0.7975213620239724 and parameters: {'model_type': 'lgbm', 'n_estimators': 198, 'max_depth': 3, 'learning_rate': 0.2653866826425046}. Best is trial 5 with value: 0.8108547252261825.
[I 2025-08-20 05:09:03,806] Trial 12 finished with value: 0.7918938318951272 and parameters: {'model_type': 'lgbm', 'n_estimators': 156, 'max_depth': 4, 'learning_rate': 0.20608532086016737}. Best is trial 5 with value: 0.8108547252261825.
[I 2025-08-20 05:09:03,843] Trial 13 finished with value: 0.8085208153892753 and parameters: {'model_type': 'lgbm', 'n_estimators': 90, 'max_depth': 5, 'learning_rate': 0.22712445302416637}. Best is trial 5 with value: 0.8108547252261825.
[I 2025-08-20 05:09:08,554] Trial 14 finished with value: 0.7878259330517529 and parameters: {'model_type': 'cat', 'iterations': 782, 'depth': 5, 'learning_rate': 0.13966394291897596}. Best is trial 5 with value: 0.8108547252261825.
