[I 2025-08-20 04:33:13,098] Trial 17 finished with value: 0.44139520629216533 and parameters: {'model_type': 'bayesian_ridge', 'alpha_1': 7.775750972910465e-05, 'alpha_2': 0.00013609363615377863, 'lambda_1': 6.739901927722147e-05, 'lambda_2': 2.6517305998302316e-05}. Best is trial 16 with value: 0.7681281733542267.
[I 2025-08-20 04:33:13,149] Trial 18 finished with value: 0.752023241254081 and parameters: {'model_type': 'lgbm', 'n_estimators': 51, 'max_depth': 9, 'learning_rate': 0.20792551778960705}. Best is trial 16 with value: 0.7681281733542267.
[I 2025-08-20 04:33:18,087] Trial 19 finished with value: 0.7574085374367827 and parameters: {'model_type': 'cat', 'iterations': 213, 'depth': 8, 'learning_rate': 0.20922303773370732}. Best is trial 16 with value: 0.7681281733542267.
[I 2025-08-20 04:33:21,260] Trial 20 finished with value: 0.7699496399057776 and parameters: {'model_type': 'cat', 'iterations': 341, 'depth': 7, 'learning_rate': 0.02380112505703097}. Best is trial 20 with value: 0.7699496399057776.
[I 2025-08-20 04:33:24,474] Trial 21 finished with value: 0.7696100753388475 and parameters: {'model_type': 'cat', 'iterations': 343, 'depth': 7, 'learning_rate': 0.023604247660500094}. Best is trial 20 with value: 0.7699496399057776.
[I 2025-08-20 04:33:29,674] Trial 22 finished with value: 0.7735999474669667 and parameters: {'model_type': 'cat', 'iterations': 394, 'depth': 7, 'learning_rate': 0.02531919210339002}. Best is trial 22 with value: 0.7735999474669667.
[I 2025-08-20 04:33:32,975] Trial 23 finished with value: 0.7689783372229007 and parameters: {'model_type': 'cat', 'iterations': 366, 'depth': 7, 'learning_rate': 0.03661797728577525}. Best is trial 22 with value: 0.7735999474669667.
[I 2025-08-20 04:33:36,297] Trial 24 finished with value: 0.7707093115412709 and parameters: {'model_type': 'cat', 'iterations': 382, 'depth': 7, 'learning_rate': 0.024178297410972067}. Best is trial 22 with value: 0.7735999474669667.
[I 2025-08-20 04:33:36,310] Trial 25 finished with value: 0.4413840445564887 and parameters: {'model_type': 'bayesian_ridge', 'alpha_1': 0.0004657706441017402, 'alpha_2': 0.0009972121050438657, 'lambda_1': 0.0009974842919278518, 'lambda_2': 0.0009316116455098378}. Best is trial 22 with value: 0.7735999474669667.
[I 2025-08-20 04:33:39,792] Trial 26 finished with value: 0.7613877764896834 and parameters: {'model_type': 'cat', 'iterations': 417, 'depth': 8, 'learning_rate': 0.0689044810100762}. Best is trial 22 with value: 0.7735999474669667.
[I 2025-08-20 04:33:39,904] Trial 27 finished with value: 0.6550941019260834 and parameters: {'model_type': 'lgbm', 'n_estimators': 200, 'max_depth': 3, 'learning_rate': 0.011522332556862162}. Best is trial 22 with value: 0.7735999474669667.
[I 2025-08-20 04:33:47,328] Trial 28 finished with value: 0.7659040173064338 and parameters: {'model_type': 'cat', 'iterations': 790, 'depth': 6, 'learning_rate': 0.05023561274177836}. Best is trial 22 with value: 0.7735999474669667.
[I 2025-08-20 04:33:51,021] Trial 29 finished with value: 0.7670685319422202 and parameters: {'model_type': 'cat', 'iterations': 440, 'depth': 8, 'learning_rate': 0.08381801528046626}. Best is trial 22 with value: 0.7735999474669667.
[I 2025-08-20 04:33:54,813] Trial 30 finished with value: 0.7678304850558452 and parameters: {'model_type': 'cat', 'iterations': 314, 'depth': 10, 'learning_rate': 0.04002624996855833}. Best is trial 22 with value: 0.7735999474669667.
[I 2025-08-20 04:33:58,000] Trial 31 finished with value: 0.7638622360915854 and parameters: {'model_type': 'cat', 'iterations': 341, 'depth': 7, 'learning_rate': 0.020415840136371877}. Best is trial 22 with value: 0.7735999474669667.
[I 2025-08-20 04:34:01,394] Trial 32 finished with value: 0.7723572818320417 and parameters: {'model_type': 'cat', 'iterations': 427, 'depth': 7, 'learning_rate': 0.03533609781301056}. Best is trial 22 with value: 0.7735999474669667.
[I 2025-08-20 04:34:02,253] Trial 33 finished with value: 0.6479615809693504 and parameters: {'model_type': 'xgb', 'n_estimators': 111, 'max_depth': 8, 'learning_rate': 0.017030258539777333}. Best is trial 22 with value: 0.7735999474669667.
[I 2025-08-20 04:34:04,735] Trial 34 finished with value: 0.7738042569511387 and parameters: {'model_type': 'cat', 'iterations': 445, 'depth': 6, 'learning_rate': 0.06439208056790126}. Best is trial 34 with value: 0.7738042569511387.
[I 2025-08-20 04:34:04,863] Trial 35 finished with value: 0.7506740859465935 and parameters: {'model_type': 'lgbm', 'n_estimators': 160, 'max_depth': 7, 'learning_rate': 0.06367483997366631}. Best is trial 34 with value: 0.7738042569511387.
[I 2025-08-20 04:34:05,717] Trial 36 finished with value: 0.6596682588073013 and parameters: {'model_type': 'xgb', 'n_estimators': 82, 'max_depth': 10, 'learning_rate': 0.041530074677242346}. Best is trial 34 with value: 0.7738042569511387.
[I 2025-08-20 04:34:09,525] Trial 37 finished with value: 0.7643883241949911 and parameters: {'model_type': 'cat', 'iterations': 458, 'depth': 6, 'learning_rate': 0.07894335729258317}. Best is trial 34 with value: 0.7738042569511387.
[I 2025-08-20 04:34:09,717] Trial 38 finished with value: 0.7303310684581465 and parameters: {'model_type': 'rf', 'n_estimators': 117, 'max_depth': 15, 'min_samples_split': 6}. Best is trial 34 with value: 0.7738042569511387.
[I 2025-08-20 04:34:09,726] Trial 39 finished with value: 0.44139528183371146 and parameters: {'model_type': 'bayesian_ridge', 'alpha_1': 0.0008926618198527398, 'alpha_2': 2.614635100665701e-06, 'lambda_1': 7.615307707243028e-06, 'lambda_2': 1.4758882012518655e-05}. Best is trial 34 with value: 0.7738042569511387.
[I 2025-08-20 04:34:13,018] Trial 40 finished with value: 0.7755645596153838 and parameters: {'model_type': 'cat', 'iterations': 478, 'depth': 6, 'learning_rate': 0.04730776856698775}. Best is trial 40 with value: 0.7755645596153838.
[I 2025-08-20 04:34:16,405] Trial 41 finished with value: 0.7668645083916978 and parameters: {'model_type': 'cat', 'iterations': 482, 'depth': 6, 'learning_rate': 0.04686946824801047}. Best is trial 40 with value: 0.7755645596153838.
[I 2025-08-20 04:34:19,565] Trial 42 finished with value: 0.7729711915593434 and parameters: {'model_type': 'cat', 'iterations': 395, 'depth': 6, 'learning_rate': 0.06071782586397652}. Best is trial 40 with value: 0.7755645596153838.
[I 2025-08-20 04:34:22,862] Trial 43 finished with value: 0.7769744221710975 and parameters: {'model_type': 'cat', 'iterations': 419, 'depth': 6, 'learning_rate': 0.063975355825208}. Best is trial 43 with value: 0.7769744221710975.
[I 2025-08-20 04:34:26,259] Trial 44 finished with value: 0.7709723987270282 and parameters: {'model_type': 'cat', 'iterations': 494, 'depth': 6, 'learning_rate': 0.08173139493507063}. Best is trial 43 with value: 0.7769744221710975.
[I 2025-08-20 04:34:26,516] Trial 45 finished with value: 0.7327249940039505 and parameters: {'model_type': 'rf', 'n_estimators': 159, 'max_depth': 13, 'min_samples_split': 6}. Best is trial 43 with value: 0.7769744221710975.
[I 2025-08-20 04:34:26,704] Trial 46 finished with value: 0.7474362122580073 and parameters: {'model_type': 'xgb', 'n_estimators': 53, 'max_depth': 4, 'learning_rate': 0.10625914636283235}. Best is trial 43 with value: 0.7769744221710975.
[I 2025-08-20 04:34:29,482] Trial 47 finished with value: 0.77555805377299 and parameters: {'model_type': 'cat', 'iterations': 405, 'depth': 6, 'learning_rate': 0.06028600629643475}. Best is trial 43 with value: 0.7769744221710975.
[I 2025-08-20 04:34:35,173] Trial 48 finished with value: 0.7652897441990895 and parameters: {'model_type': 'cat', 'iterations': 618, 'depth': 4, 'learning_rate': 0.29875215691884277}. Best is trial 43 with value: 0.7769744221710975.
[I 2025-08-20 04:34:35,251] Trial 49 finished with value: 0.7423575598818621 and parameters: {'model_type': 'lgbm', 'n_estimators': 128, 'max_depth': 7, 'learning_rate': 0.13492973506779718}. Best is trial 43 with value: 0.7769744221710975.
Regression Results:
  Train R²: 0.959
  Test R²: 0.777
  CV R²: 0.573 ± 0.193
Failed to save comparison file: Object of type ndarray is not JSON serializable

==================================================
ANALYSIS COMPLETE
==================================================
Check the following directories for outputs:
  - plots/: Visualization files
  - results/: Data files and reports
  - models/: Trained model files
