[I 2025-08-20 02:20:52,983] Trial 16 finished with value: 0.8134138441533061 and parameters: {'model_type': 'cat', 'iterations': 660, 'depth': 6, 'learning_rate': 0.265931106002609}. Best is trial 16 with value: 0.8134138441533061.
[I 2025-08-20 02:21:00,467] Trial 17 finished with value: 0.8110861285449931 and parameters: {'model_type': 'cat', 'iterations': 563, 'depth': 5, 'learning_rate': 0.28088427910927527}. Best is trial 16 with value: 0.8134138441533061.
[I 2025-08-20 02:21:10,773] Trial 18 finished with value: 0.8106433454837203 and parameters: {'model_type': 'cat', 'iterations': 697, 'depth': 6, 'learning_rate': 0.23995177777812243}. Best is trial 16 with value: 0.8134138441533061.
[I 2025-08-20 02:21:17,315] Trial 19 finished with value: 0.792671454933845 and parameters: {'model_type': 'cat', 'iterations': 435, 'depth': 7, 'learning_rate': 0.2574366936002809}. Best is trial 16 with value: 0.8134138441533061.
[I 2025-08-20 02:21:24,569] Trial 20 finished with value: 0.801982159967632 and parameters: {'model_type': 'cat', 'iterations': 487, 'depth': 5, 'learning_rate': 0.2504026228292295}. Best is trial 16 with value: 0.8134138441533061.
[I 2025-08-20 02:21:31,737] Trial 21 finished with value: 0.8161584511587097 and parameters: {'model_type': 'cat', 'iterations': 584, 'depth': 5, 'learning_rate': 0.29072951786401213}. Best is trial 21 with value: 0.8161584511587097.
[I 2025-08-20 02:21:37,410] Trial 22 finished with value: 0.8074171356018942 and parameters: {'model_type': 'cat', 'iterations': 601, 'depth': 6, 'learning_rate': 0.29719655604007733}. Best is trial 21 with value: 0.8161584511587097.
[I 2025-08-20 02:21:44,163] Trial 23 finished with value: 0.8028577219426325 and parameters: {'model_type': 'cat', 'iterations': 713, 'depth': 5, 'learning_rate': 0.2613928403281115}. Best is trial 21 with value: 0.8161584511587097.
[I 2025-08-20 02:21:51,899] Trial 24 finished with value: 0.8098821451569231 and parameters: {'model_type': 'cat', 'iterations': 554, 'depth': 6, 'learning_rate': 0.22781759862416467}. Best is trial 21 with value: 0.8161584511587097.
[I 2025-08-20 02:21:54,116] Trial 25 finished with value: 0.7888637119016925 and parameters: {'model_type': 'xgb', 'n_estimators': 88, 'max_depth': 5, 'learning_rate': 0.1725853434731324}. Best is trial 21 with value: 0.8161584511587097.
[I 2025-08-20 02:21:54,557] Trial 26 finished with value: 0.7506279118064035 and parameters: {'model_type': 'rf', 'n_estimators': 198, 'max_depth': 15, 'min_samples_split': 2}. Best is trial 21 with value: 0.8161584511587097.
[I 2025-08-20 02:21:54,568] Trial 27 finished with value: 0.3330086730875318 and parameters: {'model_type': 'bayesian_ridge', 'alpha_1': 4.278907539120982e-05, 'alpha_2': 4.030109504063402e-05, 'lambda_1': 0.0009058049160054218, 'lambda_2': 0.000999739223937284}. Best is trial 21 with value: 0.8161584511587097.
[I 2025-08-20 02:21:59,537] Trial 28 finished with value: 0.8005447550333042 and parameters: {'model_type': 'cat', 'iterations': 421, 'depth': 8, 'learning_rate': 0.27206234504750165}. Best is trial 21 with value: 0.8161584511587097.
[I 2025-08-20 02:21:59,549] Trial 29 finished with value: 0.3330083408660677 and parameters: {'model_type': 'bayesian_ridge', 'alpha_1': 0.00013440136678440653, 'alpha_2': 0.0009951430775727182, 'lambda_1': 0.0009594172809985506, 'lambda_2': 0.0008125369414229235}. Best is trial 21 with value: 0.8161584511587097.
[I 2025-08-20 02:22:05,009] Trial 30 finished with value: 0.8118367198772426 and parameters: {'model_type': 'cat', 'iterations': 667, 'depth': 4, 'learning_rate': 0.2981714298590978}. Best is trial 21 with value: 0.8161584511587097.
[I 2025-08-20 02:22:10,279] Trial 31 finished with value: 0.805534744250597 and parameters: {'model_type': 'cat', 'iterations': 665, 'depth': 4, 'learning_rate': 0.2925932927796827}. Best is trial 21 with value: 0.8161584511587097.
[I 2025-08-20 02:22:17,388] Trial 32 finished with value: 0.8267649206463575 and parameters: {'model_type': 'cat', 'iterations': 766, 'depth': 4, 'learning_rate': 0.26702151373825866}. Best is trial 32 with value: 0.8267649206463575.
[I 2025-08-20 02:22:24,820] Trial 33 finished with value: 0.811548552976085 and parameters: {'model_type': 'cat', 'iterations': 799, 'depth': 4, 'learning_rate': 0.27420818488770293}. Best is trial 32 with value: 0.8267649206463575.
[I 2025-08-20 02:22:30,779] Trial 34 finished with value: 0.8039958917685458 and parameters: {'model_type': 'cat', 'iterations': 735, 'depth': 4, 'learning_rate': 0.29673415395254354}. Best is trial 32 with value: 0.8267649206463575.
[I 2025-08-20 02:22:39,118] Trial 35 finished with value: 0.8106789586615417 and parameters: {'model_type': 'cat', 'iterations': 744, 'depth': 5, 'learning_rate': 0.2678960732829979}. Best is trial 32 with value: 0.8267649206463575.
[I 2025-08-20 02:22:46,051] Trial 36 finished with value: 0.8139337310783247 and parameters: {'model_type': 'cat', 'iterations': 589, 'depth': 5, 'learning_rate': 0.2257049462506357}. Best is trial 32 with value: 0.8267649206463575.
[I 2025-08-20 02:22:46,141] Trial 37 finished with value: 0.727662240932243 and parameters: {'model_type': 'rf', 'n_estimators': 50, 'max_depth': 13, 'min_samples_split': 9}. Best is trial 32 with value: 0.8267649206463575.
[I 2025-08-20 02:22:46,348] Trial 38 finished with value: 0.7955153868366124 and parameters: {'model_type': 'xgb', 'n_estimators': 89, 'max_depth': 3, 'learning_rate': 0.21560244195160588}. Best is trial 32 with value: 0.8267649206463575.
[I 2025-08-20 02:22:46,407] Trial 39 finished with value: 0.7971463182833893 and parameters: {'model_type': 'lgbm', 'n_estimators': 177, 'max_depth': 5, 'learning_rate': 0.22316318771050514}. Best is trial 32 with value: 0.8267649206463575.
[I 2025-08-20 02:22:46,417] Trial 40 finished with value: 0.3330078727273085 and parameters: {'model_type': 'bayesian_ridge', 'alpha_1': 0.0009928774409461484, 'alpha_2': 0.0005699183022657355, 'lambda_1': 3.959131410001749e-05, 'lambda_2': 0.0004911685008552704}. Best is trial 32 with value: 0.8267649206463575.
[I 2025-08-20 02:22:53,244] Trial 41 finished with value: 0.8131119432868762 and parameters: {'model_type': 'cat', 'iterations': 580, 'depth': 5, 'learning_rate': 0.27558252250593457}. Best is trial 32 with value: 0.8267649206463575.
[I 2025-08-20 02:23:00,574] Trial 42 finished with value: 0.8205956694530863 and parameters: {'model_type': 'cat', 'iterations': 557, 'depth': 5, 'learning_rate': 0.23740748636332185}. Best is trial 32 with value: 0.8267649206463575.
[I 2025-08-20 02:23:05,253] Trial 43 finished with value: 0.8109990528148355 and parameters: {'model_type': 'cat', 'iterations': 530, 'depth': 5, 'learning_rate': 0.23484448122652812}. Best is trial 32 with value: 0.8267649206463575.
[I 2025-08-20 02:23:10,065] Trial 44 finished with value: 0.7931419273231481 and parameters: {'model_type': 'cat', 'iterations': 494, 'depth': 5, 'learning_rate': 0.2523962781863706}. Best is trial 32 with value: 0.8267649206463575.
[I 2025-08-20 02:23:15,875] Trial 45 finished with value: 0.8174346997594668 and parameters: {'model_type': 'cat', 'iterations': 611, 'depth': 6, 'learning_rate': 0.21394088703359165}. Best is trial 32 with value: 0.8267649206463575.
[I 2025-08-20 02:23:21,115] Trial 46 finished with value: 0.8086111348073521 and parameters: {'model_type': 'cat', 'iterations': 599, 'depth': 5, 'learning_rate': 0.21247654807696648}. Best is trial 32 with value: 0.8267649206463575.
[I 2025-08-20 02:23:21,192] Trial 47 finished with value: 0.7829285898820559 and parameters: {'model_type': 'lgbm', 'n_estimators': 107, 'max_depth': 8, 'learning_rate': 0.21247228024770828}. Best is trial 32 with value: 0.8267649206463575.
[I 2025-08-20 02:23:26,131] Trial 48 finished with value: 0.8181633629939392 and parameters: {'model_type': 'cat', 'iterations': 459, 'depth': 4, 'learning_rate': 0.1714258774666749}. Best is trial 32 with value: 0.8267649206463575.
[I 2025-08-20 02:23:26,364] Trial 49 finished with value: 0.7379208524574841 and parameters: {'model_type': 'rf', 'n_estimators': 146, 'max_depth': 12, 'min_samples_split': 7}. Best is trial 32 with value: 0.8267649206463575.
Regression Results:
  Train R²: 0.936
  Test R²: 0.827
  CV R²: 0.483 ± 0.231
Saved comparison to results/rxn_feature_comparison_hte_each_8_optuna.json

==================================================
ANALYSIS COMPLETE
==================================================
Check the following directories for outputs:
  - plots/: Visualization files
  - results/: Data files and reports
  - models/: Trained model files
