[I 2025-08-20 03:55:38,844] Trial 15 finished with value: 0.7588515346831938 and parameters: {'model_type': 'lgbm', 'n_estimators': 129, 'max_depth': 3, 'learning_rate': 0.10986016221310965}. Best is trial 0 with value: 0.7660920333024066.
[I 2025-08-20 03:55:39,107] Trial 16 finished with value: 0.7427065624301664 and parameters: {'model_type': 'rf', 'n_estimators': 50, 'max_depth': 15, 'min_samples_split': 10}. Best is trial 0 with value: 0.7660920333024066.
[I 2025-08-20 03:56:44,298] Trial 17 finished with value: 0.7644741490417352 and parameters: {'model_type': 'cat', 'iterations': 673, 'depth': 10, 'learning_rate': 0.22732407451594133}. Best is trial 0 with value: 0.7660920333024066.
[I 2025-08-20 03:56:54,335] Trial 18 finished with value: 0.7281067761103994 and parameters: {'model_type': 'cat', 'iterations': 203, 'depth': 10, 'learning_rate': 0.24578531755027605}. Best is trial 0 with value: 0.7660920333024066.
[I 2025-08-20 03:57:43,780] Trial 19 finished with value: 0.770876416262586 and parameters: {'model_type': 'cat', 'iterations': 585, 'depth': 10, 'learning_rate': 0.06742533614443813}. Best is trial 19 with value: 0.770876416262586.
[I 2025-08-20 03:57:45,830] Trial 20 finished with value: 0.7678498190615887 and parameters: {'model_type': 'rf', 'n_estimators': 198, 'max_depth': 15, 'min_samples_split': 2}. Best is trial 19 with value: 0.770876416262586.
[I 2025-08-20 03:57:47,708] Trial 21 finished with value: 0.7672641203877075 and parameters: {'model_type': 'rf', 'n_estimators': 200, 'max_depth': 15, 'min_samples_split': 2}. Best is trial 19 with value: 0.770876416262586.
[I 2025-08-20 03:57:49,340] Trial 22 finished with value: 0.7674102954762987 and parameters: {'model_type': 'rf', 'n_estimators': 191, 'max_depth': 15, 'min_samples_split': 2}. Best is trial 19 with value: 0.770876416262586.
[I 2025-08-20 03:57:50,744] Trial 23 finished with value: 0.7628916059975512 and parameters: {'model_type': 'rf', 'n_estimators': 153, 'max_depth': 12, 'min_samples_split': 2}. Best is trial 19 with value: 0.770876416262586.
[I 2025-08-20 03:57:51,963] Trial 24 finished with value: 0.7629836589463572 and parameters: {'model_type': 'rf', 'n_estimators': 199, 'max_depth': 13, 'min_samples_split': 4}. Best is trial 19 with value: 0.770876416262586.
[I 2025-08-20 03:57:53,550] Trial 25 finished with value: 0.7658893189309374 and parameters: {'model_type': 'rf', 'n_estimators': 177, 'max_depth': 13, 'min_samples_split': 2}. Best is trial 19 with value: 0.770876416262586.
[I 2025-08-20 03:57:54,643] Trial 26 finished with value: 0.7543958294783615 and parameters: {'model_type': 'rf', 'n_estimators': 136, 'max_depth': 11, 'min_samples_split': 7}. Best is trial 19 with value: 0.770876416262586.
[I 2025-08-20 03:57:55,466] Trial 27 finished with value: 0.760267896750704 and parameters: {'model_type': 'rf', 'n_estimators': 103, 'max_depth': 15, 'min_samples_split': 4}. Best is trial 19 with value: 0.770876416262586.
[I 2025-08-20 03:57:59,727] Trial 28 finished with value: 0.7481876500121785 and parameters: {'model_type': 'lgbm', 'n_estimators': 185, 'max_depth': 6, 'learning_rate': 0.06501170433082143}. Best is trial 19 with value: 0.770876416262586.
[I 2025-08-20 03:57:59,761] Trial 29 finished with value: 0.4465386863281081 and parameters: {'model_type': 'bayesian_ridge', 'alpha_1': 6.424952520932129e-06, 'alpha_2': 0.000982158245955937, 'lambda_1': 0.000924462959900036, 'lambda_2': 1.2739965088920347e-05}. Best is trial 19 with value: 0.770876416262586.
[I 2025-08-20 03:58:00,990] Trial 30 finished with value: 0.7580134570879282 and parameters: {'model_type': 'rf', 'n_estimators': 146, 'max_depth': 14, 'min_samples_split': 7}. Best is trial 19 with value: 0.770876416262586.
[I 2025-08-20 03:58:02,544] Trial 31 finished with value: 0.7673920048266781 and parameters: {'model_type': 'rf', 'n_estimators': 199, 'max_depth': 15, 'min_samples_split': 2}. Best is trial 19 with value: 0.770876416262586.
[I 2025-08-20 03:58:04,349] Trial 32 finished with value: 0.761667008356828 and parameters: {'model_type': 'rf', 'n_estimators': 200, 'max_depth': 13, 'min_samples_split': 3}. Best is trial 19 with value: 0.770876416262586.
[I 2025-08-20 03:58:05,369] Trial 33 finished with value: 0.7648986368238151 and parameters: {'model_type': 'rf', 'n_estimators': 175, 'max_depth': 14, 'min_samples_split': 3}. Best is trial 19 with value: 0.770876416262586.
[I 2025-08-20 03:58:07,048] Trial 34 finished with value: 0.7641633602210832 and parameters: {'model_type': 'rf', 'n_estimators': 187, 'max_depth': 12, 'min_samples_split': 2}. Best is trial 19 with value: 0.770876416262586.
[I 2025-08-20 03:58:08,422] Trial 35 finished with value: 0.7646566761971735 and parameters: {'model_type': 'rf', 'n_estimators': 166, 'max_depth': 14, 'min_samples_split': 4}. Best is trial 19 with value: 0.770876416262586.
[I 2025-08-20 03:58:12,703] Trial 36 finished with value: 0.7341231449888883 and parameters: {'model_type': 'lgbm', 'n_estimators': 112, 'max_depth': 9, 'learning_rate': 0.1431194577133571}. Best is trial 19 with value: 0.770876416262586.
[I 2025-08-20 03:58:14,241] Trial 37 finished with value: 0.7278207625996549 and parameters: {'model_type': 'xgb', 'n_estimators': 188, 'max_depth': 9, 'learning_rate': 0.03446388404029056}. Best is trial 19 with value: 0.770876416262586.
[I 2025-08-20 03:58:15,950] Trial 38 finished with value: 0.7643414507436002 and parameters: {'model_type': 'rf', 'n_estimators': 172, 'max_depth': 15, 'min_samples_split': 3}. Best is trial 19 with value: 0.770876416262586.
[I 2025-08-20 03:58:16,033] Trial 39 finished with value: 0.44654839122454304 and parameters: {'model_type': 'bayesian_ridge', 'alpha_1': 0.000982042745769924, 'alpha_2': 0.0007683465064968812, 'lambda_1': 0.0007793774734009609, 'lambda_2': 0.0009804556888250264}. Best is trial 19 with value: 0.770876416262586.
[I 2025-08-20 03:58:17,043] Trial 40 finished with value: 0.7669502456711975 and parameters: {'model_type': 'xgb', 'n_estimators': 145, 'max_depth': 4, 'learning_rate': 0.08055855101634035}. Best is trial 19 with value: 0.770876416262586.
[I 2025-08-20 03:58:18,526] Trial 41 finished with value: 0.7672641203877075 and parameters: {'model_type': 'rf', 'n_estimators': 200, 'max_depth': 15, 'min_samples_split': 2}. Best is trial 19 with value: 0.770876416262586.
[I 2025-08-20 03:58:19,684] Trial 42 finished with value: 0.7647302476203582 and parameters: {'model_type': 'rf', 'n_estimators': 191, 'max_depth': 14, 'min_samples_split': 2}. Best is trial 19 with value: 0.770876416262586.
[I 2025-08-20 03:58:21,057] Trial 43 finished with value: 0.7644868046224376 and parameters: {'model_type': 'rf', 'n_estimators': 179, 'max_depth': 12, 'min_samples_split': 3}. Best is trial 19 with value: 0.770876416262586.
[I 2025-08-20 03:58:22,576] Trial 44 finished with value: 0.7677083089524734 and parameters: {'model_type': 'rf', 'n_estimators': 192, 'max_depth': 15, 'min_samples_split': 2}. Best is trial 19 with value: 0.770876416262586.
[I 2025-08-20 03:58:22,642] Trial 45 finished with value: 0.4465435410941381 and parameters: {'model_type': 'bayesian_ridge', 'alpha_1': 7.585167549386542e-05, 'alpha_2': 0.0005014211336827847, 'lambda_1': 0.0005424787548167076, 'lambda_2': 0.000479794134913601}. Best is trial 19 with value: 0.770876416262586.
[I 2025-08-20 03:58:23,961] Trial 46 finished with value: 0.7620571786563695 and parameters: {'model_type': 'rf', 'n_estimators': 191, 'max_depth': 13, 'min_samples_split': 3}. Best is trial 19 with value: 0.770876416262586.
[I 2025-08-20 03:58:38,500] Trial 47 finished with value: 0.7542562978428771 and parameters: {'model_type': 'cat', 'iterations': 430, 'depth': 8, 'learning_rate': 0.14785241588178927}. Best is trial 19 with value: 0.770876416262586.
[I 2025-08-20 03:58:43,632] Trial 48 finished with value: 0.7422341351767812 and parameters: {'model_type': 'lgbm', 'n_estimators': 161, 'max_depth': 7, 'learning_rate': 0.019225922248046194}. Best is trial 19 with value: 0.770876416262586.
[I 2025-08-20 03:58:46,116] Trial 49 finished with value: 0.7239796932398863 and parameters: {'model_type': 'xgb', 'n_estimators': 180, 'max_depth': 9, 'learning_rate': 0.09291403278319602}. Best is trial 19 with value: 0.770876416262586.
Regression Results:
  Train R²: 0.940
  Test R²: 0.771
  CV R²: 0.527 ± 0.230
Failed to save comparison file: Object of type ndarray is not JSON serializable

==================================================
ANALYSIS COMPLETE
==================================================
Check the following directories for outputs:
  - plots/: Visualization files
  - results/: Data files and reports
  - models/: Trained model files
