[I 2025-08-20 02:20:32,189] Trial 16 finished with value: 0.6274570596578253 and parameters: {'model_type': 'cat', 'iterations': 507, 'depth': 4, 'learning_rate': 0.2237941810858618}. Best is trial 13 with value: 0.7086603484296194.
[I 2025-08-20 02:20:39,383] Trial 17 finished with value: 0.6939122594354238 and parameters: {'model_type': 'cat', 'iterations': 490, 'depth': 8, 'learning_rate': 0.11557579603193718}. Best is trial 13 with value: 0.7086603484296194.
[I 2025-08-20 02:20:44,102] Trial 18 finished with value: 0.7229220597068962 and parameters: {'model_type': 'cat', 'iterations': 497, 'depth': 8, 'learning_rate': 0.21445439022225782}. Best is trial 18 with value: 0.7229220597068962.
[I 2025-08-20 02:20:44,137] Trial 19 finished with value: 0.5562919426402247 and parameters: {'model_type': 'lgbm', 'n_estimators': 50, 'max_depth': 3, 'learning_rate': 0.19855185063474404}. Best is trial 18 with value: 0.7229220597068962.
[I 2025-08-20 02:20:44,446] Trial 20 finished with value: 0.5543335025787028 and parameters: {'model_type': 'xgb', 'n_estimators': 130, 'max_depth': 3, 'learning_rate': 0.12731234700601826}. Best is trial 18 with value: 0.7229220597068962.
[I 2025-08-20 02:20:55,205] Trial 21 finished with value: 0.6697571744323578 and parameters: {'model_type': 'cat', 'iterations': 508, 'depth': 8, 'learning_rate': 0.24776654651207947}. Best is trial 18 with value: 0.7229220597068962.
[I 2025-08-20 02:20:58,251] Trial 22 finished with value: 0.6385476335212609 and parameters: {'model_type': 'cat', 'iterations': 365, 'depth': 7, 'learning_rate': 0.20313682055688834}. Best is trial 18 with value: 0.7229220597068962.
[I 2025-08-20 02:21:08,593] Trial 23 finished with value: 0.6307213930992208 and parameters: {'model_type': 'cat', 'iterations': 617, 'depth': 8, 'learning_rate': 0.13182569525119253}. Best is trial 18 with value: 0.7229220597068962.
[I 2025-08-20 02:21:15,153] Trial 24 finished with value: 0.6901067782583026 and parameters: {'model_type': 'cat', 'iterations': 202, 'depth': 7, 'learning_rate': 0.2618512315533178}. Best is trial 18 with value: 0.7229220597068962.
[I 2025-08-20 02:21:15,171] Trial 25 finished with value: 0.10770207562831757 and parameters: {'model_type': 'bayesian_ridge', 'alpha_1': 0.0009797465269187047, 'alpha_2': 0.00016265839038432435, 'lambda_1': 6.520937905845421e-06, 'lambda_2': 6.949453858509793e-05}. Best is trial 18 with value: 0.7229220597068962.
[I 2025-08-20 02:21:24,565] Trial 26 finished with value: 0.6821988651504287 and parameters: {'model_type': 'cat', 'iterations': 613, 'depth': 5, 'learning_rate': 0.20336453140037122}. Best is trial 18 with value: 0.7229220597068962.
[I 2025-08-20 02:21:29,580] Trial 27 finished with value: 0.6407546598239062 and parameters: {'model_type': 'cat', 'iterations': 421, 'depth': 9, 'learning_rate': 0.1543848873844084}. Best is trial 18 with value: 0.7229220597068962.
[I 2025-08-20 02:21:42,016] Trial 28 finished with value: 0.6893439651893222 and parameters: {'model_type': 'cat', 'iterations': 589, 'depth': 9, 'learning_rate': 0.09829734268725493}. Best is trial 18 with value: 0.7229220597068962.
[I 2025-08-20 02:21:42,257] Trial 29 finished with value: 0.6154016969523644 and parameters: {'model_type': 'rf', 'n_estimators': 124, 'max_depth': 15, 'min_samples_split': 2}. Best is trial 18 with value: 0.7229220597068962.
[I 2025-08-20 02:21:42,336] Trial 30 finished with value: 0.5752848279949945 and parameters: {'model_type': 'lgbm', 'n_estimators': 144, 'max_depth': 5, 'learning_rate': 0.2214753360412871}. Best is trial 18 with value: 0.7229220597068962.
[I 2025-08-20 02:21:51,908] Trial 31 finished with value: 0.6538655450636628 and parameters: {'model_type': 'cat', 'iterations': 799, 'depth': 6, 'learning_rate': 0.29898672326409426}. Best is trial 18 with value: 0.7229220597068962.
[I 2025-08-20 02:21:57,205] Trial 32 finished with value: 0.6513594872462743 and parameters: {'model_type': 'cat', 'iterations': 692, 'depth': 5, 'learning_rate': 0.2749607467359869}. Best is trial 18 with value: 0.7229220597068962.
[I 2025-08-20 02:21:57,403] Trial 33 finished with value: 0.6160368535744775 and parameters: {'model_type': 'rf', 'n_estimators': 108, 'max_depth': 12, 'min_samples_split': 3}. Best is trial 18 with value: 0.7229220597068962.
[I 2025-08-20 02:22:07,213] Trial 34 finished with value: 0.5994192822572375 and parameters: {'model_type': 'cat', 'iterations': 694, 'depth': 7, 'learning_rate': 0.26277390125778444}. Best is trial 18 with value: 0.7229220597068962.
[I 2025-08-20 02:22:07,231] Trial 35 finished with value: 0.10765071148074834 and parameters: {'model_type': 'bayesian_ridge', 'alpha_1': 3.1922160905479245e-05, 'alpha_2': 4.8894361919451775e-05, 'lambda_1': 0.0009504290029822204, 'lambda_2': 0.0008480956026524016}. Best is trial 18 with value: 0.7229220597068962.
[I 2025-08-20 02:22:07,584] Trial 36 finished with value: 0.48923144825402676 and parameters: {'model_type': 'xgb', 'n_estimators': 52, 'max_depth': 7, 'learning_rate': 0.28757628598553936}. Best is trial 18 with value: 0.7229220597068962.
[I 2025-08-20 02:22:07,745] Trial 37 finished with value: 0.6250105937995518 and parameters: {'model_type': 'rf', 'n_estimators': 97, 'max_depth': 15, 'min_samples_split': 5}. Best is trial 18 with value: 0.7229220597068962.
[I 2025-08-20 02:22:15,161] Trial 38 finished with value: 0.719679505691429 and parameters: {'model_type': 'cat', 'iterations': 797, 'depth': 6, 'learning_rate': 0.18800119639685597}. Best is trial 18 with value: 0.7229220597068962.
[I 2025-08-20 02:22:15,180] Trial 39 finished with value: 0.10766766958045537 and parameters: {'model_type': 'bayesian_ridge', 'alpha_1': 0.0007459841781171664, 'alpha_2': 0.0004613604664648975, 'lambda_1': 3.357159260047762e-05, 'lambda_2': 0.0005612363415341312}. Best is trial 18 with value: 0.7229220597068962.
[I 2025-08-20 02:22:15,224] Trial 40 finished with value: 0.6504690938220994 and parameters: {'model_type': 'lgbm', 'n_estimators': 74, 'max_depth': 4, 'learning_rate': 0.18241232183276754}. Best is trial 18 with value: 0.7229220597068962.
[I 2025-08-20 02:22:24,821] Trial 41 finished with value: 0.6913267834899602 and parameters: {'model_type': 'cat', 'iterations': 772, 'depth': 6, 'learning_rate': 0.15408396145694875}. Best is trial 18 with value: 0.7229220597068962.
[I 2025-08-20 02:22:32,972] Trial 42 finished with value: 0.7242879918278556 and parameters: {'model_type': 'cat', 'iterations': 742, 'depth': 5, 'learning_rate': 0.18544576346059333}. Best is trial 42 with value: 0.7242879918278556.
[I 2025-08-20 02:22:41,262] Trial 43 finished with value: 0.7239524402246258 and parameters: {'model_type': 'cat', 'iterations': 781, 'depth': 5, 'learning_rate': 0.18581385422225313}. Best is trial 42 with value: 0.7242879918278556.
[I 2025-08-20 02:22:48,196] Trial 44 finished with value: 0.653481272035195 and parameters: {'model_type': 'cat', 'iterations': 794, 'depth': 5, 'learning_rate': 0.1822015439211479}. Best is trial 42 with value: 0.7242879918278556.
[I 2025-08-20 02:22:55,385] Trial 45 finished with value: 0.652775749059386 and parameters: {'model_type': 'cat', 'iterations': 668, 'depth': 4, 'learning_rate': 0.21811977866610227}. Best is trial 42 with value: 0.7242879918278556.
[I 2025-08-20 02:22:58,410] Trial 46 finished with value: 0.6920723797791366 and parameters: {'model_type': 'cat', 'iterations': 417, 'depth': 5, 'learning_rate': 0.19424660978455424}. Best is trial 42 with value: 0.7242879918278556.
[I 2025-08-20 02:22:59,460] Trial 47 finished with value: 0.5545667347576793 and parameters: {'model_type': 'xgb', 'n_estimators': 164, 'max_depth': 7, 'learning_rate': 0.1671561059918401}. Best is trial 42 with value: 0.7242879918278556.
[I 2025-08-20 02:23:07,919] Trial 48 finished with value: 0.6752154504796455 and parameters: {'model_type': 'cat', 'iterations': 558, 'depth': 8, 'learning_rate': 0.240665763415467}. Best is trial 42 with value: 0.7242879918278556.
[I 2025-08-20 02:23:15,919] Trial 49 finished with value: 0.6525491899096656 and parameters: {'model_type': 'cat', 'iterations': 765, 'depth': 5, 'learning_rate': 0.138188940735125}. Best is trial 42 with value: 0.7242879918278556.
Regression Results:
  Train R²: 0.914
  Test R²: 0.724
  CV R²: 0.514 ± 0.252
Saved comparison to results/rxn_feature_comparison_hte_each_8_optuna.json

==================================================
ANALYSIS COMPLETE
==================================================
Check the following directories for outputs:
  - plots/: Visualization files
  - results/: Data files and reports
  - models/: Trained model files
