[I 2025-08-20 03:54:56,341] Trial 15 finished with value: 0.8035866095563102 and parameters: {'model_type': 'rf', 'n_estimators': 186, 'max_depth': 15, 'min_samples_split': 2}. Best is trial 12 with value: 0.8081763015339553.
[I 2025-08-20 03:55:10,894] Trial 16 finished with value: 0.7876801785789029 and parameters: {'model_type': 'cat', 'iterations': 486, 'depth': 8, 'learning_rate': 0.11462904391089443}. Best is trial 12 with value: 0.8081763015339553.
[I 2025-08-20 03:55:21,972] Trial 17 finished with value: 0.7803250552428728 and parameters: {'model_type': 'cat', 'iterations': 376, 'depth': 8, 'learning_rate': 0.1777982380926328}. Best is trial 12 with value: 0.8081763015339553.
[I 2025-08-20 03:55:41,272] Trial 18 finished with value: 0.7981889284657331 and parameters: {'model_type': 'cat', 'iterations': 636, 'depth': 8, 'learning_rate': 0.09668183452470372}. Best is trial 12 with value: 0.8081763015339553.
[I 2025-08-20 03:55:41,537] Trial 19 finished with value: 0.7905775590809158 and parameters: {'model_type': 'rf', 'n_estimators': 53, 'max_depth': 15, 'min_samples_split': 4}. Best is trial 12 with value: 0.8081763015339553.
[I 2025-08-20 03:55:41,565] Trial 20 finished with value: 0.5028615295812697 and parameters: {'model_type': 'bayesian_ridge', 'alpha_1': 6.24521597484353e-05, 'alpha_2': 0.0008898521947425242, 'lambda_1': 0.0003446668975534174, 'lambda_2': 0.0003793697106440337}. Best is trial 12 with value: 0.8081763015339553.
[I 2025-08-20 03:55:46,109] Trial 21 finished with value: 0.8030515199560508 and parameters: {'model_type': 'cat', 'iterations': 211, 'depth': 4, 'learning_rate': 0.15959888802033376}. Best is trial 12 with value: 0.8081763015339553.
[I 2025-08-20 03:55:51,649] Trial 22 finished with value: 0.8007076662992981 and parameters: {'model_type': 'cat', 'iterations': 325, 'depth': 4, 'learning_rate': 0.1836584801874098}. Best is trial 12 with value: 0.8081763015339553.
[I 2025-08-20 03:55:58,014] Trial 23 finished with value: 0.8104436114177467 and parameters: {'model_type': 'cat', 'iterations': 307, 'depth': 6, 'learning_rate': 0.13814032374544413}. Best is trial 23 with value: 0.8104436114177467.
[I 2025-08-20 03:56:19,997] Trial 24 finished with value: 0.8020401326052401 and parameters: {'model_type': 'cat', 'iterations': 565, 'depth': 6, 'learning_rate': 0.09852726838993689}. Best is trial 23 with value: 0.8104436114177467.
[I 2025-08-20 03:56:21,439] Trial 25 finished with value: 0.7964094374184926 and parameters: {'model_type': 'xgb', 'n_estimators': 193, 'max_depth': 3, 'learning_rate': 0.12342034773133964}. Best is trial 23 with value: 0.8104436114177467.
[I 2025-08-20 03:56:29,089] Trial 26 finished with value: 0.803283283887428 and parameters: {'model_type': 'cat', 'iterations': 324, 'depth': 6, 'learning_rate': 0.19811899167932973}. Best is trial 23 with value: 0.8104436114177467.
[I 2025-08-20 03:56:41,999] Trial 27 finished with value: 0.7946536910917398 and parameters: {'model_type': 'cat', 'iterations': 303, 'depth': 9, 'learning_rate': 0.08850618360345851}. Best is trial 23 with value: 0.8104436114177467.
[I 2025-08-20 03:57:29,558] Trial 28 finished with value: 0.7981810093827431 and parameters: {'model_type': 'cat', 'iterations': 798, 'depth': 6, 'learning_rate': 0.15462623760952723}. Best is trial 23 with value: 0.8104436114177467.
[I 2025-08-20 03:57:29,861] Trial 29 finished with value: 0.7932833500881938 and parameters: {'model_type': 'rf', 'n_estimators': 83, 'max_depth': 12, 'min_samples_split': 10}. Best is trial 23 with value: 0.8104436114177467.
[I 2025-08-20 03:57:31,965] Trial 30 finished with value: 0.8085530390920626 and parameters: {'model_type': 'xgb', 'n_estimators': 164, 'max_depth': 5, 'learning_rate': 0.16643031276406706}. Best is trial 23 with value: 0.8104436114177467.
[I 2025-08-20 03:57:32,875] Trial 31 finished with value: 0.790963637341285 and parameters: {'model_type': 'xgb', 'n_estimators': 166, 'max_depth': 5, 'learning_rate': 0.16686856407997405}. Best is trial 23 with value: 0.8104436114177467.
[I 2025-08-20 03:57:33,545] Trial 32 finished with value: 0.7945541706343495 and parameters: {'model_type': 'xgb', 'n_estimators': 176, 'max_depth': 3, 'learning_rate': 0.1291555760486967}. Best is trial 23 with value: 0.8104436114177467.
[I 2025-08-20 03:57:34,427] Trial 33 finished with value: 0.7791998464936915 and parameters: {'model_type': 'xgb', 'n_estimators': 155, 'max_depth': 5, 'learning_rate': 0.20192789645597883}. Best is trial 23 with value: 0.8104436114177467.
[I 2025-08-20 03:57:39,445] Trial 34 finished with value: 0.7593476805682207 and parameters: {'model_type': 'lgbm', 'n_estimators': 199, 'max_depth': 6, 'learning_rate': 0.14501485721281432}. Best is trial 23 with value: 0.8104436114177467.
[I 2025-08-20 03:57:39,538] Trial 35 finished with value: 0.5028581785903353 and parameters: {'model_type': 'bayesian_ridge', 'alpha_1': 0.0009609278904682792, 'alpha_2': 0.00025691318843209577, 'lambda_1': 0.0009153444361547352, 'lambda_2': 0.0009849210403082363}. Best is trial 23 with value: 0.8104436114177467.
[I 2025-08-20 03:57:41,473] Trial 36 finished with value: 0.7843049550434302 and parameters: {'model_type': 'lgbm', 'n_estimators': 114, 'max_depth': 4, 'learning_rate': 0.10713213329722795}. Best is trial 23 with value: 0.8104436114177467.
[I 2025-08-20 03:57:42,539] Trial 37 finished with value: 0.7752816933688083 and parameters: {'model_type': 'xgb', 'n_estimators': 84, 'max_depth': 7, 'learning_rate': 0.07425703203530054}. Best is trial 23 with value: 0.8104436114177467.
[I 2025-08-20 03:57:44,474] Trial 38 finished with value: 0.797198212191241 and parameters: {'model_type': 'rf', 'n_estimators': 167, 'max_depth': 11, 'min_samples_split': 7}. Best is trial 23 with value: 0.8104436114177467.
[I 2025-08-20 03:58:03,630] Trial 39 finished with value: 0.7877244131067681 and parameters: {'model_type': 'cat', 'iterations': 417, 'depth': 9, 'learning_rate': 0.1765925553821091}. Best is trial 23 with value: 0.8104436114177467.
[I 2025-08-20 03:58:05,895] Trial 40 finished with value: 0.7858162210913393 and parameters: {'model_type': 'xgb', 'n_estimators': 147, 'max_depth': 5, 'learning_rate': 0.20276554606803654}. Best is trial 23 with value: 0.8104436114177467.
[I 2025-08-20 03:58:14,402] Trial 41 finished with value: 0.8060418980500696 and parameters: {'model_type': 'cat', 'iterations': 249, 'depth': 5, 'learning_rate': 0.14040200101943562}. Best is trial 23 with value: 0.8104436114177467.
[I 2025-08-20 03:58:23,925] Trial 42 finished with value: 0.8050734742394047 and parameters: {'model_type': 'cat', 'iterations': 276, 'depth': 5, 'learning_rate': 0.1299370523940967}. Best is trial 23 with value: 0.8104436114177467.
[I 2025-08-20 03:58:34,734] Trial 43 finished with value: 0.8001420028169564 and parameters: {'model_type': 'cat', 'iterations': 269, 'depth': 5, 'learning_rate': 0.15025843708973327}. Best is trial 23 with value: 0.8104436114177467.
[I 2025-08-20 03:59:08,563] Trial 44 finished with value: 0.7959059965699009 and parameters: {'model_type': 'cat', 'iterations': 589, 'depth': 5, 'learning_rate': 0.11623100266225458}. Best is trial 23 with value: 0.8104436114177467.
[I 2025-08-20 03:59:10,758] Trial 45 finished with value: 0.7859878627039123 and parameters: {'model_type': 'lgbm', 'n_estimators': 122, 'max_depth': 4, 'learning_rate': 0.15886402715966785}. Best is trial 23 with value: 0.8104436114177467.
[I 2025-08-20 03:59:25,700] Trial 46 finished with value: 0.786866739157264 and parameters: {'model_type': 'cat', 'iterations': 354, 'depth': 7, 'learning_rate': 0.1720199867233536}. Best is trial 23 with value: 0.8104436114177467.
[I 2025-08-20 03:59:25,779] Trial 47 finished with value: 0.5028608343597313 and parameters: {'model_type': 'bayesian_ridge', 'alpha_1': 0.00021945488992892813, 'alpha_2': 0.0004617148293168148, 'lambda_1': 0.0005247354130674954, 'lambda_2': 0.000507458216092755}. Best is trial 23 with value: 0.8104436114177467.
[I 2025-08-20 03:59:42,922] Trial 48 finished with value: 0.8045974630638737 and parameters: {'model_type': 'cat', 'iterations': 258, 'depth': 9, 'learning_rate': 0.13851059908598232}. Best is trial 23 with value: 0.8104436114177467.
[I 2025-08-20 03:59:56,815] Trial 49 finished with value: 0.7982464668220705 and parameters: {'model_type': 'cat', 'iterations': 378, 'depth': 7, 'learning_rate': 0.2279125543965218}. Best is trial 23 with value: 0.8104436114177467.
Regression Results:
  Train R²: 0.976
  Test R²: 0.810
  CV R²: 0.542 ± 0.137
Failed to save comparison file: Object of type ndarray is not JSON serializable

==================================================
ANALYSIS COMPLETE
==================================================
Check the following directories for outputs:
  - plots/: Visualization files
  - results/: Data files and reports
  - models/: Trained model files
