[I 2025-08-20 04:29:33,714] Trial 15 finished with value: 0.7791689086795486 and parameters: {'model_type': 'cat', 'iterations': 523, 'depth': 4, 'learning_rate': 0.2547705031121068}. Best is trial 12 with value: 0.7913726127770164.
[I 2025-08-20 04:29:33,856] Trial 16 finished with value: 0.7365688951313764 and parameters: {'model_type': 'lgbm', 'n_estimators': 198, 'max_depth': 8, 'learning_rate': 0.2888671873439699}. Best is trial 12 with value: 0.7913726127770164.
[I 2025-08-20 04:29:36,353] Trial 17 finished with value: 0.7577062530231562 and parameters: {'model_type': 'cat', 'iterations': 231, 'depth': 5, 'learning_rate': 0.2473559002668017}. Best is trial 12 with value: 0.7913726127770164.
[I 2025-08-20 04:29:41,021] Trial 18 finished with value: 0.7582391412753032 and parameters: {'model_type': 'cat', 'iterations': 447, 'depth': 5, 'learning_rate': 0.12032916216848318}. Best is trial 12 with value: 0.7913726127770164.
[I 2025-08-20 04:29:47,431] Trial 19 finished with value: 0.7577679425920473 and parameters: {'model_type': 'cat', 'iterations': 789, 'depth': 4, 'learning_rate': 0.21605710062859096}. Best is trial 12 with value: 0.7913726127770164.
[I 2025-08-20 04:29:47,519] Trial 20 finished with value: 0.7522210600231721 and parameters: {'model_type': 'lgbm', 'n_estimators': 166, 'max_depth': 5, 'learning_rate': 0.2555933302722023}. Best is trial 12 with value: 0.7913726127770164.
[I 2025-08-20 04:29:55,367] Trial 21 finished with value: 0.7639479356331635 and parameters: {'model_type': 'cat', 'iterations': 560, 'depth': 8, 'learning_rate': 0.22143660690632339}. Best is trial 12 with value: 0.7913726127770164.
[I 2025-08-20 04:30:02,765] Trial 22 finished with value: 0.7676932754250536 and parameters: {'model_type': 'cat', 'iterations': 513, 'depth': 8, 'learning_rate': 0.23476465749505002}. Best is trial 12 with value: 0.7913726127770164.
[I 2025-08-20 04:30:09,848] Trial 23 finished with value: 0.7557006480328649 and parameters: {'model_type': 'cat', 'iterations': 582, 'depth': 7, 'learning_rate': 0.29331733051323694}. Best is trial 12 with value: 0.7913726127770164.
[I 2025-08-20 04:30:25,754] Trial 24 finished with value: 0.7485348149372626 and parameters: {'model_type': 'cat', 'iterations': 714, 'depth': 10, 'learning_rate': 0.14165948995307326}. Best is trial 12 with value: 0.7913726127770164.
[I 2025-08-20 04:30:25,772] Trial 25 finished with value: 0.31862159007954083 and parameters: {'model_type': 'bayesian_ridge', 'alpha_1': 4.635241395900731e-05, 'alpha_2': 0.0009953769049658601, 'lambda_1': 4.300900386513932e-05, 'lambda_2': 0.0009104156214563639}. Best is trial 12 with value: 0.7913726127770164.
[I 2025-08-20 04:30:30,684] Trial 26 finished with value: 0.7299885822638803 and parameters: {'model_type': 'cat', 'iterations': 345, 'depth': 9, 'learning_rate': 0.19245707921554134}. Best is trial 12 with value: 0.7913726127770164.
[I 2025-08-20 04:30:37,216] Trial 27 finished with value: 0.751887607021257 and parameters: {'model_type': 'cat', 'iterations': 504, 'depth': 7, 'learning_rate': 0.2604394768616526}. Best is trial 12 with value: 0.7913726127770164.
[I 2025-08-20 04:30:48,582] Trial 28 finished with value: 0.7699710158593781 and parameters: {'model_type': 'cat', 'iterations': 652, 'depth': 9, 'learning_rate': 0.2118753977984375}. Best is trial 12 with value: 0.7913726127770164.
[I 2025-08-20 04:30:48,601] Trial 29 finished with value: 0.3186131103655211 and parameters: {'model_type': 'bayesian_ridge', 'alpha_1': 0.0009752870340776537, 'alpha_2': 5.198120121803116e-06, 'lambda_1': 0.00099545279843448, 'lambda_2': 1.5812481139412143e-05}. Best is trial 12 with value: 0.7913726127770164.
[I 2025-08-20 04:30:49,815] Trial 30 finished with value: 0.6839117552441323 and parameters: {'model_type': 'xgb', 'n_estimators': 160, 'max_depth': 8, 'learning_rate': 0.09496374546679184}. Best is trial 12 with value: 0.7913726127770164.
[I 2025-08-20 04:31:03,249] Trial 31 finished with value: 0.7573949196757894 and parameters: {'model_type': 'cat', 'iterations': 646, 'depth': 9, 'learning_rate': 0.21516862873211812}. Best is trial 12 with value: 0.7913726127770164.
[I 2025-08-20 04:31:14,445] Trial 32 finished with value: 0.7558927114502858 and parameters: {'model_type': 'cat', 'iterations': 730, 'depth': 9, 'learning_rate': 0.23984034403820728}. Best is trial 12 with value: 0.7913726127770164.
[I 2025-08-20 04:31:22,305] Trial 33 finished with value: 0.7656141981086055 and parameters: {'model_type': 'cat', 'iterations': 581, 'depth': 8, 'learning_rate': 0.19479629497356082}. Best is trial 12 with value: 0.7913726127770164.
[I 2025-08-20 04:31:35,723] Trial 34 finished with value: 0.7732767481825829 and parameters: {'model_type': 'cat', 'iterations': 645, 'depth': 10, 'learning_rate': 0.15763709094200823}. Best is trial 12 with value: 0.7913726127770164.
[I 2025-08-20 04:31:36,463] Trial 35 finished with value: 0.6885361837425467 and parameters: {'model_type': 'xgb', 'n_estimators': 80, 'max_depth': 9, 'learning_rate': 0.15930204559052027}. Best is trial 12 with value: 0.7913726127770164.
[I 2025-08-20 04:31:36,823] Trial 36 finished with value: 0.6905473629155325 and parameters: {'model_type': 'rf', 'n_estimators': 194, 'max_depth': 15, 'min_samples_split': 2}. Best is trial 12 with value: 0.7913726127770164.
[I 2025-08-20 04:31:47,701] Trial 37 finished with value: 0.7532351324368387 and parameters: {'model_type': 'cat', 'iterations': 547, 'depth': 10, 'learning_rate': 0.13500979777730276}. Best is trial 12 with value: 0.7913726127770164.
[I 2025-08-20 04:31:47,720] Trial 38 finished with value: 0.31862201941116264 and parameters: {'model_type': 'bayesian_ridge', 'alpha_1': 1.1020332767932824e-05, 'alpha_2': 0.0004854643073284541, 'lambda_1': 0.0005121850365687111, 'lambda_2': 0.000979680587947092}. Best is trial 12 with value: 0.7913726127770164.
[I 2025-08-20 04:31:48,347] Trial 39 finished with value: 0.745766264025604 and parameters: {'model_type': 'xgb', 'n_estimators': 143, 'max_depth': 5, 'learning_rate': 0.17759672160109274}. Best is trial 12 with value: 0.7913726127770164.
[I 2025-08-20 04:31:48,460] Trial 40 finished with value: 0.6877731268092471 and parameters: {'model_type': 'rf', 'n_estimators': 73, 'max_depth': 15, 'min_samples_split': 10}. Best is trial 12 with value: 0.7913726127770164.
[I 2025-08-20 04:31:57,949] Trial 41 finished with value: 0.7834294126681426 and parameters: {'model_type': 'cat', 'iterations': 665, 'depth': 9, 'learning_rate': 0.20594676077429494}. Best is trial 12 with value: 0.7913726127770164.
[I 2025-08-20 04:32:12,072] Trial 42 finished with value: 0.7460877398644813 and parameters: {'model_type': 'cat', 'iterations': 618, 'depth': 10, 'learning_rate': 0.23117779301851482}. Best is trial 12 with value: 0.7913726127770164.
[I 2025-08-20 04:32:23,371] Trial 43 finished with value: 0.7607985386490993 and parameters: {'model_type': 'cat', 'iterations': 697, 'depth': 9, 'learning_rate': 0.19836831612396139}. Best is trial 12 with value: 0.7913726127770164.
[I 2025-08-20 04:32:32,412] Trial 44 finished with value: 0.7829040809684698 and parameters: {'model_type': 'cat', 'iterations': 782, 'depth': 8, 'learning_rate': 0.2726372793222416}. Best is trial 12 with value: 0.7913726127770164.
[I 2025-08-20 04:32:32,526] Trial 45 finished with value: 0.7447287907612608 and parameters: {'model_type': 'lgbm', 'n_estimators': 178, 'max_depth': 6, 'learning_rate': 0.2810228595673052}. Best is trial 12 with value: 0.7913726127770164.
[I 2025-08-20 04:32:49,290] Trial 46 finished with value: 0.7696145533888769 and parameters: {'model_type': 'cat', 'iterations': 788, 'depth': 10, 'learning_rate': 0.2678726627513384}. Best is trial 12 with value: 0.7913726127770164.
[I 2025-08-20 04:32:54,765] Trial 47 finished with value: 0.7292198084365067 and parameters: {'model_type': 'cat', 'iterations': 756, 'depth': 4, 'learning_rate': 0.05074426102124423}. Best is trial 12 with value: 0.7913726127770164.
[I 2025-08-20 04:32:55,018] Trial 48 finished with value: 0.6934064519502527 and parameters: {'model_type': 'rf', 'n_estimators': 133, 'max_depth': 12, 'min_samples_split': 2}. Best is trial 12 with value: 0.7913726127770164.
[I 2025-08-20 04:33:02,056] Trial 49 finished with value: 0.7612897260299265 and parameters: {'model_type': 'cat', 'iterations': 686, 'depth': 7, 'learning_rate': 0.1476562552038328}. Best is trial 12 with value: 0.7913726127770164.
Regression Results:
  Train R²: 0.936
  Test R²: 0.791
  CV R²: 0.485 ± 0.262
Failed to save comparison file: Object of type ndarray is not JSON serializable

==================================================
ANALYSIS COMPLETE
==================================================
Check the following directories for outputs:
  - plots/: Visualization files
  - results/: Data files and reports
  - models/: Trained model files
