=== ML Measurable HTE Rate Bias Analysis ===

==================================================
Running HTE Prediction Analysis: each with 8 features
==================================================

=== Loading Data ===
Number of HTE rates: 1031
Found 5 hydrogen-dependent features: ['num_Hs', 'BV_Hs_avg', 'Charges_Hs_avg', 'fukui_E_Hs_avg', 'fukui_N_Hs_avg']
Found 2 pKa-dependent features: ['pka_aHs', 'pka_lowest']
Found 26 heteroatom-dependent features: ['BV_main_1', 'Charges_main_atom', 'fukui_E_main_atom', 'fukui_N_main_atom', 'L_main_atom_1', 'L_main_atom_2', 'B1_main_atom_1', 'B1_main_atom_2', 'B5_main_atom_1', 'B5_main_atom_2', 'Charges_secondary_1', 'Charges_secondary_2', 'fukui_N_secondary_1', 'fukui_N_secondary_2', 'Charges_secondary_avg', 'fukui_N_secondary_avg', 'FCS_1', 'FREQS_1', 'FCS_2', 'FREQS_2', 'FCS_avg', 'FREQS_avg', 'BV_Hs_avg', 'Charges_Hs_avg', 'fukui_E_Hs_avg', 'fukui_N_Hs_avg']

Processing num_Hs conditional features...
  18/46 molecules meet condition num_Hs
    num_Hs: 0 -> 0 NA values
    BV_Hs_avg: 28 -> 0 NA values
    Charges_Hs_avg: 28 -> 0 NA values
    fukui_E_Hs_avg: 28 -> 0 NA values
    fukui_N_Hs_avg: 28 -> 0 NA values

Processing pKa_features conditional features...
  18/46 molecules meet condition pKa_features
    Processing pKa feature pka_aHs with special handling...
      Created indicator: has_acidic_H_for_pka_aHs
      Created interaction: pka_aHs_x_has_acidic_H
      Used 50.0 for molecules without acidic H
    pka_aHs: 28 -> 0 NA values
    Processing pKa feature pka_lowest with special handling...
      Created indicator: has_acidic_H_for_pka_lowest
      Created interaction: pka_lowest_x_has_acidic_H
      Used 50.0 for molecules without acidic H
    pka_lowest: 38 -> 0 NA values

Handling remaining NA values...

Encoding categorical features...
  Removed identifier feature: name
  Found categorical feature class with 4 unique values: ['aromatic' 'hetero' 'aliphatic' 'mixture']
    One-hot encoded class -> 4 features: ['class_aliphatic', 'class_aromatic', 'class_hetero', 'class_mixture']
  Removed identifier feature: smiles
  Processed 1 categorical features
  Removed 2 identifier features: ['name', 'smiles']

Creating feature quality indicators...
  Added indicator: has_num_Hs
  Added indicator: has_pKa_features
Preprocessing complete. Shape: (46, 65)
Remaining NA values: 0
Found 1 pKa-dependent features: ['pka_basic']
Warning: num_Hs column not found, cannot properly handle pKa features
Found 15 heteroatom-dependent features: ['BV_main_1', 'Charges_main_atom', 'fukui_E_main_atom', 'fukui_N_main_atom', 'L_main_atom_1', 'B1_main_atom_1', 'B5_main_atom_1', 'Charges_secondary_1', 'fukui_N_secondary_1', 'Charges_secondary_avg', 'fukui_N_secondary_avg', 'FCS_1', 'FREQS_1', 'FCS_avg', 'FREQS_avg']

Handling remaining NA values...
  pka_basic: Filled 1 NA values with median/zero
  smiles: Filled 1 NA values with mode/unknown
  class: Filled 1 NA values with mode/unknown

Encoding categorical features...
  Removed identifier feature: name
  Removed identifier feature: smiles
  Found categorical feature class with 5 unique values: ['1_aliphatic' '1_aromatic' '2_aliphatic' '1_mixture' '2_mixture']
    One-hot encoded class -> 5 features: ['class_1_aliphatic', 'class_1_aromatic', 'class_1_mixture', 'class_2_aliphatic', 'class_2_mixture']
  Processed 1 categorical features
  Removed 2 identifier features: ['name', 'smiles']

Creating feature quality indicators...
Preprocessing complete. Shape: (55, 40)
Remaining NA values: 0
Loaded reaction energy features: 1488 rows, 8 features

=== Selecting Features (selected) ===
Final selected features (8): ['acyl_pka_aHs_x_has_acidic_H', 'amine_BV_secondary_avg', 'amine_class_1_mixture', 'acyl_class_aromatic', 'amine_pka_basic', 'acyl_Charges_secondary_1', 'amine_Charges_secondary_1', 'acyl_BV_secondary_2']
=== Building HTE Prediction Models with 8 features ===
Selected features: ['acyl_pka_aHs_x_has_acidic_H', 'amine_BV_secondary_avg', 'amine_class_1_mixture', 'acyl_class_aromatic', 'amine_pka_basic', 'acyl_Charges_secondary_1', 'amine_Charges_secondary_1', 'acyl_BV_secondary_2']
Valid features: 17
=== Building Regression Model ===
Regression dataset: (1031, 17)
Target range: -1.418 to 4.010


Training data: 619 samples
Test data: 206 samples


Train-only SFS selected 16 features for regression
Running hyperparameter optimization for regression...
[I 2025-08-20 03:17:29,575] A new study created in memory with name: no-name-ef57f0f6-fe08-4055-b4b8-c4742bc52168
[I 2025-08-20 03:17:29,891] Trial 0 finished with value: 0.6540054063736789 and parameters: {'model_type': 'lgbm', 'n_estimators': 127, 'max_depth': 9, 'learning_rate': 0.02814876093813381}. Best is trial 0 with value: 0.6540054063736789.
[I 2025-08-20 03:17:29,937] Trial 1 finished with value: 0.6691743243557722 and parameters: {'model_type': 'lgbm', 'n_estimators': 67, 'max_depth': 6, 'learning_rate': 0.08815023935263168}. Best is trial 1 with value: 0.6691743243557722.
[I 2025-08-20 03:17:29,967] Trial 2 finished with value: 0.36483747248976095 and parameters: {'model_type': 'bayesian_ridge', 'alpha_1': 0.0005507989335337044, 'alpha_2': 0.00038933793323840953, 'lambda_1': 0.0007139449192863819, 'lambda_2': 0.0008204247871160755}. Best is trial 1 with value: 0.6691743243557722.
[I 2025-08-20 03:17:29,969] Trial 3 finished with value: 0.36486779676758585 and parameters: {'model_type': 'bayesian_ridge', 'alpha_1': 0.00046901986064910606, 'alpha_2': 0.0008453086666191464, 'lambda_1': 0.0005873568528359929, 'lambda_2': 0.00010868711154374089}. Best is trial 1 with value: 0.6691743243557722.
[I 2025-08-20 03:17:35,281] Trial 4 finished with value: 0.6920927592999397 and parameters: {'model_type': 'cat', 'iterations': 692, 'depth': 6, 'learning_rate': 0.07746162884609584}. Best is trial 4 with value: 0.6920927592999397.
[I 2025-08-20 03:17:35,806] Trial 5 finished with value: 0.6093206496796515 and parameters: {'model_type': 'xgb', 'n_estimators': 83, 'max_depth': 6, 'learning_rate': 0.28204171351446716}. Best is trial 4 with value: 0.6920927592999397.
[I 2025-08-20 03:17:35,811] Trial 6 finished with value: 0.3648567798597141 and parameters: {'model_type': 'bayesian_ridge', 'alpha_1': 0.0009490946640138102, 'alpha_2': 9.969212331242089e-06, 'lambda_1': 0.0009732523271557768, 'lambda_2': 0.00037519557158403416}. Best is trial 4 with value: 0.6920927592999397.
[I 2025-08-20 03:17:36,373] Trial 7 finished with value: 0.6234016674282055 and parameters: {'model_type': 'xgb', 'n_estimators': 129, 'max_depth': 5, 'learning_rate': 0.015912564902938298}. Best is trial 4 with value: 0.6920927592999397.
[I 2025-08-20 03:17:36,426] Trial 8 finished with value: 0.6660603720483925 and parameters: {'model_type': 'lgbm', 'n_estimators': 60, 'max_depth': 9, 'learning_rate': 0.11458358364408482}. Best is trial 4 with value: 0.6920927592999397.
[I 2025-08-20 03:17:43,086] Trial 9 finished with value: 0.6942361825010983 and parameters: {'model_type': 'cat', 'iterations': 734, 'depth': 4, 'learning_rate': 0.04942880568931392}. Best is trial 9 with value: 0.6942361825010983.
[I 2025-08-20 03:17:53,230] Trial 10 finished with value: 0.6870241326289023 and parameters: {'model_type': 'cat', 'iterations': 792, 'depth': 4, 'learning_rate': 0.20456117319189704}. Best is trial 9 with value: 0.6942361825010983.
[I 2025-08-20 03:17:59,788] Trial 11 finished with value: 0.6865265536752978 and parameters: {'model_type': 'cat', 'iterations': 683, 'depth': 5, 'learning_rate': 0.0923427300774261}. Best is trial 9 with value: 0.6942361825010983.
[I 2025-08-20 03:18:00,531] Trial 12 finished with value: 0.6229216437248124 and parameters: {'model_type': 'rf', 'n_estimators': 196, 'max_depth': 15, 'min_samples_split': 2}. Best is trial 9 with value: 0.6942361825010983.
[I 2025-08-20 03:18:03,506] Trial 13 finished with value: 0.6579220766521503 and parameters: {'model_type': 'cat', 'iterations': 479, 'depth': 8, 'learning_rate': 0.16045845174635054}. Best is trial 9 with value: 0.6942361825010983.
[I 2025-08-20 03:18:13,311] Trial 14 finished with value: 0.6859601133539387 and parameters: {'model_type': 'cat', 'iterations': 650, 'depth': 6, 'learning_rate': 0.08098680360318865}. Best is trial 9 with value: 0.6942361825010983.
[I 2025-08-20 03:18:16,572] Trial 15 finished with value: 0.6420290941223599 and parameters: {'model_type': 'cat', 'iterations': 224, 'depth': 10, 'learning_rate': 0.05171518208750107}. Best is trial 9 with value: 0.6942361825010983.
[I 2025-08-20 03:18:17,137] Trial 16 finished with value: 0.6232230505038756 and parameters: {'model_type': 'rf', 'n_estimators': 190, 'max_depth': 14, 'min_samples_split': 10}. Best is trial 9 with value: 0.6942361825010983.
[I 2025-08-20 03:18:26,335] Trial 17 finished with value: 0.696246675024375 and parameters: {'model_type': 'cat', 'iterations': 559, 'depth': 7, 'learning_rate': 0.13314629444288953}. Best is trial 17 with value: 0.696246675024375.
[I 2025-08-20 03:18:30,732] Trial 18 finished with value: 0.6636019622725993 and parameters: {'model_type': 'cat', 'iterations': 496, 'depth': 8, 'learning_rate': 0.14813461547471782}. Best is trial 17 with value: 0.696246675024375.
[I 2025-08-20 03:18:35,615] Trial 19 finished with value: 0.6629418012933359 and parameters: {'model_type': 'cat', 'iterations': 360, 'depth': 4, 'learning_rate': 0.20452085355243094}. Best is trial 17 with value: 0.696246675024375.
[I 2025-08-20 03:18:36,115] Trial 20 finished with value: 0.6216642863322763 and parameters: {'model_type': 'rf', 'n_estimators': 164, 'max_depth': 11, 'min_samples_split': 6}. Best is trial 17 with value: 0.696246675024375.
[I 2025-08-20 03:18:44,321] Trial 21 finished with value: 0.7084470651895538 and parameters: {'model_type': 'cat', 'iterations': 656, 'depth': 7, 'learning_rate': 0.12930766667268084}. Best is trial 21 with value: 0.7084470651895538.
[I 2025-08-20 03:18:52,086] Trial 22 finished with value: 0.6770836055412913 and parameters: {'model_type': 'cat', 'iterations': 597, 'depth': 7, 'learning_rate': 0.13975502638975965}. Best is trial 21 with value: 0.7084470651895538.
[I 2025-08-20 03:19:08,015] Trial 23 finished with value: 0.6890083511308898 and parameters: {'model_type': 'cat', 'iterations': 760, 'depth': 8, 'learning_rate': 0.18669197074872954}. Best is trial 21 with value: 0.7084470651895538.
[I 2025-08-20 03:19:33,994] Trial 24 finished with value: 0.6871873660384763 and parameters: {'model_type': 'cat', 'iterations': 576, 'depth': 10, 'learning_rate': 0.24418900047391506}. Best is trial 21 with value: 0.7084470651895538.
[I 2025-08-20 03:19:36,196] Trial 25 finished with value: 0.6724545651731464 and parameters: {'model_type': 'xgb', 'n_estimators': 98, 'max_depth': 3, 'learning_rate': 0.11947185006309316}. Best is trial 21 with value: 0.7084470651895538.
[I 2025-08-20 03:19:41,514] Trial 26 finished with value: 0.6906069409529509 and parameters: {'model_type': 'cat', 'iterations': 569, 'depth': 7, 'learning_rate': 0.05329606501129293}. Best is trial 21 with value: 0.7084470651895538.
[I 2025-08-20 03:19:52,896] Trial 27 finished with value: 0.6773873631655469 and parameters: {'model_type': 'cat', 'iterations': 723, 'depth': 6, 'learning_rate': 0.1750356722626133}. Best is trial 21 with value: 0.7084470651895538.
[I 2025-08-20 03:20:11,287] Trial 28 finished with value: 0.6890450331203767 and parameters: {'model_type': 'cat', 'iterations': 617, 'depth': 9, 'learning_rate': 0.12175016814617685}. Best is trial 21 with value: 0.7084470651895538.
[I 2025-08-20 03:20:11,355] Trial 29 finished with value: 0.679978078499859 and parameters: {'model_type': 'lgbm', 'n_estimators': 156, 'max_depth': 3, 'learning_rate': 0.055066072286189885}. Best is trial 21 with value: 0.7084470651895538.
[I 2025-08-20 03:20:13,766] Trial 30 finished with value: 0.5811556315286754 and parameters: {'model_type': 'xgb', 'n_estimators': 107, 'max_depth': 8, 'learning_rate': 0.22593488198560563}. Best is trial 21 with value: 0.7084470651895538.
[I 2025-08-20 03:20:20,044] Trial 31 finished with value: 0.6898074668985001 and parameters: {'model_type': 'cat', 'iterations': 699, 'depth': 6, 'learning_rate': 0.07222140977775313}. Best is trial 21 with value: 0.7084470651895538.
[I 2025-08-20 03:20:28,520] Trial 32 finished with value: 0.6982840841270533 and parameters: {'model_type': 'cat', 'iterations': 674, 'depth': 7, 'learning_rate': 0.10978507144764457}. Best is trial 21 with value: 0.7084470651895538.
[I 2025-08-20 03:20:28,602] Trial 33 finished with value: 0.699022876210662 and parameters: {'model_type': 'lgbm', 'n_estimators': 161, 'max_depth': 4, 'learning_rate': 0.11325047947638182}. Best is trial 21 with value: 0.7084470651895538.
[I 2025-08-20 03:20:28,676] Trial 34 finished with value: 0.6963401943065566 and parameters: {'model_type': 'lgbm', 'n_estimators': 157, 'max_depth': 4, 'learning_rate': 0.10802281031753141}. Best is trial 21 with value: 0.7084470651895538.
[I 2025-08-20 03:20:28,749] Trial 35 finished with value: 0.6944508526177083 and parameters: {'model_type': 'lgbm', 'n_estimators': 158, 'max_depth': 4, 'learning_rate': 0.10127574773846165}. Best is trial 21 with value: 0.7084470651895538.
[I 2025-08-20 03:20:28,823] Trial 36 finished with value: 0.6918475079882862 and parameters: {'model_type': 'lgbm', 'n_estimators': 174, 'max_depth': 4, 'learning_rate': 0.10689099230684687}. Best is trial 21 with value: 0.7084470651895538.
[I 2025-08-20 03:20:28,894] Trial 37 finished with value: 0.6946115402474401 and parameters: {'model_type': 'lgbm', 'n_estimators': 145, 'max_depth': 5, 'learning_rate': 0.15885783936179135}. Best is trial 21 with value: 0.7084470651895538.
[I 2025-08-20 03:20:28,949] Trial 38 finished with value: 0.684728284584677 and parameters: {'model_type': 'lgbm', 'n_estimators': 140, 'max_depth': 4, 'learning_rate': 0.13272593601832852}. Best is trial 21 with value: 0.7084470651895538.
[I 2025-08-20 03:20:28,961] Trial 39 finished with value: 0.36483638553243525 and parameters: {'model_type': 'bayesian_ridge', 'alpha_1': 2.8850852375583496e-05, 'alpha_2': 0.0009739136831875019, 'lambda_1': 0.00027316428968111796, 'lambda_2': 0.0008343560758081534}. Best is trial 21 with value: 0.7084470651895538.
[I 2025-08-20 03:20:29,042] Trial 40 finished with value: 0.6768614662399483 and parameters: {'model_type': 'lgbm', 'n_estimators': 177, 'max_depth': 5, 'learning_rate': 0.10248481611637784}. Best is trial 21 with value: 0.7084470651895538.
[I 2025-08-20 03:20:29,097] Trial 41 finished with value: 0.6860247270848381 and parameters: {'model_type': 'lgbm', 'n_estimators': 178, 'max_depth': 3, 'learning_rate': 0.13053812691514294}. Best is trial 21 with value: 0.7084470651895538.
[I 2025-08-20 03:20:29,107] Trial 42 finished with value: 0.3648679709723286 and parameters: {'model_type': 'bayesian_ridge', 'alpha_1': 6.40789496092586e-05, 'alpha_2': 0.0004713637799503385, 'lambda_1': 8.965161074630623e-06, 'lambda_2': 8.762039508369932e-05}. Best is trial 21 with value: 0.7084470651895538.
[I 2025-08-20 03:20:29,177] Trial 43 finished with value: 0.6615507597561203 and parameters: {'model_type': 'lgbm', 'n_estimators': 111, 'max_depth': 7, 'learning_rate': 0.14632661110425407}. Best is trial 21 with value: 0.7084470651895538.
[I 2025-08-20 03:20:29,232] Trial 44 finished with value: 0.6898344614267896 and parameters: {'model_type': 'lgbm', 'n_estimators': 142, 'max_depth': 4, 'learning_rate': 0.07289346099771928}. Best is trial 21 with value: 0.7084470651895538.
[I 2025-08-20 03:20:29,243] Trial 45 finished with value: 0.36484921193701225 and parameters: {'model_type': 'bayesian_ridge', 'alpha_1': 0.0009616606375565232, 'alpha_2': 3.856172109527713e-05, 'lambda_1': 0.00029285362605780687, 'lambda_2': 0.0005324078756057196}. Best is trial 21 with value: 0.7084470651895538.
[I 2025-08-20 03:20:29,740] Trial 46 finished with value: 0.620017730388931 and parameters: {'model_type': 'rf', 'n_estimators': 167, 'max_depth': 11, 'min_samples_split': 10}. Best is trial 21 with value: 0.7084470651895538.
[I 2025-08-20 03:20:32,759] Trial 47 finished with value: 0.6239280780166828 and parameters: {'model_type': 'xgb', 'n_estimators': 152, 'max_depth': 6, 'learning_rate': 0.1735141864660928}. Best is trial 21 with value: 0.7084470651895538.
[I 2025-08-20 03:20:32,868] Trial 48 finished with value: 0.6884724478700049 and parameters: {'model_type': 'lgbm', 'n_estimators': 189, 'max_depth': 5, 'learning_rate': 0.11952623186877304}. Best is trial 21 with value: 0.7084470651895538.
[I 2025-08-20 03:20:35,872] Trial 49 finished with value: 0.6641792729805831 and parameters: {'model_type': 'cat', 'iterations': 415, 'depth': 7, 'learning_rate': 0.09664252501680336}. Best is trial 21 with value: 0.7084470651895538.
Regression Results:
  Train R²: 0.963
  Test R²: 0.708
  CV R²: 0.536 ± 0.179

=== Generating Visualizations ===
=== Evaluating CatBoost with Parity Plots ===
Model Performance:
  Train R²: 0.963, MAE: 0.123, RMSE: 0.180
  Test R²: 0.708, MAE: 0.345, RMSE: 0.487
Generating parity plots...
Parity plot saved as: plots/parity_plot_catboost_train_each_8_optuna_train.png
Parity plot saved as: plots/parity_plot_catboost_test_each_8_optuna_test.png
Parity analysis plot saved as: plots/parity_analysis_catboost_test_each_8_optuna_analysis.png
Saved predictions to results/predictions_each_8_optuna.csv
Saved combined dataset to results/combined_df_each_8_optuna.csv
Models saved with suffix: _each_8_optuna
HTE prediction evaluation report saved to results/reports/hte_prediction_report_manual_8_each_8_optuna.txt

=== Comparing without reaction-energy features (HTE prediction) ===
=== Building HTE Prediction Models with 8 features ===
Selected features: ['acyl_pka_aHs_x_has_acidic_H', 'amine_BV_secondary_avg', 'amine_class_1_mixture', 'acyl_class_aromatic', 'amine_pka_basic', 'acyl_Charges_secondary_1', 'amine_Charges_secondary_1', 'acyl_BV_secondary_2']
Valid features: 9
=== Building Regression Model ===
Regression dataset: (1031, 9)
Target range: -1.418 to 4.010


Training data: 619 samples
Test data: 206 samples


Train-only SFS selected 8 features for regression
Running hyperparameter optimization for regression...
[I 2025-08-20 03:21:54,596] A new study created in memory with name: no-name-7859974c-46c9-4937-a90d-a69556482c41
[I 2025-08-20 03:21:54,600] Trial 0 finished with value: 0.40681896808660845 and parameters: {'model_type': 'bayesian_ridge', 'alpha_1': 0.000539175286247078, 'alpha_2': 0.0007742404178096966, 'lambda_1': 0.0007783872011170373, 'lambda_2': 0.0008770686663571856}. Best is trial 0 with value: 0.40681896808660845.
[I 2025-08-20 03:21:54,602] Trial 1 finished with value: 0.40682819491309297 and parameters: {'model_type': 'bayesian_ridge', 'alpha_1': 0.0009517816324858677, 'alpha_2': 0.0006036130070807339, 'lambda_1': 1.1979382251731073e-05, 'lambda_2': 0.0002012054465659761}. Best is trial 1 with value: 0.40682819491309297.
[I 2025-08-20 03:21:54,715] Trial 2 finished with value: 0.7072759294228101 and parameters: {'model_type': 'rf', 'n_estimators': 77, 'max_depth': 7, 'min_samples_split': 2}. Best is trial 2 with value: 0.7072759294228101.
[I 2025-08-20 03:21:57,203] Trial 3 finished with value: 0.7301345848571862 and parameters: {'model_type': 'cat', 'iterations': 255, 'depth': 5, 'learning_rate': 0.2750324084027107}. Best is trial 3 with value: 0.7301345848571862.
[I 2025-08-20 03:21:57,241] Trial 4 finished with value: 0.7495708686485824 and parameters: {'model_type': 'lgbm', 'n_estimators': 70, 'max_depth': 6, 'learning_rate': 0.1355154763122927}. Best is trial 4 with value: 0.7495708686485824.
[I 2025-08-20 03:21:57,298] Trial 5 finished with value: 0.7656513331092011 and parameters: {'model_type': 'lgbm', 'n_estimators': 179, 'max_depth': 4, 'learning_rate': 0.0644109443770504}. Best is trial 5 with value: 0.7656513331092011.
[I 2025-08-20 03:22:15,106] Trial 6 finished with value: 0.7578766688823448 and parameters: {'model_type': 'cat', 'iterations': 695, 'depth': 10, 'learning_rate': 0.11461755850821695}. Best is trial 5 with value: 0.7656513331092011.
[I 2025-08-20 03:22:15,401] Trial 7 finished with value: 0.7420785651212225 and parameters: {'model_type': 'xgb', 'n_estimators': 88, 'max_depth': 4, 'learning_rate': 0.24998763925899242}. Best is trial 5 with value: 0.7656513331092011.
[I 2025-08-20 03:22:16,196] Trial 8 finished with value: 0.7065495940190616 and parameters: {'model_type': 'xgb', 'n_estimators': 101, 'max_depth': 9, 'learning_rate': 0.031987995161234815}. Best is trial 5 with value: 0.7656513331092011.
[I 2025-08-20 03:22:16,198] Trial 9 finished with value: 0.4068215397818796 and parameters: {'model_type': 'bayesian_ridge', 'alpha_1': 3.5508373289898734e-05, 'alpha_2': 0.0009740733843112327, 'lambda_1': 0.0007032292247135312, 'lambda_2': 0.0006959823850492519}. Best is trial 5 with value: 0.7656513331092011.
[I 2025-08-20 03:22:16,259] Trial 10 finished with value: 0.6076567912048312 and parameters: {'model_type': 'lgbm', 'n_estimators': 196, 'max_depth': 3, 'learning_rate': 0.011928553644263477}. Best is trial 5 with value: 0.7656513331092011.
[I 2025-08-20 03:22:31,588] Trial 11 finished with value: 0.7558416092708486 and parameters: {'model_type': 'cat', 'iterations': 792, 'depth': 10, 'learning_rate': 0.12392451938540175}. Best is trial 5 with value: 0.7656513331092011.
[I 2025-08-20 03:22:31,675] Trial 12 finished with value: 0.7629559666083299 and parameters: {'model_type': 'lgbm', 'n_estimators': 173, 'max_depth': 5, 'learning_rate': 0.0892488936353136}. Best is trial 5 with value: 0.7656513331092011.
[I 2025-08-20 03:22:31,817] Trial 13 finished with value: 0.7620291335835505 and parameters: {'model_type': 'lgbm', 'n_estimators': 178, 'max_depth': 5, 'learning_rate': 0.07277814374188167}. Best is trial 5 with value: 0.7656513331092011.
