[I 2025-08-20 02:20:49,326] Trial 16 finished with value: 0.7950089346850475 and parameters: {'model_type': 'cat', 'iterations': 340, 'depth': 4, 'learning_rate': 0.11927076520071259}. Best is trial 10 with value: 0.8007526093504993.
[I 2025-08-20 02:20:55,184] Trial 17 finished with value: 0.7877696418135327 and parameters: {'model_type': 'cat', 'iterations': 545, 'depth': 6, 'learning_rate': 0.1964961290077808}. Best is trial 10 with value: 0.8007526093504993.
[I 2025-08-20 02:20:58,008] Trial 18 finished with value: 0.7955171301652254 and parameters: {'model_type': 'cat', 'iterations': 203, 'depth': 8, 'learning_rate': 0.2985702600702244}. Best is trial 10 with value: 0.8007526093504993.
[I 2025-08-20 02:20:58,236] Trial 19 finished with value: 0.7450570884475001 and parameters: {'model_type': 'xgb', 'n_estimators': 98, 'max_depth': 3, 'learning_rate': 0.08900241839764098}. Best is trial 10 with value: 0.8007526093504993.
[I 2025-08-20 02:20:58,294] Trial 20 finished with value: 0.763090450741654 and parameters: {'model_type': 'lgbm', 'n_estimators': 114, 'max_depth': 5, 'learning_rate': 0.16493692914308072}. Best is trial 10 with value: 0.8007526093504993.
[I 2025-08-20 02:21:02,644] Trial 21 finished with value: 0.7975729400601321 and parameters: {'model_type': 'cat', 'iterations': 419, 'depth': 6, 'learning_rate': 0.21220706506017592}. Best is trial 10 with value: 0.8007526093504993.
[I 2025-08-20 02:21:05,476] Trial 22 finished with value: 0.8000804058456124 and parameters: {'model_type': 'cat', 'iterations': 340, 'depth': 5, 'learning_rate': 0.22771617306942188}. Best is trial 10 with value: 0.8007526093504993.
[I 2025-08-20 02:21:12,948] Trial 23 finished with value: 0.7508476201946588 and parameters: {'model_type': 'cat', 'iterations': 786, 'depth': 5, 'learning_rate': 0.23493701510932025}. Best is trial 10 with value: 0.8007526093504993.
[I 2025-08-20 02:21:19,506] Trial 24 finished with value: 0.7968026156024953 and parameters: {'model_type': 'cat', 'iterations': 475, 'depth': 7, 'learning_rate': 0.22918525508154533}. Best is trial 10 with value: 0.8007526093504993.
[I 2025-08-20 02:21:19,517] Trial 25 finished with value: 0.34515853860944956 and parameters: {'model_type': 'bayesian_ridge', 'alpha_1': 0.0009710657512831345, 'alpha_2': 0.0009846895756257146, 'lambda_1': 1.9417604154097986e-05, 'lambda_2': 3.513082867457679e-05}. Best is trial 10 with value: 0.8007526093504993.
[I 2025-08-20 02:21:22,377] Trial 26 finished with value: 0.7956857870733132 and parameters: {'model_type': 'cat', 'iterations': 339, 'depth': 5, 'learning_rate': 0.22210820386176525}. Best is trial 10 with value: 0.8007526093504993.
[I 2025-08-20 02:21:27,428] Trial 27 finished with value: 0.792717718375488 and parameters: {'model_type': 'cat', 'iterations': 301, 'depth': 7, 'learning_rate': 0.26417320400021604}. Best is trial 10 with value: 0.8007526093504993.
[I 2025-08-20 02:21:33,904] Trial 28 finished with value: 0.8019452038986192 and parameters: {'model_type': 'cat', 'iterations': 398, 'depth': 5, 'learning_rate': 0.14621820482280484}. Best is trial 28 with value: 0.8019452038986192.
[I 2025-08-20 02:21:34,083] Trial 29 finished with value: 0.7992812833690082 and parameters: {'model_type': 'lgbm', 'n_estimators': 200, 'max_depth': 10, 'learning_rate': 0.09519989955412039}. Best is trial 28 with value: 0.8019452038986192.
[I 2025-08-20 02:21:34,666] Trial 30 finished with value: 0.7714962688388642 and parameters: {'model_type': 'xgb', 'n_estimators': 133, 'max_depth': 5, 'learning_rate': 0.14019457046063877}. Best is trial 28 with value: 0.8019452038986192.
[I 2025-08-20 02:21:34,794] Trial 31 finished with value: 0.6941627823692164 and parameters: {'model_type': 'lgbm', 'n_estimators': 198, 'max_depth': 10, 'learning_rate': 0.010938407826198093}. Best is trial 28 with value: 0.8019452038986192.
[I 2025-08-20 02:21:34,868] Trial 32 finished with value: 0.7898004493483614 and parameters: {'model_type': 'lgbm', 'n_estimators': 103, 'max_depth': 10, 'learning_rate': 0.10494378712584579}. Best is trial 28 with value: 0.8019452038986192.
[I 2025-08-20 02:21:34,944] Trial 33 finished with value: 0.7869066702350949 and parameters: {'model_type': 'lgbm', 'n_estimators': 153, 'max_depth': 7, 'learning_rate': 0.07930648510107245}. Best is trial 28 with value: 0.8019452038986192.
[I 2025-08-20 02:21:35,053] Trial 34 finished with value: 0.7886867132679779 and parameters: {'model_type': 'lgbm', 'n_estimators': 197, 'max_depth': 9, 'learning_rate': 0.1445462106223154}. Best is trial 28 with value: 0.8019452038986192.
[I 2025-08-20 02:21:35,063] Trial 35 finished with value: 0.34515923080900845 and parameters: {'model_type': 'bayesian_ridge', 'alpha_1': 1.9378202129108606e-05, 'alpha_2': 0.0007612888466946282, 'lambda_1': 8.291341306907395e-05, 'lambda_2': 0.000992805215662262}. Best is trial 28 with value: 0.8019452038986192.
[I 2025-08-20 02:21:35,119] Trial 36 finished with value: 0.7849741446932179 and parameters: {'model_type': 'lgbm', 'n_estimators': 85, 'max_depth': 6, 'learning_rate': 0.10444279498552028}. Best is trial 28 with value: 0.8019452038986192.
[I 2025-08-20 02:21:35,358] Trial 37 finished with value: 0.762168282708633 and parameters: {'model_type': 'rf', 'n_estimators': 119, 'max_depth': 13, 'min_samples_split': 2}. Best is trial 28 with value: 0.8019452038986192.
[I 2025-08-20 02:21:39,587] Trial 38 finished with value: 0.7770659036359809 and parameters: {'model_type': 'cat', 'iterations': 534, 'depth': 5, 'learning_rate': 0.04720392993050318}. Best is trial 28 with value: 0.8019452038986192.
[I 2025-08-20 02:21:39,697] Trial 39 finished with value: 0.7434064455850525 and parameters: {'model_type': 'rf', 'n_estimators': 55, 'max_depth': 12, 'min_samples_split': 10}. Best is trial 28 with value: 0.8019452038986192.
[I 2025-08-20 02:21:39,707] Trial 40 finished with value: 0.3451587500470301 and parameters: {'model_type': 'bayesian_ridge', 'alpha_1': 3.540891156623093e-05, 'alpha_2': 0.0004145212981854933, 'lambda_1': 0.0009392100921861973, 'lambda_2': 0.00037088761909892623}. Best is trial 28 with value: 0.8019452038986192.
[I 2025-08-20 02:21:44,203] Trial 41 finished with value: 0.793122039459614 and parameters: {'model_type': 'cat', 'iterations': 405, 'depth': 5, 'learning_rate': 0.21370985446800808}. Best is trial 28 with value: 0.8019452038986192.
[I 2025-08-20 02:21:46,960] Trial 42 finished with value: 0.800160812054845 and parameters: {'model_type': 'cat', 'iterations': 378, 'depth': 4, 'learning_rate': 0.178787423222233}. Best is trial 28 with value: 0.8019452038986192.
[I 2025-08-20 02:21:49,717] Trial 43 finished with value: 0.8016061771742728 and parameters: {'model_type': 'cat', 'iterations': 375, 'depth': 4, 'learning_rate': 0.18505354558648335}. Best is trial 28 with value: 0.8019452038986192.
[I 2025-08-20 02:21:54,549] Trial 44 finished with value: 0.8002719561634709 and parameters: {'model_type': 'cat', 'iterations': 365, 'depth': 4, 'learning_rate': 0.17882154374283732}. Best is trial 28 with value: 0.8019452038986192.
[I 2025-08-20 02:21:57,348] Trial 45 finished with value: 0.8024747236892348 and parameters: {'model_type': 'cat', 'iterations': 389, 'depth': 4, 'learning_rate': 0.18195984529755066}. Best is trial 45 with value: 0.8024747236892348.
[I 2025-08-20 02:22:02,073] Trial 46 finished with value: 0.7919282935870526 and parameters: {'model_type': 'cat', 'iterations': 264, 'depth': 4, 'learning_rate': 0.15232587013002014}. Best is trial 45 with value: 0.8024747236892348.
[I 2025-08-20 02:22:05,044] Trial 47 finished with value: 0.7968224015166472 and parameters: {'model_type': 'cat', 'iterations': 483, 'depth': 4, 'learning_rate': 0.1800011475953302}. Best is trial 45 with value: 0.8024747236892348.
[I 2025-08-20 02:22:07,712] Trial 48 finished with value: 0.8031148538635257 and parameters: {'model_type': 'cat', 'iterations': 272, 'depth': 4, 'learning_rate': 0.19026783709094908}. Best is trial 48 with value: 0.8031148538635257.
[I 2025-08-20 02:22:12,390] Trial 49 finished with value: 0.801063391267677 and parameters: {'model_type': 'cat', 'iterations': 271, 'depth': 4, 'learning_rate': 0.15947692463442797}. Best is trial 48 with value: 0.8031148538635257.
Regression Results:
  Train R²: 0.943
  Test R²: 0.803
  CV R²: 0.501 ± 0.252
Saved comparison to results/rxn_feature_comparison_hte_each_8_optuna.json

==================================================
ANALYSIS COMPLETE
==================================================
Check the following directories for outputs:
  - plots/: Visualization files
  - results/: Data files and reports
  - models/: Trained model files
