[I 2025-08-20 04:28:58,263] Trial 14 finished with value: 0.6771207694049688 and parameters: {'model_type': 'cat', 'iterations': 781, 'depth': 10, 'learning_rate': 0.09195425987800047}. Best is trial 12 with value: 0.7575178578775186.
[I 2025-08-20 04:29:02,557] Trial 15 finished with value: 0.6915780000612166 and parameters: {'model_type': 'xgb', 'n_estimators': 82, 'max_depth': 8, 'learning_rate': 0.2131982022184615}. Best is trial 12 with value: 0.7575178578775186.
[I 2025-08-20 04:29:02,616] Trial 16 finished with value: 0.7592660486027669 and parameters: {'model_type': 'lgbm', 'n_estimators': 142, 'max_depth': 3, 'learning_rate': 0.17618709788142664}. Best is trial 16 with value: 0.7592660486027669.
[I 2025-08-20 04:29:02,701] Trial 17 finished with value: 0.7132890387582603 and parameters: {'model_type': 'lgbm', 'n_estimators': 144, 'max_depth': 7, 'learning_rate': 0.24527282675353118}. Best is trial 16 with value: 0.7592660486027669.
[I 2025-08-20 04:29:02,739] Trial 18 finished with value: 0.74620021130043 and parameters: {'model_type': 'lgbm', 'n_estimators': 135, 'max_depth': 3, 'learning_rate': 0.1831246098707318}. Best is trial 16 with value: 0.7592660486027669.
[I 2025-08-20 04:29:05,626] Trial 19 finished with value: 0.6947374488005282 and parameters: {'model_type': 'cat', 'iterations': 229, 'depth': 9, 'learning_rate': 0.2392888584722331}. Best is trial 16 with value: 0.7592660486027669.
[I 2025-08-20 04:29:05,638] Trial 20 finished with value: 0.3711160698939324 and parameters: {'model_type': 'bayesian_ridge', 'alpha_1': 4.517422307788487e-05, 'alpha_2': 0.0009508253148021635, 'lambda_1': 0.0009746859288673593, 'lambda_2': 0.0007140150561062801}. Best is trial 16 with value: 0.7592660486027669.
[I 2025-08-20 04:29:05,778] Trial 21 finished with value: 0.7386835642688834 and parameters: {'model_type': 'lgbm', 'n_estimators': 100, 'max_depth': 4, 'learning_rate': 0.1637360251199746}. Best is trial 16 with value: 0.7592660486027669.
[I 2025-08-20 04:29:05,836] Trial 22 finished with value: 0.7397429767741897 and parameters: {'model_type': 'lgbm', 'n_estimators': 63, 'max_depth': 4, 'learning_rate': 0.1267833759373459}. Best is trial 16 with value: 0.7592660486027669.
[I 2025-08-20 04:29:05,965] Trial 23 finished with value: 0.7352496723522729 and parameters: {'model_type': 'lgbm', 'n_estimators': 149, 'max_depth': 5, 'learning_rate': 0.077155319321605}. Best is trial 16 with value: 0.7592660486027669.
[I 2025-08-20 04:29:06,040] Trial 24 finished with value: 0.7490460625655829 and parameters: {'model_type': 'lgbm', 'n_estimators': 119, 'max_depth': 3, 'learning_rate': 0.17903526106424283}. Best is trial 16 with value: 0.7592660486027669.
[I 2025-08-20 04:29:06,469] Trial 25 finished with value: 0.7378789988559029 and parameters: {'model_type': 'xgb', 'n_estimators': 95, 'max_depth': 5, 'learning_rate': 0.14219182010528197}. Best is trial 16 with value: 0.7592660486027669.
[I 2025-08-20 04:29:06,564] Trial 26 finished with value: 0.7329171798082788 and parameters: {'model_type': 'lgbm', 'n_estimators': 132, 'max_depth': 7, 'learning_rate': 0.19039763720567723}. Best is trial 16 with value: 0.7592660486027669.
[I 2025-08-20 04:29:06,600] Trial 27 finished with value: 0.7476965039463294 and parameters: {'model_type': 'lgbm', 'n_estimators': 67, 'max_depth': 4, 'learning_rate': 0.25745940177908033}. Best is trial 16 with value: 0.7592660486027669.
[I 2025-08-20 04:29:06,712] Trial 28 finished with value: 0.7475822932305769 and parameters: {'model_type': 'lgbm', 'n_estimators': 163, 'max_depth': 8, 'learning_rate': 0.09900213405343553}. Best is trial 16 with value: 0.7592660486027669.
[I 2025-08-20 04:29:06,909] Trial 29 finished with value: 0.7504712966250896 and parameters: {'model_type': 'xgb', 'n_estimators': 81, 'max_depth': 3, 'learning_rate': 0.16057008237348486}. Best is trial 16 with value: 0.7592660486027669.
[I 2025-08-20 04:29:12,049] Trial 30 finished with value: 0.6279484410420596 and parameters: {'model_type': 'cat', 'iterations': 637, 'depth': 4, 'learning_rate': 0.258298071353269}. Best is trial 16 with value: 0.7592660486027669.
[I 2025-08-20 04:29:12,256] Trial 31 finished with value: 0.7444946916654781 and parameters: {'model_type': 'xgb', 'n_estimators': 83, 'max_depth': 3, 'learning_rate': 0.16317055723130552}. Best is trial 16 with value: 0.7592660486027669.
[I 2025-08-20 04:29:12,404] Trial 32 finished with value: 0.749207619529192 and parameters: {'model_type': 'xgb', 'n_estimators': 62, 'max_depth': 3, 'learning_rate': 0.1794161741016941}. Best is trial 16 with value: 0.7592660486027669.
[I 2025-08-20 04:29:12,663] Trial 33 finished with value: 0.7431593890625814 and parameters: {'model_type': 'xgb', 'n_estimators': 75, 'max_depth': 4, 'learning_rate': 0.12911219153721953}. Best is trial 16 with value: 0.7592660486027669.
[I 2025-08-20 04:29:12,878] Trial 34 finished with value: 0.7464032754967238 and parameters: {'model_type': 'xgb', 'n_estimators': 92, 'max_depth': 3, 'learning_rate': 0.21233463925298257}. Best is trial 16 with value: 0.7592660486027669.
[I 2025-08-20 04:29:12,964] Trial 35 finished with value: 0.6764201329115014 and parameters: {'model_type': 'rf', 'n_estimators': 61, 'max_depth': 6, 'min_samples_split': 2}. Best is trial 16 with value: 0.7592660486027669.
[I 2025-08-20 04:29:12,974] Trial 36 finished with value: 0.3711184137772717 and parameters: {'model_type': 'bayesian_ridge', 'alpha_1': 0.00017206412251366538, 'alpha_2': 3.860777690471701e-05, 'lambda_1': 0.0009958960949745118, 'lambda_2': 5.330070110935736e-05}. Best is trial 16 with value: 0.7592660486027669.
[I 2025-08-20 04:29:13,143] Trial 37 finished with value: 0.7126894165334753 and parameters: {'model_type': 'rf', 'n_estimators': 108, 'max_depth': 15, 'min_samples_split': 10}. Best is trial 16 with value: 0.7592660486027669.
[I 2025-08-20 04:29:13,670] Trial 38 finished with value: 0.7290766489663222 and parameters: {'model_type': 'xgb', 'n_estimators': 119, 'max_depth': 5, 'learning_rate': 0.16039653870336282}. Best is trial 16 with value: 0.7592660486027669.
[I 2025-08-20 04:29:13,724] Trial 39 finished with value: 0.6944731660118608 and parameters: {'model_type': 'lgbm', 'n_estimators': 74, 'max_depth': 5, 'learning_rate': 0.0351614323472834}. Best is trial 16 with value: 0.7592660486027669.
[I 2025-08-20 04:29:13,734] Trial 40 finished with value: 0.37111688315095337 and parameters: {'model_type': 'bayesian_ridge', 'alpha_1': 0.00044756322933738523, 'alpha_2': 0.0009702956247977517, 'lambda_1': 5.763443794682782e-05, 'lambda_2': 0.00043510905201408725}. Best is trial 16 with value: 0.7592660486027669.
[I 2025-08-20 04:29:13,873] Trial 41 finished with value: 0.734866300168943 and parameters: {'model_type': 'xgb', 'n_estimators': 57, 'max_depth': 3, 'learning_rate': 0.18090750374287948}. Best is trial 16 with value: 0.7592660486027669.
[I 2025-08-20 04:29:14,034] Trial 42 finished with value: 0.7474769703636857 and parameters: {'model_type': 'xgb', 'n_estimators': 67, 'max_depth': 3, 'learning_rate': 0.1955221767910031}. Best is trial 16 with value: 0.7592660486027669.
[I 2025-08-20 04:29:14,177] Trial 43 finished with value: 0.7285355048040534 and parameters: {'model_type': 'xgb', 'n_estimators': 88, 'max_depth': 4, 'learning_rate': 0.14279909641785019}. Best is trial 16 with value: 0.7592660486027669.
[I 2025-08-20 04:29:14,240] Trial 44 finished with value: 0.754276502208152 and parameters: {'model_type': 'xgb', 'n_estimators': 74, 'max_depth': 3, 'learning_rate': 0.1716189103188524}. Best is trial 16 with value: 0.7592660486027669.
[I 2025-08-20 04:29:14,297] Trial 45 finished with value: 0.7600373309343156 and parameters: {'model_type': 'lgbm', 'n_estimators': 74, 'max_depth': 7, 'learning_rate': 0.11784985509511336}. Best is trial 45 with value: 0.7600373309343156.
[I 2025-08-20 04:29:14,357] Trial 46 finished with value: 0.7485081201622432 and parameters: {'model_type': 'lgbm', 'n_estimators': 71, 'max_depth': 7, 'learning_rate': 0.10876176929962496}. Best is trial 45 with value: 0.7600373309343156.
[I 2025-08-20 04:29:14,466] Trial 47 finished with value: 0.7098038155722302 and parameters: {'model_type': 'lgbm', 'n_estimators': 157, 'max_depth': 9, 'learning_rate': 0.22546250976335513}. Best is trial 45 with value: 0.7600373309343156.
[I 2025-08-20 04:29:14,509] Trial 48 finished with value: 0.721823368293688 and parameters: {'model_type': 'lgbm', 'n_estimators': 56, 'max_depth': 6, 'learning_rate': 0.061921450978334944}. Best is trial 45 with value: 0.7600373309343156.
[I 2025-08-20 04:29:14,786] Trial 49 finished with value: 0.7130269606170498 and parameters: {'model_type': 'rf', 'n_estimators': 176, 'max_depth': 10, 'min_samples_split': 8}. Best is trial 45 with value: 0.7600373309343156.
Regression Results:
  Train R²: 0.890
  Test R²: 0.760
  CV R²: 0.524 ± 0.180
Failed to save comparison file: Object of type ndarray is not JSON serializable

==================================================
ANALYSIS COMPLETE
==================================================
Check the following directories for outputs:
  - plots/: Visualization files
  - results/: Data files and reports
  - models/: Trained model files
