[I 2025-08-20 05:09:08,630] Trial 15 finished with value: 0.7873032791594192 and parameters: {'model_type': 'lgbm', 'n_estimators': 93, 'max_depth': 7, 'learning_rate': 0.21996840422824906}. Best is trial 5 with value: 0.8108547252261825.
[I 2025-08-20 05:09:08,678] Trial 16 finished with value: 0.8153921208782959 and parameters: {'model_type': 'lgbm', 'n_estimators': 93, 'max_depth': 5, 'learning_rate': 0.1254790145844532}. Best is trial 16 with value: 0.8153921208782959.
[I 2025-08-20 05:09:08,727] Trial 17 finished with value: 0.8080480576701978 and parameters: {'model_type': 'lgbm', 'n_estimators': 96, 'max_depth': 5, 'learning_rate': 0.11559741756031487}. Best is trial 16 with value: 0.8153921208782959.
[I 2025-08-20 05:09:11,679] Trial 18 finished with value: 0.7683455885722651 and parameters: {'model_type': 'cat', 'iterations': 207, 'depth': 10, 'learning_rate': 0.100854268140286}. Best is trial 16 with value: 0.8153921208782959.
[I 2025-08-20 05:09:12,085] Trial 19 finished with value: 0.7594675579886007 and parameters: {'model_type': 'xgb', 'n_estimators': 52, 'max_depth': 8, 'learning_rate': 0.084605042779173}. Best is trial 16 with value: 0.8153921208782959.
[I 2025-08-20 05:09:12,336] Trial 20 finished with value: 0.7976733195537314 and parameters: {'model_type': 'rf', 'n_estimators': 136, 'max_depth': 13, 'min_samples_split': 3}. Best is trial 16 with value: 0.8153921208782959.
[I 2025-08-20 05:09:12,432] Trial 21 finished with value: 0.8042672603289923 and parameters: {'model_type': 'lgbm', 'n_estimators': 88, 'max_depth': 5, 'learning_rate': 0.2383122394841959}. Best is trial 16 with value: 0.8153921208782959.
[I 2025-08-20 05:09:12,487] Trial 22 finished with value: 0.803935947914817 and parameters: {'model_type': 'lgbm', 'n_estimators': 80, 'max_depth': 6, 'learning_rate': 0.16919918947622561}. Best is trial 16 with value: 0.8153921208782959.
[I 2025-08-20 05:09:12,535] Trial 23 finished with value: 0.7971160351788216 and parameters: {'model_type': 'lgbm', 'n_estimators': 106, 'max_depth': 4, 'learning_rate': 0.1960586858768515}. Best is trial 16 with value: 0.8153921208782959.
[I 2025-08-20 05:09:12,547] Trial 24 finished with value: 0.45779083571992174 and parameters: {'model_type': 'bayesian_ridge', 'alpha_1': 7.543585883834864e-05, 'alpha_2': 5.9863576858891986e-05, 'lambda_1': 0.0009964102501561177, 'lambda_2': 0.0009827150662119729}. Best is trial 16 with value: 0.8153921208782959.
[I 2025-08-20 05:09:12,588] Trial 25 finished with value: 0.8012766448359812 and parameters: {'model_type': 'lgbm', 'n_estimators': 82, 'max_depth': 4, 'learning_rate': 0.14651055193092427}. Best is trial 16 with value: 0.8153921208782959.
[I 2025-08-20 05:09:12,652] Trial 26 finished with value: 0.8026032237680484 and parameters: {'model_type': 'lgbm', 'n_estimators': 130, 'max_depth': 5, 'learning_rate': 0.23611584275912562}. Best is trial 16 with value: 0.8153921208782959.
[I 2025-08-20 05:09:12,718] Trial 27 finished with value: 0.8074886353108491 and parameters: {'model_type': 'lgbm', 'n_estimators': 103, 'max_depth': 6, 'learning_rate': 0.06493594523119206}. Best is trial 16 with value: 0.8153921208782959.
[I 2025-08-20 05:09:12,751] Trial 28 finished with value: 0.7940613190032886 and parameters: {'model_type': 'lgbm', 'n_estimators': 55, 'max_depth': 4, 'learning_rate': 0.12646276693235897}. Best is trial 16 with value: 0.8153921208782959.
[I 2025-08-20 05:09:12,928] Trial 29 finished with value: 0.7890724434041299 and parameters: {'model_type': 'rf', 'n_estimators': 74, 'max_depth': 11, 'min_samples_split': 2}. Best is trial 16 with value: 0.8153921208782959.
[I 2025-08-20 05:09:14,398] Trial 30 finished with value: 0.7992046356414241 and parameters: {'model_type': 'cat', 'iterations': 205, 'depth': 4, 'learning_rate': 0.24541878662255692}. Best is trial 16 with value: 0.8153921208782959.
[I 2025-08-20 05:09:14,454] Trial 31 finished with value: 0.8151378729312866 and parameters: {'model_type': 'lgbm', 'n_estimators': 97, 'max_depth': 5, 'learning_rate': 0.11852599133837248}. Best is trial 16 with value: 0.8153921208782959.
[I 2025-08-20 05:09:14,509] Trial 32 finished with value: 0.8017765577115149 and parameters: {'model_type': 'lgbm', 'n_estimators': 104, 'max_depth': 5, 'learning_rate': 0.18280806517179968}. Best is trial 16 with value: 0.8153921208782959.
[I 2025-08-20 05:09:14,557] Trial 33 finished with value: 0.8064113953505329 and parameters: {'model_type': 'lgbm', 'n_estimators': 67, 'max_depth': 6, 'learning_rate': 0.16151439593835604}. Best is trial 16 with value: 0.8153921208782959.
[I 2025-08-20 05:09:14,610] Trial 34 finished with value: 0.8102399162652725 and parameters: {'model_type': 'lgbm', 'n_estimators': 90, 'max_depth': 5, 'learning_rate': 0.08084667029993634}. Best is trial 16 with value: 0.8153921208782959.
[I 2025-08-20 05:09:14,670] Trial 35 finished with value: 0.8037847029731163 and parameters: {'model_type': 'lgbm', 'n_estimators': 143, 'max_depth': 4, 'learning_rate': 0.07603732329374308}. Best is trial 16 with value: 0.8153921208782959.
[I 2025-08-20 05:09:14,682] Trial 36 finished with value: 0.4577785454500439 and parameters: {'model_type': 'bayesian_ridge', 'alpha_1': 5.823984008142112e-05, 'alpha_2': 0.00017587145247919205, 'lambda_1': 3.8631046548330474e-05, 'lambda_2': 6.5618775492688e-06}. Best is trial 16 with value: 0.8153921208782959.
[I 2025-08-20 05:09:14,761] Trial 37 finished with value: 0.8033387269684744 and parameters: {'model_type': 'lgbm', 'n_estimators': 112, 'max_depth': 7, 'learning_rate': 0.10495761602650797}. Best is trial 16 with value: 0.8153921208782959.
[I 2025-08-20 05:09:17,058] Trial 38 finished with value: 0.7761901643685922 and parameters: {'model_type': 'xgb', 'n_estimators': 69, 'max_depth': 5, 'learning_rate': 0.06275658834874273}. Best is trial 16 with value: 0.8153921208782959.
[I 2025-08-20 05:09:17,186] Trial 39 finished with value: 0.7809060589876133 and parameters: {'model_type': 'rf', 'n_estimators': 84, 'max_depth': 8, 'min_samples_split': 6}. Best is trial 16 with value: 0.8153921208782959.
[I 2025-08-20 05:09:17,259] Trial 40 finished with value: 0.8018705401188873 and parameters: {'model_type': 'lgbm', 'n_estimators': 122, 'max_depth': 6, 'learning_rate': 0.1279117848548797}. Best is trial 16 with value: 0.8153921208782959.
[I 2025-08-20 05:09:17,310] Trial 41 finished with value: 0.8079170189899357 and parameters: {'model_type': 'lgbm', 'n_estimators': 94, 'max_depth': 5, 'learning_rate': 0.0858515811597961}. Best is trial 16 with value: 0.8153921208782959.
[I 2025-08-20 05:09:17,352] Trial 42 finished with value: 0.8022006196224688 and parameters: {'model_type': 'lgbm', 'n_estimators': 60, 'max_depth': 6, 'learning_rate': 0.21533146229663291}. Best is trial 16 with value: 0.8153921208782959.
[I 2025-08-20 05:09:17,395] Trial 43 finished with value: 0.8015628542585393 and parameters: {'model_type': 'lgbm', 'n_estimators': 99, 'max_depth': 4, 'learning_rate': 0.10252139041673937}. Best is trial 16 with value: 0.8153921208782959.
[I 2025-08-20 05:09:17,405] Trial 44 finished with value: 0.4577870635326251 and parameters: {'model_type': 'bayesian_ridge', 'alpha_1': 0.000555923067986985, 'alpha_2': 0.00048226982455168264, 'lambda_1': 0.000527008127944385, 'lambda_2': 0.0006735576665542822}. Best is trial 16 with value: 0.8153921208782959.
[I 2025-08-20 05:09:17,447] Trial 45 finished with value: 0.795058381739355 and parameters: {'model_type': 'lgbm', 'n_estimators': 77, 'max_depth': 5, 'learning_rate': 0.26119402233525585}. Best is trial 16 with value: 0.8153921208782959.
[I 2025-08-20 05:09:17,498] Trial 46 finished with value: 0.7830359469428569 and parameters: {'model_type': 'lgbm', 'n_estimators': 88, 'max_depth': 5, 'learning_rate': 0.04566104312878372}. Best is trial 16 with value: 0.8153921208782959.
[I 2025-08-20 05:09:25,945] Trial 47 finished with value: 0.7895849850326875 and parameters: {'model_type': 'cat', 'iterations': 792, 'depth': 7, 'learning_rate': 0.29413284014022933}. Best is trial 16 with value: 0.8153921208782959.
[I 2025-08-20 05:09:26,301] Trial 48 finished with value: 0.7538701929278396 and parameters: {'model_type': 'xgb', 'n_estimators': 62, 'max_depth': 6, 'learning_rate': 0.1354745418824312}. Best is trial 16 with value: 0.8153921208782959.
[I 2025-08-20 05:09:26,360] Trial 49 finished with value: 0.6795573137984352 and parameters: {'model_type': 'lgbm', 'n_estimators': 114, 'max_depth': 4, 'learning_rate': 0.018488377208634915}. Best is trial 16 with value: 0.8153921208782959.
Regression Results:
  Train R²: 0.883
  Test R²: 0.815
  CV R²: 0.495 ± 0.217
Failed to save comparison file: Object of type ndarray is not JSON serializable

==================================================
ANALYSIS COMPLETE
==================================================
Check the following directories for outputs:
  - plots/: Visualization files
  - results/: Data files and reports
  - models/: Trained model files
