[I 2025-08-20 03:47:50,930] Trial 14 finished with value: 0.6858251675096223 and parameters: {'model_type': 'xgb', 'n_estimators': 156, 'max_depth': 3, 'learning_rate': 0.18417984757446146}. Best is trial 7 with value: 0.7125401159734583.
[I 2025-08-20 03:47:58,574] Trial 15 finished with value: 0.6900610931749307 and parameters: {'model_type': 'cat', 'iterations': 235, 'depth': 4, 'learning_rate': 0.13016657006172921}. Best is trial 7 with value: 0.7125401159734583.
[I 2025-08-20 03:47:59,306] Trial 16 finished with value: 0.7368647081119484 and parameters: {'model_type': 'rf', 'n_estimators': 60, 'max_depth': 15, 'min_samples_split': 2}. Best is trial 16 with value: 0.7368647081119484.
[I 2025-08-20 03:47:59,893] Trial 17 finished with value: 0.7398192191779973 and parameters: {'model_type': 'rf', 'n_estimators': 52, 'max_depth': 15, 'min_samples_split': 2}. Best is trial 17 with value: 0.7398192191779973.
[I 2025-08-20 03:48:00,497] Trial 18 finished with value: 0.7476659390204741 and parameters: {'model_type': 'rf', 'n_estimators': 51, 'max_depth': 13, 'min_samples_split': 2}. Best is trial 18 with value: 0.7476659390204741.
[I 2025-08-20 03:48:01,053] Trial 19 finished with value: 0.747019955955263 and parameters: {'model_type': 'rf', 'n_estimators': 53, 'max_depth': 12, 'min_samples_split': 2}. Best is trial 18 with value: 0.7476659390204741.
[I 2025-08-20 03:48:02,061] Trial 20 finished with value: 0.7226204513521647 and parameters: {'model_type': 'rf', 'n_estimators': 84, 'max_depth': 12, 'min_samples_split': 4}. Best is trial 18 with value: 0.7476659390204741.
[I 2025-08-20 03:48:02,858] Trial 21 finished with value: 0.7466441612586245 and parameters: {'model_type': 'rf', 'n_estimators': 50, 'max_depth': 13, 'min_samples_split': 2}. Best is trial 18 with value: 0.7476659390204741.
[I 2025-08-20 03:48:03,713] Trial 22 finished with value: 0.7302238236065783 and parameters: {'model_type': 'rf', 'n_estimators': 69, 'max_depth': 12, 'min_samples_split': 3}. Best is trial 18 with value: 0.7476659390204741.
[I 2025-08-20 03:48:05,118] Trial 23 finished with value: 0.7243642313929276 and parameters: {'model_type': 'rf', 'n_estimators': 106, 'max_depth': 12, 'min_samples_split': 2}. Best is trial 18 with value: 0.7476659390204741.
[I 2025-08-20 03:48:05,640] Trial 24 finished with value: 0.7386539509720262 and parameters: {'model_type': 'rf', 'n_estimators': 50, 'max_depth': 13, 'min_samples_split': 4}. Best is trial 18 with value: 0.7476659390204741.
[I 2025-08-20 03:48:50,649] Trial 25 finished with value: 0.7178185866430942 and parameters: {'model_type': 'lgbm', 'n_estimators': 70, 'max_depth': 9, 'learning_rate': 0.19796870692999793}. Best is trial 18 with value: 0.7476659390204741.
[I 2025-08-20 03:48:51,791] Trial 26 finished with value: 0.6787352915365752 and parameters: {'model_type': 'xgb', 'n_estimators': 73, 'max_depth': 4, 'learning_rate': 0.23078693267063605}. Best is trial 18 with value: 0.7476659390204741.
[I 2025-08-20 03:48:53,817] Trial 27 finished with value: 0.7153996130973331 and parameters: {'model_type': 'rf', 'n_estimators': 114, 'max_depth': 11, 'min_samples_split': 6}. Best is trial 18 with value: 0.7476659390204741.
[I 2025-08-20 03:48:54,867] Trial 28 finished with value: 0.7371467650901431 and parameters: {'model_type': 'rf', 'n_estimators': 51, 'max_depth': 13, 'min_samples_split': 3}. Best is trial 18 with value: 0.7476659390204741.
[I 2025-08-20 03:48:56,371] Trial 29 finished with value: 0.7189624498962368 and parameters: {'model_type': 'rf', 'n_estimators': 100, 'max_depth': 13, 'min_samples_split': 3}. Best is trial 18 with value: 0.7476659390204741.
[I 2025-08-20 03:48:57,582] Trial 30 finished with value: 0.7318827445399863 and parameters: {'model_type': 'rf', 'n_estimators': 76, 'max_depth': 11, 'min_samples_split': 2}. Best is trial 18 with value: 0.7476659390204741.
[I 2025-08-20 03:48:58,633] Trial 31 finished with value: 0.7469694827594566 and parameters: {'model_type': 'rf', 'n_estimators': 59, 'max_depth': 14, 'min_samples_split': 2}. Best is trial 18 with value: 0.7476659390204741.
[I 2025-08-20 03:48:59,901] Trial 32 finished with value: 0.7327948674932099 and parameters: {'model_type': 'rf', 'n_estimators': 63, 'max_depth': 14, 'min_samples_split': 3}. Best is trial 18 with value: 0.7476659390204741.
[I 2025-08-20 03:49:01,293] Trial 33 finished with value: 0.7449536790723768 and parameters: {'model_type': 'rf', 'n_estimators': 62, 'max_depth': 14, 'min_samples_split': 2}. Best is trial 18 with value: 0.7476659390204741.
[I 2025-08-20 03:49:01,421] Trial 34 finished with value: 0.3413990916741948 and parameters: {'model_type': 'bayesian_ridge', 'alpha_1': 0.0009966177180894282, 'alpha_2': 3.6293289938583626e-05, 'lambda_1': 0.0008481809140264799, 'lambda_2': 0.0009700968874117814}. Best is trial 18 with value: 0.7476659390204741.
[I 2025-08-20 03:49:02,447] Trial 35 finished with value: 0.7274158474252099 and parameters: {'model_type': 'rf', 'n_estimators': 80, 'max_depth': 13, 'min_samples_split': 4}. Best is trial 18 with value: 0.7476659390204741.
[I 2025-08-20 03:49:03,230] Trial 36 finished with value: 0.6609560683654105 and parameters: {'model_type': 'xgb', 'n_estimators': 50, 'max_depth': 7, 'learning_rate': 0.10996784276841653}. Best is trial 18 with value: 0.7476659390204741.
[I 2025-08-20 03:49:04,707] Trial 37 finished with value: 0.7321645136151593 and parameters: {'model_type': 'rf', 'n_estimators': 60, 'max_depth': 11, 'min_samples_split': 3}. Best is trial 18 with value: 0.7476659390204741.
[I 2025-08-20 03:49:06,294] Trial 38 finished with value: 0.744814528374231 and parameters: {'model_type': 'rf', 'n_estimators': 64, 'max_depth': 14, 'min_samples_split': 2}. Best is trial 18 with value: 0.7476659390204741.
[I 2025-08-20 03:49:06,505] Trial 39 finished with value: 0.341399659220039 and parameters: {'model_type': 'bayesian_ridge', 'alpha_1': 0.00014805575470252396, 'alpha_2': 0.0009763128110804717, 'lambda_1': 0.0005167592269362984, 'lambda_2': 0.0005707858413172315}. Best is trial 18 with value: 0.7476659390204741.
[I 2025-08-20 03:49:25,623] Trial 40 finished with value: 0.7212007959383393 and parameters: {'model_type': 'lgbm', 'n_estimators': 92, 'max_depth': 7, 'learning_rate': 0.21928115352090938}. Best is trial 18 with value: 0.7476659390204741.
[I 2025-08-20 03:49:26,583] Trial 41 finished with value: 0.7476887040082656 and parameters: {'model_type': 'rf', 'n_estimators': 58, 'max_depth': 14, 'min_samples_split': 2}. Best is trial 41 with value: 0.7476887040082656.
[I 2025-08-20 03:49:28,057] Trial 42 finished with value: 0.7476887040082656 and parameters: {'model_type': 'rf', 'n_estimators': 58, 'max_depth': 14, 'min_samples_split': 2}. Best is trial 41 with value: 0.7476887040082656.
[I 2025-08-20 03:49:30,053] Trial 43 finished with value: 0.7296155907810133 and parameters: {'model_type': 'rf', 'n_estimators': 76, 'max_depth': 15, 'min_samples_split': 3}. Best is trial 41 with value: 0.7476887040082656.
[I 2025-08-20 03:49:31,509] Trial 44 finished with value: 0.7272370724578917 and parameters: {'model_type': 'rf', 'n_estimators': 60, 'max_depth': 14, 'min_samples_split': 7}. Best is trial 41 with value: 0.7476887040082656.
[I 2025-08-20 03:54:11,315] Trial 45 finished with value: 0.6508442089242465 and parameters: {'model_type': 'cat', 'iterations': 786, 'depth': 9, 'learning_rate': 0.1583195539739447}. Best is trial 41 with value: 0.7476887040082656.
[I 2025-08-20 03:54:11,589] Trial 46 finished with value: 0.7378981501321222 and parameters: {'model_type': 'rf', 'n_estimators': 71, 'max_depth': 12, 'min_samples_split': 2}. Best is trial 41 with value: 0.7476887040082656.
[I 2025-08-20 03:54:11,610] Trial 47 finished with value: 0.3413995811279982 and parameters: {'model_type': 'bayesian_ridge', 'alpha_1': 0.0004926410099609528, 'alpha_2': 2.3947763589428795e-05, 'lambda_1': 0.0005158075657776072, 'lambda_2': 0.0006222596564907656}. Best is trial 41 with value: 0.7476887040082656.
[I 2025-08-20 03:54:11,758] Trial 48 finished with value: 0.731625030553941 and parameters: {'model_type': 'rf', 'n_estimators': 59, 'max_depth': 14, 'min_samples_split': 4}. Best is trial 41 with value: 0.7476887040082656.
[I 2025-08-20 03:54:12,491] Trial 49 finished with value: 0.7241292141268482 and parameters: {'model_type': 'rf', 'n_estimators': 83, 'max_depth': 15, 'min_samples_split': 3}. Best is trial 41 with value: 0.7476887040082656.
Regression Results:
  Train R²: 0.961
  Test R²: 0.748
  CV R²: 0.481 ± 0.185
Failed to save comparison file: Object of type ndarray is not JSON serializable

==================================================
ANALYSIS COMPLETE
==================================================
Check the following directories for outputs:
  - plots/: Visualization files
  - results/: Data files and reports
  - models/: Trained model files
