[I 2025-08-20 02:46:29,248] Trial 15 finished with value: 0.7279083949649539 and parameters: {'model_type': 'cat', 'iterations': 528, 'depth': 10, 'learning_rate': 0.12041538528588401}. Best is trial 15 with value: 0.7279083949649539.
[I 2025-08-20 02:46:41,183] Trial 16 finished with value: 0.7149934041756227 and parameters: {'model_type': 'cat', 'iterations': 522, 'depth': 10, 'learning_rate': 0.20536096875443313}. Best is trial 15 with value: 0.7279083949649539.
[I 2025-08-20 02:46:48,053] Trial 17 finished with value: 0.6702016136677373 and parameters: {'model_type': 'cat', 'iterations': 492, 'depth': 9, 'learning_rate': 0.20288902778728896}. Best is trial 15 with value: 0.7279083949649539.
[I 2025-08-20 02:46:54,548] Trial 18 finished with value: 0.6802631981006957 and parameters: {'model_type': 'cat', 'iterations': 491, 'depth': 8, 'learning_rate': 0.10824056217091818}. Best is trial 15 with value: 0.7279083949649539.
[I 2025-08-20 02:47:03,800] Trial 19 finished with value: 0.7304929091924278 and parameters: {'model_type': 'cat', 'iterations': 640, 'depth': 7, 'learning_rate': 0.2565474279778974}. Best is trial 19 with value: 0.7304929091924278.
[I 2025-08-20 02:47:11,784] Trial 20 finished with value: 0.7172320139343407 and parameters: {'model_type': 'cat', 'iterations': 745, 'depth': 6, 'learning_rate': 0.280092213398333}. Best is trial 19 with value: 0.7304929091924278.
[I 2025-08-20 02:47:21,798] Trial 21 finished with value: 0.7188716513067905 and parameters: {'model_type': 'cat', 'iterations': 771, 'depth': 6, 'learning_rate': 0.29468912765706134}. Best is trial 19 with value: 0.7304929091924278.
[I 2025-08-20 02:47:29,182] Trial 22 finished with value: 0.7233701263971435 and parameters: {'model_type': 'cat', 'iterations': 797, 'depth': 6, 'learning_rate': 0.29745588502662584}. Best is trial 19 with value: 0.7304929091924278.
[I 2025-08-20 02:47:35,679] Trial 23 finished with value: 0.7161822211638023 and parameters: {'model_type': 'cat', 'iterations': 622, 'depth': 6, 'learning_rate': 0.2535345613569176}. Best is trial 19 with value: 0.7304929091924278.
[I 2025-08-20 02:47:44,436] Trial 24 finished with value: 0.7251773342667694 and parameters: {'model_type': 'cat', 'iterations': 637, 'depth': 7, 'learning_rate': 0.25031382652783235}. Best is trial 19 with value: 0.7304929091924278.
[I 2025-08-20 02:47:44,662] Trial 25 finished with value: 0.6749785472639502 and parameters: {'model_type': 'rf', 'n_estimators': 105, 'max_depth': 15, 'min_samples_split': 2}. Best is trial 19 with value: 0.7304929091924278.
[I 2025-08-20 02:47:44,790] Trial 26 finished with value: 0.6742665786923746 and parameters: {'model_type': 'lgbm', 'n_estimators': 200, 'max_depth': 8, 'learning_rate': 0.15871424603709966}. Best is trial 19 with value: 0.7304929091924278.
[I 2025-08-20 02:47:44,799] Trial 27 finished with value: 0.27852828781412575 and parameters: {'model_type': 'bayesian_ridge', 'alpha_1': 0.0009684540287416602, 'alpha_2': 5.5471440449679466e-05, 'lambda_1': 0.0006948312839779892, 'lambda_2': 2.1172371846207654e-05}. Best is trial 19 with value: 0.7304929091924278.
[I 2025-08-20 02:47:56,064] Trial 28 finished with value: 0.7183069370308763 and parameters: {'model_type': 'cat', 'iterations': 635, 'depth': 8, 'learning_rate': 0.23181354111349978}. Best is trial 19 with value: 0.7304929091924278.
[I 2025-08-20 02:48:03,733] Trial 29 finished with value: 0.7088814450367467 and parameters: {'model_type': 'cat', 'iterations': 583, 'depth': 8, 'learning_rate': 0.18058305627210214}. Best is trial 19 with value: 0.7304929091924278.
[I 2025-08-20 02:48:08,118] Trial 30 finished with value: 0.6999784098904059 and parameters: {'model_type': 'cat', 'iterations': 393, 'depth': 7, 'learning_rate': 0.1314420274552789}. Best is trial 19 with value: 0.7304929091924278.
[I 2025-08-20 02:48:15,925] Trial 31 finished with value: 0.7242964749829575 and parameters: {'model_type': 'cat', 'iterations': 711, 'depth': 5, 'learning_rate': 0.2624502865366705}. Best is trial 19 with value: 0.7304929091924278.
[I 2025-08-20 02:48:24,330] Trial 32 finished with value: 0.7223071210520801 and parameters: {'model_type': 'cat', 'iterations': 689, 'depth': 5, 'learning_rate': 0.26150958860543244}. Best is trial 19 with value: 0.7304929091924278.
[I 2025-08-20 02:48:29,615] Trial 33 finished with value: 0.709939231155795 and parameters: {'model_type': 'cat', 'iterations': 699, 'depth': 4, 'learning_rate': 0.2408233446773519}. Best is trial 19 with value: 0.7304929091924278.
[I 2025-08-20 02:48:35,443] Trial 34 finished with value: 0.7431462087343799 and parameters: {'model_type': 'cat', 'iterations': 602, 'depth': 5, 'learning_rate': 0.2265199459572989}. Best is trial 34 with value: 0.7431462087343799.
[I 2025-08-20 02:48:35,595] Trial 35 finished with value: 0.6745512583967229 and parameters: {'model_type': 'rf', 'n_estimators': 98, 'max_depth': 15, 'min_samples_split': 10}. Best is trial 34 with value: 0.7431462087343799.
[I 2025-08-20 02:48:45,441] Trial 36 finished with value: 0.7082871243315564 and parameters: {'model_type': 'cat', 'iterations': 596, 'depth': 9, 'learning_rate': 0.2229302638500672}. Best is trial 34 with value: 0.7431462087343799.
[I 2025-08-20 02:48:54,694] Trial 37 finished with value: 0.7327623087151716 and parameters: {'model_type': 'cat', 'iterations': 549, 'depth': 7, 'learning_rate': 0.17538208909615732}. Best is trial 34 with value: 0.7431462087343799.
[I 2025-08-20 02:48:55,244] Trial 38 finished with value: 0.6870780339881806 and parameters: {'model_type': 'xgb', 'n_estimators': 83, 'max_depth': 7, 'learning_rate': 0.1798731500505867}. Best is trial 34 with value: 0.7431462087343799.
[I 2025-08-20 02:48:55,253] Trial 39 finished with value: 0.2785181929637116 and parameters: {'model_type': 'bayesian_ridge', 'alpha_1': 5.31311363000022e-06, 'alpha_2': 0.0009767746392393088, 'lambda_1': 3.736761443289601e-05, 'lambda_2': 0.000973000734485818}. Best is trial 34 with value: 0.7431462087343799.
[I 2025-08-20 02:48:55,316] Trial 40 finished with value: 0.7087846498591768 and parameters: {'model_type': 'lgbm', 'n_estimators': 117, 'max_depth': 5, 'learning_rate': 0.09243574424871259}. Best is trial 34 with value: 0.7431462087343799.
[I 2025-08-20 02:49:02,575] Trial 41 finished with value: 0.7104051314217326 and parameters: {'model_type': 'cat', 'iterations': 561, 'depth': 7, 'learning_rate': 0.1781981545452041}. Best is trial 34 with value: 0.7431462087343799.
[I 2025-08-20 02:49:09,095] Trial 42 finished with value: 0.7321350638592958 and parameters: {'model_type': 'cat', 'iterations': 550, 'depth': 7, 'learning_rate': 0.08116308434461937}. Best is trial 34 with value: 0.7431462087343799.
[I 2025-08-20 02:49:12,642] Trial 43 finished with value: 0.6901884230873755 and parameters: {'model_type': 'cat', 'iterations': 445, 'depth': 8, 'learning_rate': 0.07235250635090451}. Best is trial 34 with value: 0.7431462087343799.
[I 2025-08-20 02:49:20,545] Trial 44 finished with value: 0.722915709072133 and parameters: {'model_type': 'cat', 'iterations': 551, 'depth': 5, 'learning_rate': 0.07940279677888272}. Best is trial 34 with value: 0.7431462087343799.
[I 2025-08-20 02:49:20,839] Trial 45 finished with value: 0.6771566346092353 and parameters: {'model_type': 'rf', 'n_estimators': 178, 'max_depth': 13, 'min_samples_split': 6}. Best is trial 34 with value: 0.7431462087343799.
[I 2025-08-20 02:49:24,924] Trial 46 finished with value: 0.6879914858586493 and parameters: {'model_type': 'cat', 'iterations': 444, 'depth': 7, 'learning_rate': 0.12733720041925883}. Best is trial 34 with value: 0.7431462087343799.
[I 2025-08-20 02:49:25,416] Trial 47 finished with value: 0.6992392505118408 and parameters: {'model_type': 'xgb', 'n_estimators': 75, 'max_depth': 7, 'learning_rate': 0.10655141904418555}. Best is trial 34 with value: 0.7431462087343799.
[I 2025-08-20 02:49:37,239] Trial 48 finished with value: 0.7116705565163531 and parameters: {'model_type': 'cat', 'iterations': 551, 'depth': 9, 'learning_rate': 0.023826148017193488}. Best is trial 34 with value: 0.7431462087343799.
[I 2025-08-20 02:49:37,269] Trial 49 finished with value: 0.6928694402271434 and parameters: {'model_type': 'lgbm', 'n_estimators': 51, 'max_depth': 3, 'learning_rate': 0.22235269621080114}. Best is trial 34 with value: 0.7431462087343799.
Regression Results:
  Train R²: 0.933
  Test R²: 0.743
  CV R²: 0.543 ± 0.175
Saved comparison to results/rxn_feature_comparison_hte_each_8_optuna.json

==================================================
ANALYSIS COMPLETE
==================================================
Check the following directories for outputs:
  - plots/: Visualization files
  - results/: Data files and reports
  - models/: Trained model files
