[I 2025-08-20 03:22:31,918] Trial 14 finished with value: 0.7610134871496063 and parameters: {'model_type': 'lgbm', 'n_estimators': 153, 'max_depth': 3, 'learning_rate': 0.19548025547397588}. Best is trial 5 with value: 0.7656513331092011.
[I 2025-08-20 03:22:32,147] Trial 15 finished with value: 0.7622190703688525 and parameters: {'model_type': 'lgbm', 'n_estimators': 146, 'max_depth': 6, 'learning_rate': 0.07444764346261563}. Best is trial 5 with value: 0.7656513331092011.
[I 2025-08-20 03:22:32,430] Trial 16 finished with value: 0.7221020932541824 and parameters: {'model_type': 'rf', 'n_estimators': 165, 'max_depth': 15, 'min_samples_split': 10}. Best is trial 5 with value: 0.7656513331092011.
[I 2025-08-20 03:22:32,486] Trial 17 finished with value: 0.7531971773640079 and parameters: {'model_type': 'lgbm', 'n_estimators': 121, 'max_depth': 5, 'learning_rate': 0.18298304659327774}. Best is trial 5 with value: 0.7656513331092011.
[I 2025-08-20 03:22:32,600] Trial 18 finished with value: 0.7529023498357169 and parameters: {'model_type': 'lgbm', 'n_estimators': 200, 'max_depth': 8, 'learning_rate': 0.06981861923801945}. Best is trial 5 with value: 0.7656513331092011.
[I 2025-08-20 03:22:32,649] Trial 19 finished with value: 0.7635545659224431 and parameters: {'model_type': 'lgbm', 'n_estimators': 131, 'max_depth': 4, 'learning_rate': 0.0924967380260887}. Best is trial 5 with value: 0.7656513331092011.
[I 2025-08-20 03:22:32,862] Trial 20 finished with value: 0.7204004149532608 and parameters: {'model_type': 'rf', 'n_estimators': 127, 'max_depth': 11, 'min_samples_split': 6}. Best is trial 5 with value: 0.7656513331092011.
[I 2025-08-20 03:22:32,923] Trial 21 finished with value: 0.7631311142294286 and parameters: {'model_type': 'lgbm', 'n_estimators': 178, 'max_depth': 4, 'learning_rate': 0.09107980322355666}. Best is trial 5 with value: 0.7656513331092011.
[I 2025-08-20 03:22:32,952] Trial 22 finished with value: 0.6511307845890284 and parameters: {'model_type': 'lgbm', 'n_estimators': 52, 'max_depth': 4, 'learning_rate': 0.04202808057982594}. Best is trial 5 with value: 0.7656513331092011.
[I 2025-08-20 03:22:33,003] Trial 23 finished with value: 0.7714996450618214 and parameters: {'model_type': 'lgbm', 'n_estimators': 144, 'max_depth': 4, 'learning_rate': 0.10241734075763992}. Best is trial 23 with value: 0.7714996450618214.
[I 2025-08-20 03:22:33,040] Trial 24 finished with value: 0.7561242996572352 and parameters: {'model_type': 'lgbm', 'n_estimators': 133, 'max_depth': 3, 'learning_rate': 0.17143035455841343}. Best is trial 23 with value: 0.7714996450618214.
[I 2025-08-20 03:22:34,616] Trial 25 finished with value: 0.7510320966734163 and parameters: {'model_type': 'xgb', 'n_estimators': 110, 'max_depth': 4, 'learning_rate': 0.14601774592949132}. Best is trial 23 with value: 0.7714996450618214.
[I 2025-08-20 03:22:34,672] Trial 26 finished with value: 0.762515723054273 and parameters: {'model_type': 'lgbm', 'n_estimators': 148, 'max_depth': 5, 'learning_rate': 0.10542615032950176}. Best is trial 23 with value: 0.7714996450618214.
[I 2025-08-20 03:22:34,704] Trial 27 finished with value: 0.7287900539117235 and parameters: {'model_type': 'lgbm', 'n_estimators': 137, 'max_depth': 3, 'learning_rate': 0.04598104416911222}. Best is trial 23 with value: 0.7714996450618214.
[I 2025-08-20 03:22:34,750] Trial 28 finished with value: 0.7482491545084995 and parameters: {'model_type': 'lgbm', 'n_estimators': 161, 'max_depth': 4, 'learning_rate': 0.21367964283896898}. Best is trial 23 with value: 0.7714996450618214.
[I 2025-08-20 03:22:34,759] Trial 29 finished with value: 0.4068310341891669 and parameters: {'model_type': 'bayesian_ridge', 'alpha_1': 1.7124135498643753e-05, 'alpha_2': 6.525351241499057e-06, 'lambda_1': 0.00016882886140364572, 'lambda_2': 1.4420600412767262e-05}. Best is trial 23 with value: 0.7714996450618214.
[I 2025-08-20 03:22:34,965] Trial 30 finished with value: 0.7207433468032327 and parameters: {'model_type': 'rf', 'n_estimators': 116, 'max_depth': 10, 'min_samples_split': 2}. Best is trial 23 with value: 0.7714996450618214.
[I 2025-08-20 03:22:35,029] Trial 31 finished with value: 0.7700568544385713 and parameters: {'model_type': 'lgbm', 'n_estimators': 185, 'max_depth': 4, 'learning_rate': 0.09173811081787646}. Best is trial 23 with value: 0.7714996450618214.
[I 2025-08-20 03:22:35,095] Trial 32 finished with value: 0.7616717057717165 and parameters: {'model_type': 'lgbm', 'n_estimators': 189, 'max_depth': 4, 'learning_rate': 0.06453061491857552}. Best is trial 23 with value: 0.7714996450618214.
[I 2025-08-20 03:22:35,106] Trial 33 finished with value: 0.4068260455563527 and parameters: {'model_type': 'bayesian_ridge', 'alpha_1': 0.0009523764465642879, 'alpha_2': 0.0001480008600248201, 'lambda_1': 0.0009930833578127986, 'lambda_2': 0.00039896653382041555}. Best is trial 23 with value: 0.7714996450618214.
[I 2025-08-20 03:22:35,181] Trial 34 finished with value: 0.7601096499133202 and parameters: {'model_type': 'lgbm', 'n_estimators': 181, 'max_depth': 5, 'learning_rate': 0.10020596962794813}. Best is trial 23 with value: 0.7714996450618214.
[I 2025-08-20 03:22:35,261] Trial 35 finished with value: 0.761134709075514 and parameters: {'model_type': 'lgbm', 'n_estimators': 162, 'max_depth': 6, 'learning_rate': 0.14918484452845893}. Best is trial 23 with value: 0.7714996450618214.
[I 2025-08-20 03:22:35,755] Trial 36 finished with value: 0.7389870243532866 and parameters: {'model_type': 'cat', 'iterations': 203, 'depth': 5, 'learning_rate': 0.11980602805074922}. Best is trial 23 with value: 0.7714996450618214.
[I 2025-08-20 03:22:36,079] Trial 37 finished with value: 0.7530142628954917 and parameters: {'model_type': 'xgb', 'n_estimators': 139, 'max_depth': 3, 'learning_rate': 0.05587696699642078}. Best is trial 23 with value: 0.7714996450618214.
[I 2025-08-20 03:22:36,164] Trial 38 finished with value: 0.7143843720381291 and parameters: {'model_type': 'lgbm', 'n_estimators': 186, 'max_depth': 4, 'learning_rate': 0.019516672745587313}. Best is trial 23 with value: 0.7714996450618214.
[I 2025-08-20 03:22:42,299] Trial 39 finished with value: 0.7294780140763673 and parameters: {'model_type': 'cat', 'iterations': 493, 'depth': 7, 'learning_rate': 0.08965406370949101}. Best is trial 23 with value: 0.7714996450618214.
[I 2025-08-20 03:22:42,320] Trial 40 finished with value: 0.4068233482357867 and parameters: {'model_type': 'bayesian_ridge', 'alpha_1': 0.00043816464408629244, 'alpha_2': 0.0003150061379255163, 'lambda_1': 0.00037447623050710266, 'lambda_2': 0.0005533420320444842}. Best is trial 23 with value: 0.7714996450618214.
[I 2025-08-20 03:22:42,392] Trial 41 finished with value: 0.7662744315171399 and parameters: {'model_type': 'lgbm', 'n_estimators': 172, 'max_depth': 4, 'learning_rate': 0.08693638857628432}. Best is trial 23 with value: 0.7714996450618214.
[I 2025-08-20 03:22:42,449] Trial 42 finished with value: 0.7706631500389478 and parameters: {'model_type': 'lgbm', 'n_estimators': 159, 'max_depth': 5, 'learning_rate': 0.08334643015294844}. Best is trial 23 with value: 0.7714996450618214.
[I 2025-08-20 03:22:42,513] Trial 43 finished with value: 0.7638842478602388 and parameters: {'model_type': 'lgbm', 'n_estimators': 169, 'max_depth': 5, 'learning_rate': 0.13057838509555503}. Best is trial 23 with value: 0.7714996450618214.
[I 2025-08-20 03:22:42,592] Trial 44 finished with value: 0.7533088887729629 and parameters: {'model_type': 'lgbm', 'n_estimators': 157, 'max_depth': 7, 'learning_rate': 0.05461367604619234}. Best is trial 23 with value: 0.7714996450618214.
[I 2025-08-20 03:22:43,221] Trial 45 finished with value: 0.7353742354100277 and parameters: {'model_type': 'xgb', 'n_estimators': 190, 'max_depth': 4, 'learning_rate': 0.2907695842035053}. Best is trial 23 with value: 0.7714996450618214.
[I 2025-08-20 03:22:43,293] Trial 46 finished with value: 0.7626276855948498 and parameters: {'model_type': 'lgbm', 'n_estimators': 170, 'max_depth': 5, 'learning_rate': 0.11047679989433314}. Best is trial 23 with value: 0.7714996450618214.
[I 2025-08-20 03:22:43,379] Trial 47 finished with value: 0.7566107410953745 and parameters: {'model_type': 'lgbm', 'n_estimators': 148, 'max_depth': 6, 'learning_rate': 0.07981450871560122}. Best is trial 23 with value: 0.7714996450618214.
[I 2025-08-20 03:22:43,621] Trial 48 finished with value: 0.7067180855429214 and parameters: {'model_type': 'rf', 'n_estimators': 176, 'max_depth': 7, 'min_samples_split': 10}. Best is trial 23 with value: 0.7714996450618214.
[I 2025-08-20 03:22:43,677] Trial 49 finished with value: 0.7074439369303738 and parameters: {'model_type': 'lgbm', 'n_estimators': 193, 'max_depth': 3, 'learning_rate': 0.024232135985684133}. Best is trial 23 with value: 0.7714996450618214.
Regression Results:
  Train R²: 0.886
  Test R²: 0.771
  CV R²: 0.542 ± 0.148
Failed to save comparison file: Object of type ndarray is not JSON serializable

==================================================
ANALYSIS COMPLETE
==================================================
Check the following directories for outputs:
  - plots/: Visualization files
  - results/: Data files and reports
  - models/: Trained model files
