[I 2025-08-20 05:13:33,693] Trial 13 finished with value: 0.7944844680731735 and parameters: {'model_type': 'rf', 'n_estimators': 200, 'max_depth': 14, 'min_samples_split': 7}. Best is trial 12 with value: 0.804450075348183.
[I 2025-08-20 05:13:33,802] Trial 14 finished with value: 0.7989128282824584 and parameters: {'model_type': 'lgbm', 'n_estimators': 162, 'max_depth': 10, 'learning_rate': 0.09129469428107004}. Best is trial 12 with value: 0.804450075348183.
[I 2025-08-20 05:13:33,894] Trial 15 finished with value: 0.7907056997490655 and parameters: {'model_type': 'lgbm', 'n_estimators': 151, 'max_depth': 8, 'learning_rate': 0.0994090731066286}. Best is trial 12 with value: 0.804450075348183.
[I 2025-08-20 05:13:34,306] Trial 16 finished with value: 0.7889763530032895 and parameters: {'model_type': 'rf', 'n_estimators': 195, 'max_depth': 13, 'min_samples_split': 2}. Best is trial 12 with value: 0.804450075348183.
[I 2025-08-20 05:13:39,075] Trial 17 finished with value: 0.7876476650277359 and parameters: {'model_type': 'cat', 'iterations': 790, 'depth': 4, 'learning_rate': 0.09786288384920805}. Best is trial 12 with value: 0.804450075348183.
[I 2025-08-20 05:13:39,132] Trial 18 finished with value: 0.7858866072732997 and parameters: {'model_type': 'lgbm', 'n_estimators': 145, 'max_depth': 3, 'learning_rate': 0.07348861475230795}. Best is trial 12 with value: 0.804450075348183.
[I 2025-08-20 05:13:39,239] Trial 19 finished with value: 0.7916718027071961 and parameters: {'model_type': 'lgbm', 'n_estimators': 173, 'max_depth': 8, 'learning_rate': 0.12960090570729607}. Best is trial 12 with value: 0.804450075348183.
[I 2025-08-20 05:13:39,333] Trial 20 finished with value: 0.8046407007690342 and parameters: {'model_type': 'lgbm', 'n_estimators': 132, 'max_depth': 9, 'learning_rate': 0.0542500410174309}. Best is trial 20 with value: 0.8046407007690342.
[I 2025-08-20 05:13:39,439] Trial 21 finished with value: 0.8105560782277341 and parameters: {'model_type': 'lgbm', 'n_estimators': 135, 'max_depth': 9, 'learning_rate': 0.05522176529551702}. Best is trial 21 with value: 0.8105560782277341.
[I 2025-08-20 05:13:39,552] Trial 22 finished with value: 0.8118521143771305 and parameters: {'model_type': 'lgbm', 'n_estimators': 133, 'max_depth': 9, 'learning_rate': 0.059440526440373204}. Best is trial 22 with value: 0.8118521143771305.
[I 2025-08-20 05:13:39,652] Trial 23 finished with value: 0.7899354712736106 and parameters: {'model_type': 'lgbm', 'n_estimators': 129, 'max_depth': 9, 'learning_rate': 0.14283566800252034}. Best is trial 22 with value: 0.8118521143771305.
[I 2025-08-20 05:13:39,739] Trial 24 finished with value: 0.8049944564519222 and parameters: {'model_type': 'lgbm', 'n_estimators': 131, 'max_depth': 7, 'learning_rate': 0.06486476856778986}. Best is trial 22 with value: 0.8118521143771305.
[I 2025-08-20 05:13:41,713] Trial 25 finished with value: 0.803502797187618 and parameters: {'model_type': 'cat', 'iterations': 243, 'depth': 5, 'learning_rate': 0.061350772989888926}. Best is trial 22 with value: 0.8118521143771305.
[I 2025-08-20 05:13:41,878] Trial 26 finished with value: 0.7911629759402963 and parameters: {'model_type': 'rf', 'n_estimators': 108, 'max_depth': 12, 'min_samples_split': 10}. Best is trial 22 with value: 0.8118521143771305.
[I 2025-08-20 05:13:42,791] Trial 27 finished with value: 0.7507361565866002 and parameters: {'model_type': 'xgb', 'n_estimators': 141, 'max_depth': 7, 'learning_rate': 0.12163045994659147}. Best is trial 22 with value: 0.8118521143771305.
[I 2025-08-20 05:13:42,855] Trial 28 finished with value: 0.7978962081691814 and parameters: {'model_type': 'lgbm', 'n_estimators': 115, 'max_depth': 6, 'learning_rate': 0.17834560924404735}. Best is trial 22 with value: 0.8118521143771305.
[I 2025-08-20 05:13:43,450] Trial 29 finished with value: 0.7489006610500659 and parameters: {'model_type': 'xgb', 'n_estimators': 91, 'max_depth': 7, 'learning_rate': 0.2967361001329816}. Best is trial 22 with value: 0.8118521143771305.
[I 2025-08-20 05:13:43,504] Trial 30 finished with value: 0.7922278831552113 and parameters: {'model_type': 'lgbm', 'n_estimators': 130, 'max_depth': 4, 'learning_rate': 0.0509388792767279}. Best is trial 22 with value: 0.8118521143771305.
[I 2025-08-20 05:13:43,610] Trial 31 finished with value: 0.8100851368983113 and parameters: {'model_type': 'lgbm', 'n_estimators': 134, 'max_depth': 9, 'learning_rate': 0.04919467429081048}. Best is trial 22 with value: 0.8118521143771305.
[I 2025-08-20 05:13:43,718] Trial 32 finished with value: 0.8103535889434621 and parameters: {'model_type': 'lgbm', 'n_estimators': 141, 'max_depth': 9, 'learning_rate': 0.0537514043087928}. Best is trial 22 with value: 0.8118521143771305.
[I 2025-08-20 05:13:43,836] Trial 33 finished with value: 0.8080834895425648 and parameters: {'model_type': 'lgbm', 'n_estimators': 154, 'max_depth': 9, 'learning_rate': 0.04228152483056889}. Best is trial 22 with value: 0.8118521143771305.
[I 2025-08-20 05:13:44,214] Trial 34 finished with value: 0.7572032364365113 and parameters: {'model_type': 'xgb', 'n_estimators': 144, 'max_depth': 9, 'learning_rate': 0.11447397571408244}. Best is trial 22 with value: 0.8118521143771305.
[I 2025-08-20 05:13:57,023] Trial 35 finished with value: 0.7842154299363174 and parameters: {'model_type': 'cat', 'iterations': 677, 'depth': 10, 'learning_rate': 0.08344685741463745}. Best is trial 22 with value: 0.8118521143771305.
[I 2025-08-20 05:13:57,115] Trial 36 finished with value: 0.8043534003668008 and parameters: {'model_type': 'lgbm', 'n_estimators': 118, 'max_depth': 8, 'learning_rate': 0.044952266790674864}. Best is trial 22 with value: 0.8118521143771305.
[I 2025-08-20 05:13:57,219] Trial 37 finished with value: 0.683764814267603 and parameters: {'model_type': 'lgbm', 'n_estimators': 141, 'max_depth': 9, 'learning_rate': 0.010914767768351541}. Best is trial 22 with value: 0.8118521143771305.
[I 2025-08-20 05:13:57,515] Trial 38 finished with value: 0.7895839237617485 and parameters: {'model_type': 'rf', 'n_estimators': 162, 'max_depth': 11, 'min_samples_split': 2}. Best is trial 22 with value: 0.8118521143771305.
[I 2025-08-20 05:13:57,576] Trial 39 finished with value: 0.7845130449039209 and parameters: {'model_type': 'lgbm', 'n_estimators': 90, 'max_depth': 8, 'learning_rate': 0.22458694514038322}. Best is trial 22 with value: 0.8118521143771305.
[I 2025-08-20 05:13:57,586] Trial 40 finished with value: 0.4577786138300376 and parameters: {'model_type': 'bayesian_ridge', 'alpha_1': 1.1262831719789776e-06, 'alpha_2': 0.000997535625333585, 'lambda_1': 0.000948013155183829, 'lambda_2': 5.4687156302723355e-05}. Best is trial 22 with value: 0.8118521143771305.
[I 2025-08-20 05:13:57,698] Trial 41 finished with value: 0.8084536706332272 and parameters: {'model_type': 'lgbm', 'n_estimators': 157, 'max_depth': 9, 'learning_rate': 0.043929259381048705}. Best is trial 22 with value: 0.8118521143771305.
[I 2025-08-20 05:13:57,791] Trial 42 finished with value: 0.8041449106350967 and parameters: {'model_type': 'lgbm', 'n_estimators': 137, 'max_depth': 8, 'learning_rate': 0.039847864225431476}. Best is trial 22 with value: 0.8118521143771305.
[I 2025-08-20 05:13:57,895] Trial 43 finished with value: 0.8091909418014802 and parameters: {'model_type': 'lgbm', 'n_estimators': 154, 'max_depth': 9, 'learning_rate': 0.0714493149097556}. Best is trial 22 with value: 0.8118521143771305.
[I 2025-08-20 05:13:57,944] Trial 44 finished with value: 0.7977587756329965 and parameters: {'model_type': 'lgbm', 'n_estimators': 56, 'max_depth': 9, 'learning_rate': 0.07088874449229976}. Best is trial 22 with value: 0.8118521143771305.
[I 2025-08-20 05:13:58,057] Trial 45 finished with value: 0.7991705956836608 and parameters: {'model_type': 'lgbm', 'n_estimators': 176, 'max_depth': 9, 'learning_rate': 0.09824382487007238}. Best is trial 22 with value: 0.8118521143771305.
[I 2025-08-20 05:13:58,067] Trial 46 finished with value: 0.45779162947871144 and parameters: {'model_type': 'bayesian_ridge', 'alpha_1': 0.0009576758629659754, 'alpha_2': 0.00012017462842258672, 'lambda_1': 2.3483334551752545e-06, 'lambda_2': 0.0009965929456226073}. Best is trial 22 with value: 0.8118521143771305.
[I 2025-08-20 05:13:58,148] Trial 47 finished with value: 0.806651748747929 and parameters: {'model_type': 'lgbm', 'n_estimators': 122, 'max_depth': 8, 'learning_rate': 0.06294173860825841}. Best is trial 22 with value: 0.8118521143771305.
[I 2025-08-20 05:13:58,956] Trial 48 finished with value: 0.7489233739299981 and parameters: {'model_type': 'xgb', 'n_estimators': 107, 'max_depth': 8, 'learning_rate': 0.02751474810527546}. Best is trial 22 with value: 0.8118521143771305.
[I 2025-08-20 05:14:03,066] Trial 49 finished with value: 0.7894736920374722 and parameters: {'model_type': 'cat', 'iterations': 502, 'depth': 7, 'learning_rate': 0.11043523486957837}. Best is trial 22 with value: 0.8118521143771305.
Regression Results:
  Train R²: 0.891
  Test R²: 0.812
  CV R²: 0.508 ± 0.236
Failed to save comparison file: Object of type ndarray is not JSON serializable

==================================================
ANALYSIS COMPLETE
==================================================
Check the following directories for outputs:
  - plots/: Visualization files
  - results/: Data files and reports
  - models/: Trained model files
