=== ML Measurable HTE Rate Bias Analysis ===

==================================================
Running HTE Prediction Analysis: each with 8 features
==================================================

=== Loading Data ===
Number of HTE rates: 1031
Found 5 hydrogen-dependent features: ['num_Hs', 'BV_Hs_avg', 'Charges_Hs_avg', 'fukui_E_Hs_avg', 'fukui_N_Hs_avg']
Found 2 pKa-dependent features: ['pka_aHs', 'pka_lowest']
Found 26 heteroatom-dependent features: ['BV_main_1', 'Charges_main_atom', 'fukui_E_main_atom', 'fukui_N_main_atom', 'L_main_atom_1', 'L_main_atom_2', 'B1_main_atom_1', 'B1_main_atom_2', 'B5_main_atom_1', 'B5_main_atom_2', 'Charges_secondary_1', 'Charges_secondary_2', 'fukui_N_secondary_1', 'fukui_N_secondary_2', 'Charges_secondary_avg', 'fukui_N_secondary_avg', 'FCS_1', 'FREQS_1', 'FCS_2', 'FREQS_2', 'FCS_avg', 'FREQS_avg', 'BV_Hs_avg', 'Charges_Hs_avg', 'fukui_E_Hs_avg', 'fukui_N_Hs_avg']

Processing num_Hs conditional features...
  18/46 molecules meet condition num_Hs
    num_Hs: 0 -> 0 NA values
    BV_Hs_avg: 28 -> 0 NA values
    Charges_Hs_avg: 28 -> 0 NA values
    fukui_E_Hs_avg: 28 -> 0 NA values
    fukui_N_Hs_avg: 28 -> 0 NA values

Processing pKa_features conditional features...
  18/46 molecules meet condition pKa_features
    Processing pKa feature pka_aHs with special handling...
      Created indicator: has_acidic_H_for_pka_aHs
      Created interaction: pka_aHs_x_has_acidic_H
      Used 50.0 for molecules without acidic H
    pka_aHs: 28 -> 0 NA values
    Processing pKa feature pka_lowest with special handling...
      Created indicator: has_acidic_H_for_pka_lowest
      Created interaction: pka_lowest_x_has_acidic_H
      Used 50.0 for molecules without acidic H
    pka_lowest: 38 -> 0 NA values

Handling remaining NA values...

Encoding categorical features...
  Removed identifier feature: name
  Found categorical feature class with 4 unique values: ['aromatic' 'hetero' 'aliphatic' 'mixture']
    One-hot encoded class -> 4 features: ['class_aliphatic', 'class_aromatic', 'class_hetero', 'class_mixture']
  Removed identifier feature: smiles
  Processed 1 categorical features
  Removed 2 identifier features: ['name', 'smiles']

Creating feature quality indicators...
  Added indicator: has_num_Hs
  Added indicator: has_pKa_features
Preprocessing complete. Shape: (46, 65)
Remaining NA values: 0
Found 1 pKa-dependent features: ['pka_basic']
Warning: num_Hs column not found, cannot properly handle pKa features
Found 15 heteroatom-dependent features: ['BV_main_1', 'Charges_main_atom', 'fukui_E_main_atom', 'fukui_N_main_atom', 'L_main_atom_1', 'B1_main_atom_1', 'B5_main_atom_1', 'Charges_secondary_1', 'fukui_N_secondary_1', 'Charges_secondary_avg', 'fukui_N_secondary_avg', 'FCS_1', 'FREQS_1', 'FCS_avg', 'FREQS_avg']

Handling remaining NA values...
  pka_basic: Filled 1 NA values with median/zero
  smiles: Filled 1 NA values with mode/unknown
  class: Filled 1 NA values with mode/unknown

Encoding categorical features...
  Removed identifier feature: name
  Removed identifier feature: smiles
  Found categorical feature class with 5 unique values: ['1_aliphatic' '1_aromatic' '2_aliphatic' '1_mixture' '2_mixture']
    One-hot encoded class -> 5 features: ['class_1_aliphatic', 'class_1_aromatic', 'class_1_mixture', 'class_2_aliphatic', 'class_2_mixture']
  Processed 1 categorical features
  Removed 2 identifier features: ['name', 'smiles']

Creating feature quality indicators...
Preprocessing complete. Shape: (55, 40)
Remaining NA values: 0
Loaded reaction energy features: 1488 rows, 8 features

=== Selecting Features (selected) ===
Final selected features (8): ['amine_BV_secondary_avg', 'amine_Charges_secondary_1', 'acyl_Charges_secondary_1', 'acyl_pka_aHs_x_has_acidic_H', 'amine_pka_basic', 'acyl_BV_secondary_2', 'amine_class_1_mixture', 'acyl_class_aromatic']
=== Building HTE Prediction Models with 8 features ===
Selected features: ['amine_BV_secondary_avg', 'amine_Charges_secondary_1', 'acyl_Charges_secondary_1', 'acyl_pka_aHs_x_has_acidic_H', 'amine_pka_basic', 'acyl_BV_secondary_2', 'amine_class_1_mixture', 'acyl_class_aromatic']
Valid features: 17
=== Building Regression Model ===
Regression dataset: (1031, 17)
Target range: -1.418 to 4.010


Training data: 619 samples
Test data: 206 samples


Train-only SFS selected 16 features for regression
Running hyperparameter optimization for regression...
[I 2025-08-20 05:07:48,138] A new study created in memory with name: no-name-d5735517-d24d-4a2c-96a6-73ab72cad5d3
[I 2025-08-20 05:07:48,926] Trial 0 finished with value: 0.7604368384298359 and parameters: {'model_type': 'lgbm', 'n_estimators': 126, 'max_depth': 10, 'learning_rate': 0.1768718761491053}. Best is trial 0 with value: 0.7604368384298359.
[I 2025-08-20 05:07:50,352] Trial 1 finished with value: 0.6851999682353096 and parameters: {'model_type': 'xgb', 'n_estimators': 106, 'max_depth': 10, 'learning_rate': 0.09106297916601545}. Best is trial 0 with value: 0.7604368384298359.
[I 2025-08-20 05:07:50,409] Trial 2 finished with value: 0.7657398079765045 and parameters: {'model_type': 'lgbm', 'n_estimators': 193, 'max_depth': 3, 'learning_rate': 0.05938891713742139}. Best is trial 2 with value: 0.7657398079765045.
[I 2025-08-20 05:07:50,487] Trial 3 finished with value: 0.7602893702602883 and parameters: {'model_type': 'lgbm', 'n_estimators': 163, 'max_depth': 5, 'learning_rate': 0.20949822505711357}. Best is trial 2 with value: 0.7657398079765045.
[I 2025-08-20 05:07:50,652] Trial 4 finished with value: 0.5328718685939573 and parameters: {'model_type': 'rf', 'n_estimators': 99, 'max_depth': 3, 'min_samples_split': 7}. Best is trial 2 with value: 0.7657398079765045.
[I 2025-08-20 05:07:51,022] Trial 5 finished with value: 0.7501821109187268 and parameters: {'model_type': 'rf', 'n_estimators': 130, 'max_depth': 12, 'min_samples_split': 9}. Best is trial 2 with value: 0.7657398079765045.
[I 2025-08-20 05:07:51,070] Trial 6 finished with value: 0.6331760452811072 and parameters: {'model_type': 'lgbm', 'n_estimators': 56, 'max_depth': 6, 'learning_rate': 0.026103414404224055}. Best is trial 2 with value: 0.7657398079765045.
[I 2025-08-20 05:07:51,378] Trial 7 finished with value: 0.7547366998084885 and parameters: {'model_type': 'rf', 'n_estimators': 96, 'max_depth': 10, 'min_samples_split': 4}. Best is trial 2 with value: 0.7657398079765045.
[I 2025-08-20 05:07:54,156] Trial 8 finished with value: 0.7750228670992112 and parameters: {'model_type': 'cat', 'iterations': 240, 'depth': 7, 'learning_rate': 0.11516287799644113}. Best is trial 8 with value: 0.7750228670992112.
[I 2025-08-20 05:07:54,206] Trial 9 finished with value: 0.7602737511417379 and parameters: {'model_type': 'lgbm', 'n_estimators': 82, 'max_depth': 4, 'learning_rate': 0.1168694360357528}. Best is trial 8 with value: 0.7750228670992112.
[I 2025-08-20 05:07:57,120] Trial 10 finished with value: 0.7422106196324754 and parameters: {'model_type': 'cat', 'iterations': 204, 'depth': 8, 'learning_rate': 0.27661195740714695}. Best is trial 8 with value: 0.7750228670992112.
[I 2025-08-20 05:07:57,163] Trial 11 finished with value: 0.5866939593418294 and parameters: {'model_type': 'bayesian_ridge', 'alpha_1': 0.0006740703269621565, 'alpha_2': 0.0005593154240874999, 'lambda_1': 0.0009583276152839333, 'lambda_2': 0.0009194607346788394}. Best is trial 8 with value: 0.7750228670992112.
[I 2025-08-20 05:07:59,972] Trial 12 finished with value: 0.7707502372155164 and parameters: {'model_type': 'cat', 'iterations': 359, 'depth': 4, 'learning_rate': 0.045261127066119684}. Best is trial 8 with value: 0.7750228670992112.
[I 2025-08-20 05:08:02,646] Trial 13 finished with value: 0.7711866373553339 and parameters: {'model_type': 'cat', 'iterations': 307, 'depth': 4, 'learning_rate': 0.1197587945190875}. Best is trial 8 with value: 0.7750228670992112.
[I 2025-08-20 05:08:08,429] Trial 14 finished with value: 0.7863196194109896 and parameters: {'model_type': 'cat', 'iterations': 703, 'depth': 5, 'learning_rate': 0.13115753989037568}. Best is trial 14 with value: 0.7863196194109896.
[I 2025-08-20 05:08:18,686] Trial 15 finished with value: 0.7885168298359013 and parameters: {'model_type': 'cat', 'iterations': 682, 'depth': 6, 'learning_rate': 0.1840907862964917}. Best is trial 15 with value: 0.7885168298359013.
[I 2025-08-20 05:08:26,227] Trial 16 finished with value: 0.785340296261516 and parameters: {'model_type': 'cat', 'iterations': 732, 'depth': 6, 'learning_rate': 0.2238025592004557}. Best is trial 15 with value: 0.7885168298359013.
[I 2025-08-20 05:08:27,369] Trial 17 finished with value: 0.7207740257349899 and parameters: {'model_type': 'xgb', 'n_estimators': 193, 'max_depth': 8, 'learning_rate': 0.1630928982332047}. Best is trial 15 with value: 0.7885168298359013.
[I 2025-08-20 05:08:27,379] Trial 18 finished with value: 0.5866892783654425 and parameters: {'model_type': 'bayesian_ridge', 'alpha_1': 2.0944579784522917e-05, 'alpha_2': 2.865916776427323e-05, 'lambda_1': 1.16290000952904e-05, 'lambda_2': 1.3096824468462236e-06}. Best is trial 15 with value: 0.7885168298359013.
[I 2025-08-20 05:08:52,644] Trial 19 finished with value: 0.7704395260862278 and parameters: {'model_type': 'cat', 'iterations': 726, 'depth': 10, 'learning_rate': 0.21907153743721838}. Best is trial 15 with value: 0.7885168298359013.
[I 2025-08-20 05:09:00,989] Trial 20 finished with value: 0.7769424073630308 and parameters: {'model_type': 'cat', 'iterations': 580, 'depth': 6, 'learning_rate': 0.2834510039368129}. Best is trial 15 with value: 0.7885168298359013.
[I 2025-08-20 05:09:08,553] Trial 21 finished with value: 0.7790335595547189 and parameters: {'model_type': 'cat', 'iterations': 771, 'depth': 6, 'learning_rate': 0.2233640826981064}. Best is trial 15 with value: 0.7885168298359013.
[I 2025-08-20 05:09:14,891] Trial 22 finished with value: 0.787246621162861 and parameters: {'model_type': 'cat', 'iterations': 633, 'depth': 6, 'learning_rate': 0.18773503371558278}. Best is trial 15 with value: 0.7885168298359013.
[I 2025-08-20 05:09:22,212] Trial 23 finished with value: 0.7685031051779935 and parameters: {'model_type': 'cat', 'iterations': 595, 'depth': 5, 'learning_rate': 0.19030828831027485}. Best is trial 15 with value: 0.7885168298359013.
[I 2025-08-20 05:09:27,994] Trial 24 finished with value: 0.7785057866701492 and parameters: {'model_type': 'cat', 'iterations': 628, 'depth': 5, 'learning_rate': 0.14757466992946366}. Best is trial 15 with value: 0.7885168298359013.
[I 2025-08-20 05:09:29,035] Trial 25 finished with value: 0.7433219307550366 and parameters: {'model_type': 'xgb', 'n_estimators': 159, 'max_depth': 7, 'learning_rate': 0.15769589745441945}. Best is trial 15 with value: 0.7885168298359013.
[I 2025-08-20 05:09:36,035] Trial 26 finished with value: 0.7713245517538587 and parameters: {'model_type': 'cat', 'iterations': 654, 'depth': 7, 'learning_rate': 0.13408966044986395}. Best is trial 15 with value: 0.7885168298359013.
[I 2025-08-20 05:09:36,045] Trial 27 finished with value: 0.586690942185365 and parameters: {'model_type': 'bayesian_ridge', 'alpha_1': 0.0009286916018272362, 'alpha_2': 0.0009540592715312305, 'lambda_1': 0.00043142275480461973, 'lambda_2': 0.00032880281608376524}. Best is trial 15 with value: 0.7885168298359013.
[I 2025-08-20 05:09:40,493] Trial 28 finished with value: 0.7698916568485918 and parameters: {'model_type': 'cat', 'iterations': 496, 'depth': 5, 'learning_rate': 0.25354556289784685}. Best is trial 15 with value: 0.7885168298359013.
[I 2025-08-20 05:09:50,251] Trial 29 finished with value: 0.7860573744543007 and parameters: {'model_type': 'cat', 'iterations': 518, 'depth': 8, 'learning_rate': 0.19559046682528633}. Best is trial 15 with value: 0.7885168298359013.
[I 2025-08-20 05:09:56,506] Trial 30 finished with value: 0.7856693398101837 and parameters: {'model_type': 'cat', 'iterations': 684, 'depth': 6, 'learning_rate': 0.0890533964996962}. Best is trial 15 with value: 0.7885168298359013.
[I 2025-08-20 05:10:07,979] Trial 31 finished with value: 0.7903069460864964 and parameters: {'model_type': 'cat', 'iterations': 512, 'depth': 8, 'learning_rate': 0.1979199451356316}. Best is trial 31 with value: 0.7903069460864964.
[I 2025-08-20 05:10:11,711] Trial 32 finished with value: 0.7364920236287311 and parameters: {'model_type': 'cat', 'iterations': 471, 'depth': 8, 'learning_rate': 0.24646513896632116}. Best is trial 31 with value: 0.7903069460864964.
[I 2025-08-20 05:10:12,118] Trial 33 finished with value: 0.7234738411785672 and parameters: {'model_type': 'xgb', 'n_estimators': 52, 'max_depth': 8, 'learning_rate': 0.17134123700321133}. Best is trial 31 with value: 0.7903069460864964.
[I 2025-08-20 05:10:21,178] Trial 34 finished with value: 0.774580964541533 and parameters: {'model_type': 'cat', 'iterations': 556, 'depth': 7, 'learning_rate': 0.19228797650690893}. Best is trial 31 with value: 0.7903069460864964.
[I 2025-08-20 05:10:21,769] Trial 35 finished with value: 0.7538251287205828 and parameters: {'model_type': 'rf', 'n_estimators': 165, 'max_depth': 15, 'min_samples_split': 2}. Best is trial 31 with value: 0.7903069460864964.
[I 2025-08-20 05:10:47,030] Trial 36 finished with value: 0.7809360759022854 and parameters: {'model_type': 'cat', 'iterations': 680, 'depth': 10, 'learning_rate': 0.2521409000912341}. Best is trial 31 with value: 0.7903069460864964.
[I 2025-08-20 05:10:47,146] Trial 37 finished with value: 0.7692649599869797 and parameters: {'model_type': 'lgbm', 'n_estimators': 143, 'max_depth': 5, 'learning_rate': 0.17591171103842965}. Best is trial 31 with value: 0.7903069460864964.
[I 2025-08-20 05:10:47,159] Trial 38 finished with value: 0.586694185489899 and parameters: {'model_type': 'bayesian_ridge', 'alpha_1': 6.673177640814486e-05, 'alpha_2': 4.141360799452746e-06, 'lambda_1': 0.0009799188836481319, 'lambda_2': 0.0009631076891126047}. Best is trial 31 with value: 0.7903069460864964.
[I 2025-08-20 05:10:47,386] Trial 39 finished with value: 0.7510182239263896 and parameters: {'model_type': 'rf', 'n_estimators': 76, 'max_depth': 15, 'min_samples_split': 10}. Best is trial 31 with value: 0.7903069460864964.
[I 2025-08-20 05:10:51,930] Trial 40 finished with value: 0.7316944597294823 and parameters: {'model_type': 'cat', 'iterations': 436, 'depth': 9, 'learning_rate': 0.14200794675168601}. Best is trial 31 with value: 0.7903069460864964.
[I 2025-08-20 05:11:02,345] Trial 41 finished with value: 0.7766436309484569 and parameters: {'model_type': 'cat', 'iterations': 535, 'depth': 8, 'learning_rate': 0.18940150324519464}. Best is trial 31 with value: 0.7903069460864964.
[I 2025-08-20 05:11:06,658] Trial 42 finished with value: 0.7444145398974793 and parameters: {'model_type': 'cat', 'iterations': 424, 'depth': 8, 'learning_rate': 0.1966658326116695}. Best is trial 31 with value: 0.7903069460864964.
[I 2025-08-20 05:11:24,561] Trial 43 finished with value: 0.7950703215746224 and parameters: {'model_type': 'cat', 'iterations': 798, 'depth': 9, 'learning_rate': 0.20493143352265297}. Best is trial 43 with value: 0.7950703215746224.
[I 2025-08-20 05:11:24,691] Trial 44 finished with value: 0.7507953209594147 and parameters: {'model_type': 'lgbm', 'n_estimators': 175, 'max_depth': 6, 'learning_rate': 0.23798075184704737}. Best is trial 43 with value: 0.7950703215746224.
[I 2025-08-20 05:11:45,151] Trial 45 finished with value: 0.7912791693632539 and parameters: {'model_type': 'cat', 'iterations': 792, 'depth': 9, 'learning_rate': 0.20553670166664845}. Best is trial 43 with value: 0.7950703215746224.
[I 2025-08-20 05:12:04,325] Trial 46 finished with value: 0.7892203276915275 and parameters: {'model_type': 'cat', 'iterations': 790, 'depth': 9, 'learning_rate': 0.2068163249675508}. Best is trial 43 with value: 0.7950703215746224.
[I 2025-08-20 05:12:04,764] Trial 47 finished with value: 0.7563681956134414 and parameters: {'model_type': 'rf', 'n_estimators': 144, 'max_depth': 13, 'min_samples_split': 6}. Best is trial 43 with value: 0.7950703215746224.
[I 2025-08-20 05:12:05,036] Trial 48 finished with value: 0.7864485137803869 and parameters: {'model_type': 'xgb', 'n_estimators': 78, 'max_depth': 4, 'learning_rate': 0.20953973641329315}. Best is trial 43 with value: 0.7950703215746224.
[I 2025-08-20 05:12:22,361] Trial 49 finished with value: 0.7838251308192804 and parameters: {'model_type': 'cat', 'iterations': 800, 'depth': 9, 'learning_rate': 0.21140818135640108}. Best is trial 43 with value: 0.7950703215746224.
Regression Results:
  Train R²: 0.978
  Test R²: 0.795
  CV R²: 0.431 ± 0.213

=== Generating Visualizations ===
=== Evaluating CatBoost with Parity Plots ===
Model Performance:
  Train R²: 0.978, MAE: 0.085, RMSE: 0.135
  Test R²: 0.795, MAE: 0.337, RMSE: 0.435
Generating parity plots...
Parity plot saved as: plots/parity_plot_catboost_train_each_8_optuna_ens7_gpu0_train.png
Parity plot saved as: plots/parity_plot_catboost_test_each_8_optuna_ens7_gpu0_test.png
Parity analysis plot saved as: plots/parity_analysis_catboost_test_each_8_optuna_ens7_gpu0_analysis.png
Saved predictions to results/predictions_each_8_optuna_ens7_gpu0.csv
Saved combined dataset to results/combined_df_each_8_optuna_ens7_gpu0.csv
Models saved with suffix: _each_8_optuna_ens7_gpu0
HTE prediction evaluation report saved to results/reports/hte_prediction_report_manual_8_each_8_optuna_ens7_gpu0.txt

=== Comparing without reaction-energy features (HTE prediction) ===
=== Building HTE Prediction Models with 8 features ===
Selected features: ['amine_BV_secondary_avg', 'amine_Charges_secondary_1', 'acyl_Charges_secondary_1', 'acyl_pka_aHs_x_has_acidic_H', 'amine_pka_basic', 'acyl_BV_secondary_2', 'amine_class_1_mixture', 'acyl_class_aromatic']
Valid features: 9
=== Building Regression Model ===
Regression dataset: (1031, 9)
Target range: -1.418 to 4.010


Training data: 619 samples
Test data: 206 samples


Train-only SFS selected 8 features for regression
Running hyperparameter optimization for regression...
[I 2025-08-20 05:15:05,088] A new study created in memory with name: no-name-a3e69dd8-0358-498c-91df-abb8ee9c1959
[I 2025-08-20 05:15:05,142] Trial 0 finished with value: 0.8006638663090972 and parameters: {'model_type': 'lgbm', 'n_estimators': 74, 'max_depth': 6, 'learning_rate': 0.2452317630169894}. Best is trial 0 with value: 0.8006638663090972.
[I 2025-08-20 05:15:05,146] Trial 1 finished with value: 0.45778877394242024 and parameters: {'model_type': 'bayesian_ridge', 'alpha_1': 0.0003770013058847288, 'alpha_2': 0.0007302393496142275, 'lambda_1': 3.542035654340272e-05, 'lambda_2': 0.0007811637566996087}. Best is trial 0 with value: 0.8006638663090972.
[I 2025-08-20 05:15:05,274] Trial 2 finished with value: 0.7832240252587823 and parameters: {'model_type': 'rf', 'n_estimators': 89, 'max_depth': 9, 'min_samples_split': 10}. Best is trial 0 with value: 0.8006638663090972.
[I 2025-08-20 05:15:10,207] Trial 3 finished with value: 0.7994915258973083 and parameters: {'model_type': 'cat', 'iterations': 651, 'depth': 6, 'learning_rate': 0.10278864655657184}. Best is trial 0 with value: 0.8006638663090972.
[I 2025-08-20 05:15:13,144] Trial 4 finished with value: 0.7834329635790912 and parameters: {'model_type': 'cat', 'iterations': 333, 'depth': 6, 'learning_rate': 0.22136339867065186}. Best is trial 0 with value: 0.8006638663090972.
[I 2025-08-20 05:15:13,180] Trial 5 finished with value: 0.797770114428094 and parameters: {'model_type': 'lgbm', 'n_estimators': 59, 'max_depth': 6, 'learning_rate': 0.23837744316341455}. Best is trial 0 with value: 0.8006638663090972.
[I 2025-08-20 05:15:13,182] Trial 6 finished with value: 0.45778266810549717 and parameters: {'model_type': 'bayesian_ridge', 'alpha_1': 0.0007878183607786732, 'alpha_2': 0.00021611375392171283, 'lambda_1': 0.0006965735585767578, 'lambda_2': 0.0003477581760856432}. Best is trial 0 with value: 0.8006638663090972.
[I 2025-08-20 05:15:14,356] Trial 7 finished with value: 0.7501508364735581 and parameters: {'model_type': 'xgb', 'n_estimators': 150, 'max_depth': 9, 'learning_rate': 0.18416294114845458}. Best is trial 0 with value: 0.8006638663090972.
[I 2025-08-20 05:15:15,146] Trial 8 finished with value: 0.7544717737006754 and parameters: {'model_type': 'xgb', 'n_estimators': 122, 'max_depth': 7, 'learning_rate': 0.06276901280165224}. Best is trial 0 with value: 0.8006638663090972.
[I 2025-08-20 05:15:17,315] Trial 9 finished with value: 0.7933518891468135 and parameters: {'model_type': 'cat', 'iterations': 377, 'depth': 10, 'learning_rate': 0.23744477294171526}. Best is trial 0 with value: 0.8006638663090972.
[I 2025-08-20 05:15:17,361] Trial 10 finished with value: 0.800149704704894 and parameters: {'model_type': 'lgbm', 'n_estimators': 188, 'max_depth': 3, 'learning_rate': 0.292337935239874}. Best is trial 0 with value: 0.8006638663090972.
[I 2025-08-20 05:15:17,401] Trial 11 finished with value: 0.7712270465671445 and parameters: {'model_type': 'lgbm', 'n_estimators': 188, 'max_depth': 3, 'learning_rate': 0.2874396017456648}. Best is trial 0 with value: 0.8006638663090972.
[I 2025-08-20 05:15:17,453] Trial 12 finished with value: 0.791815421334196 and parameters: {'model_type': 'lgbm', 'n_estimators': 196, 'max_depth': 3, 'learning_rate': 0.2997844028723985}. Best is trial 0 with value: 0.8006638663090972.
[I 2025-08-20 05:15:17,513] Trial 13 finished with value: 0.8073600331649966 and parameters: {'model_type': 'lgbm', 'n_estimators': 133, 'max_depth': 5, 'learning_rate': 0.15099639115306365}. Best is trial 13 with value: 0.8073600331649966.
[I 2025-08-20 05:15:17,578] Trial 14 finished with value: 0.8054534409703289 and parameters: {'model_type': 'lgbm', 'n_estimators': 121, 'max_depth': 6, 'learning_rate': 0.1339031066404341}. Best is trial 13 with value: 0.8073600331649966.
