[I 2025-08-20 02:49:55,263] Trial 14 finished with value: 0.6938697197740777 and parameters: {'model_type': 'cat', 'iterations': 738, 'depth': 10, 'learning_rate': 0.28831561576356424}. Best is trial 6 with value: 0.7122038153655847.
[I 2025-08-20 02:50:03,378] Trial 15 finished with value: 0.7187634079480003 and parameters: {'model_type': 'cat', 'iterations': 600, 'depth': 9, 'learning_rate': 0.11268962908429783}. Best is trial 15 with value: 0.7187634079480003.
[I 2025-08-20 02:50:09,555] Trial 16 finished with value: 0.708129369634604 and parameters: {'model_type': 'cat', 'iterations': 510, 'depth': 8, 'learning_rate': 0.12998654573963844}. Best is trial 15 with value: 0.7187634079480003.
[I 2025-08-20 02:50:09,680] Trial 17 finished with value: 0.7226162024799685 and parameters: {'model_type': 'lgbm', 'n_estimators': 194, 'max_depth': 4, 'learning_rate': 0.12017724129979472}. Best is trial 17 with value: 0.7226162024799685.
[I 2025-08-20 02:50:09,727] Trial 18 finished with value: 0.7200508909975487 and parameters: {'model_type': 'lgbm', 'n_estimators': 199, 'max_depth': 3, 'learning_rate': 0.15275558825184057}. Best is trial 17 with value: 0.7226162024799685.
[I 2025-08-20 02:50:09,772] Trial 19 finished with value: 0.7144741094425502 and parameters: {'model_type': 'lgbm', 'n_estimators': 199, 'max_depth': 3, 'learning_rate': 0.19120087178103456}. Best is trial 17 with value: 0.7226162024799685.
[I 2025-08-20 02:50:09,853] Trial 20 finished with value: 0.7012655020944334 and parameters: {'model_type': 'lgbm', 'n_estimators': 166, 'max_depth': 5, 'learning_rate': 0.21899508349267763}. Best is trial 17 with value: 0.7226162024799685.
[I 2025-08-20 02:50:09,907] Trial 21 finished with value: 0.7192992132285776 and parameters: {'model_type': 'lgbm', 'n_estimators': 172, 'max_depth': 4, 'learning_rate': 0.11520374167052738}. Best is trial 17 with value: 0.7226162024799685.
[I 2025-08-20 02:50:09,963] Trial 22 finished with value: 0.7220192664964031 and parameters: {'model_type': 'lgbm', 'n_estimators': 177, 'max_depth': 4, 'learning_rate': 0.1138545253912574}. Best is trial 17 with value: 0.7226162024799685.
[I 2025-08-20 02:50:10,034] Trial 23 finished with value: 0.7236915032424645 and parameters: {'model_type': 'lgbm', 'n_estimators': 197, 'max_depth': 4, 'learning_rate': 0.15268921311405118}. Best is trial 23 with value: 0.7236915032424645.
[I 2025-08-20 02:50:10,097] Trial 24 finished with value: 0.7119956842291155 and parameters: {'model_type': 'lgbm', 'n_estimators': 175, 'max_depth': 5, 'learning_rate': 0.08129687643224508}. Best is trial 23 with value: 0.7236915032424645.
[I 2025-08-20 02:50:10,161] Trial 25 finished with value: 0.7080182304505498 and parameters: {'model_type': 'lgbm', 'n_estimators': 174, 'max_depth': 5, 'learning_rate': 0.21325623462179594}. Best is trial 23 with value: 0.7236915032424645.
[I 2025-08-20 02:50:11,112] Trial 26 finished with value: 0.676924280586513 and parameters: {'model_type': 'xgb', 'n_estimators': 147, 'max_depth': 7, 'learning_rate': 0.08329096257731144}. Best is trial 23 with value: 0.7236915032424645.
[I 2025-08-20 02:50:11,164] Trial 27 finished with value: 0.7198654779262808 and parameters: {'model_type': 'lgbm', 'n_estimators': 184, 'max_depth': 4, 'learning_rate': 0.1459245271270665}. Best is trial 23 with value: 0.7236915032424645.
[I 2025-08-20 02:50:11,212] Trial 28 finished with value: 0.7081011119665894 and parameters: {'model_type': 'lgbm', 'n_estimators': 109, 'max_depth': 4, 'learning_rate': 0.10297019892105996}. Best is trial 23 with value: 0.7236915032424645.
[I 2025-08-20 02:50:11,278] Trial 29 finished with value: 0.698931966734651 and parameters: {'model_type': 'lgbm', 'n_estimators': 151, 'max_depth': 6, 'learning_rate': 0.1704824064392907}. Best is trial 23 with value: 0.7236915032424645.
[I 2025-08-20 02:50:13,426] Trial 30 finished with value: 0.6794701594170809 and parameters: {'model_type': 'xgb', 'n_estimators': 185, 'max_depth': 4, 'learning_rate': 0.24974414633576636}. Best is trial 23 with value: 0.7236915032424645.
[I 2025-08-20 02:50:13,485] Trial 31 finished with value: 0.7203653187422754 and parameters: {'model_type': 'lgbm', 'n_estimators': 196, 'max_depth': 3, 'learning_rate': 0.14948630564047358}. Best is trial 23 with value: 0.7236915032424645.
[I 2025-08-20 02:50:13,536] Trial 32 finished with value: 0.7148522701069214 and parameters: {'model_type': 'lgbm', 'n_estimators': 190, 'max_depth': 3, 'learning_rate': 0.1368248354706378}. Best is trial 23 with value: 0.7236915032424645.
[I 2025-08-20 02:50:13,590] Trial 33 finished with value: 0.7252544371689905 and parameters: {'model_type': 'lgbm', 'n_estimators': 183, 'max_depth': 4, 'learning_rate': 0.16687911991341547}. Best is trial 33 with value: 0.7252544371689905.
[I 2025-08-20 02:50:13,668] Trial 34 finished with value: 0.7212836852141902 and parameters: {'model_type': 'lgbm', 'n_estimators': 165, 'max_depth': 5, 'learning_rate': 0.1803081980647252}. Best is trial 33 with value: 0.7252544371689905.
[I 2025-08-20 02:50:13,996] Trial 35 finished with value: 0.6737895196774357 and parameters: {'model_type': 'rf', 'n_estimators': 182, 'max_depth': 10, 'min_samples_split': 3}. Best is trial 33 with value: 0.7252544371689905.
[I 2025-08-20 02:50:14,051] Trial 36 finished with value: 0.7082835351834006 and parameters: {'model_type': 'lgbm', 'n_estimators': 158, 'max_depth': 4, 'learning_rate': 0.2011931417352744}. Best is trial 33 with value: 0.7252544371689905.
[I 2025-08-20 02:50:14,135] Trial 37 finished with value: 0.7126635227606491 and parameters: {'model_type': 'lgbm', 'n_estimators': 133, 'max_depth': 5, 'learning_rate': 0.09922174907579501}. Best is trial 33 with value: 0.7252544371689905.
[I 2025-08-20 02:50:14,219] Trial 38 finished with value: 0.7020970007580969 and parameters: {'model_type': 'lgbm', 'n_estimators': 183, 'max_depth': 4, 'learning_rate': 0.0548108628991429}. Best is trial 33 with value: 0.7252544371689905.
[I 2025-08-20 02:50:14,231] Trial 39 finished with value: 0.2785278656987673 and parameters: {'model_type': 'bayesian_ridge', 'alpha_1': 7.804976840813412e-05, 'alpha_2': 1.937510009306239e-05, 'lambda_1': 8.247508052492076e-06, 'lambda_2': 2.229804183499155e-05}. Best is trial 33 with value: 0.7252544371689905.
[I 2025-08-20 02:50:14,547] Trial 40 finished with value: 0.6711961863011395 and parameters: {'model_type': 'rf', 'n_estimators': 185, 'max_depth': 10, 'min_samples_split': 10}. Best is trial 33 with value: 0.7252544371689905.
[I 2025-08-20 02:50:14,647] Trial 41 finished with value: 0.7184760553984679 and parameters: {'model_type': 'lgbm', 'n_estimators': 166, 'max_depth': 5, 'learning_rate': 0.17345920905151824}. Best is trial 33 with value: 0.7252544371689905.
[I 2025-08-20 02:50:14,712] Trial 42 finished with value: 0.722018711414347 and parameters: {'model_type': 'lgbm', 'n_estimators': 163, 'max_depth': 4, 'learning_rate': 0.17355529876530496}. Best is trial 33 with value: 0.7252544371689905.
[I 2025-08-20 02:50:14,787] Trial 43 finished with value: 0.7220333959956451 and parameters: {'model_type': 'lgbm', 'n_estimators': 176, 'max_depth': 4, 'learning_rate': 0.1287690243634555}. Best is trial 33 with value: 0.7252544371689905.
[I 2025-08-20 02:50:14,856] Trial 44 finished with value: 0.7077356729210882 and parameters: {'model_type': 'lgbm', 'n_estimators': 176, 'max_depth': 6, 'learning_rate': 0.12903882231326366}. Best is trial 33 with value: 0.7252544371689905.
[I 2025-08-20 02:50:14,866] Trial 45 finished with value: 0.278524940314676 and parameters: {'model_type': 'bayesian_ridge', 'alpha_1': 0.00032556636796590114, 'alpha_2': 0.0008917705238674853, 'lambda_1': 0.0005695760488937977, 'lambda_2': 0.0003422596128412297}. Best is trial 33 with value: 0.7252544371689905.
[I 2025-08-20 02:50:14,946] Trial 46 finished with value: 0.720851768435872 and parameters: {'model_type': 'lgbm', 'n_estimators': 192, 'max_depth': 4, 'learning_rate': 0.11981611902052869}. Best is trial 33 with value: 0.7252544371689905.
[I 2025-08-20 02:50:15,243] Trial 47 finished with value: 0.6779189723866849 and parameters: {'model_type': 'rf', 'n_estimators': 145, 'max_depth': 15, 'min_samples_split': 2}. Best is trial 33 with value: 0.7252544371689905.
[I 2025-08-20 02:50:15,699] Trial 48 finished with value: 0.6647384325631063 and parameters: {'model_type': 'xgb', 'n_estimators': 108, 'max_depth': 6, 'learning_rate': 0.15982511020044443}. Best is trial 33 with value: 0.7252544371689905.
[I 2025-08-20 02:50:15,747] Trial 49 finished with value: 0.699300104702828 and parameters: {'model_type': 'lgbm', 'n_estimators': 156, 'max_depth': 3, 'learning_rate': 0.09366564820006232}. Best is trial 33 with value: 0.7252544371689905.
Regression Results:
  Train R²: 0.936
  Test R²: 0.725
  CV R²: 0.552 ± 0.201
Saved comparison to results/rxn_feature_comparison_hte_each_8_optuna.json

==================================================
ANALYSIS COMPLETE
==================================================
Check the following directories for outputs:
  - plots/: Visualization files
  - results/: Data files and reports
  - models/: Trained model files
