[I 2025-08-20 02:00:46,733] Trial 35 finished with value: 0.769599596924831 and parameters: {'model_type': 'cat', 'iterations': 792, 'depth': 4, 'learning_rate': 0.1039011043822868}. Best is trial 34 with value: 0.7794573884953193.
[I 2025-08-20 02:00:53,501] Trial 36 finished with value: 0.7733393866996874 and parameters: {'model_type': 'cat', 'iterations': 788, 'depth': 4, 'learning_rate': 0.10627714018545988}. Best is trial 34 with value: 0.7794573884953193.
[I 2025-08-20 02:01:00,210] Trial 37 finished with value: 0.7788973113527135 and parameters: {'model_type': 'cat', 'iterations': 797, 'depth': 4, 'learning_rate': 0.10715092769635769}. Best is trial 34 with value: 0.7794573884953193.
[I 2025-08-20 02:01:07,065] Trial 38 finished with value: 0.7686610678894134 and parameters: {'model_type': 'cat', 'iterations': 794, 'depth': 4, 'learning_rate': 0.1445349600353116}. Best is trial 34 with value: 0.7794573884953193.
[I 2025-08-20 02:01:13,257] Trial 39 finished with value: 0.7739565863802641 and parameters: {'model_type': 'cat', 'iterations': 691, 'depth': 4, 'learning_rate': 0.11417046840118106}. Best is trial 34 with value: 0.7794573884953193.
[I 2025-08-20 02:01:20,455] Trial 40 finished with value: 0.7765115818828457 and parameters: {'model_type': 'cat', 'iterations': 678, 'depth': 6, 'learning_rate': 0.08325747830200443}. Best is trial 34 with value: 0.7794573884953193.
[I 2025-08-20 02:01:27,134] Trial 41 finished with value: 0.7837964097796677 and parameters: {'model_type': 'cat', 'iterations': 682, 'depth': 6, 'learning_rate': 0.08730265315530832}. Best is trial 41 with value: 0.7837964097796677.
[I 2025-08-20 02:01:33,708] Trial 42 finished with value: 0.7800947971646646 and parameters: {'model_type': 'cat', 'iterations': 678, 'depth': 6, 'learning_rate': 0.08419318039833844}. Best is trial 41 with value: 0.7837964097796677.
[I 2025-08-20 02:01:40,221] Trial 43 finished with value: 0.7753135636706123 and parameters: {'model_type': 'cat', 'iterations': 652, 'depth': 6, 'learning_rate': 0.0847676830023839}. Best is trial 41 with value: 0.7837964097796677.
[I 2025-08-20 02:01:46,766] Trial 44 finished with value: 0.7764215866581905 and parameters: {'model_type': 'cat', 'iterations': 687, 'depth': 6, 'learning_rate': 0.08130529411036395}. Best is trial 41 with value: 0.7837964097796677.
[I 2025-08-20 02:01:46,903] Trial 45 finished with value: 0.7428074861051295 and parameters: {'model_type': 'rf', 'n_estimators': 56, 'max_depth': 15, 'min_samples_split': 2}. Best is trial 41 with value: 0.7837964097796677.
[I 2025-08-20 02:01:52,252] Trial 46 finished with value: 0.775230042559627 and parameters: {'model_type': 'cat', 'iterations': 594, 'depth': 5, 'learning_rate': 0.04129294341846607}. Best is trial 41 with value: 0.7837964097796677.
[I 2025-08-20 02:01:58,398] Trial 47 finished with value: 0.76471957341738 and parameters: {'model_type': 'cat', 'iterations': 729, 'depth': 5, 'learning_rate': 0.08758906984926526}. Best is trial 41 with value: 0.7837964097796677.
[I 2025-08-20 02:02:05,346] Trial 48 finished with value: 0.7754870138093368 and parameters: {'model_type': 'cat', 'iterations': 587, 'depth': 7, 'learning_rate': 0.07200764748395772}. Best is trial 41 with value: 0.7837964097796677.
[I 2025-08-20 02:02:05,366] Trial 49 finished with value: 0.37514226878058554 and parameters: {'model_type': 'bayesian_ridge', 'alpha_1': 0.0009186006277524093, 'alpha_2': 0.0009673249015119862, 'lambda_1': 4.253187763216475e-05, 'lambda_2': 0.000780864198259866}. Best is trial 41 with value: 0.7837964097796677.
Regression Results:
  Train R²: 0.922
  Test R²: 0.784
  CV R²: 0.486 ± 0.268
Saved comparison to results/rxn_feature_comparison_hte_each_8_optuna.json

==================================================
ANALYSIS COMPLETE
==================================================
Check the following directories for outputs:
  - plots/: Visualization files
  - results/: Data files and reports
  - models/: Trained model files
