[I 2025-08-20 05:15:17,644] Trial 15 finished with value: 0.8092856419360325 and parameters: {'model_type': 'lgbm', 'n_estimators': 135, 'max_depth': 5, 'learning_rate': 0.13156200173384755}. Best is trial 15 with value: 0.8092856419360325.
[I 2025-08-20 05:15:17,944] Trial 16 finished with value: 0.7915142509016326 and parameters: {'model_type': 'rf', 'n_estimators': 156, 'max_depth': 12, 'min_samples_split': 2}. Best is trial 15 with value: 0.8092856419360325.
[I 2025-08-20 05:15:18,028] Trial 17 finished with value: 0.7319386922826645 and parameters: {'model_type': 'lgbm', 'n_estimators': 143, 'max_depth': 5, 'learning_rate': 0.0171031112061919}. Best is trial 15 with value: 0.8092856419360325.
[I 2025-08-20 05:15:18,072] Trial 18 finished with value: 0.799902777583057 and parameters: {'model_type': 'lgbm', 'n_estimators': 104, 'max_depth': 4, 'learning_rate': 0.1622337310603073}. Best is trial 15 with value: 0.8092856419360325.
[I 2025-08-20 05:15:19,234] Trial 19 finished with value: 0.7824085949886789 and parameters: {'model_type': 'xgb', 'n_estimators': 166, 'max_depth': 5, 'learning_rate': 0.10824339945640779}. Best is trial 15 with value: 0.8092856419360325.
[I 2025-08-20 05:15:19,244] Trial 20 finished with value: 0.4577780143223553 and parameters: {'model_type': 'bayesian_ridge', 'alpha_1': 7.377471550796291e-05, 'alpha_2': 0.0009886279417270528, 'lambda_1': 0.0009961727897770992, 'lambda_2': 1.175934174608268e-05}. Best is trial 15 with value: 0.8092856419360325.
[I 2025-08-20 05:15:19,322] Trial 21 finished with value: 0.8034196483107516 and parameters: {'model_type': 'lgbm', 'n_estimators': 121, 'max_depth': 7, 'learning_rate': 0.12420529444079265}. Best is trial 15 with value: 0.8092856419360325.
[I 2025-08-20 05:15:19,387] Trial 22 finished with value: 0.8200704774603698 and parameters: {'model_type': 'lgbm', 'n_estimators': 131, 'max_depth': 5, 'learning_rate': 0.14470849233164015}. Best is trial 22 with value: 0.8200704774603698.
[I 2025-08-20 05:15:19,454] Trial 23 finished with value: 0.7961712499882141 and parameters: {'model_type': 'lgbm', 'n_estimators': 136, 'max_depth': 5, 'learning_rate': 0.180008849859531}. Best is trial 22 with value: 0.8200704774603698.
[I 2025-08-20 05:15:19,528] Trial 24 finished with value: 0.8034983978872323 and parameters: {'model_type': 'lgbm', 'n_estimators': 106, 'max_depth': 4, 'learning_rate': 0.07719949776261456}. Best is trial 22 with value: 0.8200704774603698.
[I 2025-08-20 05:15:19,808] Trial 25 finished with value: 0.7973431713830412 and parameters: {'model_type': 'rf', 'n_estimators': 167, 'max_depth': 15, 'min_samples_split': 6}. Best is trial 22 with value: 0.8200704774603698.
[I 2025-08-20 05:15:19,861] Trial 26 finished with value: 0.8018634435400537 and parameters: {'model_type': 'lgbm', 'n_estimators': 132, 'max_depth': 4, 'learning_rate': 0.14321892959926205}. Best is trial 22 with value: 0.8200704774603698.
[I 2025-08-20 05:15:19,916] Trial 27 finished with value: 0.8142609623456825 and parameters: {'model_type': 'lgbm', 'n_estimators': 109, 'max_depth': 5, 'learning_rate': 0.19978396251598304}. Best is trial 22 with value: 0.8200704774603698.
[I 2025-08-20 05:15:19,961] Trial 28 finished with value: 0.8088229623070021 and parameters: {'model_type': 'lgbm', 'n_estimators': 105, 'max_depth': 4, 'learning_rate': 0.2017644735715502}. Best is trial 22 with value: 0.8200704774603698.
[I 2025-08-20 05:15:20,024] Trial 29 finished with value: 0.7955325572051578 and parameters: {'model_type': 'lgbm', 'n_estimators': 93, 'max_depth': 7, 'learning_rate': 0.17335190921911958}. Best is trial 22 with value: 0.8200704774603698.
[I 2025-08-20 05:15:20,179] Trial 30 finished with value: 0.7894047643479639 and parameters: {'model_type': 'xgb', 'n_estimators': 112, 'max_depth': 5, 'learning_rate': 0.20445044450327315}. Best is trial 22 with value: 0.8200704774603698.
[I 2025-08-20 05:15:20,219] Trial 31 finished with value: 0.7970656577558395 and parameters: {'model_type': 'lgbm', 'n_estimators': 88, 'max_depth': 4, 'learning_rate': 0.19569854718980953}. Best is trial 22 with value: 0.8200704774603698.
[I 2025-08-20 05:15:20,268] Trial 32 finished with value: 0.7922063436838326 and parameters: {'model_type': 'lgbm', 'n_estimators': 111, 'max_depth': 4, 'learning_rate': 0.21369831419764468}. Best is trial 22 with value: 0.8200704774603698.
[I 2025-08-20 05:15:20,278] Trial 33 finished with value: 0.45779150873874586 and parameters: {'model_type': 'bayesian_ridge', 'alpha_1': 0.000972129566302837, 'alpha_2': 1.7193799306087338e-05, 'lambda_1': 1.3373695058195145e-06, 'lambda_2': 0.000987210069709018}. Best is trial 22 with value: 0.8200704774603698.
[I 2025-08-20 05:15:20,427] Trial 34 finished with value: 0.7835943797417615 and parameters: {'model_type': 'rf', 'n_estimators': 96, 'max_depth': 9, 'min_samples_split': 10}. Best is trial 22 with value: 0.8200704774603698.
[I 2025-08-20 05:15:24,320] Trial 35 finished with value: 0.771825318973812 and parameters: {'model_type': 'cat', 'iterations': 787, 'depth': 4, 'learning_rate': 0.2654395137875265}. Best is trial 22 with value: 0.8200704774603698.
[I 2025-08-20 05:15:24,373] Trial 36 finished with value: 0.8062810536621416 and parameters: {'model_type': 'lgbm', 'n_estimators': 75, 'max_depth': 6, 'learning_rate': 0.1651324080241208}. Best is trial 22 with value: 0.8200704774603698.
[I 2025-08-20 05:15:24,441] Trial 37 finished with value: 0.8074989172779102 and parameters: {'model_type': 'lgbm', 'n_estimators': 147, 'max_depth': 5, 'learning_rate': 0.11358348024213978}. Best is trial 22 with value: 0.8200704774603698.
[I 2025-08-20 05:15:24,451] Trial 38 finished with value: 0.4577843077141356 and parameters: {'model_type': 'bayesian_ridge', 'alpha_1': 0.00047939661863392153, 'alpha_2': 0.0005018753992820393, 'lambda_1': 0.00038178061015433945, 'lambda_2': 0.00045769741028623}. Best is trial 22 with value: 0.8200704774603698.
[I 2025-08-20 05:15:27,646] Trial 39 finished with value: 0.7907911562389974 and parameters: {'model_type': 'cat', 'iterations': 225, 'depth': 10, 'learning_rate': 0.19165109048040158}. Best is trial 22 with value: 0.8200704774603698.
[I 2025-08-20 05:15:27,690] Trial 40 finished with value: 0.804673774602836 and parameters: {'model_type': 'lgbm', 'n_estimators': 71, 'max_depth': 4, 'learning_rate': 0.2556870425104639}. Best is trial 22 with value: 0.8200704774603698.
[I 2025-08-20 05:15:27,763] Trial 41 finished with value: 0.808949780112446 and parameters: {'model_type': 'lgbm', 'n_estimators': 155, 'max_depth': 5, 'learning_rate': 0.11000371864264703}. Best is trial 22 with value: 0.8200704774603698.
[I 2025-08-20 05:15:27,838] Trial 42 finished with value: 0.8194885511083444 and parameters: {'model_type': 'lgbm', 'n_estimators': 160, 'max_depth': 5, 'learning_rate': 0.08191148972993352}. Best is trial 22 with value: 0.8200704774603698.
[I 2025-08-20 05:15:27,937] Trial 43 finished with value: 0.8061910152804908 and parameters: {'model_type': 'lgbm', 'n_estimators': 164, 'max_depth': 6, 'learning_rate': 0.07273419248124038}. Best is trial 22 with value: 0.8200704774603698.
[I 2025-08-20 05:15:28,042] Trial 44 finished with value: 0.797265123597332 and parameters: {'model_type': 'lgbm', 'n_estimators': 173, 'max_depth': 6, 'learning_rate': 0.08755640204670428}. Best is trial 22 with value: 0.8200704774603698.
[I 2025-08-20 05:15:28,121] Trial 45 finished with value: 0.8054498236705279 and parameters: {'model_type': 'lgbm', 'n_estimators': 156, 'max_depth': 5, 'learning_rate': 0.0428152813805255}. Best is trial 22 with value: 0.8200704774603698.
[I 2025-08-20 05:15:28,904] Trial 46 finished with value: 0.7770480300409336 and parameters: {'model_type': 'xgb', 'n_estimators': 145, 'max_depth': 6, 'learning_rate': 0.09758962845748419}. Best is trial 22 with value: 0.8200704774603698.
[I 2025-08-20 05:15:35,822] Trial 47 finished with value: 0.7877125316135525 and parameters: {'model_type': 'cat', 'iterations': 553, 'depth': 8, 'learning_rate': 0.12709219731229973}. Best is trial 22 with value: 0.8200704774603698.
[I 2025-08-20 05:15:36,094] Trial 48 finished with value: 0.757394203294099 and parameters: {'model_type': 'rf', 'n_estimators': 179, 'max_depth': 7, 'min_samples_split': 2}. Best is trial 22 with value: 0.8200704774603698.
[I 2025-08-20 05:15:36,157] Trial 49 finished with value: 0.8171852668615159 and parameters: {'model_type': 'lgbm', 'n_estimators': 129, 'max_depth': 5, 'learning_rate': 0.14526343232443617}. Best is trial 22 with value: 0.8200704774603698.
Regression Results:
  Train R²: 0.910
  Test R²: 0.820
  CV R²: 0.495 ± 0.245
Failed to save comparison file: Object of type ndarray is not JSON serializable

==================================================
ANALYSIS COMPLETE
==================================================
Check the following directories for outputs:
  - plots/: Visualization files
  - results/: Data files and reports
  - models/: Trained model files
