[I 2025-08-20 01:57:21,661] Trial 34 finished with value: 0.261381985813644 and parameters: {'model_type': 'bayesian_ridge', 'alpha_1': 1.656430260468995e-05, 'alpha_2': 0.0009562414510727178, 'lambda_1': 1.0381934243450892e-06, 'lambda_2': 0.0009470928870562137}. Best is trial 2 with value: 0.42617989468719375.
[I 2025-08-20 01:57:21,813] Trial 35 finished with value: 0.35581668511051734 and parameters: {'model_type': 'xgb', 'n_estimators': 123, 'max_depth': 4, 'learning_rate': 0.025655313512983578}. Best is trial 2 with value: 0.42617989468719375.
[I 2025-08-20 01:57:22,032] Trial 36 finished with value: 0.34589366846378455 and parameters: {'model_type': 'rf', 'n_estimators': 145, 'max_depth': 10, 'min_samples_split': 10}. Best is trial 2 with value: 0.42617989468719375.
[I 2025-08-20 01:57:22,042] Trial 37 finished with value: 0.26139087854642196 and parameters: {'model_type': 'bayesian_ridge', 'alpha_1': 0.0009355167982360081, 'alpha_2': 4.485608115437274e-05, 'lambda_1': 0.0004062022341007209, 'lambda_2': 7.027835952171433e-05}. Best is trial 2 with value: 0.42617989468719375.
[I 2025-08-20 01:57:36,806] Trial 38 finished with value: 0.21213697023299882 and parameters: {'model_type': 'cat', 'iterations': 784, 'depth': 10, 'learning_rate': 0.05471460279516853}. Best is trial 2 with value: 0.42617989468719375.
[I 2025-08-20 01:57:38,953] Trial 39 finished with value: 0.39224570937350745 and parameters: {'model_type': 'xgb', 'n_estimators': 115, 'max_depth': 5, 'learning_rate': 0.026127059306887662}. Best is trial 2 with value: 0.42617989468719375.
[I 2025-08-20 01:57:39,101] Trial 40 finished with value: 0.20650523046013525 and parameters: {'model_type': 'lgbm', 'n_estimators': 164, 'max_depth': 6, 'learning_rate': 0.1411789054613217}. Best is trial 2 with value: 0.42617989468719375.
[I 2025-08-20 01:57:39,264] Trial 41 finished with value: 0.3816197664081863 and parameters: {'model_type': 'xgb', 'n_estimators': 120, 'max_depth': 5, 'learning_rate': 0.02559904479273372}. Best is trial 2 with value: 0.42617989468719375.
[I 2025-08-20 01:57:39,400] Trial 42 finished with value: 0.4317332943179445 and parameters: {'model_type': 'xgb', 'n_estimators': 110, 'max_depth': 5, 'learning_rate': 0.023708966679474176}. Best is trial 42 with value: 0.4317332943179445.
[I 2025-08-20 01:57:39,523] Trial 43 finished with value: 0.4730107996709494 and parameters: {'model_type': 'xgb', 'n_estimators': 104, 'max_depth': 5, 'learning_rate': 0.013712446233872105}. Best is trial 43 with value: 0.4730107996709494.
[I 2025-08-20 01:57:39,645] Trial 44 finished with value: 0.3529087206357536 and parameters: {'model_type': 'xgb', 'n_estimators': 101, 'max_depth': 5, 'learning_rate': 0.051788860313902944}. Best is trial 43 with value: 0.4730107996709494.
[I 2025-08-20 01:57:39,759] Trial 45 finished with value: 0.11398801602811048 and parameters: {'model_type': 'xgb', 'n_estimators': 78, 'max_depth': 6, 'learning_rate': 0.220988496014949}. Best is trial 43 with value: 0.4730107996709494.
[I 2025-08-20 01:57:39,918] Trial 46 finished with value: 0.3033771457450509 and parameters: {'model_type': 'xgb', 'n_estimators': 139, 'max_depth': 5, 'learning_rate': 0.032807962565949575}. Best is trial 43 with value: 0.4730107996709494.
[I 2025-08-20 01:57:40,093] Trial 47 finished with value: 0.1854714295816563 and parameters: {'model_type': 'xgb', 'n_estimators': 126, 'max_depth': 6, 'learning_rate': 0.09235897144904055}. Best is trial 43 with value: 0.4730107996709494.
[I 2025-08-20 01:57:40,256] Trial 48 finished with value: 0.3901744554422504 and parameters: {'model_type': 'xgb', 'n_estimators': 88, 'max_depth': 7, 'learning_rate': 0.021767366603926523}. Best is trial 43 with value: 0.4730107996709494.
[I 2025-08-20 01:57:40,883] Trial 49 finished with value: 0.36607411987284433 and parameters: {'model_type': 'cat', 'iterations': 220, 'depth': 7, 'learning_rate': 0.043982084462945825}. Best is trial 43 with value: 0.4730107996709494.
Regression Results:
  Train R²: 0.756
  Test R²: 0.473
  CV R²: 0.494 ± 0.168
Saved comparison to results/rxn_feature_comparison_hte_each_8_optuna.json

==================================================
ANALYSIS COMPLETE
==================================================
Check the following directories for outputs:
  - plots/: Visualization files
  - results/: Data files and reports
  - models/: Trained model files
