[I 2025-08-20 01:04:14,758] Trial 0 finished with value: 0.6973120060659823 and parameters: {'model_type': 'xgb', 'n_estimators': 125, 'max_depth': 10, 'learning_rate': 0.20111577552917367}. Best is trial 0 with value: 0.6973120060659823.
[I 2025-08-20 01:04:14,988] Trial 1 finished with value: 0.5943622022365598 and parameters: {'model_type': 'rf', 'n_estimators': 115, 'max_depth': 4, 'min_samples_split': 8}. Best is trial 0 with value: 0.6973120060659823.
[I 2025-08-20 01:04:15,232] Trial 2 finished with value: 0.7086256569216579 and parameters: {'model_type': 'rf', 'n_estimators': 78, 'max_depth': 13, 'min_samples_split': 7}. Best is trial 2 with value: 0.7086256569216579.
[I 2025-08-20 01:04:32,554] Trial 3 finished with value: 0.7212313485921655 and parameters: {'model_type': 'cat', 'iterations': 694, 'depth': 10, 'learning_rate': 0.04519124651263827}. Best is trial 3 with value: 0.7212313485921655.
[I 2025-08-20 01:04:36,573] Trial 4 finished with value: 0.7088634595264768 and parameters: {'model_type': 'cat', 'iterations': 410, 'depth': 6, 'learning_rate': 0.28390952586046475}. Best is trial 3 with value: 0.7212313485921655.
[I 2025-08-20 01:04:36,677] Trial 5 finished with value: 0.7253810518968251 and parameters: {'model_type': 'lgbm', 'n_estimators': 55, 'max_depth': 9, 'learning_rate': 0.1923665307151394}. Best is trial 5 with value: 0.7253810518968251.
[I 2025-08-20 01:04:43,852] Trial 6 finished with value: 0.7204646269996882 and parameters: {'model_type': 'cat', 'iterations': 698, 'depth': 5, 'learning_rate': 0.02012507470277344}. Best is trial 5 with value: 0.7253810518968251.
[I 2025-08-20 01:04:49,527] Trial 7 finished with value: 0.7064775944469713 and parameters: {'model_type': 'cat', 'iterations': 534, 'depth': 4, 'learning_rate': 0.2157890819916159}. Best is trial 5 with value: 0.7253810518968251.
[I 2025-08-20 01:04:50,403] Trial 8 finished with value: 0.677883861617553 and parameters: {'model_type': 'xgb', 'n_estimators': 192, 'max_depth': 9, 'learning_rate': 0.1842184537946268}. Best is trial 5 with value: 0.7253810518968251.
[I 2025-08-20 01:04:52,977] Trial 9 finished with value: 0.7149029904920485 and parameters: {'model_type': 'cat', 'iterations': 365, 'depth': 4, 'learning_rate': 0.040029187635455724}. Best is trial 5 with value: 0.7253810518968251.
[I 2025-08-20 01:04:53,040] Trial 10 finished with value: 0.7170547758160712 and parameters: {'model_type': 'lgbm', 'n_estimators': 50, 'max_depth': 7, 'learning_rate': 0.10449503915827607}. Best is trial 5 with value: 0.7253810518968251.
[I 2025-08-20 01:04:53,128] Trial 11 finished with value: 0.7462100691724018 and parameters: {'model_type': 'lgbm', 'n_estimators': 182, 'max_depth': 4, 'learning_rate': 0.11436529887637881}. Best is trial 11 with value: 0.7462100691724018.
[I 2025-08-20 01:04:53,194] Trial 12 finished with value: 0.7423630372845655 and parameters: {'model_type': 'lgbm', 'n_estimators': 192, 'max_depth': 3, 'learning_rate': 0.12342901625562963}. Best is trial 11 with value: 0.7462100691724018.
[I 2025-08-20 01:04:53,263] Trial 13 finished with value: 0.743145059962587 and parameters: {'model_type': 'lgbm', 'n_estimators': 199, 'max_depth': 3, 'learning_rate': 0.11755333919509037}. Best is trial 11 with value: 0.7462100691724018.
[I 2025-08-20 01:04:53,274] Trial 14 finished with value: 0.5346132899500091 and parameters: {'model_type': 'bayesian_ridge', 'alpha_1': 2.8015452148725953e-05, 'alpha_2': 0.0005919339828077537, 'lambda_1': 0.0007071600518659377, 'lambda_2': 0.0002585503660531496}. Best is trial 11 with value: 0.7462100691724018.
[I 2025-08-20 01:04:53,372] Trial 15 finished with value: 0.7250976764942765 and parameters: {'model_type': 'lgbm', 'n_estimators': 160, 'max_depth': 5, 'learning_rate': 0.11249561582734763}. Best is trial 11 with value: 0.7462100691724018.
[I 2025-08-20 01:04:53,436] Trial 16 finished with value: 0.7436954495646562 and parameters: {'model_type': 'lgbm', 'n_estimators': 164, 'max_depth': 3, 'learning_rate': 0.06994196929871487}. Best is trial 11 with value: 0.7462100691724018.
[I 2025-08-20 01:04:53,446] Trial 17 finished with value: 0.5346245243673435 and parameters: {'model_type': 'bayesian_ridge', 'alpha_1': 0.0009926157415213396, 'alpha_2': 0.00017130027138073135, 'lambda_1': 0.00018202571045785655, 'lambda_2': 0.0009851542701193694}. Best is trial 11 with value: 0.7462100691724018.
[I 2025-08-20 01:04:53,562] Trial 18 finished with value: 0.7323864007043454 and parameters: {'model_type': 'lgbm', 'n_estimators': 159, 'max_depth': 5, 'learning_rate': 0.067772627669505}. Best is trial 11 with value: 0.7462100691724018.
[I 2025-08-20 01:04:53,669] Trial 19 finished with value: 0.7365655647854388 and parameters: {'model_type': 'lgbm', 'n_estimators': 159, 'max_depth': 5, 'learning_rate': 0.07613251306212447}. Best is trial 11 with value: 0.7462100691724018.
[I 2025-08-20 01:04:53,733] Trial 20 finished with value: 0.7366046395907755 and parameters: {'model_type': 'lgbm', 'n_estimators': 170, 'max_depth': 3, 'learning_rate': 0.15506264401707556}. Best is trial 11 with value: 0.7462100691724018.
[I 2025-08-20 01:04:53,808] Trial 21 finished with value: 0.7416618899046612 and parameters: {'model_type': 'lgbm', 'n_estimators': 200, 'max_depth': 3, 'learning_rate': 0.1430443846557719}. Best is trial 11 with value: 0.7462100691724018.
[I 2025-08-20 01:04:53,890] Trial 22 finished with value: 0.7426044415236049 and parameters: {'model_type': 'lgbm', 'n_estimators': 173, 'max_depth': 4, 'learning_rate': 0.08473060141132548}. Best is trial 11 with value: 0.7462100691724018.
[I 2025-08-20 01:04:53,958] Trial 23 finished with value: 0.7384179467712456 and parameters: {'model_type': 'lgbm', 'n_estimators': 140, 'max_depth': 4, 'learning_rate': 0.15434442667746734}. Best is trial 11 with value: 0.7462100691724018.
[I 2025-08-20 01:04:53,968] Trial 24 finished with value: 0.5346212861105037 and parameters: {'model_type': 'bayesian_ridge', 'alpha_1': 0.0005429646064043576, 'alpha_2': 0.0009075589673491008, 'lambda_1': 0.0009794578553919617, 'lambda_2': 0.0007927556231093909}. Best is trial 11 with value: 0.7462100691724018.
[I 2025-08-20 01:04:54,427] Trial 25 finished with value: 0.693144286235357 and parameters: {'model_type': 'rf', 'n_estimators': 181, 'max_depth': 7, 'min_samples_split': 2}. Best is trial 11 with value: 0.7462100691724018.
[I 2025-08-20 01:04:54,766] Trial 26 finished with value: 0.7603503025247281 and parameters: {'model_type': 'xgb', 'n_estimators': 145, 'max_depth': 3, 'learning_rate': 0.09214357657713676}. Best is trial 26 with value: 0.7603503025247281.
[I 2025-08-20 01:04:55,073] Trial 27 finished with value: 0.721037297574658 and parameters: {'model_type': 'xgb', 'n_estimators': 140, 'max_depth': 4, 'learning_rate': 0.05859187303525345}. Best is trial 26 with value: 0.7603503025247281.
[I 2025-08-20 01:04:55,300] Trial 28 finished with value: 0.6423505455051117 and parameters: {'model_type': 'xgb', 'n_estimators': 140, 'max_depth': 6, 'learning_rate': 0.011362098141407706}. Best is trial 26 with value: 0.7603503025247281.
[I 2025-08-20 01:04:55,397] Trial 29 finished with value: 0.7512044778715987 and parameters: {'model_type': 'xgb', 'n_estimators': 108, 'max_depth': 3, 'learning_rate': 0.09041468367129633}. Best is trial 26 with value: 0.7603503025247281.
[I 2025-08-20 01:04:55,504] Trial 30 finished with value: 0.7354883079083716 and parameters: {'model_type': 'xgb', 'n_estimators': 98, 'max_depth': 4, 'learning_rate': 0.09131378205753718}. Best is trial 26 with value: 0.7603503025247281.
[I 2025-08-20 01:04:55,595] Trial 31 finished with value: 0.7466371441171992 and parameters: {'model_type': 'xgb', 'n_estimators': 100, 'max_depth': 3, 'learning_rate': 0.09249929033608575}. Best is trial 26 with value: 0.7603503025247281.
[I 2025-08-20 01:04:55,677] Trial 32 finished with value: 0.7532987439483221 and parameters: {'model_type': 'xgb', 'n_estimators': 91, 'max_depth': 3, 'learning_rate': 0.12792015209950716}. Best is trial 26 with value: 0.7603503025247281.
[I 2025-08-20 01:04:55,767] Trial 33 finished with value: 0.7580507031585776 and parameters: {'model_type': 'xgb', 'n_estimators': 97, 'max_depth': 3, 'learning_rate': 0.13785363013806742}. Best is trial 26 with value: 0.7603503025247281.
[I 2025-08-20 01:04:55,845] Trial 34 finished with value: 0.7445013963091107 and parameters: {'model_type': 'xgb', 'n_estimators': 83, 'max_depth': 3, 'learning_rate': 0.1422110290144913}. Best is trial 26 with value: 0.7603503025247281.
[I 2025-08-20 01:04:55,977] Trial 35 finished with value: 0.728330502977222 and parameters: {'model_type': 'xgb', 'n_estimators': 100, 'max_depth': 5, 'learning_rate': 0.1316735816114817}. Best is trial 26 with value: 0.7603503025247281.
[I 2025-08-20 01:04:56,057] Trial 36 finished with value: 0.7573918830240639 and parameters: {'model_type': 'xgb', 'n_estimators': 85, 'max_depth': 3, 'learning_rate': 0.16929303870633372}. Best is trial 26 with value: 0.7603503025247281.
[I 2025-08-20 01:04:56,148] Trial 37 finished with value: 0.7427397595694583 and parameters: {'model_type': 'xgb', 'n_estimators': 80, 'max_depth': 4, 'learning_rate': 0.2218738169116739}. Best is trial 26 with value: 0.7603503025247281.
[I 2025-08-20 01:04:56,261] Trial 38 finished with value: 0.7126176166028966 and parameters: {'model_type': 'xgb', 'n_estimators': 66, 'max_depth': 6, 'learning_rate': 0.17239187951183993}. Best is trial 26 with value: 0.7603503025247281.
[I 2025-08-20 01:04:56,680] Trial 39 finished with value: 0.707220439102058 and parameters: {'model_type': 'rf', 'n_estimators': 122, 'max_depth': 12, 'min_samples_split': 2}. Best is trial 26 with value: 0.7603503025247281.
[I 2025-08-20 01:04:56,780] Trial 40 finished with value: 0.696533387675129 and parameters: {'model_type': 'xgb', 'n_estimators': 88, 'max_depth': 4, 'learning_rate': 0.2440527718848567}. Best is trial 26 with value: 0.7603503025247281.
[I 2025-08-20 01:04:56,880] Trial 41 finished with value: 0.7386083372201733 and parameters: {'model_type': 'xgb', 'n_estimators': 115, 'max_depth': 3, 'learning_rate': 0.16728462029334987}. Best is trial 26 with value: 0.7603503025247281.
[I 2025-08-20 01:04:56,976] Trial 42 finished with value: 0.7551377432990183 and parameters: {'model_type': 'xgb', 'n_estimators': 109, 'max_depth': 3, 'learning_rate': 0.10179644841463256}. Best is trial 26 with value: 0.7603503025247281.
[I 2025-08-20 01:04:57,046] Trial 43 finished with value: 0.7486067771078969 and parameters: {'model_type': 'xgb', 'n_estimators': 71, 'max_depth': 3, 'learning_rate': 0.13212285536647891}. Best is trial 26 with value: 0.7603503025247281.
[I 2025-08-20 01:04:57,131] Trial 44 finished with value: 0.7517362901238486 and parameters: {'model_type': 'xgb', 'n_estimators': 92, 'max_depth': 3, 'learning_rate': 0.1042006022225301}. Best is trial 26 with value: 0.7603503025247281.
[I 2025-08-20 01:04:57,252] Trial 45 finished with value: 0.7324050754106424 and parameters: {'model_type': 'xgb', 'n_estimators': 108, 'max_depth': 4, 'learning_rate': 0.20507190122405805}. Best is trial 26 with value: 0.7603503025247281.
[I 2025-08-20 01:04:57,548] Trial 46 finished with value: 0.6791223308770353 and parameters: {'model_type': 'xgb', 'n_estimators': 131, 'max_depth': 8, 'learning_rate': 0.17342919553285113}. Best is trial 26 with value: 0.7603503025247281.
[I 2025-08-20 01:04:59,677] Trial 47 finished with value: 0.6631098011964092 and parameters: {'model_type': 'cat', 'iterations': 202, 'depth': 9, 'learning_rate': 0.14600673355202617}. Best is trial 26 with value: 0.7603503025247281.
[I 2025-08-20 01:04:59,934] Trial 48 finished with value: 0.6812131997005247 and parameters: {'model_type': 'xgb', 'n_estimators': 71, 'max_depth': 4, 'learning_rate': 0.041068644487400954}. Best is trial 26 with value: 0.7603503025247281.
[I 2025-08-20 01:05:00,193] Trial 49 finished with value: 0.7451275133174977 and parameters: {'model_type': 'xgb', 'n_estimators': 110, 'max_depth': 3, 'learning_rate': 0.1926284508847148}. Best is trial 26 with value: 0.7603503025247281.
Regression Results:
  Train R²: 0.896
  Test R²: 0.760
  CV R²: 0.372 ± 0.293

=== Generating Visualizations ===
=== Evaluating XGBoost with Parity Plots ===
Traceback (most recent call last):
  File "/home/passos/ml_measurable_hte_rates/run_analysis.py", line 722, in <module>
    main() 
  File "/home/passos/ml_measurable_hte_rates/run_analysis.py", line 702, in main
    results = run_single_hte_prediction_analysis(config)
  File "/home/passos/ml_measurable_hte_rates/run_analysis.py", line 419, in run_single_hte_prediction_analysis
    parity_results = evaluate_regression_with_parity_plots(
  File "/home/passos/ml_measurable_hte_rates/src/model_evaluation.py", line 1168, in evaluate_regression_with_parity_plots
    X_train_scaled = scaler.transform(X_train)
  File "/home/passos/mambaforge/envs/hte-ml/lib/python3.10/site-packages/sklearn/utils/_set_output.py", line 316, in wrapped
    data_to_wrap = f(self, X, *args, **kwargs)
  File "/home/passos/mambaforge/envs/hte-ml/lib/python3.10/site-packages/sklearn/preprocessing/_data.py", line 1075, in transform
    X = validate_data(
  File "/home/passos/mambaforge/envs/hte-ml/lib/python3.10/site-packages/sklearn/utils/validation.py", line 2929, in validate_data
    _check_feature_names(_estimator, X, reset=reset)
  File "/home/passos/mambaforge/envs/hte-ml/lib/python3.10/site-packages/sklearn/utils/validation.py", line 2787, in _check_feature_names
    raise ValueError(message)
ValueError: The feature names should match those that were passed during fit.
Feature names unseen at fit time:
- rxn_barriers_dGTS_from_INT1_B

