[I 2025-08-20 01:11:46,303] Trial 34 finished with value: 0.4075875501734074 and parameters: {'model_type': 'bayesian_ridge', 'alpha_1': 0.0009004344028945563, 'alpha_2': 0.0009788025216597629, 'lambda_1': 3.6112831550535606e-05, 'lambda_2': 0.0009778788322031642}. Best is trial 29 with value: 0.7691828075386569.
[I 2025-08-20 01:11:46,427] Trial 35 finished with value: 0.7122784340774151 and parameters: {'model_type': 'rf', 'n_estimators': 75, 'max_depth': 8, 'min_samples_split': 2}. Best is trial 29 with value: 0.7691828075386569.
[I 2025-08-20 01:11:46,475] Trial 36 finished with value: 0.7479847874122101 and parameters: {'model_type': 'lgbm', 'n_estimators': 104, 'max_depth': 4, 'learning_rate': 0.23770895737644743}. Best is trial 29 with value: 0.7691828075386569.
[I 2025-08-20 01:11:46,532] Trial 37 finished with value: 0.7477056994519464 and parameters: {'model_type': 'lgbm', 'n_estimators': 119, 'max_depth': 5, 'learning_rate': 0.1726758694254799}. Best is trial 29 with value: 0.7691828075386569.
[I 2025-08-20 01:11:46,573] Trial 38 finished with value: 0.7650469310105005 and parameters: {'model_type': 'lgbm', 'n_estimators': 94, 'max_depth': 4, 'learning_rate': 0.22351649521436842}. Best is trial 29 with value: 0.7691828075386569.
[I 2025-08-20 01:11:46,682] Trial 39 finished with value: 0.7603204657641279 and parameters: {'model_type': 'xgb', 'n_estimators': 58, 'max_depth': 3, 'learning_rate': 0.22332296690761674}. Best is trial 29 with value: 0.7691828075386569.
[I 2025-08-20 01:11:46,741] Trial 40 finished with value: 0.7480177218967559 and parameters: {'model_type': 'xgb', 'n_estimators': 56, 'max_depth': 3, 'learning_rate': 0.21697794283803842}. Best is trial 29 with value: 0.7691828075386569.
[I 2025-08-20 01:11:46,810] Trial 41 finished with value: 0.7677939988336343 and parameters: {'model_type': 'xgb', 'n_estimators': 72, 'max_depth': 3, 'learning_rate': 0.26574618074597894}. Best is trial 29 with value: 0.7691828075386569.
[I 2025-08-20 01:11:46,874] Trial 42 finished with value: 0.7592870209601482 and parameters: {'model_type': 'xgb', 'n_estimators': 65, 'max_depth': 3, 'learning_rate': 0.2865143576656533}. Best is trial 29 with value: 0.7691828075386569.
[I 2025-08-20 01:11:46,952] Trial 43 finished with value: 0.7680125165288954 and parameters: {'model_type': 'xgb', 'n_estimators': 85, 'max_depth': 3, 'learning_rate': 0.26517979529936375}. Best is trial 29 with value: 0.7691828075386569.
[I 2025-08-20 01:11:47,046] Trial 44 finished with value: 0.7474920255157644 and parameters: {'model_type': 'xgb', 'n_estimators': 88, 'max_depth': 4, 'learning_rate': 0.26499719993190257}. Best is trial 29 with value: 0.7691828075386569.
[I 2025-08-20 01:11:47,118] Trial 45 finished with value: 0.7557421175678393 and parameters: {'model_type': 'xgb', 'n_estimators': 75, 'max_depth': 3, 'learning_rate': 0.24834513613126696}. Best is trial 29 with value: 0.7691828075386569.
[I 2025-08-20 01:11:47,223] Trial 46 finished with value: 0.7281288659959089 and parameters: {'model_type': 'xgb', 'n_estimators': 101, 'max_depth': 4, 'learning_rate': 0.2736590569765877}. Best is trial 29 with value: 0.7691828075386569.
[I 2025-08-20 01:11:47,300] Trial 47 finished with value: 0.760071798170057 and parameters: {'model_type': 'xgb', 'n_estimators': 85, 'max_depth': 3, 'learning_rate': 0.2757167557239715}. Best is trial 29 with value: 0.7691828075386569.
[I 2025-08-20 01:11:47,468] Trial 48 finished with value: 0.7332651427919934 and parameters: {'model_type': 'rf', 'n_estimators': 95, 'max_depth': 11, 'min_samples_split': 5}. Best is trial 29 with value: 0.7691828075386569.
[I 2025-08-20 01:11:47,554] Trial 49 finished with value: 0.7588814043878848 and parameters: {'model_type': 'xgb', 'n_estimators': 79, 'max_depth': 4, 'learning_rate': 0.20925600545094775}. Best is trial 29 with value: 0.7691828075386569.
Regression Results:
  Train R²: 0.879
  Test R²: 0.769
  CV R²: 0.441 ± 0.244
Saved comparison to results/rxn_feature_comparison_hte_each_8_optuna.json

==================================================
ANALYSIS COMPLETE
==================================================
Check the following directories for outputs:
  - plots/: Visualization files
  - results/: Data files and reports
  - models/: Trained model files
