[I 2025-08-20 00:53:06,621] Trial 0 finished with value: -9905.898834693993 and parameters: {'model_type': 'bayesian_ridge', 'alpha_1': 9.284495650810773e-05, 'alpha_2': 0.0006266677229374089, 'lambda_1': 0.0009004730957822428, 'lambda_2': 1.6497426332851263e-05}. Best is trial 0 with value: -9905.898834693993.
[I 2025-08-20 00:53:06,629] Trial 1 finished with value: -9940.530646053083 and parameters: {'model_type': 'bayesian_ridge', 'alpha_1': 0.00010816986087813, 'alpha_2': 0.0004913184827535684, 'lambda_1': 0.0008648439712459896, 'lambda_2': 0.0005539758356254204}. Best is trial 0 with value: -9905.898834693993.
[I 2025-08-20 00:53:07,259] Trial 2 finished with value: 0.5712496373862288 and parameters: {'model_type': 'rf', 'n_estimators': 197, 'max_depth': 8, 'min_samples_split': 3}. Best is trial 2 with value: 0.5712496373862288.
[I 2025-08-20 00:53:08,265] Trial 3 finished with value: 0.49436578896116223 and parameters: {'model_type': 'xgb', 'n_estimators': 100, 'max_depth': 9, 'learning_rate': 0.07621977080639115}. Best is trial 2 with value: 0.5712496373862288.
[I 2025-08-20 00:53:08,394] Trial 4 finished with value: 0.5813770611787696 and parameters: {'model_type': 'xgb', 'n_estimators': 156, 'max_depth': 3, 'learning_rate': 0.13534129175247972}. Best is trial 4 with value: 0.5813770611787696.
[I 2025-08-20 00:53:08,871] Trial 5 finished with value: 0.5879187264591506 and parameters: {'model_type': 'rf', 'n_estimators': 143, 'max_depth': 15, 'min_samples_split': 3}. Best is trial 5 with value: 0.5879187264591506.
[I 2025-08-20 00:53:09,364] Trial 6 finished with value: 0.4541500398321281 and parameters: {'model_type': 'xgb', 'n_estimators': 153, 'max_depth': 10, 'learning_rate': 0.09493017890041526}. Best is trial 5 with value: 0.5879187264591506.
[I 2025-08-20 00:53:09,462] Trial 7 finished with value: 0.5855771774287639 and parameters: {'model_type': 'xgb', 'n_estimators': 120, 'max_depth': 3, 'learning_rate': 0.0626723937705317}. Best is trial 5 with value: 0.5879187264591506.
[I 2025-08-20 00:53:09,592] Trial 8 finished with value: 0.5903245018781688 and parameters: {'model_type': 'xgb', 'n_estimators': 133, 'max_depth': 4, 'learning_rate': 0.16004723652407543}. Best is trial 8 with value: 0.5903245018781688.
[I 2025-08-20 00:53:12,476] Trial 9 finished with value: 0.5603622304622959 and parameters: {'model_type': 'cat', 'iterations': 216, 'depth': 10, 'learning_rate': 0.24378766603523694}. Best is trial 8 with value: 0.5903245018781688.
[I 2025-08-20 00:53:12,627] Trial 10 finished with value: 0.5870661368179023 and parameters: {'model_type': 'lgbm', 'n_estimators': 80, 'max_depth': 5, 'learning_rate': 0.22627562728735368}. Best is trial 8 with value: 0.5903245018781688.
[I 2025-08-20 00:53:13,177] Trial 11 finished with value: 0.5873049257034266 and parameters: {'model_type': 'rf', 'n_estimators': 147, 'max_depth': 15, 'min_samples_split': 3}. Best is trial 8 with value: 0.5903245018781688.
[I 2025-08-20 00:53:13,538] Trial 12 finished with value: 0.5741241957991182 and parameters: {'model_type': 'rf', 'n_estimators': 124, 'max_depth': 15, 'min_samples_split': 9}. Best is trial 8 with value: 0.5903245018781688.
[I 2025-08-20 00:53:19,341] Trial 13 finished with value: 0.5731935064595768 and parameters: {'model_type': 'cat', 'iterations': 792, 'depth': 4, 'learning_rate': 0.18092732984733187}. Best is trial 8 with value: 0.5903245018781688.
[I 2025-08-20 00:53:19,461] Trial 14 finished with value: 0.5550103906462237 and parameters: {'model_type': 'lgbm', 'n_estimators': 180, 'max_depth': 5, 'learning_rate': 0.29977639991352706}. Best is trial 8 with value: 0.5903245018781688.
[I 2025-08-20 00:53:19,672] Trial 15 finished with value: 0.5818443721029636 and parameters: {'model_type': 'rf', 'n_estimators': 56, 'max_depth': 13, 'min_samples_split': 6}. Best is trial 8 with value: 0.5903245018781688.
[I 2025-08-20 00:53:20,301] Trial 16 finished with value: 0.4981232571226446 and parameters: {'model_type': 'xgb', 'n_estimators': 140, 'max_depth': 5, 'learning_rate': 0.014094231514925837}. Best is trial 8 with value: 0.5903245018781688.
[I 2025-08-20 00:53:20,928] Trial 17 finished with value: 0.5779262918778206 and parameters: {'model_type': 'rf', 'n_estimators': 172, 'max_depth': 12, 'min_samples_split': 2}. Best is trial 8 with value: 0.5903245018781688.
[I 2025-08-20 00:53:20,939] Trial 18 finished with value: -9970.140361590487 and parameters: {'model_type': 'bayesian_ridge', 'alpha_1': 0.0009414989147594563, 'alpha_2': 1.0715243872342142e-06, 'lambda_1': 1.9137455737581154e-05, 'lambda_2': 0.0009866405184296534}. Best is trial 8 with value: 0.5903245018781688.
[I 2025-08-20 00:53:21,033] Trial 19 finished with value: 0.6071387629761287 and parameters: {'model_type': 'lgbm', 'n_estimators': 100, 'max_depth': 7, 'learning_rate': 0.15937077921759113}. Best is trial 19 with value: 0.6071387629761287.
[I 2025-08-20 00:53:21,128] Trial 20 finished with value: 0.6063967637449187 and parameters: {'model_type': 'lgbm', 'n_estimators': 102, 'max_depth': 7, 'learning_rate': 0.1637056589302499}. Best is trial 19 with value: 0.6071387629761287.
[I 2025-08-20 00:53:21,210] Trial 21 finished with value: 0.6220449718957998 and parameters: {'model_type': 'lgbm', 'n_estimators': 83, 'max_depth': 7, 'learning_rate': 0.16362583782503498}. Best is trial 21 with value: 0.6220449718957998.
[I 2025-08-20 00:53:21,298] Trial 22 finished with value: 0.6018292474477236 and parameters: {'model_type': 'lgbm', 'n_estimators': 96, 'max_depth': 7, 'learning_rate': 0.19462432003744673}. Best is trial 21 with value: 0.6220449718957998.
[I 2025-08-20 00:53:21,374] Trial 23 finished with value: 0.6224884763210954 and parameters: {'model_type': 'lgbm', 'n_estimators': 76, 'max_depth': 7, 'learning_rate': 0.12795824892258698}. Best is trial 23 with value: 0.6224884763210954.
[I 2025-08-20 00:53:21,447] Trial 24 finished with value: 0.6291867513312168 and parameters: {'model_type': 'lgbm', 'n_estimators': 62, 'max_depth': 6, 'learning_rate': 0.1218621400141579}. Best is trial 24 with value: 0.6291867513312168.
[I 2025-08-20 00:53:21,499] Trial 25 finished with value: 0.6136246668309071 and parameters: {'model_type': 'lgbm', 'n_estimators': 52, 'max_depth': 6, 'learning_rate': 0.11643201926443186}. Best is trial 24 with value: 0.6291867513312168.
[I 2025-08-20 00:53:21,561] Trial 26 finished with value: 0.6034370766459622 and parameters: {'model_type': 'lgbm', 'n_estimators': 72, 'max_depth': 6, 'learning_rate': 0.11798261977384639}. Best is trial 24 with value: 0.6291867513312168.
[I 2025-08-20 00:53:21,638] Trial 27 finished with value: 0.6038928367823075 and parameters: {'model_type': 'lgbm', 'n_estimators': 74, 'max_depth': 8, 'learning_rate': 0.20899789586739825}. Best is trial 24 with value: 0.6291867513312168.
[I 2025-08-20 00:53:21,715] Trial 28 finished with value: 0.6119569072872102 and parameters: {'model_type': 'lgbm', 'n_estimators': 85, 'max_depth': 6, 'learning_rate': 0.13021899727607938}. Best is trial 24 with value: 0.6291867513312168.
[I 2025-08-20 00:53:21,802] Trial 29 finished with value: 0.592774924177644 and parameters: {'model_type': 'lgbm', 'n_estimators': 63, 'max_depth': 8, 'learning_rate': 0.04724952681732042}. Best is trial 24 with value: 0.6291867513312168.
[I 2025-08-20 00:53:27,033] Trial 30 finished with value: 0.6218685730158221 and parameters: {'model_type': 'cat', 'iterations': 518, 'depth': 7, 'learning_rate': 0.09182802098730522}. Best is trial 24 with value: 0.6291867513312168.
[I 2025-08-20 00:53:34,248] Trial 31 finished with value: 0.6124504525665049 and parameters: {'model_type': 'cat', 'iterations': 531, 'depth': 7, 'learning_rate': 0.09915965354761351}. Best is trial 24 with value: 0.6291867513312168.
[I 2025-08-20 00:53:39,040] Trial 32 finished with value: 0.6084906017735148 and parameters: {'model_type': 'cat', 'iterations': 491, 'depth': 7, 'learning_rate': 0.13949285083029556}. Best is trial 24 with value: 0.6291867513312168.
[I 2025-08-20 00:53:39,053] Trial 33 finished with value: -9907.475060523755 and parameters: {'model_type': 'bayesian_ridge', 'alpha_1': 0.000993998318478683, 'alpha_2': 0.0009636072513353009, 'lambda_1': 0.00024025633730919376, 'lambda_2': 1.9450673171237515e-05}. Best is trial 24 with value: 0.6291867513312168.
[I 2025-08-20 00:53:44,320] Trial 34 finished with value: 0.6232333172857281 and parameters: {'model_type': 'cat', 'iterations': 507, 'depth': 5, 'learning_rate': 0.08943805763539325}. Best is trial 24 with value: 0.6291867513312168.
[I 2025-08-20 00:53:44,401] Trial 35 finished with value: 0.6185477108268548 and parameters: {'model_type': 'lgbm', 'n_estimators': 64, 'max_depth': 7, 'learning_rate': 0.11512962211172495}. Best is trial 24 with value: 0.6291867513312168.
[I 2025-08-20 00:53:44,411] Trial 36 finished with value: -9969.226815746884 and parameters: {'model_type': 'bayesian_ridge', 'alpha_1': 0.0005700889320707444, 'alpha_2': 4.5946323699902274e-05, 'lambda_1': 0.0005430147070944573, 'lambda_2': 0.0009898758024271702}. Best is trial 24 with value: 0.6291867513312168.
[I 2025-08-20 00:53:47,462] Trial 37 finished with value: 0.6397681984160399 and parameters: {'model_type': 'cat', 'iterations': 266, 'depth': 4, 'learning_rate': 0.06441306033175236}. Best is trial 37 with value: 0.6397681984160399.
[I 2025-08-20 00:53:50,694] Trial 38 finished with value: 0.63226541524098 and parameters: {'model_type': 'cat', 'iterations': 285, 'depth': 4, 'learning_rate': 0.044261738840655915}. Best is trial 37 with value: 0.6397681984160399.
[I 2025-08-20 00:53:53,730] Trial 39 finished with value: 0.5980160385533654 and parameters: {'model_type': 'cat', 'iterations': 229, 'depth': 4, 'learning_rate': 0.03491971992333624}. Best is trial 37 with value: 0.6397681984160399.
[I 2025-08-20 00:53:57,192] Trial 40 finished with value: 0.6397980287308205 and parameters: {'model_type': 'cat', 'iterations': 366, 'depth': 4, 'learning_rate': 0.06978239315229344}. Best is trial 40 with value: 0.6397980287308205.
[I 2025-08-20 00:54:00,595] Trial 41 finished with value: 0.6447117180118708 and parameters: {'model_type': 'cat', 'iterations': 348, 'depth': 4, 'learning_rate': 0.07049230198647044}. Best is trial 41 with value: 0.6447117180118708.
[I 2025-08-20 00:54:05,064] Trial 42 finished with value: 0.6391576669467842 and parameters: {'model_type': 'cat', 'iterations': 342, 'depth': 4, 'learning_rate': 0.06802008147532158}. Best is trial 41 with value: 0.6447117180118708.
[I 2025-08-20 00:54:08,469] Trial 43 finished with value: 0.6468593425663208 and parameters: {'model_type': 'cat', 'iterations': 340, 'depth': 4, 'learning_rate': 0.06721810517448694}. Best is trial 43 with value: 0.6468593425663208.
[I 2025-08-20 00:54:12,075] Trial 44 finished with value: 0.6325758278679683 and parameters: {'model_type': 'cat', 'iterations': 359, 'depth': 5, 'learning_rate': 0.07092431595439636}. Best is trial 43 with value: 0.6468593425663208.
[I 2025-08-20 00:54:15,506] Trial 45 finished with value: 0.6395971832038887 and parameters: {'model_type': 'cat', 'iterations': 355, 'depth': 4, 'learning_rate': 0.061015630973998494}. Best is trial 43 with value: 0.6468593425663208.
[I 2025-08-20 00:54:19,162] Trial 46 finished with value: 0.6282341858167522 and parameters: {'model_type': 'cat', 'iterations': 357, 'depth': 5, 'learning_rate': 0.052266395271195795}. Best is trial 43 with value: 0.6468593425663208.
[I 2025-08-20 00:54:22,772] Trial 47 finished with value: 0.6209063642891847 and parameters: {'model_type': 'cat', 'iterations': 413, 'depth': 4, 'learning_rate': 0.03234448827167803}. Best is trial 43 with value: 0.6468593425663208.
[I 2025-08-20 00:54:26,245] Trial 48 finished with value: 0.6238539595997041 and parameters: {'model_type': 'cat', 'iterations': 309, 'depth': 5, 'learning_rate': 0.08143054422099893}. Best is trial 43 with value: 0.6468593425663208.
[I 2025-08-20 00:54:29,867] Trial 49 finished with value: 0.6373386415734046 and parameters: {'model_type': 'cat', 'iterations': 423, 'depth': 4, 'learning_rate': 0.057068262451611174}. Best is trial 43 with value: 0.6468593425663208.
Regression Results:
  Train R²: 0.918
  Test R²: 0.647
  CV R²: 0.568 ± 0.123

=== Generating Visualizations ===
=== Evaluating CatBoost with Parity Plots ===
Traceback (most recent call last):
  File "/home/passos/ml_measurable_hte_rates/run_analysis.py", line 722, in <module>
    main() 
  File "/home/passos/ml_measurable_hte_rates/run_analysis.py", line 702, in main
    results = run_single_hte_prediction_analysis(config)
  File "/home/passos/ml_measurable_hte_rates/run_analysis.py", line 419, in run_single_hte_prediction_analysis
    parity_results = evaluate_regression_with_parity_plots(
  File "/home/passos/ml_measurable_hte_rates/src/model_evaluation.py", line 1165, in evaluate_regression_with_parity_plots
    X_train_scaled = scaler.transform(X_train)
  File "/home/passos/mambaforge/envs/hte-ml/lib/python3.10/site-packages/sklearn/utils/_set_output.py", line 316, in wrapped
    data_to_wrap = f(self, X, *args, **kwargs)
  File "/home/passos/mambaforge/envs/hte-ml/lib/python3.10/site-packages/sklearn/preprocessing/_data.py", line 1075, in transform
    X = validate_data(
  File "/home/passos/mambaforge/envs/hte-ml/lib/python3.10/site-packages/sklearn/utils/validation.py", line 2929, in validate_data
    _check_feature_names(_estimator, X, reset=reset)
  File "/home/passos/mambaforge/envs/hte-ml/lib/python3.10/site-packages/sklearn/utils/validation.py", line 2787, in _check_feature_names
    raise ValueError(message)
ValueError: The feature names should match those that were passed during fit.
Feature names unseen at fit time:
- rxn_barriers_dGTS_from_INT1_B

