[I 2025-08-20 01:09:57,132] Trial 0 finished with value: 0.7039587050450382 and parameters: {'model_type': 'lgbm', 'n_estimators': 91, 'max_depth': 9, 'learning_rate': 0.16900993594662334}. Best is trial 0 with value: 0.7039587050450382.
[I 2025-08-20 01:09:57,898] Trial 1 finished with value: 0.7084881871408779 and parameters: {'model_type': 'xgb', 'n_estimators': 87, 'max_depth': 4, 'learning_rate': 0.24206679236933815}. Best is trial 1 with value: 0.7084881871408779.
[I 2025-08-20 01:09:58,389] Trial 2 finished with value: 0.7273564978624729 and parameters: {'model_type': 'xgb', 'n_estimators': 186, 'max_depth': 10, 'learning_rate': 0.10241347290324715}. Best is trial 2 with value: 0.7273564978624729.
[I 2025-08-20 01:09:58,394] Trial 3 finished with value: 0.5346185876444023 and parameters: {'model_type': 'bayesian_ridge', 'alpha_1': 0.0006302000783846935, 'alpha_2': 0.00034901450426360773, 'lambda_1': 0.00041296805277391034, 'lambda_2': 0.0005989557809104485}. Best is trial 2 with value: 0.7273564978624729.
[I 2025-08-20 01:10:01,012] Trial 4 finished with value: 0.6818584474982892 and parameters: {'model_type': 'cat', 'iterations': 255, 'depth': 9, 'learning_rate': 0.05551306259736283}. Best is trial 2 with value: 0.7273564978624729.
[I 2025-08-20 01:10:01,520] Trial 5 finished with value: 0.7057499830934046 and parameters: {'model_type': 'rf', 'n_estimators': 160, 'max_depth': 10, 'min_samples_split': 3}. Best is trial 2 with value: 0.7273564978624729.
[I 2025-08-20 01:10:02,541] Trial 6 finished with value: 0.694830895541754 and parameters: {'model_type': 'xgb', 'n_estimators': 181, 'max_depth': 7, 'learning_rate': 0.17643055887203835}. Best is trial 2 with value: 0.7273564978624729.
[I 2025-08-20 01:10:15,722] Trial 7 finished with value: 0.7106312904276999 and parameters: {'model_type': 'cat', 'iterations': 696, 'depth': 9, 'learning_rate': 0.18862344502542205}. Best is trial 2 with value: 0.7273564978624729.
[I 2025-08-20 01:10:21,193] Trial 8 finished with value: 0.7305504483795953 and parameters: {'model_type': 'cat', 'iterations': 502, 'depth': 4, 'learning_rate': 0.05658706860437565}. Best is trial 8 with value: 0.7305504483795953.
[I 2025-08-20 01:10:29,209] Trial 9 finished with value: 0.7346180347938516 and parameters: {'model_type': 'cat', 'iterations': 703, 'depth': 6, 'learning_rate': 0.18291501849941935}. Best is trial 9 with value: 0.7346180347938516.
[I 2025-08-20 01:10:29,399] Trial 10 finished with value: 0.7018219158441643 and parameters: {'model_type': 'rf', 'n_estimators': 55, 'max_depth': 15, 'min_samples_split': 10}. Best is trial 9 with value: 0.7346180347938516.
[I 2025-08-20 01:10:35,435] Trial 11 finished with value: 0.7276536534179097 and parameters: {'model_type': 'cat', 'iterations': 611, 'depth': 4, 'learning_rate': 0.045139373473925326}. Best is trial 9 with value: 0.7346180347938516.
[I 2025-08-20 01:10:39,079] Trial 12 finished with value: 0.7231100293446185 and parameters: {'model_type': 'cat', 'iterations': 417, 'depth': 4, 'learning_rate': 0.10864795094968918}. Best is trial 9 with value: 0.7346180347938516.
[I 2025-08-20 01:10:47,808] Trial 13 finished with value: 0.7448316068961776 and parameters: {'model_type': 'cat', 'iterations': 773, 'depth': 6, 'learning_rate': 0.2599147101072119}. Best is trial 13 with value: 0.7448316068961776.
[I 2025-08-20 01:10:47,870] Trial 14 finished with value: 0.7383760869322795 and parameters: {'model_type': 'lgbm', 'n_estimators': 133, 'max_depth': 3, 'learning_rate': 0.2915235589376284}. Best is trial 13 with value: 0.7448316068961776.
[I 2025-08-20 01:10:47,923] Trial 15 finished with value: 0.7282800489115399 and parameters: {'model_type': 'lgbm', 'n_estimators': 136, 'max_depth': 3, 'learning_rate': 0.2995084313334213}. Best is trial 13 with value: 0.7448316068961776.
[I 2025-08-20 01:10:48,007] Trial 16 finished with value: 0.6815558127013024 and parameters: {'model_type': 'lgbm', 'n_estimators': 123, 'max_depth': 5, 'learning_rate': 0.298042986293652}. Best is trial 13 with value: 0.7448316068961776.
[I 2025-08-20 01:10:48,019] Trial 17 finished with value: 0.5346093290964222 and parameters: {'model_type': 'bayesian_ridge', 'alpha_1': 3.0529117870413034e-05, 'alpha_2': 0.0009608277824740947, 'lambda_1': 0.0009707596111706461, 'lambda_2': 6.178386723097902e-06}. Best is trial 13 with value: 0.7448316068961776.
[I 2025-08-20 01:10:48,117] Trial 18 finished with value: 0.716231779598888 and parameters: {'model_type': 'lgbm', 'n_estimators': 126, 'max_depth': 6, 'learning_rate': 0.24722134815197597}. Best is trial 13 with value: 0.7448316068961776.
[I 2025-08-20 01:10:48,174] Trial 19 finished with value: 0.7531062937357668 and parameters: {'model_type': 'lgbm', 'n_estimators': 155, 'max_depth': 3, 'learning_rate': 0.24162832017388478}. Best is trial 19 with value: 0.7531062937357668.
[I 2025-08-20 01:10:48,184] Trial 20 finished with value: 0.5346225005514864 and parameters: {'model_type': 'bayesian_ridge', 'alpha_1': 0.0009171288523252949, 'alpha_2': 2.5215880583625042e-05, 'lambda_1': 4.2961342410890925e-05, 'lambda_2': 0.0008472937912774195}. Best is trial 19 with value: 0.7531062937357668.
[I 2025-08-20 01:10:48,240] Trial 21 finished with value: 0.7473834234605921 and parameters: {'model_type': 'lgbm', 'n_estimators': 155, 'max_depth': 3, 'learning_rate': 0.24610586347786179}. Best is trial 19 with value: 0.7531062937357668.
[I 2025-08-20 01:10:48,317] Trial 22 finished with value: 0.7185947075188959 and parameters: {'model_type': 'lgbm', 'n_estimators': 158, 'max_depth': 4, 'learning_rate': 0.23377433647524984}. Best is trial 19 with value: 0.7531062937357668.
[I 2025-08-20 01:10:48,375] Trial 23 finished with value: 0.7492359789299949 and parameters: {'model_type': 'lgbm', 'n_estimators': 159, 'max_depth': 3, 'learning_rate': 0.22234593200825342}. Best is trial 19 with value: 0.7531062937357668.
[I 2025-08-20 01:10:48,433] Trial 24 finished with value: 0.7354369156363212 and parameters: {'model_type': 'lgbm', 'n_estimators': 160, 'max_depth': 3, 'learning_rate': 0.20845709570563847}. Best is trial 19 with value: 0.7531062937357668.
[I 2025-08-20 01:10:48,509] Trial 25 finished with value: 0.7278420589197034 and parameters: {'model_type': 'lgbm', 'n_estimators': 152, 'max_depth': 4, 'learning_rate': 0.2163316735280041}. Best is trial 19 with value: 0.7531062937357668.
[I 2025-08-20 01:10:48,632] Trial 26 finished with value: 0.7093902087009677 and parameters: {'model_type': 'lgbm', 'n_estimators': 199, 'max_depth': 5, 'learning_rate': 0.26619528490909694}. Best is trial 19 with value: 0.7531062937357668.
[I 2025-08-20 01:10:48,695] Trial 27 finished with value: 0.7475526930695828 and parameters: {'model_type': 'lgbm', 'n_estimators': 176, 'max_depth': 3, 'learning_rate': 0.20723302934423454}. Best is trial 19 with value: 0.7531062937357668.
[I 2025-08-20 01:10:49,120] Trial 28 finished with value: 0.6888094890487967 and parameters: {'model_type': 'rf', 'n_estimators': 172, 'max_depth': 7, 'min_samples_split': 8}. Best is trial 19 with value: 0.7531062937357668.
[I 2025-08-20 01:10:49,240] Trial 29 finished with value: 0.7206325084540952 and parameters: {'model_type': 'lgbm', 'n_estimators': 198, 'max_depth': 5, 'learning_rate': 0.13250648107442223}. Best is trial 19 with value: 0.7531062937357668.
[I 2025-08-20 01:10:49,324] Trial 30 finished with value: 0.7352661342538616 and parameters: {'model_type': 'lgbm', 'n_estimators': 175, 'max_depth': 4, 'learning_rate': 0.20088858060992984}. Best is trial 19 with value: 0.7531062937357668.
[I 2025-08-20 01:10:49,379] Trial 31 finished with value: 0.7354274127905587 and parameters: {'model_type': 'lgbm', 'n_estimators': 145, 'max_depth': 3, 'learning_rate': 0.22385934115150702}. Best is trial 19 with value: 0.7531062937357668.
[I 2025-08-20 01:10:49,440] Trial 32 finished with value: 0.7369297783442676 and parameters: {'model_type': 'lgbm', 'n_estimators': 170, 'max_depth': 3, 'learning_rate': 0.27361587685859234}. Best is trial 19 with value: 0.7531062937357668.
[I 2025-08-20 01:10:49,512] Trial 33 finished with value: 0.7257615470957324 and parameters: {'model_type': 'lgbm', 'n_estimators': 145, 'max_depth': 4, 'learning_rate': 0.2282764592685167}. Best is trial 19 with value: 0.7531062937357668.
[I 2025-08-20 01:10:49,778] Trial 34 finished with value: 0.7708932479776499 and parameters: {'model_type': 'xgb', 'n_estimators': 111, 'max_depth': 3, 'learning_rate': 0.13871951210717437}. Best is trial 34 with value: 0.7708932479776499.
[I 2025-08-20 01:10:49,898] Trial 35 finished with value: 0.7581181713740636 and parameters: {'model_type': 'xgb', 'n_estimators': 111, 'max_depth': 3, 'learning_rate': 0.1532949648134334}. Best is trial 34 with value: 0.7708932479776499.
[I 2025-08-20 01:10:50,014] Trial 36 finished with value: 0.7348459293371259 and parameters: {'model_type': 'xgb', 'n_estimators': 109, 'max_depth': 4, 'learning_rate': 0.15280019456995958}. Best is trial 34 with value: 0.7708932479776499.
[I 2025-08-20 01:10:50,147] Trial 37 finished with value: 0.7133748803179676 and parameters: {'model_type': 'xgb', 'n_estimators': 103, 'max_depth': 5, 'learning_rate': 0.15326278967216217}. Best is trial 34 with value: 0.7708932479776499.
[I 2025-08-20 01:10:50,246] Trial 38 finished with value: 0.7407737241567173 and parameters: {'model_type': 'xgb', 'n_estimators': 113, 'max_depth': 3, 'learning_rate': 0.128073784965061}. Best is trial 34 with value: 0.7708932479776499.
[I 2025-08-20 01:10:50,346] Trial 39 finished with value: 0.7175863451278831 and parameters: {'model_type': 'xgb', 'n_estimators': 89, 'max_depth': 4, 'learning_rate': 0.09305717885304443}. Best is trial 34 with value: 0.7708932479776499.
[I 2025-08-20 01:10:50,479] Trial 40 finished with value: 0.7075701968619057 and parameters: {'model_type': 'xgb', 'n_estimators': 80, 'max_depth': 6, 'learning_rate': 0.16695934877850782}. Best is trial 34 with value: 0.7708932479776499.
[I 2025-08-20 01:10:50,570] Trial 41 finished with value: 0.7389886669627496 and parameters: {'model_type': 'xgb', 'n_estimators': 100, 'max_depth': 3, 'learning_rate': 0.14046611298332423}. Best is trial 34 with value: 0.7708932479776499.
[I 2025-08-20 01:10:50,679] Trial 42 finished with value: 0.7630132650052308 and parameters: {'model_type': 'xgb', 'n_estimators': 119, 'max_depth': 3, 'learning_rate': 0.19728004985024464}. Best is trial 34 with value: 0.7708932479776499.
[I 2025-08-20 01:10:50,801] Trial 43 finished with value: 0.7104214656845957 and parameters: {'model_type': 'xgb', 'n_estimators': 116, 'max_depth': 4, 'learning_rate': 0.17055390696273118}. Best is trial 34 with value: 0.7708932479776499.
[I 2025-08-20 01:10:50,890] Trial 44 finished with value: 0.7528517571720896 and parameters: {'model_type': 'xgb', 'n_estimators': 98, 'max_depth': 3, 'learning_rate': 0.18665141548474087}. Best is trial 34 with value: 0.7708932479776499.
[I 2025-08-20 01:10:50,981] Trial 45 finished with value: 0.7338329291425096 and parameters: {'model_type': 'xgb', 'n_estimators': 77, 'max_depth': 4, 'learning_rate': 0.11165678936277343}. Best is trial 34 with value: 0.7708932479776499.
[I 2025-08-20 01:10:51,227] Trial 46 finished with value: 0.699742563618424 and parameters: {'model_type': 'xgb', 'n_estimators': 104, 'max_depth': 8, 'learning_rate': 0.19392740242443013}. Best is trial 34 with value: 0.7708932479776499.
[I 2025-08-20 01:10:51,313] Trial 47 finished with value: 0.7457992644561096 and parameters: {'model_type': 'xgb', 'n_estimators': 95, 'max_depth': 3, 'learning_rate': 0.08260846337179335}. Best is trial 34 with value: 0.7708932479776499.
[I 2025-08-20 01:10:51,446] Trial 48 finished with value: 0.7358979589448202 and parameters: {'model_type': 'xgb', 'n_estimators': 126, 'max_depth': 4, 'learning_rate': 0.176304606593895}. Best is trial 34 with value: 0.7708932479776499.
[I 2025-08-20 01:10:51,737] Trial 49 finished with value: 0.7034869664985548 and parameters: {'model_type': 'rf', 'n_estimators': 82, 'max_depth': 12, 'min_samples_split': 2}. Best is trial 34 with value: 0.7708932479776499.
Regression Results:
  Train R²: 0.917
  Test R²: 0.771
  CV R²: 0.370 ± 0.279

=== Generating Visualizations ===
=== Evaluating XGBoost with Parity Plots ===
Model Performance:
  Train R²: 0.917, MAE: 0.191, RMSE: 0.264
  Test R²: 0.771, MAE: 0.324, RMSE: 0.457
Generating parity plots...
Parity plot saved as: plots/parity_plot_xgboost_train_each_8_optuna_train.png
Parity plot saved as: plots/parity_plot_xgboost_test_each_8_optuna_test.png
Parity analysis plot saved as: plots/parity_analysis_xgboost_test_each_8_optuna_analysis.png
HTE prediction evaluation report saved to results/reports/hte_prediction_report_manual_8_each_8_optuna.txt

=== Comparing without reaction-energy features (HTE prediction) ===
=== Building HTE Prediction Models with 8 features ===
Selected features: ['amine_pka_basic', 'amine_BV_secondary_avg', 'acyl_BV_secondary_2', 'acyl_class_aromatic', 'amine_class_1_mixture', 'acyl_pka_aHs_x_has_acidic_H', 'acyl_Charges_secondary_1', 'amine_Charges_secondary_1']
Valid features: 9
=== Building Regression Model ===
Regression dataset: (1031, 9)
Target range: -1.418 to 4.010


Training data: 619 samples
Test data: 206 samples


Train-only SFS selected 8 features for regression
Running hyperparameter optimization for regression...
[I 2025-08-20 01:11:08,187] A new study created in memory with name: no-name-471fd030-c22a-43e0-bd59-fa5d10d9b100
[I 2025-08-20 01:11:09,339] Trial 0 finished with value: 0.7546744404324277 and parameters: {'model_type': 'cat', 'iterations': 231, 'depth': 6, 'learning_rate': 0.092002779424565}. Best is trial 0 with value: 0.7546744404324277.
[I 2025-08-20 01:11:09,343] Trial 1 finished with value: 0.40758427822817966 and parameters: {'model_type': 'bayesian_ridge', 'alpha_1': 0.00042821259597716657, 'alpha_2': 0.0007629798140779768, 'lambda_1': 0.0005905670305679087, 'lambda_2': 0.0007656536995335649}. Best is trial 0 with value: 0.7546744404324277.
[I 2025-08-20 01:11:09,370] Trial 2 finished with value: 0.6594654955235308 and parameters: {'model_type': 'lgbm', 'n_estimators': 88, 'max_depth': 3, 'learning_rate': 0.045316471697102144}. Best is trial 0 with value: 0.7546744404324277.
[I 2025-08-20 01:11:09,574] Trial 3 finished with value: 0.7372468576640495 and parameters: {'model_type': 'rf', 'n_estimators': 91, 'max_depth': 15, 'min_samples_split': 2}. Best is trial 0 with value: 0.7546744404324277.
[I 2025-08-20 01:11:09,753] Trial 4 finished with value: 0.6325598717607546 and parameters: {'model_type': 'rf', 'n_estimators': 154, 'max_depth': 5, 'min_samples_split': 7}. Best is trial 0 with value: 0.7546744404324277.
[I 2025-08-20 01:11:09,871] Trial 5 finished with value: 0.681595998542606 and parameters: {'model_type': 'lgbm', 'n_estimators': 163, 'max_depth': 10, 'learning_rate': 0.015189698900501727}. Best is trial 0 with value: 0.7546744404324277.
[I 2025-08-20 01:11:09,939] Trial 6 finished with value: 0.750057812014578 and parameters: {'model_type': 'lgbm', 'n_estimators': 139, 'max_depth': 7, 'learning_rate': 0.15397606164290478}. Best is trial 0 with value: 0.7546744404324277.
[I 2025-08-20 01:11:10,920] Trial 7 finished with value: 0.6536147760914863 and parameters: {'model_type': 'xgb', 'n_estimators': 111, 'max_depth': 9, 'learning_rate': 0.19870178014564252}. Best is trial 0 with value: 0.7546744404324277.
[I 2025-08-20 01:11:16,315] Trial 8 finished with value: 0.7356412676031607 and parameters: {'model_type': 'cat', 'iterations': 618, 'depth': 6, 'learning_rate': 0.0452009693889844}. Best is trial 0 with value: 0.7546744404324277.
[I 2025-08-20 01:11:17,392] Trial 9 finished with value: 0.6572735373848977 and parameters: {'model_type': 'xgb', 'n_estimators': 115, 'max_depth': 9, 'learning_rate': 0.025505485633792062}. Best is trial 0 with value: 0.7546744404324277.
[I 2025-08-20 01:11:19,810] Trial 10 finished with value: 0.7055677949916777 and parameters: {'model_type': 'cat', 'iterations': 201, 'depth': 9, 'learning_rate': 0.2893339946922182}. Best is trial 0 with value: 0.7546744404324277.
[I 2025-08-20 01:11:19,927] Trial 11 finished with value: 0.7592609580301345 and parameters: {'model_type': 'lgbm', 'n_estimators': 192, 'max_depth': 6, 'learning_rate': 0.12788649782640285}. Best is trial 11 with value: 0.7592609580301345.
[I 2025-08-20 01:11:22,746] Trial 12 finished with value: 0.748113515845465 and parameters: {'model_type': 'cat', 'iterations': 202, 'depth': 4, 'learning_rate': 0.12228407379561182}. Best is trial 11 with value: 0.7592609580301345.
[I 2025-08-20 01:11:22,758] Trial 13 finished with value: 0.4075749369239454 and parameters: {'model_type': 'bayesian_ridge', 'alpha_1': 0.0009508108111526461, 'alpha_2': 2.6936713510984916e-05, 'lambda_1': 5.588691488138804e-05, 'lambda_2': 7.088117037193923e-05}. Best is trial 11 with value: 0.7592609580301345.
[I 2025-08-20 01:11:26,849] Trial 14 finished with value: 0.7468277787387545 and parameters: {'model_type': 'cat', 'iterations': 424, 'depth': 7, 'learning_rate': 0.11163482579515607}. Best is trial 11 with value: 0.7592609580301345.
[I 2025-08-20 01:11:26,945] Trial 15 finished with value: 0.7498405394414487 and parameters: {'model_type': 'lgbm', 'n_estimators': 199, 'max_depth': 5, 'learning_rate': 0.09273229676176231}. Best is trial 11 with value: 0.7592609580301345.
[I 2025-08-20 01:11:26,983] Trial 16 finished with value: 0.7370849909240973 and parameters: {'model_type': 'lgbm', 'n_estimators': 51, 'max_depth': 6, 'learning_rate': 0.20042832416330633}. Best is trial 11 with value: 0.7592609580301345.
[I 2025-08-20 01:11:44,658] Trial 17 finished with value: 0.7296363067261071 and parameters: {'model_type': 'cat', 'iterations': 780, 'depth': 10, 'learning_rate': 0.07739075155408588}. Best is trial 11 with value: 0.7592609580301345.
[I 2025-08-20 01:11:44,958] Trial 18 finished with value: 0.7281604317477153 and parameters: {'model_type': 'rf', 'n_estimators': 199, 'max_depth': 13, 'min_samples_split': 10}. Best is trial 11 with value: 0.7592609580301345.
[I 2025-08-20 01:11:45,351] Trial 19 finished with value: 0.7495790030851459 and parameters: {'model_type': 'xgb', 'n_estimators': 171, 'max_depth': 3, 'learning_rate': 0.17155589462861806}. Best is trial 11 with value: 0.7592609580301345.
[I 2025-08-20 01:11:45,360] Trial 20 finished with value: 0.4075761259837787 and parameters: {'model_type': 'bayesian_ridge', 'alpha_1': 9.828530936278895e-05, 'alpha_2': 0.00023704042380763508, 'lambda_1': 0.0009457208976906284, 'lambda_2': 0.00019513937774987586}. Best is trial 11 with value: 0.7592609580301345.
[I 2025-08-20 01:11:45,456] Trial 21 finished with value: 0.7558653889166357 and parameters: {'model_type': 'lgbm', 'n_estimators': 146, 'max_depth': 7, 'learning_rate': 0.14134370300767776}. Best is trial 11 with value: 0.7592609580301345.
[I 2025-08-20 01:11:45,568] Trial 22 finished with value: 0.7521069566938822 and parameters: {'model_type': 'lgbm', 'n_estimators': 179, 'max_depth': 7, 'learning_rate': 0.15591467849847468}. Best is trial 11 with value: 0.7592609580301345.
[I 2025-08-20 01:11:45,650] Trial 23 finished with value: 0.7564161030076733 and parameters: {'model_type': 'lgbm', 'n_estimators': 141, 'max_depth': 6, 'learning_rate': 0.12030768002399556}. Best is trial 11 with value: 0.7592609580301345.
[I 2025-08-20 01:11:45,731] Trial 24 finished with value: 0.7485867446660854 and parameters: {'model_type': 'lgbm', 'n_estimators': 135, 'max_depth': 6, 'learning_rate': 0.1264860802038326}. Best is trial 11 with value: 0.7592609580301345.
[I 2025-08-20 01:11:45,807] Trial 25 finished with value: 0.7676187441075981 and parameters: {'model_type': 'lgbm', 'n_estimators': 148, 'max_depth': 5, 'learning_rate': 0.22543532156048945}. Best is trial 25 with value: 0.7676187441075981.
[I 2025-08-20 01:11:45,901] Trial 26 finished with value: 0.7545200543626129 and parameters: {'model_type': 'lgbm', 'n_estimators': 184, 'max_depth': 5, 'learning_rate': 0.26065819510168153}. Best is trial 25 with value: 0.7676187441075981.
[I 2025-08-20 01:11:45,954] Trial 27 finished with value: 0.7546969340106091 and parameters: {'model_type': 'lgbm', 'n_estimators': 124, 'max_depth': 4, 'learning_rate': 0.2191949707566706}. Best is trial 25 with value: 0.7676187441075981.
[I 2025-08-20 01:11:46,049] Trial 28 finished with value: 0.7435133754180658 and parameters: {'model_type': 'lgbm', 'n_estimators': 157, 'max_depth': 6, 'learning_rate': 0.25530815045249705}. Best is trial 25 with value: 0.7676187441075981.
[I 2025-08-20 01:11:46,093] Trial 29 finished with value: 0.7691828075386569 and parameters: {'model_type': 'lgbm', 'n_estimators': 97, 'max_depth': 4, 'learning_rate': 0.17857029252922363}. Best is trial 29 with value: 0.7691828075386569.
[I 2025-08-20 01:11:46,137] Trial 30 finished with value: 0.7546369265550767 and parameters: {'model_type': 'lgbm', 'n_estimators': 101, 'max_depth': 4, 'learning_rate': 0.23283354164605571}. Best is trial 29 with value: 0.7691828075386569.
[I 2025-08-20 01:11:46,172] Trial 31 finished with value: 0.7501235324644968 and parameters: {'model_type': 'lgbm', 'n_estimators': 76, 'max_depth': 4, 'learning_rate': 0.17731207598411358}. Best is trial 29 with value: 0.7691828075386569.
[I 2025-08-20 01:11:46,232] Trial 32 finished with value: 0.7589562193880732 and parameters: {'model_type': 'lgbm', 'n_estimators': 119, 'max_depth': 5, 'learning_rate': 0.18558827610692366}. Best is trial 29 with value: 0.7691828075386569.
[I 2025-08-20 01:11:46,293] Trial 33 finished with value: 0.7557397064051747 and parameters: {'model_type': 'lgbm', 'n_estimators': 125, 'max_depth': 5, 'learning_rate': 0.19352115576230713}. Best is trial 29 with value: 0.7691828075386569.
