=== ML Measurable HTE Rate Bias Analysis ===

==================================================
Running HTE Prediction Analysis: each with 8 features
==================================================

=== Loading Data ===
Number of HTE rates: 1031
Found 5 hydrogen-dependent features: ['num_Hs', 'BV_Hs_avg', 'Charges_Hs_avg', 'fukui_E_Hs_avg', 'fukui_N_Hs_avg']
Found 2 pKa-dependent features: ['pka_aHs', 'pka_lowest']
Found 26 heteroatom-dependent features: ['BV_main_1', 'Charges_main_atom', 'fukui_E_main_atom', 'fukui_N_main_atom', 'L_main_atom_1', 'L_main_atom_2', 'B1_main_atom_1', 'B1_main_atom_2', 'B5_main_atom_1', 'B5_main_atom_2', 'Charges_secondary_1', 'Charges_secondary_2', 'fukui_N_secondary_1', 'fukui_N_secondary_2', 'Charges_secondary_avg', 'fukui_N_secondary_avg', 'FCS_1', 'FREQS_1', 'FCS_2', 'FREQS_2', 'FCS_avg', 'FREQS_avg', 'BV_Hs_avg', 'Charges_Hs_avg', 'fukui_E_Hs_avg', 'fukui_N_Hs_avg']

Processing num_Hs conditional features...
  18/46 molecules meet condition num_Hs
    num_Hs: 0 -> 0 NA values
    BV_Hs_avg: 28 -> 0 NA values
    Charges_Hs_avg: 28 -> 0 NA values
    fukui_E_Hs_avg: 28 -> 0 NA values
    fukui_N_Hs_avg: 28 -> 0 NA values

Processing pKa_features conditional features...
  18/46 molecules meet condition pKa_features
    Processing pKa feature pka_aHs with special handling...
      Created indicator: has_acidic_H_for_pka_aHs
      Created interaction: pka_aHs_x_has_acidic_H
      Used 50.0 for molecules without acidic H
    pka_aHs: 28 -> 0 NA values
    Processing pKa feature pka_lowest with special handling...
      Created indicator: has_acidic_H_for_pka_lowest
      Created interaction: pka_lowest_x_has_acidic_H
      Used 50.0 for molecules without acidic H
    pka_lowest: 38 -> 0 NA values

Handling remaining NA values...

Encoding categorical features...
  Removed identifier feature: name
  Found categorical feature class with 4 unique values: ['aromatic' 'hetero' 'aliphatic' 'mixture']
    One-hot encoded class -> 4 features: ['class_aliphatic', 'class_aromatic', 'class_hetero', 'class_mixture']
  Removed identifier feature: smiles
  Processed 1 categorical features
  Removed 2 identifier features: ['name', 'smiles']

Creating feature quality indicators...
  Added indicator: has_num_Hs
  Added indicator: has_pKa_features
Preprocessing complete. Shape: (46, 65)
Remaining NA values: 0
Found 1 pKa-dependent features: ['pka_basic']
Warning: num_Hs column not found, cannot properly handle pKa features
Found 15 heteroatom-dependent features: ['BV_main_1', 'Charges_main_atom', 'fukui_E_main_atom', 'fukui_N_main_atom', 'L_main_atom_1', 'B1_main_atom_1', 'B5_main_atom_1', 'Charges_secondary_1', 'fukui_N_secondary_1', 'Charges_secondary_avg', 'fukui_N_secondary_avg', 'FCS_1', 'FREQS_1', 'FCS_avg', 'FREQS_avg']

Handling remaining NA values...
  pka_basic: Filled 1 NA values with median/zero
  smiles: Filled 1 NA values with mode/unknown
  class: Filled 1 NA values with mode/unknown

Encoding categorical features...
  Removed identifier feature: name
  Removed identifier feature: smiles
  Found categorical feature class with 5 unique values: ['1_aliphatic' '1_aromatic' '2_aliphatic' '1_mixture' '2_mixture']
    One-hot encoded class -> 5 features: ['class_1_aliphatic', 'class_1_aromatic', 'class_1_mixture', 'class_2_aliphatic', 'class_2_mixture']
  Processed 1 categorical features
  Removed 2 identifier features: ['name', 'smiles']

Creating feature quality indicators...
Preprocessing complete. Shape: (55, 40)
Remaining NA values: 0
Loaded reaction energy features: 1488 rows, 8 features

=== Selecting Features (selected) ===
Final selected features (8): ['acyl_class_aromatic', 'acyl_Charges_secondary_1', 'acyl_BV_secondary_2', 'acyl_pka_aHs_x_has_acidic_H', 'amine_Charges_secondary_1', 'amine_class_1_mixture', 'amine_pka_basic', 'amine_BV_secondary_avg']
=== Building HTE Prediction Models with 8 features ===
Selected features: ['acyl_class_aromatic', 'acyl_Charges_secondary_1', 'acyl_BV_secondary_2', 'acyl_pka_aHs_x_has_acidic_H', 'amine_Charges_secondary_1', 'amine_class_1_mixture', 'amine_pka_basic', 'amine_BV_secondary_avg']
Valid features: 17
=== Building Regression Model ===
Regression dataset: (1031, 17)
Target range: -1.418 to 4.010


Training data: 619 samples
Test data: 206 samples


/home/passos/mambaforge/envs/hte-ml/lib/python3.10/multiprocessing/queues.py:122: UserWarning: pkg_resources is deprecated as an API. See https://setuptools.pypa.io/en/latest/pkg_resources.html. The pkg_resources package is slated for removal as early as 2025-11-30. Refrain from using this package or pin to Setuptools<81.
  return _ForkingPickler.loads(res)
/home/passos/mambaforge/envs/hte-ml/lib/python3.10/multiprocessing/queues.py:122: UserWarning: pkg_resources is deprecated as an API. See https://setuptools.pypa.io/en/latest/pkg_resources.html. The pkg_resources package is slated for removal as early as 2025-11-30. Refrain from using this package or pin to Setuptools<81.
  return _ForkingPickler.loads(res)
/home/passos/mambaforge/envs/hte-ml/lib/python3.10/multiprocessing/queues.py:122: UserWarning: pkg_resources is deprecated as an API. See https://setuptools.pypa.io/en/latest/pkg_resources.html. The pkg_resources package is slated for removal as early as 2025-11-30. Refrain from using this package or pin to Setuptools<81.
  return _ForkingPickler.loads(res)
/home/passos/mambaforge/envs/hte-ml/lib/python3.10/multiprocessing/queues.py:122: UserWarning: pkg_resources is deprecated as an API. See https://setuptools.pypa.io/en/latest/pkg_resources.html. The pkg_resources package is slated for removal as early as 2025-11-30. Refrain from using this package or pin to Setuptools<81.
  return _ForkingPickler.loads(res)
/home/passos/mambaforge/envs/hte-ml/lib/python3.10/multiprocessing/queues.py:122: UserWarning: pkg_resources is deprecated as an API. See https://setuptools.pypa.io/en/latest/pkg_resources.html. The pkg_resources package is slated for removal as early as 2025-11-30. Refrain from using this package or pin to Setuptools<81.
  return _ForkingPickler.loads(res)
/home/passos/mambaforge/envs/hte-ml/lib/python3.10/multiprocessing/queues.py:122: UserWarning: pkg_resources is deprecated as an API. See https://setuptools.pypa.io/en/latest/pkg_resources.html. The pkg_resources package is slated for removal as early as 2025-11-30. Refrain from using this package or pin to Setuptools<81.
  return _ForkingPickler.loads(res)
/home/passos/mambaforge/envs/hte-ml/lib/python3.10/multiprocessing/queues.py:122: UserWarning: pkg_resources is deprecated as an API. See https://setuptools.pypa.io/en/latest/pkg_resources.html. The pkg_resources package is slated for removal as early as 2025-11-30. Refrain from using this package or pin to Setuptools<81.
  return _ForkingPickler.loads(res)
/home/passos/mambaforge/envs/hte-ml/lib/python3.10/multiprocessing/queues.py:122: UserWarning: pkg_resources is deprecated as an API. See https://setuptools.pypa.io/en/latest/pkg_resources.html. The pkg_resources package is slated for removal as early as 2025-11-30. Refrain from using this package or pin to Setuptools<81.
  return _ForkingPickler.loads(res)
/home/passos/mambaforge/envs/hte-ml/lib/python3.10/multiprocessing/queues.py:122: UserWarning: pkg_resources is deprecated as an API. See https://setuptools.pypa.io/en/latest/pkg_resources.html. The pkg_resources package is slated for removal as early as 2025-11-30. Refrain from using this package or pin to Setuptools<81.
  return _ForkingPickler.loads(res)
/home/passos/mambaforge/envs/hte-ml/lib/python3.10/multiprocessing/queues.py:122: UserWarning: pkg_resources is deprecated as an API. See https://setuptools.pypa.io/en/latest/pkg_resources.html. The pkg_resources package is slated for removal as early as 2025-11-30. Refrain from using this package or pin to Setuptools<81.
  return _ForkingPickler.loads(res)
/home/passos/mambaforge/envs/hte-ml/lib/python3.10/multiprocessing/queues.py:122: UserWarning: pkg_resources is deprecated as an API. See https://setuptools.pypa.io/en/latest/pkg_resources.html. The pkg_resources package is slated for removal as early as 2025-11-30. Refrain from using this package or pin to Setuptools<81.
  return _ForkingPickler.loads(res)
/home/passos/mambaforge/envs/hte-ml/lib/python3.10/multiprocessing/queues.py:122: UserWarning: pkg_resources is deprecated as an API. See https://setuptools.pypa.io/en/latest/pkg_resources.html. The pkg_resources package is slated for removal as early as 2025-11-30. Refrain from using this package or pin to Setuptools<81.
  return _ForkingPickler.loads(res)
/home/passos/mambaforge/envs/hte-ml/lib/python3.10/multiprocessing/queues.py:122: UserWarning: pkg_resources is deprecated as an API. See https://setuptools.pypa.io/en/latest/pkg_resources.html. The pkg_resources package is slated for removal as early as 2025-11-30. Refrain from using this package or pin to Setuptools<81.
  return _ForkingPickler.loads(res)
/home/passos/mambaforge/envs/hte-ml/lib/python3.10/multiprocessing/queues.py:122: UserWarning: pkg_resources is deprecated as an API. See https://setuptools.pypa.io/en/latest/pkg_resources.html. The pkg_resources package is slated for removal as early as 2025-11-30. Refrain from using this package or pin to Setuptools<81.
  return _ForkingPickler.loads(res)
/home/passos/mambaforge/envs/hte-ml/lib/python3.10/multiprocessing/queues.py:122: UserWarning: pkg_resources is deprecated as an API. See https://setuptools.pypa.io/en/latest/pkg_resources.html. The pkg_resources package is slated for removal as early as 2025-11-30. Refrain from using this package or pin to Setuptools<81.
  return _ForkingPickler.loads(res)
/home/passos/mambaforge/envs/hte-ml/lib/python3.10/multiprocessing/queues.py:122: UserWarning: pkg_resources is deprecated as an API. See https://setuptools.pypa.io/en/latest/pkg_resources.html. The pkg_resources package is slated for removal as early as 2025-11-30. Refrain from using this package or pin to Setuptools<81.
  return _ForkingPickler.loads(res)
/home/passos/mambaforge/envs/hte-ml/lib/python3.10/multiprocessing/queues.py:122: UserWarning: pkg_resources is deprecated as an API. See https://setuptools.pypa.io/en/latest/pkg_resources.html. The pkg_resources package is slated for removal as early as 2025-11-30. Refrain from using this package or pin to Setuptools<81.
  return _ForkingPickler.loads(res)
/home/passos/mambaforge/envs/hte-ml/lib/python3.10/multiprocessing/queues.py:122: UserWarning: pkg_resources is deprecated as an API. See https://setuptools.pypa.io/en/latest/pkg_resources.html. The pkg_resources package is slated for removal as early as 2025-11-30. Refrain from using this package or pin to Setuptools<81.
  return _ForkingPickler.loads(res)
/home/passos/mambaforge/envs/hte-ml/lib/python3.10/multiprocessing/queues.py:122: UserWarning: pkg_resources is deprecated as an API. See https://setuptools.pypa.io/en/latest/pkg_resources.html. The pkg_resources package is slated for removal as early as 2025-11-30. Refrain from using this package or pin to Setuptools<81.
  return _ForkingPickler.loads(res)
/home/passos/mambaforge/envs/hte-ml/lib/python3.10/multiprocessing/queues.py:122: UserWarning: pkg_resources is deprecated as an API. See https://setuptools.pypa.io/en/latest/pkg_resources.html. The pkg_resources package is slated for removal as early as 2025-11-30. Refrain from using this package or pin to Setuptools<81.
  return _ForkingPickler.loads(res)
/home/passos/mambaforge/envs/hte-ml/lib/python3.10/multiprocessing/queues.py:122: UserWarning: pkg_resources is deprecated as an API. See https://setuptools.pypa.io/en/latest/pkg_resources.html. The pkg_resources package is slated for removal as early as 2025-11-30. Refrain from using this package or pin to Setuptools<81.
  return _ForkingPickler.loads(res)
/home/passos/mambaforge/envs/hte-ml/lib/python3.10/multiprocessing/queues.py:122: UserWarning: pkg_resources is deprecated as an API. See https://setuptools.pypa.io/en/latest/pkg_resources.html. The pkg_resources package is slated for removal as early as 2025-11-30. Refrain from using this package or pin to Setuptools<81.
  return _ForkingPickler.loads(res)
/home/passos/mambaforge/envs/hte-ml/lib/python3.10/multiprocessing/queues.py:122: UserWarning: pkg_resources is deprecated as an API. See https://setuptools.pypa.io/en/latest/pkg_resources.html. The pkg_resources package is slated for removal as early as 2025-11-30. Refrain from using this package or pin to Setuptools<81.
  return _ForkingPickler.loads(res)
/home/passos/mambaforge/envs/hte-ml/lib/python3.10/multiprocessing/queues.py:122: UserWarning: pkg_resources is deprecated as an API. See https://setuptools.pypa.io/en/latest/pkg_resources.html. The pkg_resources package is slated for removal as early as 2025-11-30. Refrain from using this package or pin to Setuptools<81.
  return _ForkingPickler.loads(res)
/home/passos/mambaforge/envs/hte-ml/lib/python3.10/multiprocessing/queues.py:122: UserWarning: pkg_resources is deprecated as an API. See https://setuptools.pypa.io/en/latest/pkg_resources.html. The pkg_resources package is slated for removal as early as 2025-11-30. Refrain from using this package or pin to Setuptools<81.
  return _ForkingPickler.loads(res)
/home/passos/mambaforge/envs/hte-ml/lib/python3.10/multiprocessing/queues.py:122: UserWarning: pkg_resources is deprecated as an API. See https://setuptools.pypa.io/en/latest/pkg_resources.html. The pkg_resources package is slated for removal as early as 2025-11-30. Refrain from using this package or pin to Setuptools<81.
  return _ForkingPickler.loads(res)
/home/passos/mambaforge/envs/hte-ml/lib/python3.10/multiprocessing/queues.py:122: UserWarning: pkg_resources is deprecated as an API. See https://setuptools.pypa.io/en/latest/pkg_resources.html. The pkg_resources package is slated for removal as early as 2025-11-30. Refrain from using this package or pin to Setuptools<81.
  return _ForkingPickler.loads(res)
/home/passos/mambaforge/envs/hte-ml/lib/python3.10/multiprocessing/queues.py:122: UserWarning: pkg_resources is deprecated as an API. See https://setuptools.pypa.io/en/latest/pkg_resources.html. The pkg_resources package is slated for removal as early as 2025-11-30. Refrain from using this package or pin to Setuptools<81.
  return _ForkingPickler.loads(res)
/home/passos/mambaforge/envs/hte-ml/lib/python3.10/multiprocessing/queues.py:122: UserWarning: pkg_resources is deprecated as an API. See https://setuptools.pypa.io/en/latest/pkg_resources.html. The pkg_resources package is slated for removal as early as 2025-11-30. Refrain from using this package or pin to Setuptools<81.
  return _ForkingPickler.loads(res)
/home/passos/mambaforge/envs/hte-ml/lib/python3.10/multiprocessing/queues.py:122: UserWarning: pkg_resources is deprecated as an API. See https://setuptools.pypa.io/en/latest/pkg_resources.html. The pkg_resources package is slated for removal as early as 2025-11-30. Refrain from using this package or pin to Setuptools<81.
  return _ForkingPickler.loads(res)
/home/passos/mambaforge/envs/hte-ml/lib/python3.10/multiprocessing/queues.py:122: UserWarning: pkg_resources is deprecated as an API. See https://setuptools.pypa.io/en/latest/pkg_resources.html. The pkg_resources package is slated for removal as early as 2025-11-30. Refrain from using this package or pin to Setuptools<81.
  return _ForkingPickler.loads(res)
/home/passos/mambaforge/envs/hte-ml/lib/python3.10/multiprocessing/queues.py:122: UserWarning: pkg_resources is deprecated as an API. See https://setuptools.pypa.io/en/latest/pkg_resources.html. The pkg_resources package is slated for removal as early as 2025-11-30. Refrain from using this package or pin to Setuptools<81.
  return _ForkingPickler.loads(res)
/home/passos/mambaforge/envs/hte-ml/lib/python3.10/multiprocessing/queues.py:122: UserWarning: pkg_resources is deprecated as an API. See https://setuptools.pypa.io/en/latest/pkg_resources.html. The pkg_resources package is slated for removal as early as 2025-11-30. Refrain from using this package or pin to Setuptools<81.
  return _ForkingPickler.loads(res)
/home/passos/mambaforge/envs/hte-ml/lib/python3.10/multiprocessing/queues.py:122: UserWarning: pkg_resources is deprecated as an API. See https://setuptools.pypa.io/en/latest/pkg_resources.html. The pkg_resources package is slated for removal as early as 2025-11-30. Refrain from using this package or pin to Setuptools<81.
  return _ForkingPickler.loads(res)
/home/passos/mambaforge/envs/hte-ml/lib/python3.10/multiprocessing/queues.py:122: UserWarning: pkg_resources is deprecated as an API. See https://setuptools.pypa.io/en/latest/pkg_resources.html. The pkg_resources package is slated for removal as early as 2025-11-30. Refrain from using this package or pin to Setuptools<81.
  return _ForkingPickler.loads(res)
/home/passos/mambaforge/envs/hte-ml/lib/python3.10/multiprocessing/queues.py:122: UserWarning: pkg_resources is deprecated as an API. See https://setuptools.pypa.io/en/latest/pkg_resources.html. The pkg_resources package is slated for removal as early as 2025-11-30. Refrain from using this package or pin to Setuptools<81.
  return _ForkingPickler.loads(res)
/home/passos/mambaforge/envs/hte-ml/lib/python3.10/multiprocessing/queues.py:122: UserWarning: pkg_resources is deprecated as an API. See https://setuptools.pypa.io/en/latest/pkg_resources.html. The pkg_resources package is slated for removal as early as 2025-11-30. Refrain from using this package or pin to Setuptools<81.
  return _ForkingPickler.loads(res)
/home/passos/mambaforge/envs/hte-ml/lib/python3.10/multiprocessing/queues.py:122: UserWarning: pkg_resources is deprecated as an API. See https://setuptools.pypa.io/en/latest/pkg_resources.html. The pkg_resources package is slated for removal as early as 2025-11-30. Refrain from using this package or pin to Setuptools<81.
  return _ForkingPickler.loads(res)
/home/passos/mambaforge/envs/hte-ml/lib/python3.10/multiprocessing/queues.py:122: UserWarning: pkg_resources is deprecated as an API. See https://setuptools.pypa.io/en/latest/pkg_resources.html. The pkg_resources package is slated for removal as early as 2025-11-30. Refrain from using this package or pin to Setuptools<81.
  return _ForkingPickler.loads(res)
/home/passos/mambaforge/envs/hte-ml/lib/python3.10/multiprocessing/queues.py:122: UserWarning: pkg_resources is deprecated as an API. See https://setuptools.pypa.io/en/latest/pkg_resources.html. The pkg_resources package is slated for removal as early as 2025-11-30. Refrain from using this package or pin to Setuptools<81.
  return _ForkingPickler.loads(res)
/home/passos/mambaforge/envs/hte-ml/lib/python3.10/multiprocessing/queues.py:122: UserWarning: pkg_resources is deprecated as an API. See https://setuptools.pypa.io/en/latest/pkg_resources.html. The pkg_resources package is slated for removal as early as 2025-11-30. Refrain from using this package or pin to Setuptools<81.
  return _ForkingPickler.loads(res)
/home/passos/mambaforge/envs/hte-ml/lib/python3.10/multiprocessing/queues.py:122: UserWarning: pkg_resources is deprecated as an API. See https://setuptools.pypa.io/en/latest/pkg_resources.html. The pkg_resources package is slated for removal as early as 2025-11-30. Refrain from using this package or pin to Setuptools<81.
  return _ForkingPickler.loads(res)
/home/passos/mambaforge/envs/hte-ml/lib/python3.10/multiprocessing/queues.py:122: UserWarning: pkg_resources is deprecated as an API. See https://setuptools.pypa.io/en/latest/pkg_resources.html. The pkg_resources package is slated for removal as early as 2025-11-30. Refrain from using this package or pin to Setuptools<81.
  return _ForkingPickler.loads(res)
/home/passos/mambaforge/envs/hte-ml/lib/python3.10/multiprocessing/queues.py:122: UserWarning: pkg_resources is deprecated as an API. See https://setuptools.pypa.io/en/latest/pkg_resources.html. The pkg_resources package is slated for removal as early as 2025-11-30. Refrain from using this package or pin to Setuptools<81.
  return _ForkingPickler.loads(res)
/home/passos/mambaforge/envs/hte-ml/lib/python3.10/multiprocessing/queues.py:122: UserWarning: pkg_resources is deprecated as an API. See https://setuptools.pypa.io/en/latest/pkg_resources.html. The pkg_resources package is slated for removal as early as 2025-11-30. Refrain from using this package or pin to Setuptools<81.
  return _ForkingPickler.loads(res)
/home/passos/mambaforge/envs/hte-ml/lib/python3.10/multiprocessing/queues.py:122: UserWarning: pkg_resources is deprecated as an API. See https://setuptools.pypa.io/en/latest/pkg_resources.html. The pkg_resources package is slated for removal as early as 2025-11-30. Refrain from using this package or pin to Setuptools<81.
  return _ForkingPickler.loads(res)
/home/passos/mambaforge/envs/hte-ml/lib/python3.10/multiprocessing/queues.py:122: UserWarning: pkg_resources is deprecated as an API. See https://setuptools.pypa.io/en/latest/pkg_resources.html. The pkg_resources package is slated for removal as early as 2025-11-30. Refrain from using this package or pin to Setuptools<81.
  return _ForkingPickler.loads(res)
/home/passos/mambaforge/envs/hte-ml/lib/python3.10/multiprocessing/queues.py:122: UserWarning: pkg_resources is deprecated as an API. See https://setuptools.pypa.io/en/latest/pkg_resources.html. The pkg_resources package is slated for removal as early as 2025-11-30. Refrain from using this package or pin to Setuptools<81.
  return _ForkingPickler.loads(res)
/home/passos/mambaforge/envs/hte-ml/lib/python3.10/multiprocessing/queues.py:122: UserWarning: pkg_resources is deprecated as an API. See https://setuptools.pypa.io/en/latest/pkg_resources.html. The pkg_resources package is slated for removal as early as 2025-11-30. Refrain from using this package or pin to Setuptools<81.
  return _ForkingPickler.loads(res)
/home/passos/mambaforge/envs/hte-ml/lib/python3.10/mult