[I 2025-08-20 01:25:13,646] Trial 0 finished with value: 0.7017486485223287 and parameters: {'model_type': 'rf', 'n_estimators': 143, 'max_depth': 6, 'min_samples_split': 8}. Best is trial 0 with value: 0.7017486485223287.
[I 2025-08-20 01:25:13,869] Trial 1 finished with value: 0.7618058049752112 and parameters: {'model_type': 'rf', 'n_estimators': 139, 'max_depth': 15, 'min_samples_split': 5}. Best is trial 1 with value: 0.7618058049752112.
[I 2025-08-20 01:25:13,872] Trial 2 finished with value: 0.421656430195695 and parameters: {'model_type': 'bayesian_ridge', 'alpha_1': 1.081377617019032e-05, 'alpha_2': 0.0007590844544560273, 'lambda_1': 0.0006021734364257048, 'lambda_2': 0.0007639130056767872}. Best is trial 1 with value: 0.7618058049752112.
[I 2025-08-20 01:25:14,113] Trial 3 finished with value: 0.7393698929424322 and parameters: {'model_type': 'xgb', 'n_estimators': 191, 'max_depth': 5, 'learning_rate': 0.2431607897011088}. Best is trial 1 with value: 0.7618058049752112.
[I 2025-08-20 01:25:14,115] Trial 4 finished with value: 0.42165220387071634 and parameters: {'model_type': 'bayesian_ridge', 'alpha_1': 0.000659596682747407, 'alpha_2': 0.0007034552717761151, 'lambda_1': 0.000814313048523085, 'lambda_2': 8.199423575508059e-05}. Best is trial 1 with value: 0.7618058049752112.
[I 2025-08-20 01:25:14,228] Trial 5 finished with value: 0.7890014886377077 and parameters: {'model_type': 'lgbm', 'n_estimators': 155, 'max_depth': 8, 'learning_rate': 0.034416850417451954}. Best is trial 5 with value: 0.7890014886377077.
[I 2025-08-20 01:25:14,255] Trial 6 finished with value: 0.7812535569073535 and parameters: {'model_type': 'lgbm', 'n_estimators': 107, 'max_depth': 3, 'learning_rate': 0.170396141667675}. Best is trial 5 with value: 0.7890014886377077.
[I 2025-08-20 01:25:14,546] Trial 7 finished with value: 0.7502859285997672 and parameters: {'model_type': 'rf', 'n_estimators': 169, 'max_depth': 8, 'min_samples_split': 5}. Best is trial 5 with value: 0.7890014886377077.
[I 2025-08-20 01:25:14,835] Trial 8 finished with value: 0.7651567996161972 and parameters: {'model_type': 'rf', 'n_estimators': 177, 'max_depth': 11, 'min_samples_split': 4}. Best is trial 5 with value: 0.7890014886377077.
[I 2025-08-20 01:25:14,837] Trial 9 finished with value: 0.42165668680368273 and parameters: {'model_type': 'bayesian_ridge', 'alpha_1': 0.00045713794676576256, 'alpha_2': 0.0009960242530716384, 'lambda_1': 0.00029924413397182327, 'lambda_2': 0.0007901024364484481}. Best is trial 5 with value: 0.7890014886377077.
[I 2025-08-20 01:25:14,900] Trial 10 finished with value: 0.6691155176361632 and parameters: {'model_type': 'lgbm', 'n_estimators': 52, 'max_depth': 8, 'learning_rate': 0.029664284856724007}. Best is trial 5 with value: 0.7890014886377077.
[I 2025-08-20 01:25:14,934] Trial 11 finished with value: 0.7760692614612746 and parameters: {'model_type': 'lgbm', 'n_estimators': 86, 'max_depth': 3, 'learning_rate': 0.12499095137038344}. Best is trial 5 with value: 0.7890014886377077.
[I 2025-08-20 01:25:14,971] Trial 12 finished with value: 0.7868451322075442 and parameters: {'model_type': 'lgbm', 'n_estimators': 104, 'max_depth': 3, 'learning_rate': 0.15658003103841475}. Best is trial 5 with value: 0.7890014886377077.
[I 2025-08-20 01:25:36,731] Trial 13 finished with value: 0.7751467527766692 and parameters: {'model_type': 'cat', 'iterations': 516, 'depth': 7, 'learning_rate': 0.028632298176403365}. Best is trial 5 with value: 0.7890014886377077.
[I 2025-08-20 01:25:36,821] Trial 14 finished with value: 0.7688986286741547 and parameters: {'model_type': 'lgbm', 'n_estimators': 105, 'max_depth': 8, 'learning_rate': 0.12966516284386842}. Best is trial 5 with value: 0.7890014886377077.
[I 2025-08-20 01:25:36,885] Trial 15 finished with value: 0.7561835594883058 and parameters: {'model_type': 'lgbm', 'n_estimators': 150, 'max_depth': 5, 'learning_rate': 0.1951796238823306}. Best is trial 5 with value: 0.7890014886377077.
[I 2025-08-20 01:25:38,964] Trial 16 finished with value: 0.7406065555742759 and parameters: {'model_type': 'xgb', 'n_estimators': 73, 'max_depth': 9, 'learning_rate': 0.07794762111768079}. Best is trial 5 with value: 0.7890014886377077.
[I 2025-08-20 01:25:45,054] Trial 17 finished with value: 0.7717264625786324 and parameters: {'model_type': 'cat', 'iterations': 202, 'depth': 10, 'learning_rate': 0.2987841720111437}. Best is trial 5 with value: 0.7890014886377077.
[I 2025-08-20 01:25:45,104] Trial 18 finished with value: 0.7869618229385371 and parameters: {'model_type': 'lgbm', 'n_estimators': 118, 'max_depth': 4, 'learning_rate': 0.09411602989528597}. Best is trial 5 with value: 0.7890014886377077.
[I 2025-08-20 01:25:45,158] Trial 19 finished with value: 0.7888803834080446 and parameters: {'model_type': 'lgbm', 'n_estimators': 123, 'max_depth': 5, 'learning_rate': 0.07524196260003713}. Best is trial 5 with value: 0.7890014886377077.
[I 2025-08-20 01:25:45,260] Trial 20 finished with value: 0.771029812975015 and parameters: {'model_type': 'lgbm', 'n_estimators': 161, 'max_depth': 6, 'learning_rate': 0.07251899081898694}. Best is trial 5 with value: 0.7890014886377077.
[I 2025-08-20 01:25:45,316] Trial 21 finished with value: 0.7922123928721487 and parameters: {'model_type': 'lgbm', 'n_estimators': 120, 'max_depth': 4, 'learning_rate': 0.07756223011662801}. Best is trial 21 with value: 0.7922123928721487.
[I 2025-08-20 01:25:45,402] Trial 22 finished with value: 0.7146137766278835 and parameters: {'model_type': 'lgbm', 'n_estimators': 126, 'max_depth': 5, 'learning_rate': 0.016657331443816252}. Best is trial 21 with value: 0.7922123928721487.
[I 2025-08-20 01:25:45,456] Trial 23 finished with value: 0.7860354285044324 and parameters: {'model_type': 'lgbm', 'n_estimators': 129, 'max_depth': 4, 'learning_rate': 0.06910603265953309}. Best is trial 21 with value: 0.7922123928721487.
[I 2025-08-20 01:25:45,538] Trial 24 finished with value: 0.7823389844820025 and parameters: {'model_type': 'lgbm', 'n_estimators': 154, 'max_depth': 7, 'learning_rate': 0.049152202588066615}. Best is trial 21 with value: 0.7922123928721487.
[I 2025-08-20 01:26:03,007] Trial 25 finished with value: 0.7824820756294423 and parameters: {'model_type': 'cat', 'iterations': 739, 'depth': 4, 'learning_rate': 0.11772162312239072}. Best is trial 21 with value: 0.7922123928721487.
[I 2025-08-20 01:26:03,976] Trial 26 finished with value: 0.7738469994950435 and parameters: {'model_type': 'xgb', 'n_estimators': 129, 'max_depth': 4, 'learning_rate': 0.0988599948258646}. Best is trial 21 with value: 0.7922123928721487.
[I 2025-08-20 01:26:04,045] Trial 27 finished with value: 0.7839452188678281 and parameters: {'model_type': 'lgbm', 'n_estimators': 87, 'max_depth': 7, 'learning_rate': 0.04562153735326994}. Best is trial 21 with value: 0.7922123928721487.
[I 2025-08-20 01:26:04,142] Trial 28 finished with value: 0.7772222571419052 and parameters: {'model_type': 'lgbm', 'n_estimators': 183, 'max_depth': 9, 'learning_rate': 0.053899104145362725}. Best is trial 21 with value: 0.7922123928721487.
[I 2025-08-20 01:26:04,224] Trial 29 finished with value: 0.7687394269698482 and parameters: {'model_type': 'lgbm', 'n_estimators': 199, 'max_depth': 6, 'learning_rate': 0.09419781651860115}. Best is trial 21 with value: 0.7922123928721487.
[I 2025-08-20 01:26:05,789] Trial 30 finished with value: 0.7886626811254429 and parameters: {'model_type': 'cat', 'iterations': 227, 'depth': 4, 'learning_rate': 0.1511210653772762}. Best is trial 21 with value: 0.7922123928721487.
[I 2025-08-20 01:26:10,259] Trial 31 finished with value: 0.7837074977015693 and parameters: {'model_type': 'cat', 'iterations': 217, 'depth': 4, 'learning_rate': 0.2206449638630914}. Best is trial 21 with value: 0.7922123928721487.
Warning: less than 75% GPU memory available for training. Free: 4007.4375 Total: 81155.75
[I 2025-08-20 01:26:17,430] Trial 32 finished with value: 0.7854438031807378 and parameters: {'model_type': 'cat', 'iterations': 436, 'depth': 6, 'learning_rate': 0.15566586336414734}. Best is trial 21 with value: 0.7922123928721487.
[I 2025-08-20 01:26:24,296] Trial 33 finished with value: 0.777806283158188 and parameters: {'model_type': 'cat', 'iterations': 402, 'depth': 10, 'learning_rate': 0.05947000927970805}. Best is trial 21 with value: 0.7922123928721487.
[I 2025-08-20 01:26:24,315] Trial 34 finished with value: 0.4216521222288191 and parameters: {'model_type': 'bayesian_ridge', 'alpha_1': 0.0009400279980448091, 'alpha_2': 2.5170976241946797e-05, 'lambda_1': 1.5475093830956443e-05, 'lambda_2': 2.5520913583700674e-05}. Best is trial 21 with value: 0.7922123928721487.
[I 2025-08-20 01:26:24,533] Trial 35 finished with value: 0.7528876332807632 and parameters: {'model_type': 'rf', 'n_estimators': 116, 'max_depth': 11, 'min_samples_split': 10}. Best is trial 21 with value: 0.7922123928721487.
[I 2025-08-20 01:26:26,467] Trial 36 finished with value: 0.7640581007837145 and parameters: {'model_type': 'xgb', 'n_estimators': 142, 'max_depth': 5, 'learning_rate': 0.11170724698550508}. Best is trial 21 with value: 0.7922123928721487.
[I 2025-08-20 01:26:47,990] Trial 37 finished with value: 0.7922735961387322 and parameters: {'model_type': 'cat', 'iterations': 649, 'depth': 6, 'learning_rate': 0.1434302374150642}. Best is trial 37 with value: 0.7922735961387322.
[I 2025-08-20 01:26:48,009] Trial 38 finished with value: 0.4216541824011708 and parameters: {'model_type': 'bayesian_ridge', 'alpha_1': 5.9142634696016105e-05, 'alpha_2': 9.519152897470969e-05, 'lambda_1': 0.0008764996037753298, 'lambda_2': 0.0004084381970162045}. Best is trial 37 with value: 0.7922735961387322.
[I 2025-08-20 01:26:48,348] Trial 39 finished with value: 0.7676638186845948 and parameters: {'model_type': 'rf', 'n_estimators': 164, 'max_depth': 11, 'min_samples_split': 2}. Best is trial 37 with value: 0.7922735961387322.
[I 2025-08-20 01:26:48,404] Trial 40 finished with value: 0.541178220156308 and parameters: {'model_type': 'lgbm', 'n_estimators': 98, 'max_depth': 4, 'learning_rate': 0.011540350537504795}. Best is trial 37 with value: 0.7922735961387322.
[I 2025-08-20 01:27:09,313] Trial 41 finished with value: 0.7688350706937257 and parameters: {'model_type': 'cat', 'iterations': 675, 'depth': 6, 'learning_rate': 0.18678385649471896}. Best is trial 37 with value: 0.7922735961387322.
[I 2025-08-20 01:27:18,812] Trial 42 finished with value: 0.791894291460451 and parameters: {'model_type': 'cat', 'iterations': 601, 'depth': 5, 'learning_rate': 0.13744582947193754}. Best is trial 37 with value: 0.7922735961387322.
[I 2025-08-20 01:27:30,500] Trial 43 finished with value: 0.7780593778584799 and parameters: {'model_type': 'cat', 'iterations': 625, 'depth': 6, 'learning_rate': 0.14396330651273948}. Best is trial 37 with value: 0.7922735961387322.
[I 2025-08-20 01:27:39,046] Trial 44 finished with value: 0.7876722416938702 and parameters: {'model_type': 'cat', 'iterations': 573, 'depth': 8, 'learning_rate': 0.08036700018568084}. Best is trial 37 with value: 0.7922735961387322.
[I 2025-08-20 01:27:49,056] Trial 45 finished with value: 0.7910600109692273 and parameters: {'model_type': 'cat', 'iterations': 771, 'depth': 5, 'learning_rate': 0.17893830558838275}. Best is trial 37 with value: 0.7922735961387322.
[I 2025-08-20 01:27:56,158] Trial 46 finished with value: 0.7819804757033243 and parameters: {'model_type': 'cat', 'iterations': 762, 'depth': 5, 'learning_rate': 0.17567736898471067}. Best is trial 37 with value: 0.7922735961387322.
[I 2025-08-20 01:28:03,719] Trial 47 finished with value: 0.778309665767797 and parameters: {'model_type': 'cat', 'iterations': 797, 'depth': 5, 'learning_rate': 0.20229385452355064}. Best is trial 37 with value: 0.7922735961387322.
[I 2025-08-20 01:28:11,294] Trial 48 finished with value: 0.785656723947841 and parameters: {'model_type': 'cat', 'iterations': 686, 'depth': 5, 'learning_rate': 0.13578564292736495}. Best is trial 37 with value: 0.7922735961387322.
[I 2025-08-20 01:28:11,314] Trial 49 finished with value: 0.42165794331984296 and parameters: {'model_type': 'bayesian_ridge', 'alpha_1': 0.00032547576966468933, 'alpha_2': 0.00036687031788897815, 'lambda_1': 0.00035920378872683287, 'lambda_2': 0.0009999559543077225}. Best is trial 37 with value: 0.7922735961387322.
Regression Results:
  Train R²: 0.937
  Test R²: 0.792
  CV R²: 0.499 ± 0.212
Saved comparison to results/rxn_feature_comparison_hte_each_8_optuna.json

==================================================
ANALYSIS COMPLETE
==================================================
Check the following directories for outputs:
  - plots/: Visualization files
  - results/: Data files and reports
  - models/: Trained model files
