[I 2025-08-20 01:22:58,134] Trial 49 finished with value: 0.7693155488565783 and parameters: {'model_type': 'lgbm', 'n_estimators': 193, 'max_depth': 3, 'learning_rate': 0.13720974036667885}. Best is trial 33 with value: 0.7866651633512239.
[01:23:00] WARNING: /home/conda/feedstock_root/build_artifacts/xgboost-split_1744329155408/work/src/common/error_msg.cc:27: The tree method `gpu_hist` is deprecated since 2.0.0. To use GPU training, set the `device` parameter to CUDA instead.

    E.g. tree_method = "hist", device = "cuda"

/home/passos/mambaforge/envs/hte-ml/lib/python3.10/multiprocessing/queues.py:122: UserWarning: pkg_resources is deprecated as an API. See https://setuptools.pypa.io/en/latest/pkg_resources.html. The pkg_resources package is slated for removal as early as 2025-11-30. Refrain from using this package or pin to Setuptools<81.
  return _ForkingPickler.loads(res)
/home/passos/mambaforge/envs/hte-ml/lib/python3.10/multiprocessing/queues.py:122: UserWarning: pkg_resources is deprecated as an API. See https://setuptools.pypa.io/en/latest/pkg_resources.html. The pkg_resources package is slated for removal as early as 2025-11-30. Refrain from using this package or pin to Setuptools<81.
  return _ForkingPickler.loads(res)
/home/passos/mambaforge/envs/hte-ml/lib/python3.10/multiprocessing/queues.py:122: UserWarning: pkg_resources is deprecated as an API. See https://setuptools.pypa.io/en/latest/pkg_resources.html. The pkg_resources package is slated for removal as early as 2025-11-30. Refrain from using this package or pin to Setuptools<81.
  return _ForkingPickler.loads(res)
/home/passos/mambaforge/envs/hte-ml/lib/python3.10/multiprocessing/queues.py:122: UserWarning: pkg_resources is deprecated as an API. See https://setuptools.pypa.io/en/latest/pkg_resources.html. The pkg_resources package is slated for removal as early as 2025-11-30. Refrain from using this package or pin to Setuptools<81.
  return _ForkingPickler.loads(res)
/home/passos/mambaforge/envs/hte-ml/lib/python3.10/multiprocessing/queues.py:122: UserWarning: pkg_resources is deprecated as an API. See https://setuptools.pypa.io/en/latest/pkg_resources.html. The pkg_resources package is slated for removal as early as 2025-11-30. Refrain from using this package or pin to Setuptools<81.
  return _ForkingPickler.loads(res)
/home/passos/mambaforge/envs/hte-ml/lib/python3.10/multiprocessing/queues.py:122: UserWarning: pkg_resources is deprecated as an API. See https://setuptools.pypa.io/en/latest/pkg_resources.html. The pkg_resources package is slated for removal as early as 2025-11-30. Refrain from using this package or pin to Setuptools<81.
  return _ForkingPickler.loads(res)
/home/passos/mambaforge/envs/hte-ml/lib/python3.10/multiprocessing/queues.py:122: UserWarning: pkg_resources is deprecated as an API. See https://setuptools.pypa.io/en/latest/pkg_resources.html. The pkg_resources package is slated for removal as early as 2025-11-30. Refrain from using this package or pin to Setuptools<81.
  return _ForkingPickler.loads(res)
/home/passos/mambaforge/envs/hte-ml/lib/python3.10/multiprocessing/queues.py:122: UserWarning: pkg_resources is deprecated as an API. See https://setuptools.pypa.io/en/latest/pkg_resources.html. The pkg_resources package is slated for removal as early as 2025-11-30. Refrain from using this package or pin to Setuptools<81.
  return _ForkingPickler.loads(res)
/home/passos/mambaforge/envs/hte-ml/lib/python3.10/multiprocessing/queues.py:122: UserWarning: pkg_resources is deprecated as an API. See https://setuptools.pypa.io/en/latest/pkg_resources.html. The pkg_resources package is slated for removal as early as 2025-11-30. Refrain from using this package or pin to Setuptools<81.
  return _ForkingPickler.loads(res)
/home/passos/mambaforge/envs/hte-ml/lib/python3.10/multiprocessing/queues.py:122: UserWarning: pkg_resources is deprecated as an API. See https://setuptools.pypa.io/en/latest/pkg_resources.html. The pkg_resources package is slated for removal as early as 2025-11-30. Refrain from using this package or pin to Setuptools<81.
  return _ForkingPickler.loads(res)
/home/passos/mambaforge/envs/hte-ml/lib/python3.10/multiprocessing/queues.py:122: UserWarning: pkg_resources is deprecated as an API. See https://setuptools.pypa.io/en/latest/pkg_resources.html. The pkg_resources package is slated for removal as early as 2025-11-30. Refrain from using this package or pin to Setuptools<81.
  return _ForkingPickler.loads(res)
/home/passos/mambaforge/envs/hte-ml/lib/python3.10/multiprocessing/queues.py:122: UserWarning: pkg_resources is deprecated as an API. See https://setuptools.pypa.io/en/latest/pkg_resources.html. The pkg_resources package is slated for removal as early as 2025-11-30. Refrain from using this package or pin to Setuptools<81.
  return _ForkingPickler.loads(res)
/home/passos/mambaforge/envs/hte-ml/lib/python3.10/multiprocessing/queues.py:122: UserWarning: pkg_resources is deprecated as an API. See https://setuptools.pypa.io/en/latest/pkg_resources.html. The pkg_resources package is slated for removal as early as 2025-11-30. Refrain from using this package or pin to Setuptools<81.
  return _ForkingPickler.loads(res)
/home/passos/mambaforge/envs/hte-ml/lib/python3.10/multiprocessing/queues.py:122: UserWarning: pkg_resources is deprecated as an API. See https://setuptools.pypa.io/en/latest/pkg_resources.html. The pkg_resources package is slated for removal as early as 2025-11-30. Refrain from using this package or pin to Setuptools<81.
  return _ForkingPickler.loads(res)
/home/passos/mambaforge/envs/hte-ml/lib/python3.10/multiprocessing/queues.py:122: UserWarning: pkg_resources is deprecated as an API. See https://setuptools.pypa.io/en/latest/pkg_resources.html. The pkg_resources package is slated for removal as early as 2025-11-30. Refrain from using this package or pin to Setuptools<81.
  return _ForkingPickler.loads(res)
/home/passos/mambaforge/envs/hte-ml/lib/python3.10/site-packages/xgboost/core.py:158: UserWarning: [01:23:04] WARNING: /home/conda/feedstock_root/build_artifacts/xgboost-split_1744329155408/work/src/common/error_msg.cc:27: The tree method `gpu_hist` is deprecated since 2.0.0. To use GPU training, set the `device` parameter to CUDA instead.

    E.g. tree_method = "hist", device = "cuda"

  warnings.warn(smsg, UserWarning)
/home/passos/mambaforge/envs/hte-ml/lib/python3.10/site-packages/xgboost/core.py:158: UserWarning: [01:23:07] WARNING: /home/conda/feedstock_root/build_artifacts/xgboost-split_1744329155408/work/src/common/error_msg.cc:27: The tree method `gpu_hist` is deprecated since 2.0.0. To use GPU training, set the `device` parameter to CUDA instead.

    E.g. tree_method = "hist", device = "cuda"

  warnings.warn(smsg, UserWarning)
/home/passos/mambaforge/envs/hte-ml/lib/python3.10/site-packages/xgboost/core.py:158: UserWarning: [01:23:13] WARNING: /home/conda/feedstock_root/build_artifacts/xgboost-split_1744329155408/work/src/common/error_msg.cc:27: The tree method `gpu_hist` is deprecated since 2.0.0. To use GPU training, set the `device` parameter to CUDA instead.

    E.g. tree_method = "hist", device = "cuda"

  warnings.warn(smsg, UserWarning)
/home/passos/mambaforge/envs/hte-ml/lib/python3.10/site-packages/xgboost/core.py:158: UserWarning: [01:23:13] WARNING: /home/conda/feedstock_root/build_artifacts/xgboost-split_1744329155408/work/src/common/error_msg.cc:27: The tree method `gpu_hist` is deprecated since 2.0.0. To use GPU training, set the `device` parameter to CUDA instead.

    E.g. tree_method = "hist", device = "cuda"

  warnings.warn(smsg, UserWarning)
/home/passos/mambaforge/envs/hte-ml/lib/python3.10/site-packages/xgboost/core.py:158: UserWarning: [01:23:14] WARNING: /home/conda/feedstock_root/build_artifacts/xgboost-split_1744329155408/work/src/common/error_msg.cc:27: The tree method `gpu_hist` is deprecated since 2.0.0. To use GPU training, set the `device` parameter to CUDA instead.

    E.g. tree_method = "hist", device = "cuda"

  warnings.warn(smsg, UserWarning)
/home/passos/mambaforge/envs/hte-ml/lib/python3.10/site-packages/xgboost/core.py:158: UserWarning: [01:23:14] WARNING: /home/conda/feedstock_root/build_artifacts/xgboost-split_1744329155408/work/src/common/error_msg.cc:27: The tree method `gpu_hist` is deprecated since 2.0.0. To use GPU training, set the `device` parameter to CUDA instead.

    E.g. tree_method = "hist", device = "cuda"

  warnings.warn(smsg, UserWarning)
/home/passos/mambaforge/envs/hte-ml/lib/python3.10/site-packages/xgboost/core.py:158: UserWarning: [01:23:14] WARNING: /home/conda/feedstock_root/build_artifacts/xgboost-split_1744329155408/work/src/common/error_msg.cc:27: The tree method `gpu_hist` is deprecated since 2.0.0. To use GPU training, set the `device` parameter to CUDA instead.

    E.g. tree_method = "hist", device = "cuda"

  warnings.warn(smsg, UserWarning)
/home/passos/mambaforge/envs/hte-ml/lib/python3.10/site-packages/xgboost/core.py:158: UserWarning: [01:23:14] WARNING: /home/conda/feedstock_root/build_artifacts/xgboost-split_1744329155408/work/src/common/error_msg.cc:27: The tree method `gpu_hist` is deprecated since 2.0.0. To use GPU training, set the `device` parameter to CUDA instead.

    E.g. tree_method = "hist", device = "cuda"

  warnings.warn(smsg, UserWarning)
/home/passos/mambaforge/envs/hte-ml/lib/python3.10/site-packages/xgboost/core.py:158: UserWarning: [01:23:14] WARNING: /home/conda/feedstock_root/build_artifacts/xgboost-split_1744329155408/work/src/common/error_msg.cc:27: The tree method `gpu_hist` is deprecated since 2.0.0. To use GPU training, set the `device` parameter to CUDA instead.

    E.g. tree_method = "hist", device = "cuda"

  warnings.warn(smsg, UserWarning)
/home/passos/mambaforge/envs/hte-ml/lib/python3.10/site-packages/xgboost/core.py:158: UserWarning: [01:23:14] WARNING: /home/conda/feedstock_root/build_artifacts/xgboost-split_1744329155408/work/src/common/error_msg.cc:27: The tree method `gpu_hist` is deprecated since 2.0.0. To use GPU training, set the `device` parameter to CUDA instead.

    E.g. tree_method = "hist", device = "cuda"

  warnings.warn(smsg, UserWarning)
/home/passos/mambaforge/envs/hte-ml/lib/python3.10/site-packages/xgboost/core.py:158: UserWarning: [01:23:14] WARNING: /home/conda/feedstock_root/build_artifacts/xgboost-split_1744329155408/work/src/common/error_msg.cc:27: The tree method `gpu_hist` is deprecated since 2.0.0. To use GPU training, set the `device` parameter to CUDA instead.

    E.g. tree_method = "hist", device = "cuda"

  warnings.warn(smsg, UserWarning)
/home/passos/mambaforge/envs/hte-ml/lib/python3.10/site-packages/xgboost/core.py:158: UserWarning: [01:23:14] WARNING: /home/conda/feedstock_root/build_artifacts/xgboost-split_1744329155408/work/src/common/error_msg.cc:27: The tree method `gpu_hist` is deprecated since 2.0.0. To use GPU training, set the `device` parameter to CUDA instead.

    E.g. tree_method = "hist", device = "cuda"

  warnings.warn(smsg, UserWarning)
/home/passos/mambaforge/envs/hte-ml/lib/python3.10/site-packages/xgboost/core.py:158: UserWarning: [01:23:14] WARNING: /home/conda/feedstock_root/build_artifacts/xgboost-split_1744329155408/work/src/common/error_msg.cc:27: The tree method `gpu_hist` is deprecated since 2.0.0. To use GPU training, set the `device` parameter to CUDA instead.

    E.g. tree_method = "hist", device = "cuda"

  warnings.warn(smsg, UserWarning)
/home/passos/mambaforge/envs/hte-ml/lib/python3.10/site-packages/xgboost/core.py:158: UserWarning: [01:23:14] WARNING: /home/conda/feedstock_root/build_artifacts/xgboost-split_1744329155408/work/src/common/error_msg.cc:27: The tree method `gpu_hist` is deprecated since 2.0.0. To use GPU training, set the `device` parameter to CUDA instead.

    E.g. tree_method = "hist", device = "cuda"

  warnings.warn(smsg, UserWarning)
/home/passos/mambaforge/envs/hte-ml/lib/python3.10/site-packages/xgboost/core.py:158: UserWarning: [01:23:14] WARNING: /home/conda/feedstock_root/build_artifacts/xgboost-split_1744329155408/work/src/common/error_msg.cc:27: The tree method `gpu_hist` is deprecated since 2.0.0. To use GPU training, set the `device` parameter to CUDA instead.

    E.g. tree_method = "hist", device = "cuda"

  warnings.warn(smsg, UserWarning)
Wrapped best model with Bagging ensemble: Bagging(XGBoost x15)
[01:23:14] WARNING: /home/conda/feedstock_root/build_artifacts/xgboost-split_1744329155408/work/src/common/error_msg.cc:27: The tree method `gpu_hist` is deprecated since 2.0.0. To use GPU training, set the `device` parameter to CUDA instead.

    E.g. tree_method = "hist", device = "cuda"

[01:23:14] WARNING: /home/conda/feedstock_root/build_artifacts/xgboost-split_1744329155408/work/src/common/error_msg.cc:27: The tree method `gpu_hist` is deprecated since 2.0.0. To use GPU training, set the `device` parameter to CUDA instead.

    E.g. tree_method = "hist", device = "cuda"

[01:23:14] WARNING: /home/conda/feedstock_root/build_artifacts/xgboost-split_1744329155408/work/src/common/error_msg.cc:27: The tree method `gpu_hist` is deprecated since 2.0.0. To use GPU training, set the `device` parameter to CUDA instead.

    E.g. tree_method = "hist", device = "cuda"

[01:23:14] WARNING: /home/conda/feedstock_root/build_artifacts/xgboost-split_1744329155408/work/src/common/error_msg.cc:27: The tree method `gpu_hist` is deprecated since 2.0.0. To use GPU training, set the `device` parameter to CUDA instead.

    E.g. tree_method = "hist", device = "cuda"

[01:23:14] WARNING: /home/conda/feedstock_root/build_artifacts/xgboost-split_1744329155408/work/src/common/error_msg.cc:27: The tree method `gpu_hist` is deprecated since 2.0.0. To use GPU training, set the `device` parameter to CUDA instead.

    E.g. tree_method = "hist", device = "cuda"

[01:23:14] WARNING: /home/conda/feedstock_root/build_artifacts/xgboost-split_1744329155408/work/src/common/error_msg.cc:27: The tree method `gpu_hist` is deprecated since 2.0.0. To use GPU training, set the `device` parameter to CUDA instead.

    E.g. tree_method = "hist", device = "cuda"

[01:23:14] WARNING: /home/conda/feedstock_root/build_artifacts/xgboost-split_1744329155408/work/src/common/error_msg.cc:27: The tree method `gpu_hist` is deprecated since 2.0.0. To use GPU training, set the `device` parameter to CUDA instead.

    E.g. tree_method = "hist", device = "cuda"

[01:23:14] WARNING: /home/conda/feedstock_root/build_artifacts/xgboost-split_1744329155408/work/src/common/error_msg.cc:27: The tree method `gpu_hist` is deprecated since 2.0.0. To use GPU training, set the `device` parameter to CUDA instead.

    E.g. tree_method = "hist", device = "cuda"

[01:23:14] WARNING: /home/conda/feedstock_root/build_artifacts/xgboost-split_1744329155408/work/src/common/error_msg.cc:27: The tree method `gpu_hist` is deprecated since 2.0.0. To use GPU training, set the `device` parameter to CUDA instead.

    E.g. tree_method = "hist", device = "cuda"

[01:23:14] WARNING: /home/conda/feedstock_root/build_artifacts/xgboost-split_1744329155408/work/src/common/error_msg.cc:27: The tree method `gpu_hist` is deprecated since 2.0.0. To use GPU training, set the `device` parameter to CUDA instead.

    E.g. tree_method = "hist", device = "cuda"

[01:23:15] WARNING: /home/conda/feedstock_root/build_artifacts/xgboost-split_1744329155408/work/src/common/error_msg.cc:27: The tree method `gpu_hist` is deprecated since 2.0.0. To use GPU training, set the `device` parameter to CUDA instead.

    E.g. tree_method = "hist", device = "cuda"

[01:23:15] WARNING: /home/conda/feedstock_root/build_artifacts/xgboost-split_1744329155408/work/src/common/error_msg.cc:27: The tree method `gpu_hist` is deprecated since 2.0.0. To use GPU training, set the `device` parameter to CUDA instead.

    E.g. tree_method = "hist", device = "cuda"

[01:23:15] WARNING: /home/conda/feedstock_root/build_artifacts/xgboost-split_1744329155408/work/src/common/error_msg.cc:27: The tree method `gpu_hist` is deprecated since 2.0.0. To use GPU training, set the `device` parameter to CUDA instead.

    E.g. tree_method = "hist", device = "cuda"

[01:23:15] WARNING: /home/conda/feedstock_root/build_artifacts/xgboost-split_1744329155408/work/src/common/error_msg.cc:27: The tree method `gpu_hist` is deprecated since 2.0.0. To use GPU training, set the `device` parameter to CUDA instead.

    E.g. tree_method = "hist", device = "cuda"

[01:23:15] WARNING: /home/conda/feedstock_root/build_artifacts/xgboost-split_1744329155408/work/src/common/error_msg.cc:27: The tree method `gpu_hist` is deprecated since 2.0.0. To use GPU training, set the `device` parameter to CUDA instead.

    E.g. tree_method = "hist", device = "cuda"

/home/passos/mambaforge/envs/hte-ml/lib/python3.10/site-packages/xgboost/core.py:158: UserWarning: [01:23:23] WARNING: /home/conda/feedstock_root/build_artifacts/xgboost-split_1744329155408/work/src/common/error_msg.cc:27: The tree method `gpu_hist` is deprecated since 2.0.0. To use GPU training, set the `device` parameter to CUDA instead.

    E.g. tree_method = "hist", device = "cuda"

  warnings.warn(smsg, UserWarning)
/home/passos/mambaforge/envs/hte-ml/lib/python3.10/site-packages/xgboost/core.py:158: UserWarning: [01:23:23] WARNING: /home/conda/feedstock_root/build_artifacts/xgboost-split_1744329155408/work/src/common/error_msg.cc:27: The tree method `gpu_hist` is deprecated since 2.0.0. To use GPU training, set the `device` parameter to CUDA instead.

    E.g. tree_method = "hist", device = "cuda"

  warnings.warn(smsg, UserWarning)
/home/passos/mambaforge/envs/hte-ml/lib/python3.10/site-packages/xgboost/core.py:158: UserWarning: [01:23:23] WARNING: /home/conda/feedstock_root/build_artifacts/xgboost-split_1744329155408/work/src/common/error_msg.cc:27: The tree method `gpu_hist` is deprecated since 2.0.0. To use GPU training, set the `device` parameter to CUDA instead.

    E.g. tree_method = "hist", device = "cuda"

  warnings.warn(smsg, UserWarning)
/home/passos/mambaforge/envs/hte-ml/lib/python3.10/site-packages/xgboost/core.py:158: UserWarning: [01:23:23] WARNING: /home/conda/feedstock_root/build_artifacts/xgboost-split_1744329155408/work/src/common/error_msg.cc:27: The tree method `gpu_hist` is deprecated since 2.0.0. To use GPU training, set the `device` parameter to CUDA instead.

    E.g. tree_method = "hist", device = "cuda"

  warnings.warn(smsg, UserWarning)
/home/passos/mambaforge/envs/hte-ml/lib/python3.10/site-packages/xgboost/core.py:158: UserWarning: [01:23:23] WARNING: /home/conda/feedstock_root/build_artifacts/xgboost-split_1744329155408/work/src/common/error_msg.cc:27: The tree method `gpu_hist` is deprecated since 2.0.0. To use GPU training, set the `device` parameter to CUDA instead.

    E.g. tree_method = "hist", device = "cuda"

  warnings.warn(smsg, UserWarning)
/home/passos/mambaforge/envs/hte-ml/lib/python3.10/site-packages/xgboost/core.py:158: UserWarning: [01:23:23] WARNING: /home/conda/feedstock_root/build_artifacts/xgboost-split_1744329155408/work/src/common/error_msg.cc:27: The tree method `gpu_hist` is deprecated since 2.0.0. To use GPU training, set the `device` parameter to CUDA instead.

    E.g. tree_method = "hist", device = "cuda"

  warnings.warn(smsg, UserWarning)
/home/passos/mambaforge/envs/hte-ml/lib/python3.10/site-packages/xgboost/core.py:158: UserWarning: [01:23:23] WARNING: /home/conda/feedstock_root/build_artifacts/xgboost-split_1744329155408/work/src/common/error_msg.cc:27: The tree method `gpu_hist` is deprecated since 2.0.0. To use GPU training, set the `device` parameter to CUDA instead.

    E.g. tree_method = "hist", device = "cuda"

  warnings.warn(smsg, UserWarning)
/home/passos/mambaforge/envs/hte-ml/lib/python3.10/site-packages/xgboost/core.py:158: UserWarning: [01:23:24] WARNING: /home/conda/feedstock_root/build_artifacts/xgboost-split_1744329155408/work/src/common/error_msg.cc:27: The tree method `gpu_hist` is deprecated since 2.0.0. To use GPU training, set the `device` parameter to CUDA instead.

    E.g. tree_method = "hist", device = "cuda"

  warnings.warn(smsg, UserWarning)
/home/passos/mambaforge/envs/hte-ml/lib/python3.10/site-packages/xgboost/core.py:158: UserWarning: [01:23:24] WARNING: /home/conda/feedstock_root/build_artifacts/xgboost-split_1744329155408/work/src/common/error_msg.cc:27: The tree method `gpu_hist` is deprecated since 2.0.0. To use GPU training, set the `device` parameter to CUDA instead.

    E.g. tree_method = "hist", device = "cuda"

  warnings.warn(smsg, UserWarning)
/home/passos/mambaforge/envs/hte-ml/lib/python3.10/site-packages/xgboost/core.py:158: UserWarning: [01:23:24] WARNING: /home/conda/feedstock_root/build_artifacts/xgboost-split_1744329155408/work/src/common/error_msg.cc:27: The tree method `gpu_hist` is deprecated since 2.0.0. To use GPU training, set the `device` parameter to CUDA instead.

    E.g. tree_method = "hist", device = "cuda"

  warnings.warn(smsg, UserWarning)
/home/passos/mambaforge/envs/hte-ml/lib/python3.10/site-packages/xgboost/core.py:158: UserWarning: [01:23:24] WARNING: /home/conda/feedstock_root/build_artifacts/xgboost-split_1744329155408/work/src/common/error_msg.cc:27: The tree method `gpu_hist` is deprecated since 2.0.0. To use GPU training, set the `device` parameter to CUDA instead.

    E.g. tree_method = "hist", device = "cuda"

  warnings.warn(smsg, UserWarning)
/home/passos/mambaforge/envs/hte-ml/lib/python3.10/site-packages/xgboost/core.py:158: UserWarning: [01:23:24] WARNING: /home/conda/feedstock_root/build_artifacts/xgboost-split_1744329155408/work/src/common/error_msg.cc:27: The tree method `gpu_hist` is deprecated since 2.0.0. To use GPU training, set the `device` parameter to CUDA instead.

    E.g. tree_method = "hist", device = "cuda"

  warnings.warn(smsg, UserWarning)
/home/passos/mambaforge/envs/hte-ml/lib/python3.10/site-packages/xgboost/core.py:158: UserWarning: [01:23:24] WARNING: /ho