[I 2025-08-20 01:21:30,744] Trial 0 finished with value: 0.5863169780105325 and parameters: {'model_type': 'rf', 'n_estimators': 192, 'max_depth': 4, 'min_samples_split': 5}. Best is trial 0 with value: 0.5863169780105325.
[I 2025-08-20 01:21:30,754] Trial 1 finished with value: 0.48044730786800294 and parameters: {'model_type': 'bayesian_ridge', 'alpha_1': 0.00031771572755449234, 'alpha_2': 0.0009303002085299194, 'lambda_1': 3.362306965307593e-06, 'lambda_2': 5.0826691424602954e-05}. Best is trial 0 with value: 0.5863169780105325.
[I 2025-08-20 01:21:31,483] Trial 2 finished with value: 0.7306380616819337 and parameters: {'model_type': 'xgb', 'n_estimators': 200, 'max_depth': 7, 'learning_rate': 0.27578490914789355}. Best is trial 2 with value: 0.7306380616819337.
[I 2025-08-20 01:21:31,577] Trial 3 finished with value: 0.5433401795889033 and parameters: {'model_type': 'xgb', 'n_estimators': 112, 'max_depth': 3, 'learning_rate': 0.01367515042137732}. Best is trial 2 with value: 0.7306380616819337.
[I 2025-08-20 01:21:31,785] Trial 4 finished with value: 0.7625410864106476 and parameters: {'model_type': 'lgbm', 'n_estimators': 193, 'max_depth': 5, 'learning_rate': 0.29667874458177673}. Best is trial 4 with value: 0.7625410864106476.
[I 2025-08-20 01:21:48,863] Trial 5 finished with value: 0.7405496460638996 and parameters: {'model_type': 'cat', 'iterations': 513, 'depth': 10, 'learning_rate': 0.27220796976529077}. Best is trial 4 with value: 0.7625410864106476.
[I 2025-08-20 01:21:48,996] Trial 6 finished with value: 0.7602205051748506 and parameters: {'model_type': 'lgbm', 'n_estimators': 116, 'max_depth': 8, 'learning_rate': 0.12598496159760592}. Best is trial 4 with value: 0.7625410864106476.
[I 2025-08-20 01:21:49,672] Trial 7 finished with value: 0.7453479250374336 and parameters: {'model_type': 'xgb', 'n_estimators': 180, 'max_depth': 7, 'learning_rate': 0.29891487527967525}. Best is trial 4 with value: 0.7625410864106476.
[I 2025-08-20 01:21:49,729] Trial 8 finished with value: 0.7804850424464737 and parameters: {'model_type': 'lgbm', 'n_estimators': 132, 'max_depth': 6, 'learning_rate': 0.06627698224010711}. Best is trial 8 with value: 0.7804850424464737.
[I 2025-08-20 01:21:51,444] Trial 9 finished with value: 0.7613905067576621 and parameters: {'model_type': 'cat', 'iterations': 206, 'depth': 5, 'learning_rate': 0.07963783240320417}. Best is trial 8 with value: 0.7804850424464737.
[I 2025-08-20 01:21:51,491] Trial 10 finished with value: 0.7566490831675873 and parameters: {'model_type': 'lgbm', 'n_estimators': 53, 'max_depth': 10, 'learning_rate': 0.19576861627844275}. Best is trial 8 with value: 0.7804850424464737.
[I 2025-08-20 01:21:51,558] Trial 11 finished with value: 0.7699833915650397 and parameters: {'model_type': 'lgbm', 'n_estimators': 154, 'max_depth': 5, 'learning_rate': 0.19319638912304887}. Best is trial 8 with value: 0.7804850424464737.
[I 2025-08-20 01:21:51,624] Trial 12 finished with value: 0.7746080015328821 and parameters: {'model_type': 'lgbm', 'n_estimators': 149, 'max_depth': 5, 'learning_rate': 0.1916714553030268}. Best is trial 8 with value: 0.7804850424464737.
[I 2025-08-20 01:21:51,686] Trial 13 finished with value: 0.7831635042232458 and parameters: {'model_type': 'lgbm', 'n_estimators': 143, 'max_depth': 5, 'learning_rate': 0.08230693557073424}. Best is trial 13 with value: 0.7831635042232458.
[I 2025-08-20 01:21:51,699] Trial 14 finished with value: 0.48045512049211425 and parameters: {'model_type': 'bayesian_ridge', 'alpha_1': 0.0009573874013646588, 'alpha_2': 2.420548473805917e-06, 'lambda_1': 0.0009587285346603461, 'lambda_2': 0.000972495996314487}. Best is trial 13 with value: 0.7831635042232458.
[I 2025-08-20 01:21:52,029] Trial 15 finished with value: 0.7331160663062259 and parameters: {'model_type': 'rf', 'n_estimators': 94, 'max_depth': 14, 'min_samples_split': 10}. Best is trial 13 with value: 0.7831635042232458.
[I 2025-08-20 01:21:52,116] Trial 16 finished with value: 0.7752828836465112 and parameters: {'model_type': 'lgbm', 'n_estimators': 152, 'max_depth': 6, 'learning_rate': 0.06803715991668262}. Best is trial 13 with value: 0.7831635042232458.
[I 2025-08-20 01:21:52,146] Trial 17 finished with value: 0.7016807225888446 and parameters: {'model_type': 'lgbm', 'n_estimators': 82, 'max_depth': 3, 'learning_rate': 0.04693396681330196}. Best is trial 13 with value: 0.7831635042232458.
[I 2025-08-20 01:21:52,224] Trial 18 finished with value: 0.7454828964669498 and parameters: {'model_type': 'lgbm', 'n_estimators': 136, 'max_depth': 8, 'learning_rate': 0.125579148764851}. Best is trial 13 with value: 0.7831635042232458.
[I 2025-08-20 01:22:08,776] Trial 19 finished with value: 0.7786984790886416 and parameters: {'model_type': 'cat', 'iterations': 800, 'depth': 9, 'learning_rate': 0.1087516870617086}. Best is trial 13 with value: 0.7831635042232458.
[I 2025-08-20 01:22:09,369] Trial 20 finished with value: 0.7414408345871695 and parameters: {'model_type': 'rf', 'n_estimators': 167, 'max_depth': 11, 'min_samples_split': 2}. Best is trial 13 with value: 0.7831635042232458.
[I 2025-08-20 01:22:26,028] Trial 21 finished with value: 0.7718175104742071 and parameters: {'model_type': 'cat', 'iterations': 795, 'depth': 9, 'learning_rate': 0.10962288740150897}. Best is trial 13 with value: 0.7831635042232458.
[I 2025-08-20 01:22:35,148] Trial 22 finished with value: 0.7716251887458836 and parameters: {'model_type': 'cat', 'iterations': 753, 'depth': 7, 'learning_rate': 0.0945019417069532}. Best is trial 13 with value: 0.7831635042232458.
[I 2025-08-20 01:22:44,061] Trial 23 finished with value: 0.7576178821211643 and parameters: {'model_type': 'cat', 'iterations': 523, 'depth': 8, 'learning_rate': 0.14916747428288207}. Best is trial 13 with value: 0.7831635042232458.
[I 2025-08-20 01:22:44,082] Trial 24 finished with value: 0.48045173533405716 and parameters: {'model_type': 'bayesian_ridge', 'alpha_1': 5.134098464185051e-05, 'alpha_2': 0.00036320147666813515, 'lambda_1': 0.00040933114056158795, 'lambda_2': 0.0005683304879092621}. Best is trial 13 with value: 0.7831635042232458.
[I 2025-08-20 01:22:51,008] Trial 25 finished with value: 0.7594498447195717 and parameters: {'model_type': 'cat', 'iterations': 661, 'depth': 6, 'learning_rate': 0.05014804647533526}. Best is trial 13 with value: 0.7831635042232458.
[I 2025-08-20 01:22:51,153] Trial 26 finished with value: 0.7069310956417445 and parameters: {'model_type': 'lgbm', 'n_estimators': 129, 'max_depth': 6, 'learning_rate': 0.015633204416372407}. Best is trial 13 with value: 0.7831635042232458.
[I 2025-08-20 01:22:51,202] Trial 27 finished with value: 0.7585044580555994 and parameters: {'model_type': 'lgbm', 'n_estimators': 96, 'max_depth': 4, 'learning_rate': 0.052115052327309126}. Best is trial 13 with value: 0.7831635042232458.
[I 2025-08-20 01:22:53,769] Trial 28 finished with value: 0.7605824010002231 and parameters: {'model_type': 'cat', 'iterations': 307, 'depth': 4, 'learning_rate': 0.149737206633946}. Best is trial 13 with value: 0.7831635042232458.
[I 2025-08-20 01:22:54,186] Trial 29 finished with value: 0.7336665705608587 and parameters: {'model_type': 'rf', 'n_estimators': 140, 'max_depth': 12, 'min_samples_split': 10}. Best is trial 13 with value: 0.7831635042232458.
[I 2025-08-20 01:22:54,747] Trial 30 finished with value: 0.7756706267495843 and parameters: {'model_type': 'xgb', 'n_estimators': 167, 'max_depth': 4, 'learning_rate': 0.09593759571843752}. Best is trial 13 with value: 0.7831635042232458.
[I 2025-08-20 01:22:55,318] Trial 31 finished with value: 0.78170721698388 and parameters: {'model_type': 'xgb', 'n_estimators': 171, 'max_depth': 4, 'learning_rate': 0.09625670961605175}. Best is trial 13 with value: 0.7831635042232458.
[I 2025-08-20 01:22:55,961] Trial 32 finished with value: 0.7630444401569777 and parameters: {'model_type': 'xgb', 'n_estimators': 166, 'max_depth': 6, 'learning_rate': 0.08334826316002952}. Best is trial 13 with value: 0.7831635042232458.
[I 2025-08-20 01:22:56,116] Trial 33 finished with value: 0.7866651633512239 and parameters: {'model_type': 'xgb', 'n_estimators': 113, 'max_depth': 5, 'learning_rate': 0.12080390195984508}. Best is trial 33 with value: 0.7866651633512239.
[I 2025-08-20 01:22:56,281] Trial 34 finished with value: 0.774412131302808 and parameters: {'model_type': 'xgb', 'n_estimators': 120, 'max_depth': 5, 'learning_rate': 0.12558258309864992}. Best is trial 33 with value: 0.7866651633512239.
[I 2025-08-20 01:22:56,426] Trial 35 finished with value: 0.7628118198369863 and parameters: {'model_type': 'xgb', 'n_estimators': 129, 'max_depth': 4, 'learning_rate': 0.03531228861968495}. Best is trial 33 with value: 0.7866651633512239.
[I 2025-08-20 01:22:56,575] Trial 36 finished with value: 0.782355096778731 and parameters: {'model_type': 'xgb', 'n_estimators': 108, 'max_depth': 5, 'learning_rate': 0.06871700381775721}. Best is trial 33 with value: 0.7866651633512239.
[I 2025-08-20 01:22:56,722] Trial 37 finished with value: 0.7748548722397286 and parameters: {'model_type': 'xgb', 'n_estimators': 105, 'max_depth': 5, 'learning_rate': 0.11065769721573239}. Best is trial 33 with value: 0.7866651633512239.
[I 2025-08-20 01:22:56,812] Trial 38 finished with value: 0.768373244439086 and parameters: {'model_type': 'xgb', 'n_estimators': 70, 'max_depth': 4, 'learning_rate': 0.16443454677223454}. Best is trial 33 with value: 0.7866651633512239.
[I 2025-08-20 01:22:56,912] Trial 39 finished with value: 0.6621677397446903 and parameters: {'model_type': 'xgb', 'n_estimators': 100, 'max_depth': 3, 'learning_rate': 0.028934407659896022}. Best is trial 33 with value: 0.7866651633512239.
[I 2025-08-20 01:22:57,065] Trial 40 finished with value: 0.761008439400165 and parameters: {'model_type': 'xgb', 'n_estimators': 109, 'max_depth': 5, 'learning_rate': 0.16887028581762079}. Best is trial 33 with value: 0.7866651633512239.
[I 2025-08-20 01:22:57,293] Trial 41 finished with value: 0.7685646675867761 and parameters: {'model_type': 'xgb', 'n_estimators': 140, 'max_depth': 6, 'learning_rate': 0.06708514792719926}. Best is trial 33 with value: 0.7866651633512239.
[I 2025-08-20 01:22:57,307] Trial 42 finished with value: 0.48044675355178934 and parameters: {'model_type': 'bayesian_ridge', 'alpha_1': 0.0009764519986519653, 'alpha_2': 0.0009960077019424485, 'lambda_1': 0.0009753108622053087, 'lambda_2': 1.27288903575269e-05}. Best is trial 33 with value: 0.7866651633512239.
[I 2025-08-20 01:22:57,475] Trial 43 finished with value: 0.7798873725694864 and parameters: {'model_type': 'xgb', 'n_estimators': 122, 'max_depth': 5, 'learning_rate': 0.06570987887060795}. Best is trial 33 with value: 0.7866651633512239.
[I 2025-08-20 01:22:57,695] Trial 44 finished with value: 0.7626224583962085 and parameters: {'model_type': 'xgb', 'n_estimators': 133, 'max_depth': 6, 'learning_rate': 0.08601967686169837}. Best is trial 33 with value: 0.7866651633512239.
[I 2025-08-20 01:22:57,767] Trial 45 finished with value: 0.7836261087945673 and parameters: {'model_type': 'lgbm', 'n_estimators': 159, 'max_depth': 4, 'learning_rate': 0.1351997801153524}. Best is trial 33 with value: 0.7866651633512239.
[I 2025-08-20 01:22:57,844] Trial 46 finished with value: 0.7784207477571532 and parameters: {'model_type': 'lgbm', 'n_estimators': 178, 'max_depth': 4, 'learning_rate': 0.1355426233831624}. Best is trial 33 with value: 0.7866651633512239.
[I 2025-08-20 01:22:57,989] Trial 47 finished with value: 0.7658918112343469 and parameters: {'model_type': 'xgb', 'n_estimators': 159, 'max_depth': 3, 'learning_rate': 0.22375953522306435}. Best is trial 33 with value: 0.7866651633512239.
[I 2025-08-20 01:22:58,071] Trial 48 finished with value: 0.7864752714886659 and parameters: {'model_type': 'lgbm', 'n_estimators': 179, 'max_depth': 4, 'learning_rate': 0.1029073883784266}. Best is trial 33 with value: 0.7866651633512239.
