[I 2025-08-20 01:27:19,129] Trial 0 finished with value: 0.3806993330023295 and parameters: {'model_type': 'lgbm', 'n_estimators': 140, 'max_depth': 4, 'learning_rate': 0.2591487000834656}. Best is trial 0 with value: 0.3806993330023295.
[I 2025-08-20 01:27:19,254] Trial 1 finished with value: 0.37978113164612326 and parameters: {'model_type': 'rf', 'n_estimators': 136, 'max_depth': 15, 'min_samples_split': 4}. Best is trial 0 with value: 0.3806993330023295.
[I 2025-08-20 01:27:19,323] Trial 2 finished with value: 0.372969739182188 and parameters: {'model_type': 'lgbm', 'n_estimators': 146, 'max_depth': 7, 'learning_rate': 0.17617969229081143}. Best is trial 0 with value: 0.3806993330023295.
[I 2025-08-20 01:27:19,383] Trial 3 finished with value: 0.3816867569829008 and parameters: {'model_type': 'lgbm', 'n_estimators': 197, 'max_depth': 4, 'learning_rate': 0.15183521701623717}. Best is trial 3 with value: 0.3816867569829008.
[I 2025-08-20 01:27:20,941] Trial 4 finished with value: 0.35848720596796646 and parameters: {'model_type': 'xgb', 'n_estimators': 115, 'max_depth': 9, 'learning_rate': 0.1912329994280647}. Best is trial 3 with value: 0.3816867569829008.
[I 2025-08-20 01:27:21,088] Trial 5 finished with value: 0.38078873802579816 and parameters: {'model_type': 'lgbm', 'n_estimators': 142, 'max_depth': 3, 'learning_rate': 0.10508974149780552}. Best is trial 3 with value: 0.3816867569829008.
[I 2025-08-20 01:27:22,561] Trial 6 finished with value: 0.3726382971022598 and parameters: {'model_type': 'cat', 'iterations': 362, 'depth': 9, 'learning_rate': 0.13129913649542366}. Best is trial 3 with value: 0.3816867569829008.
[I 2025-08-20 01:27:22,717] Trial 7 finished with value: 0.38189999519959106 and parameters: {'model_type': 'rf', 'n_estimators': 161, 'max_depth': 9, 'min_samples_split': 5}. Best is trial 7 with value: 0.38189999519959106.
[I 2025-08-20 01:27:22,842] Trial 8 finished with value: 0.3801635504455334 and parameters: {'model_type': 'rf', 'n_estimators': 140, 'max_depth': 14, 'min_samples_split': 4}. Best is trial 7 with value: 0.38189999519959106.
[I 2025-08-20 01:27:28,320] Trial 9 finished with value: 0.3945455404505863 and parameters: {'model_type': 'cat', 'iterations': 602, 'depth': 4, 'learning_rate': 0.036416582066516975}. Best is trial 9 with value: 0.3945455404505863.
[I 2025-08-20 01:27:36,050] Trial 10 finished with value: 0.39400693632986583 and parameters: {'model_type': 'cat', 'iterations': 752, 'depth': 4, 'learning_rate': 0.022486607958044157}. Best is trial 9 with value: 0.3945455404505863.
[I 2025-08-20 01:27:41,618] Trial 11 finished with value: 0.39393416180462015 and parameters: {'model_type': 'cat', 'iterations': 775, 'depth': 4, 'learning_rate': 0.022245016817295793}. Best is trial 9 with value: 0.3945455404505863.
[I 2025-08-20 01:27:41,632] Trial 12 finished with value: 0.2993019365980064 and parameters: {'model_type': 'bayesian_ridge', 'alpha_1': 0.0007784349393100143, 'alpha_2': 0.0006475581252022155, 'lambda_1': 0.0007695899032333963, 'lambda_2': 0.0005023920705036207}. Best is trial 9 with value: 0.3945455404505863.
[I 2025-08-20 01:27:46,911] Trial 13 finished with value: 0.39429313976900005 and parameters: {'model_type': 'cat', 'iterations': 714, 'depth': 4, 'learning_rate': 0.024691753918039395}. Best is trial 9 with value: 0.3945455404505863.
[I 2025-08-20 01:27:53,969] Trial 14 finished with value: 0.3899713266670628 and parameters: {'model_type': 'cat', 'iterations': 579, 'depth': 5, 'learning_rate': 0.0756107309302548}. Best is trial 9 with value: 0.3945455404505863.
[I 2025-08-20 01:28:01,576] Trial 15 finished with value: 0.38702927625869066 and parameters: {'model_type': 'cat', 'iterations': 583, 'depth': 7, 'learning_rate': 0.06674057355675082}. Best is trial 9 with value: 0.3945455404505863.
[I 2025-08-20 01:28:01,886] Trial 16 finished with value: 0.26420841387227134 and parameters: {'model_type': 'xgb', 'n_estimators': 54, 'max_depth': 6, 'learning_rate': 0.012326860848706551}. Best is trial 9 with value: 0.3945455404505863.
[I 2025-08-20 01:28:01,900] Trial 17 finished with value: 0.2993072630273048 and parameters: {'model_type': 'bayesian_ridge', 'alpha_1': 0.00018117829671794057, 'alpha_2': 0.00012224234071153277, 'lambda_1': 7.463092519600754e-05, 'lambda_2': 0.0009846089253240408}. Best is trial 9 with value: 0.3945455404505863.
[I 2025-08-20 01:28:09,128] Trial 18 finished with value: 0.38665366573009985 and parameters: {'model_type': 'cat', 'iterations': 652, 'depth': 6, 'learning_rate': 0.07594154749667302}. Best is trial 9 with value: 0.3945455404505863.
[I 2025-08-20 01:28:15,317] Trial 19 finished with value: 0.38155694920958527 and parameters: {'model_type': 'cat', 'iterations': 406, 'depth': 10, 'learning_rate': 0.2989305158515119}. Best is trial 9 with value: 0.3945455404505863.
[I 2025-08-20 01:28:20,645] Trial 20 finished with value: 0.3908731377114957 and parameters: {'model_type': 'cat', 'iterations': 673, 'depth': 4, 'learning_rate': 0.21973973486969578}. Best is trial 9 with value: 0.3945455404505863.
[I 2025-08-20 01:28:27,361] Trial 21 finished with value: 0.3951569944909734 and parameters: {'model_type': 'cat', 'iterations': 784, 'depth': 4, 'learning_rate': 0.04479571562604587}. Best is trial 21 with value: 0.3951569944909734.
[I 2025-08-20 01:28:33,471] Trial 22 finished with value: 0.3930429890871935 and parameters: {'model_type': 'cat', 'iterations': 792, 'depth': 5, 'learning_rate': 0.05223970416715763}. Best is trial 21 with value: 0.3951569944909734.
[I 2025-08-20 01:28:40,821] Trial 23 finished with value: 0.39029029251843916 and parameters: {'model_type': 'cat', 'iterations': 672, 'depth': 5, 'learning_rate': 0.10736696821267741}. Best is trial 21 with value: 0.3951569944909734.
[I 2025-08-20 01:28:41,298] Trial 24 finished with value: 0.3574222875596944 and parameters: {'model_type': 'xgb', 'n_estimators': 53, 'max_depth': 9, 'learning_rate': 0.05399480206308313}. Best is trial 21 with value: 0.3951569944909734.
[I 2025-08-20 01:28:41,312] Trial 25 finished with value: 0.2992985825519311 and parameters: {'model_type': 'bayesian_ridge', 'alpha_1': 5.489781591476017e-06, 'alpha_2': 0.0009764186197943511, 'lambda_1': 0.0009562677551121559, 'lambda_2': 1.9073800956502605e-06}. Best is trial 21 with value: 0.3951569944909734.
[I 2025-08-20 01:28:45,113] Trial 26 finished with value: 0.3938255703147824 and parameters: {'model_type': 'cat', 'iterations': 510, 'depth': 4, 'learning_rate': 0.043840214451184197}. Best is trial 21 with value: 0.3951569944909734.
[I 2025-08-20 01:28:51,056] Trial 27 finished with value: 0.38902505754412364 and parameters: {'model_type': 'cat', 'iterations': 707, 'depth': 6, 'learning_rate': 0.09971897245545526}. Best is trial 21 with value: 0.3951569944909734.
[I 2025-08-20 01:28:55,923] Trial 28 finished with value: 0.3921295760743193 and parameters: {'model_type': 'cat', 'iterations': 231, 'depth': 5, 'learning_rate': 0.03940880244772411}. Best is trial 21 with value: 0.3951569944909734.
[I 2025-08-20 01:29:02,349] Trial 29 finished with value: 0.3822109178634364 and parameters: {'model_type': 'cat', 'iterations': 582, 'depth': 8, 'learning_rate': 0.08259436465670023}. Best is trial 21 with value: 0.3951569944909734.
[I 2025-08-20 01:29:02,929] Trial 30 finished with value: 0.33425623586336073 and parameters: {'model_type': 'xgb', 'n_estimators': 87, 'max_depth': 7, 'learning_rate': 0.015221205831379703}. Best is trial 21 with value: 0.3951569944909734.
[I 2025-08-20 01:29:08,496] Trial 31 finished with value: 0.3962435765230772 and parameters: {'model_type': 'cat', 'iterations': 729, 'depth': 4, 'learning_rate': 0.03912833932897355}. Best is trial 31 with value: 0.3962435765230772.
[I 2025-08-20 01:29:14,481] Trial 32 finished with value: 0.39523048460897947 and parameters: {'model_type': 'cat', 'iterations': 720, 'depth': 4, 'learning_rate': 0.04555804429668707}. Best is trial 31 with value: 0.3962435765230772.
[I 2025-08-20 01:29:14,598] Trial 33 finished with value: 0.3818310384024083 and parameters: {'model_type': 'rf', 'n_estimators': 96, 'max_depth': 12, 'min_samples_split': 10}. Best is trial 31 with value: 0.3962435765230772.
[I 2025-08-20 01:29:14,698] Trial 34 finished with value: 0.37694505999152517 and parameters: {'model_type': 'lgbm', 'n_estimators': 198, 'max_depth': 5, 'learning_rate': 0.043757373635248294}. Best is trial 31 with value: 0.3962435765230772.
[I 2025-08-20 01:29:20,307] Trial 35 finished with value: 0.39473064512379075 and parameters: {'model_type': 'cat', 'iterations': 797, 'depth': 4, 'learning_rate': 0.06236442044204617}. Best is trial 31 with value: 0.3962435765230772.
[I 2025-08-20 01:29:20,435] Trial 36 finished with value: 0.3721776085435644 and parameters: {'model_type': 'lgbm', 'n_estimators': 175, 'max_depth': 8, 'learning_rate': 0.12453932425418361}. Best is trial 31 with value: 0.3962435765230772.
[I 2025-08-20 01:29:25,953] Trial 37 finished with value: 0.3853646395184288 and parameters: {'model_type': 'cat', 'iterations': 799, 'depth': 5, 'learning_rate': 0.08633687993020614}. Best is trial 31 with value: 0.3962435765230772.
[I 2025-08-20 01:29:25,965] Trial 38 finished with value: 0.29930683347423803 and parameters: {'model_type': 'bayesian_ridge', 'alpha_1': 0.000991668566080339, 'alpha_2': 1.248552939662307e-05, 'lambda_1': 0.00020752470813346718, 'lambda_2': 0.000996355568556046}. Best is trial 31 with value: 0.3962435765230772.
[I 2025-08-20 01:29:26,069] Trial 39 finished with value: 0.3827921228638832 and parameters: {'model_type': 'rf', 'n_estimators': 77, 'max_depth': 12, 'min_samples_split': 9}. Best is trial 31 with value: 0.3962435765230772.
[I 2025-08-20 01:29:31,952] Trial 40 finished with value: 0.3910766269046769 and parameters: {'model_type': 'cat', 'iterations': 731, 'depth': 6, 'learning_rate': 0.06201095279138454}. Best is trial 31 with value: 0.3962435765230772.
[I 2025-08-20 01:29:37,167] Trial 41 finished with value: 0.39532537336862716 and parameters: {'model_type': 'cat', 'iterations': 632, 'depth': 4, 'learning_rate': 0.0466311087073144}. Best is trial 31 with value: 0.3962435765230772.
[I 2025-08-20 01:29:42,584] Trial 42 finished with value: 0.3954729966607632 and parameters: {'model_type': 'cat', 'iterations': 738, 'depth': 4, 'learning_rate': 0.0605674150305746}. Best is trial 31 with value: 0.3962435765230772.
[I 2025-08-20 01:29:47,988] Trial 43 finished with value: 0.39510021102359194 and parameters: {'model_type': 'cat', 'iterations': 721, 'depth': 4, 'learning_rate': 0.04230320476262387}. Best is trial 31 with value: 0.3962435765230772.
[I 2025-08-20 01:29:53,331] Trial 44 finished with value: 0.3869736212042547 and parameters: {'model_type': 'cat', 'iterations': 656, 'depth': 5, 'learning_rate': 0.09337470009409439}. Best is trial 31 with value: 0.3962435765230772.
[I 2025-08-20 01:29:53,383] Trial 45 finished with value: 0.3810429763341132 and parameters: {'model_type': 'lgbm', 'n_estimators': 107, 'max_depth': 3, 'learning_rate': 0.1764528290388214}. Best is trial 31 with value: 0.3962435765230772.
[I 2025-08-20 01:29:58,866] Trial 46 finished with value: 0.3907504860266794 and parameters: {'model_type': 'cat', 'iterations': 742, 'depth': 4, 'learning_rate': 0.12024596023418216}. Best is trial 31 with value: 0.3962435765230772.
[I 2025-08-20 01:30:04,442] Trial 47 finished with value: 0.3905797538726725 and parameters: {'model_type': 'cat', 'iterations': 689, 'depth': 5, 'learning_rate': 0.22493240729900205}. Best is trial 31 with value: 0.3962435765230772.
[I 2025-08-20 01:30:04,624] Trial 48 finished with value: 0.38138353031333605 and parameters: {'model_type': 'rf', 'n_estimators': 170, 'max_depth': 11, 'min_samples_split': 2}. Best is trial 31 with value: 0.3962435765230772.
[I 2025-08-20 01:30:04,965] Trial 49 finished with value: 0.3583700859583714 and parameters: {'model_type': 'xgb', 'n_estimators': 71, 'max_depth': 6, 'learning_rate': 0.1534088319738694}. Best is trial 31 with value: 0.3962435765230772.
Regression Results:
  Train R²: 0.473
  Test R²: 0.396
  CV R²: 0.284 ± 0.131
Saved comparison to results/rxn_feature_comparison_hte_in_all_24_optuna.json

==================================================
ANALYSIS COMPLETE
==================================================
Check the following directories for outputs:
  - plots/: Visualization files
  - results/: Data files and reports
  - models/: Trained model files
