[I 2025-08-20 01:25:23,171] Trial 49 finished with value: 0.388025440131882 and parameters: {'model_type': 'cat', 'iterations': 535, 'depth': 10, 'learning_rate': 0.19768190844079356}. Best is trial 32 with value: 0.46235129252493323.
/home/passos/mambaforge/envs/hte-ml/lib/python3.10/multiprocessing/queues.py:122: UserWarning: pkg_resources is deprecated as an API. See https://setuptools.pypa.io/en/latest/pkg_resources.html. The pkg_resources package is slated for removal as early as 2025-11-30. Refrain from using this package or pin to Setuptools<81.
  return _ForkingPickler.loads(res)
/home/passos/mambaforge/envs/hte-ml/lib/python3.10/multiprocessing/queues.py:122: UserWarning: pkg_resources is deprecated as an API. See https://setuptools.pypa.io/en/latest/pkg_resources.html. The pkg_resources package is slated for removal as early as 2025-11-30. Refrain from using this package or pin to Setuptools<81.
  return _ForkingPickler.loads(res)
/home/passos/mambaforge/envs/hte-ml/lib/python3.10/multiprocessing/queues.py:122: UserWarning: pkg_resources is deprecated as an API. See https://setuptools.pypa.io/en/latest/pkg_resources.html. The pkg_resources package is slated for removal as early as 2025-11-30. Refrain from using this package or pin to Setuptools<81.
  return _ForkingPickler.loads(res)
/home/passos/mambaforge/envs/hte-ml/lib/python3.10/multiprocessing/queues.py:122: UserWarning: pkg_resources is deprecated as an API. See https://setuptools.pypa.io/en/latest/pkg_resources.html. The pkg_resources package is slated for removal as early as 2025-11-30. Refrain from using this package or pin to Setuptools<81.
  return _ForkingPickler.loads(res)
/home/passos/mambaforge/envs/hte-ml/lib/python3.10/multiprocessing/queues.py:122: UserWarning: pkg_resources is deprecated as an API. See https://setuptools.pypa.io/en/latest/pkg_resources.html. The pkg_resources package is slated for removal as early as 2025-11-30. Refrain from using this package or pin to Setuptools<81.
  return _ForkingPickler.loads(res)
/home/passos/mambaforge/envs/hte-ml/lib/python3.10/multiprocessing/queues.py:122: UserWarning: pkg_resources is deprecated as an API. See https://setuptools.pypa.io/en/latest/pkg_resources.html. The pkg_resources package is slated for removal as early as 2025-11-30. Refrain from using this package or pin to Setuptools<81.
  return _ForkingPickler.loads(res)
/home/passos/mambaforge/envs/hte-ml/lib/python3.10/multiprocessing/queues.py:122: UserWarning: pkg_resources is deprecated as an API. See https://setuptools.pypa.io/en/latest/pkg_resources.html. The pkg_resources package is slated for removal as early as 2025-11-30. Refrain from using this package or pin to Setuptools<81.
  return _ForkingPickler.loads(res)
/home/passos/mambaforge/envs/hte-ml/lib/python3.10/multiprocessing/queues.py:122: UserWarning: pkg_resources is deprecated as an API. See https://setuptools.pypa.io/en/latest/pkg_resources.html. The pkg_resources package is slated for removal as early as 2025-11-30. Refrain from using this package or pin to Setuptools<81.
  return _ForkingPickler.loads(res)
/home/passos/mambaforge/envs/hte-ml/lib/python3.10/multiprocessing/queues.py:122: UserWarning: pkg_resources is deprecated as an API. See https://setuptools.pypa.io/en/latest/pkg_resources.html. The pkg_resources package is slated for removal as early as 2025-11-30. Refrain from using this package or pin to Setuptools<81.
  return _ForkingPickler.loads(res)
/home/passos/mambaforge/envs/hte-ml/lib/python3.10/multiprocessing/queues.py:122: UserWarning: pkg_resources is deprecated as an API. See https://setuptools.pypa.io/en/latest/pkg_resources.html. The pkg_resources package is slated for removal as early as 2025-11-30. Refrain from using this package or pin to Setuptools<81.
  return _ForkingPickler.loads(res)
/home/passos/mambaforge/envs/hte-ml/lib/python3.10/multiprocessing/queues.py:122: UserWarning: pkg_resources is deprecated as an API. See https://setuptools.pypa.io/en/latest/pkg_resources.html. The pkg_resources package is slated for removal as early as 2025-11-30. Refrain from using this package or pin to Setuptools<81.
  return _ForkingPickler.loads(res)
/home/passos/mambaforge/envs/hte-ml/lib/python3.10/multiprocessing/queues.py:122: UserWarning: pkg_resources is deprecated as an API. See https://setuptools.pypa.io/en/latest/pkg_resources.html. The pkg_resources package is slated for removal as early as 2025-11-30. Refrain from using this package or pin to Setuptools<81.
  return _ForkingPickler.loads(res)
/home/passos/mambaforge/envs/hte-ml/lib/python3.10/multiprocessing/queues.py:122: UserWarning: pkg_resources is deprecated as an API. See https://setuptools.pypa.io/en/latest/pkg_resources.html. The pkg_resources package is slated for removal as early as 2025-11-30. Refrain from using this package or pin to Setuptools<81.
  return _ForkingPickler.loads(res)
/home/passos/mambaforge/envs/hte-ml/lib/python3.10/multiprocessing/queues.py:122: UserWarning: pkg_resources is deprecated as an API. See https://setuptools.pypa.io/en/latest/pkg_resources.html. The pkg_resources package is slated for removal as early as 2025-11-30. Refrain from using this package or pin to Setuptools<81.
  return _ForkingPickler.loads(res)
/home/passos/mambaforge/envs/hte-ml/lib/python3.10/multiprocessing/queues.py:122: UserWarning: pkg_resources is deprecated as an API. See https://setuptools.pypa.io/en/latest/pkg_resources.html. The pkg_resources package is slated for removal as early as 2025-11-30. Refrain from using this package or pin to Setuptools<81.
  return _ForkingPickler.loads(res)
Wrapped best model with Bagging ensemble: Bagging(Random Forest x15)
Regression Results:
  Train R²: 0.675
  Test R²: 0.458
  CV R²: 0.422 ± 0.152

=== Generating Visualizations ===
=== Evaluating Bagging(Random Forest x15) with Parity Plots ===
Model Performance:
  Train R²: 0.675, MAE: 0.385, RMSE: 0.512
  Test R²: 0.458, MAE: 0.544, RMSE: 0.730
Generating parity plots...
Parity plot saved as: plots/parity_plot_bagging(random_forest_x15)_train_in_all_24_optuna_train.png
Parity plot saved as: plots/parity_plot_bagging(random_forest_x15)_test_in_all_24_optuna_test.png
Parity analysis plot saved as: plots/parity_analysis_bagging(random_forest_x15)_test_in_all_24_optuna_analysis.png
HTE prediction evaluation report saved to results/reports/hte_prediction_report_manual_24_in_all_24_optuna.txt

=== Comparing without reaction-energy features (HTE prediction) ===
=== Building HTE Prediction Models with 24 features ===
Selected features: ['acyl_pka_lowest', 'acyl_Charges_Hs_avg_x_has_num_Hs', 'acyl_BV_Hs_avg', 'acyl_num_Hs_x_has_num_Hs', 'acyl_has_acidic_H_for_pka_lowest', 'acyl_fukui_N_Hs_avg', 'acyl_pka_aHs', 'acyl_Charges_main_atom', 'int_pka_basic_minus_pka_lowest', 'acyl_BV_secondary_avg', 'acyl_pka_aHs_x_has_pKa_features', 'acyl_fukui_E_Hs_avg', 'int_pka_basic_minus_pka_aHs', 'acyl_BV_secondary_2', 'acyl_has_pKa_features', 'acyl_num_Hs', 'int_BV_secondary_prod', 'acyl_Charges_Hs_avg', 'acyl_BV_Hs_avg_x_has_num_Hs', 'acyl_has_acidic_H_for_pka_aHs', 'acyl_has_num_Hs', 'acyl_Charges_secondary_2', 'acyl_pka_aHs_x_has_acidic_H', 'acyl_fukui_E_secondary_2']
Valid features: 21
=== Building Regression Model ===
Regression dataset: (1031, 21)
Target range: -1.418 to 4.010


Training data: 617 samples
Test data: 234 samples


/home/passos/mambaforge/envs/hte-ml/lib/python3.10/multiprocessing/queues.py:122: UserWarning: pkg_resources is deprecated as an API. See https://setuptools.pypa.io/en/latest/pkg_resources.html. The pkg_resources package is slated for removal as early as 2025-11-30. Refrain from using this package or pin to Setuptools<81.
  return _ForkingPickler.loads(res)
/home/passos/mambaforge/envs/hte-ml/lib/python3.10/multiprocessing/queues.py:122: UserWarning: pkg_resources is deprecated as an API. See https://setuptools.pypa.io/en/latest/pkg_resources.html. The pkg_resources package is slated for removal as early as 2025-11-30. Refrain from using this package or pin to Setuptools<81.
  return _ForkingPickler.loads(res)
/home/passos/mambaforge/envs/hte-ml/lib/python3.10/multiprocessing/queues.py:122: UserWarning: pkg_resources is deprecated as an API. See https://setuptools.pypa.io/en/latest/pkg_resources.html. The pkg_resources package is slated for removal as early as 2025-11-30. Refrain from using this package or pin to Setuptools<81.
  return _ForkingPickler.loads(res)
/home/passos/mambaforge/envs/hte-ml/lib/python3.10/multiprocessing/queues.py:122: UserWarning: pkg_resources is deprecated as an API. See https://setuptools.pypa.io/en/latest/pkg_resources.html. The pkg_resources package is slated for removal as early as 2025-11-30. Refrain from using this package or pin to Setuptools<81.
  return _ForkingPickler.loads(res)
/home/passos/mambaforge/envs/hte-ml/lib/python3.10/multiprocessing/queues.py:122: UserWarning: pkg_resources is deprecated as an API. See https://setuptools.pypa.io/en/latest/pkg_resources.html. The pkg_resources package is slated for removal as early as 2025-11-30. Refrain from using this package or pin to Setuptools<81.
  return _ForkingPickler.loads(res)
/home/passos/mambaforge/envs/hte-ml/lib/python3.10/multiprocessing/queues.py:122: UserWarning: pkg_resources is deprecated as an API. See https://setuptools.pypa.io/en/latest/pkg_resources.html. The pkg_resources package is slated for removal as early as 2025-11-30. Refrain from using this package or pin to Setuptools<81.
  return _ForkingPickler.loads(res)
/home/passos/mambaforge/envs/hte-ml/lib/python3.10/multiprocessing/queues.py:122: UserWarning: pkg_resources is deprecated as an API. See https://setuptools.pypa.io/en/latest/pkg_resources.html. The pkg_resources package is slated for removal as early as 2025-11-30. Refrain from using this package or pin to Setuptools<81.
  return _ForkingPickler.loads(res)
/home/passos/mambaforge/envs/hte-ml/lib/python3.10/multiprocessing/queues.py:122: UserWarning: pkg_resources is deprecated as an API. See https://setuptools.pypa.io/en/latest/pkg_resources.html. The pkg_resources package is slated for removal as early as 2025-11-30. Refrain from using this package or pin to Setuptools<81.
  return _ForkingPickler.loads(res)
/home/passos/mambaforge/envs/hte-ml/lib/python3.10/multiprocessing/queues.py:122: UserWarning: pkg_resources is deprecated as an API. See https://setuptools.pypa.io/en/latest/pkg_resources.html. The pkg_resources package is slated for removal as early as 2025-11-30. Refrain from using this package or pin to Setuptools<81.
  return _ForkingPickler.loads(res)
/home/passos/mambaforge/envs/hte-ml/lib/python3.10/multiprocessing/queues.py:122: UserWarning: pkg_resources is deprecated as an API. See https://setuptools.pypa.io/en/latest/pkg_resources.html. The pkg_resources package is slated for removal as early as 2025-11-30. Refrain from using this package or pin to Setuptools<81.
  return _ForkingPickler.loads(res)
/home/passos/mambaforge/envs/hte-ml/lib/python3.10/multiprocessing/queues.py:122: UserWarning: pkg_resources is deprecated as an API. See https://setuptools.pypa.io/en/latest/pkg_resources.html. The pkg_resources package is slated for removal as early as 2025-11-30. Refrain from using this package or pin to Setuptools<81.
  return _ForkingPickler.loads(res)
/home/passos/mambaforge/envs/hte-ml/lib/python3.10/multiprocessing/queues.py:122: UserWarning: pkg_resources is deprecated as an API. See https://setuptools.pypa.io/en/latest/pkg_resources.html. The pkg_resources package is slated for removal as early as 2025-11-30. Refrain from using this package or pin to Setuptools<81.
  return _ForkingPickler.loads(res)
/home/passos/mambaforge/envs/hte-ml/lib/python3.10/multiprocessing/queues.py:122: UserWarning: pkg_resources is deprecated as an API. See https://setuptools.pypa.io/en/latest/pkg_resources.html. The pkg_resources package is slated for removal as early as 2025-11-30. Refrain from using this package or pin to Setuptools<81.
  return _ForkingPickler.loads(res)
/home/passos/mambaforge/envs/hte-ml/lib/python3.10/multiprocessing/queues.py:122: UserWarning: pkg_resources is deprecated as an API. See https://setuptools.pypa.io/en/latest/pkg_resources.html. The pkg_resources package is slated for removal as early as 2025-11-30. Refrain from using this package or pin to Setuptools<81.
  return _ForkingPickler.loads(res)
/home/passos/mambaforge/envs/hte-ml/lib/python3.10/multiprocessing/queues.py:122: UserWarning: pkg_resources is deprecated as an API. See https://setuptools.pypa.io/en/latest/pkg_resources.html. The pkg_resources package is slated for removal as early as 2025-11-30. Refrain from using this package or pin to Setuptools<81.
  return _ForkingPickler.loads(res)
/home/passos/mambaforge/envs/hte-ml/lib/python3.10/multiprocessing/queues.py:122: UserWarning: pkg_resources is deprecated as an API. See https://setuptools.pypa.io/en/latest/pkg_resources.html. The pkg_resources package is slated for removal as early as 2025-11-30. Refrain from using this package or pin to Setuptools<81.
  return _ForkingPickler.loads(res)
/home/passos/mambaforge/envs/hte-ml/lib/python3.10/multiprocessing/queues.py:122: UserWarning: pkg_resources is deprecated as an API. See https://setuptools.pypa.io/en/latest/pkg_resources.html. The pkg_resources package is slated for removal as early as 2025-11-30. Refrain from using this package or pin to Setuptools<81.
  return _ForkingPickler.loads(res)
/home/passos/mambaforge/envs/hte-ml/lib/python3.10/multiprocessing/queues.py:122: UserWarning: pkg_resources is deprecated as an API. See https://setuptools.pypa.io/en/latest/pkg_resources.html. The pkg_resources package is slated for removal as early as 2025-11-30. Refrain from using this package or pin to Setuptools<81.
  return _ForkingPickler.loads(res)
/home/passos/mambaforge/envs/hte-ml/lib/python3.10/multiprocessing/queues.py:122: UserWarning: pkg_resources is deprecated as an API. See https://setuptools.pypa.io/en/latest/pkg_resources.html. The pkg_resources package is slated for removal as early as 2025-11-30. Refrain from using this package or pin to Setuptools<81.
  return _ForkingPickler.loads(res)
/home/passos/mambaforge/envs/hte-ml/lib/python3.10/multiprocessing/queues.py:122: UserWarning: pkg_resources is deprecated as an API. See https://setuptools.pypa.io/en/latest/pkg_resources.html. The pkg_resources package is slated for removal as early as 2025-11-30. Refrain from using this package or pin to Setuptools<81.
  return _ForkingPickler.loads(res)
/home/passos/mambaforge/envs/hte-ml/lib/python3.10/multiprocessing/queues.py:122: UserWarning: pkg_resources is deprecated as an API. See https://setuptools.pypa.io/en/latest/pkg_resources.html. The pkg_resources package is slated for removal as early as 2025-11-30. Refrain from using this package or pin to Setuptools<81.
  return _ForkingPickler.loads(res)
/home/passos/mambaforge/envs/hte-ml/lib/python3.10/multiprocessing/queues.py:122: UserWarning: pkg_resources is deprecated as an API. See https://setuptools.pypa.io/en/latest/pkg_resources.html. The pkg_resources package is slated for removal as early as 2025-11-30. Refrain from using this package or pin to Setuptools<81.
  return _ForkingPickler.loads(res)
/home/passos/mambaforge/envs/hte-ml/lib/python3.10/multiprocessing/queues.py:122: UserWarning: pkg_resources is deprecated as an API. See https://setuptools.pypa.io/en/latest/pkg_resources.html. The pkg_resources package is slated for removal as early as 2025-11-30. Refrain from using this package or pin to Setuptools<81.
  return _ForkingPickler.loads(res)
/home/passos/mambaforge/envs/hte-ml/lib/python3.10/multiprocessing/queues.py:122: UserWarning: pkg_resources is deprecated as an API. See https://setuptools.pypa.io/en/latest/pkg_resources.html. The pkg_resources package is slated for removal as early as 2025-11-30. Refrain from using this package or pin to Setuptools<81.
  return _ForkingPickler.loads(res)
/home/passos/mambaforge/envs/hte-ml/lib/python3.10/multiprocessing/queues.py:122: UserWarning: pkg_resources is deprecated as an API. See https://setuptools.pypa.io/en/latest/pkg_resources.html. The pkg_resources package is slated for removal as early as 2025-11-30. Refrain from using this package or pin to Setuptools<81.
  return _ForkingPickler.loads(res)
/home/passos/mambaforge/envs/hte-ml/lib/python3.10/multiprocessing/queues.py:122: UserWarning: pkg_resources is deprecated as an API. See https://setuptools.pypa.io/en/latest/pkg_resources.html. The pkg_resources package is slated for removal as early as 2025-11-30. Refrain from using this package or pin to Setuptools<81.
  return _ForkingPickler.loads(res)
/home/passos/mambaforge/envs/hte-ml/lib/python3.10/multiprocessing/queues.py:122: UserWarning: pkg_resources is deprecated as an API. See https://setuptools.pypa.io/en/latest/pkg_resources.html. The pkg_resources package is slated for removal as early as 2025-11-30. Refrain from using this package or pin to Setuptools<81.
  return _ForkingPickler.loads(res)
/home/passos/mambaforge/envs/hte-ml/lib/python3.10/multiprocessing/queues.py:122: UserWarning: pkg_resources is deprecated as an API. See https://setuptools.pypa.io/en/latest/pkg_resources.html. The pkg_resources package is slated for removal as early as 2025-11-30. Refrain from using this package or pin to Setuptools<81.
  return _ForkingPickler.loads(res)
/home/passos/mambaforge/envs/hte-ml/lib/python3.10/multiprocessing/queues.py:122: UserWarning: pkg_resources is deprecated as an API. See https://setuptools.pypa.io/en/latest/pkg_resources.html. The pkg_resources package is slated for removal as early as 2025-11-30. Refrain from using this package or pin to Setuptools<81.
  return _ForkingPickler.loads(res)
/home/passos/mambaforge/envs/hte-ml/lib/python3.10/multiprocessing/queues.py:122: UserWarning: pkg_resources is deprecated as an API. See https://setuptools.pypa.io/en/latest/pkg_resources.html. The pkg_resources package is slated for removal as early as 2025-11-30. Refrain from using this package or pin to Setuptools<81.
  return _ForkingPickler.loads(res)
/home/passos/mambaforge/envs/hte-ml/lib/python3.10/multiprocessing/queues.py:122: UserWarning: pkg_resources is deprecated as an API. See https://setuptools.pypa.io/en/latest/pkg_resources.html. The pkg_resources package is slated for removal as early as 2025-11-30. Refrain from using this package or pin to Setuptools<81.
  return _ForkingPickler.loads(res)
/home/passos/mambaforge/envs/hte-ml/lib/python3.10/multiprocessing/queues.py:122: UserWarning: pkg_resources is deprecated as an API. See https://setuptools.pypa.io/en/latest/pkg_resources.html. The pkg_resources package is slated for removal as early as 2025-11-30. Refrain from using this package or pin to Setuptools<81.
  return _ForkingPickler.loads(res)
/home/passos/mambaforge/envs/hte-ml/lib/python3.10/multiprocessing/queues.py:122: UserWarning: pkg_resources is deprecated as an API. See https://setuptools.pypa.io/en/latest/pkg_resources.html. The pkg_resources package is slated for removal as early as 2025-11-30. Refrain from using this package or pin to Setuptools<81.
  return _ForkingPickler.loads(res)
/home/passos/mambaforge/envs/hte-ml/lib/python3.10/multiprocessing/queues.py:122: UserWarning: pkg_resources is deprecated as an API. See https://setuptools.pypa.io/en/latest/pkg_resources.html. The pkg_resources package is slated for removal as early as 2025-11-30. Refrain from using this package or pin to Setuptools<81.
  return _ForkingPickler.loads(res)
/home/passos/mambaforge/envs/hte-ml/lib/python3.10/multiprocessing/queues.py:122: UserWarning: pkg_resources is deprecated as an API. See https://setuptools.pypa.io/en/latest/pkg_resources.html. The pkg_resources package is slated for removal as early as 2025-11-30. Refrain from using this package or pin to Setuptools<81.
  return _ForkingPickler.loads(res)
/home/passos/mambaforge/envs/hte-ml/lib/python3.10/multiprocessing/queues.py:122: UserWarning: pkg_resources is deprecated as an API. See https://setuptools.pypa.io/en/latest/pkg_resources.html. The pkg_resources package is slated for removal as early as 2025-11-30. Refrain from using this package or pin to Setuptools<81.
  return _ForkingPickler.loads(res)
/home/passos/mambaforge/envs/hte-ml/lib/python3.10/multiprocessing/queues.py:122: UserWarning: pkg_resources is deprecated as an API. See https://setuptools.pypa.io/en/latest/pkg_resources.html. The pkg_resources package is slated for removal as early as 2025-11-30. Refrain from using this package or pin to Setuptools<81.
  return _ForkingPickler.loads(res)
/home/passos/mambaforge/envs/hte-ml/lib/python3.10/multiprocessing/queues.py:122: UserWarning: pkg_resources is deprecated as an API. See https://setuptools.pypa.io/en/latest/pkg_resources.html. The pkg_resources package is slated for removal as early as 2025-11-30. Refrain from using this package or pin to Setuptools<81.
  return _ForkingPickler.loads(res)
/home/passos/mambaforge/envs/hte-ml/lib/python3.10/multiprocessing/queues.py:122: UserWarning: pkg_resources is deprecated as an API. See https://setuptools.pypa.io/en/latest/pkg_resources.html. The pkg_resources package is slated for removal as early as 2025-11-30. Refrain from using this package or pin to Setuptools<81.
  return _ForkingPickler.loads(res)
/home/passos/mambaforge/envs/hte-ml/lib/python3.10/multiprocessing/queues.py:122: UserWarning: pkg_resources is deprecated as an API. See https://setuptools.pypa.io/en/latest/pkg_resources.html. The pkg_resources package is slated for removal as early as 2025-11-30. Refrain from using this package or pin to Setuptools<81.
  return _ForkingPickler.loads(res)
/home/passos/mambaforge/envs/hte-ml/lib/python3.10/multiprocessing/queues.py:122: UserWarning: pkg_resources is deprecated as an API. See https://setuptools.pypa.io/en/latest/pkg_resources.html. The pkg_resources package