[I 2025-08-20 01:24:43,094] Trial 0 finished with value: 0.45320264340061267 and parameters: {'model_type': 'rf', 'n_estimators': 107, 'max_depth': 6, 'min_samples_split': 10}. Best is trial 0 with value: 0.45320264340061267.
[I 2025-08-20 01:24:43,146] Trial 1 finished with value: 0.35183805660844325 and parameters: {'model_type': 'bayesian_ridge', 'alpha_1': 0.00037707353542287266, 'alpha_2': 0.000952280025298936, 'lambda_1': 0.0008632192524523568, 'lambda_2': 0.00030043102132434207}. Best is trial 0 with value: 0.45320264340061267.
[I 2025-08-20 01:24:43,392] Trial 2 finished with value: 0.37316347316389664 and parameters: {'model_type': 'lgbm', 'n_estimators': 103, 'max_depth': 4, 'learning_rate': 0.23289040456181526}. Best is trial 0 with value: 0.45320264340061267.
[I 2025-08-20 01:24:43,860] Trial 3 finished with value: 0.4361283819046945 and parameters: {'model_type': 'rf', 'n_estimators': 160, 'max_depth': 8, 'min_samples_split': 5}. Best is trial 0 with value: 0.45320264340061267.
[I 2025-08-20 01:24:43,865] Trial 4 finished with value: 0.3518424681752863 and parameters: {'model_type': 'bayesian_ridge', 'alpha_1': 4.366898914210831e-06, 'alpha_2': 0.0006939471213797101, 'lambda_1': 0.0006445851414230691, 'lambda_2': 0.0007675002753100466}. Best is trial 0 with value: 0.45320264340061267.
[I 2025-08-20 01:24:44,205] Trial 5 finished with value: 0.45816984403476146 and parameters: {'model_type': 'rf', 'n_estimators': 141, 'max_depth': 6, 'min_samples_split': 10}. Best is trial 5 with value: 0.45816984403476146.
[I 2025-08-20 01:24:44,801] Trial 6 finished with value: 0.373364430260708 and parameters: {'model_type': 'xgb', 'n_estimators': 84, 'max_depth': 4, 'learning_rate': 0.2431609025473056}. Best is trial 5 with value: 0.45816984403476146.
[I 2025-08-20 01:24:48,192] Trial 7 finished with value: 0.3886678119869079 and parameters: {'model_type': 'cat', 'iterations': 726, 'depth': 4, 'learning_rate': 0.25477083159450065}. Best is trial 5 with value: 0.45816984403476146.
[I 2025-08-20 01:24:49,229] Trial 8 finished with value: 0.37533971188672854 and parameters: {'model_type': 'xgb', 'n_estimators': 160, 'max_depth': 7, 'learning_rate': 0.05496498270011775}. Best is trial 5 with value: 0.45816984403476146.
[I 2025-08-20 01:24:49,349] Trial 9 finished with value: 0.32543050897558967 and parameters: {'model_type': 'lgbm', 'n_estimators': 159, 'max_depth': 4, 'learning_rate': 0.2511884773252012}. Best is trial 5 with value: 0.45816984403476146.
[I 2025-08-20 01:24:49,948] Trial 10 finished with value: 0.43755534044533906 and parameters: {'model_type': 'rf', 'n_estimators': 199, 'max_depth': 12, 'min_samples_split': 10}. Best is trial 5 with value: 0.45816984403476146.
[I 2025-08-20 01:24:50,086] Trial 11 finished with value: 0.44421900318175556 and parameters: {'model_type': 'rf', 'n_estimators': 56, 'max_depth': 7, 'min_samples_split': 10}. Best is trial 5 with value: 0.45816984403476146.
[I 2025-08-20 01:24:50,416] Trial 12 finished with value: 0.43753051136575094 and parameters: {'model_type': 'rf', 'n_estimators': 121, 'max_depth': 10, 'min_samples_split': 9}. Best is trial 5 with value: 0.45816984403476146.
[I 2025-08-20 01:24:50,706] Trial 13 finished with value: 0.4563481831808244 and parameters: {'model_type': 'rf', 'n_estimators': 131, 'max_depth': 6, 'min_samples_split': 2}. Best is trial 5 with value: 0.45816984403476146.
[I 2025-08-20 01:24:51,861] Trial 14 finished with value: 0.43997949622486987 and parameters: {'model_type': 'cat', 'iterations': 208, 'depth': 10, 'learning_rate': 0.02976951519543966}. Best is trial 5 with value: 0.45816984403476146.
[I 2025-08-20 01:24:52,362] Trial 15 finished with value: 0.42522065409626186 and parameters: {'model_type': 'rf', 'n_estimators': 142, 'max_depth': 14, 'min_samples_split': 2}. Best is trial 5 with value: 0.45816984403476146.
[I 2025-08-20 01:24:52,897] Trial 16 finished with value: 0.4313103073022956 and parameters: {'model_type': 'rf', 'n_estimators': 192, 'max_depth': 10, 'min_samples_split': 6}. Best is trial 5 with value: 0.45816984403476146.
[I 2025-08-20 01:24:53,201] Trial 17 finished with value: 0.4556143367852643 and parameters: {'model_type': 'rf', 'n_estimators': 134, 'max_depth': 6, 'min_samples_split': 2}. Best is trial 5 with value: 0.45816984403476146.
[I 2025-08-20 01:24:53,212] Trial 18 finished with value: 0.351836977890874 and parameters: {'model_type': 'bayesian_ridge', 'alpha_1': 0.0008911002642321539, 'alpha_2': 3.424916563054219e-05, 'lambda_1': 3.121576411240596e-05, 'lambda_2': 3.510973130149876e-05}. Best is trial 5 with value: 0.45816984403476146.
[I 2025-08-20 01:24:54,911] Trial 19 finished with value: 0.37864879207677626 and parameters: {'model_type': 'cat', 'iterations': 365, 'depth': 7, 'learning_rate': 0.1287830719939567}. Best is trial 5 with value: 0.45816984403476146.
[I 2025-08-20 01:24:55,032] Trial 20 finished with value: 0.3286488588636325 and parameters: {'model_type': 'lgbm', 'n_estimators': 178, 'max_depth': 5, 'learning_rate': 0.14954590717492}. Best is trial 5 with value: 0.45816984403476146.
[I 2025-08-20 01:24:55,376] Trial 21 finished with value: 0.45609821697287756 and parameters: {'model_type': 'rf', 'n_estimators': 135, 'max_depth': 6, 'min_samples_split': 2}. Best is trial 5 with value: 0.45816984403476146.
[I 2025-08-20 01:24:55,590] Trial 22 finished with value: 0.44254417136728175 and parameters: {'model_type': 'rf', 'n_estimators': 140, 'max_depth': 3, 'min_samples_split': 4}. Best is trial 5 with value: 0.45816984403476146.
[I 2025-08-20 01:24:55,920] Trial 23 finished with value: 0.4285532581548902 and parameters: {'model_type': 'rf', 'n_estimators': 115, 'max_depth': 9, 'min_samples_split': 3}. Best is trial 5 with value: 0.45816984403476146.
[I 2025-08-20 01:24:56,240] Trial 24 finished with value: 0.45533575338529453 and parameters: {'model_type': 'rf', 'n_estimators': 148, 'max_depth': 6, 'min_samples_split': 8}. Best is trial 5 with value: 0.45816984403476146.
[I 2025-08-20 01:24:56,641] Trial 25 finished with value: 0.44786117381010504 and parameters: {'model_type': 'xgb', 'n_estimators': 88, 'max_depth': 5, 'learning_rate': 0.09404265962747257}. Best is trial 5 with value: 0.45816984403476146.
[I 2025-08-20 01:24:57,017] Trial 26 finished with value: 0.43904489541133385 and parameters: {'model_type': 'rf', 'n_estimators': 130, 'max_depth': 8, 'min_samples_split': 7}. Best is trial 5 with value: 0.45816984403476146.
[I 2025-08-20 01:24:57,350] Trial 27 finished with value: 0.43514468906705317 and parameters: {'model_type': 'rf', 'n_estimators': 125, 'max_depth': 8, 'min_samples_split': 4}. Best is trial 5 with value: 0.45816984403476146.
[I 2025-08-20 01:24:57,611] Trial 28 finished with value: 0.44368354888590744 and parameters: {'model_type': 'rf', 'n_estimators': 177, 'max_depth': 3, 'min_samples_split': 3}. Best is trial 5 with value: 0.45816984403476146.
[I 2025-08-20 01:24:57,983] Trial 29 finished with value: 0.44949665396915117 and parameters: {'model_type': 'rf', 'n_estimators': 152, 'max_depth': 7, 'min_samples_split': 2}. Best is trial 5 with value: 0.45816984403476146.
[I 2025-08-20 01:25:01,232] Trial 30 finished with value: 0.3885034469369084 and parameters: {'model_type': 'cat', 'iterations': 778, 'depth': 4, 'learning_rate': 0.19123157359670712}. Best is trial 5 with value: 0.45816984403476146.
[I 2025-08-20 01:25:01,550] Trial 31 finished with value: 0.45646372660266676 and parameters: {'model_type': 'rf', 'n_estimators': 140, 'max_depth': 6, 'min_samples_split': 2}. Best is trial 5 with value: 0.45816984403476146.
[I 2025-08-20 01:25:01,809] Trial 32 finished with value: 0.46235129252493323 and parameters: {'model_type': 'rf', 'n_estimators': 132, 'max_depth': 5, 'min_samples_split': 3}. Best is trial 32 with value: 0.46235129252493323.
[I 2025-08-20 01:25:01,822] Trial 33 finished with value: 0.35184524138538964 and parameters: {'model_type': 'bayesian_ridge', 'alpha_1': 0.000947015067849612, 'alpha_2': 0.00013302762110835065, 'lambda_1': 0.00012592514874170524, 'lambda_2': 0.0009928566963270566}. Best is trial 32 with value: 0.46235129252493323.
[I 2025-08-20 01:25:01,885] Trial 34 finished with value: 0.29196272398431133 and parameters: {'model_type': 'lgbm', 'n_estimators': 112, 'max_depth': 5, 'learning_rate': 0.2962029372943005}. Best is trial 32 with value: 0.46235129252493323.
[I 2025-08-20 01:25:02,104] Trial 35 finished with value: 0.45775404838034794 and parameters: {'model_type': 'rf', 'n_estimators': 92, 'max_depth': 5, 'min_samples_split': 3}. Best is trial 32 with value: 0.46235129252493323.
[I 2025-08-20 01:25:02,262] Trial 36 finished with value: 0.4588600933013929 and parameters: {'model_type': 'rf', 'n_estimators': 85, 'max_depth': 4, 'min_samples_split': 4}. Best is trial 32 with value: 0.46235129252493323.
[I 2025-08-20 01:25:02,574] Trial 37 finished with value: 0.40486595718036655 and parameters: {'model_type': 'xgb', 'n_estimators': 67, 'max_depth': 5, 'learning_rate': 0.1887684172366115}. Best is trial 32 with value: 0.46235129252493323.
[I 2025-08-20 01:25:02,590] Trial 38 finished with value: 0.35184080709794285 and parameters: {'model_type': 'bayesian_ridge', 'alpha_1': 0.0005245484939182105, 'alpha_2': 0.00045214176722819003, 'lambda_1': 0.0003957624172916157, 'lambda_2': 0.0005341063454809855}. Best is trial 32 with value: 0.46235129252493323.
[I 2025-08-20 01:25:02,779] Trial 39 finished with value: 0.4420657940314441 and parameters: {'model_type': 'rf', 'n_estimators': 98, 'max_depth': 3, 'min_samples_split': 4}. Best is trial 32 with value: 0.46235129252493323.
[I 2025-08-20 01:25:02,834] Trial 40 finished with value: 0.40679288262929536 and parameters: {'model_type': 'lgbm', 'n_estimators': 74, 'max_depth': 4, 'learning_rate': 0.08560606538488724}. Best is trial 32 with value: 0.46235129252493323.
[I 2025-08-20 01:25:03,070] Trial 41 finished with value: 0.45799609245545636 and parameters: {'model_type': 'rf', 'n_estimators': 95, 'max_depth': 5, 'min_samples_split': 3}. Best is trial 32 with value: 0.46235129252493323.
[I 2025-08-20 01:25:03,243] Trial 42 finished with value: 0.4608612119602852 and parameters: {'model_type': 'rf', 'n_estimators': 94, 'max_depth': 4, 'min_samples_split': 3}. Best is trial 32 with value: 0.46235129252493323.
[I 2025-08-20 01:25:03,428] Trial 43 finished with value: 0.45992288875571574 and parameters: {'model_type': 'rf', 'n_estimators': 103, 'max_depth': 4, 'min_samples_split': 5}. Best is trial 32 with value: 0.46235129252493323.
[I 2025-08-20 01:25:03,611] Trial 44 finished with value: 0.46015923545524573 and parameters: {'model_type': 'rf', 'n_estimators': 104, 'max_depth': 4, 'min_samples_split': 5}. Best is trial 32 with value: 0.46235129252493323.
[I 2025-08-20 01:25:03,767] Trial 45 finished with value: 0.442526046675087 and parameters: {'model_type': 'rf', 'n_estimators': 106, 'max_depth': 3, 'min_samples_split': 5}. Best is trial 32 with value: 0.46235129252493323.
[I 2025-08-20 01:25:03,893] Trial 46 finished with value: 0.36241416814833904 and parameters: {'model_type': 'xgb', 'n_estimators': 81, 'max_depth': 4, 'learning_rate': 0.01129694274902765}. Best is trial 32 with value: 0.46235129252493323.
[I 2025-08-20 01:25:04,118] Trial 47 finished with value: 0.4598227854964587 and parameters: {'model_type': 'rf', 'n_estimators': 105, 'max_depth': 4, 'min_samples_split': 5}. Best is trial 32 with value: 0.46235129252493323.
[I 2025-08-20 01:25:04,282] Trial 48 finished with value: 0.4423267758963997 and parameters: {'model_type': 'rf', 'n_estimators': 105, 'max_depth': 3, 'min_samples_split': 5}. Best is trial 32 with value: 0.46235129252493323.
