[I 2025-08-20 11:48:03,962] Trial 15 finished with value: 0.7678840391986628 and parameters: {'model_type': 'lgbm', 'n_estimators': 164, 'max_depth': 9, 'learning_rate': 0.17869234220893834}. Best is trial 0 with value: 0.7984100669271332.
[I 2025-08-20 11:48:04,209] Trial 16 finished with value: 0.7948268547464155 and parameters: {'model_type': 'rf', 'n_estimators': 135, 'max_depth': 13, 'min_samples_split': 3}. Best is trial 0 with value: 0.7984100669271332.
[I 2025-08-20 11:48:04,342] Trial 17 finished with value: 0.7899922890693718 and parameters: {'model_type': 'rf', 'n_estimators': 84, 'max_depth': 10, 'min_samples_split': 8}. Best is trial 0 with value: 0.7984100669271332.
[I 2025-08-20 11:48:04,625] Trial 18 finished with value: 0.7977389413683285 and parameters: {'model_type': 'rf', 'n_estimators': 168, 'max_depth': 14, 'min_samples_split': 4}. Best is trial 0 with value: 0.7984100669271332.
[I 2025-08-20 11:48:04,690] Trial 19 finished with value: 0.796481444139909 and parameters: {'model_type': 'lgbm', 'n_estimators': 166, 'max_depth': 5, 'learning_rate': 0.16111280359577296}. Best is trial 0 with value: 0.7984100669271332.
[I 2025-08-20 11:48:09,028] Trial 20 finished with value: 0.7702450024413019 and parameters: {'model_type': 'cat', 'iterations': 791, 'depth': 5, 'learning_rate': 0.21825076102730956}. Best is trial 0 with value: 0.7984100669271332.
[I 2025-08-20 11:48:09,361] Trial 21 finished with value: 0.7984950241095401 and parameters: {'model_type': 'rf', 'n_estimators': 176, 'max_depth': 14, 'min_samples_split': 4}. Best is trial 21 with value: 0.7984950241095401.
[I 2025-08-20 11:48:09,690] Trial 22 finished with value: 0.7945260781728611 and parameters: {'model_type': 'rf', 'n_estimators': 184, 'max_depth': 14, 'min_samples_split': 3}. Best is trial 21 with value: 0.7984950241095401.
[I 2025-08-20 11:48:09,972] Trial 23 finished with value: 0.798531286235353 and parameters: {'model_type': 'rf', 'n_estimators': 167, 'max_depth': 14, 'min_samples_split': 4}. Best is trial 23 with value: 0.798531286235353.
[I 2025-08-20 11:48:10,173] Trial 24 finished with value: 0.7973629689212041 and parameters: {'model_type': 'rf', 'n_estimators': 127, 'max_depth': 15, 'min_samples_split': 7}. Best is trial 23 with value: 0.798531286235353.
[I 2025-08-20 11:48:10,182] Trial 25 finished with value: 0.45777867118800064 and parameters: {'model_type': 'bayesian_ridge', 'alpha_1': 0.0009892239573928826, 'alpha_2': 0.0009207179188061769, 'lambda_1': 1.3475007532694834e-05, 'lambda_2': 1.5091976982122056e-05}. Best is trial 23 with value: 0.798531286235353.
[I 2025-08-20 11:48:10,518] Trial 26 finished with value: 0.7965758307057129 and parameters: {'model_type': 'rf', 'n_estimators': 200, 'max_depth': 13, 'min_samples_split': 4}. Best is trial 23 with value: 0.798531286235353.
[I 2025-08-20 11:48:10,809] Trial 27 finished with value: 0.7951861302250893 and parameters: {'model_type': 'rf', 'n_estimators': 177, 'max_depth': 11, 'min_samples_split': 4}. Best is trial 23 with value: 0.798531286235353.
[I 2025-08-20 11:48:11,055] Trial 28 finished with value: 0.7971219437946331 and parameters: {'model_type': 'rf', 'n_estimators': 152, 'max_depth': 14, 'min_samples_split': 6}. Best is trial 23 with value: 0.798531286235353.
[I 2025-08-20 11:48:11,351] Trial 29 finished with value: 0.78235942291357 and parameters: {'model_type': 'xgb', 'n_estimators': 134, 'max_depth': 8, 'learning_rate': 0.11085695509704016}. Best is trial 23 with value: 0.798531286235353.
[I 2025-08-20 11:48:12,344] Trial 30 finished with value: 0.7842839207555462 and parameters: {'model_type': 'cat', 'iterations': 205, 'depth': 10, 'learning_rate': 0.11855008209599692}. Best is trial 23 with value: 0.798531286235353.
[I 2025-08-20 11:48:12,638] Trial 31 finished with value: 0.7972078485319166 and parameters: {'model_type': 'rf', 'n_estimators': 171, 'max_depth': 14, 'min_samples_split': 4}. Best is trial 23 with value: 0.798531286235353.
[I 2025-08-20 11:48:12,910] Trial 32 finished with value: 0.7956232503254349 and parameters: {'model_type': 'rf', 'n_estimators': 158, 'max_depth': 12, 'min_samples_split': 3}. Best is trial 23 with value: 0.798531286235353.
[I 2025-08-20 11:48:13,211] Trial 33 finished with value: 0.7981495402523403 and parameters: {'model_type': 'rf', 'n_estimators': 177, 'max_depth': 14, 'min_samples_split': 4}. Best is trial 23 with value: 0.798531286235353.
[I 2025-08-20 11:48:15,455] Trial 34 finished with value: 0.7642597247163497 and parameters: {'model_type': 'xgb', 'n_estimators': 190, 'max_depth': 9, 'learning_rate': 0.20854545144352943}. Best is trial 23 with value: 0.798531286235353.
[I 2025-08-20 11:48:15,749] Trial 35 finished with value: 0.7953023068956864 and parameters: {'model_type': 'rf', 'n_estimators': 177, 'max_depth': 13, 'min_samples_split': 5}. Best is trial 23 with value: 0.798531286235353.
[I 2025-08-20 11:48:18,274] Trial 36 finished with value: 0.800892188155947 and parameters: {'model_type': 'cat', 'iterations': 225, 'depth': 7, 'learning_rate': 0.2949069384897939}. Best is trial 36 with value: 0.800892188155947.
[I 2025-08-20 11:48:20,926] Trial 37 finished with value: 0.8087273042686878 and parameters: {'model_type': 'cat', 'iterations': 203, 'depth': 7, 'learning_rate': 0.2766204990540492}. Best is trial 37 with value: 0.8087273042686878.
[I 2025-08-20 11:48:23,718] Trial 38 finished with value: 0.8023097435309289 and parameters: {'model_type': 'cat', 'iterations': 200, 'depth': 7, 'learning_rate': 0.29314751362676367}. Best is trial 37 with value: 0.8087273042686878.
[I 2025-08-20 11:48:28,575] Trial 39 finished with value: 0.8059620188833102 and parameters: {'model_type': 'cat', 'iterations': 210, 'depth': 7, 'learning_rate': 0.29934134178763355}. Best is trial 37 with value: 0.8087273042686878.
[I 2025-08-20 11:48:31,378] Trial 40 finished with value: 0.8116726877889952 and parameters: {'model_type': 'cat', 'iterations': 217, 'depth': 7, 'learning_rate': 0.2985693699527986}. Best is trial 40 with value: 0.8116726877889952.
[I 2025-08-20 11:48:37,962] Trial 41 finished with value: 0.8070837441541194 and parameters: {'model_type': 'cat', 'iterations': 208, 'depth': 7, 'learning_rate': 0.29666827953846936}. Best is trial 40 with value: 0.8116726877889952.
[I 2025-08-20 11:48:40,688] Trial 42 finished with value: 0.801442588817699 and parameters: {'model_type': 'cat', 'iterations': 205, 'depth': 7, 'learning_rate': 0.26224201617003495}. Best is trial 40 with value: 0.8116726877889952.
[I 2025-08-20 11:48:43,458] Trial 43 finished with value: 0.8133529525296257 and parameters: {'model_type': 'cat', 'iterations': 201, 'depth': 7, 'learning_rate': 0.29733996505035293}. Best is trial 43 with value: 0.8133529525296257.
[I 2025-08-20 11:48:50,105] Trial 44 finished with value: 0.7966831439918993 and parameters: {'model_type': 'cat', 'iterations': 318, 'depth': 7, 'learning_rate': 0.2555876414938074}. Best is trial 43 with value: 0.8133529525296257.
[I 2025-08-20 11:48:52,956] Trial 45 finished with value: 0.7923765198649162 and parameters: {'model_type': 'cat', 'iterations': 326, 'depth': 6, 'learning_rate': 0.2724716855620835}. Best is trial 43 with value: 0.8133529525296257.
[I 2025-08-20 11:48:55,970] Trial 46 finished with value: 0.7617886471242505 and parameters: {'model_type': 'cat', 'iterations': 303, 'depth': 8, 'learning_rate': 0.2998691408414575}. Best is trial 43 with value: 0.8133529525296257.
[I 2025-08-20 11:49:00,463] Trial 47 finished with value: 0.7910528558387477 and parameters: {'model_type': 'cat', 'iterations': 284, 'depth': 6, 'learning_rate': 0.23136332697974485}. Best is trial 43 with value: 0.8133529525296257.
[I 2025-08-20 11:49:03,383] Trial 48 finished with value: 0.7614260911114898 and parameters: {'model_type': 'cat', 'iterations': 265, 'depth': 8, 'learning_rate': 0.27032882212174986}. Best is trial 43 with value: 0.8133529525296257.
[I 2025-08-20 11:49:06,552] Trial 49 finished with value: 0.7727777170269863 and parameters: {'model_type': 'cat', 'iterations': 395, 'depth': 8, 'learning_rate': 0.24440242149201916}. Best is trial 43 with value: 0.8133529525296257.
Regression Results:
  Train R²: 0.992
  Test R²: 0.813
  CV R²: 0.420 ± 0.145
Failed to save comparison file: Object of type ndarray is not JSON serializable

==================================================
ANALYSIS COMPLETE
==================================================
Check the following directories for outputs:
  - plots/: Visualization files
  - results/: Data files and reports
  - models/: Trained model files
