[I 2025-08-20 11:48:23,428] Trial 15 finished with value: 0.8003168930109114 and parameters: {'model_type': 'lgbm', 'n_estimators': 59, 'max_depth': 5, 'learning_rate': 0.1639474550210715}. Best is trial 15 with value: 0.8003168930109114.
[I 2025-08-20 11:48:23,469] Trial 16 finished with value: 0.801736166332627 and parameters: {'model_type': 'lgbm', 'n_estimators': 52, 'max_depth': 5, 'learning_rate': 0.19241526176142093}. Best is trial 16 with value: 0.801736166332627.
[I 2025-08-20 11:48:23,503] Trial 17 finished with value: 0.8016839090265199 and parameters: {'model_type': 'lgbm', 'n_estimators': 57, 'max_depth': 5, 'learning_rate': 0.20136054141373422}. Best is trial 16 with value: 0.801736166332627.
[I 2025-08-20 11:48:23,548] Trial 18 finished with value: 0.7873033982864697 and parameters: {'model_type': 'lgbm', 'n_estimators': 81, 'max_depth': 6, 'learning_rate': 0.20124075647278802}. Best is trial 16 with value: 0.801736166332627.
[I 2025-08-20 11:48:23,578] Trial 19 finished with value: 0.7929446712800517 and parameters: {'model_type': 'lgbm', 'n_estimators': 80, 'max_depth': 4, 'learning_rate': 0.2036723076698026}. Best is trial 16 with value: 0.801736166332627.
[I 2025-08-20 11:48:25,907] Trial 20 finished with value: 0.7154533873445785 and parameters: {'model_type': 'xgb', 'n_estimators': 110, 'max_depth': 7, 'learning_rate': 0.2079410005985287}. Best is trial 16 with value: 0.801736166332627.
[I 2025-08-20 11:48:25,948] Trial 21 finished with value: 0.8031903948935322 and parameters: {'model_type': 'lgbm', 'n_estimators': 50, 'max_depth': 5, 'learning_rate': 0.16417663942697677}. Best is trial 21 with value: 0.8031903948935322.
[I 2025-08-20 11:48:25,981] Trial 22 finished with value: 0.8075904847921174 and parameters: {'model_type': 'lgbm', 'n_estimators': 65, 'max_depth': 6, 'learning_rate': 0.16553512822058505}. Best is trial 22 with value: 0.8075904847921174.
[I 2025-08-20 11:48:26,017] Trial 23 finished with value: 0.8035501303236756 and parameters: {'model_type': 'lgbm', 'n_estimators': 72, 'max_depth': 6, 'learning_rate': 0.15963795834995123}. Best is trial 22 with value: 0.8075904847921174.
[I 2025-08-20 11:48:26,056] Trial 24 finished with value: 0.7993178150469523 and parameters: {'model_type': 'lgbm', 'n_estimators': 74, 'max_depth': 6, 'learning_rate': 0.13900491697746908}. Best is trial 22 with value: 0.8075904847921174.
[I 2025-08-20 11:48:26,065] Trial 25 finished with value: 0.4400762850841604 and parameters: {'model_type': 'bayesian_ridge', 'alpha_1': 0.0009665966586337785, 'alpha_2': 4.932014549519927e-06, 'lambda_1': 0.0009698269538460713, 'lambda_2': 0.0008850000569020566}. Best is trial 22 with value: 0.8075904847921174.
[I 2025-08-20 11:48:26,217] Trial 26 finished with value: 0.760513648739759 and parameters: {'model_type': 'rf', 'n_estimators': 98, 'max_depth': 8, 'min_samples_split': 6}. Best is trial 22 with value: 0.8075904847921174.
[I 2025-08-20 11:48:26,250] Trial 27 finished with value: 0.8021704894281788 and parameters: {'model_type': 'lgbm', 'n_estimators': 65, 'max_depth': 6, 'learning_rate': 0.1678152170315407}. Best is trial 22 with value: 0.8075904847921174.
[I 2025-08-20 11:48:26,284] Trial 28 finished with value: 0.8045432523028884 and parameters: {'model_type': 'lgbm', 'n_estimators': 100, 'max_depth': 4, 'learning_rate': 0.13726030881040996}. Best is trial 22 with value: 0.8075904847921174.
[I 2025-08-20 11:48:26,318] Trial 29 finished with value: 0.8027105079659702 and parameters: {'model_type': 'lgbm', 'n_estimators': 105, 'max_depth': 4, 'learning_rate': 0.12939173149861544}. Best is trial 22 with value: 0.8075904847921174.
[I 2025-08-20 11:48:26,590] Trial 30 finished with value: 0.7760563100518569 and parameters: {'model_type': 'rf', 'n_estimators': 138, 'max_depth': 14, 'min_samples_split': 2}. Best is trial 22 with value: 0.8075904847921174.
[I 2025-08-20 11:48:26,631] Trial 31 finished with value: 0.7947159952369118 and parameters: {'model_type': 'lgbm', 'n_estimators': 70, 'max_depth': 4, 'learning_rate': 0.16976364945585576}. Best is trial 22 with value: 0.8075904847921174.
[I 2025-08-20 11:48:26,690] Trial 32 finished with value: 0.8028282163983737 and parameters: {'model_type': 'lgbm', 'n_estimators': 92, 'max_depth': 6, 'learning_rate': 0.09122079393342228}. Best is trial 22 with value: 0.8075904847921174.
[I 2025-08-20 11:48:28,179] Trial 33 finished with value: 0.7338097880006718 and parameters: {'model_type': 'xgb', 'n_estimators': 69, 'max_depth': 7, 'learning_rate': 0.13180476421004386}. Best is trial 22 with value: 0.8075904847921174.
[I 2025-08-20 11:48:28,224] Trial 34 finished with value: 0.7863528924145006 and parameters: {'model_type': 'lgbm', 'n_estimators': 82, 'max_depth': 4, 'learning_rate': 0.17221928547326}. Best is trial 22 with value: 0.8075904847921174.
[I 2025-08-20 11:48:30,738] Trial 35 finished with value: 0.7968170517403542 and parameters: {'model_type': 'cat', 'iterations': 272, 'depth': 4, 'learning_rate': 0.1493283468309578}. Best is trial 22 with value: 0.8075904847921174.
[I 2025-08-20 11:48:30,749] Trial 36 finished with value: 0.44007645231375325 and parameters: {'model_type': 'bayesian_ridge', 'alpha_1': 0.0008713599155663133, 'alpha_2': 0.0007995547179169011, 'lambda_1': 0.0009291750330559416, 'lambda_2': 0.0009783338570596445}. Best is trial 22 with value: 0.8075904847921174.
[I 2025-08-20 11:48:30,810] Trial 37 finished with value: 0.7941947164791123 and parameters: {'model_type': 'lgbm', 'n_estimators': 62, 'max_depth': 6, 'learning_rate': 0.07878766616162468}. Best is trial 22 with value: 0.8075904847921174.
[I 2025-08-20 11:48:30,868] Trial 38 finished with value: 0.7904897872870227 and parameters: {'model_type': 'lgbm', 'n_estimators': 97, 'max_depth': 4, 'learning_rate': 0.22736305564471465}. Best is trial 22 with value: 0.8075904847921174.
[I 2025-08-20 11:48:30,938] Trial 39 finished with value: 0.798701953866171 and parameters: {'model_type': 'lgbm', 'n_estimators': 74, 'max_depth': 7, 'learning_rate': 0.18238004633589455}. Best is trial 22 with value: 0.8075904847921174.
[I 2025-08-20 11:48:31,331] Trial 40 finished with value: 0.7236938508183548 and parameters: {'model_type': 'xgb', 'n_estimators': 50, 'max_depth': 8, 'learning_rate': 0.12450084416928017}. Best is trial 22 with value: 0.8075904847921174.
[I 2025-08-20 11:48:31,433] Trial 41 finished with value: 0.8001627385548665 and parameters: {'model_type': 'lgbm', 'n_estimators': 91, 'max_depth': 6, 'learning_rate': 0.08071552730297665}. Best is trial 22 with value: 0.8075904847921174.
[I 2025-08-20 11:48:31,481] Trial 42 finished with value: 0.8013805061635079 and parameters: {'model_type': 'lgbm', 'n_estimators': 89, 'max_depth': 5, 'learning_rate': 0.14852535808634576}. Best is trial 22 with value: 0.8075904847921174.
[I 2025-08-20 11:48:31,550] Trial 43 finished with value: 0.8014158706241585 and parameters: {'model_type': 'lgbm', 'n_estimators': 101, 'max_depth': 6, 'learning_rate': 0.05290498471519531}. Best is trial 22 with value: 0.8075904847921174.
[I 2025-08-20 11:48:31,627] Trial 44 finished with value: 0.804025085779934 and parameters: {'model_type': 'lgbm', 'n_estimators': 114, 'max_depth': 7, 'learning_rate': 0.09444800099991212}. Best is trial 22 with value: 0.8075904847921174.
[I 2025-08-20 11:48:31,637] Trial 45 finished with value: 0.4400749310258275 and parameters: {'model_type': 'bayesian_ridge', 'alpha_1': 4.543540356238818e-05, 'alpha_2': 0.0005200229871989727, 'lambda_1': 0.0005417579174466874, 'lambda_2': 0.00011189516121878196}. Best is trial 22 with value: 0.8075904847921174.
[I 2025-08-20 11:48:37,979] Trial 46 finished with value: 0.7779084761523616 and parameters: {'model_type': 'cat', 'iterations': 212, 'depth': 10, 'learning_rate': 0.1186092179056818}. Best is trial 22 with value: 0.8075904847921174.
[I 2025-08-20 11:48:38,059] Trial 47 finished with value: 0.7842289743426161 and parameters: {'model_type': 'lgbm', 'n_estimators': 120, 'max_depth': 7, 'learning_rate': 0.29644982395291963}. Best is trial 22 with value: 0.8075904847921174.
[I 2025-08-20 11:48:38,255] Trial 48 finished with value: 0.7547908758167364 and parameters: {'model_type': 'rf', 'n_estimators': 116, 'max_depth': 8, 'min_samples_split': 10}. Best is trial 22 with value: 0.8075904847921174.
[I 2025-08-20 11:48:38,354] Trial 49 finished with value: 0.7838653074225689 and parameters: {'model_type': 'lgbm', 'n_estimators': 166, 'max_depth': 7, 'learning_rate': 0.15157864994048434}. Best is trial 22 with value: 0.8075904847921174.
Regression Results:
  Train R²: 0.892
  Test R²: 0.808
  CV R²: 0.444 ± 0.228
Failed to save comparison file: Object of type ndarray is not JSON serializable

==================================================
ANALYSIS COMPLETE
==================================================
Check the following directories for outputs:
  - plots/: Visualization files
  - results/: Data files and reports
  - models/: Trained model files
