=== ML Measurable HTE Rate Bias Analysis ===

==================================================
Running HTE Prediction Analysis: each with 8 features
==================================================

=== Loading Data ===
Number of HTE rates: 1031
Found 5 hydrogen-dependent features: ['num_Hs', 'BV_Hs_avg', 'Charges_Hs_avg', 'fukui_E_Hs_avg', 'fukui_N_Hs_avg']
Found 2 pKa-dependent features: ['pka_aHs', 'pka_lowest']
Found 26 heteroatom-dependent features: ['BV_main_1', 'Charges_main_atom', 'fukui_E_main_atom', 'fukui_N_main_atom', 'L_main_atom_1', 'L_main_atom_2', 'B1_main_atom_1', 'B1_main_atom_2', 'B5_main_atom_1', 'B5_main_atom_2', 'Charges_secondary_1', 'Charges_secondary_2', 'fukui_N_secondary_1', 'fukui_N_secondary_2', 'Charges_secondary_avg', 'fukui_N_secondary_avg', 'FCS_1', 'FREQS_1', 'FCS_2', 'FREQS_2', 'FCS_avg', 'FREQS_avg', 'BV_Hs_avg', 'Charges_Hs_avg', 'fukui_E_Hs_avg', 'fukui_N_Hs_avg']

Processing num_Hs conditional features...
  18/46 molecules meet condition num_Hs
    num_Hs: 0 -> 0 NA values
    BV_Hs_avg: 28 -> 0 NA values
    Charges_Hs_avg: 28 -> 0 NA values
    fukui_E_Hs_avg: 28 -> 0 NA values
    fukui_N_Hs_avg: 28 -> 0 NA values

Processing pKa_features conditional features...
  18/46 molecules meet condition pKa_features
    Processing pKa feature pka_aHs with special handling...
      Created indicator: has_acidic_H_for_pka_aHs
      Created interaction: pka_aHs_x_has_acidic_H
      Used 50.0 for molecules without acidic H
    pka_aHs: 28 -> 0 NA values
    Processing pKa feature pka_lowest with special handling...
      Created indicator: has_acidic_H_for_pka_lowest
      Created interaction: pka_lowest_x_has_acidic_H
      Used 50.0 for molecules without acidic H
    pka_lowest: 38 -> 0 NA values

Handling remaining NA values...

Encoding categorical features...
  Removed identifier feature: name
  Found categorical feature class with 4 unique values: ['aromatic' 'hetero' 'aliphatic' 'mixture']
    One-hot encoded class -> 4 features: ['class_aliphatic', 'class_aromatic', 'class_hetero', 'class_mixture']
  Removed identifier feature: smiles
  Processed 1 categorical features
  Removed 2 identifier features: ['name', 'smiles']

Creating feature quality indicators...
  Added indicator: has_num_Hs
  Added indicator: has_pKa_features
Preprocessing complete. Shape: (46, 65)
Remaining NA values: 0
Found 1 pKa-dependent features: ['pka_basic']
Warning: num_Hs column not found, cannot properly handle pKa features
Found 15 heteroatom-dependent features: ['BV_main_1', 'Charges_main_atom', 'fukui_E_main_atom', 'fukui_N_main_atom', 'L_main_atom_1', 'B1_main_atom_1', 'B5_main_atom_1', 'Charges_secondary_1', 'fukui_N_secondary_1', 'Charges_secondary_avg', 'fukui_N_secondary_avg', 'FCS_1', 'FREQS_1', 'FCS_avg', 'FREQS_avg']

Handling remaining NA values...
  pka_basic: Filled 1 NA values with median/zero
  smiles: Filled 1 NA values with mode/unknown
  class: Filled 1 NA values with mode/unknown

Encoding categorical features...
  Removed identifier feature: name
  Removed identifier feature: smiles
  Found categorical feature class with 5 unique values: ['1_aliphatic' '1_aromatic' '2_aliphatic' '1_mixture' '2_mixture']
    One-hot encoded class -> 5 features: ['class_1_aliphatic', 'class_1_aromatic', 'class_1_mixture', 'class_2_aliphatic', 'class_2_mixture']
  Processed 1 categorical features
  Removed 2 identifier features: ['name', 'smiles']

Creating feature quality indicators...
Preprocessing complete. Shape: (55, 40)
Remaining NA values: 0
Loaded reaction energy features: 1488 rows, 8 features

=== Selecting Features (selected) ===
Final selected features (8): ['acyl_class_aromatic', 'acyl_Charges_secondary_1', 'acyl_BV_secondary_2', 'amine_pka_basic', 'amine_Charges_secondary_1', 'acyl_pka_aHs_x_has_acidic_H', 'amine_BV_secondary_avg', 'amine_class_1_mixture']
=== Building HTE Prediction Models with 8 features ===
Selected features: ['acyl_class_aromatic', 'acyl_Charges_secondary_1', 'acyl_BV_secondary_2', 'amine_pka_basic', 'amine_Charges_secondary_1', 'acyl_pka_aHs_x_has_acidic_H', 'amine_BV_secondary_avg', 'amine_class_1_mixture']
Valid features: 17
=== Building Regression Model ===
Regression dataset: (1031, 17)
Target range: -1.418 to 4.010


Training data: 619 samples
Test data: 206 samples


Train-only SFS selected 16 features for regression
Running hyperparameter optimization for regression...
[I 2025-08-20 11:43:41,019] A new study created in memory with name: no-name-984c6ee6-6066-4c4d-beaf-319ecacb8764
[I 2025-08-20 11:43:42,338] Trial 0 finished with value: 0.7495256302796833 and parameters: {'model_type': 'lgbm', 'n_estimators': 174, 'max_depth': 10, 'learning_rate': 0.2453697859363317}. Best is trial 0 with value: 0.7495256302796833.
[I 2025-08-20 11:43:44,038] Trial 1 finished with value: 0.777331798665071 and parameters: {'model_type': 'cat', 'iterations': 446, 'depth': 7, 'learning_rate': 0.17857036965900258}. Best is trial 1 with value: 0.777331798665071.
[I 2025-08-20 11:43:47,294] Trial 2 finished with value: 0.7068996409093827 and parameters: {'model_type': 'cat', 'iterations': 226, 'depth': 10, 'learning_rate': 0.031905568390831765}. Best is trial 1 with value: 0.777331798665071.
[I 2025-08-20 11:43:48,148] Trial 3 finished with value: 0.7686248046049232 and parameters: {'model_type': 'xgb', 'n_estimators': 177, 'max_depth': 5, 'learning_rate': 0.129386990900205}. Best is trial 1 with value: 0.777331798665071.
[I 2025-08-20 11:43:48,287] Trial 4 finished with value: 0.7713638686858513 and parameters: {'model_type': 'lgbm', 'n_estimators': 119, 'max_depth': 9, 'learning_rate': 0.04479445616635578}. Best is trial 1 with value: 0.777331798665071.
[I 2025-08-20 11:43:48,768] Trial 5 finished with value: 0.7305783227555417 and parameters: {'model_type': 'rf', 'n_estimators': 168, 'max_depth': 7, 'min_samples_split': 8}. Best is trial 1 with value: 0.777331798665071.
[I 2025-08-20 11:43:49,379] Trial 6 finished with value: 0.7592450627277333 and parameters: {'model_type': 'xgb', 'n_estimators': 114, 'max_depth': 6, 'learning_rate': 0.19043155996496575}. Best is trial 1 with value: 0.777331798665071.
[I 2025-08-20 11:43:49,533] Trial 7 finished with value: 0.6650883578712106 and parameters: {'model_type': 'xgb', 'n_estimators': 62, 'max_depth': 8, 'learning_rate': 0.029898327043756147}. Best is trial 1 with value: 0.777331798665071.
[I 2025-08-20 11:43:49,584] Trial 8 finished with value: 0.5866936475350523 and parameters: {'model_type': 'bayesian_ridge', 'alpha_1': 0.0004543897760765558, 'alpha_2': 0.00021471579442609113, 'lambda_1': 0.000536106797405584, 'lambda_2': 0.0008473045582640494}. Best is trial 1 with value: 0.777331798665071.
[I 2025-08-20 11:43:50,096] Trial 9 finished with value: 0.7524767991953796 and parameters: {'model_type': 'rf', 'n_estimators': 177, 'max_depth': 15, 'min_samples_split': 9}. Best is trial 1 with value: 0.777331798665071.
[I 2025-08-20 11:43:57,637] Trial 10 finished with value: 0.7595993704508117 and parameters: {'model_type': 'cat', 'iterations': 628, 'depth': 5, 'learning_rate': 0.29535951511243713}. Best is trial 1 with value: 0.777331798665071.
[I 2025-08-20 11:43:57,694] Trial 11 finished with value: 0.7697893014412562 and parameters: {'model_type': 'lgbm', 'n_estimators': 113, 'max_depth': 3, 'learning_rate': 0.1302439597929675}. Best is trial 1 with value: 0.777331798665071.
[I 2025-08-20 11:43:57,790] Trial 12 finished with value: 0.7741055394851143 and parameters: {'model_type': 'lgbm', 'n_estimators': 71, 'max_depth': 10, 'learning_rate': 0.08645701451233642}. Best is trial 1 with value: 0.777331798665071.
[I 2025-08-20 11:44:04,867] Trial 13 finished with value: 0.7424524773921402 and parameters: {'model_type': 'cat', 'iterations': 380, 'depth': 8, 'learning_rate': 0.0934545061932488}. Best is trial 1 with value: 0.777331798665071.
[I 2025-08-20 11:44:04,898] Trial 14 finished with value: 0.5866893370417967 and parameters: {'model_type': 'bayesian_ridge', 'alpha_1': 0.000982010874954166, 'alpha_2': 0.0009697910705011544, 'lambda_1': 3.517835985846163e-05, 'lambda_2': 1.3793957348394198e-05}. Best is trial 1 with value: 0.777331798665071.
[I 2025-08-20 11:44:05,318] Trial 15 finished with value: 0.7615307628787014 and parameters: {'model_type': 'lgbm', 'n_estimators': 51, 'max_depth': 10, 'learning_rate': 0.2039344648264014}. Best is trial 1 with value: 0.777331798665071.
[I 2025-08-20 11:44:14,165] Trial 16 finished with value: 0.786169594323265 and parameters: {'model_type': 'cat', 'iterations': 790, 'depth': 6, 'learning_rate': 0.08825986855474208}. Best is trial 16 with value: 0.786169594323265.
[I 2025-08-20 11:44:25,638] Trial 17 finished with value: 0.7633586458666418 and parameters: {'model_type': 'cat', 'iterations': 793, 'depth': 6, 'learning_rate': 0.16928917680154015}. Best is trial 16 with value: 0.786169594323265.
[I 2025-08-20 11:44:31,290] Trial 18 finished with value: 0.785064051596656 and parameters: {'model_type': 'cat', 'iterations': 499, 'depth': 7, 'learning_rate': 0.08998271988038929}. Best is trial 16 with value: 0.786169594323265.
[I 2025-08-20 11:44:38,587] Trial 19 finished with value: 0.775348351871668 and parameters: {'model_type': 'cat', 'iterations': 615, 'depth': 4, 'learning_rate': 0.0796507483628816}. Best is trial 16 with value: 0.786169594323265.
[I 2025-08-20 11:44:53,401] Trial 20 finished with value: 0.7882648226968719 and parameters: {'model_type': 'cat', 'iterations': 797, 'depth': 8, 'learning_rate': 0.12607142651535969}. Best is trial 20 with value: 0.7882648226968719.
[I 2025-08-20 11:45:02,996] Trial 21 finished with value: 0.7812434348252169 and parameters: {'model_type': 'cat', 'iterations': 779, 'depth': 7, 'learning_rate': 0.12646775936335303}. Best is trial 20 with value: 0.7882648226968719.
[I 2025-08-20 11:45:17,516] Trial 22 finished with value: 0.7868697231060753 and parameters: {'model_type': 'cat', 'iterations': 641, 'depth': 9, 'learning_rate': 0.07202115698291561}. Best is trial 20 with value: 0.7882648226968719.
[I 2025-08-20 11:45:33,923] Trial 23 finished with value: 0.7805899017904294 and parameters: {'model_type': 'cat', 'iterations': 643, 'depth': 9, 'learning_rate': 0.06007122991459064}. Best is trial 20 with value: 0.7882648226968719.
[I 2025-08-20 11:45:51,626] Trial 24 finished with value: 0.7808587883619378 and parameters: {'model_type': 'cat', 'iterations': 709, 'depth': 9, 'learning_rate': 0.11988699507571449}. Best is trial 20 with value: 0.7882648226968719.
[I 2025-08-20 11:45:51,640] Trial 25 finished with value: 0.5866904610885446 and parameters: {'model_type': 'bayesian_ridge', 'alpha_1': 4.035986591385246e-05, 'alpha_2': 4.751563129644148e-06, 'lambda_1': 0.0009685222092325044, 'lambda_2': 0.0002518782671299242}. Best is trial 20 with value: 0.7882648226968719.
[I 2025-08-20 11:45:52,184] Trial 26 finished with value: 0.7591768841347348 and parameters: {'model_type': 'rf', 'n_estimators': 143, 'max_depth': 15, 'min_samples_split': 2}. Best is trial 20 with value: 0.7882648226968719.
[I 2025-08-20 11:46:09,392] Trial 27 finished with value: 0.7647860985006375 and parameters: {'model_type': 'cat', 'iterations': 719, 'depth': 9, 'learning_rate': 0.15205612038885918}. Best is trial 20 with value: 0.7882648226968719.
[I 2025-08-20 11:46:21,841] Trial 28 finished with value: 0.7779350416339088 and parameters: {'model_type': 'cat', 'iterations': 799, 'depth': 8, 'learning_rate': 0.06413498228942974}. Best is trial 20 with value: 0.7882648226968719.
[I 2025-08-20 11:46:29,937] Trial 29 finished with value: 0.7970540431004903 and parameters: {'model_type': 'cat', 'iterations': 694, 'depth': 6, 'learning_rate': 0.10539645139969084}. Best is trial 29 with value: 0.7970540431004903.
[I 2025-08-20 11:46:52,311] Trial 30 finished with value: 0.7639804064273814 and parameters: {'model_type': 'cat', 'iterations': 570, 'depth': 10, 'learning_rate': 0.1445532240570398}. Best is trial 29 with value: 0.7970540431004903.
[I 2025-08-20 11:47:03,355] Trial 31 finished with value: 0.7945225717046922 and parameters: {'model_type': 'cat', 'iterations': 714, 'depth': 6, 'learning_rate': 0.1117999550441813}. Best is trial 29 with value: 0.7970540431004903.
[I 2025-08-20 11:47:11,631] Trial 32 finished with value: 0.7989149924981099 and parameters: {'model_type': 'cat', 'iterations': 707, 'depth': 6, 'learning_rate': 0.10829794634112344}. Best is trial 32 with value: 0.7989149924981099.
[I 2025-08-20 11:47:18,625] Trial 33 finished with value: 0.7992926581867159 and parameters: {'model_type': 'cat', 'iterations': 716, 'depth': 6, 'learning_rate': 0.11036386991550451}. Best is trial 33 with value: 0.7992926581867159.
[I 2025-08-20 11:47:27,726] Trial 34 finished with value: 0.7926827688087856 and parameters: {'model_type': 'cat', 'iterations': 707, 'depth': 6, 'learning_rate': 0.10679726945015636}. Best is trial 33 with value: 0.7992926581867159.
[I 2025-08-20 11:47:30,061] Trial 35 finished with value: 0.7775320735865313 and parameters: {'model_type': 'xgb', 'n_estimators': 200, 'max_depth': 4, 'learning_rate': 0.10556200234164083}. Best is trial 33 with value: 0.7992926581867159.
[I 2025-08-20 11:47:33,909] Trial 36 finished with value: 0.7782096860987634 and parameters: {'model_type': 'cat', 'iterations': 713, 'depth': 5, 'learning_rate': 0.2224978233510823}. Best is trial 33 with value: 0.7992926581867159.
[I 2025-08-20 11:47:34,184] Trial 37 finished with value: 0.7595348212622524 and parameters: {'model_type': 'rf', 'n_estimators': 84, 'max_depth': 13, 'min_samples_split': 3}. Best is trial 33 with value: 0.7992926581867159.
[I 2025-08-20 11:47:39,411] Trial 38 finished with value: 0.7875775850102915 and parameters: {'model_type': 'cat', 'iterations': 565, 'depth': 5, 'learning_rate': 0.1489029065280523}. Best is trial 33 with value: 0.7992926581867159.
[I 2025-08-20 11:47:39,657] Trial 39 finished with value: 0.7754242437342479 and parameters: {'model_type': 'xgb', 'n_estimators': 97, 'max_depth': 3, 'learning_rate': 0.10466505332118424}. Best is trial 33 with value: 0.7992926581867159.
[I 2025-08-20 11:47:39,667] Trial 40 finished with value: 0.5866944658352279 and parameters: {'model_type': 'bayesian_ridge', 'alpha_1': 0.0009819460491666534, 'alpha_2': 0.0007305871884391132, 'lambda_1': 3.426354409578788e-05, 'lambda_2': 0.0009907289199835518}. Best is trial 33 with value: 0.7992926581867159.
[I 2025-08-20 11:47:46,450] Trial 41 finished with value: 0.7920192278187581 and parameters: {'model_type': 'cat', 'iterations': 698, 'depth': 6, 'learning_rate': 0.10645846223526978}. Best is trial 33 with value: 0.7992926581867159.
[I 2025-08-20 11:47:53,694] Trial 42 finished with value: 0.7961686025790444 and parameters: {'model_type': 'cat', 'iterations': 683, 'depth': 6, 'learning_rate': 0.11093220250545027}. Best is trial 33 with value: 0.7992926581867159.
[I 2025-08-20 11:48:00,648] Trial 43 finished with value: 0.7861180820319378 and parameters: {'model_type': 'cat', 'iterations': 669, 'depth': 6, 'learning_rate': 0.04869031842644578}. Best is trial 33 with value: 0.7992926581867159.
[I 2025-08-20 11:48:09,039] Trial 44 finished with value: 0.7910846426977952 and parameters: {'model_type': 'cat', 'iterations': 739, 'depth': 5, 'learning_rate': 0.13791585438623136}. Best is trial 33 with value: 0.7992926581867159.
[I 2025-08-20 11:48:09,155] Trial 45 finished with value: 0.7732019936990173 and parameters: {'model_type': 'lgbm', 'n_estimators': 143, 'max_depth': 5, 'learning_rate': 0.16543065462422862}. Best is trial 33 with value: 0.7992926581867159.
[I 2025-08-20 11:48:09,645] Trial 46 finished with value: 0.7538904231996053 and parameters: {'model_type': 'rf', 'n_estimators': 147, 'max_depth': 12, 'min_samples_split': 5}. Best is trial 33 with value: 0.7992926581867159.
[I 2025-08-20 11:48:17,658] Trial 47 finished with value: 0.7778716601021531 and parameters: {'model_type': 'cat', 'iterations': 581, 'depth': 7, 'learning_rate': 0.11878773810180202}. Best is trial 33 with value: 0.7992926581867159.
[I 2025-08-20 11:48:20,360] Trial 48 finished with value: 0.7376370087842448 and parameters: {'model_type': 'xgb', 'n_estimators': 94, 'max_depth': 7, 'learning_rate': 0.04756350499560662}. Best is trial 33 with value: 0.7992926581867159.
[I 2025-08-20 11:48:25,942] Trial 49 finished with value: 0.7928873760658102 and parameters: {'model_type': 'cat', 'iterations': 656, 'depth': 6, 'learning_rate': 0.11501889615295299}. Best is trial 33 with value: 0.7992926581867159.
Regression Results:
  Train R²: 0.943
  Test R²: 0.799
  CV R²: 0.425 ± 0.198

=== Generating Visualizations ===
=== Evaluating CatBoost with Parity Plots ===
Model Performance:
  Train R²: 0.943, MAE: 0.152, RMSE: 0.216
  Test R²: 0.799, MAE: 0.333, RMSE: 0.430
Generating parity plots...
Parity plot saved as: plots/parity_plot_catboost_train_each_8_optuna_ens7_gpu0_train.png
Parity plot saved as: plots/parity_plot_catboost_test_each_8_optuna_ens7_gpu0_test.png
Parity analysis plot saved as: plots/parity_analysis_catboost_test_each_8_optuna_ens7_gpu0_analysis.png
Saved predictions to results/predictions_each_8_optuna_ens7_gpu0.csv
Saved combined dataset to results/combined_df_each_8_optuna_ens7_gpu0.csv
Models saved with suffix: _each_8_optuna_ens7_gpu0
HTE prediction evaluation report saved to results/reports/hte_prediction_report_manual_8_each_8_optuna_ens7_gpu0.txt

=== Comparing without reaction-energy features (HTE prediction) ===
=== Building HTE Prediction Models with 8 features ===
Selected features: ['acyl_class_aromatic', 'acyl_Charges_secondary_1', 'acyl_BV_secondary_2', 'amine_pka_basic', 'amine_Charges_secondary_1', 'acyl_pka_aHs_x_has_acidic_H', 'amine_BV_secondary_avg', 'amine_class_1_mixture']
Valid features: 9
=== Building Regression Model ===
Regression dataset: (1031, 9)
Target range: -1.418 to 4.010


Training data: 619 samples
Test data: 206 samples


Train-only SFS selected 8 features for regression
Running hyperparameter optimization for regression...
[I 2025-08-20 11:50:02,874] A new study created in memory with name: no-name-9c3095e4-a6df-4695-8fb5-c74dad0d9855
[I 2025-08-20 11:50:03,066] Trial 0 finished with value: 0.7734616103839903 and parameters: {'model_type': 'xgb', 'n_estimators': 153, 'max_depth': 5, 'learning_rate': 0.26379153015477314}. Best is trial 0 with value: 0.7734616103839903.
[I 2025-08-20 11:50:03,301] Trial 1 finished with value: 0.7564018802981801 and parameters: {'model_type': 'xgb', 'n_estimators': 166, 'max_depth': 9, 'learning_rate': 0.2737844460223863}. Best is trial 0 with value: 0.7734616103839903.
[I 2025-08-20 11:50:03,525] Trial 2 finished with value: 0.799482136650252 and parameters: {'model_type': 'rf', 'n_estimators': 141, 'max_depth': 15, 'min_samples_split': 7}. Best is trial 2 with value: 0.799482136650252.
[I 2025-08-20 11:50:03,731] Trial 3 finished with value: 0.753995854877519 and parameters: {'model_type': 'xgb', 'n_estimators': 128, 'max_depth': 10, 'learning_rate': 0.266874505799238}. Best is trial 2 with value: 0.799482136650252.
[I 2025-08-20 11:50:03,790] Trial 4 finished with value: 0.7415333638292967 and parameters: {'model_type': 'xgb', 'n_estimators': 81, 'max_depth': 3, 'learning_rate': 0.0637923368742582}. Best is trial 2 with value: 0.799482136650252.
[I 2025-08-20 11:50:03,983] Trial 5 finished with value: 0.7734488824843411 and parameters: {'model_type': 'xgb', 'n_estimators': 156, 'max_depth': 6, 'learning_rate': 0.11705168273541505}. Best is trial 2 with value: 0.799482136650252.
[I 2025-08-20 11:50:03,985] Trial 6 finished with value: 0.457784172361694 and parameters: {'model_type': 'bayesian_ridge', 'alpha_1': 0.0004666747267277584, 'alpha_2': 0.0002270818618566192, 'lambda_1': 0.0008010219350520385, 'lambda_2': 0.00046666574080952966}. Best is trial 2 with value: 0.799482136650252.
[I 2025-08-20 11:50:04,185] Trial 7 finished with value: 0.7843181302952401 and parameters: {'model_type': 'rf', 'n_estimators': 142, 'max_depth': 9, 'min_samples_split': 9}. Best is trial 2 with value: 0.799482136650252.
[I 2025-08-20 11:50:04,186] Trial 8 finished with value: 0.4577783030038478 and parameters: {'model_type': 'bayesian_ridge', 'alpha_1': 0.00034816304895891144, 'alpha_2': 0.0003469521776535952, 'lambda_1': 0.0003296313919290431, 'lambda_2': 1.82037343813443e-06}. Best is trial 2 with value: 0.799482136650252.
[I 2025-08-20 11:50:04,317] Trial 9 finished with value: 0.7898741002454822 and parameters: {'model_type': 'rf', 'n_estimators': 93, 'max_depth': 10, 'min_samples_split': 10}. Best is trial 2 with value: 0.799482136650252.
[I 2025-08-20 11:50:04,474] Trial 10 finished with value: 0.7525453842879276 and parameters: {'model_type': 'lgbm', 'n_estimators': 199, 'max_depth': 7, 'learning_rate': 0.012404771027891337}. Best is trial 2 with value: 0.799482136650252.
[I 2025-08-20 11:50:04,615] Trial 11 finished with value: 0.7982453743817142 and parameters: {'model_type': 'rf', 'n_estimators': 82, 'max_depth': 15, 'min_samples_split': 6}. Best is trial 2 with value: 0.799482136650252.
[I 2025-08-20 11:50:07,637] Trial 12 finished with value: 0.8016256205231564 and parameters: {'model_type': 'cat', 'iterations': 715, 'depth': 4, 'learning_rate': 0.17903962702457168}. Best is trial 12 with value: 0.8016256205231564.
[I 2025-08-20 11:50:13,611] Trial 13 finished with value: 0.7863378882806129 and parameters: {'model_type': 'cat', 'iterations': 750, 'depth': 4, 'learning_rate': 0.19287033930418707}. Best is trial 12 with value: 0.8016256205231564.
[I 2025-08-20 11:50:21,148] Trial 14 finished with value: 0.7955929051653082 and parameters: {'model_type': 'cat', 'iterations': 658, 'depth': 7, 'learning_rate': 0.18290061046851427}. Best is trial 12 with value: 0.8016256205231564.
