[I 2025-08-20 11:51:24,445] Trial 14 finished with value: 0.7949023742469512 and parameters: {'model_type': 'lgbm', 'n_estimators': 187, 'max_depth': 3, 'learning_rate': 0.15184415754366046}. Best is trial 12 with value: 0.8083400464633993.
[I 2025-08-20 11:51:25,820] Trial 15 finished with value: 0.7547203291387559 and parameters: {'model_type': 'xgb', 'n_estimators': 167, 'max_depth': 10, 'learning_rate': 0.15253752992973793}. Best is trial 12 with value: 0.8083400464633993.
[I 2025-08-20 11:51:26,011] Trial 16 finished with value: 0.7905097877496459 and parameters: {'model_type': 'rf', 'n_estimators': 128, 'max_depth': 14, 'min_samples_split': 10}. Best is trial 12 with value: 0.8083400464633993.
[I 2025-08-20 11:51:27,877] Trial 17 finished with value: 0.7838178659495069 and parameters: {'model_type': 'cat', 'iterations': 441, 'depth': 8, 'learning_rate': 0.11609479279632628}. Best is trial 12 with value: 0.8083400464633993.
[I 2025-08-20 11:51:32,303] Trial 18 finished with value: 0.7758805499790908 and parameters: {'model_type': 'cat', 'iterations': 467, 'depth': 10, 'learning_rate': 0.02400891810809498}. Best is trial 12 with value: 0.8083400464633993.
[I 2025-08-20 11:51:35,465] Trial 19 finished with value: 0.7891236672592863 and parameters: {'model_type': 'cat', 'iterations': 420, 'depth': 6, 'learning_rate': 0.19658373362832357}. Best is trial 12 with value: 0.8083400464633993.
[I 2025-08-20 11:51:36,043] Trial 20 finished with value: 0.7871825399160097 and parameters: {'model_type': 'xgb', 'n_estimators': 131, 'max_depth': 5, 'learning_rate': 0.11437439390477998}. Best is trial 12 with value: 0.8083400464633993.
[I 2025-08-20 11:51:41,423] Trial 21 finished with value: 0.7967923045305276 and parameters: {'model_type': 'cat', 'iterations': 595, 'depth': 5, 'learning_rate': 0.11487698178063555}. Best is trial 12 with value: 0.8083400464633993.
[I 2025-08-20 11:51:47,594] Trial 22 finished with value: 0.7998450156819308 and parameters: {'model_type': 'cat', 'iterations': 546, 'depth': 6, 'learning_rate': 0.07741906505158153}. Best is trial 12 with value: 0.8083400464633993.
[I 2025-08-20 11:51:50,509] Trial 23 finished with value: 0.791641675360671 and parameters: {'model_type': 'cat', 'iterations': 350, 'depth': 5, 'learning_rate': 0.14188935116993032}. Best is trial 12 with value: 0.8083400464633993.
[I 2025-08-20 11:51:50,889] Trial 24 finished with value: 0.7920129173691242 and parameters: {'model_type': 'rf', 'n_estimators': 200, 'max_depth': 15, 'min_samples_split': 2}. Best is trial 12 with value: 0.8083400464633993.
[I 2025-08-20 11:51:50,943] Trial 25 finished with value: 0.8093662596079636 and parameters: {'model_type': 'lgbm', 'n_estimators': 107, 'max_depth': 5, 'learning_rate': 0.09969118108541883}. Best is trial 25 with value: 0.8093662596079636.
[I 2025-08-20 11:51:50,998] Trial 26 finished with value: 0.8048836002424327 and parameters: {'model_type': 'lgbm', 'n_estimators': 106, 'max_depth': 5, 'learning_rate': 0.06832553331208704}. Best is trial 25 with value: 0.8093662596079636.
[I 2025-08-20 11:51:51,056] Trial 27 finished with value: 0.7843506060581328 and parameters: {'model_type': 'lgbm', 'n_estimators': 103, 'max_depth': 5, 'learning_rate': 0.044263239447070044}. Best is trial 25 with value: 0.8093662596079636.
[I 2025-08-20 11:51:51,114] Trial 28 finished with value: 0.8123966946423598 and parameters: {'model_type': 'lgbm', 'n_estimators': 109, 'max_depth': 5, 'learning_rate': 0.0646768274424942}. Best is trial 28 with value: 0.8123966946423598.
[I 2025-08-20 11:51:51,197] Trial 29 finished with value: 0.7804419732795025 and parameters: {'model_type': 'lgbm', 'n_estimators': 149, 'max_depth': 6, 'learning_rate': 0.29855377493277935}. Best is trial 28 with value: 0.8123966946423598.
[I 2025-08-20 11:51:51,244] Trial 30 finished with value: 0.7908355768612281 and parameters: {'model_type': 'lgbm', 'n_estimators': 103, 'max_depth': 4, 'learning_rate': 0.05700005123328343}. Best is trial 28 with value: 0.8123966946423598.
[I 2025-08-20 11:51:51,301] Trial 31 finished with value: 0.8046462872581857 and parameters: {'model_type': 'lgbm', 'n_estimators': 109, 'max_depth': 5, 'learning_rate': 0.08926177416768505}. Best is trial 28 with value: 0.8123966946423598.
[I 2025-08-20 11:51:51,370] Trial 32 finished with value: 0.8040971850446486 and parameters: {'model_type': 'lgbm', 'n_estimators': 113, 'max_depth': 6, 'learning_rate': 0.06411167719091347}. Best is trial 28 with value: 0.8123966946423598.
[I 2025-08-20 11:51:51,416] Trial 33 finished with value: 0.5831912080025576 and parameters: {'model_type': 'lgbm', 'n_estimators': 85, 'max_depth': 4, 'learning_rate': 0.016584443671880382}. Best is trial 28 with value: 0.8123966946423598.
[I 2025-08-20 11:51:51,505] Trial 34 finished with value: 0.8035445980160736 and parameters: {'model_type': 'lgbm', 'n_estimators': 139, 'max_depth': 7, 'learning_rate': 0.10030315475269122}. Best is trial 28 with value: 0.8123966946423598.
[I 2025-08-20 11:51:51,536] Trial 35 finished with value: 0.7987264524333921 and parameters: {'model_type': 'lgbm', 'n_estimators': 54, 'max_depth': 4, 'learning_rate': 0.17337414081357416}. Best is trial 28 with value: 0.8123966946423598.
[I 2025-08-20 11:51:51,609] Trial 36 finished with value: 0.8116532393674418 and parameters: {'model_type': 'lgbm', 'n_estimators': 119, 'max_depth': 6, 'learning_rate': 0.055242972012293265}. Best is trial 28 with value: 0.8123966946423598.
[I 2025-08-20 11:51:52,598] Trial 37 finished with value: 0.7630392020825958 and parameters: {'model_type': 'xgb', 'n_estimators': 155, 'max_depth': 7, 'learning_rate': 0.04385163637588596}. Best is trial 28 with value: 0.8123966946423598.
[I 2025-08-20 11:51:52,780] Trial 38 finished with value: 0.7895953421756401 and parameters: {'model_type': 'rf', 'n_estimators': 122, 'max_depth': 10, 'min_samples_split': 9}. Best is trial 28 with value: 0.8123966946423598.
[I 2025-08-20 11:51:52,838] Trial 39 finished with value: 0.8087139289465999 and parameters: {'model_type': 'lgbm', 'n_estimators': 91, 'max_depth': 6, 'learning_rate': 0.09148172699866658}. Best is trial 28 with value: 0.8123966946423598.
[I 2025-08-20 11:51:52,909] Trial 40 finished with value: 0.7689640323886275 and parameters: {'model_type': 'lgbm', 'n_estimators': 95, 'max_depth': 6, 'learning_rate': 0.031091039121431366}. Best is trial 28 with value: 0.8123966946423598.
[I 2025-08-20 11:51:52,959] Trial 41 finished with value: 0.8089712005627616 and parameters: {'model_type': 'lgbm', 'n_estimators': 72, 'max_depth': 6, 'learning_rate': 0.09460731938913158}. Best is trial 28 with value: 0.8123966946423598.
[I 2025-08-20 11:51:53,014] Trial 42 finished with value: 0.809650600429065 and parameters: {'model_type': 'lgbm', 'n_estimators': 77, 'max_depth': 6, 'learning_rate': 0.097494079325492}. Best is trial 28 with value: 0.8123966946423598.
[I 2025-08-20 11:51:53,070] Trial 43 finished with value: 0.7946248147278874 and parameters: {'model_type': 'lgbm', 'n_estimators': 65, 'max_depth': 7, 'learning_rate': 0.05799662521425529}. Best is trial 28 with value: 0.8123966946423598.
[I 2025-08-20 11:51:53,116] Trial 44 finished with value: 0.8074921547615771 and parameters: {'model_type': 'lgbm', 'n_estimators': 74, 'max_depth': 5, 'learning_rate': 0.1001003608109855}. Best is trial 28 with value: 0.8123966946423598.
[I 2025-08-20 11:51:53,129] Trial 45 finished with value: 0.4577785532609149 and parameters: {'model_type': 'bayesian_ridge', 'alpha_1': 0.000522724189654335, 'alpha_2': 3.142389088789133e-05, 'lambda_1': 9.60524978895188e-06, 'lambda_2': 5.419374102222938e-06}. Best is trial 28 with value: 0.8123966946423598.
[I 2025-08-20 11:51:53,197] Trial 46 finished with value: 0.8089050956587032 and parameters: {'model_type': 'lgbm', 'n_estimators': 116, 'max_depth': 6, 'learning_rate': 0.13430608014185055}. Best is trial 28 with value: 0.8123966946423598.
[I 2025-08-20 11:51:53,247] Trial 47 finished with value: 0.7737042287702761 and parameters: {'model_type': 'lgbm', 'n_estimators': 78, 'max_depth': 5, 'learning_rate': 0.04720206495921668}. Best is trial 28 with value: 0.8123966946423598.
[I 2025-08-20 11:51:53,296] Trial 48 finished with value: 0.8110258413170278 and parameters: {'model_type': 'lgbm', 'n_estimators': 70, 'max_depth': 6, 'learning_rate': 0.1712541104842367}. Best is trial 28 with value: 0.8123966946423598.
[I 2025-08-20 11:51:53,309] Trial 49 finished with value: 0.45779119696724546 and parameters: {'model_type': 'bayesian_ridge', 'alpha_1': 1.4857810333215144e-05, 'alpha_2': 0.0009963644898066193, 'lambda_1': 0.0006065975581131303, 'lambda_2': 0.0009930817650686985}. Best is trial 28 with value: 0.8123966946423598.
Regression Results:
  Train R²: 0.847
  Test R²: 0.812
  CV R²: 0.503 ± 0.231
Failed to save comparison file: Object of type ndarray is not JSON serializable

==================================================
ANALYSIS COMPLETE
==================================================
Check the following directories for outputs:
  - plots/: Visualization files
  - results/: Data files and reports
  - models/: Trained model files
