[I 2025-08-20 11:50:23,762] Trial 15 finished with value: 0.8026859710398627 and parameters: {'model_type': 'cat', 'iterations': 246, 'depth': 4, 'learning_rate': 0.12714061581530503}. Best is trial 15 with value: 0.8026859710398627.
[I 2025-08-20 11:50:26,317] Trial 16 finished with value: 0.799259017961468 and parameters: {'model_type': 'cat', 'iterations': 202, 'depth': 4, 'learning_rate': 0.1321652597823786}. Best is trial 15 with value: 0.8026859710398627.
[I 2025-08-20 11:50:29,054] Trial 17 finished with value: 0.8055889834074252 and parameters: {'model_type': 'cat', 'iterations': 323, 'depth': 4, 'learning_rate': 0.21124808441300041}. Best is trial 17 with value: 0.8055889834074252.
[I 2025-08-20 11:50:31,975] Trial 18 finished with value: 0.7992720987586722 and parameters: {'model_type': 'cat', 'iterations': 275, 'depth': 7, 'learning_rate': 0.21609367364749413}. Best is trial 17 with value: 0.8055889834074252.
[I 2025-08-20 11:50:32,004] Trial 19 finished with value: 0.7539020998565705 and parameters: {'model_type': 'lgbm', 'n_estimators': 50, 'max_depth': 3, 'learning_rate': 0.10364023403860063}. Best is trial 17 with value: 0.8055889834074252.
[I 2025-08-20 11:50:35,016] Trial 20 finished with value: 0.7977827507443371 and parameters: {'model_type': 'cat', 'iterations': 369, 'depth': 6, 'learning_rate': 0.23629279912574272}. Best is trial 17 with value: 0.8055889834074252.
[I 2025-08-20 11:50:38,040] Trial 21 finished with value: 0.8036051076454647 and parameters: {'model_type': 'cat', 'iterations': 482, 'depth': 4, 'learning_rate': 0.1531634354106902}. Best is trial 17 with value: 0.8055889834074252.
[I 2025-08-20 11:50:41,053] Trial 22 finished with value: 0.7988552540791723 and parameters: {'model_type': 'cat', 'iterations': 443, 'depth': 5, 'learning_rate': 0.1446669791415926}. Best is trial 17 with value: 0.8055889834074252.
[I 2025-08-20 11:50:50,973] Trial 23 finished with value: 0.7821137743522428 and parameters: {'model_type': 'cat', 'iterations': 543, 'depth': 9, 'learning_rate': 0.08723736259248152}. Best is trial 17 with value: 0.8055889834074252.
[I 2025-08-20 11:50:53,770] Trial 24 finished with value: 0.8053849020268611 and parameters: {'model_type': 'cat', 'iterations': 316, 'depth': 5, 'learning_rate': 0.15726134546618203}. Best is trial 17 with value: 0.8055889834074252.
[I 2025-08-20 11:50:58,084] Trial 25 finished with value: 0.7991346646938642 and parameters: {'model_type': 'cat', 'iterations': 361, 'depth': 5, 'learning_rate': 0.16372740982994693}. Best is trial 17 with value: 0.8055889834074252.
[I 2025-08-20 11:51:03,602] Trial 26 finished with value: 0.7808676845683012 and parameters: {'model_type': 'cat', 'iterations': 534, 'depth': 5, 'learning_rate': 0.2157322397190291}. Best is trial 17 with value: 0.8055889834074252.
[I 2025-08-20 11:51:03,693] Trial 27 finished with value: 0.8125857738702016 and parameters: {'model_type': 'lgbm', 'n_estimators': 200, 'max_depth': 5, 'learning_rate': 0.15626360802273426}. Best is trial 27 with value: 0.8125857738702016.
[I 2025-08-20 11:51:03,766] Trial 28 finished with value: 0.7870411330795988 and parameters: {'model_type': 'lgbm', 'n_estimators': 185, 'max_depth': 5, 'learning_rate': 0.21374757267915215}. Best is trial 27 with value: 0.8125857738702016.
[I 2025-08-20 11:51:03,805] Trial 29 finished with value: 0.8042860992565823 and parameters: {'model_type': 'lgbm', 'n_estimators': 108, 'max_depth': 4, 'learning_rate': 0.24393839937021738}. Best is trial 27 with value: 0.8125857738702016.
[I 2025-08-20 11:51:03,902] Trial 30 finished with value: 0.7744995757291703 and parameters: {'model_type': 'lgbm', 'n_estimators': 180, 'max_depth': 7, 'learning_rate': 0.29783627746902924}. Best is trial 27 with value: 0.8125857738702016.
[I 2025-08-20 11:51:03,941] Trial 31 finished with value: 0.8033512476777609 and parameters: {'model_type': 'lgbm', 'n_estimators': 109, 'max_depth': 4, 'learning_rate': 0.24331610475079862}. Best is trial 27 with value: 0.8125857738702016.
[I 2025-08-20 11:51:03,990] Trial 32 finished with value: 0.8144153758664021 and parameters: {'model_type': 'lgbm', 'n_estimators': 114, 'max_depth': 5, 'learning_rate': 0.1999390299592037}. Best is trial 32 with value: 0.8144153758664021.
[I 2025-08-20 11:51:04,023] Trial 33 finished with value: 0.8058173853104356 and parameters: {'model_type': 'lgbm', 'n_estimators': 55, 'max_depth': 6, 'learning_rate': 0.20199813984647572}. Best is trial 32 with value: 0.8144153758664021.
[I 2025-08-20 11:51:04,056] Trial 34 finished with value: 0.8033975201970209 and parameters: {'model_type': 'lgbm', 'n_estimators': 52, 'max_depth': 6, 'learning_rate': 0.1989576698076533}. Best is trial 32 with value: 0.8144153758664021.
[I 2025-08-20 11:51:04,105] Trial 35 finished with value: 0.7997610349432469 and parameters: {'model_type': 'lgbm', 'n_estimators': 114, 'max_depth': 5, 'learning_rate': 0.17718588051111592}. Best is trial 32 with value: 0.8144153758664021.
[I 2025-08-20 11:51:04,143] Trial 36 finished with value: 0.7922279337628959 and parameters: {'model_type': 'lgbm', 'n_estimators': 68, 'max_depth': 6, 'learning_rate': 0.2045758824990349}. Best is trial 32 with value: 0.8144153758664021.
[I 2025-08-20 11:51:04,187] Trial 37 finished with value: 0.7941434357012646 and parameters: {'model_type': 'lgbm', 'n_estimators': 128, 'max_depth': 4, 'learning_rate': 0.23019053655151497}. Best is trial 32 with value: 0.8144153758664021.
[I 2025-08-20 11:51:04,807] Trial 38 finished with value: 0.7630750881162105 and parameters: {'model_type': 'xgb', 'n_estimators': 94, 'max_depth': 7, 'learning_rate': 0.25567554138326354}. Best is trial 32 with value: 0.8144153758664021.
[I 2025-08-20 11:51:04,817] Trial 39 finished with value: 0.45779084840389184 and parameters: {'model_type': 'bayesian_ridge', 'alpha_1': 0.0009887333556461717, 'alpha_2': 0.0009423073814952792, 'lambda_1': 5.60438306079021e-06, 'lambda_2': 0.0009378637512211955}. Best is trial 32 with value: 0.8144153758664021.
[I 2025-08-20 11:51:04,850] Trial 40 finished with value: 0.8185526337033482 and parameters: {'model_type': 'lgbm', 'n_estimators': 61, 'max_depth': 5, 'learning_rate': 0.1714604057565191}. Best is trial 40 with value: 0.8185526337033482.
[I 2025-08-20 11:51:04,882] Trial 41 finished with value: 0.8100057687271982 and parameters: {'model_type': 'lgbm', 'n_estimators': 57, 'max_depth': 5, 'learning_rate': 0.1697805927902013}. Best is trial 40 with value: 0.8185526337033482.
[I 2025-08-20 11:51:04,917] Trial 42 finished with value: 0.80189687905536 and parameters: {'model_type': 'lgbm', 'n_estimators': 65, 'max_depth': 5, 'learning_rate': 0.1663872438056184}. Best is trial 40 with value: 0.8185526337033482.
[I 2025-08-20 11:51:04,952] Trial 43 finished with value: 0.8077266731251538 and parameters: {'model_type': 'lgbm', 'n_estimators': 65, 'max_depth': 5, 'learning_rate': 0.1876251780580093}. Best is trial 40 with value: 0.8185526337033482.
[I 2025-08-20 11:51:04,987] Trial 44 finished with value: 0.8196914149074336 and parameters: {'model_type': 'lgbm', 'n_estimators': 66, 'max_depth': 5, 'learning_rate': 0.14402706613513713}. Best is trial 44 with value: 0.8196914149074336.
[I 2025-08-20 11:51:05,019] Trial 45 finished with value: 0.8084558944597197 and parameters: {'model_type': 'lgbm', 'n_estimators': 76, 'max_depth': 4, 'learning_rate': 0.14036177885487347}. Best is trial 44 with value: 0.8196914149074336.
[I 2025-08-20 11:51:05,063] Trial 46 finished with value: 0.8145970887415133 and parameters: {'model_type': 'lgbm', 'n_estimators': 89, 'max_depth': 5, 'learning_rate': 0.10933358445710614}. Best is trial 44 with value: 0.8196914149074336.
[I 2025-08-20 11:51:05,209] Trial 47 finished with value: 0.7732692294453569 and parameters: {'model_type': 'rf', 'n_estimators': 88, 'max_depth': 8, 'min_samples_split': 2}. Best is trial 44 with value: 0.8196914149074336.
[I 2025-08-20 11:51:05,219] Trial 48 finished with value: 0.45779091554378926 and parameters: {'model_type': 'bayesian_ridge', 'alpha_1': 9.404936432464697e-05, 'alpha_2': 0.0008188863698464783, 'lambda_1': 0.0009908112860114052, 'lambda_2': 0.0009892838286694153}. Best is trial 44 with value: 0.8196914149074336.
[I 2025-08-20 11:51:05,681] Trial 49 finished with value: 0.7838556135155395 and parameters: {'model_type': 'xgb', 'n_estimators': 100, 'max_depth': 5, 'learning_rate': 0.07299396435386168}. Best is trial 44 with value: 0.8196914149074336.
Regression Results:
  Train R²: 0.864
  Test R²: 0.820
  CV R²: 0.510 ± 0.239
Failed to save comparison file: Object of type ndarray is not JSON serializable

==================================================
ANALYSIS COMPLETE
==================================================
Check the following directories for outputs:
  - plots/: Visualization files
  - results/: Data files and reports
  - models/: Trained model files
