=== ML Measurable HTE Rate Bias Analysis ===

==================================================
Running HTE Prediction Analysis: each with 8 features
==================================================

=== Loading Data ===
Number of HTE rates: 1031
Found 5 hydrogen-dependent features: ['num_Hs', 'BV_Hs_avg', 'Charges_Hs_avg', 'fukui_E_Hs_avg', 'fukui_N_Hs_avg']
Found 2 pKa-dependent features: ['pka_aHs', 'pka_lowest']
Found 26 heteroatom-dependent features: ['BV_main_1', 'Charges_main_atom', 'fukui_E_main_atom', 'fukui_N_main_atom', 'L_main_atom_1', 'L_main_atom_2', 'B1_main_atom_1', 'B1_main_atom_2', 'B5_main_atom_1', 'B5_main_atom_2', 'Charges_secondary_1', 'Charges_secondary_2', 'fukui_N_secondary_1', 'fukui_N_secondary_2', 'Charges_secondary_avg', 'fukui_N_secondary_avg', 'FCS_1', 'FREQS_1', 'FCS_2', 'FREQS_2', 'FCS_avg', 'FREQS_avg', 'BV_Hs_avg', 'Charges_Hs_avg', 'fukui_E_Hs_avg', 'fukui_N_Hs_avg']

Processing num_Hs conditional features...
  18/46 molecules meet condition num_Hs
    num_Hs: 0 -> 0 NA values
    BV_Hs_avg: 28 -> 0 NA values
    Charges_Hs_avg: 28 -> 0 NA values
    fukui_E_Hs_avg: 28 -> 0 NA values
    fukui_N_Hs_avg: 28 -> 0 NA values

Processing pKa_features conditional features...
  18/46 molecules meet condition pKa_features
    Processing pKa feature pka_aHs with special handling...
      Created indicator: has_acidic_H_for_pka_aHs
      Created interaction: pka_aHs_x_has_acidic_H
      Used 50.0 for molecules without acidic H
    pka_aHs: 28 -> 0 NA values
    Processing pKa feature pka_lowest with special handling...
      Created indicator: has_acidic_H_for_pka_lowest
      Created interaction: pka_lowest_x_has_acidic_H
      Used 50.0 for molecules without acidic H
    pka_lowest: 38 -> 0 NA values

Handling remaining NA values...

Encoding categorical features...
  Removed identifier feature: name
  Found categorical feature class with 4 unique values: ['aromatic' 'hetero' 'aliphatic' 'mixture']
    One-hot encoded class -> 4 features: ['class_aliphatic', 'class_aromatic', 'class_hetero', 'class_mixture']
  Removed identifier feature: smiles
  Processed 1 categorical features
  Removed 2 identifier features: ['name', 'smiles']

Creating feature quality indicators...
  Added indicator: has_num_Hs
  Added indicator: has_pKa_features
Preprocessing complete. Shape: (46, 65)
Remaining NA values: 0
Found 1 pKa-dependent features: ['pka_basic']
Warning: num_Hs column not found, cannot properly handle pKa features
Found 15 heteroatom-dependent features: ['BV_main_1', 'Charges_main_atom', 'fukui_E_main_atom', 'fukui_N_main_atom', 'L_main_atom_1', 'B1_main_atom_1', 'B5_main_atom_1', 'Charges_secondary_1', 'fukui_N_secondary_1', 'Charges_secondary_avg', 'fukui_N_secondary_avg', 'FCS_1', 'FREQS_1', 'FCS_avg', 'FREQS_avg']

Handling remaining NA values...
  pka_basic: Filled 1 NA values with median/zero
  smiles: Filled 1 NA values with mode/unknown
  class: Filled 1 NA values with mode/unknown

Encoding categorical features...
  Removed identifier feature: name
  Removed identifier feature: smiles
  Found categorical feature class with 5 unique values: ['1_aliphatic' '1_aromatic' '2_aliphatic' '1_mixture' '2_mixture']
    One-hot encoded class -> 5 features: ['class_1_aliphatic', 'class_1_aromatic', 'class_1_mixture', 'class_2_aliphatic', 'class_2_mixture']
  Processed 1 categorical features
  Removed 2 identifier features: ['name', 'smiles']

Creating feature quality indicators...
Preprocessing complete. Shape: (55, 40)
Remaining NA values: 0
Loaded reaction energy features: 1488 rows, 8 features

=== Selecting Features (selected) ===
Final selected features (8): ['amine_Charges_secondary_1', 'amine_BV_secondary_avg', 'acyl_BV_secondary_2', 'amine_class_1_mixture', 'acyl_Charges_secondary_1', 'amine_pka_basic', 'acyl_class_aromatic', 'acyl_pka_aHs_x_has_acidic_H']
=== Building HTE Prediction Models with 8 features ===
Selected features: ['amine_Charges_secondary_1', 'amine_BV_secondary_avg', 'acyl_BV_secondary_2', 'amine_class_1_mixture', 'acyl_Charges_secondary_1', 'amine_pka_basic', 'acyl_class_aromatic', 'acyl_pka_aHs_x_has_acidic_H']
Valid features: 17
=== Building Regression Model ===
Regression dataset: (1031, 17)
Target range: -1.418 to 4.010


Training data: 619 samples
Test data: 206 samples


Train-only SFS selected 16 features for regression
Running hyperparameter optimization for regression...
[I 2025-08-20 11:43:41,252] A new study created in memory with name: no-name-a41a267c-ff71-412d-9fdb-09ab98953a16
[I 2025-08-20 11:43:42,170] Trial 0 finished with value: 0.7530764680336303 and parameters: {'model_type': 'xgb', 'n_estimators': 155, 'max_depth': 4, 'learning_rate': 0.24653956208546376}. Best is trial 0 with value: 0.7530764680336303.
[I 2025-08-20 11:43:42,802] Trial 1 finished with value: 0.753915023302813 and parameters: {'model_type': 'rf', 'n_estimators': 146, 'max_depth': 14, 'min_samples_split': 2}. Best is trial 1 with value: 0.753915023302813.
[I 2025-08-20 11:43:42,873] Trial 2 finished with value: 0.5866907764259459 and parameters: {'model_type': 'bayesian_ridge', 'alpha_1': 0.0006092854604897226, 'alpha_2': 0.00044674267237610556, 'lambda_1': 0.0008375757667079512, 'lambda_2': 0.0003082698729106293}. Best is trial 1 with value: 0.753915023302813.
[I 2025-08-20 11:43:43,162] Trial 3 finished with value: 0.7183769129235804 and parameters: {'model_type': 'xgb', 'n_estimators': 101, 'max_depth': 9, 'learning_rate': 0.12245419097058349}. Best is trial 1 with value: 0.753915023302813.
[I 2025-08-20 11:43:43,165] Trial 4 finished with value: 0.5866924575218948 and parameters: {'model_type': 'bayesian_ridge', 'alpha_1': 0.0009210967101561494, 'alpha_2': 8.244714021589939e-05, 'lambda_1': 0.000963781861364282, 'lambda_2': 0.0006311499416830205}. Best is trial 1 with value: 0.753915023302813.
[I 2025-08-20 11:43:43,398] Trial 5 finished with value: 0.7458781149245457 and parameters: {'model_type': 'xgb', 'n_estimators': 116, 'max_depth': 8, 'learning_rate': 0.18352529638123435}. Best is trial 1 with value: 0.753915023302813.
[I 2025-08-20 11:43:44,037] Trial 6 finished with value: 0.7577019216106172 and parameters: {'model_type': 'rf', 'n_estimators': 181, 'max_depth': 14, 'min_samples_split': 4}. Best is trial 6 with value: 0.7577019216106172.
[I 2025-08-20 11:43:46,269] Trial 7 finished with value: 0.7685071123081153 and parameters: {'model_type': 'xgb', 'n_estimators': 115, 'max_depth': 3, 'learning_rate': 0.2713463254265008}. Best is trial 7 with value: 0.7685071123081153.
[I 2025-08-20 11:43:49,855] Trial 8 finished with value: 0.7841848928602209 and parameters: {'model_type': 'cat', 'iterations': 562, 'depth': 5, 'learning_rate': 0.15734271269251482}. Best is trial 8 with value: 0.7841848928602209.
[I 2025-08-20 11:43:59,780] Trial 9 finished with value: 0.774021651600776 and parameters: {'model_type': 'cat', 'iterations': 618, 'depth': 6, 'learning_rate': 0.2129470321778721}. Best is trial 8 with value: 0.7841848928602209.
[I 2025-08-20 11:44:02,564] Trial 10 finished with value: 0.768455531016388 and parameters: {'model_type': 'cat', 'iterations': 311, 'depth': 4, 'learning_rate': 0.04900370102986901}. Best is trial 8 with value: 0.7841848928602209.
[I 2025-08-20 11:44:11,994] Trial 11 finished with value: 0.7814246593334135 and parameters: {'model_type': 'cat', 'iterations': 671, 'depth': 6, 'learning_rate': 0.170443063722799}. Best is trial 8 with value: 0.7841848928602209.
[I 2025-08-20 11:44:12,335] Trial 12 finished with value: 0.7650368439273141 and parameters: {'model_type': 'lgbm', 'n_estimators': 57, 'max_depth': 6, 'learning_rate': 0.11821490902492715}. Best is trial 8 with value: 0.7841848928602209.
[I 2025-08-20 11:44:25,641] Trial 13 finished with value: 0.7849685583726043 and parameters: {'model_type': 'cat', 'iterations': 781, 'depth': 7, 'learning_rate': 0.1426579057390283}. Best is trial 13 with value: 0.7849685583726043.
[I 2025-08-20 11:44:55,620] Trial 14 finished with value: 0.7646173627574138 and parameters: {'model_type': 'cat', 'iterations': 790, 'depth': 10, 'learning_rate': 0.10562998406449595}. Best is trial 13 with value: 0.7849685583726043.
[I 2025-08-20 11:45:03,001] Trial 15 finished with value: 0.7573049196815083 and parameters: {'model_type': 'cat', 'iterations': 432, 'depth': 8, 'learning_rate': 0.04618245702465586}. Best is trial 13 with value: 0.7849685583726043.
[I 2025-08-20 11:45:03,203] Trial 16 finished with value: 0.7740189749466045 and parameters: {'model_type': 'lgbm', 'n_estimators': 200, 'max_depth': 9, 'learning_rate': 0.0894203309514045}. Best is trial 13 with value: 0.7849685583726043.
[I 2025-08-20 11:45:09,886] Trial 17 finished with value: 0.7787027635821507 and parameters: {'model_type': 'cat', 'iterations': 549, 'depth': 4, 'learning_rate': 0.1587347287966877}. Best is trial 13 with value: 0.7849685583726043.
[I 2025-08-20 11:45:23,223] Trial 18 finished with value: 0.7723682654613814 and parameters: {'model_type': 'cat', 'iterations': 789, 'depth': 8, 'learning_rate': 0.21670661539842484}. Best is trial 13 with value: 0.7849685583726043.
[I 2025-08-20 11:45:28,032] Trial 19 finished with value: 0.7731918158538595 and parameters: {'model_type': 'cat', 'iterations': 461, 'depth': 6, 'learning_rate': 0.14444142966451845}. Best is trial 13 with value: 0.7849685583726043.
[I 2025-08-20 11:45:28,213] Trial 20 finished with value: 0.7481633480685963 and parameters: {'model_type': 'rf', 'n_estimators': 62, 'max_depth': 12, 'min_samples_split': 10}. Best is trial 13 with value: 0.7849685583726043.
[I 2025-08-20 11:45:36,188] Trial 21 finished with value: 0.7892481550911901 and parameters: {'model_type': 'cat', 'iterations': 646, 'depth': 6, 'learning_rate': 0.17709474258904886}. Best is trial 21 with value: 0.7892481550911901.
[I 2025-08-20 11:45:42,506] Trial 22 finished with value: 0.7947529607288725 and parameters: {'model_type': 'cat', 'iterations': 673, 'depth': 5, 'learning_rate': 0.18924239452395053}. Best is trial 22 with value: 0.7947529607288725.
[I 2025-08-20 11:45:51,572] Trial 23 finished with value: 0.7851528602681982 and parameters: {'model_type': 'cat', 'iterations': 700, 'depth': 7, 'learning_rate': 0.2047912439967979}. Best is trial 22 with value: 0.7947529607288725.
[I 2025-08-20 11:45:51,585] Trial 24 finished with value: 0.5866943159219898 and parameters: {'model_type': 'bayesian_ridge', 'alpha_1': 1.6308058719405403e-05, 'alpha_2': 0.0009839004275051782, 'lambda_1': 2.5740992424192258e-05, 'lambda_2': 0.0009626012563953582}. Best is trial 22 with value: 0.7947529607288725.
[I 2025-08-20 11:45:51,649] Trial 25 finished with value: 0.7527046438174977 and parameters: {'model_type': 'lgbm', 'n_estimators': 85, 'max_depth': 5, 'learning_rate': 0.20853347962068391}. Best is trial 22 with value: 0.7947529607288725.
[I 2025-08-20 11:46:00,512] Trial 26 finished with value: 0.776453141385867 and parameters: {'model_type': 'cat', 'iterations': 678, 'depth': 7, 'learning_rate': 0.2491889355412713}. Best is trial 22 with value: 0.7947529607288725.
[I 2025-08-20 11:46:07,191] Trial 27 finished with value: 0.7848123770065847 and parameters: {'model_type': 'cat', 'iterations': 691, 'depth': 5, 'learning_rate': 0.19173847441992076}. Best is trial 22 with value: 0.7947529607288725.
[I 2025-08-20 11:46:15,907] Trial 28 finished with value: 0.7929041744995642 and parameters: {'model_type': 'cat', 'iterations': 629, 'depth': 5, 'learning_rate': 0.2371635930063352}. Best is trial 22 with value: 0.7947529607288725.
[I 2025-08-20 11:46:21,873] Trial 29 finished with value: 0.7581701491800534 and parameters: {'model_type': 'cat', 'iterations': 581, 'depth': 5, 'learning_rate': 0.24642694808508875}. Best is trial 22 with value: 0.7947529607288725.
[I 2025-08-20 11:46:22,002] Trial 30 finished with value: 0.7651281686832057 and parameters: {'model_type': 'lgbm', 'n_estimators': 146, 'max_depth': 7, 'learning_rate': 0.2998495807816438}. Best is trial 22 with value: 0.7947529607288725.
[I 2025-08-20 11:46:29,941] Trial 31 finished with value: 0.7781492889084768 and parameters: {'model_type': 'cat', 'iterations': 693, 'depth': 6, 'learning_rate': 0.22817272231882535}. Best is trial 22 with value: 0.7947529607288725.
[I 2025-08-20 11:46:36,154] Trial 32 finished with value: 0.7842437483544431 and parameters: {'model_type': 'cat', 'iterations': 628, 'depth': 5, 'learning_rate': 0.1896068439033576}. Best is trial 22 with value: 0.7947529607288725.
[I 2025-08-20 11:46:36,406] Trial 33 finished with value: 0.7534787151088197 and parameters: {'model_type': 'rf', 'n_estimators': 82, 'max_depth': 11, 'min_samples_split': 9}. Best is trial 22 with value: 0.7947529607288725.
[I 2025-08-20 11:46:36,416] Trial 34 finished with value: 0.5866892413145329 and parameters: {'model_type': 'bayesian_ridge', 'alpha_1': 1.7333393865479854e-05, 'alpha_2': 0.0009451327175243941, 'lambda_1': 0.00022499219828272566, 'lambda_2': 1.6289746162973266e-06}. Best is trial 22 with value: 0.7947529607288725.
[I 2025-08-20 11:46:50,106] Trial 35 finished with value: 0.7866842282532818 and parameters: {'model_type': 'cat', 'iterations': 720, 'depth': 8, 'learning_rate': 0.20015168995495883}. Best is trial 22 with value: 0.7947529607288725.
[I 2025-08-20 11:46:50,501] Trial 36 finished with value: 0.7658785197041 and parameters: {'model_type': 'xgb', 'n_estimators': 169, 'max_depth': 3, 'learning_rate': 0.23336611516384262}. Best is trial 22 with value: 0.7947529607288725.
[I 2025-08-20 11:47:08,557] Trial 37 finished with value: 0.7613837796307269 and parameters: {'model_type': 'cat', 'iterations': 740, 'depth': 9, 'learning_rate': 0.2712947645840858}. Best is trial 22 with value: 0.7947529607288725.
[I 2025-08-20 11:47:08,576] Trial 38 finished with value: 0.5866942076174642 and parameters: {'model_type': 'bayesian_ridge', 'alpha_1': 0.0004455176842383162, 'alpha_2': 9.70261245573055e-06, 'lambda_1': 0.0005221448039222277, 'lambda_2': 0.0009541792381067858}. Best is trial 22 with value: 0.7947529607288725.
[I 2025-08-20 11:47:09,453] Trial 39 finished with value: 0.7700964270742862 and parameters: {'model_type': 'xgb', 'n_estimators': 199, 'max_depth': 5, 'learning_rate': 0.1682883689166893}. Best is trial 22 with value: 0.7947529607288725.
[I 2025-08-20 11:47:09,883] Trial 40 finished with value: 0.7556818633298231 and parameters: {'model_type': 'rf', 'n_estimators': 131, 'max_depth': 15, 'min_samples_split': 7}. Best is trial 22 with value: 0.7947529607288725.
[I 2025-08-20 11:47:25,562] Trial 41 finished with value: 0.8019752761215242 and parameters: {'model_type': 'cat', 'iterations': 721, 'depth': 8, 'learning_rate': 0.19689704702641078}. Best is trial 41 with value: 0.8019752761215242.
[I 2025-08-20 11:47:36,223] Trial 42 finished with value: 0.790428815691184 and parameters: {'model_type': 'cat', 'iterations': 631, 'depth': 8, 'learning_rate': 0.18985817188498258}. Best is trial 41 with value: 0.8019752761215242.
[I 2025-08-20 11:47:51,109] Trial 43 finished with value: 0.7785513844653005 and parameters: {'model_type': 'cat', 'iterations': 626, 'depth': 9, 'learning_rate': 0.1787642247965924}. Best is trial 41 with value: 0.8019752761215242.
[I 2025-08-20 11:48:02,836] Trial 44 finished with value: 0.7817798109934149 and parameters: {'model_type': 'cat', 'iterations': 634, 'depth': 8, 'learning_rate': 0.2323974137909069}. Best is trial 41 with value: 0.8019752761215242.
[I 2025-08-20 11:48:15,487] Trial 45 finished with value: 0.7765665244936528 and parameters: {'model_type': 'cat', 'iterations': 507, 'depth': 9, 'learning_rate': 0.18216462485749357}. Best is trial 41 with value: 0.8019752761215242.
[I 2025-08-20 11:48:23,152] Trial 46 finished with value: 0.774325705467732 and parameters: {'model_type': 'cat', 'iterations': 736, 'depth': 5, 'learning_rate': 0.14674438697670236}. Best is trial 41 with value: 0.8019752761215242.
[I 2025-08-20 11:48:23,698] Trial 47 finished with value: 0.7252260458099835 and parameters: {'model_type': 'xgb', 'n_estimators': 81, 'max_depth': 7, 'learning_rate': 0.25902626333905054}. Best is trial 41 with value: 0.8019752761215242.
[I 2025-08-20 11:48:33,559] Trial 48 finished with value: 0.7871283877657128 and parameters: {'model_type': 'cat', 'iterations': 603, 'depth': 6, 'learning_rate': 0.22560115279566256}. Best is trial 41 with value: 0.8019752761215242.
[I 2025-08-20 11:48:45,655] Trial 49 finished with value: 0.7932663443598069 and parameters: {'model_type': 'cat', 'iterations': 654, 'depth': 7, 'learning_rate': 0.19483845804569722}. Best is trial 41 with value: 0.8019752761215242.
Regression Results:
  Train R²: 0.968
  Test R²: 0.802
  CV R²: 0.419 ± 0.202

=== Generating Visualizations ===
=== Evaluating CatBoost with Parity Plots ===
Model Performance:
  Train R²: 0.968, MAE: 0.104, RMSE: 0.161
  Test R²: 0.802, MAE: 0.326, RMSE: 0.427
Generating parity plots...
Parity plot saved as: plots/parity_plot_catboost_train_each_8_optuna_ens7_gpu3_train.png
Parity plot saved as: plots/parity_plot_catboost_test_each_8_optuna_ens7_gpu3_test.png
Parity analysis plot saved as: plots/parity_analysis_catboost_test_each_8_optuna_ens7_gpu3_analysis.png
Saved predictions to results/predictions_each_8_optuna_ens7_gpu3.csv
Saved combined dataset to results/combined_df_each_8_optuna_ens7_gpu3.csv
Models saved with suffix: _each_8_optuna_ens7_gpu3
HTE prediction evaluation report saved to results/reports/hte_prediction_report_manual_8_each_8_optuna_ens7_gpu3.txt

=== Comparing without reaction-energy features (HTE prediction) ===
=== Building HTE Prediction Models with 8 features ===
Selected features: ['amine_Charges_secondary_1', 'amine_BV_secondary_avg', 'acyl_BV_secondary_2', 'amine_class_1_mixture', 'acyl_Charges_secondary_1', 'amine_pka_basic', 'acyl_class_aromatic', 'acyl_pka_aHs_x_has_acidic_H']
Valid features: 9
=== Building Regression Model ===
Regression dataset: (1031, 9)
Target range: -1.418 to 4.010


Training data: 619 samples
Test data: 206 samples


Train-only SFS selected 8 features for regression
Running hyperparameter optimization for regression...
[I 2025-08-20 11:50:50,343] A new study created in memory with name: no-name-3d85c5fb-2090-4633-9dda-03d9acae611f
[I 2025-08-20 11:50:50,472] Trial 0 finished with value: 0.7827398018821866 and parameters: {'model_type': 'xgb', 'n_estimators': 61, 'max_depth': 3, 'learning_rate': 0.2555966207782967}. Best is trial 0 with value: 0.7827398018821866.
[I 2025-08-20 11:50:50,599] Trial 1 finished with value: 0.7779403148409019 and parameters: {'model_type': 'rf', 'n_estimators': 87, 'max_depth': 8, 'min_samples_split': 4}. Best is trial 0 with value: 0.7827398018821866.
[I 2025-08-20 11:50:55,953] Trial 2 finished with value: 0.7969994678193606 and parameters: {'model_type': 'cat', 'iterations': 686, 'depth': 5, 'learning_rate': 0.0392969118888213}. Best is trial 2 with value: 0.7969994678193606.
[I 2025-08-20 11:50:55,957] Trial 3 finished with value: 0.45777896407293195 and parameters: {'model_type': 'bayesian_ridge', 'alpha_1': 0.0002913252618328732, 'alpha_2': 0.0007287710716624435, 'lambda_1': 0.00044347819852201656, 'lambda_2': 5.725364928260594e-05}. Best is trial 2 with value: 0.7969994678193606.
[I 2025-08-20 11:50:56,009] Trial 4 finished with value: 0.7949334818821594 and parameters: {'model_type': 'lgbm', 'n_estimators': 78, 'max_depth': 8, 'learning_rate': 0.1953810710201773}. Best is trial 2 with value: 0.7969994678193606.
[I 2025-08-20 11:50:56,011] Trial 5 finished with value: 0.4577908929965804 and parameters: {'model_type': 'bayesian_ridge', 'alpha_1': 0.0009717974221397486, 'alpha_2': 0.000538578312385349, 'lambda_1': 0.0009636782072875144, 'lambda_2': 0.0009855569818683363}. Best is trial 2 with value: 0.7969994678193606.
[I 2025-08-20 11:51:06,513] Trial 6 finished with value: 0.7862416468465541 and parameters: {'model_type': 'cat', 'iterations': 734, 'depth': 7, 'learning_rate': 0.2164453313071835}. Best is trial 2 with value: 0.7969994678193606.
[I 2025-08-20 11:51:06,517] Trial 7 finished with value: 0.45778663588712676 and parameters: {'model_type': 'bayesian_ridge', 'alpha_1': 1.1202513734934532e-05, 'alpha_2': 0.0002802843903606994, 'lambda_1': 0.0008656084960001405, 'lambda_2': 0.0006569005865864609}. Best is trial 2 with value: 0.7969994678193606.
[I 2025-08-20 11:51:12,862] Trial 8 finished with value: 0.8019868218634353 and parameters: {'model_type': 'cat', 'iterations': 661, 'depth': 5, 'learning_rate': 0.1138228443000406}. Best is trial 8 with value: 0.8019868218634353.
[I 2025-08-20 11:51:12,867] Trial 9 finished with value: 0.45778353502659497 and parameters: {'model_type': 'bayesian_ridge', 'alpha_1': 0.0007200676620801595, 'alpha_2': 0.0006324883672659561, 'lambda_1': 0.00018501323191766756, 'lambda_2': 0.0003900331187451266}. Best is trial 8 with value: 0.8019868218634353.
[I 2025-08-20 11:51:15,652] Trial 10 finished with value: 0.8019057635202653 and parameters: {'model_type': 'cat', 'iterations': 300, 'depth': 4, 'learning_rate': 0.07660776606080213}. Best is trial 8 with value: 0.8019868218634353.
[I 2025-08-20 11:51:18,291] Trial 11 finished with value: 0.7987006945583633 and parameters: {'model_type': 'cat', 'iterations': 250, 'depth': 4, 'learning_rate': 0.08141965780610468}. Best is trial 8 with value: 0.8019868218634353.
[I 2025-08-20 11:51:21,120] Trial 12 finished with value: 0.8083400464633993 and parameters: {'model_type': 'cat', 'iterations': 344, 'depth': 4, 'learning_rate': 0.11601554435316329}. Best is trial 12 with value: 0.8083400464633993.
[I 2025-08-20 11:51:24,391] Trial 13 finished with value: 0.8027234828361665 and parameters: {'model_type': 'cat', 'iterations': 498, 'depth': 6, 'learning_rate': 0.12791838243120596}. Best is trial 12 with value: 0.8083400464633993.
