[I 2025-08-19 06:02:01,572] Trial 14 finished with value: 0.06045313806450181 and parameters: {'model_type': 'lgbm', 'n_estimators': 96, 'max_depth': 5, 'learning_rate': 0.25781586463760703}. Best is trial 13 with value: 0.11134364067666003.
[I 2025-08-19 06:03:30,810] Trial 15 finished with value: 0.11659790944239834 and parameters: {'model_type': 'xgb', 'n_estimators': 162, 'max_depth': 4, 'learning_rate': 0.022965033447508276}. Best is trial 15 with value: 0.11659790944239834.
[I 2025-08-19 06:04:38,007] Trial 16 finished with value: 0.08498544731324087 and parameters: {'model_type': 'xgb', 'n_estimators': 116, 'max_depth': 6, 'learning_rate': 0.012177391602149977}. Best is trial 15 with value: 0.11659790944239834.
[I 2025-08-19 06:04:57,923] Trial 17 finished with value: 0.12212506920866995 and parameters: {'model_type': 'xgb', 'n_estimators': 61, 'max_depth': 4, 'learning_rate': 0.02573899766780513}. Best is trial 17 with value: 0.12212506920866995.
[I 2025-08-19 06:04:58,144] Trial 18 finished with value: 0.03165582057507399 and parameters: {'model_type': 'lgbm', 'n_estimators': 70, 'max_depth': 3, 'learning_rate': 0.1101674642468364}. Best is trial 17 with value: 0.12212506920866995.
[I 2025-08-19 06:04:58,154] Trial 19 finished with value: 0.05349979834416674 and parameters: {'model_type': 'bayesian_ridge', 'alpha_1': 6.503561351236154e-06, 'alpha_2': 0.0009707983963594159, 'lambda_1': 2.9736635372816576e-05, 'lambda_2': 0.0009698932832052415}. Best is trial 17 with value: 0.12212506920866995.
[I 2025-08-19 06:06:11,592] Trial 20 finished with value: 0.09798018648058593 and parameters: {'model_type': 'xgb', 'n_estimators': 159, 'max_depth': 7, 'learning_rate': 0.07342941246158524}. Best is trial 17 with value: 0.12212506920866995.
[I 2025-08-19 06:06:39,075] Trial 21 finished with value: 0.12938857873005472 and parameters: {'model_type': 'xgb', 'n_estimators': 77, 'max_depth': 4, 'learning_rate': 0.024718601252734607}. Best is trial 21 with value: 0.12938857873005472.
[I 2025-08-19 06:07:01,717] Trial 22 finished with value: 0.12837802356070638 and parameters: {'model_type': 'xgb', 'n_estimators': 70, 'max_depth': 4, 'learning_rate': 0.04055188453550207}. Best is trial 21 with value: 0.12938857873005472.
[I 2025-08-19 06:07:28,626] Trial 23 finished with value: 0.06746053100729688 and parameters: {'model_type': 'xgb', 'n_estimators': 69, 'max_depth': 5, 'learning_rate': 0.04791293843839378}. Best is trial 21 with value: 0.12938857873005472.
[I 2025-08-19 06:07:46,936] Trial 24 finished with value: 0.07030197573864139 and parameters: {'model_type': 'xgb', 'n_estimators': 73, 'max_depth': 3, 'learning_rate': 0.10866873070600992}. Best is trial 21 with value: 0.12938857873005472.
[I 2025-08-19 06:08:03,890] Trial 25 finished with value: 0.10976627090288882 and parameters: {'model_type': 'xgb', 'n_estimators': 51, 'max_depth': 4, 'learning_rate': 0.08871154592356804}. Best is trial 21 with value: 0.12938857873005472.
[I 2025-08-19 06:08:43,179] Trial 26 finished with value: 0.09872805340762325 and parameters: {'model_type': 'xgb', 'n_estimators': 85, 'max_depth': 6, 'learning_rate': 0.03999995583558731}. Best is trial 21 with value: 0.12938857873005472.
[I 2025-08-19 06:08:43,357] Trial 27 finished with value: 0.11005777776863579 and parameters: {'model_type': 'lgbm', 'n_estimators': 62, 'max_depth': 10, 'learning_rate': 0.14298169004067052}. Best is trial 21 with value: 0.12938857873005472.
[I 2025-08-19 06:08:43,369] Trial 28 finished with value: 0.05350311954517861 and parameters: {'model_type': 'bayesian_ridge', 'alpha_1': 0.0009961784665504445, 'alpha_2': 1.507022756784646e-05, 'lambda_1': 0.00019576876997201814, 'lambda_2': 7.944551575334447e-05}. Best is trial 21 with value: 0.12938857873005472.
[I 2025-08-19 06:09:16,466] Trial 29 finished with value: 0.067486667270506 and parameters: {'model_type': 'xgb', 'n_estimators': 85, 'max_depth': 5, 'learning_rate': 0.03886356737432285}. Best is trial 21 with value: 0.12938857873005472.
[I 2025-08-19 06:09:53,436] Trial 30 finished with value: 0.09980937221171293 and parameters: {'model_type': 'xgb', 'n_estimators': 81, 'max_depth': 4, 'learning_rate': 0.08446781381439772}. Best is trial 21 with value: 0.12938857873005472.
[I 2025-08-19 06:10:12,155] Trial 31 finished with value: 0.049942271384157744 and parameters: {'model_type': 'xgb', 'n_estimators': 58, 'max_depth': 4, 'learning_rate': 0.014150083576567296}. Best is trial 21 with value: 0.12938857873005472.
[I 2025-08-19 06:10:39,210] Trial 32 finished with value: 0.09525999453599987 and parameters: {'model_type': 'xgb', 'n_estimators': 107, 'max_depth': 3, 'learning_rate': 0.037285501248361844}. Best is trial 21 with value: 0.12938857873005472.
[I 2025-08-19 06:11:03,889] Trial 33 finished with value: 0.13060686709673874 and parameters: {'model_type': 'xgb', 'n_estimators': 77, 'max_depth': 4, 'learning_rate': 0.028134708155561988}. Best is trial 33 with value: 0.13060686709673874.
[I 2025-08-19 06:11:35,106] Trial 34 finished with value: 0.054758914616662935 and parameters: {'model_type': 'xgb', 'n_estimators': 79, 'max_depth': 5, 'learning_rate': 0.06309723058558572}. Best is trial 33 with value: 0.13060686709673874.
[I 2025-08-19 06:11:42,109] Trial 35 finished with value: 0.09235574681031367 and parameters: {'model_type': 'xgb', 'n_estimators': 64, 'max_depth': 3, 'learning_rate': 0.03200001861162352}. Best is trial 33 with value: 0.13060686709673874.
[I 2025-08-19 06:11:42,194] Trial 36 finished with value: 0.06260978434941122 and parameters: {'model_type': 'rf', 'n_estimators': 90, 'max_depth': 14, 'min_samples_split': 2}. Best is trial 33 with value: 0.13060686709673874.
[I 2025-08-19 06:11:42,320] Trial 37 finished with value: 0.11500795563575772 and parameters: {'model_type': 'xgb', 'n_estimators': 75, 'max_depth': 4, 'learning_rate': 0.22032095668973634}. Best is trial 33 with value: 0.13060686709673874.
[I 2025-08-19 06:11:42,378] Trial 38 finished with value: 0.0706016770348662 and parameters: {'model_type': 'rf', 'n_estimators': 59, 'max_depth': 11, 'min_samples_split': 2}. Best is trial 33 with value: 0.13060686709673874.
[I 2025-08-19 06:11:42,387] Trial 39 finished with value: 0.053502617757371196 and parameters: {'model_type': 'bayesian_ridge', 'alpha_1': 5.295884655269934e-06, 'alpha_2': 0.0004396779841270769, 'lambda_1': 0.0004955936598398687, 'lambda_2': 0.0005046479555938103}. Best is trial 33 with value: 0.13060686709673874.
[I 2025-08-19 06:11:42,577] Trial 40 finished with value: 0.10011955809794837 and parameters: {'model_type': 'xgb', 'n_estimators': 104, 'max_depth': 6, 'learning_rate': 0.0971566743050758}. Best is trial 33 with value: 0.13060686709673874.
[I 2025-08-19 06:11:42,810] Trial 41 finished with value: 0.11464367240829654 and parameters: {'model_type': 'xgb', 'n_estimators': 167, 'max_depth': 4, 'learning_rate': 0.02333077516879125}. Best is trial 33 with value: 0.13060686709673874.
[I 2025-08-19 06:11:43,069] Trial 42 finished with value: 0.09320545026909255 and parameters: {'model_type': 'xgb', 'n_estimators': 179, 'max_depth': 4, 'learning_rate': 0.05675892395819045}. Best is trial 33 with value: 0.13060686709673874.
[I 2025-08-19 06:11:43,370] Trial 43 finished with value: 0.04808349203702533 and parameters: {'model_type': 'xgb', 'n_estimators': 148, 'max_depth': 5, 'learning_rate': 0.048074647867219905}. Best is trial 33 with value: 0.13060686709673874.
[I 2025-08-19 06:11:43,511] Trial 44 finished with value: 0.13067336937041785 and parameters: {'model_type': 'xgb', 'n_estimators': 93, 'max_depth': 4, 'learning_rate': 0.025360153542596853}. Best is trial 44 with value: 0.13067336937041785.
[I 2025-08-19 06:11:43,595] Trial 45 finished with value: 0.07149518650795039 and parameters: {'model_type': 'rf', 'n_estimators': 93, 'max_depth': 7, 'min_samples_split': 7}. Best is trial 44 with value: 0.13067336937041785.
[I 2025-08-19 06:11:43,678] Trial 46 finished with value: 0.10345271327640371 and parameters: {'model_type': 'xgb', 'n_estimators': 66, 'max_depth': 3, 'learning_rate': 0.060832392882265066}. Best is trial 44 with value: 0.13067336937041785.
[I 2025-08-19 06:11:43,767] Trial 47 finished with value: 0.13120713871655532 and parameters: {'model_type': 'lgbm', 'n_estimators': 79, 'max_depth': 4, 'learning_rate': 0.03010462407057784}. Best is trial 47 with value: 0.13120713871655532.
[I 2025-08-19 06:11:43,871] Trial 48 finished with value: 0.060477164950583084 and parameters: {'model_type': 'lgbm', 'n_estimators': 78, 'max_depth': 5, 'learning_rate': 0.07789794695727591}. Best is trial 47 with value: 0.13120713871655532.
[I 2025-08-19 06:11:43,937] Trial 49 finished with value: 0.06371880736635016 and parameters: {'model_type': 'lgbm', 'n_estimators': 97, 'max_depth': 3, 'learning_rate': 0.04899361787626008}. Best is trial 47 with value: 0.13120713871655532.
Regression Results:
  Train R²: 0.453
  Test R²: 0.131
  CV R²: 0.128 ± 0.241
Saved comparison to results/rxn_feature_comparison_hte_in_all_12_optuna.json

==================================================
ANALYSIS COMPLETE
==================================================
Check the following directories for outputs:
  - plots/: Visualization files
  - results/: Data files and reports
  - models/: Trained model files
