[I 2025-08-19 05:04:04,779] Trial 13 finished with value: 0.2513125796275688 and parameters: {'model_type': 'bayesian_ridge', 'alpha_1': 4.894492686919818e-06, 'alpha_2': 0.0009617227586129576, 'lambda_1': 0.0007688930580939912, 'lambda_2': 0.0009523560022735246}. Best is trial 11 with value: 0.25131325181839714.
[I 2025-08-19 05:04:04,800] Trial 14 finished with value: 0.2513047226008549 and parameters: {'model_type': 'bayesian_ridge', 'alpha_1': 1.2836011081350854e-05, 'alpha_2': 0.0005820436105010843, 'lambda_1': 0.0006101757754907223, 'lambda_2': 9.037674912134685e-06}. Best is trial 11 with value: 0.25131325181839714.
[I 2025-08-19 05:17:17,104] Trial 15 finished with value: 0.007200808625797972 and parameters: {'model_type': 'lgbm', 'n_estimators': 150, 'max_depth': 8, 'learning_rate': 0.010195825104277384}. Best is trial 11 with value: 0.25131325181839714.
[I 2025-08-19 05:17:17,142] Trial 16 finished with value: 0.25131047609011803 and parameters: {'model_type': 'bayesian_ridge', 'alpha_1': 0.0009697876391018159, 'alpha_2': 4.793605994294356e-05, 'lambda_1': 0.000468713007055524, 'lambda_2': 0.0006830935269288686}. Best is trial 11 with value: 0.25131325181839714.
[I 2025-08-19 05:17:17,155] Trial 17 finished with value: 0.251309445923553 and parameters: {'model_type': 'bayesian_ridge', 'alpha_1': 0.0002900960648046072, 'alpha_2': 0.0005943503271763295, 'lambda_1': 0.0003624963068286593, 'lambda_2': 0.000555482706183165}. Best is trial 11 with value: 0.25131325181839714.
[I 2025-08-19 05:17:17,168] Trial 18 finished with value: 0.25131068909957255 and parameters: {'model_type': 'bayesian_ridge', 'alpha_1': 0.0005652262543209266, 'alpha_2': 0.0003565433042395924, 'lambda_1': 0.0008425167013707141, 'lambda_2': 0.0007297267121325831}. Best is trial 11 with value: 0.25131325181839714.
[I 2025-08-19 05:20:46,227] Trial 19 finished with value: -0.09141259370183752 and parameters: {'model_type': 'lgbm', 'n_estimators': 50, 'max_depth': 8, 'learning_rate': 0.11221744038076362}. Best is trial 11 with value: 0.25131325181839714.
[I 2025-08-19 05:20:46,261] Trial 20 finished with value: 0.2513129476930448 and parameters: {'model_type': 'bayesian_ridge', 'alpha_1': 0.0001371833117425491, 'alpha_2': 0.0007745914365264792, 'lambda_1': 0.0006203880928921089, 'lambda_2': 0.000987870351688026}. Best is trial 11 with value: 0.25131325181839714.
[I 2025-08-19 05:20:46,298] Trial 21 finished with value: 0.25131299951307884 and parameters: {'model_type': 'bayesian_ridge', 'alpha_1': 0.00011245825639169833, 'alpha_2': 0.0007610108094592836, 'lambda_1': 0.0006362378011566024, 'lambda_2': 0.0009949456063387174}. Best is trial 11 with value: 0.25131325181839714.
[I 2025-08-19 05:20:46,333] Trial 22 finished with value: 0.2513130075841752 and parameters: {'model_type': 'bayesian_ridge', 'alpha_1': 0.0001896088497615219, 'alpha_2': 0.00078385330048425, 'lambda_1': 0.0006552748803181021, 'lambda_2': 0.0009969513563495745}. Best is trial 11 with value: 0.25131325181839714.
[I 2025-08-19 05:20:46,357] Trial 23 finished with value: 0.2513111527434446 and parameters: {'model_type': 'bayesian_ridge', 'alpha_1': 0.00040733939880828934, 'alpha_2': 0.0007647777377806259, 'lambda_1': 0.0009551444820790835, 'lambda_2': 0.0007918030039026097}. Best is trial 11 with value: 0.25131325181839714.
[I 2025-08-19 05:20:46,380] Trial 24 finished with value: 0.2513082181059262 and parameters: {'model_type': 'bayesian_ridge', 'alpha_1': 0.00016020855845752464, 'alpha_2': 0.000996099062463513, 'lambda_1': 0.000757944605856863, 'lambda_2': 0.0004318510822168359}. Best is trial 11 with value: 0.25131325181839714.
[I 2025-08-19 05:20:46,411] Trial 25 finished with value: 0.25131180336305725 and parameters: {'model_type': 'bayesian_ridge', 'alpha_1': 0.00035432549447700714, 'alpha_2': 0.0007525068917320271, 'lambda_1': 0.0004163990623510604, 'lambda_2': 0.0008396581220881257}. Best is trial 11 with value: 0.25131325181839714.
[I 2025-08-19 05:20:46,430] Trial 26 finished with value: 0.251306553425905 and parameters: {'model_type': 'bayesian_ridge', 'alpha_1': 0.00012612465934515454, 'alpha_2': 0.0008726922987218322, 'lambda_1': 0.0002623388765660834, 'lambda_2': 0.00020681519671468486}. Best is trial 11 with value: 0.25131325181839714.
[I 2025-08-19 05:23:09,445] Trial 27 finished with value: -0.012634540370006553 and parameters: {'model_type': 'lgbm', 'n_estimators': 86, 'max_depth': 4, 'learning_rate': 0.0779316062151742}. Best is trial 11 with value: 0.25131325181839714.
[I 2025-08-19 05:23:09,838] Trial 28 finished with value: -0.1125035434086572 and parameters: {'model_type': 'rf', 'n_estimators': 146, 'max_depth': 15, 'min_samples_split': 10}. Best is trial 11 with value: 0.25131325181839714.
[I 2025-08-19 05:27:35,672] Trial 29 finished with value: -0.2799190509117311 and parameters: {'model_type': 'xgb', 'n_estimators': 176, 'max_depth': 10, 'learning_rate': 0.19481424732841643}. Best is trial 11 with value: 0.25131325181839714.
[I 2025-08-19 05:27:35,699] Trial 30 finished with value: 0.2513097662879682 and parameters: {'model_type': 'bayesian_ridge', 'alpha_1': 0.0004576837016359017, 'alpha_2': 0.0006446606896403542, 'lambda_1': 0.0006877712132475929, 'lambda_2': 0.0006115790394682103}. Best is trial 11 with value: 0.25131325181839714.
[I 2025-08-19 05:27:35,712] Trial 31 finished with value: 0.25131269875083695 and parameters: {'model_type': 'bayesian_ridge', 'alpha_1': 0.00011190972393637495, 'alpha_2': 0.0007615428581343504, 'lambda_1': 0.0006055634818066406, 'lambda_2': 0.0009572728911747909}. Best is trial 11 with value: 0.25131325181839714.
[I 2025-08-19 05:27:35,726] Trial 32 finished with value: 0.2513127683337626 and parameters: {'model_type': 'bayesian_ridge', 'alpha_1': 0.00012516311130232241, 'alpha_2': 0.0008520881255849179, 'lambda_1': 0.0006976301740996141, 'lambda_2': 0.0009707891341076547}. Best is trial 11 with value: 0.25131325181839714.
[I 2025-08-19 05:27:35,743] Trial 33 finished with value: 0.2513133239019095 and parameters: {'model_type': 'bayesian_ridge', 'alpha_1': 0.00017901941219527668, 'alpha_2': 0.00070004877389924, 'lambda_1': 6.217849858311991e-06, 'lambda_2': 0.0009987447363401774}. Best is trial 33 with value: 0.2513133239019095.
[I 2025-08-19 05:27:35,767] Trial 34 finished with value: 0.25131193780943917 and parameters: {'model_type': 'bayesian_ridge', 'alpha_1': 0.0003116511203632588, 'alpha_2': 0.0006830252649959393, 'lambda_1': 1.3391348015635543e-05, 'lambda_2': 0.0008333430336026927}. Best is trial 33 with value: 0.2513133239019095.
[I 2025-08-19 05:27:35,781] Trial 35 finished with value: 0.25131224544889585 and parameters: {'model_type': 'bayesian_ridge', 'alpha_1': 0.0007283999096133078, 'alpha_2': 0.0004196844950533472, 'lambda_1': 5.651938510436765e-06, 'lambda_2': 0.0008691541952336612}. Best is trial 33 with value: 0.2513133239019095.
[I 2025-08-19 05:27:35,980] Trial 36 finished with value: -0.12195132334388581 and parameters: {'model_type': 'rf', 'n_estimators': 77, 'max_depth': 15, 'min_samples_split': 6}. Best is trial 33 with value: 0.2513133239019095.
[I 2025-08-19 05:29:18,605] Trial 37 finished with value: -0.314924535331905 and parameters: {'model_type': 'xgb', 'n_estimators': 129, 'max_depth': 3, 'learning_rate': 0.2862956374093831}. Best is trial 33 with value: 0.2513133239019095.
[I 2025-08-19 05:29:18,625] Trial 38 finished with value: 0.25131232910536705 and parameters: {'model_type': 'bayesian_ridge', 'alpha_1': 0.00022434410978242102, 'alpha_2': 0.0009233486857180148, 'lambda_1': 0.00015047177814335802, 'lambda_2': 0.0008879961100688099}. Best is trial 33 with value: 0.2513133239019095.
[I 2025-08-19 05:29:18,796] Trial 39 finished with value: -0.09612522537326562 and parameters: {'model_type': 'rf', 'n_estimators': 70, 'max_depth': 13, 'min_samples_split': 10}. Best is trial 33 with value: 0.2513133239019095.
[I 2025-08-19 05:29:18,809] Trial 40 finished with value: 0.25131126975849016 and parameters: {'model_type': 'bayesian_ridge', 'alpha_1': 6.344926286660527e-05, 'alpha_2': 0.0005289264815842099, 'lambda_1': 0.00021123483733227806, 'lambda_2': 0.0007645034976626823}. Best is trial 33 with value: 0.2513133239019095.
[I 2025-08-19 05:29:18,823] Trial 41 finished with value: 0.25131298033916616 and parameters: {'model_type': 'bayesian_ridge', 'alpha_1': 0.00018633105248851243, 'alpha_2': 0.0008019377553151497, 'lambda_1': 0.0005459193132299552, 'lambda_2': 0.0009876544191273603}. Best is trial 33 with value: 0.2513133239019095.
[I 2025-08-19 05:29:18,837] Trial 42 finished with value: 0.2513130286637387 and parameters: {'model_type': 'bayesian_ridge', 'alpha_1': 0.00020542586434243166, 'alpha_2': 0.0008333333022108475, 'lambda_1': 0.0005153630173112161, 'lambda_2': 0.0009917676176536688}. Best is trial 33 with value: 0.2513133239019095.
[I 2025-08-19 05:29:18,855] Trial 43 finished with value: 0.25131211398403863 and parameters: {'model_type': 'bayesian_ridge', 'alpha_1': 8.101908832927425e-05, 'alpha_2': 0.0006885353136147645, 'lambda_1': 0.0005185585125452865, 'lambda_2': 0.0008824903328438498}. Best is trial 33 with value: 0.2513133239019095.
[I 2025-08-19 05:32:48,663] Trial 44 finished with value: -0.24660727502548108 and parameters: {'model_type': 'xgb', 'n_estimators': 168, 'max_depth': 5, 'learning_rate': 0.16427624833941024}. Best is trial 33 with value: 0.2513133239019095.
[I 2025-08-19 05:32:48,678] Trial 45 finished with value: 0.2513132828340696 and parameters: {'model_type': 'bayesian_ridge', 'alpha_1': 0.00020891415929578835, 'alpha_2': 0.0009097583734574439, 'lambda_1': 7.779441128414856e-05, 'lambda_2': 0.0009980153217367031}. Best is trial 33 with value: 0.2513133239019095.
[I 2025-08-19 05:32:48,695] Trial 46 finished with value: 0.25131255715464706 and parameters: {'model_type': 'bayesian_ridge', 'alpha_1': 0.0003388579538900723, 'alpha_2': 0.0009249720105051419, 'lambda_1': 9.144637129329757e-05, 'lambda_2': 0.0009119260276030485}. Best is trial 33 with value: 0.2513133239019095.
[I 2025-08-19 05:40:08,861] Trial 47 finished with value: 0.01463351609252761 and parameters: {'model_type': 'lgbm', 'n_estimators': 135, 'max_depth': 8, 'learning_rate': 0.07222654484434243}. Best is trial 33 with value: 0.2513133239019095.
[I 2025-08-19 05:40:08,910] Trial 48 finished with value: 0.25131327625595745 and parameters: {'model_type': 'bayesian_ridge', 'alpha_1': 0.00022001041664774842, 'alpha_2': 0.000851700894742254, 'lambda_1': 6.78642634329321e-05, 'lambda_2': 0.000996607256558768}. Best is trial 33 with value: 0.2513133239019095.
[I 2025-08-19 05:40:08,937] Trial 49 finished with value: 0.25131174485698105 and parameters: {'model_type': 'bayesian_ridge', 'alpha_1': 0.000260540122833718, 'alpha_2': 0.0008594970566517956, 'lambda_1': 8.25863626212143e-05, 'lambda_2': 0.0008143560956450429}. Best is trial 33 with value: 0.2513133239019095.
Regression Results:
  Train R²: 0.448
  Test R²: 0.251
  CV R²: 0.269 ± 0.124
Saved comparison to results/rxn_feature_comparison_hte_each_8_optuna.json

==================================================
ANALYSIS COMPLETE
==================================================
Check the following directories for outputs:
  - plots/: Visualization files
  - results/: Data files and reports
  - models/: Trained model files
