[I 2025-08-19 05:55:48,207] Trial 13 finished with value: 0.0947908148842721 and parameters: {'model_type': 'xgb', 'n_estimators': 149, 'max_depth': 8, 'learning_rate': 0.16021937845470738}. Best is trial 4 with value: 0.1313493856962431.
[I 2025-08-19 05:55:48,346] Trial 14 finished with value: 0.08086492408958923 and parameters: {'model_type': 'rf', 'n_estimators': 101, 'max_depth': 15, 'min_samples_split': 10}. Best is trial 4 with value: 0.1313493856962431.
[I 2025-08-19 06:00:16,116] Trial 15 finished with value: 0.13473715120670893 and parameters: {'model_type': 'lgbm', 'n_estimators': 161, 'max_depth': 5, 'learning_rate': 0.15671431197052185}. Best is trial 15 with value: 0.13473715120670893.
[I 2025-08-19 06:01:45,943] Trial 16 finished with value: 0.14648181970933838 and parameters: {'model_type': 'lgbm', 'n_estimators': 111, 'max_depth': 4, 'learning_rate': 0.09760223539413351}. Best is trial 16 with value: 0.14648181970933838.
[I 2025-08-19 06:03:18,003] Trial 17 finished with value: 0.1433933128676529 and parameters: {'model_type': 'lgbm', 'n_estimators': 113, 'max_depth': 4, 'learning_rate': 0.06241668052763054}. Best is trial 16 with value: 0.14648181970933838.
[I 2025-08-19 06:03:18,110] Trial 18 finished with value: 0.124718640438093 and parameters: {'model_type': 'rf', 'n_estimators': 102, 'max_depth': 3, 'min_samples_split': 6}. Best is trial 16 with value: 0.14648181970933838.
[I 2025-08-19 06:04:14,872] Trial 19 finished with value: 0.10498374333195248 and parameters: {'model_type': 'xgb', 'n_estimators': 110, 'max_depth': 5, 'learning_rate': 0.021186644480584965}. Best is trial 16 with value: 0.14648181970933838.
[I 2025-08-19 06:04:26,769] Trial 20 finished with value: 0.1336403142659961 and parameters: {'model_type': 'lgbm', 'n_estimators': 78, 'max_depth': 5, 'learning_rate': 0.08064036166393229}. Best is trial 16 with value: 0.14648181970933838.
[I 2025-08-19 06:04:43,909] Trial 21 finished with value: 0.1336096450799864 and parameters: {'model_type': 'lgbm', 'n_estimators': 121, 'max_depth': 5, 'learning_rate': 0.1018201797590496}. Best is trial 16 with value: 0.14648181970933838.
[I 2025-08-19 06:04:51,577] Trial 22 finished with value: 0.17857373289146283 and parameters: {'model_type': 'lgbm', 'n_estimators': 86, 'max_depth': 4, 'learning_rate': 0.028172614461329626}. Best is trial 22 with value: 0.17857373289146283.
[I 2025-08-19 06:04:58,061] Trial 23 finished with value: 0.10607370186176635 and parameters: {'model_type': 'lgbm', 'n_estimators': 84, 'max_depth': 4, 'learning_rate': 0.010291535603599081}. Best is trial 22 with value: 0.17857373289146283.
[I 2025-08-19 06:05:07,231] Trial 24 finished with value: 0.1651841336454909 and parameters: {'model_type': 'lgbm', 'n_estimators': 88, 'max_depth': 4, 'learning_rate': 0.045745254231657755}. Best is trial 22 with value: 0.17857373289146283.
[I 2025-08-19 06:05:20,491] Trial 25 finished with value: 0.17111586410849589 and parameters: {'model_type': 'lgbm', 'n_estimators': 88, 'max_depth': 4, 'learning_rate': 0.03815932690223066}. Best is trial 22 with value: 0.17857373289146283.
[I 2025-08-19 06:05:41,850] Trial 26 finished with value: 0.13294590509871373 and parameters: {'model_type': 'lgbm', 'n_estimators': 85, 'max_depth': 6, 'learning_rate': 0.04243026028458321}. Best is trial 22 with value: 0.17857373289146283.
[I 2025-08-19 06:05:41,927] Trial 27 finished with value: 0.12706087912802277 and parameters: {'model_type': 'rf', 'n_estimators': 68, 'max_depth': 3, 'min_samples_split': 2}. Best is trial 22 with value: 0.17857373289146283.
[I 2025-08-19 06:06:20,952] Trial 28 finished with value: 0.13231168119917203 and parameters: {'model_type': 'xgb', 'n_estimators': 91, 'max_depth': 4, 'learning_rate': 0.040301692827693136}. Best is trial 22 with value: 0.17857373289146283.
[I 2025-08-19 06:06:20,969] Trial 29 finished with value: 0.04017327560868922 and parameters: {'model_type': 'bayesian_ridge', 'alpha_1': 0.0009806580761793824, 'alpha_2': 0.0009913977968717927, 'lambda_1': 0.0009282276961609795, 'lambda_2': 0.0009856883866780014}. Best is trial 22 with value: 0.17857373289146283.
[I 2025-08-19 06:06:27,514] Trial 30 finished with value: 0.13456995951125506 and parameters: {'model_type': 'lgbm', 'n_estimators': 55, 'max_depth': 6, 'learning_rate': 0.04151783350261195}. Best is trial 22 with value: 0.17857373289146283.
[I 2025-08-19 06:06:39,101] Trial 31 finished with value: 0.13920959284581624 and parameters: {'model_type': 'lgbm', 'n_estimators': 99, 'max_depth': 4, 'learning_rate': 0.10578735091262323}. Best is trial 22 with value: 0.17857373289146283.
[I 2025-08-19 06:06:43,248] Trial 32 finished with value: 0.1446380803527908 and parameters: {'model_type': 'lgbm', 'n_estimators': 92, 'max_depth': 4, 'learning_rate': 0.0939674426841275}. Best is trial 22 with value: 0.17857373289146283.
[I 2025-08-19 06:06:49,607] Trial 33 finished with value: 0.1296298703324804 and parameters: {'model_type': 'lgbm', 'n_estimators': 70, 'max_depth': 3, 'learning_rate': 0.058384788575382464}. Best is trial 22 with value: 0.17857373289146283.
[I 2025-08-19 06:07:05,304] Trial 34 finished with value: 0.14249941599770044 and parameters: {'model_type': 'lgbm', 'n_estimators': 121, 'max_depth': 4, 'learning_rate': 0.11996088666627902}. Best is trial 22 with value: 0.17857373289146283.
[I 2025-08-19 06:07:05,373] Trial 35 finished with value: 0.0911933839586665 and parameters: {'model_type': 'rf', 'n_estimators': 53, 'max_depth': 13, 'min_samples_split': 10}. Best is trial 22 with value: 0.17857373289146283.
[I 2025-08-19 06:07:28,779] Trial 36 finished with value: 0.14566492537419728 and parameters: {'model_type': 'lgbm', 'n_estimators': 109, 'max_depth': 5, 'learning_rate': 0.019701106691381476}. Best is trial 22 with value: 0.17857373289146283.
[I 2025-08-19 06:07:28,793] Trial 37 finished with value: 0.04017088015005088 and parameters: {'model_type': 'bayesian_ridge', 'alpha_1': 0.0003932853281700198, 'alpha_2': 0.00017148667978157092, 'lambda_1': 0.00041108648396117985, 'lambda_2': 0.000689852237726459}. Best is trial 22 with value: 0.17857373289146283.
[I 2025-08-19 06:07:37,680] Trial 38 finished with value: 0.11129408678690422 and parameters: {'model_type': 'lgbm', 'n_estimators': 74, 'max_depth': 3, 'learning_rate': 0.08104987804344974}. Best is trial 22 with value: 0.17857373289146283.
[I 2025-08-19 06:08:10,032] Trial 39 finished with value: 0.13156489378466762 and parameters: {'model_type': 'lgbm', 'n_estimators': 133, 'max_depth': 6, 'learning_rate': 0.19081716727937736}. Best is trial 22 with value: 0.17857373289146283.
[I 2025-08-19 06:08:10,057] Trial 40 finished with value: 0.04017524293666708 and parameters: {'model_type': 'bayesian_ridge', 'alpha_1': 0.0008013983823251339, 'alpha_2': 0.0006808607823098694, 'lambda_1': 4.569247219126196e-05, 'lambda_2': 2.848839915027047e-05}. Best is trial 22 with value: 0.17857373289146283.
[I 2025-08-19 06:08:32,182] Trial 41 finished with value: 0.1449896549393802 and parameters: {'model_type': 'lgbm', 'n_estimators': 111, 'max_depth': 5, 'learning_rate': 0.024516416326354547}. Best is trial 22 with value: 0.17857373289146283.
[I 2025-08-19 06:08:43,207] Trial 42 finished with value: 0.17698282089466977 and parameters: {'model_type': 'lgbm', 'n_estimators': 93, 'max_depth': 4, 'learning_rate': 0.030403086513098185}. Best is trial 22 with value: 0.17857373289146283.
[I 2025-08-19 06:08:43,337] Trial 43 finished with value: 0.16353099580542874 and parameters: {'model_type': 'lgbm', 'n_estimators': 91, 'max_depth': 4, 'learning_rate': 0.04313554361109597}. Best is trial 22 with value: 0.17857373289146283.
[I 2025-08-19 06:08:43,489] Trial 44 finished with value: 0.1703568227647666 and parameters: {'model_type': 'lgbm', 'n_estimators': 83, 'max_depth': 4, 'learning_rate': 0.042418321777714776}. Best is trial 22 with value: 0.17857373289146283.
[I 2025-08-19 06:08:53,927] Trial 45 finished with value: 0.14777813795179096 and parameters: {'model_type': 'lgbm', 'n_estimators': 62, 'max_depth': 3, 'learning_rate': 0.05407733234909691}. Best is trial 22 with value: 0.17857373289146283.
[I 2025-08-19 06:09:11,912] Trial 46 finished with value: 0.1776922266283617 and parameters: {'model_type': 'lgbm', 'n_estimators': 79, 'max_depth': 4, 'learning_rate': 0.0339565771697849}. Best is trial 22 with value: 0.17857373289146283.
[I 2025-08-19 06:09:52,016] Trial 47 finished with value: 0.10334655210170096 and parameters: {'model_type': 'xgb', 'n_estimators': 78, 'max_depth': 5, 'learning_rate': 0.024488083872921444}. Best is trial 22 with value: 0.17857373289146283.
[I 2025-08-19 06:09:56,450] Trial 48 finished with value: 0.1365896064088611 and parameters: {'model_type': 'lgbm', 'n_estimators': 63, 'max_depth': 3, 'learning_rate': 0.0727534990401785}. Best is trial 22 with value: 0.17857373289146283.
[I 2025-08-19 06:10:18,736] Trial 49 finished with value: 0.08580574010730879 and parameters: {'model_type': 'lgbm', 'n_estimators': 79, 'max_depth': 6, 'learning_rate': 0.011462567109295784}. Best is trial 22 with value: 0.17857373289146283.
Regression Results:
  Train R²: 0.454
  Test R²: 0.179
  CV R²: 0.129 ± 0.220
Saved comparison to results/rxn_feature_comparison_hte_in_all_16_optuna.json

==================================================
ANALYSIS COMPLETE
==================================================
Check the following directories for outputs:
  - plots/: Visualization files
  - results/: Data files and reports
  - models/: Trained model files
