=== ML Measurable HTE Rate Bias Analysis ===

==================================================
Running HTE Prediction Analysis: in_all with 24 features
==================================================

=== Loading Data ===
Number of HTE rates: 1031
Found 5 hydrogen-dependent features: ['num_Hs', 'BV_Hs_avg', 'Charges_Hs_avg', 'fukui_E_Hs_avg', 'fukui_N_Hs_avg']
Found 2 pKa-dependent features: ['pka_aHs', 'pka_lowest']
Found 26 heteroatom-dependent features: ['BV_main_1', 'Charges_main_atom', 'fukui_E_main_atom', 'fukui_N_main_atom', 'L_main_atom_1', 'L_main_atom_2', 'B1_main_atom_1', 'B1_main_atom_2', 'B5_main_atom_1', 'B5_main_atom_2', 'Charges_secondary_1', 'Charges_secondary_2', 'fukui_N_secondary_1', 'fukui_N_secondary_2', 'Charges_secondary_avg', 'fukui_N_secondary_avg', 'FCS_1', 'FREQS_1', 'FCS_2', 'FREQS_2', 'FCS_avg', 'FREQS_avg', 'BV_Hs_avg', 'Charges_Hs_avg', 'fukui_E_Hs_avg', 'fukui_N_Hs_avg']

Processing num_Hs conditional features...
  18/46 molecules meet condition num_Hs
    num_Hs: 0 -> 0 NA values
    BV_Hs_avg: 28 -> 0 NA values
    Charges_Hs_avg: 28 -> 0 NA values
    fukui_E_Hs_avg: 28 -> 0 NA values
    fukui_N_Hs_avg: 28 -> 0 NA values

Processing pKa_features conditional features...
  18/46 molecules meet condition pKa_features
    Processing pKa feature pka_aHs with special handling...
      Created indicator: has_acidic_H_for_pka_aHs
      Created interaction: pka_aHs_x_has_acidic_H
      Used 50.0 for molecules without acidic H
    pka_aHs: 28 -> 0 NA values
    Processing pKa feature pka_lowest with special handling...
      Created indicator: has_acidic_H_for_pka_lowest
      Created interaction: pka_lowest_x_has_acidic_H
      Used 50.0 for molecules without acidic H
    pka_lowest: 38 -> 0 NA values

Handling remaining NA values...

Encoding categorical features...
  Removed identifier feature: name
  Found categorical feature class with 4 unique values: ['aromatic' 'hetero' 'aliphatic' 'mixture']
    One-hot encoded class -> 4 features: ['class_aliphatic', 'class_aromatic', 'class_hetero', 'class_mixture']
  Removed identifier feature: smiles
  Processed 1 categorical features
  Removed 2 identifier features: ['name', 'smiles']

Creating feature quality indicators...
  Added indicator: has_num_Hs
  Added indicator: has_pKa_features
Preprocessing complete. Shape: (46, 65)
Remaining NA values: 0
Found 1 pKa-dependent features: ['pka_basic']
Warning: num_Hs column not found, cannot properly handle pKa features
Found 15 heteroatom-dependent features: ['BV_main_1', 'Charges_main_atom', 'fukui_E_main_atom', 'fukui_N_main_atom', 'L_main_atom_1', 'B1_main_atom_1', 'B5_main_atom_1', 'Charges_secondary_1', 'fukui_N_secondary_1', 'Charges_secondary_avg', 'fukui_N_secondary_avg', 'FCS_1', 'FREQS_1', 'FCS_avg', 'FREQS_avg']

Handling remaining NA values...
  pka_basic: Filled 1 NA values with median/zero
  smiles: Filled 1 NA values with mode/unknown
  class: Filled 1 NA values with mode/unknown

Encoding categorical features...
  Removed identifier feature: name
  Removed identifier feature: smiles
  Found categorical feature class with 5 unique values: ['1_aliphatic' '1_aromatic' '2_aliphatic' '1_mixture' '2_mixture']
    One-hot encoded class -> 5 features: ['class_1_aliphatic', 'class_1_aromatic', 'class_1_mixture', 'class_2_aliphatic', 'class_2_mixture']
  Processed 1 categorical features
  Removed 2 identifier features: ['name', 'smiles']

Creating feature quality indicators...
Preprocessing complete. Shape: (55, 40)
Remaining NA values: 0

=== Selecting Features (correlation) ===
Final selected features (24): ['acyl_Charges_main_atom', 'acyl_BV_Hs_avg_x_has_num_Hs', 'acyl_pka_aHs_x_has_pKa_features', 'acyl_num_Hs_x_has_num_Hs', 'int_pka_basic_minus_pka_lowest', 'acyl_has_num_Hs', 'acyl_Charges_Hs_avg_x_has_num_Hs', 'acyl_BV_Hs_avg', 'acyl_BV_secondary_2', 'acyl_fukui_E_secondary_2', 'acyl_fukui_E_Hs_avg', 'acyl_has_acidic_H_for_pka_aHs', 'acyl_pka_aHs', 'acyl_pka_lowest', 'int_BV_secondary_prod', 'acyl_BV_secondary_avg', 'acyl_num_Hs', 'acyl_Charges_Hs_avg', 'acyl_has_acidic_H_for_pka_lowest', 'acyl_fukui_N_Hs_avg', 'acyl_Charges_secondary_2', 'int_pka_basic_minus_pka_aHs', 'acyl_pka_aHs_x_has_acidic_H', 'acyl_has_pKa_features']
=== Building HTE Prediction Models with 24 features ===
Selected features: ['acyl_Charges_main_atom', 'acyl_BV_Hs_avg_x_has_num_Hs', 'acyl_pka_aHs_x_has_pKa_features', 'acyl_num_Hs_x_has_num_Hs', 'int_pka_basic_minus_pka_lowest', 'acyl_has_num_Hs', 'acyl_Charges_Hs_avg_x_has_num_Hs', 'acyl_BV_Hs_avg', 'acyl_BV_secondary_2', 'acyl_fukui_E_secondary_2', 'acyl_fukui_E_Hs_avg', 'acyl_has_acidic_H_for_pka_aHs', 'acyl_pka_aHs', 'acyl_pka_lowest', 'int_BV_secondary_prod', 'acyl_BV_secondary_avg', 'acyl_num_Hs', 'acyl_Charges_Hs_avg', 'acyl_has_acidic_H_for_pka_lowest', 'acyl_fukui_N_Hs_avg', 'acyl_Charges_secondary_2', 'int_pka_basic_minus_pka_aHs', 'acyl_pka_aHs_x_has_acidic_H', 'acyl_has_pKa_features']
Valid features: 21
=== Building Regression Model ===
Regression dataset: (1031, 21)
Target range: -1.418 to 4.010


Training data: 876 samples
Test data: 155 samples


SFS (regression) failed, using provided features. Error: n_features_to_select must be < n_features.
Running hyperparameter optimization for regression...
[I 2025-08-19 03:21:41,666] A new study created in memory with name: no-name-9104eb60-66f2-4bea-a546-e70cf806f56e
[I 2025-08-19 03:26:26,680] Trial 0 finished with value: 0.0029256591594275516 and parameters: {'model_type': 'xgb', 'n_estimators': 93, 'max_depth': 10, 'learning_rate': 0.04393010498796005}. Best is trial 0 with value: 0.0029256591594275516.
[I 2025-08-19 03:26:26,832] Trial 1 finished with value: -0.020495558373178735 and parameters: {'model_type': 'rf', 'n_estimators': 58, 'max_depth': 13, 'min_samples_split': 5}. Best is trial 0 with value: 0.0029256591594275516.
[I 2025-08-19 03:26:27,008] Trial 2 finished with value: 0.16300965773266096 and parameters: {'model_type': 'bayesian_ridge', 'alpha_1': 0.0007560362884059209, 'alpha_2': 0.0005871059603276432, 'lambda_1': 0.00035593395076717973, 'lambda_2': 0.00022893600501384793}. Best is trial 2 with value: 0.16300965773266096.
[I 2025-08-19 03:26:27,067] Trial 3 finished with value: 0.16301059645448257 and parameters: {'model_type': 'bayesian_ridge', 'alpha_1': 0.00016732593885443307, 'alpha_2': 0.0006157301979417102, 'lambda_1': 0.0004131506851876495, 'lambda_2': 0.0009655265751519944}. Best is trial 3 with value: 0.16301059645448257.
[I 2025-08-19 03:26:27,247] Trial 4 finished with value: -0.031446863475946385 and parameters: {'model_type': 'rf', 'n_estimators': 146, 'max_depth': 4, 'min_samples_split': 4}. Best is trial 3 with value: 0.16301059645448257.
[I 2025-08-19 03:26:27,478] Trial 5 finished with value: -0.05308402237694887 and parameters: {'model_type': 'rf', 'n_estimators': 158, 'max_depth': 10, 'min_samples_split': 2}. Best is trial 3 with value: 0.16301059645448257.
[I 2025-08-19 03:29:37,198] Trial 6 finished with value: 0.10611590012277428 and parameters: {'model_type': 'lgbm', 'n_estimators': 90, 'max_depth': 3, 'learning_rate': 0.03636458482299224}. Best is trial 3 with value: 0.16301059645448257.
[I 2025-08-19 03:40:37,563] Trial 7 finished with value: 0.10512102433680137 and parameters: {'model_type': 'lgbm', 'n_estimators': 83, 'max_depth': 10, 'learning_rate': 0.08895658243492094}. Best is trial 3 with value: 0.16301059645448257.
[I 2025-08-19 03:40:37,585] Trial 8 finished with value: 0.16301078451317608 and parameters: {'model_type': 'bayesian_ridge', 'alpha_1': 0.0005519864937570305, 'alpha_2': 0.0007165841569738392, 'lambda_1': 0.00033730527419760574, 'lambda_2': 0.0009738960109137315}. Best is trial 8 with value: 0.16301078451317608.
[I 2025-08-19 03:40:37,617] Trial 9 finished with value: 0.16301003159143834 and parameters: {'model_type': 'bayesian_ridge', 'alpha_1': 9.636182144157701e-05, 'alpha_2': 0.0005108886298784272, 'lambda_1': 0.00018501577951486684, 'lambda_2': 0.00023216873245751607}. Best is trial 8 with value: 0.16301078451317608.
[I 2025-08-19 03:43:45,692] Trial 10 finished with value: 0.003545310233720733 and parameters: {'model_type': 'xgb', 'n_estimators': 200, 'max_depth': 6, 'learning_rate': 0.26121882850968425}. Best is trial 8 with value: 0.16301078451317608.
[I 2025-08-19 03:43:45,768] Trial 11 finished with value: 0.1630100405454986 and parameters: {'model_type': 'bayesian_ridge', 'alpha_1': 0.0003735325271144007, 'alpha_2': 0.00097629883188982, 'lambda_1': 0.0006709291880451485, 'lambda_2': 0.0009906021341412182}. Best is trial 8 with value: 0.16301078451317608.
[I 2025-08-19 03:43:45,834] Trial 12 finished with value: 0.16301054202420795 and parameters: {'model_type': 'bayesian_ridge', 'alpha_1': 0.0005166776287677104, 'alpha_2': 0.000735513870729549, 'lambda_1': 0.00044825461319071124, 'lambda_2': 0.000979783209761683}. Best is trial 8 with value: 0.16301078451317608.
[I 2025-08-19 03:43:45,860] Trial 13 finished with value: 0.16301097734788517 and parameters: {'model_type': 'bayesian_ridge', 'alpha_1': 4.441674617669032e-05, 'alpha_2': 5.626977694582773e-05, 'lambda_1': 8.119928955877724e-05, 'lambda_2': 0.0006995639913615604}. Best is trial 13 with value: 0.16301097734788517.
[I 2025-08-19 03:43:45,898] Trial 14 finished with value: 0.16301100114232758 and parameters: {'model_type': 'bayesian_ridge', 'alpha_1': 0.0006559692635056545, 'alpha_2': 1.1641549220245813e-05, 'lambda_1': 4.928479199011244e-05, 'lambda_2': 0.0006534957707517416}. Best is trial 14 with value: 0.16301100114232758.
[I 2025-08-19 03:43:45,933] Trial 15 finished with value: 0.16301085502310664 and parameters: {'model_type': 'bayesian_ridge', 'alpha_1': 0.0008743123279866128, 'alpha_2': 4.674287638131713e-06, 'lambda_1': 7.139625332888968e-05, 'lambda_2': 0.0005835219476571264}. Best is trial 14 with value: 0.16301100114232758.
[I 2025-08-19 03:43:45,947] Trial 16 finished with value: 0.16301108943661724 and parameters: {'model_type': 'bayesian_ridge', 'alpha_1': 0.0006424020940451675, 'alpha_2': 8.683209363367544e-06, 'lambda_1': 1.18610977633277e-05, 'lambda_2': 0.0006565436979681587}. Best is trial 16 with value: 0.16301108943661724.
[I 2025-08-19 03:58:20,257] Trial 17 finished with value: 0.10615133006418953 and parameters: {'model_type': 'lgbm', 'n_estimators': 190, 'max_depth': 6, 'learning_rate': 0.2824318524273891}. Best is trial 16 with value: 0.16301108943661724.
[I 2025-08-19 04:01:42,789] Trial 18 finished with value: 0.003044503107955454 and parameters: {'model_type': 'xgb', 'n_estimators': 119, 'max_depth': 8, 'learning_rate': 0.17819642803814345}. Best is trial 16 with value: 0.16301108943661724.
[I 2025-08-19 04:01:42,888] Trial 19 finished with value: 0.16300907708942058 and parameters: {'model_type': 'bayesian_ridge', 'alpha_1': 0.000698582098765905, 'alpha_2': 0.0002561364140569303, 'lambda_1': 0.000900755797433739, 'lambda_2': 0.0006535726743845275}. Best is trial 16 with value: 0.16301108943661724.
[I 2025-08-19 04:01:42,920] Trial 20 finished with value: 0.16301064567331902 and parameters: {'model_type': 'bayesian_ridge', 'alpha_1': 0.000999909883130064, 'alpha_2': 0.00028767979467938447, 'lambda_1': 5.2317133821115614e-05, 'lambda_2': 0.0004206297843806103}. Best is trial 16 with value: 0.16301108943661724.
[I 2025-08-19 04:01:42,983] Trial 21 finished with value: 0.163011165419495 and parameters: {'model_type': 'bayesian_ridge', 'alpha_1': 0.0003060434978252066, 'alpha_2': 1.3797544716144729e-05, 'lambda_1': 1.7163257313588878e-05, 'lambda_2': 0.0007229236484435608}. Best is trial 21 with value: 0.163011165419495.
[I 2025-08-19 04:01:43,046] Trial 22 finished with value: 0.1630112683362941 and parameters: {'model_type': 'bayesian_ridge', 'alpha_1': 0.00031803693365489564, 'alpha_2': 0.00011956943931050733, 'lambda_1': 1.8432658502815294e-06, 'lambda_2': 0.000773171623673524}. Best is trial 22 with value: 0.1630112683362941.
[I 2025-08-19 04:01:43,087] Trial 23 finished with value: 0.16301083784015857 and parameters: {'model_type': 'bayesian_ridge', 'alpha_1': 0.00031908604573564005, 'alpha_2': 0.0001816232038939377, 'lambda_1': 0.0001966614553782966, 'lambda_2': 0.0007801854827391408}. Best is trial 22 with value: 0.1630112683362941.
[I 2025-08-19 04:01:43,122] Trial 24 finished with value: 0.16301080447476146 and parameters: {'model_type': 'bayesian_ridge', 'alpha_1': 0.0003094563474325067, 'alpha_2': 0.00015896462761724796, 'lambda_1': 0.00022741248677511248, 'lambda_2': 0.0008037284550119237}. Best is trial 22 with value: 0.1630112683362941.
[I 2025-08-19 04:01:43,166] Trial 25 finished with value: 0.16300951646214024 and parameters: {'model_type': 'bayesian_ridge', 'alpha_1': 0.0003976359678875646, 'alpha_2': 0.0003438814718905491, 'lambda_1': 0.0005723310413323138, 'lambda_2': 0.00046054402685686126}. Best is trial 22 with value: 0.1630112683362941.
[I 2025-08-19 04:01:43,293] Trial 26 finished with value: -0.009617651552578321 and parameters: {'model_type': 'rf', 'n_estimators': 53, 'max_depth': 15, 'min_samples_split': 10}. Best is trial 22 with value: 0.1630112683362941.
[I 2025-08-19 04:08:46,190] Trial 27 finished with value: 0.09616314549055027 and parameters: {'model_type': 'lgbm', 'n_estimators': 170, 'max_depth': 4, 'learning_rate': 0.17433783235114328}. Best is trial 22 with value: 0.1630112683362941.
[I 2025-08-19 04:13:43,446] Trial 28 finished with value: 0.0004955742123015083 and parameters: {'model_type': 'xgb', 'n_estimators': 122, 'max_depth': 8, 'learning_rate': 0.11191971807451648}. Best is trial 22 with value: 0.1630112683362941.
[I 2025-08-19 04:16:19,112] Trial 29 finished with value: 0.006034365954408649 and parameters: {'model_type': 'xgb', 'n_estimators': 141, 'max_depth': 5, 'learning_rate': 0.2289869625743655}. Best is trial 22 with value: 0.1630112683362941.
[I 2025-08-19 04:16:19,244] Trial 30 finished with value: 0.1630113178312882 and parameters: {'model_type': 'bayesian_ridge', 'alpha_1': 0.00021418981830611134, 'alpha_2': 0.00014355666501592065, 'lambda_1': 5.307196638639414e-06, 'lambda_2': 0.0008149622270323892}. Best is trial 30 with value: 0.1630113178312882.
[I 2025-08-19 04:16:19,258] Trial 31 finished with value: 0.16301129873705256 and parameters: {'model_type': 'bayesian_ridge', 'alpha_1': 0.00020418042760595012, 'alpha_2': 0.00013404241110287216, 'lambda_1': 1.6450199694770374e-05, 'lambda_2': 0.0008188188841484997}. Best is trial 30 with value: 0.1630113178312882.
[I 2025-08-19 04:16:19,468] Trial 32 finished with value: 0.16301135770443143 and parameters: {'model_type': 'bayesian_ridge', 'alpha_1': 0.00021042620487965826, 'alpha_2': 0.00012831721723010668, 'lambda_1': 3.283053656269064e-06, 'lambda_2': 0.0008384349128402825}. Best is trial 32 with value: 0.16301135770443143.
[I 2025-08-19 04:16:19,589] Trial 33 finished with value: 0.16301097178959223 and parameters: {'model_type': 'bayesian_ridge', 'alpha_1': 0.0001836735182966518, 'alpha_2': 0.0001541490144368444, 'lambda_1': 0.0001703801082295478, 'lambda_2': 0.0008326390027388836}. Best is trial 32 with value: 0.16301135770443143.
[I 2025-08-19 04:16:19,944] Trial 34 finished with value: 0.16301101906737814 and parameters: {'model_type': 'bayesian_ridge', 'alpha_1': 0.0002118787402621777, 'alpha_2': 0.0003756650041539972, 'lambda_1': 0.0001556241020653659, 'lambda_2': 0.0008500375157820964}. Best is trial 32 with value: 0.16301135770443143.
[I 2025-08-19 04:16:20,796] Trial 35 finished with value: -0.05404773951930553 and parameters: {'model_type': 'rf', 'n_estimators': 110, 'max_depth': 12, 'min_samples_split': 10}. Best is trial 32 with value: 0.16301135770443143.
[I 2025-08-19 04:16:21,013] Trial 36 finished with value: 0.16301141076978964 and parameters: {'model_type': 'bayesian_ridge', 'alpha_1': 0.0002168305127057488, 'alpha_2': 0.00011714320301598198, 'lambda_1': 2.81855629920919e-06, 'lambda_2': 0.0008731916432204032}. Best is trial 36 with value: 0.16301141076978964.
[I 2025-08-19 04:16:21,092] Trial 37 finished with value: 0.1630108033861345 and parameters: {'model_type': 'bayesian_ridge', 'alpha_1': 1.081966433607513e-05, 'alpha_2': 0.00023297697350777773, 'lambda_1': 0.0002699769451983753, 'lambda_2': 0.0008764415034148774}. Best is trial 36 with value: 0.16301141076978964.
[I 2025-08-19 04:16:21,528] Trial 38 finished with value: -0.045286561759595445 and parameters: {'model_type': 'rf', 'n_estimators': 174, 'max_depth': 15, 'min_samples_split': 7}. Best is trial 36 with value: 0.16301141076978964.
[I 2025-08-19 04:31:07,528] Trial 39 finished with value: 0.10504363100080649 and parameters: {'model_type': 'lgbm', 'n_estimators': 138, 'max_depth': 7, 'learning_rate': 0.21211386081751135}. Best is trial 36 with value: 0.16301141076978964.
[I 2025-08-19 04:31:07,966] Trial 40 finished with value: 0.16301117754644034 and parameters: {'model_type': 'bayesian_ridge', 'alpha_1': 0.00021426139585636954, 'alpha_2': 0.0001135129177457948, 'lambda_1': 0.00012895997345073815, 'lambda_2': 0.0009070281381762709}. Best is trial 36 with value: 0.16301141076978964.
[I 2025-08-19 04:31:08,200] Trial 41 finished with value: 0.1630112268311128 and parameters: {'model_type': 'bayesian_ridge', 'alpha_1': 0.0001367273638436621, 'alpha_2': 0.00011239672081060477, 'lambda_1': 1.127258438464673e-05, 'lambda_2': 0.0007626339972913445}. Best is trial 36 with value: 0.16301141076978964.
[I 2025-08-19 04:31:08,280] Trial 42 finished with value: 0.16301116523277648 and parameters: {'model_type': 'bayesian_ridge', 'alpha_1': 0.0002507578492586247, 'alpha_2': 0.00021243813076436777, 'lambda_1': 0.00011744153482037028, 'lambda_2': 0.000884140436117847}. Best is trial 36 with value: 0.16301141076978964.
[I 2025-08-19 04:31:08,583] Trial 43 finished with value: 0.1630112546695428 and parameters: {'model_type': 'bayesian_ridge', 'alpha_1': 0.00039723496612386813, 'alpha_2': 9.074950235412963e-05, 'lambda_1': 1.6448464101225528e-05, 'lambda_2': 0.0007835215017034496}. Best is trial 36 with value: 0.16301141076978964.
[I 2025-08-19 04:31:08,788] Trial 44 finished with value: 0.16300991994428293 and parameters: {'model_type': 'bayesian_ridge', 'alpha_1': 9.039230779963457e-05, 'alpha_2': 0.0003075110260030655, 'lambda_1': 0.00010503049921558105, 'lambda_2': 2.703680523346235e-05}. Best is trial 36 with value: 0.16301141076978964.
[I 2025-08-19 04:31:08,829] Trial 45 finished with value: 0.1630112132679027 and parameters: {'model_type': 'bayesian_ridge', 'alpha_1': 0.0002621723734727865, 'alpha_2': 0.00041030339396529744, 'lambda_1': 8.952492671491671e-05, 'lambda_2': 0.0008814379838378468}. Best is trial 36 with value: 0.16301141076978964.
[I 2025-08-19 04:31:08,874] Trial 46 finished with value: 0.16300901041690974 and parameters: {'model_type': 'bayesian_ridge', 'alpha_1': 0.00011516426402066407, 'alpha_2': 0.0001670224489429333, 'lambda_1': 0.0009708757125971993, 'lambda_2': 0.0007231492010568512}. Best is trial 36 with value: 0.16301141076978964.
[I 2025-08-19 04:33:22,980] Trial 47 finished with value: 0.11411495288165818 and parameters: {'model_type': 'xgb', 'n_estimators': 74, 'max_depth': 3, 'learning_rate': 0.12546792672847612}. Best is trial 36 with value: 0.16301141076978964.
[I 2025-08-19 04:33:23,019] Trial 48 finished with value: 0.16301037729426537 and parameters: {'model_type': 'bayesian_ridge', 'alpha_1': 0.0004285843732600062, 'alpha_2': 9.75547814615563e-05, 'lambda_1': 0.0002754754082439429, 'lambda_2': 0.0005824687205370278}. Best is trial 36 with value: 0.16301141076978964.
[I 2025-08-19 04:33:23,276] Trial 49 finished with value: -0.054633099437753074 and parameters: {'model_type': 'rf', 'n_estimators': 104, 'max_depth': 12, 'min_samples_split': 7}. Best is trial 36 with value: 0.16301141076978964.
Regression Results:
  Train R²: 0.391
  Test R²: 0.163
  CV R²: -0.214 ± 0.508

=== Generating Visualizations ===
=== Evaluating Bayesian Ridge with Parity Plots ===
Model Performance:
  Train R²: 0.391, MAE: 0.541, RMSE: 0.714
  Test R²: 0.163, MAE: 0.626, RMSE: 0.813
Generating parity plots...
Parity plot saved as: plots/parity_plot_bayesian_ridge_train_in_all_24_optuna_train.png
Parity plot saved as: plots/parity_plot_bayesian_ridge_test_in_all_24_optuna_test.png
Parity analysis plot saved as: plots/parity_analysis_bayesian_ridge_test_in_all_24_optuna_analysis.png
HTE prediction evaluation report saved to results/reports/hte_prediction_report_manual_24_in_all_24_optuna.txt

==================================================
ANALYSIS COMPLETE
==================================================
Check the following directories for outputs:
  - plots/: Visualization files
  - results/: Data files and reports
  - models/: Trained model files
