=== ML Measurable HTE Rate Bias Analysis ===

==================================================
Running HTE Prediction Analysis: each with 8 features
==================================================

=== Loading Data ===
Number of HTE rates: 1031
Found 5 hydrogen-dependent features: ['num_Hs', 'BV_Hs_avg', 'Charges_Hs_avg', 'fukui_E_Hs_avg', 'fukui_N_Hs_avg']
Found 2 pKa-dependent features: ['pka_aHs', 'pka_lowest']
Found 26 heteroatom-dependent features: ['BV_main_1', 'Charges_main_atom', 'fukui_E_main_atom', 'fukui_N_main_atom', 'L_main_atom_1', 'L_main_atom_2', 'B1_main_atom_1', 'B1_main_atom_2', 'B5_main_atom_1', 'B5_main_atom_2', 'Charges_secondary_1', 'Charges_secondary_2', 'fukui_N_secondary_1', 'fukui_N_secondary_2', 'Charges_secondary_avg', 'fukui_N_secondary_avg', 'FCS_1', 'FREQS_1', 'FCS_2', 'FREQS_2', 'FCS_avg', 'FREQS_avg', 'BV_Hs_avg', 'Charges_Hs_avg', 'fukui_E_Hs_avg', 'fukui_N_Hs_avg']

Processing num_Hs conditional features...
  18/46 molecules meet condition num_Hs
    num_Hs: 0 -> 0 NA values
    BV_Hs_avg: 28 -> 0 NA values
    Charges_Hs_avg: 28 -> 0 NA values
    fukui_E_Hs_avg: 28 -> 0 NA values
    fukui_N_Hs_avg: 28 -> 0 NA values

Processing pKa_features conditional features...
  18/46 molecules meet condition pKa_features
    Processing pKa feature pka_aHs with special handling...
      Created indicator: has_acidic_H_for_pka_aHs
      Created interaction: pka_aHs_x_has_acidic_H
      Used 50.0 for molecules without acidic H
    pka_aHs: 28 -> 0 NA values
    Processing pKa feature pka_lowest with special handling...
      Created indicator: has_acidic_H_for_pka_lowest
      Created interaction: pka_lowest_x_has_acidic_H
      Used 50.0 for molecules without acidic H
    pka_lowest: 38 -> 0 NA values

Handling remaining NA values...

Encoding categorical features...
  Removed identifier feature: name
  Found categorical feature class with 4 unique values: ['aromatic' 'hetero' 'aliphatic' 'mixture']
    One-hot encoded class -> 4 features: ['class_aliphatic', 'class_aromatic', 'class_hetero', 'class_mixture']
  Removed identifier feature: smiles
  Processed 1 categorical features
  Removed 2 identifier features: ['name', 'smiles']

Creating feature quality indicators...
  Added indicator: has_num_Hs
  Added indicator: has_pKa_features
Preprocessing complete. Shape: (46, 65)
Remaining NA values: 0
Found 1 pKa-dependent features: ['pka_basic']
Warning: num_Hs column not found, cannot properly handle pKa features
Found 15 heteroatom-dependent features: ['BV_main_1', 'Charges_main_atom', 'fukui_E_main_atom', 'fukui_N_main_atom', 'L_main_atom_1', 'B1_main_atom_1', 'B5_main_atom_1', 'Charges_secondary_1', 'fukui_N_secondary_1', 'Charges_secondary_avg', 'fukui_N_secondary_avg', 'FCS_1', 'FREQS_1', 'FCS_avg', 'FREQS_avg']

Handling remaining NA values...
  pka_basic: Filled 1 NA values with median/zero
  smiles: Filled 1 NA values with mode/unknown
  class: Filled 1 NA values with mode/unknown

Encoding categorical features...
  Removed identifier feature: name
  Removed identifier feature: smiles
  Found categorical feature class with 5 unique values: ['1_aliphatic' '1_aromatic' '2_aliphatic' '1_mixture' '2_mixture']
    One-hot encoded class -> 5 features: ['class_1_aliphatic', 'class_1_aromatic', 'class_1_mixture', 'class_2_aliphatic', 'class_2_mixture']
  Processed 1 categorical features
  Removed 2 identifier features: ['name', 'smiles']

Creating feature quality indicators...
Preprocessing complete. Shape: (55, 40)
Remaining NA values: 0
Loaded reaction energy features: 1488 rows, 8 features

=== Selecting Features (selected) ===
Final selected features (8): ['acyl_class_aromatic', 'amine_class_1_mixture', 'amine_Charges_secondary_1', 'acyl_BV_secondary_2', 'acyl_pka_aHs_x_has_acidic_H', 'acyl_Charges_secondary_1', 'amine_pka_basic', 'amine_BV_secondary_avg']
=== Building HTE Prediction Models with 8 features ===
Selected features: ['acyl_class_aromatic', 'amine_class_1_mixture', 'amine_Charges_secondary_1', 'acyl_BV_secondary_2', 'acyl_pka_aHs_x_has_acidic_H', 'acyl_Charges_secondary_1', 'amine_pka_basic', 'amine_BV_secondary_avg']
Valid features: 17
=== Building Regression Model ===
Regression dataset: (1031, 17)
Target range: -1.418 to 4.010


Training data: 619 samples
Test data: 206 samples


SFS (regression) failed, using provided features. Error: n_features_to_select must be < n_features.
Running hyperparameter optimization for regression...
[I 2025-08-20 00:16:40,653] A new study created in memory with name: no-name-7ce78714-d5ae-4db9-bbdc-92c6471044ad
[I 2025-08-20 00:16:41,072] Trial 0 finished with value: 0.709332942457729 and parameters: {'model_type': 'rf', 'n_estimators': 134, 'max_depth': 14, 'min_samples_split': 7}. Best is trial 0 with value: 0.709332942457729.
[I 2025-08-20 00:16:42,132] Trial 1 finished with value: 0.695267895665819 and parameters: {'model_type': 'xgb', 'n_estimators': 158, 'max_depth': 10, 'learning_rate': 0.2576122729214867}. Best is trial 0 with value: 0.709332942457729.
[I 2025-08-20 00:16:42,506] Trial 2 finished with value: 0.7027754103373153 and parameters: {'model_type': 'rf', 'n_estimators': 137, 'max_depth': 8, 'min_samples_split': 7}. Best is trial 0 with value: 0.709332942457729.
[I 2025-08-20 00:16:42,649] Trial 3 finished with value: 0.7458196968244282 and parameters: {'model_type': 'xgb', 'n_estimators': 101, 'max_depth': 3, 'learning_rate': 0.25990874838908323}. Best is trial 3 with value: 0.7458196968244282.
[I 2025-08-20 00:16:43,246] Trial 4 finished with value: 0.7138615976879452 and parameters: {'model_type': 'rf', 'n_estimators': 194, 'max_depth': 12, 'min_samples_split': 7}. Best is trial 3 with value: 0.7458196968244282.
[I 2025-08-20 00:16:43,248] Trial 5 finished with value: 0.5037927252168064 and parameters: {'model_type': 'bayesian_ridge', 'alpha_1': 8.005843094465595e-05, 'alpha_2': 0.000674139249753725, 'lambda_1': 0.000716278077402108, 'lambda_2': 0.0007844042643951673}. Best is trial 3 with value: 0.7458196968244282.
[I 2025-08-20 00:16:43,656] Trial 6 finished with value: 0.6959152010322892 and parameters: {'model_type': 'rf', 'n_estimators': 162, 'max_depth': 7, 'min_samples_split': 6}. Best is trial 3 with value: 0.7458196968244282.
[I 2025-08-20 00:16:44,471] Trial 7 finished with value: 0.6897289815224061 and parameters: {'model_type': 'xgb', 'n_estimators': 70, 'max_depth': 10, 'learning_rate': 0.2152941694773317}. Best is trial 3 with value: 0.7458196968244282.
[I 2025-08-20 00:16:44,865] Trial 8 finished with value: 0.7057429751679338 and parameters: {'model_type': 'rf', 'n_estimators': 138, 'max_depth': 9, 'min_samples_split': 8}. Best is trial 3 with value: 0.7458196968244282.
[I 2025-08-20 00:16:44,867] Trial 9 finished with value: 0.5037778295883613 and parameters: {'model_type': 'bayesian_ridge', 'alpha_1': 0.0004183447874709965, 'alpha_2': 0.0005257237415397568, 'lambda_1': 2.445134211677863e-05, 'lambda_2': 1.9595027253970197e-05}. Best is trial 3 with value: 0.7458196968244282.
[I 2025-08-20 00:16:44,980] Trial 10 finished with value: 0.6450805512390871 and parameters: {'model_type': 'lgbm', 'n_estimators': 78, 'max_depth': 3, 'learning_rate': 0.03244482479217799}. Best is trial 3 with value: 0.7458196968244282.
[I 2025-08-20 00:16:45,622] Trial 11 finished with value: 0.7437246554706343 and parameters: {'model_type': 'xgb', 'n_estimators': 198, 'max_depth': 3, 'learning_rate': 0.1070741002364187}. Best is trial 3 with value: 0.7458196968244282.
[I 2025-08-20 00:16:45,774] Trial 12 finished with value: 0.7372044470773498 and parameters: {'model_type': 'xgb', 'n_estimators': 98, 'max_depth': 3, 'learning_rate': 0.09831755805377293}. Best is trial 3 with value: 0.7458196968244282.
[I 2025-08-20 00:16:46,486] Trial 13 finished with value: 0.7408350161740922 and parameters: {'model_type': 'xgb', 'n_estimators': 107, 'max_depth': 5, 'learning_rate': 0.1379655687698329}. Best is trial 3 with value: 0.7458196968244282.
[I 2025-08-20 00:16:46,656] Trial 14 finished with value: 0.7393406940061301 and parameters: {'model_type': 'xgb', 'n_estimators': 50, 'max_depth': 5, 'learning_rate': 0.2950720442682877}. Best is trial 3 with value: 0.7458196968244282.
[I 2025-08-20 00:16:46,842] Trial 15 finished with value: 0.7409572215619313 and parameters: {'model_type': 'lgbm', 'n_estimators': 200, 'max_depth': 4, 'learning_rate': 0.18795474602232792}. Best is trial 3 with value: 0.7458196968244282.
[I 2025-08-20 00:16:49,465] Trial 16 finished with value: 0.7439180381494109 and parameters: {'model_type': 'xgb', 'n_estimators': 108, 'max_depth': 5, 'learning_rate': 0.08372285092584933}. Best is trial 3 with value: 0.7458196968244282.
[I 2025-08-20 00:16:50,210] Trial 17 finished with value: 0.6623159898805673 and parameters: {'model_type': 'xgb', 'n_estimators': 111, 'max_depth': 5, 'learning_rate': 0.01843330515902114}. Best is trial 3 with value: 0.7458196968244282.
[I 2025-08-20 00:16:50,564] Trial 18 finished with value: 0.7342829373636255 and parameters: {'model_type': 'xgb', 'n_estimators': 87, 'max_depth': 6, 'learning_rate': 0.059893740986658665}. Best is trial 3 with value: 0.7458196968244282.
[I 2025-08-20 00:16:50,575] Trial 19 finished with value: 0.5037812598823079 and parameters: {'model_type': 'bayesian_ridge', 'alpha_1': 0.0009848001372634234, 'alpha_2': 5.842896244987589e-05, 'lambda_1': 0.0009622201788866177, 'lambda_2': 0.0002149380815613021}. Best is trial 3 with value: 0.7458196968244282.
[I 2025-08-20 00:16:50,703] Trial 20 finished with value: 0.747149215245513 and parameters: {'model_type': 'lgbm', 'n_estimators': 118, 'max_depth': 4, 'learning_rate': 0.1715592585406583}. Best is trial 20 with value: 0.747149215245513.
[I 2025-08-20 00:16:50,816] Trial 21 finished with value: 0.7532987859910035 and parameters: {'model_type': 'lgbm', 'n_estimators': 113, 'max_depth': 4, 'learning_rate': 0.1868642284035323}. Best is trial 21 with value: 0.7532987859910035.
[I 2025-08-20 00:16:50,948] Trial 22 finished with value: 0.7367386260143904 and parameters: {'model_type': 'lgbm', 'n_estimators': 123, 'max_depth': 4, 'learning_rate': 0.1888822634812731}. Best is trial 21 with value: 0.7532987859910035.
[I 2025-08-20 00:16:51,070] Trial 23 finished with value: 0.7453851946869603 and parameters: {'model_type': 'lgbm', 'n_estimators': 121, 'max_depth': 4, 'learning_rate': 0.22966859495655537}. Best is trial 21 with value: 0.7532987859910035.
[I 2025-08-20 00:16:51,173] Trial 24 finished with value: 0.749250089407709 and parameters: {'model_type': 'lgbm', 'n_estimators': 91, 'max_depth': 4, 'learning_rate': 0.15255379605675082}. Best is trial 21 with value: 0.7532987859910035.
[I 2025-08-20 00:16:51,289] Trial 25 finished with value: 0.7382500023060694 and parameters: {'model_type': 'lgbm', 'n_estimators': 63, 'max_depth': 6, 'learning_rate': 0.1449521614348163}. Best is trial 21 with value: 0.7532987859910035.
[I 2025-08-20 00:16:51,389] Trial 26 finished with value: 0.7620842519733222 and parameters: {'model_type': 'lgbm', 'n_estimators': 92, 'max_depth': 4, 'learning_rate': 0.1726704606993798}. Best is trial 26 with value: 0.7620842519733222.
[I 2025-08-20 00:16:51,550] Trial 27 finished with value: 0.7271849929383285 and parameters: {'model_type': 'lgbm', 'n_estimators': 88, 'max_depth': 6, 'learning_rate': 0.132179551256651}. Best is trial 26 with value: 0.7620842519733222.
[I 2025-08-20 00:16:51,650] Trial 28 finished with value: 0.7288822263030652 and parameters: {'model_type': 'lgbm', 'n_estimators': 90, 'max_depth': 4, 'learning_rate': 0.2011959057967646}. Best is trial 26 with value: 0.7620842519733222.
[I 2025-08-20 00:16:51,798] Trial 29 finished with value: 0.744714091202771 and parameters: {'model_type': 'lgbm', 'n_estimators': 73, 'max_depth': 7, 'learning_rate': 0.16430529034237543}. Best is trial 26 with value: 0.7620842519733222.
[I 2025-08-20 00:16:51,891] Trial 30 finished with value: 0.7419705413992405 and parameters: {'model_type': 'lgbm', 'n_estimators': 57, 'max_depth': 5, 'learning_rate': 0.12648895295884532}. Best is trial 26 with value: 0.7620842519733222.
[I 2025-08-20 00:16:52,021] Trial 31 finished with value: 0.7456594542637938 and parameters: {'model_type': 'lgbm', 'n_estimators': 119, 'max_depth': 4, 'learning_rate': 0.15967478042324737}. Best is trial 26 with value: 0.7620842519733222.
[I 2025-08-20 00:16:52,172] Trial 32 finished with value: 0.7436351992425837 and parameters: {'model_type': 'lgbm', 'n_estimators': 149, 'max_depth': 4, 'learning_rate': 0.15906196676087664}. Best is trial 26 with value: 0.7620842519733222.
[I 2025-08-20 00:16:52,264] Trial 33 finished with value: 0.765520244826984 and parameters: {'model_type': 'lgbm', 'n_estimators': 129, 'max_depth': 3, 'learning_rate': 0.17558106823062564}. Best is trial 33 with value: 0.765520244826984.
[I 2025-08-20 00:16:52,336] Trial 34 finished with value: 0.7668496962792914 and parameters: {'model_type': 'lgbm', 'n_estimators': 96, 'max_depth': 3, 'learning_rate': 0.22621866172195929}. Best is trial 34 with value: 0.7668496962792914.
[I 2025-08-20 00:16:52,439] Trial 35 finished with value: 0.7440051419806644 and parameters: {'model_type': 'lgbm', 'n_estimators': 147, 'max_depth': 3, 'learning_rate': 0.23155610690657286}. Best is trial 34 with value: 0.7668496962792914.
[I 2025-08-20 00:16:52,531] Trial 36 finished with value: 0.7434434131545982 and parameters: {'model_type': 'lgbm', 'n_estimators': 130, 'max_depth': 3, 'learning_rate': 0.2055065173730034}. Best is trial 34 with value: 0.7668496962792914.
[I 2025-08-20 00:16:52,606] Trial 37 finished with value: 0.7494222465144353 and parameters: {'model_type': 'lgbm', 'n_estimators': 100, 'max_depth': 3, 'learning_rate': 0.2429145548345874}. Best is trial 34 with value: 0.7668496962792914.
[I 2025-08-20 00:16:53,209] Trial 38 finished with value: 0.713311660497676 and parameters: {'model_type': 'rf', 'n_estimators': 170, 'max_depth': 15, 'min_samples_split': 3}. Best is trial 34 with value: 0.7668496962792914.
[I 2025-08-20 00:16:53,218] Trial 39 finished with value: 0.5037970201398967 and parameters: {'model_type': 'bayesian_ridge', 'alpha_1': 0.000933150384543499, 'alpha_2': 0.0009916676390835533, 'lambda_1': 0.00018449899850545476, 'lambda_2': 0.0009862756764153473}. Best is trial 34 with value: 0.7668496962792914.
[I 2025-08-20 00:16:53,311] Trial 40 finished with value: 0.7432830156964497 and parameters: {'model_type': 'lgbm', 'n_estimators': 134, 'max_depth': 3, 'learning_rate': 0.2662016665661702}. Best is trial 34 with value: 0.7668496962792914.
[I 2025-08-20 00:16:53,384] Trial 41 finished with value: 0.7555061168368693 and parameters: {'model_type': 'lgbm', 'n_estimators': 99, 'max_depth': 3, 'learning_rate': 0.23737281078569383}. Best is trial 34 with value: 0.7668496962792914.
[I 2025-08-20 00:16:53,466] Trial 42 finished with value: 0.7482517534874489 and parameters: {'model_type': 'lgbm', 'n_estimators': 114, 'max_depth': 3, 'learning_rate': 0.18278447457485475}. Best is trial 34 with value: 0.7668496962792914.
[I 2025-08-20 00:16:53,528] Trial 43 finished with value: 0.7654829242992206 and parameters: {'model_type': 'lgbm', 'n_estimators': 81, 'max_depth': 3, 'learning_rate': 0.21828919142603606}. Best is trial 34 with value: 0.7668496962792914.
[I 2025-08-20 00:16:53,767] Trial 44 finished with value: 0.7013928834890845 and parameters: {'model_type': 'rf', 'n_estimators': 78, 'max_depth': 13, 'min_samples_split': 10}. Best is trial 34 with value: 0.7668496962792914.
[I 2025-08-20 00:16:53,830] Trial 45 finished with value: 0.7420698803205455 and parameters: {'model_type': 'lgbm', 'n_estimators': 80, 'max_depth': 3, 'learning_rate': 0.2753224282076251}. Best is trial 34 with value: 0.7668496962792914.
[I 2025-08-20 00:16:53,840] Trial 46 finished with value: 0.5037877240288435 and parameters: {'model_type': 'bayesian_ridge', 'alpha_1': 0.0005427184894949279, 'alpha_2': 5.4858854145100754e-05, 'lambda_1': 0.00040576010115483333, 'lambda_2': 0.0005236480984110976}. Best is trial 34 with value: 0.7668496962792914.
[I 2025-08-20 00:16:53,911] Trial 47 finished with value: 0.7538480732487595 and parameters: {'model_type': 'lgbm', 'n_estimators': 98, 'max_depth': 3, 'learning_rate': 0.2198679945754171}. Best is trial 34 with value: 0.7668496962792914.
[I 2025-08-20 00:16:53,966] Trial 48 finished with value: 0.7493946269488241 and parameters: {'model_type': 'lgbm', 'n_estimators': 67, 'max_depth': 3, 'learning_rate': 0.2496583254885944}. Best is trial 34 with value: 0.7668496962792914.
[I 2025-08-20 00:16:54,271] Trial 49 finished with value: 0.7022907394188085 and parameters: {'model_type': 'rf', 'n_estimators': 104, 'max_depth': 8, 'min_samples_split': 2}. Best is trial 34 with value: 0.7668496962792914.
Regression Results:
  Train R²: 0.914
  Test R²: 0.767
  CV R²: 0.453 ± 0.156

=== Generating Visualizations ===
=== Evaluating LightGBM with Parity Plots ===
Model Performance:
  Train R²: 0.914, MAE: 0.195, RMSE: 0.273
  Test R²: 0.767, MAE: 0.326, RMSE: 0.441
Generating parity plots...
Parity plot saved as: plots/parity_plot_lightgbm_train_each_8_optuna_train.png
Parity plot saved as: plots/parity_plot_lightgbm_test_each_8_optuna_test.png
Parity analysis plot saved as: plots/parity_analysis_lightgbm_test_each_8_optuna_analysis.png
HTE prediction evaluation report saved to results/reports/hte_prediction_report_manual_8_each_8_optuna.txt

=== Comparing without reaction-energy features (HTE prediction) ===
=== Building HTE Prediction Models with 8 features ===
Selected features: ['acyl_class_aromatic', 'amine_class_1_mixture', 'amine_Charges_secondary_1', 'acyl_BV_secondary_2', 'acyl_pka_aHs_x_has_acidic_H', 'acyl_Charges_secondary_1', 'amine_pka_basic', 'amine_BV_secondary_avg']
Valid features: 9
=== Building Regression Model ===
Regression dataset: (1031, 9)
Target range: -1.418 to 4.010


Training data: 619 samples
Test data: 206 samples


SFS (regression) failed, using provided features. Error: n_features_to_select must be < n_features.
Running hyperparameter optimization for regression...
[I 2025-08-20 00:16:56,517] A new study created in memory with name: no-name-c064dc34-8fa1-4a46-987f-7b0afb059815
[I 2025-08-20 00:16:59,071] Trial 0 finished with value: 0.6484486671398504 and parameters: {'model_type': 'xgb', 'n_estimators': 68, 'max_depth': 10, 'learning_rate': 0.16290801747689906}. Best is trial 0 with value: 0.6484486671398504.
[I 2025-08-20 00:16:59,163] Trial 1 finished with value: 0.7817253395177189 and parameters: {'model_type': 'lgbm', 'n_estimators': 180, 'max_depth': 3, 'learning_rate': 0.07550953026480693}. Best is trial 1 with value: 0.7817253395177189.
[I 2025-08-20 00:16:59,165] Trial 2 finished with value: 0.45751472101882473 and parameters: {'model_type': 'bayesian_ridge', 'alpha_1': 0.0006084345432418696, 'alpha_2': 0.00014655433058559332, 'lambda_1': 0.0006432471354731972, 'lambda_2': 0.00011361462723678447}. Best is trial 1 with value: 0.7817253395177189.
[I 2025-08-20 00:16:59,166] Trial 3 finished with value: 0.45752243643398094 and parameters: {'model_type': 'bayesian_ridge', 'alpha_1': 0.0005128667087588517, 'alpha_2': 0.0001182579517714424, 'lambda_1': 0.000662001566686996, 'lambda_2': 0.0007517857359826073}. Best is trial 1 with value: 0.7817253395177189.
[I 2025-08-20 00:17:02,108] Trial 4 finished with value: 0.6439824286355291 and parameters: {'model_type': 'xgb', 'n_estimators': 185, 'max_depth': 10, 'learning_rate': 0.15633858783717594}. Best is trial 1 with value: 0.7817253395177189.
[I 2025-08-20 00:17:02,111] Trial 5 finished with value: 0.4575254077705919 and parameters: {'model_type': 'bayesian_ridge', 'alpha_1': 0.0006387038633741041, 'alpha_2': 0.0004647843458936434, 'lambda_1': 9.847907431100049e-05, 'lambda_2': 0.0009645397206379716}. Best is trial 1 with value: 0.7817253395177189.
[I 2025-08-20 00:17:02,112] Trial 6 finished with value: 0.4575223066261672 and parameters: {'model_type': 'bayesian_ridge', 'alpha_1': 0.00043896134290991913, 'alpha_2': 0.00014075527294920385, 'lambda_1': 9.448186281109887e-06, 'lambda_2': 0.0007017246301582767}. Best is trial 1 with value: 0.7817253395177189.
[I 2025-08-20 00:17:02,245] Trial 7 finished with value: 0.7834225119131766 and parameters: {'model_type': 'lgbm', 'n_estimators': 110, 'max_depth': 6, 'learning_rate': 0.11066579919406065}. Best is trial 7 with value: 0.7834225119131766.
[I 2025-08-20 00:17:02,355] Trial 8 finished with value: 0.7778990196320844 and parameters: {'model_type': 'lgbm', 'n_estimators': 154, 'max_depth': 4, 'learning_rate': 0.22527126153764956}. Best is trial 7 with value: 0.7834225119131766.
[I 2025-08-20 00:17:02,357] Trial 9 finished with value: 0.45751580151727567 and parameters: {'model_type': 'bayesian_ridge', 'alpha_1': 0.000482336656665563, 'alpha_2': 0.0006661452758981081, 'lambda_1': 0.0006641116571476318, 'lambda_2': 0.00020476961121132118}. Best is trial 7 with value: 0.7834225119131766.
[I 2025-08-20 00:17:02,496] Trial 10 finished with value: 0.6907433536352361 and parameters: {'model_type': 'rf', 'n_estimators': 105, 'max_depth': 6, 'min_samples_split': 8}. Best is trial 7 with value: 0.7834225119131766.
[I 2025-08-20 00:17:02,575] Trial 11 finished with value: 0.7531974845468735 and parameters: {'model_type': 'lgbm', 'n_estimators': 125, 'max_depth': 3, 'learning_rate': 0.04275379443311411}. Best is trial 7 with value: 0.7834225119131766.
[I 2025-08-20 00:17:02,810] Trial 12 finished with value: 0.7847146728654509 and parameters: {'model_type': 'lgbm', 'n_estimators': 191, 'max_depth': 6, 'learning_rate': 0.05535137176492687}. Best is trial 12 with value: 0.7847146728654509.
[I 2025-08-20 00:17:02,942] Trial 13 finished with value: 0.7692333545239558 and parameters: {'model_type': 'lgbm', 'n_estimators': 89, 'max_depth': 7, 'learning_rate': 0.08067692562401965}. Best is trial 12 with value: 0.7847146728654509.
