[I 2025-08-20 00:17:50,109] Trial 15 finished with value: 0.795861017598183 and parameters: {'model_type': 'lgbm', 'n_estimators': 142, 'max_depth': 4, 'learning_rate': 0.20019517540242185}. Best is trial 12 with value: 0.7988942792253109.
[I 2025-08-20 00:17:50,118] Trial 16 finished with value: 0.39373324097070617 and parameters: {'model_type': 'bayesian_ridge', 'alpha_1': 0.0009909542577462556, 'alpha_2': 0.0009327551648331757, 'lambda_1': 0.0009650203994802781, 'lambda_2': 0.0009168499407538025}. Best is trial 12 with value: 0.7988942792253109.
[I 2025-08-20 00:17:50,215] Trial 17 finished with value: 0.8050217737200942 and parameters: {'model_type': 'lgbm', 'n_estimators': 131, 'max_depth': 4, 'learning_rate': 0.18156893754942022}. Best is trial 17 with value: 0.8050217737200942.
[I 2025-08-20 00:17:50,397] Trial 18 finished with value: 0.767344055050319 and parameters: {'model_type': 'lgbm', 'n_estimators': 127, 'max_depth': 8, 'learning_rate': 0.1507115543724619}. Best is trial 17 with value: 0.8050217737200942.
[I 2025-08-20 00:17:50,550] Trial 19 finished with value: 0.7834901264344141 and parameters: {'model_type': 'lgbm', 'n_estimators': 172, 'max_depth': 5, 'learning_rate': 0.17673548339364187}. Best is trial 17 with value: 0.8050217737200942.
[I 2025-08-20 00:17:50,559] Trial 20 finished with value: 0.39373709991037986 and parameters: {'model_type': 'bayesian_ridge', 'alpha_1': 2.4341759822528778e-05, 'alpha_2': 0.0006855698196549522, 'lambda_1': 0.0006844837591691385, 'lambda_2': 2.2838028056199197e-05}. Best is trial 17 with value: 0.8050217737200942.
[I 2025-08-20 00:17:50,662] Trial 21 finished with value: 0.7947179895289264 and parameters: {'model_type': 'lgbm', 'n_estimators': 134, 'max_depth': 4, 'learning_rate': 0.22219516856120997}. Best is trial 17 with value: 0.8050217737200942.
[I 2025-08-20 00:17:50,787] Trial 22 finished with value: 0.8053141307839392 and parameters: {'model_type': 'lgbm', 'n_estimators': 137, 'max_depth': 4, 'learning_rate': 0.15868730790689772}. Best is trial 22 with value: 0.8053141307839392.
[I 2025-08-20 00:17:50,936] Trial 23 finished with value: 0.7724090582492886 and parameters: {'model_type': 'lgbm', 'n_estimators': 127, 'max_depth': 5, 'learning_rate': 0.1305953915284321}. Best is trial 22 with value: 0.8053141307839392.
[I 2025-08-20 00:17:51,050] Trial 24 finished with value: 0.676377752266764 and parameters: {'model_type': 'lgbm', 'n_estimators': 164, 'max_depth': 3, 'learning_rate': 0.021140502949156426}. Best is trial 22 with value: 0.8053141307839392.
[I 2025-08-20 00:17:51,136] Trial 25 finished with value: 0.7829400230886914 and parameters: {'model_type': 'lgbm', 'n_estimators': 89, 'max_depth': 4, 'learning_rate': 0.24786187872447252}. Best is trial 22 with value: 0.8053141307839392.
[I 2025-08-20 00:17:51,269] Trial 26 finished with value: 0.7764996811255231 and parameters: {'model_type': 'lgbm', 'n_estimators': 137, 'max_depth': 5, 'learning_rate': 0.1334854444753304}. Best is trial 22 with value: 0.8053141307839392.
[I 2025-08-20 00:17:51,370] Trial 27 finished with value: 0.8101970141432782 and parameters: {'model_type': 'lgbm', 'n_estimators': 200, 'max_depth': 3, 'learning_rate': 0.1759179303955881}. Best is trial 27 with value: 0.8101970141432782.
[I 2025-08-20 00:17:51,380] Trial 28 finished with value: 0.3937326469162258 and parameters: {'model_type': 'bayesian_ridge', 'alpha_1': 0.0009642987614906693, 'alpha_2': 9.21408804768905e-06, 'lambda_1': 0.00010533771467660641, 'lambda_2': 0.0009955970748945315}. Best is trial 27 with value: 0.8101970141432782.
[I 2025-08-20 00:17:52,117] Trial 29 finished with value: 0.7208563970944146 and parameters: {'model_type': 'xgb', 'n_estimators': 195, 'max_depth': 7, 'learning_rate': 0.18160101738987675}. Best is trial 27 with value: 0.8101970141432782.
[I 2025-08-20 00:17:52,911] Trial 30 finished with value: 0.6789002349182932 and parameters: {'model_type': 'xgb', 'n_estimators': 56, 'max_depth': 10, 'learning_rate': 0.10877197339948705}. Best is trial 27 with value: 0.8101970141432782.
[I 2025-08-20 00:17:52,979] Trial 31 finished with value: 0.7996063040281234 and parameters: {'model_type': 'lgbm', 'n_estimators': 120, 'max_depth': 3, 'learning_rate': 0.17655936438961137}. Best is trial 27 with value: 0.8101970141432782.
[I 2025-08-20 00:17:53,044] Trial 32 finished with value: 0.7874114177282068 and parameters: {'model_type': 'lgbm', 'n_estimators': 119, 'max_depth': 3, 'learning_rate': 0.17378377555518812}. Best is trial 27 with value: 0.8101970141432782.
[I 2025-08-20 00:17:53,147] Trial 33 finished with value: 0.7915125093179637 and parameters: {'model_type': 'lgbm', 'n_estimators': 85, 'max_depth': 4, 'learning_rate': 0.1606815772950384}. Best is trial 27 with value: 0.8101970141432782.
[I 2025-08-20 00:17:53,206] Trial 34 finished with value: 0.7695160774585184 and parameters: {'model_type': 'lgbm', 'n_estimators': 71, 'max_depth': 3, 'learning_rate': 0.19789409043753578}. Best is trial 27 with value: 0.8101970141432782.
[I 2025-08-20 00:17:53,307] Trial 35 finished with value: 0.7999409884880313 and parameters: {'model_type': 'lgbm', 'n_estimators': 119, 'max_depth': 4, 'learning_rate': 0.1457075996315447}. Best is trial 27 with value: 0.8101970141432782.
[I 2025-08-20 00:17:53,927] Trial 36 finished with value: 0.769450956645596 and parameters: {'model_type': 'xgb', 'n_estimators': 175, 'max_depth': 5, 'learning_rate': 0.1406923873498132}. Best is trial 27 with value: 0.8101970141432782.
[I 2025-08-20 00:17:54,080] Trial 37 finished with value: 0.7935691885439279 and parameters: {'model_type': 'lgbm', 'n_estimators': 195, 'max_depth': 4, 'learning_rate': 0.11598395231310211}. Best is trial 27 with value: 0.8101970141432782.
[I 2025-08-20 00:17:54,237] Trial 38 finished with value: 0.7077966916416834 and parameters: {'model_type': 'rf', 'n_estimators': 98, 'max_depth': 13, 'min_samples_split': 10}. Best is trial 27 with value: 0.8101970141432782.
[I 2025-08-20 00:17:54,345] Trial 39 finished with value: 0.8096037397603496 and parameters: {'model_type': 'lgbm', 'n_estimators': 136, 'max_depth': 4, 'learning_rate': 0.15864398516364517}. Best is trial 27 with value: 0.8101970141432782.
[I 2025-08-20 00:17:54,588] Trial 40 finished with value: 0.7663393137515013 and parameters: {'model_type': 'lgbm', 'n_estimators': 181, 'max_depth': 7, 'learning_rate': 0.23130657438743876}. Best is trial 27 with value: 0.8101970141432782.
[I 2025-08-20 00:17:54,689] Trial 41 finished with value: 0.7938074793839273 and parameters: {'model_type': 'lgbm', 'n_estimators': 125, 'max_depth': 4, 'learning_rate': 0.15529853078776518}. Best is trial 27 with value: 0.8101970141432782.
[I 2025-08-20 00:17:54,823] Trial 42 finished with value: 0.7890770888557337 and parameters: {'model_type': 'lgbm', 'n_estimators': 134, 'max_depth': 5, 'learning_rate': 0.1959613567818377}. Best is trial 27 with value: 0.8101970141432782.
[I 2025-08-20 00:17:54,913] Trial 43 finished with value: 0.7962132984687416 and parameters: {'model_type': 'lgbm', 'n_estimators': 113, 'max_depth': 4, 'learning_rate': 0.15992526443480887}. Best is trial 27 with value: 0.8101970141432782.
[I 2025-08-20 00:17:55,072] Trial 44 finished with value: 0.7048050594416735 and parameters: {'model_type': 'rf', 'n_estimators': 99, 'max_depth': 10, 'min_samples_split': 8}. Best is trial 27 with value: 0.8101970141432782.
[I 2025-08-20 00:17:55,189] Trial 45 finished with value: 0.7941031929915874 and parameters: {'model_type': 'lgbm', 'n_estimators': 147, 'max_depth': 4, 'learning_rate': 0.11656433636758098}. Best is trial 27 with value: 0.8101970141432782.
[I 2025-08-20 00:17:55,302] Trial 46 finished with value: 0.7835697472871649 and parameters: {'model_type': 'lgbm', 'n_estimators': 111, 'max_depth': 5, 'learning_rate': 0.14140783602540855}. Best is trial 27 with value: 0.8101970141432782.
[I 2025-08-20 00:17:55,756] Trial 47 finished with value: 0.7667563063097107 and parameters: {'model_type': 'xgb', 'n_estimators': 166, 'max_depth': 4, 'learning_rate': 0.1901391682208917}. Best is trial 27 with value: 0.8101970141432782.
[I 2025-08-20 00:17:55,768] Trial 48 finished with value: 0.3937346934428656 and parameters: {'model_type': 'bayesian_ridge', 'alpha_1': 0.0005346756240059479, 'alpha_2': 0.00038958970497146757, 'lambda_1': 0.0004756545343164335, 'lambda_2': 0.0005546284700139323}. Best is trial 27 with value: 0.8101970141432782.
[I 2025-08-20 00:17:55,969] Trial 49 finished with value: 0.6746821965864691 and parameters: {'model_type': 'rf', 'n_estimators': 135, 'max_depth': 7, 'min_samples_split': 2}. Best is trial 27 with value: 0.8101970141432782.
Regression Results:
  Train R²: 0.898
  Test R²: 0.810
  CV R²: 0.403 ± 0.131
Saved comparison to results/rxn_feature_comparison_hte_each_8_optuna.json

==================================================
ANALYSIS COMPLETE
==================================================
Check the following directories for outputs:
  - plots/: Visualization files
  - results/: Data files and reports
  - models/: Trained model files
