[I 2025-08-20 00:15:59,763] Trial 15 finished with value: 0.8050329296488173 and parameters: {'model_type': 'rf', 'n_estimators': 50, 'max_depth': 12, 'min_samples_split': 2}. Best is trial 7 with value: 0.8065206395428783.
[I 2025-08-20 00:15:59,772] Trial 16 finished with value: 0.5013707569108276 and parameters: {'model_type': 'bayesian_ridge', 'alpha_1': 6.921009899135016e-06, 'alpha_2': 0.0009537759866953446, 'lambda_1': 1.5950628925703978e-05, 'lambda_2': 6.288416129826996e-05}. Best is trial 7 with value: 0.8065206395428783.
[I 2025-08-20 00:16:00,005] Trial 17 finished with value: 0.7898015140561807 and parameters: {'model_type': 'rf', 'n_estimators': 171, 'max_depth': 7, 'min_samples_split': 7}. Best is trial 7 with value: 0.8065206395428783.
[I 2025-08-20 00:16:00,206] Trial 18 finished with value: 0.8090968202397024 and parameters: {'model_type': 'rf', 'n_estimators': 124, 'max_depth': 13, 'min_samples_split': 7}. Best is trial 18 with value: 0.8090968202397024.
[I 2025-08-20 00:16:00,402] Trial 19 finished with value: 0.8077126593298155 and parameters: {'model_type': 'rf', 'n_estimators': 123, 'max_depth': 12, 'min_samples_split': 7}. Best is trial 18 with value: 0.8090968202397024.
[I 2025-08-20 00:16:00,411] Trial 20 finished with value: 0.5013666374006472 and parameters: {'model_type': 'bayesian_ridge', 'alpha_1': 0.0005162466239335807, 'alpha_2': 2.877742874749558e-05, 'lambda_1': 0.00034915095316611966, 'lambda_2': 0.0009924018329707724}. Best is trial 18 with value: 0.8090968202397024.
[I 2025-08-20 00:16:00,605] Trial 21 finished with value: 0.8076673849019231 and parameters: {'model_type': 'rf', 'n_estimators': 121, 'max_depth': 12, 'min_samples_split': 7}. Best is trial 18 with value: 0.8090968202397024.
[I 2025-08-20 00:16:00,798] Trial 22 finished with value: 0.8081510018936557 and parameters: {'model_type': 'rf', 'n_estimators': 119, 'max_depth': 13, 'min_samples_split': 7}. Best is trial 18 with value: 0.8090968202397024.
[I 2025-08-20 00:16:00,992] Trial 23 finished with value: 0.8103117375869878 and parameters: {'model_type': 'rf', 'n_estimators': 118, 'max_depth': 13, 'min_samples_split': 6}. Best is trial 23 with value: 0.8103117375869878.
[I 2025-08-20 00:16:01,180] Trial 24 finished with value: 0.7641576994424835 and parameters: {'model_type': 'lgbm', 'n_estimators': 115, 'max_depth': 9, 'learning_rate': 0.2922292880759856}. Best is trial 23 with value: 0.8103117375869878.
[I 2025-08-20 00:16:01,411] Trial 25 finished with value: 0.8099955064296918 and parameters: {'model_type': 'rf', 'n_estimators': 134, 'max_depth': 13, 'min_samples_split': 5}. Best is trial 23 with value: 0.8103117375869878.
[I 2025-08-20 00:16:01,631] Trial 26 finished with value: 0.8096749811711749 and parameters: {'model_type': 'rf', 'n_estimators': 130, 'max_depth': 14, 'min_samples_split': 5}. Best is trial 23 with value: 0.8103117375869878.
[I 2025-08-20 00:16:01,871] Trial 27 finished with value: 0.812330065032622 and parameters: {'model_type': 'rf', 'n_estimators': 137, 'max_depth': 14, 'min_samples_split': 4}. Best is trial 27 with value: 0.812330065032622.
[I 2025-08-20 00:16:02,116] Trial 28 finished with value: 0.8122058636575576 and parameters: {'model_type': 'rf', 'n_estimators': 141, 'max_depth': 14, 'min_samples_split': 4}. Best is trial 27 with value: 0.812330065032622.
[I 2025-08-20 00:16:02,126] Trial 29 finished with value: 0.5013710387288921 and parameters: {'model_type': 'bayesian_ridge', 'alpha_1': 3.564520296220428e-05, 'alpha_2': 0.0009823594482823309, 'lambda_1': 0.000970951158722149, 'lambda_2': 5.775836080332324e-05}. Best is trial 27 with value: 0.812330065032622.
[I 2025-08-20 00:16:02,351] Trial 30 finished with value: 0.764060374954829 and parameters: {'model_type': 'lgbm', 'n_estimators': 165, 'max_depth': 9, 'learning_rate': 0.20650814648410273}. Best is trial 27 with value: 0.812330065032622.
[I 2025-08-20 00:16:02,591] Trial 31 finished with value: 0.8115402679132984 and parameters: {'model_type': 'rf', 'n_estimators': 135, 'max_depth': 14, 'min_samples_split': 4}. Best is trial 27 with value: 0.812330065032622.
[I 2025-08-20 00:16:02,850] Trial 32 finished with value: 0.8115783343571603 and parameters: {'model_type': 'rf', 'n_estimators': 143, 'max_depth': 14, 'min_samples_split': 3}. Best is trial 27 with value: 0.812330065032622.
[I 2025-08-20 00:16:03,111] Trial 33 finished with value: 0.8115783343571603 and parameters: {'model_type': 'rf', 'n_estimators': 143, 'max_depth': 14, 'min_samples_split': 3}. Best is trial 27 with value: 0.812330065032622.
[I 2025-08-20 00:16:03,434] Trial 34 finished with value: 0.8117471611682875 and parameters: {'model_type': 'rf', 'n_estimators': 179, 'max_depth': 14, 'min_samples_split': 3}. Best is trial 27 with value: 0.812330065032622.
[I 2025-08-20 00:16:03,743] Trial 35 finished with value: 0.8101085970830135 and parameters: {'model_type': 'rf', 'n_estimators': 180, 'max_depth': 11, 'min_samples_split': 3}. Best is trial 27 with value: 0.812330065032622.
[I 2025-08-20 00:16:04,181] Trial 36 finished with value: 0.7919952203600069 and parameters: {'model_type': 'xgb', 'n_estimators': 157, 'max_depth': 6, 'learning_rate': 0.22373539835557976}. Best is trial 27 with value: 0.812330065032622.
[I 2025-08-20 00:16:04,525] Trial 37 finished with value: 0.8128402193348576 and parameters: {'model_type': 'rf', 'n_estimators': 185, 'max_depth': 14, 'min_samples_split': 3}. Best is trial 37 with value: 0.8128402193348576.
[I 2025-08-20 00:16:04,877] Trial 38 finished with value: 0.8110678390667404 and parameters: {'model_type': 'rf', 'n_estimators': 184, 'max_depth': 15, 'min_samples_split': 2}. Best is trial 37 with value: 0.8128402193348576.
[I 2025-08-20 00:16:05,362] Trial 39 finished with value: 0.7798361864657981 and parameters: {'model_type': 'xgb', 'n_estimators': 170, 'max_depth': 6, 'learning_rate': 0.0784205960578344}. Best is trial 37 with value: 0.8128402193348576.
[I 2025-08-20 00:16:05,680] Trial 40 finished with value: 0.76826296483012 and parameters: {'model_type': 'lgbm', 'n_estimators': 178, 'max_depth': 9, 'learning_rate': 0.1684839548724638}. Best is trial 37 with value: 0.8128402193348576.
[I 2025-08-20 00:16:06,029] Trial 41 finished with value: 0.8133046198961303 and parameters: {'model_type': 'rf', 'n_estimators': 189, 'max_depth': 14, 'min_samples_split': 3}. Best is trial 41 with value: 0.8133046198961303.
[I 2025-08-20 00:16:06,360] Trial 42 finished with value: 0.8135111135214573 and parameters: {'model_type': 'rf', 'n_estimators': 191, 'max_depth': 14, 'min_samples_split': 4}. Best is trial 42 with value: 0.8135111135214573.
[I 2025-08-20 00:16:06,678] Trial 43 finished with value: 0.8123142727600687 and parameters: {'model_type': 'rf', 'n_estimators': 189, 'max_depth': 11, 'min_samples_split': 4}. Best is trial 42 with value: 0.8135111135214573.
[I 2025-08-20 00:16:06,995] Trial 44 finished with value: 0.8123665692195289 and parameters: {'model_type': 'rf', 'n_estimators': 190, 'max_depth': 11, 'min_samples_split': 4}. Best is trial 42 with value: 0.8135111135214573.
[I 2025-08-20 00:16:07,318] Trial 45 finished with value: 0.8120262118921195 and parameters: {'model_type': 'rf', 'n_estimators': 192, 'max_depth': 11, 'min_samples_split': 4}. Best is trial 42 with value: 0.8135111135214573.
[I 2025-08-20 00:16:08,469] Trial 46 finished with value: 0.7619973508616178 and parameters: {'model_type': 'xgb', 'n_estimators': 196, 'max_depth': 8, 'learning_rate': 0.06078668185307329}. Best is trial 42 with value: 0.8135111135214573.
[I 2025-08-20 00:16:08,793] Trial 47 finished with value: 0.8130577415877603 and parameters: {'model_type': 'rf', 'n_estimators': 187, 'max_depth': 13, 'min_samples_split': 5}. Best is trial 42 with value: 0.8135111135214573.
[I 2025-08-20 00:16:09,089] Trial 48 finished with value: 0.8113016946585024 and parameters: {'model_type': 'rf', 'n_estimators': 185, 'max_depth': 10, 'min_samples_split': 5}. Best is trial 42 with value: 0.8135111135214573.
[I 2025-08-20 00:16:09,098] Trial 49 finished with value: 0.5013689008767759 and parameters: {'model_type': 'bayesian_ridge', 'alpha_1': 0.0009816335856281855, 'alpha_2': 5.231419269297082e-05, 'lambda_1': 0.0005392999047714682, 'lambda_2': 0.000501773383780652}. Best is trial 42 with value: 0.8135111135214573.
Regression Results:
  Train R²: 0.943
  Test R²: 0.814
  CV R²: 0.414 ± 0.264
Saved comparison to results/rxn_feature_comparison_hte_each_8_optuna.json

==================================================
ANALYSIS COMPLETE
==================================================
Check the following directories for outputs:
  - plots/: Visualization files
  - results/: Data files and reports
  - models/: Trained model files
