[I 2025-08-20 00:18:51,513] Trial 14 finished with value: 0.3800311280093539 and parameters: {'model_type': 'rf', 'n_estimators': 156, 'max_depth': 13, 'min_samples_split': 8}. Best is trial 13 with value: 0.380469033826776.
[I 2025-08-20 00:18:51,734] Trial 15 finished with value: 0.383647403465075 and parameters: {'model_type': 'rf', 'n_estimators': 147, 'max_depth': 12, 'min_samples_split': 8}. Best is trial 15 with value: 0.383647403465075.
[I 2025-08-20 00:18:51,743] Trial 16 finished with value: 0.33944899573527787 and parameters: {'model_type': 'bayesian_ridge', 'alpha_1': 0.0008519744033170886, 'alpha_2': 1.2768391818791412e-05, 'lambda_1': 4.2125689687830346e-05, 'lambda_2': 0.000998313482714128}. Best is trial 15 with value: 0.383647403465075.
[I 2025-08-20 00:18:52,138] Trial 17 finished with value: 0.29123349998414894 and parameters: {'model_type': 'xgb', 'n_estimators': 107, 'max_depth': 7, 'learning_rate': 0.15646612130270876}. Best is trial 15 with value: 0.383647403465075.
[I 2025-08-20 00:18:52,419] Trial 18 finished with value: 0.3952229737413091 and parameters: {'model_type': 'lgbm', 'n_estimators': 124, 'max_depth': 9, 'learning_rate': 0.02208036827345264}. Best is trial 18 with value: 0.3952229737413091.
[I 2025-08-20 00:18:52,659] Trial 19 finished with value: 0.39598017802718666 and parameters: {'model_type': 'lgbm', 'n_estimators': 120, 'max_depth': 8, 'learning_rate': 0.013122589897611336}. Best is trial 19 with value: 0.39598017802718666.
[I 2025-08-20 00:18:52,894] Trial 20 finished with value: 0.4022816313479387 and parameters: {'model_type': 'lgbm', 'n_estimators': 119, 'max_depth': 8, 'learning_rate': 0.014986646867661307}. Best is trial 20 with value: 0.4022816313479387.
[I 2025-08-20 00:18:53,131] Trial 21 finished with value: 0.4009415435172988 and parameters: {'model_type': 'lgbm', 'n_estimators': 120, 'max_depth': 8, 'learning_rate': 0.014424152685043911}. Best is trial 20 with value: 0.4022816313479387.
[I 2025-08-20 00:18:53,432] Trial 22 finished with value: 0.3975855521224295 and parameters: {'model_type': 'lgbm', 'n_estimators': 118, 'max_depth': 8, 'learning_rate': 0.013806581509947888}. Best is trial 20 with value: 0.4022816313479387.
[I 2025-08-20 00:18:53,613] Trial 23 finished with value: 0.36583852302213027 and parameters: {'model_type': 'lgbm', 'n_estimators': 82, 'max_depth': 8, 'learning_rate': 0.10370466943919486}. Best is trial 20 with value: 0.4022816313479387.
[I 2025-08-20 00:18:53,884] Trial 24 finished with value: 0.394659917954742 and parameters: {'model_type': 'lgbm', 'n_estimators': 113, 'max_depth': 6, 'learning_rate': 0.013457085588785528}. Best is trial 20 with value: 0.4022816313479387.
[I 2025-08-20 00:18:54,044] Trial 25 finished with value: 0.37551068041753355 and parameters: {'model_type': 'lgbm', 'n_estimators': 71, 'max_depth': 8, 'learning_rate': 0.12696183715610027}. Best is trial 20 with value: 0.4022816313479387.
[I 2025-08-20 00:18:54,265] Trial 26 finished with value: 0.3653652599311066 and parameters: {'model_type': 'lgbm', 'n_estimators': 106, 'max_depth': 7, 'learning_rate': 0.0578916622131192}. Best is trial 20 with value: 0.4022816313479387.
[I 2025-08-20 00:18:54,520] Trial 27 finished with value: 0.38476764072735703 and parameters: {'model_type': 'lgbm', 'n_estimators': 136, 'max_depth': 6, 'learning_rate': 0.048441330835772595}. Best is trial 20 with value: 0.4022816313479387.
[I 2025-08-20 00:18:54,752] Trial 28 finished with value: 0.3822748585383863 and parameters: {'model_type': 'lgbm', 'n_estimators': 103, 'max_depth': 8, 'learning_rate': 0.012671174118786276}. Best is trial 20 with value: 0.4022816313479387.
[I 2025-08-20 00:18:54,841] Trial 29 finished with value: 0.42214954536033467 and parameters: {'model_type': 'lgbm', 'n_estimators': 119, 'max_depth': 3, 'learning_rate': 0.18778583393337248}. Best is trial 29 with value: 0.42214954536033467.
[I 2025-08-20 00:18:54,930] Trial 30 finished with value: 0.4127114051287095 and parameters: {'model_type': 'lgbm', 'n_estimators': 132, 'max_depth': 3, 'learning_rate': 0.19460371835616777}. Best is trial 29 with value: 0.42214954536033467.
[I 2025-08-20 00:18:55,014] Trial 31 finished with value: 0.4229639461209568 and parameters: {'model_type': 'lgbm', 'n_estimators': 130, 'max_depth': 3, 'learning_rate': 0.20287741430872688}. Best is trial 31 with value: 0.4229639461209568.
[I 2025-08-20 00:18:55,111] Trial 32 finished with value: 0.41890247768348265 and parameters: {'model_type': 'lgbm', 'n_estimators': 132, 'max_depth': 3, 'learning_rate': 0.19360424713072857}. Best is trial 31 with value: 0.4229639461209568.
[I 2025-08-20 00:18:55,411] Trial 33 finished with value: 0.42315588426211836 and parameters: {'model_type': 'lgbm', 'n_estimators': 130, 'max_depth': 3, 'learning_rate': 0.1921058592772545}. Best is trial 33 with value: 0.42315588426211836.
[I 2025-08-20 00:18:55,504] Trial 34 finished with value: 0.41334936725820537 and parameters: {'model_type': 'lgbm', 'n_estimators': 130, 'max_depth': 3, 'learning_rate': 0.20000525806169464}. Best is trial 33 with value: 0.42315588426211836.
[I 2025-08-20 00:18:55,514] Trial 35 finished with value: 0.339469230317747 and parameters: {'model_type': 'bayesian_ridge', 'alpha_1': 0.0008766964341237487, 'alpha_2': 0.0008931041957904657, 'lambda_1': 0.0009289457197881908, 'lambda_2': 0.00011856983816237724}. Best is trial 33 with value: 0.42315588426211836.
[I 2025-08-20 00:18:55,661] Trial 36 finished with value: 0.3958989286944615 and parameters: {'model_type': 'lgbm', 'n_estimators': 150, 'max_depth': 4, 'learning_rate': 0.22790301700755813}. Best is trial 33 with value: 0.42315588426211836.
[I 2025-08-20 00:18:55,671] Trial 37 finished with value: 0.33945781024419397 and parameters: {'model_type': 'bayesian_ridge', 'alpha_1': 0.00029078495907975684, 'alpha_2': 0.0004810421233851144, 'lambda_1': 1.2107818926620768e-05, 'lambda_2': 0.0005817667728530405}. Best is trial 33 with value: 0.42315588426211836.
[I 2025-08-20 00:18:55,800] Trial 38 finished with value: 0.378265071457627 and parameters: {'model_type': 'lgbm', 'n_estimators': 139, 'max_depth': 4, 'learning_rate': 0.17292027307568406}. Best is trial 33 with value: 0.42315588426211836.
[I 2025-08-20 00:20:01,823] Trial 39 finished with value: 0.3482874185486833 and parameters: {'model_type': 'xgb', 'n_estimators': 93, 'max_depth': 3, 'learning_rate': 0.2251497473367463}. Best is trial 33 with value: 0.42315588426211836.
[I 2025-08-20 00:22:20,421] Trial 40 finished with value: 0.38759614678795884 and parameters: {'model_type': 'lgbm', 'n_estimators': 128, 'max_depth': 4, 'learning_rate': 0.199319310140349}. Best is trial 33 with value: 0.42315588426211836.
[I 2025-08-20 00:23:56,192] Trial 41 finished with value: 0.42091807327316033 and parameters: {'model_type': 'lgbm', 'n_estimators': 130, 'max_depth': 3, 'learning_rate': 0.19679378064779093}. Best is trial 33 with value: 0.42315588426211836.
[I 2025-08-20 00:25:40,485] Trial 42 finished with value: 0.4096500570887208 and parameters: {'model_type': 'lgbm', 'n_estimators': 145, 'max_depth': 3, 'learning_rate': 0.18144750882388444}. Best is trial 33 with value: 0.42315588426211836.
