[I 2025-08-20 00:18:13,958] Trial 14 finished with value: 0.6230000541565892 and parameters: {'model_type': 'xgb', 'n_estimators': 116, 'max_depth': 6, 'learning_rate': 0.10623382107126739}. Best is trial 12 with value: 0.7168054194228405.
[I 2025-08-20 00:18:14,133] Trial 15 finished with value: 0.7646604330088225 and parameters: {'model_type': 'xgb', 'n_estimators': 153, 'max_depth': 3, 'learning_rate': 0.08624953380682174}. Best is trial 15 with value: 0.7646604330088225.
[I 2025-08-20 00:18:14,307] Trial 16 finished with value: 0.7507087923853732 and parameters: {'model_type': 'xgb', 'n_estimators': 153, 'max_depth': 3, 'learning_rate': 0.13846820696173165}. Best is trial 15 with value: 0.7646604330088225.
[I 2025-08-20 00:18:14,390] Trial 17 finished with value: 0.6300252416314072 and parameters: {'model_type': 'lgbm', 'n_estimators': 159, 'max_depth': 3, 'learning_rate': 0.1837928939919757}. Best is trial 15 with value: 0.7646604330088225.
[I 2025-08-20 00:18:14,639] Trial 18 finished with value: 0.6507701543105581 and parameters: {'model_type': 'rf', 'n_estimators': 147, 'max_depth': 12, 'min_samples_split': 4}. Best is trial 15 with value: 0.7646604330088225.
[I 2025-08-20 00:18:14,953] Trial 19 finished with value: 0.7650113030991259 and parameters: {'model_type': 'xgb', 'n_estimators': 162, 'max_depth': 3, 'learning_rate': 0.16486989186978113}. Best is trial 19 with value: 0.7650113030991259.
[I 2025-08-20 00:18:15,326] Trial 20 finished with value: 0.7034519548136753 and parameters: {'model_type': 'xgb', 'n_estimators': 165, 'max_depth': 5, 'learning_rate': 0.2070034293413307}. Best is trial 19 with value: 0.7650113030991259.
[I 2025-08-20 00:18:15,581] Trial 21 finished with value: 0.7577408478664542 and parameters: {'model_type': 'xgb', 'n_estimators': 155, 'max_depth': 3, 'learning_rate': 0.13592408283420257}. Best is trial 19 with value: 0.7650113030991259.
[I 2025-08-20 00:18:15,912] Trial 22 finished with value: 0.7285918573287169 and parameters: {'model_type': 'xgb', 'n_estimators': 197, 'max_depth': 3, 'learning_rate': 0.15105337305045366}. Best is trial 19 with value: 0.7650113030991259.
[I 2025-08-20 00:18:16,212] Trial 23 finished with value: 0.73198084359849 and parameters: {'model_type': 'xgb', 'n_estimators': 136, 'max_depth': 4, 'learning_rate': 0.10531245053353303}. Best is trial 19 with value: 0.7650113030991259.
[I 2025-08-20 00:18:16,388] Trial 24 finished with value: 0.7066881957450493 and parameters: {'model_type': 'xgb', 'n_estimators': 164, 'max_depth': 3, 'learning_rate': 0.19849770271075973}. Best is trial 19 with value: 0.7650113030991259.
[I 2025-08-20 00:18:16,641] Trial 25 finished with value: 0.7041552803246289 and parameters: {'model_type': 'xgb', 'n_estimators': 145, 'max_depth': 4, 'learning_rate': 0.07769154644821753}. Best is trial 19 with value: 0.7650113030991259.
[I 2025-08-20 00:18:16,781] Trial 26 finished with value: 0.6420394021121838 and parameters: {'model_type': 'rf', 'n_estimators': 94, 'max_depth': 8, 'min_samples_split': 10}. Best is trial 19 with value: 0.7650113030991259.
[I 2025-08-20 00:18:16,903] Trial 27 finished with value: 0.5696815156517787 and parameters: {'model_type': 'lgbm', 'n_estimators': 128, 'max_depth': 5, 'learning_rate': 0.129936547502599}. Best is trial 19 with value: 0.7650113030991259.
[I 2025-08-20 00:18:16,913] Trial 28 finished with value: 0.10277980886678484 and parameters: {'model_type': 'bayesian_ridge', 'alpha_1': 0.0009431536181654918, 'alpha_2': 7.653396870029505e-06, 'lambda_1': 0.0009672239587347187, 'lambda_2': 0.0008961704841587601}. Best is trial 19 with value: 0.7650113030991259.
[I 2025-08-20 00:18:17,171] Trial 29 finished with value: 0.7639575903411846 and parameters: {'model_type': 'xgb', 'n_estimators': 171, 'max_depth': 3, 'learning_rate': 0.16593809838474374}. Best is trial 19 with value: 0.7650113030991259.
[I 2025-08-20 00:18:17,455] Trial 30 finished with value: 0.6488482024944755 and parameters: {'model_type': 'xgb', 'n_estimators': 172, 'max_depth': 4, 'learning_rate': 0.17564379447211703}. Best is trial 19 with value: 0.7650113030991259.
[I 2025-08-20 00:18:17,627] Trial 31 finished with value: 0.730820805006316 and parameters: {'model_type': 'xgb', 'n_estimators': 155, 'max_depth': 3, 'learning_rate': 0.22793941647461025}. Best is trial 19 with value: 0.7650113030991259.
[I 2025-08-20 00:18:18,101] Trial 32 finished with value: 0.7707120068494318 and parameters: {'model_type': 'xgb', 'n_estimators': 184, 'max_depth': 3, 'learning_rate': 0.16378437341718083}. Best is trial 32 with value: 0.7707120068494318.
[I 2025-08-20 00:18:18,399] Trial 33 finished with value: 0.7552578103547296 and parameters: {'model_type': 'xgb', 'n_estimators': 188, 'max_depth': 3, 'learning_rate': 0.1750273585494939}. Best is trial 32 with value: 0.7707120068494318.
[I 2025-08-20 00:18:18,818] Trial 34 finished with value: 0.7138416932652276 and parameters: {'model_type': 'xgb', 'n_estimators': 178, 'max_depth': 4, 'learning_rate': 0.22885438450840123}. Best is trial 32 with value: 0.7707120068494318.
[I 2025-08-20 00:18:18,829] Trial 35 finished with value: 0.10280399185969857 and parameters: {'model_type': 'bayesian_ridge', 'alpha_1': 0.0005406323744460591, 'alpha_2': 0.0009048143211338286, 'lambda_1': 6.785243936190631e-05, 'lambda_2': 0.0005146063741300142}. Best is trial 32 with value: 0.7707120068494318.
[I 2025-08-20 00:18:19,112] Trial 36 finished with value: 0.659367827383557 and parameters: {'model_type': 'xgb', 'n_estimators': 200, 'max_depth': 4, 'learning_rate': 0.1542406674742568}. Best is trial 32 with value: 0.7707120068494318.
[I 2025-08-20 00:18:19,206] Trial 37 finished with value: 0.5885173619853343 and parameters: {'model_type': 'lgbm', 'n_estimators': 170, 'max_depth': 3, 'learning_rate': 0.117630459161112}. Best is trial 32 with value: 0.7707120068494318.
[I 2025-08-20 00:18:19,635] Trial 38 finished with value: 0.7045030573935016 and parameters: {'model_type': 'xgb', 'n_estimators': 183, 'max_depth': 5, 'learning_rate': 0.17118788394770312}. Best is trial 32 with value: 0.7707120068494318.
[I 2025-08-20 00:18:19,646] Trial 39 finished with value: 0.1028082945884028 and parameters: {'model_type': 'bayesian_ridge', 'alpha_1': 0.0005191682533912553, 'alpha_2': 0.0007673577658216055, 'lambda_1': 0.00031752703259725417, 'lambda_2': 0.00046812432873757296}. Best is trial 32 with value: 0.7707120068494318.
[I 2025-08-20 00:18:19,888] Trial 40 finished with value: 0.6379461235428886 and parameters: {'model_type': 'rf', 'n_estimators': 176, 'max_depth': 7, 'min_samples_split': 7}. Best is trial 32 with value: 0.7707120068494318.
[I 2025-08-20 00:18:20,180] Trial 41 finished with value: 0.7399479946398915 and parameters: {'model_type': 'xgb', 'n_estimators': 160, 'max_depth': 3, 'learning_rate': 0.14585455861027802}. Best is trial 32 with value: 0.7707120068494318.
[I 2025-08-20 00:18:20,350] Trial 42 finished with value: 0.7509073282772243 and parameters: {'model_type': 'xgb', 'n_estimators': 149, 'max_depth': 3, 'learning_rate': 0.12817195779557655}. Best is trial 32 with value: 0.7707120068494318.
[I 2025-08-20 00:18:20,672] Trial 43 finished with value: 0.7204159019350677 and parameters: {'model_type': 'xgb', 'n_estimators': 192, 'max_depth': 4, 'learning_rate': 0.08142616960219476}. Best is trial 32 with value: 0.7707120068494318.
[I 2025-08-20 00:18:20,952] Trial 44 finished with value: 0.7266113980040724 and parameters: {'model_type': 'xgb', 'n_estimators': 168, 'max_depth': 4, 'learning_rate': 0.16215693165229578}. Best is trial 32 with value: 0.7707120068494318.
[I 2025-08-20 00:18:21,161] Trial 45 finished with value: 0.7159028924442112 and parameters: {'model_type': 'xgb', 'n_estimators': 180, 'max_depth': 3, 'learning_rate': 0.20093219622607544}. Best is trial 32 with value: 0.7707120068494318.
[I 2025-08-20 00:18:21,450] Trial 46 finished with value: 0.7102321941261841 and parameters: {'model_type': 'xgb', 'n_estimators': 187, 'max_depth': 4, 'learning_rate': 0.11485524971727576}. Best is trial 32 with value: 0.7707120068494318.
[I 2025-08-20 00:18:21,643] Trial 47 finished with value: 0.7445131807353181 and parameters: {'model_type': 'xgb', 'n_estimators': 157, 'max_depth': 3, 'learning_rate': 0.05463883764880935}. Best is trial 32 with value: 0.7707120068494318.
[I 2025-08-20 00:18:21,820] Trial 48 finished with value: 0.7381958478396821 and parameters: {'model_type': 'xgb', 'n_estimators': 142, 'max_depth': 3, 'learning_rate': 0.19149164830218565}. Best is trial 32 with value: 0.7707120068494318.
[I 2025-08-20 00:18:21,923] Trial 49 finished with value: 0.5240651953058388 and parameters: {'model_type': 'lgbm', 'n_estimators': 131, 'max_depth': 4, 'learning_rate': 0.21983503864933257}. Best is trial 32 with value: 0.7707120068494318.
Regression Results:
  Train R²: 0.934
  Test R²: 0.771
  CV R²: 0.397 ± 0.200
Saved comparison to results/rxn_feature_comparison_hte_each_8_optuna.json

==================================================
ANALYSIS COMPLETE
==================================================
Check the following directories for outputs:
  - plots/: Visualization files
  - results/: Data files and reports
  - models/: Trained model files
