=== ML Measurable HTE Rate Bias Analysis ===

==================================================
Running HTE Prediction Analysis: each with 8 features
==================================================

=== Loading Data ===
Number of HTE rates: 1031
Found 5 hydrogen-dependent features: ['num_Hs', 'BV_Hs_avg', 'Charges_Hs_avg', 'fukui_E_Hs_avg', 'fukui_N_Hs_avg']
Found 2 pKa-dependent features: ['pka_aHs', 'pka_lowest']
Found 26 heteroatom-dependent features: ['BV_main_1', 'Charges_main_atom', 'fukui_E_main_atom', 'fukui_N_main_atom', 'L_main_atom_1', 'L_main_atom_2', 'B1_main_atom_1', 'B1_main_atom_2', 'B5_main_atom_1', 'B5_main_atom_2', 'Charges_secondary_1', 'Charges_secondary_2', 'fukui_N_secondary_1', 'fukui_N_secondary_2', 'Charges_secondary_avg', 'fukui_N_secondary_avg', 'FCS_1', 'FREQS_1', 'FCS_2', 'FREQS_2', 'FCS_avg', 'FREQS_avg', 'BV_Hs_avg', 'Charges_Hs_avg', 'fukui_E_Hs_avg', 'fukui_N_Hs_avg']

Processing num_Hs conditional features...
  18/46 molecules meet condition num_Hs
    num_Hs: 0 -> 0 NA values
    BV_Hs_avg: 28 -> 0 NA values
    Charges_Hs_avg: 28 -> 0 NA values
    fukui_E_Hs_avg: 28 -> 0 NA values
    fukui_N_Hs_avg: 28 -> 0 NA values

Processing pKa_features conditional features...
  18/46 molecules meet condition pKa_features
    Processing pKa feature pka_aHs with special handling...
      Created indicator: has_acidic_H_for_pka_aHs
      Created interaction: pka_aHs_x_has_acidic_H
      Used 50.0 for molecules without acidic H
    pka_aHs: 28 -> 0 NA values
    Processing pKa feature pka_lowest with special handling...
      Created indicator: has_acidic_H_for_pka_lowest
      Created interaction: pka_lowest_x_has_acidic_H
      Used 50.0 for molecules without acidic H
    pka_lowest: 38 -> 0 NA values

Handling remaining NA values...

Encoding categorical features...
  Removed identifier feature: name
  Found categorical feature class with 4 unique values: ['aromatic' 'hetero' 'aliphatic' 'mixture']
    One-hot encoded class -> 4 features: ['class_aliphatic', 'class_aromatic', 'class_hetero', 'class_mixture']
  Removed identifier feature: smiles
  Processed 1 categorical features
  Removed 2 identifier features: ['name', 'smiles']

Creating feature quality indicators...
  Added indicator: has_num_Hs
  Added indicator: has_pKa_features
Preprocessing complete. Shape: (46, 65)
Remaining NA values: 0
Found 1 pKa-dependent features: ['pka_basic']
Warning: num_Hs column not found, cannot properly handle pKa features
Found 15 heteroatom-dependent features: ['BV_main_1', 'Charges_main_atom', 'fukui_E_main_atom', 'fukui_N_main_atom', 'L_main_atom_1', 'B1_main_atom_1', 'B5_main_atom_1', 'Charges_secondary_1', 'fukui_N_secondary_1', 'Charges_secondary_avg', 'fukui_N_secondary_avg', 'FCS_1', 'FREQS_1', 'FCS_avg', 'FREQS_avg']

Handling remaining NA values...
  pka_basic: Filled 1 NA values with median/zero
  smiles: Filled 1 NA values with mode/unknown
  class: Filled 1 NA values with mode/unknown

Encoding categorical features...
  Removed identifier feature: name
  Removed identifier feature: smiles
  Found categorical feature class with 5 unique values: ['1_aliphatic' '1_aromatic' '2_aliphatic' '1_mixture' '2_mixture']
    One-hot encoded class -> 5 features: ['class_1_aliphatic', 'class_1_aromatic', 'class_1_mixture', 'class_2_aliphatic', 'class_2_mixture']
  Processed 1 categorical features
  Removed 2 identifier features: ['name', 'smiles']

Creating feature quality indicators...
Preprocessing complete. Shape: (55, 40)
Remaining NA values: 0
Loaded reaction energy features: 1488 rows, 8 features

=== Selecting Features (selected) ===
Final selected features (8): ['acyl_pka_aHs_x_has_acidic_H', 'acyl_BV_secondary_2', 'amine_pka_basic', 'acyl_Charges_secondary_1', 'amine_class_1_mixture', 'amine_BV_secondary_avg', 'acyl_class_aromatic', 'amine_Charges_secondary_1']
=== Building HTE Prediction Models with 8 features ===
Selected features: ['acyl_pka_aHs_x_has_acidic_H', 'acyl_BV_secondary_2', 'amine_pka_basic', 'acyl_Charges_secondary_1', 'amine_class_1_mixture', 'amine_BV_secondary_avg', 'acyl_class_aromatic', 'amine_Charges_secondary_1']
Valid features: 17
=== Building Regression Model ===
Regression dataset: (1031, 17)
Target range: -1.418 to 4.010


Training data: 619 samples
Test data: 206 samples


SFS (regression) failed, using provided features. Error: n_features_to_select must be < n_features.
Running hyperparameter optimization for regression...
[I 2025-08-20 00:17:27,141] A new study created in memory with name: no-name-18c18027-398f-4d5a-a837-35f80d74b237
[I 2025-08-20 00:17:27,475] Trial 0 finished with value: 0.6221612109323881 and parameters: {'model_type': 'rf', 'n_estimators': 162, 'max_depth': 5, 'min_samples_split': 6}. Best is trial 0 with value: 0.6221612109323881.
[I 2025-08-20 00:17:27,880] Trial 1 finished with value: 0.6478442756997357 and parameters: {'model_type': 'rf', 'n_estimators': 158, 'max_depth': 6, 'min_samples_split': 3}. Best is trial 1 with value: 0.6478442756997357.
[I 2025-08-20 00:17:27,883] Trial 2 finished with value: 0.5120678408572852 and parameters: {'model_type': 'bayesian_ridge', 'alpha_1': 0.0008023013095736788, 'alpha_2': 3.292756918272802e-06, 'lambda_1': 7.991039390593544e-05, 'lambda_2': 7.297028355556999e-05}. Best is trial 1 with value: 0.6478442756997357.
[I 2025-08-20 00:17:28,192] Trial 3 finished with value: 0.6924209584701435 and parameters: {'model_type': 'rf', 'n_estimators': 88, 'max_depth': 15, 'min_samples_split': 3}. Best is trial 3 with value: 0.6924209584701435.
[I 2025-08-20 00:17:28,675] Trial 4 finished with value: 0.679910736269765 and parameters: {'model_type': 'lgbm', 'n_estimators': 177, 'max_depth': 10, 'learning_rate': 0.12800041364624404}. Best is trial 3 with value: 0.6924209584701435.
[I 2025-08-20 00:17:28,678] Trial 5 finished with value: 0.512067135047253 and parameters: {'model_type': 'bayesian_ridge', 'alpha_1': 0.000958120510399916, 'alpha_2': 0.000557449526740544, 'lambda_1': 2.817754607488579e-05, 'lambda_2': 0.00013934254855878036}. Best is trial 3 with value: 0.6924209584701435.
[I 2025-08-20 00:17:28,981] Trial 6 finished with value: 0.6787415240121814 and parameters: {'model_type': 'rf', 'n_estimators': 108, 'max_depth': 9, 'min_samples_split': 10}. Best is trial 3 with value: 0.6924209584701435.
[I 2025-08-20 00:17:28,983] Trial 7 finished with value: 0.5120618827306966 and parameters: {'model_type': 'bayesian_ridge', 'alpha_1': 0.0003830628570102609, 'alpha_2': 0.00025016489668277717, 'lambda_1': 0.0006810334754397289, 'lambda_2': 0.0006571116756618343}. Best is trial 3 with value: 0.6924209584701435.
[I 2025-08-20 00:17:29,287] Trial 8 finished with value: 0.7014396182741525 and parameters: {'model_type': 'lgbm', 'n_estimators': 135, 'max_depth': 10, 'learning_rate': 0.24394176110889643}. Best is trial 8 with value: 0.7014396182741525.
[I 2025-08-20 00:17:29,953] Trial 9 finished with value: 0.6952794467694404 and parameters: {'model_type': 'xgb', 'n_estimators': 121, 'max_depth': 4, 'learning_rate': 0.20011070921744054}. Best is trial 8 with value: 0.7014396182741525.
[I 2025-08-20 00:17:30,126] Trial 10 finished with value: 0.6760905768688892 and parameters: {'model_type': 'lgbm', 'n_estimators': 72, 'max_depth': 10, 'learning_rate': 0.291045324088221}. Best is trial 8 with value: 0.7014396182741525.
[I 2025-08-20 00:17:30,351] Trial 11 finished with value: 0.71423832308001 and parameters: {'model_type': 'xgb', 'n_estimators': 130, 'max_depth': 3, 'learning_rate': 0.23726075273626546}. Best is trial 11 with value: 0.71423832308001.
[I 2025-08-20 00:17:30,609] Trial 12 finished with value: 0.7264771600835187 and parameters: {'model_type': 'xgb', 'n_estimators': 139, 'max_depth': 3, 'learning_rate': 0.25255988883908437}. Best is trial 12 with value: 0.7264771600835187.
[I 2025-08-20 00:17:30,827] Trial 13 finished with value: 0.5985530232531375 and parameters: {'model_type': 'xgb', 'n_estimators': 138, 'max_depth': 3, 'learning_rate': 0.015299983916289672}. Best is trial 12 with value: 0.7264771600835187.
[I 2025-08-20 00:17:31,126] Trial 14 finished with value: 0.7232689478468184 and parameters: {'model_type': 'xgb', 'n_estimators': 199, 'max_depth': 3, 'learning_rate': 0.18288285814837277}. Best is trial 12 with value: 0.7264771600835187.
[I 2025-08-20 00:17:31,560] Trial 15 finished with value: 0.702620865000586 and parameters: {'model_type': 'xgb', 'n_estimators': 200, 'max_depth': 4, 'learning_rate': 0.13883026802739945}. Best is trial 12 with value: 0.7264771600835187.
[I 2025-08-20 00:17:32,292] Trial 16 finished with value: 0.6476797368092234 and parameters: {'model_type': 'xgb', 'n_estimators': 194, 'max_depth': 7, 'learning_rate': 0.19269466265174998}. Best is trial 12 with value: 0.7264771600835187.
[I 2025-08-20 00:17:32,388] Trial 17 finished with value: 0.6920865006528318 and parameters: {'model_type': 'xgb', 'n_estimators': 52, 'max_depth': 3, 'learning_rate': 0.08820924336104354}. Best is trial 12 with value: 0.7264771600835187.
[I 2025-08-20 00:17:32,963] Trial 18 finished with value: 0.6771424521047807 and parameters: {'model_type': 'xgb', 'n_estimators': 161, 'max_depth': 5, 'learning_rate': 0.2922255054698974}. Best is trial 12 with value: 0.7264771600835187.
[I 2025-08-20 00:17:33,399] Trial 19 finished with value: 0.7203251329284556 and parameters: {'model_type': 'xgb', 'n_estimators': 181, 'max_depth': 4, 'learning_rate': 0.19137137769596427}. Best is trial 12 with value: 0.7264771600835187.
[I 2025-08-20 00:17:33,951] Trial 20 finished with value: 0.6666922969067428 and parameters: {'model_type': 'xgb', 'n_estimators': 101, 'max_depth': 7, 'learning_rate': 0.24229054921500845}. Best is trial 12 with value: 0.7264771600835187.
[I 2025-08-20 00:17:34,354] Trial 21 finished with value: 0.6966066258482291 and parameters: {'model_type': 'xgb', 'n_estimators': 183, 'max_depth': 4, 'learning_rate': 0.18465915411807057}. Best is trial 12 with value: 0.7264771600835187.
[I 2025-08-20 00:17:34,647] Trial 22 finished with value: 0.6941112923167708 and parameters: {'model_type': 'xgb', 'n_estimators': 177, 'max_depth': 3, 'learning_rate': 0.17089986080090067}. Best is trial 12 with value: 0.7264771600835187.
[I 2025-08-20 00:17:35,146] Trial 23 finished with value: 0.6692121153775835 and parameters: {'model_type': 'xgb', 'n_estimators': 150, 'max_depth': 5, 'learning_rate': 0.22945241326488175}. Best is trial 12 with value: 0.7264771600835187.
[I 2025-08-20 00:17:35,556] Trial 24 finished with value: 0.7120894404948612 and parameters: {'model_type': 'xgb', 'n_estimators': 187, 'max_depth': 4, 'learning_rate': 0.09764047241931353}. Best is trial 12 with value: 0.7264771600835187.
[I 2025-08-20 00:17:35,825] Trial 25 finished with value: 0.702255451235617 and parameters: {'model_type': 'xgb', 'n_estimators': 175, 'max_depth': 3, 'learning_rate': 0.21455071393092923}. Best is trial 12 with value: 0.7264771600835187.
[I 2025-08-20 00:17:36,255] Trial 26 finished with value: 0.6834595244177432 and parameters: {'model_type': 'xgb', 'n_estimators': 200, 'max_depth': 4, 'learning_rate': 0.2757355229009658}. Best is trial 12 with value: 0.7264771600835187.
[I 2025-08-20 00:17:36,467] Trial 27 finished with value: 0.7028479191377732 and parameters: {'model_type': 'lgbm', 'n_estimators': 145, 'max_depth': 6, 'learning_rate': 0.15005956849073085}. Best is trial 12 with value: 0.7264771600835187.
[I 2025-08-20 00:17:36,478] Trial 28 finished with value: 0.5120589312309822 and parameters: {'model_type': 'bayesian_ridge', 'alpha_1': 5.822578750006561e-05, 'alpha_2': 0.0008393748854214336, 'lambda_1': 0.0009985630682628859, 'lambda_2': 0.0009485183262201551}. Best is trial 12 with value: 0.7264771600835187.
[I 2025-08-20 00:17:36,936] Trial 29 finished with value: 0.6712716179554259 and parameters: {'model_type': 'rf', 'n_estimators': 167, 'max_depth': 8, 'min_samples_split': 10}. Best is trial 12 with value: 0.7264771600835187.
[I 2025-08-20 00:17:37,548] Trial 30 finished with value: 0.6769429653658094 and parameters: {'model_type': 'xgb', 'n_estimators': 188, 'max_depth': 5, 'learning_rate': 0.2634490707877352}. Best is trial 12 with value: 0.7264771600835187.
[I 2025-08-20 00:17:37,853] Trial 31 finished with value: 0.6959162276992281 and parameters: {'model_type': 'xgb', 'n_estimators': 126, 'max_depth': 3, 'learning_rate': 0.2255310183769746}. Best is trial 12 with value: 0.7264771600835187.
[I 2025-08-20 00:17:38,033] Trial 32 finished with value: 0.691100639934662 and parameters: {'model_type': 'xgb', 'n_estimators': 130, 'max_depth': 3, 'learning_rate': 0.260299523515573}. Best is trial 12 with value: 0.7264771600835187.
[I 2025-08-20 00:17:38,359] Trial 33 finished with value: 0.7313242813421914 and parameters: {'model_type': 'xgb', 'n_estimators': 121, 'max_depth': 4, 'learning_rate': 0.17153933950766087}. Best is trial 33 with value: 0.7313242813421914.
[I 2025-08-20 00:17:38,724] Trial 34 finished with value: 0.6886768951633657 and parameters: {'model_type': 'rf', 'n_estimators': 112, 'max_depth': 13, 'min_samples_split': 7}. Best is trial 33 with value: 0.7313242813421914.
[I 2025-08-20 00:17:38,899] Trial 35 finished with value: 0.7307401377962037 and parameters: {'model_type': 'xgb', 'n_estimators': 93, 'max_depth': 4, 'learning_rate': 0.16601507613536653}. Best is trial 33 with value: 0.7313242813421914.
[I 2025-08-20 00:17:38,910] Trial 36 finished with value: 0.5120637908542351 and parameters: {'model_type': 'bayesian_ridge', 'alpha_1': 0.0005022424760373882, 'alpha_2': 0.000982164497390394, 'lambda_1': 0.00041146340371233064, 'lambda_2': 0.0004689664870040057}. Best is trial 33 with value: 0.7313242813421914.
[I 2025-08-20 00:17:39,249] Trial 37 finished with value: 0.6948218474104901 and parameters: {'model_type': 'xgb', 'n_estimators': 85, 'max_depth': 5, 'learning_rate': 0.11092249039267812}. Best is trial 33 with value: 0.7313242813421914.
[I 2025-08-20 00:17:39,483] Trial 38 finished with value: 0.6525507664497094 and parameters: {'model_type': 'rf', 'n_estimators': 93, 'max_depth': 6, 'min_samples_split': 6}. Best is trial 33 with value: 0.7313242813421914.
[I 2025-08-20 00:17:39,559] Trial 39 finished with value: 0.7070889184659259 and parameters: {'model_type': 'lgbm', 'n_estimators': 72, 'max_depth': 4, 'learning_rate': 0.16495267055955093}. Best is trial 33 with value: 0.7313242813421914.
[I 2025-08-20 00:17:39,569] Trial 40 finished with value: 0.5120583066374976 and parameters: {'model_type': 'bayesian_ridge', 'alpha_1': 5.9365921732082503e-05, 'alpha_2': 0.0006243173906101373, 'lambda_1': 0.0004531569925938021, 'lambda_2': 0.000992606982005124}. Best is trial 33 with value: 0.7313242813421914.
[I 2025-08-20 00:17:41,668] Trial 41 finished with value: 0.7258554892277396 and parameters: {'model_type': 'xgb', 'n_estimators': 119, 'max_depth': 4, 'learning_rate': 0.16643969811624484}. Best is trial 33 with value: 0.7313242813421914.
[I 2025-08-20 00:17:42,016] Trial 42 finished with value: 0.7133917914022025 and parameters: {'model_type': 'xgb', 'n_estimators': 113, 'max_depth': 4, 'learning_rate': 0.1648789461904707}. Best is trial 33 with value: 0.7313242813421914.
[I 2025-08-20 00:17:42,286] Trial 43 finished with value: 0.6984575101012818 and parameters: {'model_type': 'xgb', 'n_estimators': 119, 'max_depth': 5, 'learning_rate': 0.13260901663572894}. Best is trial 33 with value: 0.7313242813421914.
[I 2025-08-20 00:17:42,519] Trial 44 finished with value: 0.7197495515801259 and parameters: {'model_type': 'xgb', 'n_estimators': 152, 'max_depth': 3, 'learning_rate': 0.12140759524449574}. Best is trial 33 with value: 0.7313242813421914.
[I 2025-08-20 00:17:42,710] Trial 45 finished with value: 0.6967062809391988 and parameters: {'model_type': 'xgb', 'n_estimators': 99, 'max_depth': 4, 'learning_rate': 0.14665821940409943}. Best is trial 33 with value: 0.7313242813421914.
[I 2025-08-20 00:17:42,921] Trial 46 finished with value: 0.6902188904574327 and parameters: {'model_type': 'xgb', 'n_estimators': 81, 'max_depth': 3, 'learning_rate': 0.2127770890967196}. Best is trial 33 with value: 0.7313242813421914.
[I 2025-08-20 00:17:43,064] Trial 47 finished with value: 0.6790681695852798 and parameters: {'model_type': 'lgbm', 'n_estimators': 105, 'max_depth': 5, 'learning_rate': 0.1820317344467858}. Best is trial 33 with value: 0.7313242813421914.
[I 2025-08-20 00:17:43,376] Trial 48 finished with value: 0.7076200557336617 and parameters: {'model_type': 'xgb', 'n_estimators': 52, 'max_depth': 4, 'learning_rate': 0.07876738112001763}. Best is trial 33 with value: 0.7313242813421914.
[I 2025-08-20 00:17:43,909] Trial 49 finished with value: 0.6913646758548597 and parameters: {'model_type': 'rf', 'n_estimators': 140, 'max_depth': 15, 'min_samples_split': 2}. Best is trial 33 with value: 0.7313242813421914.
Regression Results:
  Train R²: 0.982
  Test R²: 0.731
  CV R²: 0.416 ± 0.180

=== Generating Visualizations ===
=== Evaluating XGBoost with Parity Plots ===
Model Performance:
  Train R²: 0.982, MAE: 0.092, RMSE: 0.126
  Test R²: 0.731, MAE: 0.335, RMSE: 0.469
Generating parity plots...
Parity plot saved as: plots/parity_plot_xgboost_train_each_8_optuna_train.png
Parity plot saved as: plots/parity_plot_xgboost_test_each_8_optuna_test.png
Parity analysis plot saved as: plots/parity_analysis_xgboost_test_each_8_optuna_analysis.png
HTE prediction evaluation report saved to results/reports/hte_prediction_report_manual_8_each_8_optuna.txt

=== Comparing without reaction-energy features (HTE prediction) ===
=== Building HTE Prediction Models with 8 features ===
Selected features: ['acyl_pka_aHs_x_has_acidic_H', 'acyl_BV_secondary_2', 'amine_pka_basic', 'acyl_Charges_secondary_1', 'amine_class_1_mixture', 'amine_BV_secondary_avg', 'acyl_class_aromatic', 'amine_Charges_secondary_1']
Valid features: 9
=== Building Regression Model ===
Regression dataset: (1031, 9)
Target range: -1.418 to 4.010


Training data: 619 samples
Test data: 206 samples


SFS (regression) failed, using provided features. Error: n_features_to_select must be < n_features.
Running hyperparameter optimization for regression...
[I 2025-08-20 00:17:47,478] A new study created in memory with name: no-name-e70efa36-a70d-436d-98e6-6592924c4fea
[I 2025-08-20 00:17:47,733] Trial 0 finished with value: 0.7438661090486205 and parameters: {'model_type': 'xgb', 'n_estimators': 108, 'max_depth': 6, 'learning_rate': 0.0646148379681222}. Best is trial 0 with value: 0.7438661090486205.
[I 2025-08-20 00:17:48,115] Trial 1 finished with value: 0.773128431935726 and parameters: {'model_type': 'xgb', 'n_estimators': 187, 'max_depth': 4, 'learning_rate': 0.2638953239096511}. Best is trial 1 with value: 0.773128431935726.
[I 2025-08-20 00:17:48,205] Trial 2 finished with value: 0.6792294557851535 and parameters: {'model_type': 'rf', 'n_estimators': 53, 'max_depth': 9, 'min_samples_split': 2}. Best is trial 1 with value: 0.773128431935726.
[I 2025-08-20 00:17:48,327] Trial 3 finished with value: 0.7565928266777329 and parameters: {'model_type': 'lgbm', 'n_estimators': 80, 'max_depth': 8, 'learning_rate': 0.07253892151250027}. Best is trial 1 with value: 0.773128431935726.
[I 2025-08-20 00:17:48,552] Trial 4 finished with value: 0.658724374760854 and parameters: {'model_type': 'rf', 'n_estimators': 182, 'max_depth': 6, 'min_samples_split': 10}. Best is trial 1 with value: 0.773128431935726.
[I 2025-08-20 00:17:48,648] Trial 5 finished with value: 0.4959569364237636 and parameters: {'model_type': 'rf', 'n_estimators': 105, 'max_depth': 3, 'min_samples_split': 5}. Best is trial 1 with value: 0.773128431935726.
[I 2025-08-20 00:17:48,751] Trial 6 finished with value: 0.7628321225111752 and parameters: {'model_type': 'lgbm', 'n_estimators': 98, 'max_depth': 5, 'learning_rate': 0.07879091966502619}. Best is trial 1 with value: 0.773128431935726.
[I 2025-08-20 00:17:48,924] Trial 7 finished with value: 0.7082794972760866 and parameters: {'model_type': 'rf', 'n_estimators': 106, 'max_depth': 14, 'min_samples_split': 6}. Best is trial 1 with value: 0.773128431935726.
[I 2025-08-20 00:17:49,434] Trial 8 finished with value: 0.7599236387477692 and parameters: {'model_type': 'xgb', 'n_estimators': 114, 'max_depth': 6, 'learning_rate': 0.09176242884609324}. Best is trial 1 with value: 0.773128431935726.
[I 2025-08-20 00:17:49,640] Trial 9 finished with value: 0.6568696636883579 and parameters: {'model_type': 'rf', 'n_estimators': 162, 'max_depth': 6, 'min_samples_split': 4}. Best is trial 1 with value: 0.773128431935726.
[I 2025-08-20 00:17:49,650] Trial 10 finished with value: 0.3937362119377915 and parameters: {'model_type': 'bayesian_ridge', 'alpha_1': 0.00040781170486488315, 'alpha_2': 0.000127946788321586, 'lambda_1': 0.00013654366102014653, 'lambda_2': 0.00018791891460578697}. Best is trial 1 with value: 0.773128431935726.
[I 2025-08-20 00:17:49,736] Trial 11 finished with value: 0.7807355733635538 and parameters: {'model_type': 'lgbm', 'n_estimators': 157, 'max_depth': 3, 'learning_rate': 0.29613681880693027}. Best is trial 11 with value: 0.7807355733635538.
[I 2025-08-20 00:17:49,815] Trial 12 finished with value: 0.7988942792253109 and parameters: {'model_type': 'lgbm', 'n_estimators': 152, 'max_depth': 3, 'learning_rate': 0.28616203041026705}. Best is trial 12 with value: 0.7988942792253109.
[I 2025-08-20 00:17:49,896] Trial 13 finished with value: 0.7840387510961293 and parameters: {'model_type': 'lgbm', 'n_estimators': 149, 'max_depth': 3, 'learning_rate': 0.2856255708384945}. Best is trial 12 with value: 0.7988942792253109.
[I 2025-08-20 00:17:50,005] Trial 14 finished with value: 0.7876916221994337 and parameters: {'model_type': 'lgbm', 'n_estimators': 143, 'max_depth': 4, 'learning_rate': 0.21512546028807317}. Best is trial 12 with value: 0.7988942792253109.
