=== ML Measurable HTE Rate Bias Analysis ===

==================================================
Running HTE Prediction Analysis: each with 8 features
==================================================

=== Loading Data ===
Number of HTE rates: 1031
Found 5 hydrogen-dependent features: ['num_Hs', 'BV_Hs_avg', 'Charges_Hs_avg', 'fukui_E_Hs_avg', 'fukui_N_Hs_avg']
Found 2 pKa-dependent features: ['pka_aHs', 'pka_lowest']
Found 26 heteroatom-dependent features: ['BV_main_1', 'Charges_main_atom', 'fukui_E_main_atom', 'fukui_N_main_atom', 'L_main_atom_1', 'L_main_atom_2', 'B1_main_atom_1', 'B1_main_atom_2', 'B5_main_atom_1', 'B5_main_atom_2', 'Charges_secondary_1', 'Charges_secondary_2', 'fukui_N_secondary_1', 'fukui_N_secondary_2', 'Charges_secondary_avg', 'fukui_N_secondary_avg', 'FCS_1', 'FREQS_1', 'FCS_2', 'FREQS_2', 'FCS_avg', 'FREQS_avg', 'BV_Hs_avg', 'Charges_Hs_avg', 'fukui_E_Hs_avg', 'fukui_N_Hs_avg']

Processing num_Hs conditional features...
  18/46 molecules meet condition num_Hs
    num_Hs: 0 -> 0 NA values
    BV_Hs_avg: 28 -> 0 NA values
    Charges_Hs_avg: 28 -> 0 NA values
    fukui_E_Hs_avg: 28 -> 0 NA values
    fukui_N_Hs_avg: 28 -> 0 NA values

Processing pKa_features conditional features...
  18/46 molecules meet condition pKa_features
    Processing pKa feature pka_aHs with special handling...
      Created indicator: has_acidic_H_for_pka_aHs
      Created interaction: pka_aHs_x_has_acidic_H
      Used 50.0 for molecules without acidic H
    pka_aHs: 28 -> 0 NA values
    Processing pKa feature pka_lowest with special handling...
      Created indicator: has_acidic_H_for_pka_lowest
      Created interaction: pka_lowest_x_has_acidic_H
      Used 50.0 for molecules without acidic H
    pka_lowest: 38 -> 0 NA values

Handling remaining NA values...

Encoding categorical features...
  Removed identifier feature: name
  Found categorical feature class with 4 unique values: ['aromatic' 'hetero' 'aliphatic' 'mixture']
    One-hot encoded class -> 4 features: ['class_aliphatic', 'class_aromatic', 'class_hetero', 'class_mixture']
  Removed identifier feature: smiles
  Processed 1 categorical features
  Removed 2 identifier features: ['name', 'smiles']

Creating feature quality indicators...
  Added indicator: has_num_Hs
  Added indicator: has_pKa_features
Preprocessing complete. Shape: (46, 65)
Remaining NA values: 0
Found 1 pKa-dependent features: ['pka_basic']
Warning: num_Hs column not found, cannot properly handle pKa features
Found 15 heteroatom-dependent features: ['BV_main_1', 'Charges_main_atom', 'fukui_E_main_atom', 'fukui_N_main_atom', 'L_main_atom_1', 'B1_main_atom_1', 'B5_main_atom_1', 'Charges_secondary_1', 'fukui_N_secondary_1', 'Charges_secondary_avg', 'fukui_N_secondary_avg', 'FCS_1', 'FREQS_1', 'FCS_avg', 'FREQS_avg']

Handling remaining NA values...
  pka_basic: Filled 1 NA values with median/zero
  smiles: Filled 1 NA values with mode/unknown
  class: Filled 1 NA values with mode/unknown

Encoding categorical features...
  Removed identifier feature: name
  Removed identifier feature: smiles
  Found categorical feature class with 5 unique values: ['1_aliphatic' '1_aromatic' '2_aliphatic' '1_mixture' '2_mixture']
    One-hot encoded class -> 5 features: ['class_1_aliphatic', 'class_1_aromatic', 'class_1_mixture', 'class_2_aliphatic', 'class_2_mixture']
  Processed 1 categorical features
  Removed 2 identifier features: ['name', 'smiles']

Creating feature quality indicators...
Preprocessing complete. Shape: (55, 40)
Remaining NA values: 0
Loaded reaction energy features: 1488 rows, 8 features

=== Selecting Features (selected) ===
Final selected features (8): ['amine_BV_secondary_avg', 'amine_pka_basic', 'acyl_Charges_secondary_1', 'acyl_class_aromatic', 'acyl_BV_secondary_2', 'amine_Charges_secondary_1', 'acyl_pka_aHs_x_has_acidic_H', 'amine_class_1_mixture']
=== Building HTE Prediction Models with 8 features ===
Selected features: ['amine_BV_secondary_avg', 'amine_pka_basic', 'acyl_Charges_secondary_1', 'acyl_class_aromatic', 'acyl_BV_secondary_2', 'amine_Charges_secondary_1', 'acyl_pka_aHs_x_has_acidic_H', 'amine_class_1_mixture']
Valid features: 17
=== Building Regression Model ===
Regression dataset: (1031, 17)
Target range: -1.418 to 4.010


Training data: 557 samples
Test data: 215 samples


SFS (regression) failed, using provided features. Error: n_features_to_select must be < n_features.
Running hyperparameter optimization for regression...
[I 2025-08-20 00:13:40,032] A new study created in memory with name: no-name-82851184-d892-4551-81e8-350434f6627d
[I 2025-08-20 00:13:40,198] Trial 0 finished with value: 0.36105074611136556 and parameters: {'model_type': 'rf', 'n_estimators': 76, 'max_depth': 6, 'min_samples_split': 2}. Best is trial 0 with value: 0.36105074611136556.
[I 2025-08-20 00:13:40,331] Trial 1 finished with value: 0.32760109831955786 and parameters: {'model_type': 'rf', 'n_estimators': 57, 'max_depth': 7, 'min_samples_split': 4}. Best is trial 0 with value: 0.36105074611136556.
[I 2025-08-20 00:13:40,983] Trial 2 finished with value: 0.38412673636126915 and parameters: {'model_type': 'rf', 'n_estimators': 200, 'max_depth': 11, 'min_samples_split': 2}. Best is trial 2 with value: 0.38412673636126915.
[I 2025-08-20 00:13:41,643] Trial 3 finished with value: 0.0833116361807672 and parameters: {'model_type': 'xgb', 'n_estimators': 68, 'max_depth': 9, 'learning_rate': 0.2819747591082431}. Best is trial 2 with value: 0.38412673636126915.
[I 2025-08-20 00:13:41,647] Trial 4 finished with value: -268.8458965708281 and parameters: {'model_type': 'bayesian_ridge', 'alpha_1': 0.0006039147632774894, 'alpha_2': 0.0005349594568063541, 'lambda_1': 0.0003553230630625375, 'lambda_2': 0.0007598226516716113}. Best is trial 2 with value: 0.38412673636126915.
[I 2025-08-20 00:13:41,909] Trial 5 finished with value: 0.3582062364505151 and parameters: {'model_type': 'rf', 'n_estimators': 91, 'max_depth': 9, 'min_samples_split': 2}. Best is trial 2 with value: 0.38412673636126915.
[LightGBM] [Fatal] GPU Tree Learner was not enabled in this build.
Please recompile with CMake option -DUSE_GPU=1
[W 2025-08-20 00:13:41,955] Trial 6 failed with parameters: {'model_type': 'lgbm', 'n_estimators': 174, 'max_depth': 9, 'learning_rate': 0.07417704204398358} because of the following error: LightGBMError('GPU Tree Learner was not enabled in this build.\nPlease recompile with CMake option -DUSE_GPU=1').
Traceback (most recent call last):
  File "/home/passos/mambaforge/envs/hte-ml/lib/python3.10/site-packages/optuna/study/_optimize.py", line 201, in _run_trial
    value_or_values = func(trial)
  File "/home/passos/ml_measurable_hte_rates/src/model_building.py", line 742, in objective
    model.fit(X_train, y_train)
  File "/home/passos/mambaforge/envs/hte-ml/lib/python3.10/site-packages/lightgbm/sklearn.py", line 1398, in fit
    super().fit(
  File "/home/passos/mambaforge/envs/hte-ml/lib/python3.10/site-packages/lightgbm/sklearn.py", line 1049, in fit
    self._Booster = train(
  File "/home/passos/mambaforge/envs/hte-ml/lib/python3.10/site-packages/lightgbm/engine.py", line 297, in train
    booster = Booster(params=params, train_set=train_set)
  File "/home/passos/mambaforge/envs/hte-ml/lib/python3.10/site-packages/lightgbm/basic.py", line 3660, in __init__
    _safe_call(
  File "/home/passos/mambaforge/envs/hte-ml/lib/python3.10/site-packages/lightgbm/basic.py", line 313, in _safe_call
    raise LightGBMError(_LIB.LGBM_GetLastError().decode("utf-8"))
lightgbm.basic.LightGBMError: GPU Tree Learner was not enabled in this build.
Please recompile with CMake option -DUSE_GPU=1
[W 2025-08-20 00:13:41,957] Trial 6 failed with value None.
Traceback (most recent call last):
  File "/home/passos/ml_measurable_hte_rates/run_analysis.py", line 716, in <module>
    main() 
  File "/home/passos/ml_measurable_hte_rates/run_analysis.py", line 696, in main
    results = run_single_hte_prediction_analysis(config)
  File "/home/passos/ml_measurable_hte_rates/run_analysis.py", line 378, in run_single_hte_prediction_analysis
    model_results = build_hte_prediction_models(
  File "/home/passos/ml_measurable_hte_rates/src/model_building.py", line 624, in build_hte_prediction_models
    regressor, scaler_reg, reg_results = build_regression_model(
  File "/home/passos/ml_measurable_hte_rates/src/model_building.py", line 359, in build_regression_model
    best_model, best_model_name = optuna_regression_optimization(
  File "/home/passos/ml_measurable_hte_rates/src/model_building.py", line 747, in optuna_regression_optimization
    study.optimize(objective, n_trials=n_trials, show_progress_bar=False)
  File "/home/passos/mambaforge/envs/hte-ml/lib/python3.10/site-packages/optuna/study/study.py", line 489, in optimize
    _optimize(
  File "/home/passos/mambaforge/envs/hte-ml/lib/python3.10/site-packages/optuna/study/_optimize.py", line 64, in _optimize
    _optimize_sequential(
  File "/home/passos/mambaforge/envs/hte-ml/lib/python3.10/site-packages/optuna/study/_optimize.py", line 161, in _optimize_sequential
    frozen_trial = _run_trial(study, func, catch)
  File "/home/passos/mambaforge/envs/hte-ml/lib/python3.10/site-packages/optuna/study/_optimize.py", line 253, in _run_trial
    raise func_err
  File "/home/passos/mambaforge/envs/hte-ml/lib/python3.10/site-packages/optuna/study/_optimize.py", line 201, in _run_trial
    value_or_values = func(trial)
  File "/home/passos/ml_measurable_hte_rates/src/model_building.py", line 742, in objective
    model.fit(X_train, y_train)
  File "/home/passos/mambaforge/envs/hte-ml/lib/python3.10/site-packages/lightgbm/sklearn.py", line 1398, in fit
    super().fit(
  File "/home/passos/mambaforge/envs/hte-ml/lib/python3.10/site-packages/lightgbm/sklearn.py", line 1049, in fit
    self._Booster = train(
  File "/home/passos/mambaforge/envs/hte-ml/lib/python3.10/site-packages/lightgbm/engine.py", line 297, in train
    booster = Booster(params=params, train_set=train_set)
  File "/home/passos/mambaforge/envs/hte-ml/lib/python3.10/site-packages/lightgbm/basic.py", line 3660, in __init__
    _safe_call(
  File "/home/passos/mambaforge/envs/hte-ml/lib/python3.10/site-packages/lightgbm/basic.py", line 313, in _safe_call
    raise LightGBMError(_LIB.LGBM_GetLastError().decode("utf-8"))
lightgbm.basic.LightGBMError: GPU Tree Learner was not enabled in this build.
Please recompile with CMake option -DUSE_GPU=1
