[I 2025-08-20 00:17:03,164] Trial 14 finished with value: 0.6689144175926589 and parameters: {'model_type': 'lgbm', 'n_estimators': 143, 'max_depth': 6, 'learning_rate': 0.011814452254621549}. Best is trial 12 with value: 0.7847146728654509.
[I 2025-08-20 00:17:03,391] Trial 15 finished with value: 0.7289800828163802 and parameters: {'model_type': 'rf', 'n_estimators': 116, 'max_depth': 14, 'min_samples_split': 2}. Best is trial 12 with value: 0.7847146728654509.
[I 2025-08-20 00:17:03,656] Trial 16 finished with value: 0.7707672240178696 and parameters: {'model_type': 'lgbm', 'n_estimators': 199, 'max_depth': 7, 'learning_rate': 0.09758360078358705}. Best is trial 12 with value: 0.7847146728654509.
[I 2025-08-20 00:17:03,815] Trial 17 finished with value: 0.7805538596070235 and parameters: {'model_type': 'lgbm', 'n_estimators': 155, 'max_depth': 5, 'learning_rate': 0.12465398755421117}. Best is trial 12 with value: 0.7847146728654509.
[I 2025-08-20 00:17:03,907] Trial 18 finished with value: 0.7703859807739272 and parameters: {'model_type': 'lgbm', 'n_estimators': 57, 'max_depth': 8, 'learning_rate': 0.29997386643749446}. Best is trial 12 with value: 0.7847146728654509.
[I 2025-08-20 00:17:04,987] Trial 19 finished with value: 0.7083962744662216 and parameters: {'model_type': 'xgb', 'n_estimators': 88, 'max_depth': 5, 'learning_rate': 0.21200655002307325}. Best is trial 12 with value: 0.7847146728654509.
[I 2025-08-20 00:17:05,203] Trial 20 finished with value: 0.7203859032043258 and parameters: {'model_type': 'rf', 'n_estimators': 142, 'max_depth': 9, 'min_samples_split': 10}. Best is trial 12 with value: 0.7847146728654509.
[I 2025-08-20 00:17:05,300] Trial 21 finished with value: 0.7742992974656024 and parameters: {'model_type': 'lgbm', 'n_estimators': 175, 'max_depth': 3, 'learning_rate': 0.06012251329108867}. Best is trial 12 with value: 0.7847146728654509.
[I 2025-08-20 00:17:05,494] Trial 22 finished with value: 0.7867408458866912 and parameters: {'model_type': 'lgbm', 'n_estimators': 199, 'max_depth': 5, 'learning_rate': 0.111569449574355}. Best is trial 22 with value: 0.7867408458866912.
[I 2025-08-20 00:17:05,684] Trial 23 finished with value: 0.7826750665388609 and parameters: {'model_type': 'lgbm', 'n_estimators': 196, 'max_depth': 5, 'learning_rate': 0.12156456752870556}. Best is trial 22 with value: 0.7867408458866912.
[I 2025-08-20 00:17:05,883] Trial 24 finished with value: 0.7775099630828526 and parameters: {'model_type': 'lgbm', 'n_estimators': 170, 'max_depth': 6, 'learning_rate': 0.12349546236497001}. Best is trial 22 with value: 0.7867408458866912.
[I 2025-08-20 00:17:05,984] Trial 25 finished with value: 0.7566574287928993 and parameters: {'model_type': 'lgbm', 'n_estimators': 102, 'max_depth': 4, 'learning_rate': 0.03761655989436205}. Best is trial 22 with value: 0.7867408458866912.
[I 2025-08-20 00:17:06,169] Trial 26 finished with value: 0.7844673761554798 and parameters: {'model_type': 'lgbm', 'n_estimators': 131, 'max_depth': 7, 'learning_rate': 0.10088331377857937}. Best is trial 22 with value: 0.7867408458866912.
[I 2025-08-20 00:17:06,472] Trial 27 finished with value: 0.7093431186577976 and parameters: {'model_type': 'lgbm', 'n_estimators': 164, 'max_depth': 8, 'learning_rate': 0.013111164873550823}. Best is trial 22 with value: 0.7867408458866912.
[I 2025-08-20 00:17:17,182] Trial 28 finished with value: 0.6899026801156449 and parameters: {'model_type': 'xgb', 'n_estimators': 188, 'max_depth': 7, 'learning_rate': 0.17940601701216297}. Best is trial 22 with value: 0.7867408458866912.
[I 2025-08-20 00:17:17,421] Trial 29 finished with value: 0.7286353497198415 and parameters: {'model_type': 'rf', 'n_estimators': 133, 'max_depth': 12, 'min_samples_split': 4}. Best is trial 22 with value: 0.7867408458866912.
[I 2025-08-20 00:17:17,663] Trial 30 finished with value: 0.7579708313213678 and parameters: {'model_type': 'xgb', 'n_estimators': 162, 'max_depth': 4, 'learning_rate': 0.08871648702296957}. Best is trial 22 with value: 0.7867408458866912.
[I 2025-08-20 00:17:17,811] Trial 31 finished with value: 0.7812884751918678 and parameters: {'model_type': 'lgbm', 'n_estimators': 116, 'max_depth': 6, 'learning_rate': 0.1125861264102168}. Best is trial 22 with value: 0.7867408458866912.
[I 2025-08-20 00:17:17,909] Trial 32 finished with value: 0.7807916690747361 and parameters: {'model_type': 'lgbm', 'n_estimators': 82, 'max_depth': 5, 'learning_rate': 0.058290093478410375}. Best is trial 22 with value: 0.7867408458866912.
[I 2025-08-20 00:17:18,051] Trial 33 finished with value: 0.7861060328819526 and parameters: {'model_type': 'lgbm', 'n_estimators': 102, 'max_depth': 7, 'learning_rate': 0.14348450964054194}. Best is trial 22 with value: 0.7867408458866912.
[I 2025-08-20 00:17:18,332] Trial 34 finished with value: 0.7699580003012924 and parameters: {'model_type': 'lgbm', 'n_estimators': 191, 'max_depth': 8, 'learning_rate': 0.1359581717168533}. Best is trial 22 with value: 0.7867408458866912.
[I 2025-08-20 00:17:18,439] Trial 35 finished with value: 0.7851294982385443 and parameters: {'model_type': 'lgbm', 'n_estimators': 73, 'max_depth': 7, 'learning_rate': 0.18296123240807827}. Best is trial 22 with value: 0.7867408458866912.
[I 2025-08-20 00:17:18,546] Trial 36 finished with value: 0.775685633274205 and parameters: {'model_type': 'lgbm', 'n_estimators': 69, 'max_depth': 8, 'learning_rate': 0.19138005126749483}. Best is trial 22 with value: 0.7867408458866912.
[I 2025-08-20 00:17:18,556] Trial 37 finished with value: 0.4575181018742035 and parameters: {'model_type': 'bayesian_ridge', 'alpha_1': 1.7524425571991916e-05, 'alpha_2': 0.0009513026272372647, 'lambda_1': 0.0009475819985629685, 'lambda_2': 0.00041236192881905436}. Best is trial 22 with value: 0.7867408458866912.
[I 2025-08-20 00:17:18,659] Trial 38 finished with value: 0.769147560378648 and parameters: {'model_type': 'lgbm', 'n_estimators': 72, 'max_depth': 7, 'learning_rate': 0.2475247784198821}. Best is trial 22 with value: 0.7867408458866912.
[I 2025-08-20 00:17:24,035] Trial 39 finished with value: 0.7337728909973793 and parameters: {'model_type': 'xgb', 'n_estimators': 52, 'max_depth': 5, 'learning_rate': 0.1771743171037069}. Best is trial 22 with value: 0.7867408458866912.
[I 2025-08-20 00:17:24,046] Trial 40 finished with value: 0.45751864826074196 and parameters: {'model_type': 'bayesian_ridge', 'alpha_1': 0.0009758457070075641, 'alpha_2': 0.0009519079581401071, 'lambda_1': 0.0003255482040106628, 'lambda_2': 0.0004192004987309655}. Best is trial 22 with value: 0.7867408458866912.
[I 2025-08-20 00:17:24,185] Trial 41 finished with value: 0.7740050610293656 and parameters: {'model_type': 'lgbm', 'n_estimators': 97, 'max_depth': 7, 'learning_rate': 0.13989489495675614}. Best is trial 22 with value: 0.7867408458866912.
[I 2025-08-20 00:17:24,439] Trial 42 finished with value: 0.7723557531608622 and parameters: {'model_type': 'lgbm', 'n_estimators': 182, 'max_depth': 7, 'learning_rate': 0.14649209033399824}. Best is trial 22 with value: 0.7867408458866912.
[I 2025-08-20 00:17:24,525] Trial 43 finished with value: 0.7793935596846827 and parameters: {'model_type': 'lgbm', 'n_estimators': 61, 'max_depth': 6, 'learning_rate': 0.15840975534225482}. Best is trial 22 with value: 0.7867408458866912.
[I 2025-08-20 00:17:24,630] Trial 44 finished with value: 0.7863722392089086 and parameters: {'model_type': 'lgbm', 'n_estimators': 76, 'max_depth': 6, 'learning_rate': 0.0993464582213173}. Best is trial 22 with value: 0.7867408458866912.
[I 2025-08-20 00:17:24,749] Trial 45 finished with value: 0.7730581864146064 and parameters: {'model_type': 'lgbm', 'n_estimators': 78, 'max_depth': 6, 'learning_rate': 0.0649166896340797}. Best is trial 22 with value: 0.7867408458866912.
[I 2025-08-20 00:17:24,875] Trial 46 finished with value: 0.7855812805353607 and parameters: {'model_type': 'lgbm', 'n_estimators': 96, 'max_depth': 6, 'learning_rate': 0.17114934604617055}. Best is trial 22 with value: 0.7867408458866912.
[I 2025-08-20 00:17:25,024] Trial 47 finished with value: 0.7256305991886428 and parameters: {'model_type': 'rf', 'n_estimators': 94, 'max_depth': 9, 'min_samples_split': 6}. Best is trial 22 with value: 0.7867408458866912.
[I 2025-08-20 00:17:25,114] Trial 48 finished with value: 0.7907876927975094 and parameters: {'model_type': 'lgbm', 'n_estimators': 80, 'max_depth': 5, 'learning_rate': 0.16906970422389136}. Best is trial 48 with value: 0.7907876927975094.
[I 2025-08-20 00:17:25,123] Trial 49 finished with value: 0.4575134953375931 and parameters: {'model_type': 'bayesian_ridge', 'alpha_1': 7.031634819569641e-06, 'alpha_2': 0.0004688135022887513, 'lambda_1': 0.0009110370308651132, 'lambda_2': 2.988275565661509e-05}. Best is trial 48 with value: 0.7907876927975094.
Regression Results:
  Train R²: 0.906
  Test R²: 0.791
  CV R²: 0.429 ± 0.192
Saved comparison to results/rxn_feature_comparison_hte_each_8_optuna.json

==================================================
ANALYSIS COMPLETE
==================================================
Check the following directories for outputs:
  - plots/: Visualization files
  - results/: Data files and reports
  - models/: Trained model files
