[I 2025-08-20 00:16:32,185] Trial 14 finished with value: 0.7137476191682007 and parameters: {'model_type': 'rf', 'n_estimators': 135, 'max_depth': 15, 'min_samples_split': 3}. Best is trial 13 with value: 0.7138847307273446.
[I 2025-08-20 00:16:32,412] Trial 15 finished with value: 0.7128114225082547 and parameters: {'model_type': 'rf', 'n_estimators': 125, 'max_depth': 13, 'min_samples_split': 3}. Best is trial 13 with value: 0.7138847307273446.
[I 2025-08-20 00:16:32,645] Trial 16 finished with value: 0.708765659494011 and parameters: {'model_type': 'rf', 'n_estimators': 137, 'max_depth': 11, 'min_samples_split': 4}. Best is trial 13 with value: 0.7138847307273446.
[I 2025-08-20 00:16:32,804] Trial 17 finished with value: 0.7161321720973023 and parameters: {'model_type': 'rf', 'n_estimators': 92, 'max_depth': 15, 'min_samples_split': 5}. Best is trial 17 with value: 0.7161321720973023.
[I 2025-08-20 00:16:32,964] Trial 18 finished with value: 0.7166605963233277 and parameters: {'model_type': 'rf', 'n_estimators': 93, 'max_depth': 13, 'min_samples_split': 5}. Best is trial 18 with value: 0.7166605963233277.
[I 2025-08-20 00:16:33,514] Trial 19 finished with value: 0.6176489649597481 and parameters: {'model_type': 'xgb', 'n_estimators': 92, 'max_depth': 9, 'learning_rate': 0.2852738779377062}. Best is trial 18 with value: 0.7166605963233277.
[I 2025-08-20 00:16:33,638] Trial 20 finished with value: 0.7082419261214438 and parameters: {'model_type': 'rf', 'n_estimators': 68, 'max_depth': 13, 'min_samples_split': 6}. Best is trial 18 with value: 0.7166605963233277.
[I 2025-08-20 00:16:33,812] Trial 21 finished with value: 0.7125241675458097 and parameters: {'model_type': 'rf', 'n_estimators': 99, 'max_depth': 15, 'min_samples_split': 5}. Best is trial 18 with value: 0.7166605963233277.
[I 2025-08-20 00:16:33,945] Trial 22 finished with value: 0.7160413478956206 and parameters: {'model_type': 'rf', 'n_estimators': 75, 'max_depth': 13, 'min_samples_split': 5}. Best is trial 18 with value: 0.7166605963233277.
[I 2025-08-20 00:16:34,074] Trial 23 finished with value: 0.7073742743535865 and parameters: {'model_type': 'rf', 'n_estimators': 75, 'max_depth': 12, 'min_samples_split': 6}. Best is trial 18 with value: 0.7166605963233277.
[I 2025-08-20 00:16:34,255] Trial 24 finished with value: 0.7094911329930815 and parameters: {'model_type': 'rf', 'n_estimators': 106, 'max_depth': 13, 'min_samples_split': 5}. Best is trial 18 with value: 0.7166605963233277.
[I 2025-08-20 00:16:34,392] Trial 25 finished with value: 0.707995610406374 and parameters: {'model_type': 'rf', 'n_estimators': 80, 'max_depth': 11, 'min_samples_split': 5}. Best is trial 18 with value: 0.7166605963233277.
[I 2025-08-20 00:16:34,493] Trial 26 finished with value: 0.7062685955596786 and parameters: {'model_type': 'rf', 'n_estimators': 60, 'max_depth': 14, 'min_samples_split': 8}. Best is trial 18 with value: 0.7166605963233277.
[I 2025-08-20 00:16:34,502] Trial 27 finished with value: 0.45348790040729514 and parameters: {'model_type': 'bayesian_ridge', 'alpha_1': 0.0009041736286451019, 'alpha_2': 0.00010895654814510646, 'lambda_1': 0.0008791596540512393, 'lambda_2': 2.6698894543837517e-05}. Best is trial 18 with value: 0.7166605963233277.
[I 2025-08-20 00:16:35,173] Trial 28 finished with value: 0.6168278843122149 and parameters: {'model_type': 'xgb', 'n_estimators': 111, 'max_depth': 9, 'learning_rate': 0.1016553382099277}. Best is trial 18 with value: 0.7166605963233277.
[I 2025-08-20 00:16:35,325] Trial 29 finished with value: 0.708624163571225 and parameters: {'model_type': 'rf', 'n_estimators': 82, 'max_depth': 12, 'min_samples_split': 4}. Best is trial 18 with value: 0.7166605963233277.
[I 2025-08-20 00:16:35,437] Trial 30 finished with value: 0.710631929212405 and parameters: {'model_type': 'rf', 'n_estimators': 64, 'max_depth': 14, 'min_samples_split': 7}. Best is trial 18 with value: 0.7166605963233277.
[I 2025-08-20 00:16:35,688] Trial 31 finished with value: 0.7133480774877602 and parameters: {'model_type': 'rf', 'n_estimators': 143, 'max_depth': 15, 'min_samples_split': 4}. Best is trial 18 with value: 0.7166605963233277.
[I 2025-08-20 00:16:35,899] Trial 32 finished with value: 0.7080827053667846 and parameters: {'model_type': 'rf', 'n_estimators': 122, 'max_depth': 14, 'min_samples_split': 5}. Best is trial 18 with value: 0.7166605963233277.
[I 2025-08-20 00:16:36,072] Trial 33 finished with value: 0.7100040872471489 and parameters: {'model_type': 'rf', 'n_estimators': 98, 'max_depth': 13, 'min_samples_split': 4}. Best is trial 18 with value: 0.7166605963233277.
[I 2025-08-20 00:16:36,197] Trial 34 finished with value: 0.7065144624419482 and parameters: {'model_type': 'rf', 'n_estimators': 72, 'max_depth': 14, 'min_samples_split': 6}. Best is trial 18 with value: 0.7166605963233277.
[I 2025-08-20 00:16:36,206] Trial 35 finished with value: 0.453489764402327 and parameters: {'model_type': 'bayesian_ridge', 'alpha_1': 0.0008024015275617945, 'alpha_2': 9.020564400730137e-06, 'lambda_1': 5.927798849883297e-05, 'lambda_2': 0.0001210643865885454}. Best is trial 18 with value: 0.7166605963233277.
[I 2025-08-20 00:16:36,355] Trial 36 finished with value: 0.7108323113573288 and parameters: {'model_type': 'lgbm', 'n_estimators': 83, 'max_depth': 9, 'learning_rate': 0.11230410197469114}. Best is trial 18 with value: 0.7166605963233277.
[I 2025-08-20 00:16:36,848] Trial 37 finished with value: 0.6485831531923215 and parameters: {'model_type': 'xgb', 'n_estimators': 148, 'max_depth': 7, 'learning_rate': 0.29661370439174317}. Best is trial 18 with value: 0.7166605963233277.
[I 2025-08-20 00:16:36,950] Trial 38 finished with value: 0.7194183023053815 and parameters: {'model_type': 'lgbm', 'n_estimators': 180, 'max_depth': 3, 'learning_rate': 0.09445116690560085}. Best is trial 38 with value: 0.7194183023053815.
[I 2025-08-20 00:16:37,045] Trial 39 finished with value: 0.7128089384711089 and parameters: {'model_type': 'lgbm', 'n_estimators': 174, 'max_depth': 3, 'learning_rate': 0.09121931670245172}. Best is trial 38 with value: 0.7194183023053815.
[I 2025-08-20 00:16:37,260] Trial 40 finished with value: 0.6964927357321578 and parameters: {'model_type': 'lgbm', 'n_estimators': 182, 'max_depth': 6, 'learning_rate': 0.16017093557458867}. Best is trial 38 with value: 0.7194183023053815.
[I 2025-08-20 00:16:37,448] Trial 41 finished with value: 0.7088550910368137 and parameters: {'model_type': 'lgbm', 'n_estimators': 187, 'max_depth': 5, 'learning_rate': 0.07179029463907553}. Best is trial 38 with value: 0.7194183023053815.
[I 2025-08-20 00:16:37,537] Trial 42 finished with value: 0.7205698271281984 and parameters: {'model_type': 'lgbm', 'n_estimators': 160, 'max_depth': 3, 'learning_rate': 0.13730461022165044}. Best is trial 42 with value: 0.7205698271281984.
[I 2025-08-20 00:16:37,630] Trial 43 finished with value: 0.724011426135772 and parameters: {'model_type': 'lgbm', 'n_estimators': 169, 'max_depth': 3, 'learning_rate': 0.1439521970130465}. Best is trial 43 with value: 0.724011426135772.
[I 2025-08-20 00:16:37,722] Trial 44 finished with value: 0.7248559683720375 and parameters: {'model_type': 'lgbm', 'n_estimators': 163, 'max_depth': 3, 'learning_rate': 0.14003328939065696}. Best is trial 44 with value: 0.7248559683720375.
[I 2025-08-20 00:16:37,814] Trial 45 finished with value: 0.7156388363508679 and parameters: {'model_type': 'lgbm', 'n_estimators': 162, 'max_depth': 3, 'learning_rate': 0.13791825416353043}. Best is trial 44 with value: 0.7248559683720375.
[I 2025-08-20 00:16:37,942] Trial 46 finished with value: 0.727754030847632 and parameters: {'model_type': 'lgbm', 'n_estimators': 169, 'max_depth': 4, 'learning_rate': 0.13701662302552878}. Best is trial 46 with value: 0.727754030847632.
[I 2025-08-20 00:16:38,074] Trial 47 finished with value: 0.7233180379674394 and parameters: {'model_type': 'lgbm', 'n_estimators': 172, 'max_depth': 4, 'learning_rate': 0.1391364055798588}. Best is trial 46 with value: 0.727754030847632.
[I 2025-08-20 00:16:38,193] Trial 48 finished with value: 0.721625537544905 and parameters: {'model_type': 'lgbm', 'n_estimators': 152, 'max_depth': 4, 'learning_rate': 0.1404871992429702}. Best is trial 46 with value: 0.727754030847632.
[I 2025-08-20 00:16:38,323] Trial 49 finished with value: 0.7180548710287682 and parameters: {'model_type': 'lgbm', 'n_estimators': 169, 'max_depth': 4, 'learning_rate': 0.18565858861895504}. Best is trial 46 with value: 0.727754030847632.
Regression Results:
  Train R²: 0.925
  Test R²: 0.728
  CV R²: 0.544 ± 0.223
Saved comparison to results/rxn_feature_comparison_hte_each_8_optuna.json

==================================================
ANALYSIS COMPLETE
==================================================
Check the following directories for outputs:
  - plots/: Visualization files
  - results/: Data files and reports
  - models/: Trained model files
