[I 2025-08-20 00:15:29,305] Trial 15 finished with value: 0.3947538050795556 and parameters: {'model_type': 'bayesian_ridge', 'alpha_1': 1.6696242397522374e-05, 'alpha_2': 0.0009318860484150491, 'lambda_1': 8.455312539838071e-06, 'lambda_2': 0.0009353005962317349}. Best is trial 8 with value: 0.7366436886256051.
[I 2025-08-20 00:15:29,446] Trial 16 finished with value: 0.7266179192484844 and parameters: {'model_type': 'lgbm', 'n_estimators': 147, 'max_depth': 6, 'learning_rate': 0.1648120350769578}. Best is trial 8 with value: 0.7366436886256051.
[I 2025-08-20 00:15:29,504] Trial 17 finished with value: 0.7306630632653405 and parameters: {'model_type': 'lgbm', 'n_estimators': 108, 'max_depth': 3, 'learning_rate': 0.10039421659994861}. Best is trial 8 with value: 0.7366436886256051.
[I 2025-08-20 00:15:29,538] Trial 18 finished with value: 0.7216906863082305 and parameters: {'model_type': 'lgbm', 'n_estimators': 51, 'max_depth': 3, 'learning_rate': 0.16695823305014354}. Best is trial 8 with value: 0.7366436886256051.
[I 2025-08-20 00:15:29,807] Trial 19 finished with value: 0.7188773736995707 and parameters: {'model_type': 'xgb', 'n_estimators': 102, 'max_depth': 4, 'learning_rate': 0.0646685377162659}. Best is trial 8 with value: 0.7366436886256051.
[I 2025-08-20 00:15:29,818] Trial 20 finished with value: 0.3947579162774022 and parameters: {'model_type': 'bayesian_ridge', 'alpha_1': 0.00019605316479876178, 'alpha_2': 0.0007915264109061922, 'lambda_1': 0.0009947932364870538, 'lambda_2': 2.673377744755905e-05}. Best is trial 8 with value: 0.7366436886256051.
[I 2025-08-20 00:15:29,915] Trial 21 finished with value: 0.7255685637669111 and parameters: {'model_type': 'lgbm', 'n_estimators': 131, 'max_depth': 4, 'learning_rate': 0.11274528257781817}. Best is trial 8 with value: 0.7366436886256051.
[I 2025-08-20 00:15:29,977] Trial 22 finished with value: 0.7302409268559957 and parameters: {'model_type': 'lgbm', 'n_estimators': 112, 'max_depth': 3, 'learning_rate': 0.08599068668423715}. Best is trial 8 with value: 0.7366436886256051.
[I 2025-08-20 00:15:30,094] Trial 23 finished with value: 0.727595849449415 and parameters: {'model_type': 'lgbm', 'n_estimators': 132, 'max_depth': 5, 'learning_rate': 0.14098708062419732}. Best is trial 8 with value: 0.7366436886256051.
[I 2025-08-20 00:15:30,238] Trial 24 finished with value: 0.5455614049396569 and parameters: {'model_type': 'lgbm', 'n_estimators': 98, 'max_depth': 6, 'learning_rate': 0.010256842587801976}. Best is trial 8 with value: 0.7366436886256051.
[I 2025-08-20 00:15:30,354] Trial 25 finished with value: 0.7256749513801227 and parameters: {'model_type': 'lgbm', 'n_estimators': 165, 'max_depth': 4, 'learning_rate': 0.14562081450412603}. Best is trial 8 with value: 0.7366436886256051.
[I 2025-08-20 00:15:30,421] Trial 26 finished with value: 0.7212212032596015 and parameters: {'model_type': 'lgbm', 'n_estimators': 117, 'max_depth': 3, 'learning_rate': 0.07994092317960602}. Best is trial 8 with value: 0.7366436886256051.
[I 2025-08-20 00:15:30,540] Trial 27 finished with value: 0.7138006906954454 and parameters: {'model_type': 'lgbm', 'n_estimators': 135, 'max_depth': 5, 'learning_rate': 0.1955996429515613}. Best is trial 8 with value: 0.7366436886256051.
[I 2025-08-20 00:15:30,550] Trial 28 finished with value: 0.3947535476529398 and parameters: {'model_type': 'bayesian_ridge', 'alpha_1': 0.0009392475394868574, 'alpha_2': 3.539750489106629e-05, 'lambda_1': 1.8795095373950164e-05, 'lambda_2': 0.0009945019143403082}. Best is trial 8 with value: 0.7366436886256051.
[I 2025-08-20 00:15:30,894] Trial 29 finished with value: 0.5950103877152547 and parameters: {'model_type': 'xgb', 'n_estimators': 70, 'max_depth': 7, 'learning_rate': 0.1256283415677056}. Best is trial 8 with value: 0.7366436886256051.
[I 2025-08-20 00:15:30,979] Trial 30 finished with value: 0.7294332720722314 and parameters: {'model_type': 'lgbm', 'n_estimators': 93, 'max_depth': 4, 'learning_rate': 0.06273766729412755}. Best is trial 8 with value: 0.7366436886256051.
[I 2025-08-20 00:15:31,043] Trial 31 finished with value: 0.7352215554372707 and parameters: {'model_type': 'lgbm', 'n_estimators': 111, 'max_depth': 3, 'learning_rate': 0.09171388857873417}. Best is trial 8 with value: 0.7366436886256051.
[I 2025-08-20 00:15:31,105] Trial 32 finished with value: 0.7242710782963557 and parameters: {'model_type': 'lgbm', 'n_estimators': 111, 'max_depth': 3, 'learning_rate': 0.09354871329510998}. Best is trial 8 with value: 0.7366436886256051.
[I 2025-08-20 00:15:31,164] Trial 33 finished with value: 0.7414773605465803 and parameters: {'model_type': 'lgbm', 'n_estimators': 104, 'max_depth': 3, 'learning_rate': 0.12669184868497624}. Best is trial 33 with value: 0.7414773605465803.
[I 2025-08-20 00:15:31,331] Trial 34 finished with value: 0.6625252046113186 and parameters: {'model_type': 'rf', 'n_estimators': 104, 'max_depth': 13, 'min_samples_split': 10}. Best is trial 33 with value: 0.7414773605465803.
[I 2025-08-20 00:15:31,383] Trial 35 finished with value: 0.7379798847427053 and parameters: {'model_type': 'lgbm', 'n_estimators': 87, 'max_depth': 3, 'learning_rate': 0.13254094743934383}. Best is trial 33 with value: 0.7414773605465803.
[I 2025-08-20 00:15:31,637] Trial 36 finished with value: 0.6497036891413042 and parameters: {'model_type': 'rf', 'n_estimators': 195, 'max_depth': 6, 'min_samples_split': 7}. Best is trial 33 with value: 0.7414773605465803.
[I 2025-08-20 00:15:31,688] Trial 37 finished with value: 0.7324398626935738 and parameters: {'model_type': 'lgbm', 'n_estimators': 89, 'max_depth': 3, 'learning_rate': 0.18547439075194433}. Best is trial 33 with value: 0.7414773605465803.
[I 2025-08-20 00:15:31,698] Trial 38 finished with value: 0.3947553474536617 and parameters: {'model_type': 'bayesian_ridge', 'alpha_1': 0.0005137867620344483, 'alpha_2': 0.00048627811617223875, 'lambda_1': 0.00042299424130607326, 'lambda_2': 0.0005955881227511338}. Best is trial 33 with value: 0.7414773605465803.
[I 2025-08-20 00:15:31,904] Trial 39 finished with value: 0.720277599745355 and parameters: {'model_type': 'xgb', 'n_estimators': 68, 'max_depth': 4, 'learning_rate': 0.13500321318120337}. Best is trial 33 with value: 0.7414773605465803.
[I 2025-08-20 00:15:32,031] Trial 40 finished with value: 0.65581286915983 and parameters: {'model_type': 'rf', 'n_estimators': 82, 'max_depth': 7, 'min_samples_split': 2}. Best is trial 33 with value: 0.7414773605465803.
[I 2025-08-20 00:15:32,083] Trial 41 finished with value: 0.7280193992852786 and parameters: {'model_type': 'lgbm', 'n_estimators': 87, 'max_depth': 3, 'learning_rate': 0.17061696733947557}. Best is trial 33 with value: 0.7414773605465803.
[I 2025-08-20 00:15:32,134] Trial 42 finished with value: 0.7375527450873002 and parameters: {'model_type': 'lgbm', 'n_estimators': 90, 'max_depth': 3, 'learning_rate': 0.19227918559289503}. Best is trial 33 with value: 0.7414773605465803.
[I 2025-08-20 00:15:32,182] Trial 43 finished with value: 0.7275405034909942 and parameters: {'model_type': 'lgbm', 'n_estimators': 78, 'max_depth': 3, 'learning_rate': 0.2087711331883841}. Best is trial 33 with value: 0.7414773605465803.
[I 2025-08-20 00:15:32,256] Trial 44 finished with value: 0.7326725413570478 and parameters: {'model_type': 'lgbm', 'n_estimators': 98, 'max_depth': 4, 'learning_rate': 0.15486005751503856}. Best is trial 33 with value: 0.7414773605465803.
[I 2025-08-20 00:15:32,302] Trial 45 finished with value: 0.7325874049415231 and parameters: {'model_type': 'lgbm', 'n_estimators': 73, 'max_depth': 3, 'learning_rate': 0.25018331349500145}. Best is trial 33 with value: 0.7414773605465803.
[I 2025-08-20 00:15:32,351] Trial 46 finished with value: 0.7265186012196838 and parameters: {'model_type': 'lgbm', 'n_estimators': 83, 'max_depth': 3, 'learning_rate': 0.29243856825611525}. Best is trial 33 with value: 0.7414773605465803.
[I 2025-08-20 00:15:32,407] Trial 47 finished with value: 0.7365989918325417 and parameters: {'model_type': 'lgbm', 'n_estimators': 61, 'max_depth': 4, 'learning_rate': 0.12628508642313646}. Best is trial 33 with value: 0.7414773605465803.
[I 2025-08-20 00:15:32,473] Trial 48 finished with value: 0.7333366171704976 and parameters: {'model_type': 'lgbm', 'n_estimators': 59, 'max_depth': 5, 'learning_rate': 0.12831684421394826}. Best is trial 33 with value: 0.7414773605465803.
[I 2025-08-20 00:15:32,603] Trial 49 finished with value: 0.7084712878301438 and parameters: {'model_type': 'xgb', 'n_estimators': 62, 'max_depth': 4, 'learning_rate': 0.18500581503011218}. Best is trial 33 with value: 0.7414773605465803.
Regression Results:
  Train R²: 0.861
  Test R²: 0.741
  CV R²: 0.508 ± 0.207
Saved comparison to results/rxn_feature_comparison_hte_each_8_optuna.json

==================================================
ANALYSIS COMPLETE
==================================================
Check the following directories for outputs:
  - plots/: Visualization files
  - results/: Data files and reports
  - models/: Trained model files
