=== ML Measurable HTE Rate Bias Analysis ===

==================================================
Running HTE Prediction Analysis: each with 8 features
==================================================

=== Loading Data ===
Number of HTE rates: 1031
Found 5 hydrogen-dependent features: ['num_Hs', 'BV_Hs_avg', 'Charges_Hs_avg', 'fukui_E_Hs_avg', 'fukui_N_Hs_avg']
Found 2 pKa-dependent features: ['pka_aHs', 'pka_lowest']
Found 26 heteroatom-dependent features: ['BV_main_1', 'Charges_main_atom', 'fukui_E_main_atom', 'fukui_N_main_atom', 'L_main_atom_1', 'L_main_atom_2', 'B1_main_atom_1', 'B1_main_atom_2', 'B5_main_atom_1', 'B5_main_atom_2', 'Charges_secondary_1', 'Charges_secondary_2', 'fukui_N_secondary_1', 'fukui_N_secondary_2', 'Charges_secondary_avg', 'fukui_N_secondary_avg', 'FCS_1', 'FREQS_1', 'FCS_2', 'FREQS_2', 'FCS_avg', 'FREQS_avg', 'BV_Hs_avg', 'Charges_Hs_avg', 'fukui_E_Hs_avg', 'fukui_N_Hs_avg']

Processing num_Hs conditional features...
  18/46 molecules meet condition num_Hs
    num_Hs: 0 -> 0 NA values
    BV_Hs_avg: 28 -> 0 NA values
    Charges_Hs_avg: 28 -> 0 NA values
    fukui_E_Hs_avg: 28 -> 0 NA values
    fukui_N_Hs_avg: 28 -> 0 NA values

Processing pKa_features conditional features...
  18/46 molecules meet condition pKa_features
    Processing pKa feature pka_aHs with special handling...
      Created indicator: has_acidic_H_for_pka_aHs
      Created interaction: pka_aHs_x_has_acidic_H
      Used 50.0 for molecules without acidic H
    pka_aHs: 28 -> 0 NA values
    Processing pKa feature pka_lowest with special handling...
      Created indicator: has_acidic_H_for_pka_lowest
      Created interaction: pka_lowest_x_has_acidic_H
      Used 50.0 for molecules without acidic H
    pka_lowest: 38 -> 0 NA values

Handling remaining NA values...

Encoding categorical features...
  Removed identifier feature: name
  Found categorical feature class with 4 unique values: ['aromatic' 'hetero' 'aliphatic' 'mixture']
    One-hot encoded class -> 4 features: ['class_aliphatic', 'class_aromatic', 'class_hetero', 'class_mixture']
  Removed identifier feature: smiles
  Processed 1 categorical features
  Removed 2 identifier features: ['name', 'smiles']

Creating feature quality indicators...
  Added indicator: has_num_Hs
  Added indicator: has_pKa_features
Preprocessing complete. Shape: (46, 65)
Remaining NA values: 0
Found 1 pKa-dependent features: ['pka_basic']
Warning: num_Hs column not found, cannot properly handle pKa features
Found 15 heteroatom-dependent features: ['BV_main_1', 'Charges_main_atom', 'fukui_E_main_atom', 'fukui_N_main_atom', 'L_main_atom_1', 'B1_main_atom_1', 'B5_main_atom_1', 'Charges_secondary_1', 'fukui_N_secondary_1', 'Charges_secondary_avg', 'fukui_N_secondary_avg', 'FCS_1', 'FREQS_1', 'FCS_avg', 'FREQS_avg']

Handling remaining NA values...
  pka_basic: Filled 1 NA values with median/zero
  smiles: Filled 1 NA values with mode/unknown
  class: Filled 1 NA values with mode/unknown

Encoding categorical features...
  Removed identifier feature: name
  Removed identifier feature: smiles
  Found categorical feature class with 5 unique values: ['1_aliphatic' '1_aromatic' '2_aliphatic' '1_mixture' '2_mixture']
    One-hot encoded class -> 5 features: ['class_1_aliphatic', 'class_1_aromatic', 'class_1_mixture', 'class_2_aliphatic', 'class_2_mixture']
  Processed 1 categorical features
  Removed 2 identifier features: ['name', 'smiles']

Creating feature quality indicators...
Preprocessing complete. Shape: (55, 40)
Remaining NA values: 0
Loaded reaction energy features: 1488 rows, 8 features

=== Selecting Features (selected) ===
Final selected features (8): ['amine_BV_secondary_avg', 'acyl_Charges_secondary_1', 'acyl_pka_aHs_x_has_acidic_H', 'amine_Charges_secondary_1', 'acyl_class_aromatic', 'amine_class_1_mixture', 'acyl_BV_secondary_2', 'amine_pka_basic']
=== Building HTE Prediction Models with 8 features ===
Selected features: ['amine_BV_secondary_avg', 'acyl_Charges_secondary_1', 'acyl_pka_aHs_x_has_acidic_H', 'amine_Charges_secondary_1', 'acyl_class_aromatic', 'amine_class_1_mixture', 'acyl_BV_secondary_2', 'amine_pka_basic']
Valid features: 17
=== Building Regression Model ===
Regression dataset: (1031, 17)
Target range: -1.418 to 4.010


Training data: 619 samples
Test data: 206 samples


SFS (regression) failed, using provided features. Error: n_features_to_select must be < n_features.
Running hyperparameter optimization for regression...
[I 2025-08-20 00:18:56,726] A new study created in memory with name: no-name-0074afcc-fee4-4da3-b725-848c3f49ba72
[I 2025-08-20 00:18:56,789] Trial 0 finished with value: 0.47113018694348063 and parameters: {'model_type': 'bayesian_ridge', 'alpha_1': 0.0005905119737861735, 'alpha_2': 0.000600323655302751, 'lambda_1': 0.0006295474643729826, 'lambda_2': 0.00012490324488852487}. Best is trial 0 with value: 0.47113018694348063.
[I 2025-08-20 00:18:56,795] Trial 1 finished with value: 0.4711305743109292 and parameters: {'model_type': 'bayesian_ridge', 'alpha_1': 0.0002295079083346214, 'alpha_2': 0.0008012913188580194, 'lambda_1': 0.0007579563826568441, 'lambda_2': 0.00024125135587312591}. Best is trial 1 with value: 0.4711305743109292.
[I 2025-08-20 00:18:56,802] Trial 2 finished with value: 0.47113116550946177 and parameters: {'model_type': 'bayesian_ridge', 'alpha_1': 0.0008616405739625386, 'alpha_2': 0.00014578128028907165, 'lambda_1': 0.0008057913800969688, 'lambda_2': 0.00041316774152628524}. Best is trial 2 with value: 0.47113116550946177.
[I 2025-08-20 00:18:56,806] Trial 3 finished with value: 0.4711299030022972 and parameters: {'model_type': 'bayesian_ridge', 'alpha_1': 0.0008990141100664641, 'alpha_2': 0.000977823981648929, 'lambda_1': 0.0006077423498364454, 'lambda_2': 4.251543627511941e-05}. Best is trial 2 with value: 0.47113116550946177.
[I 2025-08-20 00:18:56,809] Trial 4 finished with value: 0.47113215489868265 and parameters: {'model_type': 'bayesian_ridge', 'alpha_1': 0.0008483988914945589, 'alpha_2': 0.0005969926046693527, 'lambda_1': 0.00036660812256349514, 'lambda_2': 0.0006916217033295318}. Best is trial 4 with value: 0.47113215489868265.
[I 2025-08-20 00:18:57,191] Trial 5 finished with value: 0.6540355993578886 and parameters: {'model_type': 'rf', 'n_estimators': 78, 'max_depth': 7, 'min_samples_split': 9}. Best is trial 5 with value: 0.6540355993578886.
[I 2025-08-20 00:28:24,392] Trial 6 finished with value: 0.6522187881612442 and parameters: {'model_type': 'xgb', 'n_estimators': 195, 'max_depth': 9, 'learning_rate': 0.1852474185608657}. Best is trial 5 with value: 0.6540355993578886.
[I 2025-08-20 00:31:50,150] Trial 7 finished with value: 0.6540114215644652 and parameters: {'model_type': 'xgb', 'n_estimators': 61, 'max_depth': 8, 'learning_rate': 0.14451557698793382}. Best is trial 5 with value: 0.6540355993578886.
[I 2025-08-20 00:38:26,440] Trial 8 finished with value: 0.7032323502062358 and parameters: {'model_type': 'lgbm', 'n_estimators': 96, 'max_depth': 7, 'learning_rate': 0.16412511631210264}. Best is trial 8 with value: 0.7032323502062358.
[I 2025-08-20 00:44:16,139] Trial 9 finished with value: 0.6567861618105956 and parameters: {'model_type': 'xgb', 'n_estimators': 100, 'max_depth': 8, 'learning_rate': 0.1913456477332154}. Best is trial 8 with value: 0.7032323502062358.
[I 2025-08-20 00:47:43,269] Trial 10 finished with value: 0.6891056150962285 and parameters: {'model_type': 'lgbm', 'n_estimators': 144, 'max_depth': 3, 'learning_rate': 0.04978547171745655}. Best is trial 8 with value: 0.7032323502062358.
