=== ML Measurable HTE Rate Bias Analysis ===

==================================================
Running HTE Prediction Analysis: each with 8 features
==================================================

=== Loading Data ===
Number of HTE rates: 1031
Found 5 hydrogen-dependent features: ['num_Hs', 'BV_Hs_avg', 'Charges_Hs_avg', 'fukui_E_Hs_avg', 'fukui_N_Hs_avg']
Found 2 pKa-dependent features: ['pka_aHs', 'pka_lowest']
Found 26 heteroatom-dependent features: ['BV_main_1', 'Charges_main_atom', 'fukui_E_main_atom', 'fukui_N_main_atom', 'L_main_atom_1', 'L_main_atom_2', 'B1_main_atom_1', 'B1_main_atom_2', 'B5_main_atom_1', 'B5_main_atom_2', 'Charges_secondary_1', 'Charges_secondary_2', 'fukui_N_secondary_1', 'fukui_N_secondary_2', 'Charges_secondary_avg', 'fukui_N_secondary_avg', 'FCS_1', 'FREQS_1', 'FCS_2', 'FREQS_2', 'FCS_avg', 'FREQS_avg', 'BV_Hs_avg', 'Charges_Hs_avg', 'fukui_E_Hs_avg', 'fukui_N_Hs_avg']

Processing num_Hs conditional features...
  18/46 molecules meet condition num_Hs
    num_Hs: 0 -> 0 NA values
    BV_Hs_avg: 28 -> 0 NA values
    Charges_Hs_avg: 28 -> 0 NA values
    fukui_E_Hs_avg: 28 -> 0 NA values
    fukui_N_Hs_avg: 28 -> 0 NA values

Processing pKa_features conditional features...
  18/46 molecules meet condition pKa_features
    Processing pKa feature pka_aHs with special handling...
      Created indicator: has_acidic_H_for_pka_aHs
      Created interaction: pka_aHs_x_has_acidic_H
      Used 50.0 for molecules without acidic H
    pka_aHs: 28 -> 0 NA values
    Processing pKa feature pka_lowest with special handling...
      Created indicator: has_acidic_H_for_pka_lowest
      Created interaction: pka_lowest_x_has_acidic_H
      Used 50.0 for molecules without acidic H
    pka_lowest: 38 -> 0 NA values

Handling remaining NA values...

Encoding categorical features...
  Removed identifier feature: name
  Found categorical feature class with 4 unique values: ['aromatic' 'hetero' 'aliphatic' 'mixture']
    One-hot encoded class -> 4 features: ['class_aliphatic', 'class_aromatic', 'class_hetero', 'class_mixture']
  Removed identifier feature: smiles
  Processed 1 categorical features
  Removed 2 identifier features: ['name', 'smiles']

Creating feature quality indicators...
  Added indicator: has_num_Hs
  Added indicator: has_pKa_features
Preprocessing complete. Shape: (46, 65)
Remaining NA values: 0
Found 1 pKa-dependent features: ['pka_basic']
Warning: num_Hs column not found, cannot properly handle pKa features
Found 15 heteroatom-dependent features: ['BV_main_1', 'Charges_main_atom', 'fukui_E_main_atom', 'fukui_N_main_atom', 'L_main_atom_1', 'B1_main_atom_1', 'B5_main_atom_1', 'Charges_secondary_1', 'fukui_N_secondary_1', 'Charges_secondary_avg', 'fukui_N_secondary_avg', 'FCS_1', 'FREQS_1', 'FCS_avg', 'FREQS_avg']

Handling remaining NA values...
  pka_basic: Filled 1 NA values with median/zero
  smiles: Filled 1 NA values with mode/unknown
  class: Filled 1 NA values with mode/unknown

Encoding categorical features...
  Removed identifier feature: name
  Removed identifier feature: smiles
  Found categorical feature class with 5 unique values: ['1_aliphatic' '1_aromatic' '2_aliphatic' '1_mixture' '2_mixture']
    One-hot encoded class -> 5 features: ['class_1_aliphatic', 'class_1_aromatic', 'class_1_mixture', 'class_2_aliphatic', 'class_2_mixture']
  Processed 1 categorical features
  Removed 2 identifier features: ['name', 'smiles']

Creating feature quality indicators...
Preprocessing complete. Shape: (55, 40)
Remaining NA values: 0
Loaded reaction energy features: 1488 rows, 8 features

=== Selecting Features (selected) ===
Final selected features (8): ['acyl_class_aromatic', 'amine_BV_secondary_avg', 'acyl_BV_secondary_2', 'acyl_Charges_secondary_1', 'amine_pka_basic', 'acyl_pka_aHs_x_has_acidic_H', 'amine_class_1_mixture', 'amine_Charges_secondary_1']
=== Building HTE Prediction Models with 8 features ===
Selected features: ['acyl_class_aromatic', 'amine_BV_secondary_avg', 'acyl_BV_secondary_2', 'acyl_Charges_secondary_1', 'amine_pka_basic', 'acyl_pka_aHs_x_has_acidic_H', 'amine_class_1_mixture', 'amine_Charges_secondary_1']
Valid features: 17
=== Building Regression Model ===
Regression dataset: (1031, 17)
Target range: -1.418 to 4.010


Training data: 619 samples
Test data: 206 samples


SFS (regression) failed, using provided features. Error: n_features_to_select must be < n_features.
Running hyperparameter optimization for regression...
[I 2025-08-20 00:18:56,863] A new study created in memory with name: no-name-55ff2859-4d69-43bd-b450-a85aa70f9e1c
[I 2025-08-20 00:18:57,306] Trial 0 finished with value: 0.7115119506943584 and parameters: {'model_type': 'rf', 'n_estimators': 106, 'max_depth': 13, 'min_samples_split': 5}. Best is trial 0 with value: 0.7115119506943584.
[I 2025-08-20 00:18:57,331] Trial 1 finished with value: 0.5037834786442986 and parameters: {'model_type': 'bayesian_ridge', 'alpha_1': 0.0006926872960547871, 'alpha_2': 0.0007257580028058248, 'lambda_1': 0.00041341182308276777, 'lambda_2': 0.000312173307910058}. Best is trial 0 with value: 0.7115119506943584.
[I 2025-08-20 00:25:57,901] Trial 2 finished with value: 0.7056657753304993 and parameters: {'model_type': 'xgb', 'n_estimators': 119, 'max_depth': 9, 'learning_rate': 0.23235121259977506}. Best is trial 0 with value: 0.7115119506943584.
[I 2025-08-20 00:31:32,679] Trial 3 finished with value: 0.7276417906518202 and parameters: {'model_type': 'xgb', 'n_estimators': 172, 'max_depth': 4, 'learning_rate': 0.2242225497750885}. Best is trial 3 with value: 0.7276417906518202.
[I 2025-08-20 00:38:49,147] Trial 4 finished with value: 0.6998009857652668 and parameters: {'model_type': 'xgb', 'n_estimators': 194, 'max_depth': 10, 'learning_rate': 0.17104943692953367}. Best is trial 3 with value: 0.7276417906518202.
[I 2025-08-20 00:41:03,351] Trial 5 finished with value: 0.7119707509079867 and parameters: {'model_type': 'xgb', 'n_estimators': 52, 'max_depth': 6, 'learning_rate': 0.061340713974353624}. Best is trial 3 with value: 0.7276417906518202.
[I 2025-08-20 00:41:03,570] Trial 6 finished with value: 0.5857270568858493 and parameters: {'model_type': 'rf', 'n_estimators': 67, 'max_depth': 4, 'min_samples_split': 10}. Best is trial 3 with value: 0.7276417906518202.
[I 2025-08-20 00:46:57,653] Trial 7 finished with value: 0.7040984397671848 and parameters: {'model_type': 'xgb', 'n_estimators': 141, 'max_depth': 8, 'learning_rate': 0.1977979968831557}. Best is trial 3 with value: 0.7276417906518202.
[I 2025-08-20 00:49:16,102] Trial 8 finished with value: 0.7280652052388268 and parameters: {'model_type': 'xgb', 'n_estimators': 110, 'max_depth': 3, 'learning_rate': 0.16980080599983416}. Best is trial 8 with value: 0.7280652052388268.
