=== ML Measurable HTE Rate Bias Analysis ===

==================================================
Running HTE Prediction Analysis: each with 8 features
==================================================

=== Loading Data ===
Number of HTE rates: 1031
Found 5 hydrogen-dependent features: ['num_Hs', 'BV_Hs_avg', 'Charges_Hs_avg', 'fukui_E_Hs_avg', 'fukui_N_Hs_avg']
Found 2 pKa-dependent features: ['pka_aHs', 'pka_lowest']
Found 26 heteroatom-dependent features: ['BV_main_1', 'Charges_main_atom', 'fukui_E_main_atom', 'fukui_N_main_atom', 'L_main_atom_1', 'L_main_atom_2', 'B1_main_atom_1', 'B1_main_atom_2', 'B5_main_atom_1', 'B5_main_atom_2', 'Charges_secondary_1', 'Charges_secondary_2', 'fukui_N_secondary_1', 'fukui_N_secondary_2', 'Charges_secondary_avg', 'fukui_N_secondary_avg', 'FCS_1', 'FREQS_1', 'FCS_2', 'FREQS_2', 'FCS_avg', 'FREQS_avg', 'BV_Hs_avg', 'Charges_Hs_avg', 'fukui_E_Hs_avg', 'fukui_N_Hs_avg']

Processing num_Hs conditional features...
  18/46 molecules meet condition num_Hs
    num_Hs: 0 -> 0 NA values
    BV_Hs_avg: 28 -> 0 NA values
    Charges_Hs_avg: 28 -> 0 NA values
    fukui_E_Hs_avg: 28 -> 0 NA values
    fukui_N_Hs_avg: 28 -> 0 NA values

Processing pKa_features conditional features...
  18/46 molecules meet condition pKa_features
    Processing pKa feature pka_aHs with special handling...
      Created indicator: has_acidic_H_for_pka_aHs
      Created interaction: pka_aHs_x_has_acidic_H
      Used 50.0 for molecules without acidic H
    pka_aHs: 28 -> 0 NA values
    Processing pKa feature pka_lowest with special handling...
      Created indicator: has_acidic_H_for_pka_lowest
      Created interaction: pka_lowest_x_has_acidic_H
      Used 50.0 for molecules without acidic H
    pka_lowest: 38 -> 0 NA values

Handling remaining NA values...

Encoding categorical features...
  Removed identifier feature: name
  Found categorical feature class with 4 unique values: ['aromatic' 'hetero' 'aliphatic' 'mixture']
    One-hot encoded class -> 4 features: ['class_aliphatic', 'class_aromatic', 'class_hetero', 'class_mixture']
  Removed identifier feature: smiles
  Processed 1 categorical features
  Removed 2 identifier features: ['name', 'smiles']

Creating feature quality indicators...
  Added indicator: has_num_Hs
  Added indicator: has_pKa_features
Preprocessing complete. Shape: (46, 65)
Remaining NA values: 0
Found 1 pKa-dependent features: ['pka_basic']
Warning: num_Hs column not found, cannot properly handle pKa features
Found 15 heteroatom-dependent features: ['BV_main_1', 'Charges_main_atom', 'fukui_E_main_atom', 'fukui_N_main_atom', 'L_main_atom_1', 'B1_main_atom_1', 'B5_main_atom_1', 'Charges_secondary_1', 'fukui_N_secondary_1', 'Charges_secondary_avg', 'fukui_N_secondary_avg', 'FCS_1', 'FREQS_1', 'FCS_avg', 'FREQS_avg']

Handling remaining NA values...
  pka_basic: Filled 1 NA values with median/zero
  smiles: Filled 1 NA values with mode/unknown
  class: Filled 1 NA values with mode/unknown

Encoding categorical features...
  Removed identifier feature: name
  Removed identifier feature: smiles
  Found categorical feature class with 5 unique values: ['1_aliphatic' '1_aromatic' '2_aliphatic' '1_mixture' '2_mixture']
    One-hot encoded class -> 5 features: ['class_1_aliphatic', 'class_1_aromatic', 'class_1_mixture', 'class_2_aliphatic', 'class_2_mixture']
  Processed 1 categorical features
  Removed 2 identifier features: ['name', 'smiles']

Creating feature quality indicators...
Preprocessing complete. Shape: (55, 40)
Remaining NA values: 0
Loaded reaction energy features: 1488 rows, 8 features

=== Selecting Features (selected) ===
Final selected features (8): ['amine_class_1_mixture', 'amine_BV_secondary_avg', 'acyl_BV_secondary_2', 'acyl_Charges_secondary_1', 'amine_pka_basic', 'acyl_pka_aHs_x_has_acidic_H', 'acyl_class_aromatic', 'amine_Charges_secondary_1']
=== Building HTE Prediction Models with 8 features ===
Selected features: ['amine_class_1_mixture', 'amine_BV_secondary_avg', 'acyl_BV_secondary_2', 'acyl_Charges_secondary_1', 'amine_pka_basic', 'acyl_pka_aHs_x_has_acidic_H', 'acyl_class_aromatic', 'amine_Charges_secondary_1']
Valid features: 17
=== Building Regression Model ===
Regression dataset: (1031, 17)
Target range: -1.418 to 4.010


Training data: 619 samples
Test data: 206 samples


SFS (regression) failed, using provided features. Error: n_features_to_select must be < n_features.
Running hyperparameter optimization for regression...
[I 2025-08-20 00:18:56,861] A new study created in memory with name: no-name-157fbcdc-3587-4474-a228-465d32df0f4b
[I 2025-08-20 00:18:56,886] Trial 0 finished with value: 0.5103633907845091 and parameters: {'model_type': 'bayesian_ridge', 'alpha_1': 0.0002882081469319603, 'alpha_2': 0.000653978246818371, 'lambda_1': 0.00026534305781916094, 'lambda_2': 0.00014788855893571628}. Best is trial 0 with value: 0.5103633907845091.
[I 2025-08-20 00:25:47,970] Trial 1 finished with value: 0.6932714921637042 and parameters: {'model_type': 'lgbm', 'n_estimators': 164, 'max_depth': 4, 'learning_rate': 0.2809144990301613}. Best is trial 1 with value: 0.6932714921637042.
[I 2025-08-20 00:25:48,876] Trial 2 finished with value: 0.6910303026520759 and parameters: {'model_type': 'rf', 'n_estimators': 126, 'max_depth': 13, 'min_samples_split': 6}. Best is trial 1 with value: 0.6932714921637042.
[I 2025-08-20 00:25:49,269] Trial 3 finished with value: 0.677546358230299 and parameters: {'model_type': 'rf', 'n_estimators': 53, 'max_depth': 14, 'min_samples_split': 6}. Best is trial 1 with value: 0.6932714921637042.
[I 2025-08-20 00:25:49,339] Trial 4 finished with value: 0.5103683091927622 and parameters: {'model_type': 'bayesian_ridge', 'alpha_1': 0.0007670095953280577, 'alpha_2': 0.0009338722429545101, 'lambda_1': 0.00028489574258888856, 'lambda_2': 0.0005836180009191413}. Best is trial 1 with value: 0.6932714921637042.
[I 2025-08-20 00:29:50,908] Trial 5 finished with value: 0.6745474786944113 and parameters: {'model_type': 'xgb', 'n_estimators': 78, 'max_depth': 6, 'learning_rate': 0.15359610971008095}. Best is trial 1 with value: 0.6932714921637042.
[I 2025-08-20 00:33:36,067] Trial 6 finished with value: 0.7065369946466518 and parameters: {'model_type': 'xgb', 'n_estimators': 179, 'max_depth': 3, 'learning_rate': 0.08498487695614665}. Best is trial 6 with value: 0.7065369946466518.
[I 2025-08-20 00:36:16,379] Trial 7 finished with value: 0.7000686789539291 and parameters: {'model_type': 'xgb', 'n_estimators': 81, 'max_depth': 4, 'learning_rate': 0.21636859653258317}. Best is trial 6 with value: 0.7065369946466518.
[I 2025-08-20 00:36:16,732] Trial 8 finished with value: 0.6709496638903282 and parameters: {'model_type': 'rf', 'n_estimators': 82, 'max_depth': 8, 'min_samples_split': 7}. Best is trial 6 with value: 0.7065369946466518.
[I 2025-08-20 00:36:16,739] Trial 9 finished with value: 0.5103662622783669 and parameters: {'model_type': 'bayesian_ridge', 'alpha_1': 0.0008045679886731397, 'alpha_2': 0.0007987395400448578, 'lambda_1': 0.0005567894806613027, 'lambda_2': 0.0004091278533885663}. Best is trial 6 with value: 0.7065369946466518.
[I 2025-08-20 00:40:54,892] Trial 10 finished with value: 0.6368841861595191 and parameters: {'model_type': 'xgb', 'n_estimators': 197, 'max_depth': 3, 'learning_rate': 0.019364611085328137}. Best is trial 6 with value: 0.7065369946466518.
[I 2025-08-20 00:43:54,420] Trial 11 finished with value: 0.7003156136922988 and parameters: {'model_type': 'xgb', 'n_estimators': 124, 'max_depth': 5, 'learning_rate': 0.12805449715984657}. Best is trial 6 with value: 0.7065369946466518.
[I 2025-08-20 00:48:29,730] Trial 12 finished with value: 0.6745239751555472 and parameters: {'model_type': 'xgb', 'n_estimators': 134, 'max_depth': 6, 'learning_rate': 0.09782574084022262}. Best is trial 6 with value: 0.7065369946466518.
